199145,bharat plaza orange georgette sarees,http://www.yebhi.com/online-shopping/women/dress-materials/sarees/salwar-kameez-set/kurta-kurtis/leggings-and-jeggings.html?affint=women-topmenu,5990,Traditional-Ethnic,salwar-kameez-set,bharat-plaza,http://im6.ybndc.com/upload/199145/ProductRear634814389732533274.jpg,5990,,Women,http://www.yebhi.com/199145/PD/bharat-plaza-orange-georgette-sarees.htm,yebhi.com,Bharat Plaza Orange Georgette - Sarees Buy Online,Bharat Plaza Orange Georgette - Sarees  Best Price Rs 5990.00  EMI Rs 998 for 6 months FREE Shipping In Stock - Delivery in 9-12 Days,None,<div class="product_detail_columns tinyscrl" itemprop="description" style=""><div class="scrollbar" style="width:2px; height:250px; background:#9E9E9E;"><div class="track" style="width:2px;"><div class="thumb" style="width:6px;"><div class="end"> </div></div></div></div><div class="viewport" style=" height:250px; width:252px; font-family:Arial !important;"><div class="overview" style="text-align:justify; display:block;"><div>This saree from <b>Bharat Plaza</b> is sure to give you a diva look. This <b>orange saree is made of georgette.</b> The <b>fine embroidery on the broad border in golden  red and green colour adds to the beauty of the saree. Add this stunning creation to your collection of traditional wear right now.</b><br><br><b>Features</b><ul style="?margin-left&lt;/b">: 20px;?&gt;<li type="?disc?"><b>Brand</b>: Bharat Plaza</li><li type="?disc?"><b>Category</b>:  Traditional and Ethnic Wear</li><li type="?disc?"><b>Type</b>:  Saree with unstitched blouse</li><li type="disc">Fabric: Georgette</li><li type="?disc?"><b>Colour</b>: Orange</li><li type="?disc?"><b>Border</b>: All sides</li><li type="?disc?"><b>Saree Length (in mts.)</b>: 5.4</li><li type="?disc?"><b>Blouse Length (in mts.)</b>:0.80</li></ul><br><b>Wash &amp; Care</b><br>  Wash it with a mild detergent.<br> If washing in a machine  set it on a delicate mode and low temperature cycle.<br> Wash dark colours separately and  use iron at low temperature.<br><br/><b>Note</b>: There may be a slight colour variation in the image from original product. </br></br></br></br></br></br></br></div></div></div> </div>,,16:04:2014,
199146,bharat plaza purple net sarees,http://www.yebhi.com/online-shopping/women/dress-materials/sarees/salwar-kameez-set/kurta-kurtis/leggings-and-jeggings.html?affint=women-topmenu,9550,Traditional-Ethnic,salwar-kameez-set,bharat-plaza,http://im6.ybndc.com/upload/199146/ProductRear634814389858582082.jpg,9550,,Women,http://www.yebhi.com/199146/PD/bharat-plaza-purple-net-sarees.htm,yebhi.com,Bharat Plaza Purple Net - Sarees Buy Online,Bharat Plaza Purple Net - Sarees  Best Price Rs 9550.00  EMI Rs 1592 for 6 months FREE Shipping In Stock - Delivery in 9-12 Days,None,<div class="product_detail_columns tinyscrl" itemprop="description" style=""><div class="scrollbar" style="width:2px; height:250px; background:#9E9E9E;"><div class="track" style="width:2px;"><div class="thumb" style="width:6px;"><div class="end"> </div></div></div></div><div class="viewport" style=" height:250px; width:252px; font-family:Arial !important;"><div class="overview" style="text-align:justify; display:block;"><div>This saree from <b>Bharat Plaza</b> will give you a wonderful look. This <b>jacquard crafted saree is available in pink colour.</b> A fine <b>work of butties all over and embellished borders</b> adorns this ethnic wear. The pallu and border flaunts a delicate stonework  net and sequence. <br><br><b>Features</b><ul style="?margin-left&lt;/b">: 20px;?&gt;<li type="?disc?"><b>Brand</b>: Bharat Plaza</li><li type="?disc?"><b>Category</b>:  Traditional and Ethnic Wear</li><li type="?disc?"><b>Type</b>:  Saree with unstitched blouse</li><li type="disc">Fabric: Jacquard  Net</li><li type="?disc?"><b>Colour</b>: Purple  Green</li><li type="?disc?"><b>Border</b>: All sides</li><li type="?disc?"><b>Saree Length (in mts.)</b>: 5.4</li><li type="?disc?"><b>Blouse Length (in mts.)</b>:0.80</li></ul><br><b>Wash &amp; Care</b><br>  Wash it with a mild detergent.<br> If washing in a machine  set it on a delicate mode and low temperature cycle.<br> Wash dark colours separately and  use iron at low temperature.<br><br/><b>Note</b>: There may be a slight colour variation in the image from original product. </br></br></br></br></br></br></br></div></div></div> </div>,,16:04:2014,
199253,bharat plaza green georgette sarees,http://www.yebhi.com/online-shopping/women/dress-materials/sarees/salwar-kameez-set/kurta-kurtis/leggings-and-jeggings.html?affint=women-topmenu,4580,Traditional-Ethnic,salwar-kameez-set,bharat-plaza,http://im6.ybndc.com/upload/199253/ProductRear634814405167272214.jpg,4580,,Women,http://www.yebhi.com/199253/PD/bharat-plaza-green-georgette-sarees.htm,yebhi.com,Bharat Plaza Green Georgette - Sarees Buy Online,Bharat Plaza Green Georgette - Sarees  Best Price Rs 4580.00  EMI Rs 763 for 6 months FREE Shipping In Stock - Delivery in 9-12 Days,None,<div class="product_detail_columns tinyscrl" itemprop="description" style=""><div class="scrollbar" style="width:2px; height:250px; background:#9E9E9E;"><div class="track" style="width:2px;"><div class="thumb" style="width:6px;"><div class="end"> </div></div></div></div><div class="viewport" style=" height:250px; width:252px; font-family:Arial !important;"><div class="overview" style="text-align:justify; display:block;"><div>This green saree is delicately crafted from <b>georgette.</b> This classy ethnic wear shows <b>intricate display of floral embroidery </b> work all over. The work on the saree makes it a great piece to own . Add this stunning creation from <b>Bharat Plaza</b> to your wardrobe. <br><br><b>Features</b><ul 20px;? style="?margin-left:"><li type="?disc?"><b>Brand:</b> Bharat Plaza</li><li type="?disc?"><b>Category:</b>  Traditional and Ethnic Wear</li><li type="?disc?"><b>Type: </b> Saree with unstitched blouse</li><li type="?disc?"><b>Fabric:</b> Georgette</li><li type="?disc?&lt;b">Colour: Green</li><li type="?disc?"><b>Border: </b>All sides</li><li type="?disc?"><b>Saree Length (in mts.):</b> 5.4</li><li type="?disc?"><b>Blouse Length (in mts.):</b>0.80</li></ul><br><b>Wash &amp; Care</b><br>  Dry Clean Only.<br><br/><b>Note:</b> There may be a slight colour variation in the image from original product.   </br></br></br></br></br></div></div></div> </div>,,16:04:2014,
199295,bharat plaza purple georgette sarees,http://www.yebhi.com/online-shopping/women/dress-materials/sarees/salwar-kameez-set/kurta-kurtis/leggings-and-jeggings.html?affint=women-topmenu,8990,Traditional-Ethnic,salwar-kameez-set,bharat-plaza,http://im6.ybndc.com/upload/199295/ProductRear634814411117618357.jpg,8990,,Women,http://www.yebhi.com/199295/PD/bharat-plaza-purple-georgette-sarees.htm,yebhi.com,Bharat Plaza Purple Georgette - Sarees Buy Online,Bharat Plaza Purple Georgette - Sarees  Best Price Rs 8990.00  EMI Rs 1498 for 6 months FREE Shipping In Stock - Delivery in 9-12 Days,None,<div class="product_detail_columns tinyscrl" itemprop="description" style=""><div class="scrollbar" style="width:2px; height:250px; background:#9E9E9E;"><div class="track" style="width:2px;"><div class="thumb" style="width:6px;"><div class="end"> </div></div></div></div><div class="viewport" style=" height:250px; width:252px; font-family:Arial !important;"><div class="overview" style="text-align:justify; display:block;"><div>Dazzling <b>dark purple coloured georgette</b> saree with trendy work border is prettified with <b>glossy kundan  stones  cutdana  zari  resham embroidered floral motifs and tiny butties all over.</b> This  elegant outfit will make you shine out for your precious moments.  <br><br><b>Features</b><ul style="?margin-left&lt;/b">: 20px;?&gt;<li type="?disc?"><b>Brand</b>: Bharat Plaza</li><li type="?disc?"><b>Category</b>:  Traditional and Ethnic Wear</li><li type="?disc?"><b>Type</b>:  Saree with unstitched blouse</li><li type="?disc?"><b>Fabric</b>: Georgette</li><li type="?disc?"><b>Colour</b>: Purple</li><li type="?disc?"><b>Border</b>: Embroidered</li><li type="?disc?"><b>Saree Length (in mts.)</b>: 5.4</li><li type="?disc?"><b>Blouse Length (in mts.)</b>:0.80</li></ul><br><b>Wash &amp; Care</b><br>  Wash it with a mild detergent.<br> If washing in a machine  set it on a delicate mode and low temperature cycle.<br> Wash dark colours separately and  use iron at low temperature.<br><br><b>Note</b>: There may be a slight colour variation in the image from original product. </br></br></br></br></br></br></br></br></div></div></div> </div>,,16:04:2014,
316181,bharat plaza green chiffon sarees,http://www.yebhi.com/online-shopping/women/dress-materials/sarees/salwar-kameez-set/kurta-kurtis/leggings-and-jeggings.html?affint=women-topmenu,8129,Traditional-Ethnic,salwar-kameez-set,bharat-plaza,http://im6.ybndc.com/upload/316181/ProductRear635068133019648159.jpg,8129,,Women,http://www.yebhi.com/316181/PD/bharat-plaza-green-chiffon-sarees.htm,yebhi.com,Bharat Plaza Green Chiffon - Sarees Buy Online,Bharat Plaza Green Chiffon - Sarees  Best Price Rs 8129.00  EMI Rs 1355 for 6 months FREE Shipping In Stock - Delivery in 9-12 Days,None,<div class="product_detail_columns tinyscrl" itemprop="description" style=""><div class="scrollbar" style="width:2px; height:250px; background:#9E9E9E;"><div class="track" style="width:2px;"><div class="thumb" style="width:6px;"><div class="end"> </div></div></div></div><div class="viewport" style=" height:250px; width:252px; font-family:Arial !important;"><div class="overview" style="text-align:justify; display:block;"><div>This beautiful <b>purple saree in georgette</b> will make you stand out from the crowd. Accented with <b>beautiful sequins work  mukesh and embroidered borders </b> this saree will steal all the glares  wherever you wear it. Redefine elegance and class in this <b>Bharat Plaza</b> saree and complete the look with a pair of danglers.<br/><br/><b>Features</b><ul style="margin-left: 20px;"><li type="disc">Brand: Bharat Plaza</li><li type="disc">Category:  Traditional and Ethnic Wear</li><li type="disc">Type: Sarees</li><li type="disc">Fabric: Georgette</li><li type="disc">Colour: Purple</li><li type="disc">Saree Length (in mts.): 5.4</li><li type="disc">Blouse Length (in mts.): 0.80</li></ul><br/><b>Wash &amp; Care</b><br>Wash it with a mild detergent.<br> If washing in a machine  set it on a delicate mode and low temperature cycle.<br> Wash dark colours separately and  use iron at low temperature.<br><br/><b>Note:</b> There may be a slight colour variation in the image from original product.   </br></br></br></br></div></div></div> </div>,,16:04:2014,
199126,bharat plaza pink georgette sarees,http://www.yebhi.com/online-shopping/women/dress-materials/sarees/salwar-kameez-set/kurta-kurtis/leggings-and-jeggings.html?affint=women-topmenu,4455,Traditional-Ethnic,salwar-kameez-set,bharat-plaza,http://im6.ybndc.com/upload/199126/ProductRear634814387008443812.jpg,4455,,Women,http://www.yebhi.com/199126/PD/bharat-plaza-pink-georgette-sarees.htm,yebhi.com,Bharat Plaza Pink Georgette - Sarees Buy Online,Bharat Plaza Pink Georgette - Sarees  Best Price Rs 4455.00  EMI Rs 743 for 6 months FREE Shipping In Stock - Delivery in 9-12 Days,None,<div class="product_detail_columns tinyscrl" itemprop="description" style=""><div class="scrollbar" style="width:2px; height:250px; background:#9E9E9E;"><div class="track" style="width:2px;"><div class="thumb" style="width:6px;"><div class="end"> </div></div></div></div><div class="viewport" style=" height:250px; width:252px; font-family:Arial !important;"><div class="overview" style="text-align:justify; display:block;"><div>Adorn your ethnic wardrobe with the classic collection of Bharat Plaza Sarees and spread your charm all around. Eye-catching magenta coloured georgette saree with enrapturing border design and entirely scattered butties  motifs having glittering kundan  cutdana  zari and resham embroidery work are increasing its beauty with charm. Eye-catching outfit will add a regal touch to your personality.<br><br><b>  SPECIAL INFO :</b><br>Delivery within 14 - 21 days<br>This is a custom-made saree.<br><br><b>Colour</b> : Magenta<br><b>Material</b> : Georgette<br><b>Occasion</b> : Party Wear  Festival<br><b>Size</b> : 6.3 meter with un-stitched blouse piece<br><br><b>  WASH &amp; CARE :</b><br> Dry Clean<br><br>Buy Bharat Plaza women sarees online in India from Yebhi which is one of the leading online shopping portals in India. While shopping at Yebhi  you can also avail the benefits of various other discounted deals  offers  supersavers apart from free shipping and prompt delivery. Get ready to experience value for money shopping only at Yebhi.com! </br></br></br></br></br></br></br></br></br></br></br></br></br></br></div></div></div> </div>,,16:04:2014,
199103,bharat plaza blue georgette sarees,http://www.yebhi.com/online-shopping/women/dress-materials/sarees/salwar-kameez-set/kurta-kurtis/leggings-and-jeggings.html?affint=women-topmenu,8959,Traditional-Ethnic,salwar-kameez-set,bharat-plaza,http://im6.ybndc.com/upload/199103/ProductRear634814382521231048.jpg,8959,,Women,http://www.yebhi.com/199103/PD/bharat-plaza-blue-georgette-sarees.htm,yebhi.com,Bharat Plaza Blue Georgette - Sarees Buy Online,Bharat Plaza Blue Georgette - Sarees  Best Price Rs 8959.00  EMI Rs 1493 for 6 months FREE Shipping In Stock - Delivery in 9-12 Days,None,<div class="product_detail_columns tinyscrl" itemprop="description" style=""><div class="scrollbar" style="width:2px; height:250px; background:#9E9E9E;"><div class="track" style="width:2px;"><div class="thumb" style="width:6px;"><div class="end"> </div></div></div></div><div class="viewport" style=" height:250px; width:252px; font-family:Arial !important;"><div class="overview" style="text-align:justify; display:block;"><div>Adorn your ethnic wardrobe with the classic collection of <b>Bharat Plaza</b> and spread your charm all around. Exclusive <b>blue coloured georgette saree with attractive paisley design cutwork border</b> is beautified with shimmering stones  zari  cutdana work representing royalty in itself. Appealing outfit will give you very divine and angelic look on your special day.  <br><br><b>Features</b><ul style="?margin-left&lt;/b">: 20px;?&gt;<li type="?disc?"><b>Brand</b>: Bharat Plaza</li><li type="?disc?"><b>Category</b>:  Traditional and Ethnic Wear</li><li type="?disc?"><b>Type</b>:  Saree with unstitched blouse</li><li type="?disc?"><b>Fabric</b>: Georgette</li><li type="?disc?"><b>Colour</b>: Blue</li><li type="?disc?"><b>Border</b>: Embroidered</li><li type="?disc?"><b>Saree Length (in mts.)</b>: 5.4</li><li type="?disc?"><b>Blouse Length (in mts.)</b>:0.80</li></ul><br><b>Wash &amp; Care</b><br>  Wash it with a mild detergent.<br> If washing in a machine  set it on a delicate mode and low temperature cycle.<br> Wash dark colours separately and  use iron at low temperature.<br><br><b>Note</b>: There may be a slight colour variation in the image from original product. </br></br></br></br></br></br></br></br></div></div></div> </div>,,16:04:2014,
203393,bharat plaza pink chiffon sarees,http://www.yebhi.com/online-shopping/women/dress-materials/sarees/salwar-kameez-set/kurta-kurtis/leggings-and-jeggings.html?affint=women-topmenu,4560,Traditional-Ethnic,salwar-kameez-set,bharat-plaza,http://im6.ybndc.com/upload/203393/ProductRear634818796363167600.jpg,4560,,Women,http://www.yebhi.com/203393/PD/bharat-plaza-pink-chiffon-sarees.htm,yebhi.com,Bharat Plaza Pink Chiffon - Sarees Buy Online,Bharat Plaza Pink Chiffon - Sarees  Best Price Rs 4560.00  EMI Rs 760 for 6 months FREE Shipping in 2 Days,None,<div class="product_detail_columns tinyscrl" itemprop="description" style=""><div class="scrollbar" style="width:2px; height:250px; background:#9E9E9E;"><div class="track" style="width:2px;"><div class="thumb" style="width:6px;"><div class="end"> </div></div></div></div><div class="viewport" style=" height:250px; width:252px; font-family:Arial !important;"><div class="overview" style="text-align:justify; display:block;"><div><table><tr><td><b>Colour</b></td><td>    </td><td>Pink</td></tr><tr><td><b>For</b></td><td>    </td><td>Women</td></tr><tr><td><b>Material</b></td><td>    </td><td>Chiffon</td></tr><tr><td><b>Brands</b></td><td>    </td><td>Bharat Plaza</td></tr><tr><td><b>Departments</b></td><td>    </td><td>Apparels</td></tr><tr><td><b>Category</b></td><td>    </td><td>Sarees</td></tr></table>Length of Saree is 5.5 meter and Length of Blouse is 0.80 meter. Delivery with in 7 to 21 Days  </div></div></div> </div>,,16:04:2014,
199156,bharat plaza pink georgette sarees,http://www.yebhi.com/online-shopping/women/dress-materials/sarees/salwar-kameez-set/kurta-kurtis/leggings-and-jeggings.html?affint=women-topmenu,8980,Traditional-Ethnic,salwar-kameez-set,bharat-plaza,http://im6.ybndc.com/upload/199156/ProductRear634814391342931597.jpg,8980,,Women,http://www.yebhi.com/199156/PD/bharat-plaza-pink-georgette-sarees.htm,yebhi.com,Bharat Plaza Pink Georgette - Sarees Buy Online,Bharat Plaza Pink Georgette - Sarees  Best Price Rs 8980.00  EMI Rs 1497 for 6 months FREE Shipping In Stock - Delivery in 9-12 Days,None,<div class="product_detail_columns tinyscrl" itemprop="description" style=""><div class="scrollbar" style="width:2px; height:250px; background:#9E9E9E;"><div class="track" style="width:2px;"><div class="thumb" style="width:6px;"><div class="end"> </div></div></div></div><div class="viewport" style=" height:250px; width:252px; font-family:Arial !important;"><div class="overview" style="text-align:justify; display:block;"><div>Enjoy <b>tradition and festivties</b> in style with this saree from <b>Bharat Plaza.</b> The <b>pink georgette saree has scattered butties with extensive seqiuns and stonework in contrast silver colour</b> all over. The pallu is magnificently designed with embellishment in floral pattern.<br/><br/><b>Features</b><ul style="margin-left&lt;/b&gt;: 20px;"><li type="disc">Brand: Bharat Plaza</li><li type="disc">Category:  Traditional and Ethnic Wear</li><li type="disc">Type: Sarees</li><li type="disc">Fabric: Georgette</li><li type="disc">Colour: Pink</li><li type="disc">Saree Length (in mts.): 5.4</li><li type="disc">Blouse Length (in mts.): 0.80</li></ul><br/><b>Wash &amp; Care</b><br>Wash it with a mild detergent.<br> If washing in a machine  set it on a delicate mode and low temperature cycle.<br> Wash dark colours separately and  use iron at low temperature.<br><br/><b>Note</b>: There may be a slight colour variation in the image from original product.   </br></br></br></br></div></div></div> </div>,,16:04:2014,
316184,bharat plaza purple chiffon sarees,http://www.yebhi.com/online-shopping/women/dress-materials/sarees/salwar-kameez-set/kurta-kurtis/leggings-and-jeggings.html?affint=women-topmenu,12309,Traditional-Ethnic,salwar-kameez-set,bharat-plaza,http://im6.ybndc.com/upload/316184/ProductRear635068133639596133.jpg,12309,,Women,http://www.yebhi.com/316184/PD/bharat-plaza-purple-chiffon-sarees.htm,yebhi.com,Bharat Plaza Purple Chiffon - Sarees Buy Online,Bharat Plaza Purple Chiffon - Sarees  Best Price Rs 12309.00  EMI Rs 2052 for 6 months FREE Shipping In Stock - Delivery in 9-12 Days,None,<div class="product_detail_columns tinyscrl" itemprop="description" style=""><div class="scrollbar" style="width:2px; height:250px; background:#9E9E9E;"><div class="track" style="width:2px;"><div class="thumb" style="width:6px;"><div class="end"> </div></div></div></div><div class="viewport" style=" height:250px; width:252px; font-family:Arial !important;"><div class="overview" style="text-align:justify; display:block;"><div>This alluring <b>purple coloured saree from Bharat Plaza</b> is embellished with <b>prettifying design border in beige colour and all over scattered butties</b>. This traditional wear is crafted with chiffon and  will surely bring you lots of compliments. <br><br><b>Features</b><ul style="?margin-left&lt;/b">: 20px;?&gt;<li type="?disc?"><b>Brand</b>: Bharat Plaza</li><li type="?disc?"><b>Category</b>:  Traditional and Ethnic Wear</li><li type="?disc?"><b>Type</b>:  Saree with unstitched blouse</li><li type="disc">Fabric: Chiffon</li><li type="?disc?"><b>Colour</b>: Purple</li><li type="?disc?"><b>Border</b>: All sides</li><li type="?disc?"><b>Saree Length (in mts.)</b>: 5.4</li><li type="?disc?"><b>Blouse Length (in mts.)</b>:0.80</li></ul><br><b>Wash &amp; Care</b><br>  Wash it with a mild detergent.<br> If washing in a machine  set it on a delicate mode and low temperature cycle.<br> Wash dark colours separately and  use iron at low temperature.<br><br/><b>Note</b>: There may be a slight colour variation in the image from original product.   </br></br></br></br></br></br></br></div></div></div> </div>,,16:04:2014,
207925,bharat plaza purple net sarees,http://www.yebhi.com/online-shopping/women/dress-materials/sarees/salwar-kameez-set/kurta-kurtis/leggings-and-jeggings.html?affint=women-topmenu,13680,Traditional-Ethnic,salwar-kameez-set,bharat-plaza,http://im6.ybndc.com/upload/207925/ProductRear634822832231568711.jpg,13680,,Women,http://www.yebhi.com/207925/PD/bharat-plaza-purple-net-sarees.htm,yebhi.com,Bharat Plaza Purple Net - Sarees Buy Online,Bharat Plaza Purple Net - Sarees  Best Price Rs 13680.00  EMI Rs 2280 for 6 months FREE Shipping In Stock - Delivery in 9-12 Days,None,<div class="product_detail_columns tinyscrl" itemprop="description" style=""><div class="scrollbar" style="width:2px; height:250px; background:#9E9E9E;"><div class="track" style="width:2px;"><div class="thumb" style="width:6px;"><div class="end"> </div></div></div></div><div class="viewport" style=" height:250px; width:252px; font-family:Arial !important;"><div class="overview" style="text-align:justify; display:block;"><div>This dual coloured saree from <b>Bharat Plaza</b> is sure to give you a beautiful look. This <b>purple and white saree made from net.</b> This ethnic wear is <b>scattered with embroidered butties all over with green velvet border.</b> The border has intricate motifs and embellishments.  <br/><br/><b>Features</b><ul style="margin-left&lt;/b&gt;: 20px;"><li type="disc">Brand: Bharat Plaza</li><li type="disc">Category:  Traditional and Ethnic Wear</li><li type="disc">Type: Sarees</li><li type="disc">Fabric: Net</li><li type="disc">Colour: White  Purple</li><li type="disc">Saree Length (in mts.): 5.4</li><li type="disc">Blouse Length (in mts.): 0.80</li></ul><br/><b>Wash &amp; Care</b><br>Dry Clean Only<br><br/><b>Note</b>: There may be a slight colour variation in the image from original product. </br></br></div></div></div> </div>,,16:04:2014,
199203,bharat plaza red georgette sarees,http://www.yebhi.com/online-shopping/women/dress-materials/sarees/salwar-kameez-set/kurta-kurtis/leggings-and-jeggings.html?affint=women-topmenu,10900,Traditional-Ethnic,salwar-kameez-set,bharat-plaza,http://im6.ybndc.com/upload/199203/ProductRear634814397354742134.jpg,10900,,Women,http://www.yebhi.com/199203/PD/bharat-plaza-red-georgette-sarees.htm,yebhi.com,Bharat Plaza Red Georgette - Sarees Buy Online,Bharat Plaza Red Georgette - Sarees  Best Price Rs 10900.00  EMI Rs 1817 for 6 months FREE Shipping In Stock - Delivery in 9-12 Days,None,<div class="product_detail_columns tinyscrl" itemprop="description" style=""><div class="scrollbar" style="width:2px; height:250px; background:#9E9E9E;"><div class="track" style="width:2px;"><div class="thumb" style="width:6px;"><div class="end"> </div></div></div></div><div class="viewport" style=" height:250px; width:252px; font-family:Arial !important;"><div class="overview" style="text-align:justify; display:block;"><div>Adorn your ethnic wardrobe with the classic collection of Bharat Plaza Sarees and spread your charm all around. Prettifying scalloped border design saree is fashioned on red coloured georgette with gleaming diamantes  cutdana  zari  jardosy and velvet applique work is giving bloom to it. Entirely sprinkled lovely butties and glowing piping edges look fluently awesome. Keep the beautiful remembrance for the lifetime.<br><br><b>  SPECIAL INFO :</b><br>Delivery within 14 - 21 days<br>This is a custom-made saree.<br><br><b>Colour</b> : Red<br><b>Material</b> : Georgette<br><b>Occasion</b> : Festival  Mehndi<br><b>Size</b> : 6.3 meter along with un-stitched blouse piece<br><br><b>  WASH &amp; CARE :</b><br> Dry Clean<br><br>Buy Bharat Plaza women sarees online in India from Yebhi which is one of the leading online shopping portals in India. While shopping at Yebhi  you can also avail the benefits of various other discounted deals  offers  supersavers apart from free shipping and prompt delivery. Get ready to experience value for money shopping only at Yebhi.com! </br></br></br></br></br></br></br></br></br></br></br></br></br></br></div></div></div> </div>,,16:04:2014,
