199292,bharat plaza pink sarees,http://www.yebhi.com/online-shopping/women/dress-materials/sarees/salwar-kameez-set/kurta-kurtis/leggings-and-jeggings.html?affint=women-topmenu,6190,Traditional-Ethnic,salwar-kameez-set,bharat-plaza,http://im6.ybndc.com/upload/199292/ProductRear634814410679567549.jpg,6190,,Women,http://www.yebhi.com/199292/PD/bharat-plaza-pink-sarees.htm,yebhi.com,Bharat Plaza Pink - Sarees Buy Online,Bharat Plaza Pink - Sarees  Best Price Rs 6190.00  EMI Rs 1032 for 6 months FREE Shipping In Stock - Delivery in 9-12 Days,None,<div class="product_detail_columns tinyscrl" itemprop="description" style=""><div class="scrollbar" style="width:2px; height:250px; background:#9E9E9E;"><div class="track" style="width:2px;"><div class="thumb" style="width:6px;"><div class="end"> </div></div></div></div><div class="viewport" style=" height:250px; width:252px; font-family:Arial !important;"><div class="overview" style="text-align:justify; display:block;"><div>Winsome <b>pink coloured jacquard saree with a floral design border</b> that looks exceptionally pretty and graceful. All over scattered motifs  butties having blooming resham embroidery  zari  stones  diamantes  cutdana  beads and velvet applique work will make you look perfect in all those special functions. This creation comes from the house of <b>Bharat Plaza.</b> <br/><br/><b>Features</b><ul style="margin-left: 20px;"><li type="disc">Brand: Bharat Plaza</li><li type="disc">Category:  Traditional and Ethnic Wear</li><li type="disc">Type: Sarees</li><li type="disc">Fabric: Jacquard</li><li type="disc">Colour: Pink</li><li type="disc">Saree Length (in mts.): 5.4</li><li type="disc">Blouse Length (in mts.): 0.80</li></ul><br/><b>Wash &amp; Care</b><br>Dry Clean Only<br><br/><b>Note:</b> There may be a slight colour variation in the image from original product.   </br></br></div></div></div> </div>,,16:04:2014,
199220,bharat plaza blue net sarees,http://www.yebhi.com/online-shopping/women/dress-materials/sarees/salwar-kameez-set/kurta-kurtis/leggings-and-jeggings.html?affint=women-topmenu,12767,Traditional-Ethnic,salwar-kameez-set,bharat-plaza,http://im6.ybndc.com/upload/199220/ProductRear634814399851382138.jpg,12767,,Women,http://www.yebhi.com/199220/PD/bharat-plaza-blue-net-sarees.htm,yebhi.com,Bharat Plaza Blue Net - Sarees Buy Online,Bharat Plaza Blue Net - Sarees  Best Price Rs 12767.00  EMI Rs 2128 for 6 months FREE Shipping In Stock - Delivery in 9-12 Days,None,<div class="product_detail_columns tinyscrl" itemprop="description" style=""><div class="scrollbar" style="width:2px; height:250px; background:#9E9E9E;"><div class="track" style="width:2px;"><div class="thumb" style="width:6px;"><div class="end"> </div></div></div></div><div class="viewport" style=" height:250px; width:252px; font-family:Arial !important;"><div class="overview" style="text-align:justify; display:block;"><div>This saree from Bharat Plaza is sure to enhance your look immensely. This <b>blue</b> ethnic wear is made of <b>net</b> with <b>velvet</b> border. The saree is adorned with <b>floral prints</b> and <b>stonework</b> all over.<b>Features</b><ul style="margin-left: 20px;"><li type="disc">Type: Saree with Unstitched Blouse</li><li type="disc">Fabric: Net</li><li type="disc">Colour: Blue</li><li type="disc">Border: All Sides</li><li type="disc">Detailing: Stonework  Velvet  Gold Prints</li><li type="disc">Suiable for: Party  Reception</li><li type="disc">Length: 6.3 metres with unstitched blouse piece</li><li type="disc">Blouse Colour: Blue</li></ul><b>Wash and Care<br/></b>Dry Clean Only<br><br><b>Note</b><br>There may be a slight colour variation in the image from original product. </br></br></br></div></div></div> </div>,,16:04:2014,
264546,bharat plaza blue georgette sarees,http://www.yebhi.com/online-shopping/women/dress-materials/sarees/salwar-kameez-set/kurta-kurtis/leggings-and-jeggings.html?affint=women-topmenu,8590,Traditional-Ethnic,salwar-kameez-set,bharat-plaza,http://im6.ybndc.com/upload/264546/ProductRear634944664240226000.jpg,8590,,Women,http://www.yebhi.com/264546/PD/bharat-plaza-blue-georgette-sarees.htm,yebhi.com,Bharat Plaza Blue Georgette - Sarees Buy Online,Bharat Plaza Blue Georgette - Sarees  Best Price Rs 8590.00  EMI Rs 1432 for 6 months FREE Shipping In Stock - Delivery in 9-12 Days,None,<div class="product_detail_columns tinyscrl" itemprop="description" style=""><div class="scrollbar" style="width:2px; height:250px; background:#9E9E9E;"><div class="track" style="width:2px;"><div class="thumb" style="width:6px;"><div class="end"> </div></div></div></div><div class="viewport" style=" height:250px; width:252px; font-family:Arial !important;"><div class="overview" style="text-align:justify; display:block;"><div>Buy for yourself this exquisite creation in <b>blue colour</b> and walk elegantly in your traditional look. Beautified with <b>paisley work on it with golden embroidered design on the borders </b> this saree will be a classy addition to your collection. <br/><br/><b>Features</b><ul style="margin-left: 20px;"><li type="disc">Brand: Colors</li><li type="disc">Category:  Traditional and Ethnic Wear</li><li type="disc">Type: Sarees</li><li type="disc">Fabric: Georgette</li><li type="disc">Colour: Blue</li><li type="disc">Saree Length (in mts.): 5.4</li><li type="disc">Blouse Length (in mts.): 0.80</li></ul><br/><b>Wash &amp; Care</b><br>Wash it with a mild detergent.<br> If washing in a machine  set it on a delicate mode and low temperature cycle.<br> Wash dark colours separately and  use iron at low temperature.<br><br/><b>Note:</b> There may be a slight colour variation in the image from original product.   </br></br></br></br></div></div></div> </div>,,16:04:2014,
199219,bharat plaza blue net sarees,http://www.yebhi.com/online-shopping/women/dress-materials/sarees/salwar-kameez-set/kurta-kurtis/leggings-and-jeggings.html?affint=women-topmenu,28775,Traditional-Ethnic,salwar-kameez-set,bharat-plaza,http://im6.ybndc.com/upload/199219/ProductRear634814399721745307.jpg,28775,,Women,http://www.yebhi.com/199219/PD/bharat-plaza-blue-net-sarees.htm,yebhi.com,Bharat Plaza Blue Net - Sarees Buy Online,Bharat Plaza Blue Net - Sarees  Best Price Rs 28775.00  EMI Rs 4796 for 6 months FREE Shipping In Stock - Delivery in 9-12 Days,None,<div class="product_detail_columns tinyscrl" itemprop="description" style=""><div class="scrollbar" style="width:2px; height:250px; background:#9E9E9E;"><div class="track" style="width:2px;"><div class="thumb" style="width:6px;"><div class="end"> </div></div></div></div><div class="viewport" style=" height:250px; width:252px; font-family:Arial !important;"><div class="overview" style="text-align:justify; display:block;"><div>Adorn your ethnic wardrobe with the classic collection of Bharat Plaza Sarees and spread your charm all around. Gleaming navy blue coloured brasso georgette saree with arresting cut work border having sparkling diamantes  cutdana  jardosy  zari and stones work is making the saree more gorgeous. Matching choli will create a unique look. Style to give you the graceful and stunning look.<br><br><b>  SPECIAL INFO :</b><br>Delivery within 14 - 21 days<br>This is a custom-made saree.<br><br><b>Colour</b> : Navy Blue<br><b>Material</b> : Brasso Georgette<br><b>Occasion</b> : Festival  Party Wear<br><b>Size</b> : 6.3 meter along with un-stitched blouse piece<br><br><b>  WASH &amp; CARE :</b><br> Dry Clean<br><br>Buy Bharat Plaza women sarees online in India from Yebhi which is one of the leading online shopping portals in India. While shopping at Yebhi  you can also avail the benefits of various other discounted deals  offers  supersavers apart from free shipping and prompt delivery. Get ready to experience value for money shopping only at Yebhi.com! </br></br></br></br></br></br></br></br></br></br></br></br></br></br></div></div></div> </div>,,16:04:2014,
200136,bharat plaza purple sarees,http://www.yebhi.com/online-shopping/women/dress-materials/sarees/salwar-kameez-set/kurta-kurtis/leggings-and-jeggings.html?affint=women-topmenu,4095,Traditional-Ethnic,salwar-kameez-set,bharat-plaza,http://im6.ybndc.com/upload/200136/ProductRear634815247898246301.jpg,4095,,Women,http://www.yebhi.com/200136/PD/bharat-plaza-purple-sarees.htm,yebhi.com,Bharat Plaza Purple - Sarees Buy Online,Bharat Plaza Purple - Sarees  Best Price Rs 4095.00  EMI Rs 683 for 6 months FREE Shipping in 2 Days,None,<div class="product_detail_columns tinyscrl" itemprop="description" style=""><div class="scrollbar" style="width:2px; height:250px; background:#9E9E9E;"><div class="track" style="width:2px;"><div class="thumb" style="width:6px;"><div class="end"> </div></div></div></div><div class="viewport" style=" height:250px; width:252px; font-family:Arial !important;"><div class="overview" style="text-align:justify; display:block;"><div>Adorn your ethnic wardrobe with the classic collection of Bharat Plaza Sarees and spread your charm all around. Winsome beauty pink color net skirt part and dark purple crepe silk pallu with fancy layered patch border is enriched with gleaming sequins  zari  stones  resham embroidered big floral motifs and sprinkled butties are very well done on it. Exclusive embroidered saree is designed to make you feel- I am the queen.<br><br><b>  SPECIAL INFO :</b><br>Delivery within 14 - 21 days<br>This is a custom-made saree.<br><br><b>Colour</b> : Pink  Purple<br><b>Material</b> : Net  Crepe<br><b>Occasion</b> : Party Wear<br><b>Design</b> : Embroidery<br><b>Size</b> :6.3 meter along with un-stitched blouse piece <br><br><b>  WASH &amp; CARE :</b><br> Dry Clean<br><br>Buy Bharat Plaza women sarees online in India from Yebhi which is one of the leading online shopping portals in India. While shopping at Yebhi  you can also avail the benefits of various other discounted deals  offers  supersavers apart from free shipping and prompt delivery. Get ready to experience value for money shopping only at Yebhi.com! </br></br></br></br></br></br></br></br></br></br></br></br></br></br></br></div></div></div> </div>,,16:04:2014,
199108,bharat plaza purple georgette sarees,http://www.yebhi.com/online-shopping/women/dress-materials/sarees/salwar-kameez-set/kurta-kurtis/leggings-and-jeggings.html?affint=women-topmenu,14950,Traditional-Ethnic,salwar-kameez-set,bharat-plaza,http://im6.ybndc.com/upload/199108/ProductRear634814383183767295.jpg,14950,,Women,http://www.yebhi.com/199108/PD/bharat-plaza-purple-georgette-sarees.htm,yebhi.com,Bharat Plaza Purple Georgette - Sarees Buy Online,Bharat Plaza Purple Georgette - Sarees  Best Price Rs 14950.00  EMI Rs 2492 for 6 months FREE Shipping In Stock - Delivery in 9-12 Days,None,<div class="product_detail_columns tinyscrl" itemprop="description" style=""><div class="scrollbar" style="width:2px; height:250px; background:#9E9E9E;"><div class="track" style="width:2px;"><div class="thumb" style="width:6px;"><div class="end"> </div></div></div></div><div class="viewport" style=" height:250px; width:252px; font-family:Arial !important;"><div class="overview" style="text-align:justify; display:block;"><div>This enchanting <b>dark purple coloured georgette</b> saree comes from the house of <b>Bharat Plaza.</b> With wonderful <b>cutwork border and choli  it is adorned with resham embroidery  cutdana  zari  stones work paisley motifs and tiny butties</b> that highlight the beauty of this creation. <br/><br/><b>Features</b><ul style="margin-left: 20px;"><li type="disc">Brand: Bharat Plaza</li><li type="disc">Category:  Traditional and Ethnic Wear</li><li type="disc">Type: Sarees</li><li type="disc">Colour: Purple</li><li type="disc">Fabric: Georgette</li><li type="disc">Saree Length (in mts.): 5.4</li><li type="disc">Blouse Length (in mts.): 0.80</li></ul><br/><b>Wash &amp; Care</b><br>Wash it with a mild detergent.<br> If washing in a machine  set it on a delicate mode and low temperature cycle.<br> Wash dark colours separately and  use iron at low temperature.<br><br/><b>Note:</b> There may be a slight colour variation in the image from original product.   </br></br></br></br></div></div></div> </div>,,16:04:2014,
316193,bharat plaza blue chiffon sarees,http://www.yebhi.com/online-shopping/women/dress-materials/sarees/salwar-kameez-set/kurta-kurtis/leggings-and-jeggings.html?affint=women-topmenu,4829,Traditional-Ethnic,salwar-kameez-set,bharat-plaza,http://im6.ybndc.com/upload/316193/ProductRear635068136610791179.jpg,4829,,Women,http://www.yebhi.com/316193/PD/bharat-plaza-blue-chiffon-sarees.htm,yebhi.com,Bharat Plaza Blue Chiffon - Sarees Buy Online,Bharat Plaza Blue Chiffon - Sarees  Best Price Rs 4829.00  EMI Rs 805 for 6 months FREE Shipping In Stock - Delivery in 9-12 Days,None,<div class="product_detail_columns tinyscrl" itemprop="description" style=""><div class="scrollbar" style="width:2px; height:250px; background:#9E9E9E;"><div class="track" style="width:2px;"><div class="thumb" style="width:6px;"><div class="end"> </div></div></div></div><div class="viewport" style=" height:250px; width:252px; font-family:Arial !important;"><div class="overview" style="text-align:justify; display:block;"><div>Elegant  fabulous and traditional  this <b>saree from Bharat Plaza</b> is sure to make you the center of attraction. Made from <b>chiffon</b>  this <b>blue </b>ethnic wear flaunts <b>grey embroidered detailing </b>. The border features a purple border with grey embroidery on it.<br><br><b>Features</b><ul style="?margin-left&lt;/b">: 20px;?&gt;<li type="?disc?"><b>Brand</b>: Bharat Plaza</li><li type="?disc?"><b>Category</b>:  Traditional and Ethnic Wear</li><li type="?disc?"><b>Type</b>:  Saree with unstitched blouse</li><li type="?disc?"><b>Fabric</b>: Chiffon</li><li type="?disc?"><b>Colour</b>: Chiffon</li><li type="?disc?"><b>Border</b>: All sides</li><li type="?disc?"><b>Saree Length (in mts.)</b>: 5.4</li><li type="?disc?"><b>Blouse Length (in mts.)</b>:0.80</li></ul><br><b>Wash &amp; Care</b><br>  Wash it with a mild detergent.<br> If washing in a machine  set it on a delicate mode and low temperature cycle.<br> Wash dark colours separately and  use iron at low temperature.<br>.<br><br/><b>Note</b>: There may be a slight colour variation in the image from original product.   </br></br></br></br></br></br></br></br></div></div></div> </div>,,16:04:2014,
316178,bharat plaza red sarees,http://www.yebhi.com/online-shopping/women/dress-materials/sarees/salwar-kameez-set/kurta-kurtis/leggings-and-jeggings.html?affint=women-topmenu,13409,Traditional-Ethnic,salwar-kameez-set,bharat-plaza,http://im6.ybndc.com/upload/316178/ProductRear635068131537326657.jpg,13409,,Women,http://www.yebhi.com/316178/PD/bharat-plaza-red-sarees.htm,yebhi.com,Bharat Plaza Red - Sarees Buy Online,Bharat Plaza Red - Sarees  Best Price Rs 13409.00  EMI Rs 2235 for 6 months FREE Shipping In Stock - Delivery in 9-12 Days,None,<div class="product_detail_columns tinyscrl" itemprop="description" style=""><div class="scrollbar" style="width:2px; height:250px; background:#9E9E9E;"><div class="track" style="width:2px;"><div class="thumb" style="width:6px;"><div class="end"> </div></div></div></div><div class="viewport" style=" height:250px; width:252px; font-family:Arial !important;"><div class="overview" style="text-align:justify; display:block;"><div>Adorn your ethnic wardrobe with the classic collection of <b>Bharat Plaza </b> saree and enhance your feminine charm with grace. This ravishing <b>red coloured lehenga  saree </b>with <b> stylishly  designed  cutwork border beautified with shimmering stones  zari and cutdana work</b>give it a glitzy look. <br/><br/><b>Features</b><ul style="margin-left&lt;/b&gt;: 20px;"><li type="disc">Brand: Bharat Plaza</li><li type="disc">Category:  Traditional and Ethnic Wear</li><li type="disc">Type: Sarees</li><li type="disc">Fabric: Net  Chiffon</li><li type="disc">Colour: Red</li><li type="disc">Saree Length (in mts.): 5.4</li><li type="disc">Blouse Length (in mts.): 0.80</li></ul><br/><b>Wash &amp; Care</b><br>Dry Clean Only.<br><br/><b>Note</b>: There may be a slight colour variation in the image from original product. </br></br></div></div></div> </div>,,16:04:2014,
264552,bharat plaza beige sarees,http://www.yebhi.com/online-shopping/women/dress-materials/sarees/salwar-kameez-set/kurta-kurtis/leggings-and-jeggings.html?affint=women-topmenu,7990,Traditional-Ethnic,salwar-kameez-set,bharat-plaza,http://im6.ybndc.com/upload/264552/ProductRear634944666002090000.jpg,7990,,Women,http://www.yebhi.com/264552/PD/bharat-plaza-beige-sarees.htm,yebhi.com,Bharat Plaza Beige - Sarees Buy Online,Bharat Plaza Beige - Sarees  Best Price Rs 7990.00  EMI Rs 1332 for 6 months FREE Shipping In Stock - Delivery in 9-12 Days,None,<div class="product_detail_columns tinyscrl" itemprop="description" style=""><div class="scrollbar" style="width:2px; height:250px; background:#9E9E9E;"><div class="track" style="width:2px;"><div class="thumb" style="width:6px;"><div class="end"> </div></div></div></div><div class="viewport" style=" height:250px; width:252px; font-family:Arial !important;"><div class="overview" style="text-align:justify; display:block;"><div>This saree in<b> beige colour with silver embroidered designs on the pallu and border </b> will make you look like a diva in your traditional wear. This saree is crafted with <b>brasso</b> and features floral design embroidery on the border and tiny butties scattered all over.<br/><br/><b>Features</b><ul style="margin-left: 20px;"><li type="disc">Brand: Bharat Plaza</li><li type="disc">Category:  Traditional and Ethnic Wear</li><li type="disc">Type: Sarees</li><li type="disc">Fabric: Brasso</li><li type="disc">Colour: Beige</li><li type="disc">Saree Length (in mts.): 5.4</li><li type="disc">Blouse Length (in mts.): 0.80</li></ul><br/><b>Wash &amp; Care</b><br>Wash it with a mild detergent.<br> If washing in a machine  set it on a delicate mode and low temperature cycle.<br> Wash dark colours separately and  use iron at low temperature.<br><br/><b>Note:</b> There may be a slight colour variation in the image from original product. </br></br></br></br></div></div></div> </div>,,16:04:2014,
264553,bharat plaza purple chiffon sarees,http://www.yebhi.com/online-shopping/women/dress-materials/sarees/salwar-kameez-set/kurta-kurtis/leggings-and-jeggings.html?affint=women-topmenu,8190,Traditional-Ethnic,salwar-kameez-set,bharat-plaza,http://im6.ybndc.com/upload/264553/ProductRear634944666191474000.jpg,8190,,Women,http://www.yebhi.com/264553/PD/bharat-plaza-purple-chiffon-sarees.htm,yebhi.com,Bharat Plaza Purple Chiffon - Sarees Buy Online,Bharat Plaza Purple Chiffon - Sarees  Best Price Rs 8190.00  EMI Rs 1365 for 6 months FREE Shipping In Stock - Delivery in 9-12 Days,None,<div class="product_detail_columns tinyscrl" itemprop="description" style=""><div class="scrollbar" style="width:2px; height:250px; background:#9E9E9E;"><div class="track" style="width:2px;"><div class="thumb" style="width:6px;"><div class="end"> </div></div></div></div><div class="viewport" style=" height:250px; width:252px; font-family:Arial !important;"><div class="overview" style="text-align:justify; display:block;"><div>Flaunt your Indian beauty with this <b>purple saree from the house of Bharat Plaza.</b> Crafted delicately with <b>chiffon </b> this saree features a <b>beautifully embroidered pallu and border.</b> The scattered butties all over add to its look.<br/><br/><b>Features</b><ul style="margin-left: 20px;"><li type="disc">Brand: Bharat Plaza</li><li type="disc">Category:  Traditional and Ethnic Wear</li><li type="disc">Type: Sarees</li><li type="disc">Fabric: Chiffon</li><li type="disc">Colour: Purple</li><li type="disc">Saree Length (in mts.): 5.4</li><li type="disc">Blouse Length (in mts.): 0.80</li></ul><br/><b>Wash &amp; Care</b><br>Wash it with a mild detergent.<br> If washing in a machine  set it on a delicate mode and low temperature cycle.<br> Wash dark colours separately and  use iron at low temperature.<br><br/><b>Note:</b> There may be a slight colour variation in the image from original product. </br></br></br></br></div></div></div> </div>,,16:04:2014,
259767,bharat plaza pink georgette sarees,http://www.yebhi.com/online-shopping/women/dress-materials/sarees/salwar-kameez-set/kurta-kurtis/leggings-and-jeggings.html?affint=women-topmenu,5440,Traditional-Ethnic,salwar-kameez-set,bharat-plaza,http://im6.ybndc.com/upload/259767/ProductRear634921342965773808.jpg,5440,,Women,http://www.yebhi.com/259767/PD/bharat-plaza-pink-georgette-sarees.htm,yebhi.com,Bharat Plaza Pink Georgette - Sarees Buy Online,Bharat Plaza Pink Georgette - Sarees  Best Price Rs 5440.00  EMI Rs 907 for 6 months FREE Shipping In Stock - Delivery in 9-12 Days,None,<div class="product_detail_columns tinyscrl" itemprop="description" style=""><div class="scrollbar" style="width:2px; height:250px; background:#9E9E9E;"><div class="track" style="width:2px;"><div class="thumb" style="width:6px;"><div class="end"> </div></div></div></div><div class="viewport" style=" height:250px; width:252px; font-family:Arial !important;"><div class="overview" style="text-align:justify; display:block;"><div>This beautiful <b>pink saree in georgette</b> will make you stand out from the crowd. Accented with <b>beautiful sequins work  mukesh and patch borders </b> this saree will steal all the glares  wherever you wear it. Redefine elegance and class in this <b>Bharat Plaza</b> saree and complete the look with a pair of danglers.<br><br><b>Features</b><ul 20px;? <li bharat li plaza< style="?argin-left:" type="?isc?Brand:"><li and ethnic li traditional type="?isc?Category:" wear<><li blouse< li saree type="?isc?Type:" unstitched with><li georgette< li type="?isc?Fabric:"><li li pink< type="?isc?Colour:"><li all li sides< type="?isc?Border:"><li (in 5.4< length li mts.): type="?isc?Saree"><li (in length li mts.):0.80< type="?isc?Blouse"></li></li></li></li></li></li></li></ul><br><b>Wash &amp; Care</b><br>  Wash it with a mild detergent.<br> If washing in a machine  set it on a delicate mode and low temperature cycle.<br> Wash dark colours separately and  use iron at low temperature.<br><br/><b>Note:</b> There may be a slight colour variation in the image from original product. </br></br></br></br></br></br></br></div></div></div> </div>,,16:04:2014,
199172,bharat plaza green georgette sarees,http://www.yebhi.com/online-shopping/women/dress-materials/sarees/salwar-kameez-set/kurta-kurtis/leggings-and-jeggings.html?affint=women-topmenu,17929,Traditional-Ethnic,salwar-kameez-set,bharat-plaza,http://im6.ybndc.com/upload/199172/ProductRear634814393404796814.jpg,17929,,Women,http://www.yebhi.com/199172/PD/bharat-plaza-green-georgette-sarees.htm,yebhi.com,Bharat Plaza Green Georgette - Sarees Buy Online,Bharat Plaza Green Georgette - Sarees  Best Price Rs 17929.00  EMI Rs 2988 for 6 months FREE Shipping In Stock - Delivery in 9-12 Days,None,<div class="product_detail_columns tinyscrl" itemprop="description" style=""><div class="scrollbar" style="width:2px; height:250px; background:#9E9E9E;"><div class="track" style="width:2px;"><div class="thumb" style="width:6px;"><div class="end"> </div></div></div></div><div class="viewport" style=" height:250px; width:252px; font-family:Arial !important;"><div class="overview" style="text-align:justify; display:block;"><div>Be the epitome of grace with this saree from Bharat Plaza. This <b>net</b> saree  available in <b>red and green</b>  is embedded with <b>butties</b> all over. The ethnic wear features an extravagant showcase of <b>sequencing </b>  <b>embroidery</b> and <b>stonework</b>.<b>Features</b><ul style="margin-left: 20px;"><li type="disc">Type: Saree with Unstitched Blouse</li><li type="disc">Fabric: Net</li><li type="disc">Colour: Red  Green</li><li type="disc">Border: All Sides</li><li type="disc">Detailing: Butties  Sequencing  Stonework</li><li type="disc">Suitable for: Wedding   Reception</li><li type="disc">Length: 6.3 metres with unstitched blouse piece</li><li type="disc">Blouse Colour: Green</li></ul><b>Wash and Care<br/></b>Dry Clean Only<br><br><b>Note</b><br>There may be a slight colour variation in the image from original product. </br></br></br></div></div></div> </div>,,16:04:2014,
