259750,bharat plaza red georgette sarees,http://www.yebhi.com/online-shopping/women/dress-materials/sarees/salwar-kameez-set/kurta-kurtis/leggings-and-jeggings.html?affint=women-topmenu,6330,Traditional-Ethnic,salwar-kameez-set,bharat-plaza,http://im6.ybndc.com/upload/259750/ProductRear634921337693597808.jpg,6330,,Women,http://www.yebhi.com/259750/PD/bharat-plaza-red-georgette-sarees.htm,yebhi.com,Bharat Plaza Red Georgette - Sarees Buy Online,Bharat Plaza Red Georgette - Sarees  Best Price Rs 6330.00  EMI Rs 1055 for 6 months FREE Shipping In Stock - Delivery in 9-12 Days,None,<div class="product_detail_columns tinyscrl" itemprop="description" style=""><div class="scrollbar" style="width:2px; height:250px; background:#9E9E9E;"><div class="track" style="width:2px;"><div class="thumb" style="width:6px;"><div class="end"> </div></div></div></div><div class="viewport" style=" height:250px; width:252px; font-family:Arial !important;"><div class="overview" style="text-align:justify; display:block;"><div>Grace all those social events in this classy saree from the house of <b>Bharat Plaza.</b> In a combination of <b>white and red </b> this saree been adorned with beautiful <b>mukesh work and zig zag designed border and floral embroidered floral pattern</b> on the pallu. <br/><br/><b>Features</b><ul style="margin-left: 20px;"><li type="disc">Brand: Bharat Plaza</li><li type="disc">Category:  Traditional and Ethnic Wear</li><li type="disc">Type: Sarees</li><li type="disc">Fabric: Georgette</li><li type="disc">Colour: White  Red</li><li type="disc">Saree Length (in mts.): 5.4</li><li type="disc">Blouse Length (in mts.): 0.80</li></ul><br/><b>Wash &amp; Care</b><br>Wash it with a mild detergent.<br> If washing in a machine  set it on a delicate mode and low temperature cycle.<br> Wash dark colours separately and  use iron at low temperature.<br><br/><b>Note:</b> There may be a slight colour variation in the image from original product.   </br></br></br></br></div></div></div> </div>,,16:04:2014,
199160,bharat plaza purple georgette sarees,http://www.yebhi.com/online-shopping/women/dress-materials/sarees/salwar-kameez-set/kurta-kurtis/leggings-and-jeggings.html?affint=women-topmenu,11489,Traditional-Ethnic,salwar-kameez-set,bharat-plaza,http://im6.ybndc.com/upload/199160/ProductRear634814391880667044.jpg,11489,,Women,http://www.yebhi.com/199160/PD/bharat-plaza-purple-georgette-sarees.htm,yebhi.com,Bharat Plaza Purple Georgette - Sarees Buy Online,Bharat Plaza Purple Georgette - Sarees  Best Price Rs 11489.00  EMI Rs 1915 for 6 months FREE Shipping In Stock - Delivery in 9-12 Days,None,<div class="product_detail_columns tinyscrl" itemprop="description" style=""><div class="scrollbar" style="width:2px; height:250px; background:#9E9E9E;"><div class="track" style="width:2px;"><div class="thumb" style="width:6px;"><div class="end"> </div></div></div></div><div class="viewport" style=" height:250px; width:252px; font-family:Arial !important;"><div class="overview" style="text-align:justify; display:block;"><div>This beauteous <b>purple and turquoise coloured shimmer georgette lehenga saree</b> with entirely heavy work on it is truly ravishing and captivating . Highlight your taste by including this stunning creation in <b>shimmer georgette .</b> <br/><br/><b>Features</b><ul style="margin-left&lt;/b&gt;: 20px;"><li type="disc">Brand: Bharat Plaza</li><li type="disc">Category:  Traditional and Ethnic Wear</li><li type="disc">Type: Sarees</li><li type="disc">Fabric: Georgette</li><li type="disc">Colour: Purple  Blue</li><li type="disc">Saree Length (in mts.): 5.4</li><li type="disc">Blouse Length (in mts.): 0.80</li></ul><br/><b>Wash &amp; Care</b><br>Wash it with a mild detergent.<br> If washing in a machine  set it on a delicate mode and low temperature cycle.<br> Wash dark colours separately and  use iron at low temperature.<br><br/><b>Note</b>: There may be a slight colour variation in the image from original product.   </br></br></br></br></div></div></div> </div>,,16:04:2014,
199213,bharat plaza green net sarees,http://www.yebhi.com/online-shopping/women/dress-materials/sarees/salwar-kameez-set/kurta-kurtis/leggings-and-jeggings.html?affint=women-topmenu,14995,Traditional-Ethnic,salwar-kameez-set,bharat-plaza,http://im6.ybndc.com/upload/199213/ProductRear634814398886203951.jpg,14995,,Women,http://www.yebhi.com/199213/PD/bharat-plaza-green-net-sarees.htm,yebhi.com,Bharat Plaza Green Net - Sarees Buy Online,Bharat Plaza Green Net - Sarees  Best Price Rs 14995.00  EMI Rs 2499 for 6 months FREE Shipping In Stock - Delivery in 9-12 Days,None,<div class="product_detail_columns tinyscrl" itemprop="description" style=""><div class="scrollbar" style="width:2px; height:250px; background:#9E9E9E;"><div class="track" style="width:2px;"><div class="thumb" style="width:6px;"><div class="end"> </div></div></div></div><div class="viewport" style=" height:250px; width:252px; font-family:Arial !important;"><div class="overview" style="text-align:justify; display:block;"><div>Don a perfect traditional look by draping this awesome creation from the house of <b>Bharat Plaza.</b> This saree has been <b>crafted with net and has embroidered pattern on the pleats and pallu.</b> The saree has beautifully designed border in contrast orange and white colour. <br/><br/><b>Features</b><ul style="margin-left: 20px;"><li type="disc"><b>Brand:</b> Bharat Plaza</li><li type="disc"><b>Category:</b>  Traditional and Ethnic Wear</li><li type="disc"><b>Type:</b> Sarees</li><li type="disc"><b>Fabric:</b>  Net</li><li type="disc"><b>Colour:</b> Green</li><li type="disc"><b>Saree Length (in mts.):</b> 5.4</li><li type="disc"><b>Blouse Length (in mts.):</b> 0.80</li></ul><br/><b>Wash &amp; Care</b><br>Dry Clean Only<br><br/><b>Note:</b> There may be a slight colour variation in the image from original product. </br></br></div></div></div> </div>,,16:04:2014,
199197,bharat plaza red georgette sarees,http://www.yebhi.com/online-shopping/women/dress-materials/sarees/salwar-kameez-set/kurta-kurtis/leggings-and-jeggings.html?affint=women-topmenu,10290,Traditional-Ethnic,salwar-kameez-set,bharat-plaza,http://im6.ybndc.com/upload/199197/ProductRear634814396534800878.jpg,10290,,Women,http://www.yebhi.com/199197/PD/bharat-plaza-red-georgette-sarees.htm,yebhi.com,Bharat Plaza Red Georgette - Sarees Buy Online,Bharat Plaza Red Georgette - Sarees  Best Price Rs 10290.00  EMI Rs 1715 for 6 months FREE Shipping In Stock - Delivery in 9-12 Days,None,<div class="product_detail_columns tinyscrl" itemprop="description" style=""><div class="scrollbar" style="width:2px; height:250px; background:#9E9E9E;"><div class="track" style="width:2px;"><div class="thumb" style="width:6px;"><div class="end"> </div></div></div></div><div class="viewport" style=" height:250px; width:252px; font-family:Arial !important;"><div class="overview" style="text-align:justify; display:block;"><div>Show off your glamorous side by draping yourself in this <b>saree from Bharat Plaza</b>. This <b>red</b> saree is made of <b>georgette</b>. The ethnic wear showcased an elegant <b>emboidery </b> and all over and a <b>laced</b> and <b> sequenced</b> border with a beautiful <b>sequence</b> work on the pallu.<b>Features</b><ul style="margin-left: 20px;"><li type="disc">Type: Saree with Unstitched Blouse</li><li type="disc">Fabric: Georgette</li><li type="disc">Colour: Red</li><li type="disc">Border: All Sides</li><li type="disc">Detailing: Lace Border  Sequence  Embroidery</li><li type="disc">Suitable for: Party  Reception</li><li type="disc">Length: 6.3 metres with unstitched blouse piece</li><li type="disc">Blouse Colour: Gold</li></ul><b>Wash and Care<br/></b>Wash it with mild detergent or machine wash gently.    Wash dark colours separately and use iron at low temperature.<br><br><b>Note</b><br>There may be a slight colour variation in the image from original product. </br></br></br></div></div></div> </div>,,16:04:2014,
bharat plaza pink cotton sarees,bharat-plaza,http://www.yebhi.com/online-shopping/women/dress-materials/sarees/salwar-kameez-set/kurta-kurtis/leggings-and-jeggings.html?affint=women-topmenu,http://im6.ybndc.com/upload/316195/ProductRear635068137027781852.jpg,Traditional-Ethnic,salwar-kameez-set,bharat-plaza,http://www.yebhi.com/316195/PD/bharat-plaza-pink-cotton-sarees.htm,316195,,Women,http://www.yebhi.com/online-shopping/bharat-plaza/women/kurta-kurtis/sarees/salwar-kameez-set/salwar-kameez-set/dress-materials/leggings-and-jeggings.html?affint=women-topmenu&lc=Brands,yebhi.com,Bharat Plaza Pink Cotton - Sarees Buy Online,Bharat Plaza Pink Cotton - Sarees  Best Price Rs 7469.00  EMI Rs 1245 for 6 months FREE Shipping In Stock - Delivery in 9-12 Days,7469,<div class="product_detail_columns tinyscrl" itemprop="description" style=""><div class="scrollbar" style="width:2px; height:250px; background:#9E9E9E;"><div class="track" style="width:2px;"><div class="thumb" style="width:6px;"><div class="end"> </div></div></div></div><div class="viewport" style=" height:250px; width:252px; font-family:Arial !important;"><div class="overview" style="text-align:justify; display:block;"><div>This appealing <b>pink coloured saree</b> is designed on <b>cotton with amazing work and a fancy multicolored border.</b> This exquisite saree is decorated with <b>shimmering embroidery on the border of all sides. </b> Grace any occasion in style in this master creation. <br><br><b>Features</b><ul style="?margin-left&lt;/b">: 20px;?&gt;<li type="?disc?"><b>Brand</b>: Bharat Plaza</li><li type="?disc?"><b>Category</b>:  Traditional and Ethnic Wear</li><li type="?disc?"><b>Type</b>:  Saree with unstitched blouse</li><li type="disc">Fabric: Georgette</li><li type="?disc?"><b>Colour</b>: Red</li><li type="?disc?"><b>Border</b>: All sides</li><li type="?disc?"><b>Saree Length (in mts.)</b>: 5.4</li><li type="?disc?"><b>Blouse Length (in mts.)</b>:0.80</li></ul><br><b>Wash &amp; Care</b><br>  Wash it with a mild detergent.<br> If washing in a machine  set it on a delicate mode and low temperature cycle.<br> Wash dark colours separately and  use iron at low temperature.<br><br/><b>Note</b>: There may be a slight colour variation in the image from original product. </br></br></br></br></br></br></br></div></div></div> </div>,,16:04:2014,
316186,bharat plaza green chiffon sarees,http://www.yebhi.com/online-shopping/women/dress-materials/sarees/salwar-kameez-set/kurta-kurtis/leggings-and-jeggings.html?affint=women-topmenu,6149,Traditional-Ethnic,salwar-kameez-set,bharat-plaza,http://im6.ybndc.com/upload/316186/ProductRear635068133993718403.jpg,6149,,Women,http://www.yebhi.com/316186/PD/bharat-plaza-green-chiffon-sarees.htm,yebhi.com,Bharat Plaza Green Chiffon - Sarees Buy Online,Bharat Plaza Green Chiffon - Sarees  Best Price Rs 6149.00  EMI Rs 1025 for 6 months FREE Shipping In Stock - Delivery in 9-12 Days,None,<div class="product_detail_columns tinyscrl" itemprop="description" style=""><div class="scrollbar" style="width:2px; height:250px; background:#9E9E9E;"><div class="track" style="width:2px;"><div class="thumb" style="width:6px;"><div class="end"> </div></div></div></div><div class="viewport" style=" height:250px; width:252px; font-family:Arial !important;"><div class="overview" style="text-align:justify; display:block;"><div>Get ready to be complimented for your look when you wear this extremely gorgeous saari. In a<b>green colour  </b> it features <b>white embroidered detailing on the borders.</b> This saree from <b>Bharat Plaza</b> is <b>crafted with chiffon</b> and is brilliantly designed with mukesh work all over.<br><br><b>Features</b><ul style="?margin-left&lt;/b">: 20px;?&gt;<li type="?disc?"><b>Brand</b>: Bharat Plaza</li><li type="?disc?"><b>Category</b>:  Traditional and Ethnic Wear</li><li type="?disc?"><b>Type</b>:  Saree with unstitched blouse</li><li type="?disc?"><b>Fabric</b>: Chiffon </li><li type="?disc?"><b>Colour</b>: Green</li><li type="?disc?"><b>Saree Length (in mts.)</b>: 5.4</li><li type="?disc?"><b>Blouse Length (in mts.)</b>:0.80</li></ul><br><b>Wash &amp; Care</b><br>  Wash it with a mild detergent. <br>If washing in a machine  set it on a delicate mode and low temperature cycle.<br> Wash dark colours separately and  use iron at low temperature.<br><br><b>Note</b>: There may be a slight colour variation in the image from original product. </br></br></br></br></br></br></br></br></div></div></div> </div>,,16:04:2014,
316189,bharat plaza purple chiffon sarees,http://www.yebhi.com/online-shopping/women/dress-materials/sarees/salwar-kameez-set/kurta-kurtis/leggings-and-jeggings.html?affint=women-topmenu,11957,Traditional-Ethnic,salwar-kameez-set,bharat-plaza,http://im6.ybndc.com/upload/316189/ProductRear635068134546429946.jpg,11957,,Women,http://www.yebhi.com/316189/PD/bharat-plaza-purple-chiffon-sarees.htm,yebhi.com,Bharat Plaza Purple Chiffon - Sarees Buy Online,Bharat Plaza Purple Chiffon - Sarees  Best Price Rs 11957.00  EMI Rs 1993 for 6 months FREE Shipping In Stock - Delivery in 9-12 Days,None,<div class="product_detail_columns tinyscrl" itemprop="description" style=""><div class="scrollbar" style="width:2px; height:250px; background:#9E9E9E;"><div class="track" style="width:2px;"><div class="thumb" style="width:6px;"><div class="end"> </div></div></div></div><div class="viewport" style=" height:250px; width:252px; font-family:Arial !important;"><div class="overview" style="text-align:justify; display:block;"><div>This purple saree is delicately made from <b>chiffon.</b> This classy ethnic wear shows <b>intricate display of mukesh</b> work all over. The border is further adorned with more detailed work in paisley pattern. Add this stunning creation from <b>Bharat Plaza</b> to your wardrobe. <br><br><b>Features</b><ul style="?margin-left&lt;/b">: 20px;?&gt;<li type="?disc?"><b>Brand</b>: Bharat Plaza</li><li type="?disc?"><b>Category</b>:  Traditional and Ethnic Wear</li><li type="?disc?"><b>Type</b>:  Saree with unstitched blouse</li><li type="?disc?"><b>Fabric</b>: Chiffon</li><li type="?disc?"><b>Colour</b>: Purple</li><li type="?disc?"><b>Border</b>: All sides</li><li type="?disc?"><b>Saree Length (in mts.)</b>: 5.4</li><li type="?disc?"><b>Blouse Length (in mts.)</b>:0.80</li></ul><br><b>Wash &amp; Care</b><br>  Wash it with a mild detergent.<br> If washing in a machine  set it on a delicate mode and low temperature cycle.<br> Wash dark colours separately and  use iron at low temperature.<br>.<br><br/><b>Note</b>: There may be a slight colour variation in the image from original product.   </br></br></br></br></br></br></br></br></div></div></div> </div>,,16:04:2014,
199216,bharat plaza blue sarees,http://www.yebhi.com/online-shopping/women/dress-materials/sarees/salwar-kameez-set/kurta-kurtis/leggings-and-jeggings.html?affint=women-topmenu,19599,Traditional-Ethnic,salwar-kameez-set,bharat-plaza,http://im6.ybndc.com/upload/199216/ProductRear634814399276674454.jpg,19599,,Women,http://www.yebhi.com/199216/PD/bharat-plaza-blue-sarees.htm,yebhi.com,Bharat Plaza Blue - Sarees Buy Online,Bharat Plaza Blue - Sarees  Best Price Rs 19599.00  EMI Rs 3267 for 6 months FREE Shipping In Stock - Delivery in 9-12 Days,None,<div class="product_detail_columns tinyscrl" itemprop="description" style=""><div class="scrollbar" style="width:2px; height:250px; background:#9E9E9E;"><div class="track" style="width:2px;"><div class="thumb" style="width:6px;"><div class="end"> </div></div></div></div><div class="viewport" style=" height:250px; width:252px; font-family:Arial !important;"><div class="overview" style="text-align:justify; display:block;"><div>Experience the rich and fabulous feel of this <b>saree from Bharat Plaza</b>. This <b>purple </b>ethnic wear is made from <b>net</b>. The saree features <b>golden colour  floral</b> prints and an extravagant <b>cut-work </b>border.<b>Features</b><ul style="margin-left: 20px;"><li type="disc">Type: Saree with Unstitched Blouse</li><li type="disc">Fabric: Net</li><li type="disc">Colour: Purple</li><li type="disc">Design: Embellished</li><li type="disc">Pallu: Cut-Work</li><li type="disc">Detailing: Floral Prints  Cut-Work Border</li><li type="disc">Length: 6.3 meters along with an unstitched blouse piece</li><li type="disc">Suitable for: Party  reception</li><li type="disc">Blouse Colour: Purple</li></ul><b>Wash and Care<br/></b>Dry Clean Only<br><br><b>Note</b><br>There may be a slight colour variation in the image from original product.  </br></br></br></div></div></div> </div>,,16:04:2014,
316185,bharat plaza red georgette sarees,http://www.yebhi.com/online-shopping/women/dress-materials/sarees/salwar-kameez-set/kurta-kurtis/leggings-and-jeggings.html?affint=women-topmenu,14289,Traditional-Ethnic,salwar-kameez-set,bharat-plaza,http://im6.ybndc.com/upload/316185/ProductRear635068133826485331.jpg,14289,,Women,http://www.yebhi.com/316185/PD/bharat-plaza-red-georgette-sarees.htm,yebhi.com,Bharat Plaza Red Georgette - Sarees Buy Online,Bharat Plaza Red Georgette - Sarees  Best Price Rs 14289.00  EMI Rs 2382 for 6 months FREE Shipping In Stock - Delivery in 9-12 Days,None,<div class="product_detail_columns tinyscrl" itemprop="description" style=""><div class="scrollbar" style="width:2px; height:250px; background:#9E9E9E;"><div class="track" style="width:2px;"><div class="thumb" style="width:6px;"><div class="end"> </div></div></div></div><div class="viewport" style=" height:250px; width:252px; font-family:Arial !important;"><div class="overview" style="text-align:justify; display:block;"><div>This ravishing red <b> coloured saree from Bharat Plaza</b> is embroidered with <b>prettifying design border in pink colour and all over scattered butties</b>. This traditional wear is crafted with <b>georgette</b> and  will surely bring you lots of compliments. <br><br><b>Features</b><ul style="?margin-left&lt;/b">: 20px;?&gt;<li type="?disc?"><b>Brand</b>: Bharat Plaza</li><li type="?disc?"><b>Category</b>:  Traditional and Ethnic Wear</li><li type="?disc?"><b>Type</b>:  Saree with unstitched blouse</li><li type="disc">Fabric: Georgette</li><li type="?disc?"><b>Colour</b>: Red</li><li type="?disc?"><b>Border</b>: All sides</li><li type="?disc?"><b>Saree Length (in mts.)</b>: 5.4</li><li type="?disc?"><b>Blouse Length (in mts.)</b>:0.80</li></ul><br><b>Wash &amp; Care</b><br>  Wash it with a mild detergent.<br> If washing in a machine  set it on a delicate mode and low temperature cycle.<br> Wash dark colours separately and  use iron at low temperature.<br><br/><b>Note</b>: There may be a slight colour variation in the image from original product.   </br></br></br></br></br></br></br></div></div></div> </div>,,16:04:2014,
199129,bharat plaza pink georgette sarees,http://www.yebhi.com/online-shopping/women/dress-materials/sarees/salwar-kameez-set/kurta-kurtis/leggings-and-jeggings.html?affint=women-topmenu,7150,Traditional-Ethnic,salwar-kameez-set,bharat-plaza,http://im6.ybndc.com/upload/199129/ProductRear634814387453826667.jpg,7150,,Women,http://www.yebhi.com/199129/PD/bharat-plaza-pink-georgette-sarees.htm,yebhi.com,Bharat Plaza Pink Georgette - Sarees Buy Online,Bharat Plaza Pink Georgette - Sarees  Best Price Rs 7150.00  EMI Rs 1192 for 6 months FREE Shipping In Stock - Delivery in 9-12 Days,None,<div class="product_detail_columns tinyscrl" itemprop="description" style=""><div class="scrollbar" style="width:2px; height:250px; background:#9E9E9E;"><div class="track" style="width:2px;"><div class="thumb" style="width:6px;"><div class="end"> </div></div></div></div><div class="viewport" style=" height:250px; width:252px; font-family:Arial !important;"><div class="overview" style="text-align:justify; display:block;"><div>Look fabulous and feel rich with this <b>saree from Bharat Plaza</b>. This <b>pink </b> saree is made from <b>georgette</b>. The ethnic wear is adorned with sprinkled <b>butties</b> all over. The border has an intricate <b>zari</b> finish.<b>Features</b><ul style="margin-left: 20px;"><li type="disc">Type: Saree with Unstitched Blouse</li><li type="disc">Fabric: Georgette</li><li type="disc">Colour: Pink</li><li type="disc">Border: All Sides</li><li type="disc">Detailing: Butties  Zari</li><li type="disc">Suitable for: Wedding  Reception</li><li type="disc">Blouse Colour: Pink</li><li type="disc">Length: 6.3 metres with unstitched blouse piece</li></ul><b>Wash and Care<br/></b>Wash it with mild detergent or machine wash gently.    Wash dark colours separately and use iron at low temperature..<br><br><b>Note</b><br>There may be a slight colour variation in the image from original product. </br></br></br></div></div></div> </div>,,16:04:2014,
259766,bharat plaza mustard georgette sarees,http://www.yebhi.com/online-shopping/women/dress-materials/sarees/salwar-kameez-set/kurta-kurtis/leggings-and-jeggings.html?affint=women-topmenu,5440,Traditional-Ethnic,salwar-kameez-set,bharat-plaza,http://im6.ybndc.com/upload/259766/ProductRear634921342765157808.jpg,5440,,Women,http://www.yebhi.com/259766/PD/bharat-plaza-mustard-georgette-sarees.htm,yebhi.com,Bharat Plaza Mustard Georgette - Sarees Buy Online,Bharat Plaza Mustard Georgette - Sarees  Best Price Rs 5440.00  EMI Rs 907 for 6 months FREE Shipping in 2 Days,None,<div class="product_detail_columns tinyscrl" itemprop="description" style=""><div class="scrollbar" style="width:2px; height:250px; background:#9E9E9E;"><div class="track" style="width:2px;"><div class="thumb" style="width:6px;"><div class="end"> </div></div></div></div><div class="viewport" style=" height:250px; width:252px; font-family:Arial !important;"><div class="overview" style="text-align:justify; display:block;"><div><table><tr><td><b>Colour</b></td><td>    </td><td>Mustard</td></tr><tr><td><b>For</b></td><td>    </td><td>Women</td></tr><tr><td><b>Material</b></td><td>    </td><td>Georgette</td></tr><tr><td><b>Brands</b></td><td>    </td><td>Bharat Plaza</td></tr><tr><td><b>Departments</b></td><td>    </td><td>Apparels</td></tr><tr><td><b>Category</b></td><td>    </td><td>Sarees</td></tr></table>  </div></div></div> </div>,,16:04:2014,
199196,bharat plaza purple georgette sarees,http://www.yebhi.com/online-shopping/women/dress-materials/sarees/salwar-kameez-set/kurta-kurtis/leggings-and-jeggings.html?affint=women-topmenu,9890,Traditional-Ethnic,salwar-kameez-set,bharat-plaza,http://im6.ybndc.com/upload/199196/ProductRear634814396408128066.jpg,9890,,Women,http://www.yebhi.com/199196/PD/bharat-plaza-purple-georgette-sarees.htm,yebhi.com,Bharat Plaza Purple Georgette - Sarees Buy Online,Bharat Plaza Purple Georgette - Sarees  Best Price Rs 9890.00  EMI Rs 1648 for 6 months FREE Shipping In Stock - Delivery in 9-12 Days,None,<div class="product_detail_columns tinyscrl" itemprop="description" style=""><div class="scrollbar" style="width:2px; height:250px; background:#9E9E9E;"><div class="track" style="width:2px;"><div class="thumb" style="width:6px;"><div class="end"> </div></div></div></div><div class="viewport" style=" height:250px; width:252px; font-family:Arial !important;"><div class="overview" style="text-align:justify; display:block;"><div>Look gorgeous with this <b>saree from Bharat Plaza</b>. This <b>purple </b>saree is made from <b> georgette</b>. This ethnic wear has sprinkled <b>butties</b> all over. The border of this saree is adorned with <b>embroidery</b>  <b>velvet</b> and <b>sequence</b>.<b>Features</b><ul style="margin-left: 20px;"><li type="disc">Type: Saree with Unstitched Blouse</li><li type="disc">Fabric: Georgette</li><li type="disc">Colour: Purple</li><li type="disc">Border: All Sides</li><li type="disc">Detailing: Butties  Sequence  Embroidery</li><li type="disc">Suitable for: Party  Reception</li><li type="disc">Blouse Colour: Purple</li><li type="disc">Length: 6.3 metres with unstitched blouse piece</li></ul><b>Wash and Care<br/></b>Wash it with mild detergent or machine wash gently.    Wash dark colours separately and use iron at low temperature.<br><br><b>Note</b><br>There may be a slight colour variation in the image from original product. </br></br></br></div></div></div> </div>,,16:04:2014,
