493762,casio black men digital wrist watches,http://www.yebhi.com/online-shopping/lifestyle/men.html?affint=men-topmenu,4995,Accessory,watches,casio,http://im6.ybndc.com/upload/493762/ProductRear635315445172582000.jpg,4995,,Men,http://www.yebhi.com/493762/PD/casio-black-men-digital-wrist-watches.htm,yebhi.com,Casio Black Men Digital - Wrist Watches Buy Online,Casio Black Men Digital - Wrist Watches  Best Price Rs 4995.00  EMI Rs 833 for 6 months FREE Shipping In Stock - Delivery in 3-5 Days,None,<div class="product_detail_columns tinyscrl" itemprop="description" style=""><div class="scrollbar" style="width:2px; height:250px; background:#9E9E9E;"><div class="track" style="width:2px;"><div class="thumb" style="width:6px;"><div class="end"> </div></div></div></div><div class="viewport" style=" height:250px; width:252px; font-family:Arial !important;"><div class="overview" style="text-align:justify; display:block;"><div>Digital Watch by Casio Round dial Digital time display Quartz movement Pin and buckle strap fasteningRubber </div></div></div> </div>,,16:04:2014,
493783,casio black men chronograph wrist watches,http://www.yebhi.com/online-shopping/lifestyle/men.html?affint=men-topmenu,9995,Accessory,watches,casio,http://im6.ybndc.com/upload/493783/ProductRear635315445259318000.jpg,9995,,Men,http://www.yebhi.com/493783/PD/casio-black-men-chronograph-wrist-watches.htm,yebhi.com,Casio Black Men Chronograph - Wrist Watches Buy Online,Casio Black Men Chronograph - Wrist Watches  Best Price Rs 9995.00  EMI Rs 1666 for 6 months FREE Shipping In Stock - Delivery in 3-5 Days,None,<div class="product_detail_columns tinyscrl" itemprop="description" style=""><div class="scrollbar" style="width:2px; height:250px; background:#9E9E9E;"><div class="track" style="width:2px;"><div class="thumb" style="width:6px;"><div class="end"> </div></div></div></div><div class="viewport" style=" height:250px; width:252px; font-family:Arial !important;"><div class="overview" style="text-align:justify; display:block;"><div>Chronograph Watch by Casio Made from rubber Analogue and digital display Quartz movementRubber </div></div></div> </div>,,16:04:2014,
493823,casio green men analog wrist watches,http://www.yebhi.com/online-shopping/lifestyle/men.html?affint=men-topmenu,7995,Accessory,watches,casio,http://im6.ybndc.com/upload/493823/ProductRear635315445425458000.jpg,7995,,Men,http://www.yebhi.com/493823/PD/casio-green-men-analog-wrist-watches.htm,yebhi.com,Casio Green Men Analog - Wrist Watches Buy Online,Casio Green Men Analog - Wrist Watches  Best Price Rs 7995.00  EMI Rs 1333 for 6 months FREE Shipping In Stock - Delivery in 3-5 Days,None,<div class="product_detail_columns tinyscrl" itemprop="description" style=""><div class="scrollbar" style="width:2px; height:250px; background:#9E9E9E;"><div class="track" style="width:2px;"><div class="thumb" style="width:6px;"><div class="end"> </div></div></div></div><div class="viewport" style=" height:250px; width:252px; font-family:Arial !important;"><div class="overview" style="text-align:justify; display:block;"><div>Analogue Watch by Casio Made from rubber Analogue and digital display Quartz/analogue movement 200 meters water resistanceRubber </div></div></div> </div>,,16:04:2014,
493761,casio blue men digital wrist watches,http://www.yebhi.com/online-shopping/lifestyle/men.html?affint=men-topmenu,5995,Accessory,watches,casio,http://im6.ybndc.com/upload/493761/ProductRear635315445168526000.jpg,5995,,Men,http://www.yebhi.com/493761/PD/casio-blue-men-digital-wrist-watches.htm,yebhi.com,Casio Blue Men Digital - Wrist Watches Buy Online,Casio Blue Men Digital - Wrist Watches  Best Price Rs 5995.00  EMI Rs 999 for 6 months FREE Shipping In Stock - Delivery in 3-5 Days,None,<div class="product_detail_columns tinyscrl" itemprop="description" style=""><div class="scrollbar" style="width:2px; height:250px; background:#9E9E9E;"><div class="track" style="width:2px;"><div class="thumb" style="width:6px;"><div class="end"> </div></div></div></div><div class="viewport" style=" height:250px; width:252px; font-family:Arial !important;"><div class="overview" style="text-align:justify; display:block;"><div>Digital Watch by Casio Round dial Digital time display Quartz movement 100 meters water resistance Pin and buckle strap fasteningFaux Leather </div></div></div> </div>,,16:04:2014,
493822,casio men analog wrist watches,http://www.yebhi.com/online-shopping/lifestyle/men.html?affint=men-topmenu,7195,Accessory,watches,casio,http://im6.ybndc.com/upload/493822/ProductRear635315445421246000.jpg,7195,,Men,http://www.yebhi.com/493822/PD/casio-men-analog-wrist-watches.htm,yebhi.com,Casio Men Analog - Wrist Watches Buy Online,Casio Men Analog - Wrist Watches  Best Price Rs 7195.00  EMI Rs 1199 for 6 months FREE Shipping In Stock - Delivery in 3-5 Days,None,<div class="product_detail_columns tinyscrl" itemprop="description" style=""><div class="scrollbar" style="width:2px; height:250px; background:#9E9E9E;"><div class="track" style="width:2px;"><div class="thumb" style="width:6px;"><div class="end"> </div></div></div></div><div class="viewport" style=" height:250px; width:252px; font-family:Arial !important;"><div class="overview" style="text-align:justify; display:block;"><div>Analogue Watch by Casio Made from rubber Analogue and digital display Quartz/analogue movement 200 meters water resistanceRubber </div></div></div> </div>,,16:04:2014,
496036,casio silver men chronograph wrist watches,http://www.yebhi.com/online-shopping/lifestyle/men.html?affint=men-topmenu,5995,Accessory,watches,casio,http://im6.ybndc.com/upload/496036/ProductRear635318776708254000.jpg,5995,,Men,http://www.yebhi.com/496036/PD/casio-silver-men-chronograph-wrist-watches.htm,yebhi.com,Casio Silver Men Chronograph - Wrist Watches Buy Online,Casio Silver Men Chronograph - Wrist Watches  Best Price Rs 5995.00  EMI Rs 999 for 6 months FREE Shipping In Stock - Delivery in 3-5 Days,None,<div class="product_detail_columns tinyscrl" itemprop="description" style=""><div class="scrollbar" style="width:2px; height:250px; background:#9E9E9E;"><div class="track" style="width:2px;"><div class="thumb" style="width:6px;"><div class="end"> </div></div></div></div><div class="viewport" style=" height:250px; width:252px; font-family:Arial !important;"><div class="overview" style="text-align:justify; display:block;"><div>Chronograph Watch by Casio  Round dial  Analogue time display  Three hand quartz movement  Multi sub-dials  100 meters water resistanceMetal </div></div></div> </div>,,16:04:2014,
493767,casio men digital wrist watches,http://www.yebhi.com/online-shopping/lifestyle/men.html?affint=men-topmenu,6495,Accessory,watches,casio,http://im6.ybndc.com/upload/493767/ProductRear635315445193018000.jpg,6495,,Men,http://www.yebhi.com/493767/PD/casio-men-digital-wrist-watches.htm,yebhi.com,Casio Men Digital - Wrist Watches Buy Online,Casio Men Digital - Wrist Watches  Best Price Rs 6495.00  EMI Rs 1083 for 6 months FREE Shipping In Stock - Delivery in 3-5 Days,None,<div class="product_detail_columns tinyscrl" itemprop="description" style=""><div class="scrollbar" style="width:2px; height:250px; background:#9E9E9E;"><div class="track" style="width:2px;"><div class="thumb" style="width:6px;"><div class="end"> </div></div></div></div><div class="viewport" style=" height:250px; width:252px; font-family:Arial !important;"><div class="overview" style="text-align:justify; display:block;"><div>Digital Watch by Casio Made from rubber Digital time display Quartz digital movement 200 meters water resistanceRubber </div></div></div> </div>,,16:04:2014,
493782,casio white men chronograph wrist watches,http://www.yebhi.com/online-shopping/lifestyle/men.html?affint=men-topmenu,7995,Accessory,watches,casio,http://im6.ybndc.com/upload/493782/ProductRear635315445255106000.jpg,7995,,Men,http://www.yebhi.com/493782/PD/casio-white-men-chronograph-wrist-watches.htm,yebhi.com,Casio White Men Chronograph - Wrist Watches Buy Online,Casio White Men Chronograph - Wrist Watches  Best Price Rs 7995.00  EMI Rs 1333 for 6 months FREE Shipping In Stock - Delivery in 3-5 Days,None,<div class="product_detail_columns tinyscrl" itemprop="description" style=""><div class="scrollbar" style="width:2px; height:250px; background:#9E9E9E;"><div class="track" style="width:2px;"><div class="thumb" style="width:6px;"><div class="end"> </div></div></div></div><div class="viewport" style=" height:250px; width:252px; font-family:Arial !important;"><div class="overview" style="text-align:justify; display:block;"><div>Chronograph Watch by Casio Round dial Analogue time display Added digital display Multiple sub-dials Shock resistant 200 meters water resistance LED lightRubber </div></div></div> </div>,,16:04:2014,
