483691,pigeon black aluminium 3 5 ltr pressure cookers,http://www.yebhi.com/online-shopping/home-ware.html?affint=home-topmenu,1850,Home Ware,cookware,pigeon,http://im6.ybndc.com/upload/483691/ProductRear635298847685950000.jpg,1850,,home and kitchen,http://www.yebhi.com/483691/PD/pigeon-black-aluminium-3-5-ltr-pressure-cookers.htm,yebhi.com,Pigeon Black Aluminium 3.5 Ltr. - Pressure Cookers Buy Online,Pigeon Black Aluminium 3.5 Ltr. - Pressure Cookers  Best Price Rs 1850.00  EMI Rs 308 for 6 months FREE Shipping In Stock - Delivery in 6-8 Days,None,<div class="product_detail_columns tinyscrl" itemprop="description" style=""><div class="scrollbar" style="width:2px; height:250px; background:#9E9E9E;"><div class="track" style="width:2px;"><div class="thumb" style="width:6px;"><div class="end"> </div></div></div></div><div class="viewport" style=" height:250px; width:252px; font-family:Arial !important;"><div class="overview" style="text-align:justify; display:block;"><div>PIGEON HARD ANODIZED COOKER - XELLA 3.5 LTR </div></div></div> </div>,,17:04:2014,
483793,pigeon black aluminium appa patram,http://www.yebhi.com/online-shopping/home-ware.html?affint=home-topmenu,925,Home Ware,cookware,pigeon,http://im6.ybndc.com/upload/483793/ProductRear635298847784854000.jpg,925,,home and kitchen,http://www.yebhi.com/483793/PD/pigeon-black-aluminium-appa-patram.htm,yebhi.com,Pigeon Black Aluminium - Appa Patram Buy Online,Pigeon Black Aluminium - Appa Patram  Best Price Rs 925.00  EMI Rs 154 for 6 months FREE Shipping In Stock - Delivery in 6-8 Days,None,<div class="product_detail_columns tinyscrl" itemprop="description" style=""><div class="scrollbar" style="width:2px; height:250px; background:#9E9E9E;"><div class="track" style="width:2px;"><div class="thumb" style="width:6px;"><div class="end"> </div></div></div></div><div class="viewport" style=" height:250px; width:252px; font-family:Arial !important;"><div class="overview" style="text-align:justify; display:block;"><div>Spiral bottom for even heating; Extra thick base to prevent warping; Triple layer coating from Greblon Germany; Metal spoon friendly; Attractive Red colour Exterior suitable for Cook- n- Serve. </div></div></div> </div>,,17:04:2014,
483790,pigeon red aluminium casseroles,http://www.yebhi.com/online-shopping/home-ware.html?affint=home-topmenu,1295,Home Ware,cookware,pigeon,http://im6.ybndc.com/upload/483790/ProductRear635298847781266000.jpg,1295,,home and kitchen,http://www.yebhi.com/483790/PD/pigeon-red-aluminium-casseroles.htm,yebhi.com,Pigeon Red Aluminium - Casseroles Buy Online,Pigeon Red Aluminium - Casseroles  Best Price Rs 1295.00  EMI Rs 216 for 6 months FREE Shipping In Stock - Delivery in 6-8 Days,None,<div class="product_detail_columns tinyscrl" itemprop="description" style=""><div class="scrollbar" style="width:2px; height:250px; background:#9E9E9E;"><div class="track" style="width:2px;"><div class="thumb" style="width:6px;"><div class="end"> </div></div></div></div><div class="viewport" style=" height:250px; width:252px; font-family:Arial !important;"><div class="overview" style="text-align:justify; display:block;"><div>Spiral bottom for even heating; Extra thick base to prevent warping; Triple layer coating from Greblon Germany; Metal spoon friendly; Attractive Red colour Exterior suitable for Cook- n- Serve. </div></div></div> </div>,,17:04:2014,
483717,pigeon stainless steel gas stove,http://www.yebhi.com/online-shopping/home-ware.html?affint=home-topmenu,1995,Home Ware,cookware,pigeon,http://im6.ybndc.com/upload/483717/ProductRear635298847699366000.jpg,1995,,home and kitchen,http://www.yebhi.com/483717/PD/pigeon-stainless-steel-gas-stove.htm,yebhi.com,Pigeon Stainless Steel - Gas Stove Buy Online,Pigeon Stainless Steel - Gas Stove  Best Price Rs 1995.00  EMI Rs 333 for 6 months FREE Shipping In Stock - Delivery in 6-8 Days,None,<div class="product_detail_columns tinyscrl" itemprop="description" style=""><div class="scrollbar" style="width:2px; height:250px; background:#9E9E9E;"><div class="track" style="width:2px;"><div class="thumb" style="width:6px;"><div class="end"> </div></div></div></div><div class="viewport" style=" height:250px; width:252px; font-family:Arial !important;"><div class="overview" style="text-align:justify; display:block;"><div>International Standard Stainless Steel;Stainless Steel Spill Tray and Body;Uniquely Designed Brass Burners;Scientifically Designed Enameled Trivets;Heat Resistant Knobs;Rust-proof &amp; Easy to Clean;Extra wide top;Automatic / Manual Ignition </div></div></div> </div>,,17:04:2014,
483686,pigeon stainless steel gas stove,http://www.yebhi.com/online-shopping/home-ware.html?affint=home-topmenu,5455,Home Ware,cookware,pigeon,http://im6.ybndc.com/upload/483686/ProductRear635298847680646000.jpg,5455,,home and kitchen,http://www.yebhi.com/483686/PD/pigeon-stainless-steel-gas-stove.htm,yebhi.com,Pigeon Stainless Steel - Gas Stove Buy Online,Pigeon Stainless Steel - Gas Stove  Best Price Rs 5455.00  EMI Rs 909 for 6 months FREE Shipping In Stock - Delivery in 6-8 Days,None,<div class="product_detail_columns tinyscrl" itemprop="description" style=""><div class="scrollbar" style="width:2px; height:250px; background:#9E9E9E;"><div class="track" style="width:2px;"><div class="thumb" style="width:6px;"><div class="end"> </div></div></div></div><div class="viewport" style=" height:250px; width:252px; font-family:Arial !important;"><div class="overview" style="text-align:justify; display:block;"><div>Uniquely designed Enameled Pan Supports;Unique Triple Ring Burner design ensures high thermal efficiency;Internal bending of the body provides strength &amp; avoid sharp edges.;Designer knobs;Drip Tray with round pan support;Manual /Automatic Ignition System;6.4 mm Rubber Hose;2 year Warranty </div></div></div> </div>,,17:04:2014,
483760,pigeon black aluminium saucepan,http://www.yebhi.com/online-shopping/home-ware.html?affint=home-topmenu,845,Home Ware,cookware,pigeon,http://im6.ybndc.com/upload/483760/ProductRear635298847745698000.jpg,845,,home and kitchen,http://www.yebhi.com/483760/PD/pigeon-black-aluminium-saucepan.htm,yebhi.com,Pigeon Black Aluminium - Saucepan Buy Online,Pigeon Black Aluminium - Saucepan  Best Price Rs 845.00  EMI Rs 141 for 6 months FREE Shipping In Stock - Delivery in 6-8 Days,None,<div class="product_detail_columns tinyscrl" itemprop="description" style=""><div class="scrollbar" style="width:2px; height:250px; background:#9E9E9E;"><div class="track" style="width:2px;"><div class="thumb" style="width:6px;"><div class="end"> </div></div></div></div><div class="viewport" style=" height:250px; width:252px; font-family:Arial !important;"><div class="overview" style="text-align:justify; display:block;"><div>4mm Thick body with thermocore base; Triple layer Stonehenge coating from Greblon Germany; Chemical PFOA (Perfluorooctanoic acid) free; Scratch resistant; Spiral Bottom for even heating; Metal spoon friendly; Strong  sturdy  stay-cool Bakelite handles; WARRANTY : 12 months. </div></div></div> </div>,,17:04:2014,
483706,pigeon black gas stove,http://www.yebhi.com/online-shopping/home-ware.html?affint=home-topmenu,6995,Home Ware,cookware,pigeon,http://im6.ybndc.com/upload/483706/ProductRear635298847692346000.jpg,6995,,home and kitchen,http://www.yebhi.com/483706/PD/pigeon-black-gas-stove.htm,yebhi.com,Pigeon Black - Gas Stove Buy Online,Pigeon Black - Gas Stove  Best Price Rs 6995.00  EMI Rs 1166 for 6 months FREE Shipping In Stock - Delivery in 6-8 Days,None,<div class="product_detail_columns tinyscrl" itemprop="description" style=""><div class="scrollbar" style="width:2px; height:250px; background:#9E9E9E;"><div class="track" style="width:2px;"><div class="thumb" style="width:6px;"><div class="end"> </div></div></div></div><div class="viewport" style=" height:250px; width:252px; font-family:Arial !important;"><div class="overview" style="text-align:justify; display:block;"><div>INDUCTION COOK TOPS </div></div></div> </div>,,17:04:2014,
483738,pigeon black aluminium casseroles,http://www.yebhi.com/online-shopping/home-ware.html?affint=home-topmenu,975,Home Ware,cookware,pigeon,http://im6.ybndc.com/upload/483738/ProductRear635298847721362000.jpg,975,,home and kitchen,http://www.yebhi.com/483738/PD/pigeon-black-aluminium-casseroles.htm,yebhi.com,Pigeon Black Aluminium - Casseroles Buy Online,Pigeon Black Aluminium - Casseroles  Best Price Rs 975.00  EMI Rs 163 for 6 months FREE Shipping In Stock - Delivery in 6-8 Days,None,<div class="product_detail_columns tinyscrl" itemprop="description" style=""><div class="scrollbar" style="width:2px; height:250px; background:#9E9E9E;"><div class="track" style="width:2px;"><div class="thumb" style="width:6px;"><div class="end"> </div></div></div></div><div class="viewport" style=" height:250px; width:252px; font-family:Arial !important;"><div class="overview" style="text-align:justify; display:block;"><div>4mm Thick body with thermocore base; Triple layer Stonehenge coating from Greblon Germany; Chemical PFOA (Perfluorooctanoic acid) free; Scratch resistant; Spiral Bottom for even heating; Metal spoon friendly; Strong  sturdy  stay-cool Bakelite handles; WARRANTY : 12 months. </div></div></div> </div>,,17:04:2014,
