494099,arrow brown women casual pants,http://www.yebhi.com/online-shopping/women/apparels.html?affint=women-topmenu,1999,Clothing,trouser,arrow,http://im6.ybndc.com/upload/494099/ProductRear635316027117634000.jpg,1999,,Women,http://www.yebhi.com/494099/PD/arrow-brown-women-casual-pants.htm,yebhi.com,Arrow Brown Women - Casual Pants Buy Online,Arrow Brown Women - Casual Pants  Best Price Rs 1999.00  EMI Rs 333 for 6 months FREE Shipping In Stock - Delivery in 3-5 Days,34,<div class="product_detail_columns tinyscrl" itemprop="description" style=""><div class="scrollbar" style="width:2px; height:250px; background:#9E9E9E;"><div class="track" style="width:2px;"><div class="thumb" style="width:6px;"><div class="end"> </div></div></div></div><div class="viewport" style=" height:250px; width:252px; font-family:Arial !important;"><div class="overview" style="text-align:justify; display:block;"><div>Casual Trousers by Arrow Made from cotton and lycra  Corduroy texture  Medium rise  Ankle length  Button and fly closure  Skinny fit  Cotton and Lycra </div></div></div> </div>,,16:04:2014,
287450,arrow blue cotton women capris,http://www.yebhi.com/online-shopping/women/apparels.html?affint=women-topmenu,1449,Clothing,trouser,arrow,http://im6.ybndc.com/upload/287450/ProductRear635036271299857004.jpg,1799,,Women,http://www.yebhi.com/287450/PD/arrow-blue-cotton-women-capris.htm,yebhi.com,Arrow Blue Cotton Women - Capris Buy Online,Arrow Blue Cotton Women - Capris  Best Price Rs 1439.00 Best Discount 20% Off EMI Rs 240 for 6 months FREE Shipping in 2 Days,2630,<div class="product_detail_columns tinyscrl" itemprop="description" style=""><div class="scrollbar" style="width:2px; height:250px; background:#9E9E9E;"><div class="track" style="width:2px;"><div class="thumb" style="width:6px;"><div class="end"> </div></div></div></div><div class="viewport" style=" height:250px; width:252px; font-family:Arial !important;"><div class="overview" style="text-align:justify; display:block;"><div><table><tr><td><b>Colour</b></td><td>    </td><td>Blue</td></tr><tr><td><b>For</b></td><td>    </td><td>Women</td></tr><tr><td><b>Material</b></td><td>    </td><td>Cotton</td></tr><tr><td><b>Brands</b></td><td>    </td><td>Arrow</td></tr><tr><td><b>Departments</b></td><td>    </td><td>Apparels</td></tr><tr><td><b>Category</b></td><td>    </td><td>Trouser and Pants</td></tr><tr><td><b>Types</b></td><td>    </td><td>Capris</td></tr></table>  </div></div></div> </div>,,16:04:2014,
287455,arrow blue women casual pants,http://www.yebhi.com/online-shopping/women/apparels.html?affint=women-topmenu,1999,Clothing,trouser,arrow,http://im6.ybndc.com/upload/287455/ProductRear635036272088286058.jpg,2499,,Women,http://www.yebhi.com/287455/PD/arrow-blue-women-casual-pants.htm,yebhi.com,Arrow Blue Women - Casual Pants Buy Online,Arrow Blue Women - Casual Pants  Best Price Rs 1999.00 Best Discount 20% Off EMI Rs 333 for 6 months FREE Shipping in 2 Days,263034,<div class="product_detail_columns tinyscrl" itemprop="description" style=""><div class="scrollbar" style="width:2px; height:250px; background:#9E9E9E;"><div class="track" style="width:2px;"><div class="thumb" style="width:6px;"><div class="end"> </div></div></div></div><div class="viewport" style=" height:250px; width:252px; font-family:Arial !important;"><div class="overview" style="text-align:justify; display:block;"><div>Gift yourself the retro look by buying these <b>casual pants from Arrow.</b> Extremely comfortable  this will give you a <b>stylish look</b> for all your outings. Grab all attention whenever you step out of the house.<b>Features</b><ul style="margin-left: 20px;"><li type="disc">Fabric: Cotton  Linen<li type="disc">Colour: Blue<li type="disc">Closure: Button and Fly<li type="disc">Waist type: Mid- rise<li type="disc">Pockets: 4</li></li></li></li></li></ul><b>Team it with</b> slim fit tops and wedges.<br/><b>Care Tips</b><br/>  Do not bleach or dry clean<br>Wash with like colours<br>Line dry<br>Warm iron</br></br><b>Note:</b>There may be a slight colour variation in the image from original product.   </br></div></div></div> </div>,,16:04:2014,
287456,arrow white women casual pants,http://www.yebhi.com/online-shopping/women/apparels.html?affint=women-topmenu,1999,Clothing,trouser,arrow,http://im6.ybndc.com/upload/287456/ProductRear635036272388275981.jpg,2499,,Women,http://www.yebhi.com/287456/PD/arrow-white-women-casual-pants.htm,yebhi.com,Arrow White Women - Casual Pants Buy Online,Arrow White Women - Casual Pants  Best Price Rs 1999.00 Best Discount 20% Off EMI Rs 333 for 6 months FREE Shipping in 2 Days,2628,<div class="product_detail_columns tinyscrl" itemprop="description" style=""><div class="scrollbar" style="width:2px; height:250px; background:#9E9E9E;"><div class="track" style="width:2px;"><div class="thumb" style="width:6px;"><div class="end"> </div></div></div></div><div class="viewport" style=" height:250px; width:252px; font-family:Arial !important;"><div class="overview" style="text-align:justify; display:block;"><div><table><tr><td><b>Colour</b></td><td>    </td><td>White</td></tr><tr><td><b>For</b></td><td>    </td><td>Women</td></tr><tr><td><b>Material</b></td><td>    </td><td>Cotton   Linen</td></tr><tr><td><b>Brands</b></td><td>    </td><td>Arrow</td></tr><tr><td><b>Departments</b></td><td>    </td><td>Apparels</td></tr><tr><td><b>Category</b></td><td>    </td><td>Trouser and Pants</td></tr><tr><td><b>Types</b></td><td>    </td><td>Casual Pants</td></tr></table>  </div></div></div> </div>,,16:04:2014,
287446,arrow grey women formal trousers,http://www.yebhi.com/online-shopping/women/apparels.html?affint=women-topmenu,1799,Clothing,trouser,arrow,http://im6.ybndc.com/upload/287446/ProductRear635036281317461219.jpg,2199,,Women,http://www.yebhi.com/287446/PD/arrow-grey-women-formal-trousers.htm,yebhi.com,Arrow Grey Women - Formal Trousers Buy Online,Arrow Grey Women - Formal Trousers  Best Price Rs 1799.00 Best Discount 18% Off EMI Rs 300 for 6 months FREE Shipping in 2 Days,26303234,<div class="product_detail_columns tinyscrl" itemprop="description" style=""><div class="scrollbar" style="width:2px; height:250px; background:#9E9E9E;"><div class="track" style="width:2px;"><div class="thumb" style="width:6px;"><div class="end"> </div></div></div></div><div class="viewport" style=" height:250px; width:252px; font-family:Arial !important;"><div class="overview" style="text-align:justify; display:block;"><div><b>Score high on style and comfort</b> with these formal trousers by Arrow. <b>Soft cotton material with stripes pattern in grey  </b>it makes your boring formal look interesting. Mix your bright coloured shirts with this grey trouser.<br/><br/><b>Features</b><ul style="margin-left: 20px;"><li type="disc">Fabric: Cotton  Linen</li><li type="disc">Colour: Grey</li><li type="disc">Closure: Button and Fly</li><li type="disc">Waist type: Mid- rise</li><li type="disc">Pockets: 4</li></ul><br/><b>Team it with </b> a formal shirt and heels.<br/><br/><b>Care Tips</b><br/>  Wash with like colours.<br/>  Do not soak  tumble dry or bleach<br/>  Mild iron<br/>  Line dry<br/><br/><b>Note:</b>The model in the image is wearing a size 28.<br/>  There may be a slight colour variation in the image from original product. </div></div></div> </div>,,16:04:2014,
287447,arrow beige women casual pants,http://www.yebhi.com/online-shopping/women/apparels.html?affint=women-topmenu,1799,Clothing,trouser,arrow,http://im6.ybndc.com/upload/287447/ProductRear635036283840153390.jpg,2199,,Women,http://www.yebhi.com/287447/PD/arrow-beige-women-casual-pants.htm,yebhi.com,Arrow Beige Women - Casual Pants Buy Online,Arrow Beige Women - Casual Pants  Best Price Rs 1759.00 Best Discount 20% Off EMI Rs 293 for 6 months FREE Shipping in 2 Days,26,<div class="product_detail_columns tinyscrl" itemprop="description" style=""><div class="scrollbar" style="width:2px; height:250px; background:#9E9E9E;"><div class="track" style="width:2px;"><div class="thumb" style="width:6px;"><div class="end"> </div></div></div></div><div class="viewport" style=" height:250px; width:252px; font-family:Arial !important;"><div class="overview" style="text-align:justify; display:block;"><div><b>Score high on style and comfort</b> with these casual trousers by Arrow. <b>Soft cotton and linen material with pin stripes in white  </b>it will make your outlook interesting. Mix and natch it with your favourite tops and shirts.<br/><br/><b>Features</b><ul style="margin-left: 20px;"><li type="disc">Fabric: Cotton  Linen</li><li type="disc">Colour: Beige</li><li type="disc">Closure: Button and Fly</li><li type="disc">Waist type: Mid- rise</li><li type="disc">Pockets: 4</li></ul><br/><b>Team it with </b>a bright vest and a big wrist watch.<br/><br/><b>Care Tips</b><br/>  Do not bleach or dry clean<br/>  Wash with like colours<br/>  Line dry<br/>  Warm iron<br/><b>Note:</b>The model in the image is wearing a size 28.<br/>  There may be a slight colour variation in the image from original product. </div></div></div> </div>,,16:04:2014,
