282432,red riding blue women cotton stoles,http://www.yebhi.com/online-shopping/women/apparels.html?affint=women-topmenu,424,Clothing,shawls-and-stoles,red-riding,http://im6.ybndc.com/upload/282432/ProductRear635006940297417926.jpg,499,,Women,http://www.yebhi.com/282432/PD/red-riding-blue-women-cotton-stoles.htm,yebhi.com,Red Riding Blue Women Cotton - Stoles Buy Online,Red Riding Blue Women Cotton - Stoles  Best Price Rs 424.00 Best Discount 15% Off EMI Rs 71 for 6 months,None,<div class="product_detail_columns tinyscrl" itemprop="description" style=""><div class="scrollbar" style="width:2px; height:250px; background:#9E9E9E;"><div class="track" style="width:2px;"><div class="thumb" style="width:6px;"><div class="end"> </div></div></div></div><div class="viewport" style=" height:250px; width:252px; font-family:Arial !important;"><div class="overview" style="text-align:justify; display:block;"><div>Look sensational in this <b>two shade stole </b>from Red Riding. The combination of the colour <b>midnight blue </b>with a lighter shade of the same colour makes it a must have article. Flaunt it for any <b>casual occasion </b>and make heads turn with the <b>fashion statement</b> that you would be making with this stole.<b>Features</b><ul style="margin-left: 20px;"><li type="disc">Fabric: Cotton</li><li type="disc">Colour: Blue</li><li type="disc">Pattern: Solid</li><li type="disc">Dimensions:50 X 180cms</li><li type="disc">Usage: Casual</li></ul><b>Drape it with</b> a lighter colour dress or casual wear and team it with a statement neck piece to make an ultimate fashion statement. <b>Wash &amp; Care:</b>Do not bleach or dry clean<br>Wash with like colours<br>Line dry<br>Warm iron</br></br><b>Note:</b> There may be a slight colour variation in the image from original product.  </br></div></div></div> </div>,,16:04:2014,
282424,red riding orange women cotton stoles,http://www.yebhi.com/online-shopping/women/apparels.html?affint=women-topmenu,424,Clothing,shawls-and-stoles,red-riding,http://im6.ybndc.com/upload/282424/ProductRear635006999760787099.jpg,499,,Women,http://www.yebhi.com/282424/PD/red-riding-orange-women-cotton-stoles.htm,yebhi.com,Red Riding Orange Women Cotton - Stoles Buy Online,Red Riding Orange Women Cotton - Stoles  Best Price Rs 424.00 Best Discount 15% Off EMI Rs 71 for 6 months,None,<div class="product_detail_columns tinyscrl" itemprop="description" style=""><div class="scrollbar" style="width:2px; height:250px; background:#9E9E9E;"><div class="track" style="width:2px;"><div class="thumb" style="width:6px;"><div class="end"> </div></div></div></div><div class="viewport" style=" height:250px; width:252px; font-family:Arial !important;"><div class="overview" style="text-align:justify; display:block;"><div>Soar high in terms of fashion with this <b>orange bird printed</b> stole from the house of Red Riding. The <b>birds printed in white on a orange background and ball fringe detailing</b> will give you a look above all and also add a delicate charm.<b>Features</b><ul style="margin-left: 20px;"><li type="disc">Fabric: Cotton</li><li type="disc">Colour: Orange and White</li><li type="disc">Pattern: Bird Print</li><li type="disc">Dimensions:50 X 180cms</li><li type="disc">Usage: Casual</li></ul><b>Drape it with</b> solid colour T-shirt or shirt and sling bag to get a lively look. <b>Wash &amp; Care:</b>Do not bleach or dry clean<br>Wash with like colours<br>Line dry<br>Warm iron</br></br><b>Note:</b> There may be a slight colour variation in the image from original product.  </br></div></div></div> </div>,,16:04:2014,
282383,red riding green women cotton stoles,http://www.yebhi.com/online-shopping/women/apparels.html?affint=women-topmenu,474,Clothing,shawls-and-stoles,red-riding,http://im6.ybndc.com/upload/282383/ProductRear635006999553149768.jpg,599,,Women,http://www.yebhi.com/282383/PD/red-riding-green-women-cotton-stoles.htm,yebhi.com,Red Riding Green Women Cotton - Stoles Buy Online,Red Riding Green Women Cotton - Stoles  Best Price Rs 474.00 Best Discount 21% Off EMI Rs 79 for 6 months,None,<div class="product_detail_columns tinyscrl" itemprop="description" style=""><div class="scrollbar" style="width:2px; height:250px; background:#9E9E9E;"><div class="track" style="width:2px;"><div class="thumb" style="width:6px;"><div class="end"> </div></div></div></div><div class="viewport" style=" height:250px; width:252px; font-family:Arial !important;"><div class="overview" style="text-align:justify; display:block;"><div>This <b>geometric printed </b>stole from the brand Red Riding will give a relaxed and joyous look  particularly with the prints and the colour. Get <b>trendy effortlessly</b> and look ramp ready always.<b>Features</b><ul style="margin-left: 20px;"><li type="disc">Fabric: Cotton</li><li type="disc">Colour: Green and Purple</li><li type="disc">Pattern: Geometric Prints </li><li type="disc">Dimensions:100X 180cms</li><li type="disc">Usage: Casual</li></ul><b>Drape it with</b> tops and shirts to be ramp ready everyday. <b>Wash &amp; Care:</b>Do not bleach or dry clean<br>Wash with like colours<br>Line dry<br>Warm iron</br></br><b>Note:</b> There may be a slight colour variation in the image from original product.  </br></div></div></div> </div>,,16:04:2014,
282376,red riding green women cotton stoles,http://www.yebhi.com/online-shopping/women/apparels.html?affint=women-topmenu,474,Clothing,shawls-and-stoles,red-riding,http://im6.ybndc.com/upload/282376/ProductRear635006985803221628.jpg,599,,Women,http://www.yebhi.com/282376/PD/red-riding-green-women-cotton-stoles.htm,yebhi.com,Red Riding Green Women Cotton - Stoles Buy Online,Red Riding Green Women Cotton - Stoles  Best Price Rs 474.00 Best Discount 21% Off EMI Rs 79 for 6 months,None,<div class="product_detail_columns tinyscrl" itemprop="description" style=""><div class="scrollbar" style="width:2px; height:250px; background:#9E9E9E;"><div class="track" style="width:2px;"><div class="thumb" style="width:6px;"><div class="end"> </div></div></div></div><div class="viewport" style=" height:250px; width:252px; font-family:Arial !important;"><div class="overview" style="text-align:justify; display:block;"><div>Crafted from <b>cotton</b>  this <b>green</b> colour stole from Red Riding will add a zing to your wardrobe. The edges are highlighted with a darker shade of green and <b>tassel detailing</b>. Team it up with ethnic or western clothes to make a statement.<b>Features</b><ul style="margin-left: 20px;"><li type="disc">Fabric: Cotton</li><li type="disc">Colour: Green</li><li type="disc">Pattern: Solid </li><li type="disc">Dimensions: 100 X 180cms</li><li type="disc">Usage: Casual</li></ul><b>Drape it with</b> shirts and tees to look different. <b>Wash &amp; Care:</b>Do not bleach or dry clean<br>Wash with like colours<br>Line dry<br>Warm iron</br></br><b>Note:</b> There may be a slight colour variation in the image from original product. </br></div></div></div> </div>,,16:04:2014,
282438,red riding blue women cotton stoles,http://www.yebhi.com/online-shopping/women/apparels.html?affint=women-topmenu,424,Clothing,shawls-and-stoles,red-riding,http://im6.ybndc.com/upload/282438/ProductRear635007874832172495.jpg,499,,Women,http://www.yebhi.com/282438/PD/red-riding-blue-women-cotton-stoles.htm,yebhi.com,Red Riding Blue Women Cotton - Stoles Buy Online,Red Riding Blue Women Cotton - Stoles  Best Price Rs 424.00 Best Discount 15% Off EMI Rs 71 for 6 months,None,<div class="product_detail_columns tinyscrl" itemprop="description" style=""><div class="scrollbar" style="width:2px; height:250px; background:#9E9E9E;"><div class="track" style="width:2px;"><div class="thumb" style="width:6px;"><div class="end"> </div></div></div></div><div class="viewport" style=" height:250px; width:252px; font-family:Arial !important;"><div class="overview" style="text-align:justify; display:block;"><div>Checks are in fashion and with this Red Riding checked stole show the fashionable side of yours. The checks in blue and white with solid blue border and lace trim detailing  adds to the beauty of this stole. Wrap it around your neck and give an exotic essence to your look.<b>Features</b><ul style="margin-left: 20px;"><li type="disc">Fabric: Cotton</li><li type="disc">Colour: Blue and White</li><li type="disc">Pattern: Solid/ Checked</li><li type="disc">Dimensions:50 X 180cms</li><li type="disc">Usage: Casual</li></ul><b>Drape it with</b> T-Shirts or Shirts and let your look be in vogue.<b>Wash &amp; Care:</b>Do not bleach or dry clean<br>Wash with like colours<br>Line dry<br>Warm iron</br></br><b>Note:</b> There may be a slight colour variation in the image from original product. </br></div></div></div> </div>,,16:04:2014,
282447,red riding brown cotton women stoles,http://www.yebhi.com/online-shopping/women/apparels.html?affint=women-topmenu,449,Clothing,shawls-and-stoles,red-riding,http://im6.ybndc.com/upload/282447/ProductRear635007007030433699.jpg,499,,Women,http://www.yebhi.com/282447/PD/red-riding-brown-cotton-women-stoles.htm,yebhi.com,Red Riding Brown Cotton Women - Stoles Buy Online,Red Riding Brown Cotton Women - Stoles  Best Price Rs 449.00 Best Discount 10% Off EMI Rs 75 for 6 months,None,<div class="product_detail_columns tinyscrl" itemprop="description" style=""><div class="scrollbar" style="width:2px; height:250px; background:#9E9E9E;"><div class="track" style="width:2px;"><div class="thumb" style="width:6px;"><div class="end"> </div></div></div></div><div class="viewport" style=" height:250px; width:252px; font-family:Arial !important;"><div class="overview" style="text-align:justify; display:block;"><div>Redefine style with this <b>unique</b> stole from Red Riding. In the <b>colour rust and the long ball fringes </b>add an edge above others. Wrap it around your neck to make a very different <b> fashion statement</b> which will make you stand apart in the crowd.<b>Features</b><ul style="margin-left: 20px;"><li type="disc">Fabric: Cotton</li><li type="disc">Colour: Brown</li><li type="disc">Pattern: Solid</li><li type="disc">Dimensions: 50 X 180cms</li><li type="disc">Usage: Fashion</li></ul><b>Drape it with</b> dark  short dresses to make a unique fashion statement. <b>Wash &amp; Care:</b>Do not bleach or dry clean<br>Wash with like colours<br>Line dry<br>Warm iron</br></br><b>Note:</b> There may be a slight colour variation in the image from original product. </br></div></div></div> </div>,,16:04:2014,
282435,red riding green women cotton stoles,http://www.yebhi.com/online-shopping/women/apparels.html?affint=women-topmenu,424,Clothing,shawls-and-stoles,red-riding,http://im6.ybndc.com/upload/282435/ProductRear635006952040081199.jpg,499,,Women,http://www.yebhi.com/282435/PD/red-riding-green-women-cotton-stoles.htm,yebhi.com,Red Riding Green Women Cotton - Stoles Buy Online,Red Riding Green Women Cotton - Stoles  Best Price Rs 424.00 Best Discount 15% Off EMI Rs 71 for 6 months,None,<div class="product_detail_columns tinyscrl" itemprop="description" style=""><div class="scrollbar" style="width:2px; height:250px; background:#9E9E9E;"><div class="track" style="width:2px;"><div class="thumb" style="width:6px;"><div class="end"> </div></div></div></div><div class="viewport" style=" height:250px; width:252px; font-family:Arial !important;"><div class="overview" style="text-align:justify; display:block;"><div>Redefine <b>classy look</b> with this beautiful scarf from Red Riding. The colour <b>green with lace trims and intricate stitch detailing</b> will enhance your look and give a divine radiance.<b>Features</b><ul style="margin-left: 20px;"><li type="disc">Fabric: Cotton</li><li type="disc">Colour: Green</li><li type="disc">Pattern: Solid with intricate detailing</li><li type="disc">Dimensions:50 X 180cms</li><li type="disc">Usage: Casual</li></ul><b>Drape it with</b> light colour shirt or T-shirts to get an exquisite look.<b>Wash &amp; Care:</b>Do not bleach or dry clean<br>Wash with like colours<br>Line dry<br>Warm iron</br></br><b>Note:</b> There may be a slight colour variation in the image from original product.  </br></div></div></div> </div>,,16:04:2014,
282352,red riding brown cotton women stoles,http://www.yebhi.com/online-shopping/women/apparels.html?affint=women-topmenu,474,Clothing,shawls-and-stoles,red-riding,http://im6.ybndc.com/upload/282352/ProductRear635006984903407860.jpg,599,,Women,http://www.yebhi.com/282352/PD/red-riding-brown-cotton-women-stoles.htm,yebhi.com,Red Riding Brown Cotton Women - Stoles Buy Online,Red Riding Brown Cotton Women - Stoles  Best Price Rs 474.00 Best Discount 21% Off EMI Rs 79 for 6 months,None,<div class="product_detail_columns tinyscrl" itemprop="description" style=""><div class="scrollbar" style="width:2px; height:250px; background:#9E9E9E;"><div class="track" style="width:2px;"><div class="thumb" style="width:6px;"><div class="end"> </div></div></div></div><div class="viewport" style=" height:250px; width:252px; font-family:Arial !important;"><div class="overview" style="text-align:justify; display:block;"><div>Stand apart with this <b>zig zag printed</b> scarf from Red Riding in red and grey colours. It has tassel detailing on the corners. Throw in this cotton scarf with your daily clothes and look stunning.<b>Features</b><ul style="margin-left: 20px;"><li type="disc">Fabric: Cotton</li><li type="disc">Colour: Red  Grey and Black</li><li type="disc">Pattern: Zig Zag</li><li type="disc">Dimensions: 100 X 180cms</li><li type="disc">Usage: Casual</li></ul><b>Drape it with</b> tops in shades of red and blue denims to complete the look.<b>Wash &amp; Care:</b>Do not bleach or dry clean<br>Wash with like colours<br>Line dry<br>Warm iron</br></br><b>Note:</b> There may be a slight colour variation in the image from original product.  </br></div></div></div> </div>,,16:04:2014,
282379,red riding beige cotton women stoles,http://www.yebhi.com/online-shopping/women/apparels.html?affint=women-topmenu,424,Clothing,shawls-and-stoles,red-riding,http://im6.ybndc.com/upload/282379/ProductRear635006949101490362.jpg,499,,Women,http://www.yebhi.com/282379/PD/red-riding-beige-cotton-women-stoles.htm,yebhi.com,Red Riding Beige Cotton Women - Stoles Buy Online,Red Riding Beige Cotton Women - Stoles  Best Price Rs 424.00 Best Discount 15% Off EMI Rs 71 for 6 months,None,<div class="product_detail_columns tinyscrl" itemprop="description" style=""><div class="scrollbar" style="width:2px; height:250px; background:#9E9E9E;"><div class="track" style="width:2px;"><div class="thumb" style="width:6px;"><div class="end"> </div></div></div></div><div class="viewport" style=" height:250px; width:252px; font-family:Arial !important;"><div class="overview" style="text-align:justify; display:block;"><div>Look gorgeous in this <b>crushed cotton beige stole</b> from Red Riding. The crushed look with tassels will add glamour to your dresses and make you look outstanding.<b>Features</b><ul style="margin-left: 20px;"><li type="disc">Fabric: Cotton</li><li type="disc">Colour: Beige </li><li type="disc">Pattern: Solid/ Crushed</li><li type="disc">Dimensions:50 X 180cms</li><li type="disc">Usage: Casual</li></ul><b>Drape it with</b> any dress and give your a gorgeous look.<b>Wash &amp; Care:</b>Do not bleach or dry clean<br>Wash with like colours<br>Line dry<br>Warm iron</br></br><b>Note:</b> There may be a slight colour variation in the image from original product.  </br></div></div></div> </div>,,16:04:2014,
282349,red riding white women cotton stoles,http://www.yebhi.com/online-shopping/women/apparels.html?affint=women-topmenu,474,Clothing,shawls-and-stoles,red-riding,http://im6.ybndc.com/upload/282349/ProductRear635024979631619967.jpg,599,,Women,http://www.yebhi.com/282349/PD/red-riding-white-women-cotton-stoles.htm,yebhi.com,Red Riding White Women Cotton - Stoles Buy Online,Red Riding White Women Cotton - Stoles  Best Price Rs 474.00 Best Discount 21% Off EMI Rs 79 for 6 months,None,<div class="product_detail_columns tinyscrl" itemprop="description" style=""><div class="scrollbar" style="width:2px; height:250px; background:#9E9E9E;"><div class="track" style="width:2px;"><div class="thumb" style="width:6px;"><div class="end"> </div></div></div></div><div class="viewport" style=" height:250px; width:252px; font-family:Arial !important;"><div class="overview" style="text-align:justify; display:block;"><div><table><tr><td><b>Colour</b></td><td>    </td><td>Purple   White</td></tr><tr><td><b>For</b></td><td>    </td><td>Women</td></tr><tr><td><b>Material</b></td><td>    </td><td>Cotton</td></tr><tr><td><b>Brands</b></td><td>    </td><td>Red Riding</td></tr><tr><td><b>Departments</b></td><td>    </td><td>Apparels</td></tr><tr><td><b>Category</b></td><td>    </td><td>Shawls and Stoles</td></tr><tr><td><b>Types</b></td><td>    </td><td>Stoles</td></tr></table>  </div></div></div> </div>,,16:04:2014,
282433,red riding brown women cotton stoles,http://www.yebhi.com/online-shopping/women/apparels.html?affint=women-topmenu,424,Clothing,shawls-and-stoles,red-riding,http://im6.ybndc.com/upload/282433/ProductRear635007003359418167.jpg,499,,Women,http://www.yebhi.com/282433/PD/red-riding-brown-women-cotton-stoles.htm,yebhi.com,Red Riding Brown Women Cotton - Stoles Buy Online,Red Riding Brown Women Cotton - Stoles  Best Price Rs 424.00 Best Discount 15% Off EMI Rs 71 for 6 months,None,<div class="product_detail_columns tinyscrl" itemprop="description" style=""><div class="scrollbar" style="width:2px; height:250px; background:#9E9E9E;"><div class="track" style="width:2px;"><div class="thumb" style="width:6px;"><div class="end"> </div></div></div></div><div class="viewport" style=" height:250px; width:252px; font-family:Arial !important;"><div class="overview" style="text-align:justify; display:block;"><div>From the house of Red Riding  comes this sophisticated stole in brown. The <b>intricate embroidered detailing  along with the tassels </b>will give you an ethnic as well as a contemporary look. Wrap this <b>cotton </b>stole around your neck and it will make you stand apart in the crowd.<b>Features</b><ul style="margin-left: 20px;"><li type="disc">Fabric: Cotton</li><li type="disc">Colour: Brown</li><li type="disc">Pattern: Solid with intricate detailing</li><li type="disc">Dimensions:50 X 180cms</li><li type="disc">Usage: Casual</li></ul><b>Drape it with</b> dark or light colour casual wear and exude sophistication along with uniqueness. <b>Wash &amp; Care:</b>Do not bleach or dry clean<br>Wash with like colours<br>Line dry<br>Warm iron</br></br><b>Note:</b> There may be a slight colour variation in the image from original product. </br></div></div></div> </div>,,16:04:2014,
282381,red riding purple women cotton stoles,http://www.yebhi.com/online-shopping/women/apparels.html?affint=women-topmenu,424,Clothing,shawls-and-stoles,red-riding,http://im6.ybndc.com/upload/282381/ProductRear635006940130652857.jpg,499,,Women,http://www.yebhi.com/282381/PD/red-riding-purple-women-cotton-stoles.htm,yebhi.com,Red Riding Purple Women Cotton - Stoles Buy Online,Red Riding Purple Women Cotton - Stoles  Best Price Rs 424.00 Best Discount 15% Off EMI Rs 71 for 6 months,None,<div class="product_detail_columns tinyscrl" itemprop="description" style=""><div class="scrollbar" style="width:2px; height:250px; background:#9E9E9E;"><div class="track" style="width:2px;"><div class="thumb" style="width:6px;"><div class="end"> </div></div></div></div><div class="viewport" style=" height:250px; width:252px; font-family:Arial !important;"><div class="overview" style="text-align:justify; display:block;"><div>The <b>intense colour and floral self print in dual tone</b> of purple will enrich your look with a royal feeling. It is from the house of Red Riding. Adding this stole will make your look more alive and animated.<b>Features</b><ul style="margin-left: 20px;"><li type="disc">Fabric: Cotton</li><li type="disc">Colour: Purple</li><li type="disc">Pattern: Self Printed</li><li type="disc">Dimensions:50 X 180cms</li><li type="disc">Usage: Casual</li></ul><b>Drape it with</b> summer dresses and shirts to get a queenly look and feel.<b>Wash &amp; Care:</b>Do not bleach or dry clean<br>Wash with like colours<br>Line dry<br>Warm iron</br></br><b>Note:</b> There may be a slight colour variation in the image from original product.  </br></div></div></div> </div>,,16:04:2014,
282442,red riding brown women cotton stoles,http://www.yebhi.com/online-shopping/women/apparels.html?affint=women-topmenu,424,Clothing,shawls-and-stoles,red-riding,http://im6.ybndc.com/upload/282442/ProductRear635007006855088575.jpg,499,,Women,http://www.yebhi.com/282442/PD/red-riding-brown-women-cotton-stoles.htm,yebhi.com,Red Riding Brown Women Cotton - Stoles Buy Online,Red Riding Brown Women Cotton - Stoles  Best Price Rs 424.00 Best Discount 15% Off EMI Rs 71 for 6 months,None,<div class="product_detail_columns tinyscrl" itemprop="description" style=""><div class="scrollbar" style="width:2px; height:250px; background:#9E9E9E;"><div class="track" style="width:2px;"><div class="thumb" style="width:6px;"><div class="end"> </div></div></div></div><div class="viewport" style=" height:250px; width:252px; font-family:Arial !important;"><div class="overview" style="text-align:justify; display:block;"><div>Crafted with <b>cotton</b>  this brown stole from Red Riding defines style. The <b>twin shades of brown with the lighter shade on the body and darker shade on the border along with the lace trims and tassel </b>detailing adds a different edge to this stole.<b>Features</b><ul style="margin-left: 20px;"><li type="disc">Fabric: Cotton</li><li type="disc">Colour: Brown</li><li type="disc">Pattern: Solid</li><li type="disc">Dimensions:50 X 180cms</li><li type="disc">Usage: Casual</li></ul><b>Drape it with</b> T-Shirts or dresses and wedges to complete the look.<b>Wash &amp; Care:</b>Do not bleach or dry clean<br>Wash with like colours<br>Line dry<br>Warm iron</br></br><b>Note:</b> There may be a slight colour variation in the image from original product.    </br></div></div></div> </div>,,16:04:2014,
282428,red riding white women cotton stoles,http://www.yebhi.com/online-shopping/women/apparels.html?affint=women-topmenu,424,Clothing,shawls-and-stoles,red-riding,http://im6.ybndc.com/upload/282428/ProductRear635007874041559427.jpg,499,,Women,http://www.yebhi.com/282428/PD/red-riding-white-women-cotton-stoles.htm,yebhi.com,Red Riding White Women Cotton - Stoles Buy Online,Red Riding White Women Cotton - Stoles  Best Price Rs 424.00 Best Discount 15% Off EMI Rs 71 for 6 months,None,<div class="product_detail_columns tinyscrl" itemprop="description" style=""><div class="scrollbar" style="width:2px; height:250px; background:#9E9E9E;"><div class="track" style="width:2px;"><div class="thumb" style="width:6px;"><div class="end"> </div></div></div></div><div class="viewport" style=" height:250px; width:252px; font-family:Arial !important;"><div class="overview" style="text-align:justify; display:block;"><div>Get a <b>blooming look </b>with this delicate looking floral printed stole from Red Riding. The delicate looking <b>floral prints on a white base  lace trims and also the brown printed detailing</b> gives it the finest look. This stole will give you an elite look.<b>Features</b><ul style="margin-left: 20px;"><li type="disc">Fabric: Cotton</li><li type="disc">Colour: White  Brown and Pink</li><li type="disc">Pattern: Floral Printed</li><li type="disc">Dimensions:50 X 180cms</li><li type="disc">Usage: Casual</li></ul><b>Drape it with</b> summer dresses and casual wear to add harm to your look. <b>Wash &amp; Care:</b>Do not bleach or dry clean<br>Wash with like colours<br>Line dry<br>Warm iron</br></br><b>Note:</b> There may be a slight colour variation in the image from original product.  </br></div></div></div> </div>,,16:04:2014,
282361,red riding brown women cotton stoles,http://www.yebhi.com/online-shopping/women/apparels.html?affint=women-topmenu,424,Clothing,shawls-and-stoles,red-riding,http://im6.ybndc.com/upload/282361/ProductRear635007800265878509.jpg,499,,Women,http://www.yebhi.com/282361/PD/red-riding-brown-women-cotton-stoles.htm,yebhi.com,Red Riding Brown Women Cotton - Stoles Buy Online,Red Riding Brown Women Cotton - Stoles  Best Price Rs 424.00 Best Discount 15% Off EMI Rs 71 for 6 months,None,<div class="product_detail_columns tinyscrl" itemprop="description" style=""><div class="scrollbar" style="width:2px; height:250px; background:#9E9E9E;"><div class="track" style="width:2px;"><div class="thumb" style="width:6px;"><div class="end"> </div></div></div></div><div class="viewport" style=" height:250px; width:252px; font-family:Arial !important;"><div class="overview" style="text-align:justify; display:block;"><div>Get an ethnic appeal with this <b>beige</b> scarf from Red Riding. The<b> intricate detailing on the sides along with the tassels </b>gives the scarf an elegant look which you will love.<b>Features</b><ul style="margin-left: 20px;"><li type="disc">Fabric: Cotton</li><li type="disc">Colour: Beige </li><li type="disc">Pattern: Solid with intricate details</li><li type="disc">Dimensions: 50 X 180cms</li><li type="disc">Usage: Casual</li></ul><b>Drape it with</b> dark or light tops to get a graceful look with a hint of traditional appeal. <b>Wash &amp; Care:</b>Do not bleach or dry clean<br>Wash with like colours<br>Line dry<br>Warm iron</br></br><b>Note:</b> There may be a slight colour variation in the image from original product. </br></div></div></div> </div>,,16:04:2014,
