282430,red riding white women cotton stoles,http://www.yebhi.com/online-shopping/women/apparels.html?affint=women-topmenu,424,Clothing,shawls-and-stoles,red-riding,http://im6.ybndc.com/upload/282430/ProductRear635006951812943743.jpg,499,,Women,http://www.yebhi.com/282430/PD/red-riding-white-women-cotton-stoles.htm,yebhi.com,Red Riding White Women Cotton - Stoles Buy Online,Red Riding White Women Cotton - Stoles  Best Price Rs 424.00 Best Discount 15% Off EMI Rs 71 for 6 months,None,<div class="product_detail_columns tinyscrl" itemprop="description" style=""><div class="scrollbar" style="width:2px; height:250px; background:#9E9E9E;"><div class="track" style="width:2px;"><div class="thumb" style="width:6px;"><div class="end"> </div></div></div></div><div class="viewport" style=" height:250px; width:252px; font-family:Arial !important;"><div class="overview" style="text-align:justify; display:block;"><div>From Red Riding comes this <b>trendy looking monochrome abstract printed </b>stole. The <b>lace trims and tassel detailing</b> adds to the chic look. Crafted in cotton makes it <b>comfortable </b>and you will love to flaunt it at all the casual occasions.<b>Features</b><ul style="margin-left: 20px;"><li type="disc">Fabric: Cotton</li><li type="disc">Colour: White and Black</li><li type="disc">Pattern: Abstract Printed </li><li type="disc">Dimensions:50 X 180cms</li><li type="disc">Usage: Casual</li></ul><b>Drape it with</b> any casual wear to get a trendy and stylish look.<b>Wash &amp; Care:</b>Do not bleach or dry clean<br>Wash with like colours<br>Line dry<br>Warm iron</br></br><b>Note:</b> There may be a slight colour variation in the image from original product.  </br></div></div></div> </div>,,16:04:2014,
282362,red riding blue cotton women stoles,http://www.yebhi.com/online-shopping/women/apparels.html?affint=women-topmenu,424,Clothing,shawls-and-stoles,red-riding,http://im6.ybndc.com/upload/282362/ProductRear635006985499019678.jpg,499,,Women,http://www.yebhi.com/282362/PD/red-riding-blue-cotton-women-stoles.htm,yebhi.com,Red Riding Blue Cotton Women - Stoles Buy Online,Red Riding Blue Cotton Women - Stoles  Best Price Rs 424.00 Best Discount 15% Off EMI Rs 71 for 6 months,None,<div class="product_detail_columns tinyscrl" itemprop="description" style=""><div class="scrollbar" style="width:2px; height:250px; background:#9E9E9E;"><div class="track" style="width:2px;"><div class="thumb" style="width:6px;"><div class="end"> </div></div></div></div><div class="viewport" style=" height:250px; width:252px; font-family:Arial !important;"><div class="overview" style="text-align:justify; display:block;"><div>Get flirty with this multi colour floral printed scarf from Red Riding. The print with black lace trim detailing and yellow tassels on the edges gives it a feminine charm.<b>Features</b><ul style="margin-left: 20px;"><li type="disc">Fabric: Cotton</li><li type="disc">Colour: Multicolour </li><li type="disc">Pattern: Floral Prints</li><li type="disc">Dimensions: 50 X 180cms</li><li type="disc">Usage: Casual</li></ul><b>Drape it with</b> dark or light tops or dresses to get a feminine look.<b>Wash &amp; Care:</b>Do not bleach or dry clean<br>Wash with like colours<br>Line dry<br>Warm iron</br></br><b>Note:</b> There may be a slight colour variation in the image from original product. </br></div></div></div> </div>,,16:04:2014,
282382,red riding orange women cotton stoles,http://www.yebhi.com/online-shopping/women/apparels.html?affint=women-topmenu,474,Clothing,shawls-and-stoles,red-riding,http://im6.ybndc.com/upload/282382/ProductRear635006949338923884.jpg,599,,Women,http://www.yebhi.com/282382/PD/red-riding-orange-women-cotton-stoles.htm,yebhi.com,Red Riding Orange Women Cotton - Stoles Buy Online,Red Riding Orange Women Cotton - Stoles  Best Price Rs 474.00 Best Discount 21% Off EMI Rs 79 for 6 months,None,<div class="product_detail_columns tinyscrl" itemprop="description" style=""><div class="scrollbar" style="width:2px; height:250px; background:#9E9E9E;"><div class="track" style="width:2px;"><div class="thumb" style="width:6px;"><div class="end"> </div></div></div></div><div class="viewport" style=" height:250px; width:252px; font-family:Arial !important;"><div class="overview" style="text-align:justify; display:block;"><div>This <b>geometric printed </b>stole from the brand Red Riding will give a relaxed and joyous look  particularly with the prints and the colour. Get <b>trendy effortlessly</b> and look ramp ready always.<b>Features</b><ul style="margin-left: 20px;"><li type="disc">Fabric: Cotton</li><li type="disc">Colour: Orange  Beige and Purple</li><li type="disc">Pattern: Geometric Prints </li><li type="disc">Dimensions:100X 180cms</li><li type="disc">Usage: Casual</li></ul><b>Drape it with</b> tops and shirts to be ramp ready everyday. <b>Wash &amp; Care:</b>Do not bleach or dry clean<br>Wash with like colours<br>Line dry<br>Warm iron</br></br><b>Note:</b> There may be a slight colour variation in the image from original product.  </br></div></div></div> </div>,,16:04:2014,
282365,red riding white women cotton stoles,http://www.yebhi.com/online-shopping/women/apparels.html?affint=women-topmenu,424,Clothing,shawls-and-stoles,red-riding,http://im6.ybndc.com/upload/282365/ProductRear635006996105371667.jpg,499,,Women,http://www.yebhi.com/282365/PD/red-riding-white-women-cotton-stoles.htm,yebhi.com,Red Riding White Women Cotton - Stoles Buy Online,Red Riding White Women Cotton - Stoles  Best Price Rs 424.00 Best Discount 15% Off EMI Rs 71 for 6 months,None,<div class="product_detail_columns tinyscrl" itemprop="description" style=""><div class="scrollbar" style="width:2px; height:250px; background:#9E9E9E;"><div class="track" style="width:2px;"><div class="thumb" style="width:6px;"><div class="end"> </div></div></div></div><div class="viewport" style=" height:250px; width:252px; font-family:Arial !important;"><div class="overview" style="text-align:justify; display:block;"><div>From Red riding comes this <b>ultra feminine scarf.</b> It is <b>floral printed</b> with red and green colours in a white background and has tassel detailing on the sides. Drape it to get a <b>gorgeous and graceful</b> look.<b>Features</b><ul style="margin-left: 20px;"><li type="disc">Fabric: Cotton</li><li type="disc">Colour: Red  Green and White</li><li type="disc">Pattern: Floral Prints</li><li type="disc">Dimensions: 50 X 180cms</li><li type="disc">Usage: Casual</li></ul><b>Drape it with</b> evening dresses or casual top and denims to look elegant.<b>Wash &amp; Care:</b>Do not bleach or dry clean<br>Wash with like colours<br>Line dry<br>Warm iron</br></br><b>Note:</b> There may be a slight colour variation in the image from original product. </br></div></div></div> </div>,,16:04:2014,
282444,red riding blue women cotton stoles,http://www.yebhi.com/online-shopping/women/apparels.html?affint=women-topmenu,424,Clothing,shawls-and-stoles,red-riding,http://im6.ybndc.com/upload/282444/ProductRear635007801710447769.jpg,499,,Women,http://www.yebhi.com/282444/PD/red-riding-blue-women-cotton-stoles.htm,yebhi.com,Red Riding Blue Women Cotton - Stoles Buy Online,Red Riding Blue Women Cotton - Stoles  Best Price Rs 424.00 Best Discount 15% Off EMI Rs 71 for 6 months,None,<div class="product_detail_columns tinyscrl" itemprop="description" style=""><div class="scrollbar" style="width:2px; height:250px; background:#9E9E9E;"><div class="track" style="width:2px;"><div class="thumb" style="width:6px;"><div class="end"> </div></div></div></div><div class="viewport" style=" height:250px; width:252px; font-family:Arial !important;"><div class="overview" style="text-align:justify; display:block;"><div>Simplicity is the what this stole from Red Riding defines. The <b>horizontal stripes in the colours blue and white </b>will give your look a simple yet <b>appealing </b>look which will be loved by all. It will suit any casual occasion and give you a charismatic look.<b>Features</b><ul style="margin-left: 20px;"><li type="disc">Fabric: Cotton</li><li type="disc">Colour: Blue and White</li><li type="disc">Pattern: Stripes</li><li type="disc">Dimensions: 50 X 180cms</li><li type="disc">Usage: Casual</li></ul><b>Drape it with</b> T-Shirts and denim get that innocent yet appealing look.<b>Wash &amp; Care:</b>Do not bleach or dry clean<br>Wash with like colours<br>Line dry<br>Warm iron</br></br><b>Note:</b> There may be a slight colour variation in the image from original product.  </br></div></div></div> </div>,,16:04:2014,
282443,red riding beige cotton women stoles,http://www.yebhi.com/online-shopping/women/apparels.html?affint=women-topmenu,424,Clothing,shawls-and-stoles,red-riding,http://im6.ybndc.com/upload/282443/ProductRear635006940719088629.jpg,499,,Women,http://www.yebhi.com/282443/PD/red-riding-beige-cotton-women-stoles.htm,yebhi.com,Red Riding Beige Cotton Women - Stoles Buy Online,Red Riding Beige Cotton Women - Stoles  Best Price Rs 424.00 Best Discount 15% Off EMI Rs 71 for 6 months,None,<div class="product_detail_columns tinyscrl" itemprop="description" style=""><div class="scrollbar" style="width:2px; height:250px; background:#9E9E9E;"><div class="track" style="width:2px;"><div class="thumb" style="width:6px;"><div class="end"> </div></div></div></div><div class="viewport" style=" height:250px; width:252px; font-family:Arial !important;"><div class="overview" style="text-align:justify; display:block;"><div>Add<b> splendor</b> to your wardrobe with this admirable stole from Red Riding. Crafted from <b>cotton</b>  the <b>crushed look in beige with intricate detailing</b> adds a creative air to your look. Sport it and let the people know your fashion sense.<b>Features</b><ul style="margin-left: 20px;"><li type="disc">Fabric: Cotton</li><li type="disc">Colour: Beige</li><li type="disc">Pattern: Solid</li><li type="disc">Dimensions: 50 X 180cms</li><li type="disc">Usage: Casual</li></ul><b>Drape it with</b> T-Shirts or dresses and wedges to make a fashion statement which will make heads turn. <b>Wash &amp; Care:</b>Do not bleach or dry clean<br>Wash with like colours<br>Line dry<br>Warm iron</br></br><b>Note:</b> There may be a slight colour variation in the image from original product. </br></div></div></div> </div>,,16:04:2014,
282437,red riding green women cotton stoles,http://www.yebhi.com/online-shopping/women/apparels.html?affint=women-topmenu,424,Clothing,shawls-and-stoles,red-riding,http://im6.ybndc.com/upload/282437/ProductRear635006952262694626.jpg,499,,Women,http://www.yebhi.com/282437/PD/red-riding-green-women-cotton-stoles.htm,yebhi.com,Red Riding Green Women Cotton - Stoles Buy Online,Red Riding Green Women Cotton - Stoles  Best Price Rs 424.00 Best Discount 15% Off EMI Rs 71 for 6 months,None,<div class="product_detail_columns tinyscrl" itemprop="description" style=""><div class="scrollbar" style="width:2px; height:250px; background:#9E9E9E;"><div class="track" style="width:2px;"><div class="thumb" style="width:6px;"><div class="end"> </div></div></div></div><div class="viewport" style=" height:250px; width:252px; font-family:Arial !important;"><div class="overview" style="text-align:justify; display:block;"><div>Give your look that chic and trendy twist with this dual colour stole from Red riding. The colours green and purple are so awesomely coordinated that you will get a bright look whenever you sport it. Be trendy with this stole and get complemented.<b>Features</b><ul style="margin-left: 20px;"><li type="disc">Fabric: Cotton</li><li type="disc">Colour: Green and Purple</li><li type="disc">Pattern: Solid</li><li type="disc">Dimensions:50 X 180cms</li><li type="disc">Usage: Casual</li></ul><b>Drape it with</b> T-Shirts  Shirts or dresses and be the trendiest person.<b>Wash &amp; Care:</b>Do not bleach or dry clean<br>Wash with like colours<br>Line dry<br>Warm iron</br></br><b>Note:</b> There may be a slight colour variation in the image from original product.  </br></div></div></div> </div>,,16:04:2014,
282426,red riding blue women cotton stoles,http://www.yebhi.com/online-shopping/women/apparels.html?affint=women-topmenu,424,Clothing,shawls-and-stoles,red-riding,http://im6.ybndc.com/upload/282426/ProductRear635007801447586084.jpg,499,,Women,http://www.yebhi.com/282426/PD/red-riding-blue-women-cotton-stoles.htm,yebhi.com,Red Riding Blue Women Cotton - Stoles Buy Online,Red Riding Blue Women Cotton - Stoles  Best Price Rs 424.00 Best Discount 15% Off EMI Rs 71 for 6 months,None,<div class="product_detail_columns tinyscrl" itemprop="description" style=""><div class="scrollbar" style="width:2px; height:250px; background:#9E9E9E;"><div class="track" style="width:2px;"><div class="thumb" style="width:6px;"><div class="end"> </div></div></div></div><div class="viewport" style=" height:250px; width:252px; font-family:Arial !important;"><div class="overview" style="text-align:justify; display:block;"><div>With this stole from Red Riding  add the <b>essence of flowers</b> to your look. The <b>miniature floral prints in pink on a two tone background of purple and grey </b>will give a blooming effect to your look  adding to your natural beauty.<b>Features</b><ul style="margin-left: 20px;"><li type="disc">Fabric: Cotton</li><li type="disc">Colour: Purple  Grey and Pink</li><li type="disc">Pattern: Floral Prints</li><li type="disc">Dimensions:50 X 180cms</li><li type="disc">Usage: Casual</li></ul><b>Drape it with</b> a one colour T-shirt or dress to get a charming look. <b>Wash &amp; Care:</b>Do not bleach or dry clean<br>Wash with like colours<br>Line dry<br>Warm iron</br></br><b>Note:</b> There may be a slight colour variation in the image from original product. </br></div></div></div> </div>,,16:04:2014,
282445,red riding green women cotton stoles,http://www.yebhi.com/online-shopping/women/apparels.html?affint=women-topmenu,424,Clothing,shawls-and-stoles,red-riding,http://im6.ybndc.com/upload/282445/ProductRear635007875052289906.jpg,499,,Women,http://www.yebhi.com/282445/PD/red-riding-green-women-cotton-stoles.htm,yebhi.com,Red Riding Green Women Cotton - Stoles Buy Online,Red Riding Green Women Cotton - Stoles  Best Price Rs 424.00 Best Discount 15% Off EMI Rs 71 for 6 months,None,<div class="product_detail_columns tinyscrl" itemprop="description" style=""><div class="scrollbar" style="width:2px; height:250px; background:#9E9E9E;"><div class="track" style="width:2px;"><div class="thumb" style="width:6px;"><div class="end"> </div></div></div></div><div class="viewport" style=" height:250px; width:252px; font-family:Arial !important;"><div class="overview" style="text-align:justify; display:block;"><div>Simplicity is the what this stole from Red Riding defines. The <b>horizontal stripes in the colours green and white </b>will give your look a simple yet <b>appealing </b>look which will be loved by all. It will suit any casual occasion and give you a charismatic look.<b>Features</b><ul style="margin-left: 20px;"><li type="disc">Fabric: Cotton</li><li type="disc">Colour: Green and White</li><li type="disc">Pattern: Stripes</li><li type="disc">Dimensions: 50 X 180cms</li><li type="disc">Usage: Casual</li></ul><b>Drape it with</b> T-Shirts and denim get that innocent yet appealing look.<b>Wash &amp; Care:</b>Do not bleach or dry clean<br>Wash with like colours<br>Line dry<br>Warm iron</br></br><b>Note:</b> There may be a slight colour variation in the image from original product.  </br></div></div></div> </div>,,16:04:2014,
282364,red riding brown women cotton stoles,http://www.yebhi.com/online-shopping/women/apparels.html?affint=women-topmenu,424,Clothing,shawls-and-stoles,red-riding,http://im6.ybndc.com/upload/282364/ProductRear635007767334691413.jpg,499,,Women,http://www.yebhi.com/282364/PD/red-riding-brown-women-cotton-stoles.htm,yebhi.com,Red Riding Brown Women Cotton - Stoles Buy Online,Red Riding Brown Women Cotton - Stoles  Best Price Rs 424.00 Best Discount 15% Off EMI Rs 71 for 6 months,None,<div class="product_detail_columns tinyscrl" itemprop="description" style=""><div class="scrollbar" style="width:2px; height:250px; background:#9E9E9E;"><div class="track" style="width:2px;"><div class="thumb" style="width:6px;"><div class="end"> </div></div></div></div><div class="viewport" style=" height:250px; width:252px; font-family:Arial !important;"><div class="overview" style="text-align:justify; display:block;"><div>Look stylish with this <b>brown floral printed</b> scarf. Crafted with <b>cotton and with chic design along with tassel trims</b> at the sides make it more desirable. This scarf will surely make your style statement chic and <b>exclusive.</b><b>Features</b><ul style="margin-left: 20px;"><li type="disc">Fabric: Cotton</li><li type="disc">Colour: Grey and Brown</li><li type="disc">Pattern: Floral Prints</li><li type="disc">Dimensions: 50 X 180cms</li><li type="disc">Usage: Casual</li></ul><b>Drape it with</b> casual tops and sport an exclusive style.<b>Wash &amp; Care:</b>Do not bleach or dry clean<br>Wash with like colours<br>Line dry<br>Warm iron</br></br><b>Note:</b> There may be a slight colour variation in the image from original product.  </br></div></div></div> </div>,,16:04:2014,
282423,red riding blue women cotton stoles,http://www.yebhi.com/online-shopping/women/apparels.html?affint=women-topmenu,424,Clothing,shawls-and-stoles,red-riding,http://im6.ybndc.com/upload/282423/ProductRear635006951360384842.jpg,499,,Women,http://www.yebhi.com/282423/PD/red-riding-blue-women-cotton-stoles.htm,yebhi.com,Red Riding Blue Women Cotton - Stoles Buy Online,Red Riding Blue Women Cotton - Stoles  Best Price Rs 424.00 Best Discount 15% Off EMI Rs 71 for 6 months,None,<div class="product_detail_columns tinyscrl" itemprop="description" style=""><div class="scrollbar" style="width:2px; height:250px; background:#9E9E9E;"><div class="track" style="width:2px;"><div class="thumb" style="width:6px;"><div class="end"> </div></div></div></div><div class="viewport" style=" height:250px; width:252px; font-family:Arial !important;"><div class="overview" style="text-align:justify; display:block;"><div>Give your everyday look a different deviation with this <b>abstract print</b> stole from Red Riding. The colour <b>blue </b>with abstract prints and<b> stitch detailing and lace trims </b>will add zing to your look. Be it college  outing with friends or any occasion  flaunt this stole and look unique.<b>Features</b><ul style="margin-left: 20px;"><li type="disc">Fabric: Cotton</li><li type="disc">Colour: Blue</li><li type="disc">Pattern: Abstract Print</li><li type="disc">Dimensions:50 X 180cms</li><li type="disc">Usage: Casual</li></ul><b>Drape it with</b> solid colour round neck T-shirt or shirt to get a peppy look. <b>Wash &amp; Care:</b>Do not bleach or dry clean<br>Wash with like colours<br>Line dry<br>Warm iron</br></br><b>Note:</b> There may be a slight colour variation in the image from original product.  </br></div></div></div> </div>,,16:04:2014,
282363,red riding blue women cotton stoles,http://www.yebhi.com/online-shopping/women/apparels.html?affint=women-topmenu,424,Clothing,shawls-and-stoles,red-riding,http://im6.ybndc.com/upload/282363/ProductRear635007871045872224.jpg,499,,Women,http://www.yebhi.com/282363/PD/red-riding-blue-women-cotton-stoles.htm,yebhi.com,Red Riding Blue Women Cotton - Stoles Buy Online,Red Riding Blue Women Cotton - Stoles  Best Price Rs 424.00 Best Discount 15% Off EMI Rs 71 for 6 months,None,<div class="product_detail_columns tinyscrl" itemprop="description" style=""><div class="scrollbar" style="width:2px; height:250px; background:#9E9E9E;"><div class="track" style="width:2px;"><div class="thumb" style="width:6px;"><div class="end"> </div></div></div></div><div class="viewport" style=" height:250px; width:252px; font-family:Arial !important;"><div class="overview" style="text-align:justify; display:block;"><div>Look dashing in this grey and white <b>wave inspired printed </b>scarf from Red Riding. Wrap it around your neck and get a <b>contemporary look</b> which will be admired as well as envied by all.<b>Features</b><ul style="margin-left: 20px;"><li type="disc">Fabric: Cotton</li><li type="disc">Colour: Grey and White</li><li type="disc">Pattern: Wave inspired Prints</li><li type="disc">Dimensions: 50 X 180cms</li><li type="disc">Usage: Casual</li></ul><b>Drape it with</b> casual tops to get a contemporary look.<b>Wash &amp; Care:</b>Do not bleach or dry clean<br>Wash with like colours<br>Line dry<br>Warm iron</br></br><b>Note:</b> There may be a slight colour variation in the image from original product.  </br></div></div></div> </div>,,16:04:2014,
