495203,jeepers peepers purple men wayfarer sunglasses,http://www.yebhi.com/online-shopping/lifestyle/men.html?affint=men-topmenu,1195,Accessory,sunglasses,jeepers-peepers,http://im6.ybndc.com/upload/495203/ProductRear635316205546222000.jpg,1195,,Men,http://www.yebhi.com/495203/PD/jeepers-peepers-purple-men-wayfarer-sunglasses.htm,yebhi.com,Jeepers Peepers Purple Men - Wayfarer Sunglasses Buy Online,Jeepers Peepers Purple Men - Wayfarer Sunglasses  Best Price Rs 1195.00  EMI Rs 199 for 6 months FREE Shipping In Stock - Delivery in 3-5 Days,None,<div class="product_detail_columns tinyscrl" itemprop="description" style=""><div class="scrollbar" style="width:2px; height:250px; background:#9E9E9E;"><div class="track" style="width:2px;"><div class="thumb" style="width:6px;"><div class="end"> </div></div></div></div><div class="viewport" style=" height:250px; width:252px; font-family:Arial !important;"><div class="overview" style="text-align:justify; display:block;"><div>Sunglasses by Jeepers Peepers Made from plastic and glass  Wayfarer style frame  Solid rim  UV protected tinted lens  Curved templePlastic Frame and Glass Lens </div></div></div> </div>,,16:04:2014,
495205,jeepers peepers purple men aviator sunglasses,http://www.yebhi.com/online-shopping/lifestyle/men.html?affint=men-topmenu,1495,Accessory,sunglasses,jeepers-peepers,http://im6.ybndc.com/upload/495205/ProductRear635316205554646000.jpg,1495,,Men,http://www.yebhi.com/495205/PD/jeepers-peepers-purple-men-aviator-sunglasses.htm,yebhi.com,Jeepers Peepers Purple Men - Aviator Sunglasses Buy Online,Jeepers Peepers Purple Men - Aviator Sunglasses  Best Price Rs 1495.00  EMI Rs 249 for 6 months FREE Shipping In Stock - Delivery in 3-5 Days,None,<div class="product_detail_columns tinyscrl" itemprop="description" style=""><div class="scrollbar" style="width:2px; height:250px; background:#9E9E9E;"><div class="track" style="width:2px;"><div class="thumb" style="width:6px;"><div class="end"> </div></div></div></div><div class="viewport" style=" height:250px; width:252px; font-family:Arial !important;"><div class="overview" style="text-align:justify; display:block;"><div>Sunglasses by Jeepers Peepers Made from metal and glass  UV protected tinted lens  Silicon nose pads  Contrast top bar  Cut-out bridge  Curved templeMetal Frame and Glass Lens </div></div></div> </div>,,16:04:2014,
495201,jeepers peepers white men wayfarer sunglasses,http://www.yebhi.com/online-shopping/lifestyle/men.html?affint=men-topmenu,1495,Accessory,sunglasses,jeepers-peepers,http://im6.ybndc.com/upload/495201/ProductRear635316205538578000.jpg,1495,,Men,http://www.yebhi.com/495201/PD/jeepers-peepers-white-men-wayfarer-sunglasses.htm,yebhi.com,Jeepers Peepers White Men - Wayfarer Sunglasses Buy Online,Jeepers Peepers White Men - Wayfarer Sunglasses  Best Price Rs 1495.00  EMI Rs 249 for 6 months FREE Shipping In Stock - Delivery in 3-5 Days,None,<div class="product_detail_columns tinyscrl" itemprop="description" style=""><div class="scrollbar" style="width:2px; height:250px; background:#9E9E9E;"><div class="track" style="width:2px;"><div class="thumb" style="width:6px;"><div class="end"> </div></div></div></div><div class="viewport" style=" height:250px; width:252px; font-family:Arial !important;"><div class="overview" style="text-align:justify; display:block;"><div>Sunglasses by Jeepers Peepers Made from plastic and glass?  UV protected and tinted teardrop lens  Contrast colour arms  Curved temple?Plastic Frame and Glass Lens </div></div></div> </div>,,16:04:2014,
495202,jeepers peepers brown men wayfarer sunglasses,http://www.yebhi.com/online-shopping/lifestyle/men.html?affint=men-topmenu,1195,Accessory,sunglasses,jeepers-peepers,http://im6.ybndc.com/upload/495202/ProductRear635316205542478000.jpg,1195,,Men,http://www.yebhi.com/495202/PD/jeepers-peepers-brown-men-wayfarer-sunglasses.htm,yebhi.com,Jeepers Peepers Brown Men - Wayfarer Sunglasses Buy Online,Jeepers Peepers Brown Men - Wayfarer Sunglasses  Best Price Rs 1195.00  EMI Rs 199 for 6 months FREE Shipping In Stock - Delivery in 3-5 Days,None,<div class="product_detail_columns tinyscrl" itemprop="description" style=""><div class="scrollbar" style="width:2px; height:250px; background:#9E9E9E;"><div class="track" style="width:2px;"><div class="thumb" style="width:6px;"><div class="end"> </div></div></div></div><div class="viewport" style=" height:250px; width:252px; font-family:Arial !important;"><div class="overview" style="text-align:justify; display:block;"><div>Sunglasses by Jeepers Peepers Made from plastic and glass  Wayfarer style?  Leopard print frame  UV protected tinted lens  Moulded nose pads  Curved temple ?Plastic Frame and Glass Lens </div></div></div> </div>,,16:04:2014,
495198,jeepers peepers blue men wayfarer sunglasses,http://www.yebhi.com/online-shopping/lifestyle/men.html?affint=men-topmenu,1195,Accessory,sunglasses,jeepers-peepers,http://im6.ybndc.com/upload/495198/ProductRear635316205527190000.jpg,1195,,Men,http://www.yebhi.com/495198/PD/jeepers-peepers-blue-men-wayfarer-sunglasses.htm,yebhi.com,Jeepers Peepers Blue Men - Wayfarer Sunglasses Buy Online,Jeepers Peepers Blue Men - Wayfarer Sunglasses  Best Price Rs 1195.00  EMI Rs 199 for 6 months FREE Shipping In Stock - Delivery in 3-5 Days,None,<div class="product_detail_columns tinyscrl" itemprop="description" style=""><div class="scrollbar" style="width:2px; height:250px; background:#9E9E9E;"><div class="track" style="width:2px;"><div class="thumb" style="width:6px;"><div class="end"> </div></div></div></div><div class="viewport" style=" height:250px; width:252px; font-family:Arial !important;"><div class="overview" style="text-align:justify; display:block;"><div>Sunglasses by Jeepers Peepers Made from plastic and glass?  Wayfarer style?  Clear frame and temple  UV protected tinted lens  Curved temple?Plastic Frame and Glass Lens </div></div></div> </div>,,16:04:2014,
495204,jeepers peepers brown men aviator sunglasses,http://www.yebhi.com/online-shopping/lifestyle/men.html?affint=men-topmenu,1195,Accessory,sunglasses,jeepers-peepers,http://im6.ybndc.com/upload/495204/ProductRear635316205550590000.jpg,1195,,Men,http://www.yebhi.com/495204/PD/jeepers-peepers-brown-men-aviator-sunglasses.htm,yebhi.com,Jeepers Peepers Brown Men - Aviator Sunglasses Buy Online,Jeepers Peepers Brown Men - Aviator Sunglasses  Best Price Rs 1195.00  EMI Rs 199 for 6 months FREE Shipping In Stock - Delivery in 3-5 Days,None,<div class="product_detail_columns tinyscrl" itemprop="description" style=""><div class="scrollbar" style="width:2px; height:250px; background:#9E9E9E;"><div class="track" style="width:2px;"><div class="thumb" style="width:6px;"><div class="end"> </div></div></div></div><div class="viewport" style=" height:250px; width:252px; font-family:Arial !important;"><div class="overview" style="text-align:justify; display:block;"><div>Sunglasses by Jeepers Peepers Made from metal and glass?  Aviator style frame  UV protected tinted lenses  Metallic bridge and top bar  Comfortable nose pads  Slender temple ?Metal Frame and Glass Lens </div></div></div> </div>,,16:04:2014,
495207,jeepers peepers brown men aviator sunglasses,http://www.yebhi.com/online-shopping/lifestyle/men.html?affint=men-topmenu,1195,Accessory,sunglasses,jeepers-peepers,http://im6.ybndc.com/upload/495207/ProductRear635316205562602000.jpg,1195,,Men,http://www.yebhi.com/495207/PD/jeepers-peepers-brown-men-aviator-sunglasses.htm,yebhi.com,Jeepers Peepers Brown Men - Aviator Sunglasses Buy Online,Jeepers Peepers Brown Men - Aviator Sunglasses  Best Price Rs 1195.00  EMI Rs 199 for 6 months FREE Shipping In Stock - Delivery in 3-5 Days,None,<div class="product_detail_columns tinyscrl" itemprop="description" style=""><div class="scrollbar" style="width:2px; height:250px; background:#9E9E9E;"><div class="track" style="width:2px;"><div class="thumb" style="width:6px;"><div class="end"> </div></div></div></div><div class="viewport" style=" height:250px; width:252px; font-family:Arial !important;"><div class="overview" style="text-align:justify; display:block;"><div>Sunglasses by Jeepers Peepers Made from metal and glass  UV protected and tinted teardrop lens  Silicon nose pads  Double bridge design  Slender curved templeMetal Frame and Glass Lens </div></div></div> </div>,,16:04:2014,
495206,jeepers peepers brown men aviator sunglasses,http://www.yebhi.com/online-shopping/lifestyle/men.html?affint=men-topmenu,1495,Accessory,sunglasses,jeepers-peepers,http://im6.ybndc.com/upload/495206/ProductRear635316205558390000.jpg,1495,,Men,http://www.yebhi.com/495206/PD/jeepers-peepers-brown-men-aviator-sunglasses.htm,yebhi.com,Jeepers Peepers Brown Men - Aviator Sunglasses Buy Online,Jeepers Peepers Brown Men - Aviator Sunglasses  Best Price Rs 1495.00  EMI Rs 249 for 6 months FREE Shipping In Stock - Delivery in 3-5 Days,None,<div class="product_detail_columns tinyscrl" itemprop="description" style=""><div class="scrollbar" style="width:2px; height:250px; background:#9E9E9E;"><div class="track" style="width:2px;"><div class="thumb" style="width:6px;"><div class="end"> </div></div></div></div><div class="viewport" style=" height:250px; width:252px; font-family:Arial !important;"><div class="overview" style="text-align:justify; display:block;"><div>Sunglasses by Jeepers Peepers Made from metal and glass  UV protected tinted lens  Silicon nose pads  Cut-out bridge  Slender curved templeMetal Frame and Glass Lens </div></div></div> </div>,,16:04:2014,
