495161,done by none silver women casual shoes,http://www.yebhi.com/online-shopping/women/shoes.html?affint=women-topmenu,1899,Shoes,casual-shoes,done-by-none,http://im6.ybndc.com/upload/495161/ProductRear635315516292826000.jpg,1899,,Women,http://www.yebhi.com/495161/PD/done-by-none-silver-women-casual-shoes.htm,yebhi.com,Done By None Silver Women - Casual Shoes Buy Online,Done By None Silver Women - Casual Shoes  Best Price Rs 1899.00  EMI Rs 317 for 6 months FREE Shipping In Stock - Delivery in 3-5 Days,EU 40EU 41,<div class="product_detail_columns tinyscrl" itemprop="description" style=""><div class="scrollbar" style="width:2px; height:250px; background:#9E9E9E;"><div class="track" style="width:2px;"><div class="thumb" style="width:6px;"><div class="end"> </div></div></div></div><div class="viewport" style=" height:250px; width:252px; font-family:Arial !important;"><div class="overview" style="text-align:justify; display:block;"><div>Pumps?by?Done By None Made from polyurethane  Pointed toe styling  Silver-tone glossy finish  Low cut vamp  Transparent panelling  Mid rise heels? </div></div></div> </div>,,16:04:2014,
391587,done by none grey women casual shoes,http://www.yebhi.com/online-shopping/women/shoes.html?affint=women-topmenu,1699,Shoes,casual-shoes,done-by-none,http://im6.ybndc.com/upload/391587/ProductRear635181342501561996.jpg,1699,,Women,http://www.yebhi.com/391587/PD/done-by-none-grey-women-casual-shoes.htm,yebhi.com,Done By None Grey Women - Casual Shoes Buy Online,Done By None Grey Women - Casual Shoes  Best Price Rs 1699.00  EMI Rs 283 for 6 months FREE Shipping In Stock - Delivery in 6-8 Days,EU 36EU 38,<div class="product_detail_columns tinyscrl" itemprop="description" style=""><div class="scrollbar" style="width:2px; height:250px; background:#9E9E9E;"><div class="track" style="width:2px;"><div class="thumb" style="width:6px;"><div class="end"> </div></div></div></div><div class="viewport" style=" height:250px; width:252px; font-family:Arial !important;"><div class="overview" style="text-align:justify; display:block;"><div>Black floral lace fabric  layered over off-white canvas fabric dotted with gold. Comes with black laces.. </div></div></div> </div>,,16:04:2014,
495170,done by none pink women casual shoes,http://www.yebhi.com/online-shopping/women/shoes.html?affint=women-topmenu,1899,Shoes,casual-shoes,done-by-none,http://im6.ybndc.com/upload/495170/ProductRear635315516327926000.jpg,1899,,Women,http://www.yebhi.com/495170/PD/done-by-none-pink-women-casual-shoes.htm,yebhi.com,Done By None Pink Women - Casual Shoes Buy Online,Done By None Pink Women - Casual Shoes  Best Price Rs 1899.00  EMI Rs 317 for 6 months FREE Shipping In Stock - Delivery in 3-5 Days,EU 41,<div class="product_detail_columns tinyscrl" itemprop="description" style=""><div class="scrollbar" style="width:2px; height:250px; background:#9E9E9E;"><div class="track" style="width:2px;"><div class="thumb" style="width:6px;"><div class="end"> </div></div></div></div><div class="viewport" style=" height:250px; width:252px; font-family:Arial !important;"><div class="overview" style="text-align:justify; display:block;"><div>Pumps?by?Done By None Made from polyurethane  Pointed toe styling  Glossy finish  Low cut vamp  Pencil heels </div></div></div> </div>,,16:04:2014,
391586,done by none blue women casual shoes,http://www.yebhi.com/online-shopping/women/shoes.html?affint=women-topmenu,1599,Shoes,casual-shoes,done-by-none,http://im6.ybndc.com/upload/391586/ProductRear635181345181659176.jpg,1599,,Women,http://www.yebhi.com/391586/PD/done-by-none-blue-women-casual-shoes.htm,yebhi.com,Done By None Blue Women - Casual Shoes Buy Online,Done By None Blue Women - Casual Shoes  Best Price Rs 1599.00  EMI Rs 267 for 6 months FREE Shipping in 2 Days,EU 37EU 39EU 41,<div class="product_detail_columns tinyscrl" itemprop="description" style=""><div class="scrollbar" style="width:2px; height:250px; background:#9E9E9E;"><div class="track" style="width:2px;"><div class="thumb" style="width:6px;"><div class="end"> </div></div></div></div><div class="viewport" style=" height:250px; width:252px; font-family:Arial !important;"><div class="overview" style="text-align:justify; display:block;"><div>White &amp; blue striped canvas shoes with blue laces &amp; braided canvas base. </div></div></div> </div>,,16:04:2014,
495162,done by none white women casual shoes,http://www.yebhi.com/online-shopping/women/shoes.html?affint=women-topmenu,1899,Shoes,casual-shoes,done-by-none,http://im6.ybndc.com/upload/495162/ProductRear635315516296570000.jpg,1899,,Women,http://www.yebhi.com/495162/PD/done-by-none-white-women-casual-shoes.htm,yebhi.com,Done By None White Women - Casual Shoes Buy Online,Done By None White Women - Casual Shoes  Best Price Rs 1899.00  EMI Rs 317 for 6 months FREE Shipping In Stock - Delivery in 3-5 Days,EU 39EU 40,<div class="product_detail_columns tinyscrl" itemprop="description" style=""><div class="scrollbar" style="width:2px; height:250px; background:#9E9E9E;"><div class="track" style="width:2px;"><div class="thumb" style="width:6px;"><div class="end"> </div></div></div></div><div class="viewport" style=" height:250px; width:252px; font-family:Arial !important;"><div class="overview" style="text-align:justify; display:block;"><div>Pumps?by?Done By None Made from polyurethane  Pointed toe styling  Snake skin print all over  Low cut vamp  Transparent paneling?  High rise pencil heels </div></div></div> </div>,,16:04:2014,
495169,done by none yellow women casual shoes,http://www.yebhi.com/online-shopping/women/shoes.html?affint=women-topmenu,1899,Shoes,casual-shoes,done-by-none,http://im6.ybndc.com/upload/495169/ProductRear635315516324338000.jpg,1899,,Women,http://www.yebhi.com/495169/PD/done-by-none-yellow-women-casual-shoes.htm,yebhi.com,Done By None Yellow Women - Casual Shoes Buy Online,Done By None Yellow Women - Casual Shoes  Best Price Rs 1899.00  EMI Rs 317 for 6 months FREE Shipping In Stock - Delivery in 3-5 Days,EU 39EU 41,<div class="product_detail_columns tinyscrl" itemprop="description" style=""><div class="scrollbar" style="width:2px; height:250px; background:#9E9E9E;"><div class="track" style="width:2px;"><div class="thumb" style="width:6px;"><div class="end"> </div></div></div></div><div class="viewport" style=" height:250px; width:252px; font-family:Arial !important;"><div class="overview" style="text-align:justify; display:block;"><div>Pumps?by?Done By None Made from polyurethane  Pointed toe styling  Glossy finish  Low cut vamp  Pencil heels </div></div></div> </div>,,16:04:2014,
478328,done by none red women casual shoes,http://www.yebhi.com/online-shopping/women/shoes.html?affint=women-topmenu,1599,Shoes,casual-shoes,done-by-none,http://im6.ybndc.com/upload/478328/ProductRear635290338240998000.jpg,1599,,Women,http://www.yebhi.com/478328/PD/done-by-none-red-women-casual-shoes.htm,yebhi.com,Done By None Red Women - Casual Shoes Buy Online,Done By None Red Women - Casual Shoes  Best Price Rs 1599.00  EMI Rs 267 for 6 months FREE Shipping In Stock - Delivery in 3-5 Days,EU 35EU 38,<div class="product_detail_columns tinyscrl" itemprop="description" style=""><div class="scrollbar" style="width:2px; height:250px; background:#9E9E9E;"><div class="track" style="width:2px;"><div class="thumb" style="width:6px;"><div class="end"> </div></div></div></div><div class="viewport" style=" height:250px; width:252px; font-family:Arial !important;"><div class="overview" style="text-align:justify; display:block;"><div>White &amp; red striped canvas shoes with blue laces &amp; braided canvas base. </div></div></div> </div>,,16:04:2014,
478332,done by none pink women casual shoes,http://www.yebhi.com/online-shopping/women/shoes.html?affint=women-topmenu,1799,Shoes,casual-shoes,done-by-none,http://im6.ybndc.com/upload/478332/ProductRear635290338284522000.jpg,1799,,Women,http://www.yebhi.com/478332/PD/done-by-none-pink-women-casual-shoes.htm,yebhi.com,Done By None Pink Women - Casual Shoes Buy Online,Done By None Pink Women - Casual Shoes  Best Price Rs 1799.00  EMI Rs 300 for 6 months FREE Shipping in 2 Days,EU 36,<div class="product_detail_columns tinyscrl" itemprop="description" style=""><div class="scrollbar" style="width:2px; height:250px; background:#9E9E9E;"><div class="track" style="width:2px;"><div class="thumb" style="width:6px;"><div class="end"> </div></div></div></div><div class="viewport" style=" height:250px; width:252px; font-family:Arial !important;"><div class="overview" style="text-align:justify; display:block;"><div>Cut-out feature on both sides. The back and front cap are both greyish-beige. The centre is bright neon pinl with beige laces. The sole is black. </div></div></div> </div>,,16:04:2014,
