455115,style centrum black pure leather men casual shoes,http://www.yebhi.com/online-shopping/men/shoes.html?affint=men-topmenu,2699,Shoes,casual-shoes,style-centrum,http://im6.ybndc.com/upload/455115/ProductRear635312602440786000.jpg,2699,,Men,http://www.yebhi.com/455115/PD/style-centrum-black-pure-leather-men-casual-shoes.htm,yebhi.com,Style Centrum Black Pure Leather Men - Casual Shoes Buy Online,Style Centrum Black Pure Leather Men - Casual Shoes  Best Price Rs 2699.00  EMI Rs 450 for 6 months FREE Shipping In Stock - Delivery in 6-8 Days,UK 6UK 7UK 8UK 9UK 10UK 11,<div class="product_detail_columns tinyscrl" itemprop="description" style=""><div class="scrollbar" style="width:2px; height:250px; background:#9E9E9E;"><div class="track" style="width:2px;"><div class="thumb" style="width:6px;"><div class="end"> </div></div></div></div><div class="viewport" style=" height:250px; width:252px; font-family:Arial !important;"><div class="overview" style="text-align:justify; display:block;"><div>Style Centrum Black Color Shoes Upper : Leather Lining : Leather Sole : T-UNIT </div></div></div> </div>,,16:04:2014,
455110,style centrum orange men casual shoes,http://www.yebhi.com/online-shopping/men/shoes.html?affint=men-topmenu,1599,Shoes,casual-shoes,style-centrum,http://im6.ybndc.com/upload/455110/ProductRear635258998950726000.jpg,1599,,Men,http://www.yebhi.com/455110/PD/style-centrum-orange-men-casual-shoes.htm,yebhi.com,Style Centrum Orange Men - Casual Shoes Buy Online,Style Centrum Orange Men - Casual Shoes  Best Price Rs 1599.00  EMI Rs 267 for 6 months FREE Shipping In Stock - Delivery in 6-8 Days,UK 6UK 7UK 8UK 9UK 10UK 11,<div class="product_detail_columns tinyscrl" itemprop="description" style=""><div class="scrollbar" style="width:2px; height:250px; background:#9E9E9E;"><div class="track" style="width:2px;"><div class="thumb" style="width:6px;"><div class="end"> </div></div></div></div><div class="viewport" style=" height:250px; width:252px; font-family:Arial !important;"><div class="overview" style="text-align:justify; display:block;"><div>Style Centrum Orange Color Shoes Upper : suede+ leather Lining : Textile Sole : TPR </div></div></div> </div>,,16:04:2014,
313517,style centrum black men pure leather casual shoes,http://www.yebhi.com/online-shopping/men/shoes.html?affint=men-topmenu,2399,Shoes,casual-shoes,style-centrum,http://im6.ybndc.com/upload/313517/ProductRear635073472145881652.jpg,2399,,Men,http://www.yebhi.com/313517/PD/style-centrum-black-men-pure-leather-casual-shoes.htm,yebhi.com,Style Centrum Black Men Pure Leather - Casual Shoes Buy Online,Style Centrum Black Men Pure Leather - Casual Shoes  Best Price Rs 2399.00  EMI Rs 400 for 6 months FREE Shipping In Stock - Delivery in 6-8 Days,UK 6UK 7UK 8UK 9UK 10UK 11,<div class="product_detail_columns tinyscrl" itemprop="description" style=""><div class="scrollbar" style="width:2px; height:250px; background:#9E9E9E;"><div class="track" style="width:2px;"><div class="thumb" style="width:6px;"><div class="end"> </div></div></div></div><div class="viewport" style=" height:250px; width:252px; font-family:Arial !important;"><div class="overview" style="text-align:justify; display:block;"><div><table><tr><td><b>Colour</b></td><td>    </td><td>Black   Grey</td></tr><tr><td><b>For</b></td><td>    </td><td>Men</td></tr><tr><td><b>Material</b></td><td>    </td><td>Pure Leather</td></tr><tr><td><b>Brands</b></td><td>    </td><td>Style Centrum</td></tr><tr><td><b>Departments</b></td><td>    </td><td>Shoes</td></tr><tr><td><b>Category</b></td><td>    </td><td>Casual Shoes</td></tr></table>  </div></div></div> </div>,,16:04:2014,
313518,style centrum blue men pure leather casual shoes,http://www.yebhi.com/online-shopping/men/shoes.html?affint=men-topmenu,2399,Shoes,casual-shoes,style-centrum,http://im6.ybndc.com/upload/313518/ProductRear635073472885326392.jpg,2399,,Men,http://www.yebhi.com/313518/PD/style-centrum-blue-men-pure-leather-casual-shoes.htm,yebhi.com,Style Centrum Blue Men Pure Leather - Casual Shoes Buy Online,Style Centrum Blue Men Pure Leather - Casual Shoes  Best Price Rs 2399.00  EMI Rs 400 for 6 months FREE Shipping In Stock - Delivery in 6-8 Days,UK 6UK 7UK 8UK 9UK 10UK 11,<div class="product_detail_columns tinyscrl" itemprop="description" style=""><div class="scrollbar" style="width:2px; height:250px; background:#9E9E9E;"><div class="track" style="width:2px;"><div class="thumb" style="width:6px;"><div class="end"> </div></div></div></div><div class="viewport" style=" height:250px; width:252px; font-family:Arial !important;"><div class="overview" style="text-align:justify; display:block;"><div>  This pair of casual shoes from the house of <b>Style Centrum</b> has a <b>leather upper </b>with overlays and <b>stitched detailing</b>. It has a <b>reinforced heel collar</b>. The sole is made of <b>rubber</b> that enhances grip.<br/><br/><b>Features</b><ul style="margin-left: 20px;"><li type="disc"><b>Brand: </b>Style Centrum</li><li type="disc"><b>Category: </b>Casual Shoes</li><li type="disc"><b>Material: </b>Pure Leather</li><li type="disc"><b>Colour: </b>Blue</li><li type="disc"><b>Pattern: </b>Round toe  Stitched</li><li type="disc"><b>Style: </b>Lace-Up</li></ul><br/><b>Style it up with</b> your casual ensemble for a smart look.<br/><br/><b>Care Tips </b><br/>  Gently brush away dust or dirt using a soft cleaning brush.<br/>  Use a leather conditioner/wax and a brush for added shine.<br/>  Avoid contact with liquids. </div></div></div> </div>,,16:04:2014,
313519,style centrum grey men pure leather casual shoes,http://www.yebhi.com/online-shopping/men/shoes.html?affint=men-topmenu,2299,Shoes,casual-shoes,style-centrum,http://im6.ybndc.com/upload/313519/ProductRear635073473525398495.jpg,2299,,Men,http://www.yebhi.com/313519/PD/style-centrum-grey-men-pure-leather-casual-shoes.htm,yebhi.com,Style Centrum Grey Men Pure Leather - Casual Shoes Buy Online,Style Centrum Grey Men Pure Leather - Casual Shoes  Best Price Rs 2299.00  EMI Rs 383 for 6 months FREE Shipping In Stock - Delivery in 6-8 Days,UK 10,<div class="product_detail_columns tinyscrl" itemprop="description" style=""><div class="scrollbar" style="width:2px; height:250px; background:#9E9E9E;"><div class="track" style="width:2px;"><div class="thumb" style="width:6px;"><div class="end"> </div></div></div></div><div class="viewport" style=" height:250px; width:252px; font-family:Arial !important;"><div class="overview" style="text-align:justify; display:block;"><div><table><tr><td><b>Colour</b></td><td>    </td><td>Grey</td></tr><tr><td><b>For</b></td><td>    </td><td>Men</td></tr><tr><td><b>Material</b></td><td>    </td><td>Pure Leather</td></tr><tr><td><b>Brands</b></td><td>    </td><td>Style Centrum</td></tr><tr><td><b>Departments</b></td><td>    </td><td>Shoes</td></tr><tr><td><b>Category</b></td><td>    </td><td>Casual Shoes</td></tr></table>  </div></div></div> </div>,,16:04:2014,
455111,style centrum black men casual shoes,http://www.yebhi.com/online-shopping/men/shoes.html?affint=men-topmenu,1999,Shoes,casual-shoes,style-centrum,http://im6.ybndc.com/upload/455111/ProductRear635258999256018000.jpg,1999,,Men,http://www.yebhi.com/455111/PD/style-centrum-black-men-casual-shoes.htm,yebhi.com,Style Centrum Black Men - Casual Shoes Buy Online,Style Centrum Black Men - Casual Shoes  Best Price Rs 1999.00  EMI Rs 333 for 6 months FREE Shipping In Stock - Delivery in 6-8 Days,UK 6UK 7UK 8UK 9UK 10UK 11,<div class="product_detail_columns tinyscrl" itemprop="description" style=""><div class="scrollbar" style="width:2px; height:250px; background:#9E9E9E;"><div class="track" style="width:2px;"><div class="thumb" style="width:6px;"><div class="end"> </div></div></div></div><div class="viewport" style=" height:250px; width:252px; font-family:Arial !important;"><div class="overview" style="text-align:justify; display:block;"><div> This pair of <b>black and grey pair loafers</b> from the house of <b>Style Centrum</b> features <b>leather upper</b> with <b>neat stitched detailing. knot detailing on the fore foot</b> and <b>texture</b>. The <b>slip on</b> features a <b>cushioned foot bed</b> that makes it comfortable. The <b>outsole</b> is made of <b>rubber</b> and has <b>grooves</b> to enhance the grip.<br/><br/><b>Features</b><br/><ul style="margin-left: 20px;"><li type="disc"><b>Brand:</b> Style Centrum<br/></li><li type="disc"><b>Category:</b> Loafers<br/></li><li type="disc"><b>Colour:</b> Black  Grey<br/></li><li type="disc"><b>Material:</b> Leather<br/></li><li type="disc"><b>Sole:</b> Rubber outsole<br/></li><li type="disc"><b>Pattern:</b> Slip-On<br/></li><li type="disc"><b>Occasion:</b> Casual<br/></li><li type="disc"><b>Style:</b> Round toe<br/></li><li type="disc"><b>Detailing:</b> Stitched Detailing</li></ul><br/><b>Style it up with</b> your favourite casual attire<br/><br/><b>Care Tip<br/></b>Gently brush away dust or dirt using a soft cleaning brush<br/>  Use a leather conditioner/wax and a brush for added shine<br/>  Avoid contact with liquids  </div></div></div> </div>,,16:04:2014,
455112,style centrum red men casual shoes,http://www.yebhi.com/online-shopping/men/shoes.html?affint=men-topmenu,1999,Shoes,casual-shoes,style-centrum,http://im6.ybndc.com/upload/455112/ProductRear635258999574882000.jpg,1999,,Men,http://www.yebhi.com/455112/PD/style-centrum-red-men-casual-shoes.htm,yebhi.com,Style Centrum Red Men - Casual Shoes Buy Online,Style Centrum Red Men - Casual Shoes  Best Price Rs 1999.00  EMI Rs 333 for 6 months FREE Shipping In Stock - Delivery in 6-8 Days,UK 6UK 7UK 8UK 9UK 10UK 11,<div class="product_detail_columns tinyscrl" itemprop="description" style=""><div class="scrollbar" style="width:2px; height:250px; background:#9E9E9E;"><div class="track" style="width:2px;"><div class="thumb" style="width:6px;"><div class="end"> </div></div></div></div><div class="viewport" style=" height:250px; width:252px; font-family:Arial !important;"><div class="overview" style="text-align:justify; display:block;"><div> This pair of <b>red and grey pair loafers</b> from the house of <b>Style Centrum</b> features <b>leather upper</b> with <b>neat stitched detailing. knot detailing on the fore foot</b> and <b>texture</b>. The <b>slip on</b> features a <b>cushioned foot bed</b> that makes it comfortable. The <b>outsole</b> is made of <b>rubber</b> and has <b>grooves</b> to enhance the grip.<br/><br/><b>Features</b><br/><ul style="margin-left: 20px;"><li type="disc"><b>Brand:</b> Style Centrum<br/></li><li type="disc"><b>Category:</b> Loafers<br/></li><li type="disc"><b>Colour:</b> Red  Grey<br/></li><li type="disc"><b>Material:</b> Leather<br/></li><li type="disc"><b>Sole:</b> Rubber outsole<br/></li><li type="disc"><b>Pattern:</b> Slip-On<br/></li><li type="disc"><b>Occasion:</b> Casual<br/></li><li type="disc"><b>Style:</b> Round toe<br/></li><li type="disc"><b>Detailing:</b> Stitched Detailing</li></ul><br/><b>Style it up with</b> your favourite casual attire<br/><br/><b>Care Tip<br/></b>Gently brush away dust or dirt using a soft cleaning brush<br/>  Use a leather conditioner/wax and a brush for added shine<br/>  Avoid contact with liquids  </div></div></div> </div>,,16:04:2014,
455108,style centrum yellow pure leather men casual shoes,http://www.yebhi.com/online-shopping/men/shoes.html?affint=men-topmenu,2499,Shoes,casual-shoes,style-centrum,http://im6.ybndc.com/upload/455108/ProductRear635258998398642000.jpg,2499,,Men,http://www.yebhi.com/455108/PD/style-centrum-yellow-pure-leather-men-casual-shoes.htm,yebhi.com,Style Centrum Yellow Pure Leather Men - Casual Shoes Buy Online,Style Centrum Yellow Pure Leather Men - Casual Shoes  Best Price Rs 2499.00  EMI Rs 417 for 6 months FREE Shipping In Stock - Delivery in 6-8 Days,UK 7UK 8UK 9UK 10,<div class="product_detail_columns tinyscrl" itemprop="description" style=""><div class="scrollbar" style="width:2px; height:250px; background:#9E9E9E;"><div class="track" style="width:2px;"><div class="thumb" style="width:6px;"><div class="end"> </div></div></div></div><div class="viewport" style=" height:250px; width:252px; font-family:Arial !important;"><div class="overview" style="text-align:justify; display:block;"><div>   This pair of <b>yellow casual shoes</b> feature <b>pure leather</b> upper with <b>neat stitched detailing</b>. The <b>square toe</b> pair of casual shoes is stylized as a <b>slip on</b> with <b>low top styling</b>. It comes with a <b>soft and comfortable footbed</b> and a <b>tough outsole</b> with <b>grooves</b> that enhance grip.<br/><br/><b>Features</b><br/><ul style="margin-left: 20px;"><li type="disc"> <b>Brand</b>: Style Centrum<br/></li><li type="disc"> <b>Category</b>: Loafers<br/></li><li type="disc"> <b>Colour</b>: Yellow</li><li type="disc"><b> Material</b>: Pure Leather<br/></li><li type="disc"><b>Pattern:</b> Slip On<br/></li><li type="disc"><b>Occasion:</b> Casual<br/></li><li type="disc"><b>Style:</b> Square Toe<br/></li><li type="disc"><b>Detailing:</b> Stitched Detailing</li></ul><br/><b>Style it up with</b> your favourite pair of denims and sweatshirt<br/><br/><b>Care Tip<br/></b>Use a gentle cleaner and then apply a protective gel or conditioner to protect it from the elements  </div></div></div> </div>,,16:04:2014,
313522,style centrum red men pure leather casual shoes,http://www.yebhi.com/online-shopping/men/shoes.html?affint=men-topmenu,2099,Shoes,casual-shoes,style-centrum,http://im6.ybndc.com/upload/313522/ProductRear635073476538089807.jpg,2099,,Men,http://www.yebhi.com/313522/PD/style-centrum-red-men-pure-leather-casual-shoes.htm,yebhi.com,Style Centrum Red Men Pure Leather - Casual Shoes Buy Online,Style Centrum Red Men Pure Leather - Casual Shoes  Best Price Rs 2099.00  EMI Rs 350 for 6 months FREE Shipping In Stock - Delivery in 6-8 Days,UK 7UK 8UK 9UK 10UK 11,<div class="product_detail_columns tinyscrl" itemprop="description" style=""><div class="scrollbar" style="width:2px; height:250px; background:#9E9E9E;"><div class="track" style="width:2px;"><div class="thumb" style="width:6px;"><div class="end"> </div></div></div></div><div class="viewport" style=" height:250px; width:252px; font-family:Arial !important;"><div class="overview" style="text-align:justify; display:block;"><div><table><tr><td><b>Colour</b></td><td>    </td><td>Red   White</td></tr><tr><td><b>For</b></td><td>    </td><td>Men</td></tr><tr><td><b>Material</b></td><td>    </td><td>Pure Leather</td></tr><tr><td><b>Brands</b></td><td>    </td><td>Style Centrum</td></tr><tr><td><b>Departments</b></td><td>    </td><td>Shoes</td></tr><tr><td><b>Category</b></td><td>    </td><td>Casual Shoes</td></tr></table>  </div></div></div> </div>,,16:04:2014,
455107,style centrum black men pure leather casual shoes,http://www.yebhi.com/online-shopping/men/shoes.html?affint=men-topmenu,2499,Shoes,casual-shoes,style-centrum,http://im6.ybndc.com/upload/455107/ProductRear635258998156686000.jpg,2499,,Men,http://www.yebhi.com/455107/PD/style-centrum-black-men-pure-leather-casual-shoes.htm,yebhi.com,Style Centrum Black Men Pure Leather - Casual Shoes Buy Online,Style Centrum Black Men Pure Leather - Casual Shoes  Best Price Rs 2499.00  EMI Rs 417 for 6 months FREE Shipping In Stock - Delivery in 6-8 Days,UK 6UK 7UK 8UK 9UK 10UK 11,<div class="product_detail_columns tinyscrl" itemprop="description" style=""><div class="scrollbar" style="width:2px; height:250px; background:#9E9E9E;"><div class="track" style="width:2px;"><div class="thumb" style="width:6px;"><div class="end"> </div></div></div></div><div class="viewport" style=" height:250px; width:252px; font-family:Arial !important;"><div class="overview" style="text-align:justify; display:block;"><div>   This pair of <b>black casual shoes</b> feature <b>pure leather</b> upper with <b>neat stitched detailing</b>. The <b>square toe</b> pair of casual shoes is stylized as a <b>slip on</b> with <b>low top styling</b>. It comes with a <b>soft and comfortable footbed</b> and a <b>tough outsole</b> with <b>grooves</b> that enhance grip.<br/><br/><b>Features</b><br/><ul style="margin-left: 20px;"><li type="disc"> <b>Brand</b>: Style Centrum<br/></li><li type="disc"> <b>Category</b>: Loafers<br/></li><li type="disc"> <b>Colour</b>: Black</li><li type="disc"><b> Material</b>: Pure Leather<br/></li><li type="disc"><b>Pattern:</b> Slip On<br/></li><li type="disc"><b>Occasion:</b> Casual<br/></li><li type="disc"><b>Style:</b> Square Toe<br/></li><li type="disc"><b>Detailing:</b> Stitched Detailing</li></ul><br/><b>Style it up with</b> your favourite pair of denims and sweatshirt<br/><br/><b>Care Tip<br/></b>Use a gentle cleaner and then apply a protective gel or conditioner to protect it from the elements  </div></div></div> </div>,,16:04:2014,
313551,style centrum black men pure leather casual shoes,http://www.yebhi.com/online-shopping/men/shoes.html?affint=men-topmenu,2499,Shoes,casual-shoes,style-centrum,http://im6.ybndc.com/upload/313551/ProductRear635086260460126000.jpg,2499,,Men,http://www.yebhi.com/313551/PD/style-centrum-black-men-pure-leather-casual-shoes.htm,yebhi.com,Style Centrum Black Men Pure Leather - Casual Shoes Buy Online,Style Centrum Black Men Pure Leather - Casual Shoes  Best Price Rs 2499.00  EMI Rs 417 for 6 months FREE Shipping In Stock - Delivery in 6-8 Days,UK 6UK 7UK 8UK 9UK 10UK 11,<div class="product_detail_columns tinyscrl" itemprop="description" style=""><div class="scrollbar" style="width:2px; height:250px; background:#9E9E9E;"><div class="track" style="width:2px;"><div class="thumb" style="width:6px;"><div class="end"> </div></div></div></div><div class="viewport" style=" height:250px; width:252px; font-family:Arial !important;"><div class="overview" style="text-align:justify; display:block;"><div>  This pair of <b>sqaure toed casual loafers</b> has with <b>interwoven details on the upper</b>. It features <b>branding on the side upper</b> and <b>braided strap at the midfoot</b>. The <b>footbed</b> is <b>cushioned</b> with <b>branding</b> and the <b>outsole</b> is <b>durable</b> with <b>circular nibs.</b><br/><br/><b>Features</b><ul style="margin-left: 20px;"><li type="disc"><b>Brand: </b>Style Centrum</li><li type="disc"><b>Category: </b>Loafers</li><li type="disc"><b>Material: </b>Pure Leather</li><li type="disc"><b>Colour: </b>Black</li><li type="disc"><b>Pattern: </b>Square toe  Stitched</li><li type="disc"><b>Style: </b>Slip-On</li></ul><br/><b>Style it up with</b> your favourite casual attire<br/><br/><b>Care Tips </b><br/>  Gently brush away dust or dirt using a soft cleaning brush<br/>  Use a leather conditioner/wax and a brush for added shine<br/>  Avoid contact with liquids </div></div></div> </div>,,16:04:2014,
