331821,zoey red women tops,http://www.yebhi.com/online-shopping/women/apparels.html?affint=women-topmenu,2249,Clothing,tops,zoey,http://im6.ybndc.com/upload/331821/ProductRear635100963375892000.jpg,2450,,Women,http://www.yebhi.com/331821/PD/zoey-red-women-tops.htm,yebhi.com,Zoey Red Women - Tops Buy Online,Zoey Red Women - Tops  Best Price Rs 2450.00  EMI Rs 408 for 6 months FREE Shipping in 2 Days,M,<div class="product_detail_columns tinyscrl" itemprop="description" style=""><div class="scrollbar" style="width:2px; height:250px; background:#9E9E9E;"><div class="track" style="width:2px;"><div class="thumb" style="width:6px;"><div class="end"> </div></div></div></div><div class="viewport" style=" height:250px; width:252px; font-family:Arial !important;"><div class="overview" style="text-align:justify; display:block;"><div>This top with a <b>flounce stand collar and bow knot puff </b>this deep red shirt can be a novelty in your collection. If <b>chic and glamorous</b> is your style then this red bow tie top will be your perfect pick. The collar puff and extremely stylish placket is an attribute hard to find in all your other clothing<br/><br/><b>Features</b><ul style="margin-left: 20px;"><li type="disc"> Fabric: Chiffon Blend<br/></li><li type="disc"> Colour: Red<br/></li><li type="disc"> Pattern: Solid<br/><li type="disc">Neckline: Stand Collar<br/></li><li type="disc">Sleeves: Half sleeves <br/></li></li></ul> <br/><b>Looks great with </b> a peplum skirt adding black high pumps for a perfect glamorous look. <br/><br/><b>Care Tips</b><br/>  Wash with like colours.<br>Do not soak  tumble dry or bleach<br>Mild iron<br>Line dry<br><br><b>Note:</b>There may be a slight colour variation in the image from original product. </br></br></br></br></br></div></div></div> </div>,,17:04:2014,
338740,zoey green chiffon women tops,http://www.yebhi.com/online-shopping/women/apparels.html?affint=women-topmenu,2149,Clothing,tops,zoey,http://im6.ybndc.com/upload/338740/ProductRear635115723529687994.jpg,2350,,Women,http://www.yebhi.com/338740/PD/zoey-green-chiffon-women-tops.htm,yebhi.com,Zoey Green Chiffon Women - Tops Buy Online,Zoey Green Chiffon Women - Tops  Best Price Rs 2149.00 Best Discount 9% Off EMI Rs 358 for 6 months FREE Shipping in 2 Days,XXL,<div class="product_detail_columns tinyscrl" itemprop="description" style=""><div class="scrollbar" style="width:2px; height:250px; background:#9E9E9E;"><div class="track" style="width:2px;"><div class="thumb" style="width:6px;"><div class="end"> </div></div></div></div><div class="viewport" style=" height:250px; width:252px; font-family:Arial !important;"><div class="overview" style="text-align:justify; display:block;"><div>This <b>green top with a scoop neck</b> is all you need this monsoon to step out in style. <b>Crafted in chiffon </b> it is a chic option for fall. With a playful retro feel this green top from Zoey has been on the toplist of all the fashionista. This vibrant style is clinched near the waist to give you a flattering fit.<br/><br/><b>Features</b><ul style="margin-left: 20px;"><li type="disc"> Fabric: Chiffon Blend<br/></li><li type="disc"> Colour: Green<br/></li><li type="disc"> Pattern: Solid<br/><li type="disc">Neckline: Round<br/></li><li type="disc">Sleeves: Full sleeves <br/></li></li></ul> <br/><b>Looks great with </b> a novelty clutch and flat sandals.<br/><br/><b>Care Tips</b><br/>  Wash with like colours.<br>Do not soak  tumble dry or bleach<br>Mild iron<br>Line dry<br><br><b>Note:</b>There may be a slight colour variation in the image from original product.  </br></br></br></br></br></div></div></div> </div>,,17:04:2014,
331823,zoey blue chiffon women tops,http://www.yebhi.com/online-shopping/women/apparels.html?affint=women-topmenu,1799,Clothing,tops,zoey,http://im6.ybndc.com/upload/331823/ProductRear635100963811132000.jpg,1999,,Women,http://www.yebhi.com/331823/PD/zoey-blue-chiffon-women-tops.htm,yebhi.com,Zoey Blue Chiffon Women - Tops Buy Online,Zoey Blue Chiffon Women - Tops  Best Price Rs 1999.00  EMI Rs 333 for 6 months FREE Shipping in 2 Days,SML,<div class="product_detail_columns tinyscrl" itemprop="description" style=""><div class="scrollbar" style="width:2px; height:250px; background:#9E9E9E;"><div class="track" style="width:2px;"><div class="thumb" style="width:6px;"><div class="end"> </div></div></div></div><div class="viewport" style=" height:250px; width:252px; font-family:Arial !important;"><div class="overview" style="text-align:justify; display:block;"><div>Add a dose of femininity to your wardrobe with this <b>chic blue top from the house of Zoey.</b> Master the ease of feminine dressing with this <b>short sleeve scoop neck blue top</b>. It will not only make a covetable piece in your wardrobe but also refresh it.<br/><br/><b>Features</b><ul style="margin-left: 20px;"><li type="disc"> Fabric: Chiffon Blend<br/></li><li type="disc"> Colour: Blue<br/></li><li type="disc"> Pattern: Solid<br/></li><li type="disc">Neckline: Round neck <br/></li><li type="disc">Sleeves: Mega Sleeves <br/></li></ul> <br/><b>Looks great with </b> black high waist pants for a trendy office attire.<br/><br/><b>Care Tips</b><br/>  Wash with like colours.<br/>  Do not soak  tumble dry or bleach<br/>  Mild iron<br/>  Line dry<br/><br/><b>Note:</b> There may be a slight colour variation in the image from original product.  </div></div></div> </div>,,17:04:2014,
338739,zoey yellow chiffon women tops,http://www.yebhi.com/online-shopping/women/apparels.html?affint=women-topmenu,2149,Clothing,tops,zoey,http://im6.ybndc.com/upload/338739/ProductRear635115723386167994.jpg,2350,,Women,http://www.yebhi.com/338739/PD/zoey-yellow-chiffon-women-tops.htm,yebhi.com,Zoey Yellow Chiffon Women - Tops Buy Online,Zoey Yellow Chiffon Women - Tops  Best Price Rs 2350.00  EMI Rs 392 for 6 months FREE Shipping in 2 Days,XSL,<div class="product_detail_columns tinyscrl" itemprop="description" style=""><div class="scrollbar" style="width:2px; height:250px; background:#9E9E9E;"><div class="track" style="width:2px;"><div class="thumb" style="width:6px;"><div class="end"> </div></div></div></div><div class="viewport" style=" height:250px; width:252px; font-family:Arial !important;"><div class="overview" style="text-align:justify; display:block;"><div>Refine your look with some feminine charm and a pinch of versatility with this pretty top in yellow and blue colour. With scoop neckline and bow puff detailing on the neckline  and ruched detailing on the sleeves  this designer top has been crafted with chiffon. <br/><br/><b>Features</b><ul style="margin-left: 20px;"><li type="disc"> Fabric: Chiffon<br/></li><li type="disc"> Colour: Yellow<br/></li><li type="disc"> Pattern: Solid<br/></li><li type="disc">Neckline: Round<br/></li><li type="disc">Sleeves: Half Sleeves <br/></li></ul> <br/><b>Looks great with </b> skirts and flats. <br/><br/><b>Care Tips</b><br/>  Wash with like colours.<br/>  Do not soak  tumble dry or bleach<br/>  Mild iron<br/>  Line dry<br/><br/><b>Note:</b>There may be a slight colour variation in the image from original product. </div></div></div> </div>,,17:04:2014,
352048,zoey white chiffon women tops,http://www.yebhi.com/online-shopping/women/apparels.html?affint=women-topmenu,1799,Clothing,tops,zoey,http://im6.ybndc.com/upload/352048/ProductRear635139925726134000.jpg,1999,,Women,http://www.yebhi.com/352048/PD/zoey-white-chiffon-women-tops.htm,yebhi.com,Zoey White Chiffon Women - Tops Buy Online,Zoey White Chiffon Women - Tops  Best Price Rs 1999.00  EMI Rs 333 for 6 months FREE Shipping in 2 Days,ML,<div class="product_detail_columns tinyscrl" itemprop="description" style=""><div class="scrollbar" style="width:2px; height:250px; background:#9E9E9E;"><div class="track" style="width:2px;"><div class="thumb" style="width:6px;"><div class="end"> </div></div></div></div><div class="viewport" style=" height:250px; width:252px; font-family:Arial !important;"><div class="overview" style="text-align:justify; display:block;"><div>Update your city portfolio with Zoey's polka dot top. Forged in Chiffon blend and finished with charming round-Neck along with the puff sleeves to don a perfect  look. Complement the polka-dot  top by styling yours with a tangerine clutch and subtle jewelry. Finish your look with a pony tale to don a sophisticated office look. Material: Chiffon blend; Size: XS  S  M  L  XL; Length: 59-62cm. This product is supplied by Zoey and designer partner  www.simplysizzl.in  </div></div></div> </div>,,17:04:2014,
331815,zoey pink chiffon women tops,http://www.yebhi.com/online-shopping/women/apparels.html?affint=women-topmenu,1799,Clothing,tops,zoey,http://im6.ybndc.com/upload/331815/ProductRear635100960979420000.jpg,1999,,Women,http://www.yebhi.com/331815/PD/zoey-pink-chiffon-women-tops.htm,yebhi.com,Zoey Pink Chiffon Women - Tops Buy Online,Zoey Pink Chiffon Women - Tops  Best Price Rs 1999.00  EMI Rs 333 for 6 months FREE Shipping in 2 Days,XS,<div class="product_detail_columns tinyscrl" itemprop="description" style=""><div class="scrollbar" style="width:2px; height:250px; background:#9E9E9E;"><div class="track" style="width:2px;"><div class="thumb" style="width:6px;"><div class="end"> </div></div></div></div><div class="viewport" style=" height:250px; width:252px; font-family:Arial !important;"><div class="overview" style="text-align:justify; display:block;"><div>Colour blocking has been a runway trend and is showcased best with this <b>pink slim fit blouse.</b> The detailing near the neck and the sleeves makes it a ladylike choice to have. Go all chic with this pretty pink top.<br/><br/><b>Features</b><ul style="margin-left: 20px;"><li type="disc"> Fabric: Chiffon Blend<br/></li><li type="disc"> Colour: Pink<br/></li><li type="disc"> Pattern: Solid<br/><li type="disc">Neckline: Round Neck<br/></li><li type="disc">Sleeves: Mega Sleeves <br/></li></li></ul> <br/><b>Looks great with </b> shorts/ skirts. <br/><br/><b>Care Tips</b><br/>  Wash with like colours.<br>Do not soak  tumble dry or bleach<br>Mild iron<br>Line dry<br><br><b>Note:</b>There may be a slight colour variation in the image from original product. </br></br></br></br></br></div></div></div> </div>,,17:04:2014,
352045,zoey white chiffon women tops,http://www.yebhi.com/online-shopping/women/apparels.html?affint=women-topmenu,1999,Clothing,tops,zoey,http://im6.ybndc.com/upload/352045/ProductRear635139925064694000.jpg,1999,,Women,http://www.yebhi.com/352045/PD/zoey-white-chiffon-women-tops.htm,yebhi.com,Zoey White Chiffon Women - Tops Buy Online,Zoey White Chiffon Women - Tops  Best Price Rs 1999.00  EMI Rs 333 for 6 months FREE Shipping in 2 Days,SL,<div class="product_detail_columns tinyscrl" itemprop="description" style=""><div class="scrollbar" style="width:2px; height:250px; background:#9E9E9E;"><div class="track" style="width:2px;"><div class="thumb" style="width:6px;"><div class="end"> </div></div></div></div><div class="viewport" style=" height:250px; width:252px; font-family:Arial !important;"><div class="overview" style="text-align:justify; display:block;"><div>Update your city portfolio with Zoey's white top. Forged in Chiffon blend and finished with charming scoop neck along with the irregular bottom to don a perfect diva look. We just love the double layer in this top. The fresh white placket with short sleeves  makes the top pop. Wear it with a nice palazzo pant or a tribal long skirt to get a dramatic impact.Material: Chiffon blend; Size XS : S  M   L; Length: 61-64cm. This product is supplied by Zoey and designer partner  www.simplysizzl.in  </div></div></div> </div>,,17:04:2014,
331820,zoey white chiffon women tops,http://www.yebhi.com/online-shopping/women/apparels.html?affint=women-topmenu,1599,Clothing,tops,zoey,http://im6.ybndc.com/upload/331820/ProductRear635100963151564000.jpg,1850,,Women,http://www.yebhi.com/331820/PD/zoey-white-chiffon-women-tops.htm,yebhi.com,Zoey White Chiffon Women - Tops Buy Online,Zoey White Chiffon Women - Tops  Best Price Rs 1850.00  EMI Rs 308 for 6 months FREE Shipping in 2 Days,XL,<div class="product_detail_columns tinyscrl" itemprop="description" style=""><div class="scrollbar" style="width:2px; height:250px; background:#9E9E9E;"><div class="track" style="width:2px;"><div class="thumb" style="width:6px;"><div class="end"> </div></div></div></div><div class="viewport" style=" height:250px; width:252px; font-family:Arial !important;"><div class="overview" style="text-align:justify; display:block;"><div>Live life in colour with this white contrast button shirt. The <b>long sleeves and slim fit shirt</b> along with the <b>contrast buttons and collar</b> make it a funky yet stylish piece to own. <br/><br/><b>Features</b><ul style="margin-left: 20px;"><li type="disc"> Fabric: Chiffon Blend<br/></li><li type="disc"> Colour: White<br/></li><li type="disc"> Pattern: Solid<br/><li type="disc">Neckline: Spread collar<br/></li><li type="disc">Sleeves: Full sleeves <br/></li></li></ul> <br/><b>Looks great with </b> shorts. <br/><br/><b>Care Tips</b><br/>  Wash with like colours.<br>Do not soak  tumble dry or bleach<br>Mild iron<br>Line dry<br><br><b>Note:</b>There may be a slight colour variation in the image from original product. </br></br></br></br></br></div></div></div> </div>,,17:04:2014,
325830,zoey green women tops,http://www.yebhi.com/online-shopping/women/apparels.html?affint=women-topmenu,1849,Clothing,tops,zoey,http://im6.ybndc.com/upload/325830/ProductRear635085485677078000.jpg,2150,,Women,http://www.yebhi.com/325830/PD/zoey-green-women-tops.htm,yebhi.com,Zoey Green Women - Tops Buy Online,Zoey Green Women - Tops  Best Price Rs 2150.00  EMI Rs 358 for 6 months FREE Shipping in 2 Days,M,<div class="product_detail_columns tinyscrl" itemprop="description" style=""><div class="scrollbar" style="width:2px; height:250px; background:#9E9E9E;"><div class="track" style="width:2px;"><div class="thumb" style="width:6px;"><div class="end"> </div></div></div></div><div class="viewport" style=" height:250px; width:252px; font-family:Arial !important;"><div class="overview" style="text-align:justify; display:block;"><div>This <b>long top by Zoey</b> is a true fashion essential for those who love to be in style always. In <b>green colour with big floral pattern all over </b> this top is crafted with <b>polyester and chiffon. </b><br/><br/><b>Features</b><ul style="margin-left: 20px;"><li type="disc"> Fabric: Chiffon  Polyester<br/></li><li type="disc"> Colour: Green  Pink<br/></li><li type="disc"> Pattern: Printed<br/></li><li type="disc">Neckline: Round neck<br/></li><li type="disc">Sleeves: Bat Sleeves <br/></li></ul> <br/><b>Looks great with </b> black jeggings. <br/><br/><b>Care Tips</b><br/>  Wash with like colours.<br/>  Do not soak  tumble dry or bleach<br/>  Mild iron<br/>  Line dry<br/><br/><b>Note:</b>There may be a slight colour variation in the image from original product. </div></div></div> </div>,,17:04:2014,
331817,zoey yellow chiffon women tops,http://www.yebhi.com/online-shopping/women/apparels.html?affint=women-topmenu,1699,Clothing,tops,zoey,http://im6.ybndc.com/upload/331817/ProductRear635100962189668000.jpg,1999,,Women,http://www.yebhi.com/331817/PD/zoey-yellow-chiffon-women-tops.htm,yebhi.com,Zoey Yellow Chiffon Women - Tops Buy Online,Zoey Yellow Chiffon Women - Tops  Best Price Rs 1999.00  EMI Rs 333 for 6 months FREE Shipping in 2 Days,L,<div class="product_detail_columns tinyscrl" itemprop="description" style=""><div class="scrollbar" style="width:2px; height:250px; background:#9E9E9E;"><div class="track" style="width:2px;"><div class="thumb" style="width:6px;"><div class="end"> </div></div></div></div><div class="viewport" style=" height:250px; width:252px; font-family:Arial !important;"><div class="overview" style="text-align:justify; display:block;"><div>Friday dressing at work needs something refreshing. Invest in buying this chic top by Zoey in a bright yellow colour with cut out designs on the sleeves  placket and shoulder. <br/><br/><b>Features</b><ul style="margin-left: 20px;"><li type="disc"> Fabric: Chiffon Blend<br/></li><li type="disc"> Colour: Yellow<br/></li><li type="disc"> Pattern: Solid<br/><li type="disc">Neckline: Round Neck<br/></li><li type="disc">Sleeves: Mega Sleeves <br/></li></li></ul> <br/><b>Looks great with </b> shorts/ skirts. <br/><br/><b>Care Tips</b><br/>  Wash with like colours.<br>Do not soak  tumble dry or bleach<br>Mild iron<br>Line dry<br><br><b>Note:</b>There may be a slight colour variation in the image from original product. </br></br></br></br></br></div></div></div> </div>,,17:04:2014,
325834,zoey grey women tops,http://www.yebhi.com/online-shopping/women/apparels.html?affint=women-topmenu,1950,Clothing,tops,zoey,http://im6.ybndc.com/upload/325834/ProductRear635085487363282000.jpg,1950,,Women,http://www.yebhi.com/325834/PD/zoey-grey-women-tops.htm,yebhi.com,Zoey Grey Women - Tops Buy Online,Zoey Grey Women - Tops  Best Price Rs 1950.00  EMI Rs 325 for 6 months FREE Shipping in 2 Days,Free Size,<div class="product_detail_columns tinyscrl" itemprop="description" style=""><div class="scrollbar" style="width:2px; height:250px; background:#9E9E9E;"><div class="track" style="width:2px;"><div class="thumb" style="width:6px;"><div class="end"> </div></div></div></div><div class="viewport" style=" height:250px; width:252px; font-family:Arial !important;"><div class="overview" style="text-align:justify; display:block;"><div>This is a grey faux cashmere blouse by Zoey. The blouse has black lace detailing and a loose silhouette.Bust:  136cms Length:65cms. This product is supplied by Zoey and designer partner  www.simplysizzl.in  </div></div></div> </div>,,17:04:2014,
338747,zoey pink chiffon women tops,http://www.yebhi.com/online-shopping/women/apparels.html?affint=women-topmenu,1999,Clothing,tops,zoey,http://im6.ybndc.com/upload/338747/ProductRear635115742553419994.jpg,1999,,Women,http://www.yebhi.com/338747/PD/zoey-pink-chiffon-women-tops.htm,yebhi.com,Zoey Pink Chiffon Women - Tops Buy Online,Zoey Pink Chiffon Women - Tops  Best Price Rs 1999.00  EMI Rs 333 for 6 months FREE Shipping in 2 Days,M,<div class="product_detail_columns tinyscrl" itemprop="description" style=""><div class="scrollbar" style="width:2px; height:250px; background:#9E9E9E;"><div class="track" style="width:2px;"><div class="thumb" style="width:6px;"><div class="end"> </div></div></div></div><div class="viewport" style=" height:250px; width:252px; font-family:Arial !important;"><div class="overview" style="text-align:justify; display:block;"><div>This feminine top in pink colour has been designed by Zoey. <b>Crafted in chiffon blend</b> and accomplished with <b>stand collar along the short sleeves </b> it will give you a complete retro yet chic look. Look sugary sweet in this oh-so-feminine pink top. <br/><br/><b>Features</b><ul style="margin-left: 20px;"><li type="disc"> Fabric: Chiffon Blend<br/></li><li type="disc"> Colour: Pink<br/></li><li type="disc"> Pattern: Solid<br/><li type="disc">Neckline: Mandarin collars with V cut <br/></li><li type="disc">Sleeves: Half Sleeves <br/></li></li></ul> <br/><b>Looks great with </b> pants or a pencil skirt.<br/><br/><b>Care Tips</b><br/>  Wash with like colours.<br>Do not soak  tumble dry or bleach<br>Mild iron<br>Line dry<br><br><b>Note:</b>There may be a slight colour variation in the image from original product.  </br></br></br></br></br></div></div></div> </div>,,17:04:2014,
331829,zoey pink chiffon women tops,http://www.yebhi.com/online-shopping/women/apparels.html?affint=women-topmenu,1999,Clothing,tops,zoey,http://im6.ybndc.com/upload/331829/ProductRear635100965796388000.jpg,2350,,Women,http://www.yebhi.com/331829/PD/zoey-pink-chiffon-women-tops.htm,yebhi.com,Zoey Pink Chiffon Women - Tops Buy Online,Zoey Pink Chiffon Women - Tops  Best Price Rs 2350.00  EMI Rs 392 for 6 months FREE Shipping in 2 Days,M,<div class="product_detail_columns tinyscrl" itemprop="description" style=""><div class="scrollbar" style="width:2px; height:250px; background:#9E9E9E;"><div class="track" style="width:2px;"><div class="thumb" style="width:6px;"><div class="end"> </div></div></div></div><div class="viewport" style=" height:250px; width:252px; font-family:Arial !important;"><div class="overview" style="text-align:justify; display:block;"><div>Grace meets style with this graceful pink top. The <b>turndown collar and long elegant sleeves with cuff details</b> make it a piece you want to own. <b>Zoey</b> brings to you this master creation in <b>chiffon.</b><br/><br/><b>Features</b><ul style="margin-left: 20px;"><li type="disc"> Fabric: Chiffon Blend<br/></li><li type="disc"> Colour: Pink<br/></li><li type="disc"> Pattern: Solid<br/><li type="disc">Neckline: Turndown Collar<br/></li><li type="disc">Sleeves: Full sleeves <br/></li></li></ul> <br/><b>Looks great with </b> basic black pants and  black high pumps for a perfect glamorous look. <br/><br/><b>Care Tips</b><br/>  Wash with like colours.<br>Do not soak  tumble dry or bleach<br>Mild iron<br>Line dry<br><br><b>Note:</b>There may be a slight colour variation in the image from original product. </br></br></br></br></br></div></div></div> </div>,,17:04:2014,
331825,zoey yellow chiffon women tops,http://www.yebhi.com/online-shopping/women/apparels.html?affint=women-topmenu,1699,Clothing,tops,zoey,http://im6.ybndc.com/upload/331825/ProductRear635100964372420000.jpg,1999,,Women,http://www.yebhi.com/331825/PD/zoey-yellow-chiffon-women-tops.htm,yebhi.com,Zoey Yellow Chiffon Women - Tops Buy Online,Zoey Yellow Chiffon Women - Tops  Best Price Rs 1699.00 Best Discount 15% Off EMI Rs 283 for 6 months FREE Shipping in 2 Days,XS,<div class="product_detail_columns tinyscrl" itemprop="description" style=""><div class="scrollbar" style="width:2px; height:250px; background:#9E9E9E;"><div class="track" style="width:2px;"><div class="thumb" style="width:6px;"><div class="end"> </div></div></div></div><div class="viewport" style=" height:250px; width:252px; font-family:Arial !important;"><div class="overview" style="text-align:justify; display:block;"><div>What you need to freshen up your wardrobe is this pretty and elegant top in yellow colour. The top features a scoop neckline and faux pearls on it. This top by <b>Zoey</b> in yellow colour has been crafted with chiffon.<br/><br/><b>Features</b><ul style="margin-left: 20px;"><li type="disc"> Fabric: Chiffon Blend<br/></li><li type="disc"> Colour: White<br/></li><li type="disc"> Pattern: Solid<br/><li type="disc">Neckline: Spread collars<br/></li><li type="disc">Sleeves: Half Sleeves <br/></li></li></ul> <br/><b>Looks great with </b> pretty skirts and shorts.<br/><br/><b>Care Tips</b><br/>  Wash with like colours.<br>Do not soak  tumble dry or bleach<br>Mild iron<br>Line dry<br><br><b>Note:</b>The belt used is only for demonstration and not a part of the product. There may be a slight colour variation in the image from original product.  </br></br></br></br></br></div></div></div> </div>,,17:04:2014,
325828,zoey green women tops,http://www.yebhi.com/online-shopping/women/apparels.html?affint=women-topmenu,1649,Clothing,tops,zoey,http://im6.ybndc.com/upload/325828/ProductRear635085484062478000.jpg,1899,,Women,http://www.yebhi.com/325828/PD/zoey-green-women-tops.htm,yebhi.com,Zoey Green Women - Tops Buy Online,Zoey Green Women - Tops  Best Price Rs 1899.00  EMI Rs 317 for 6 months FREE Shipping in 2 Days,M,<div class="product_detail_columns tinyscrl" itemprop="description" style=""><div class="scrollbar" style="width:2px; height:250px; background:#9E9E9E;"><div class="track" style="width:2px;"><div class="thumb" style="width:6px;"><div class="end"> </div></div></div></div><div class="viewport" style=" height:250px; width:252px; font-family:Arial !important;"><div class="overview" style="text-align:justify; display:block;"><div>This <b>bright multicoloured top with floral pattern</b> has been <b>crafted with chiffon.</b> The top features <b>bat sleeves  scooped neckline and asymmetrical hem</b> and gives you a true diva look.<br/><br/><b>Features</b><ul style="margin-left: 20px;"><li type="disc"> Fabric: Chiffon Blend<br/></li><li type="disc"> Colour: Multicoloured<br/></li><li type="disc"> Pattern: Floral Pattern<br/></li><li type="disc">Neckline: Scoop neck<br/></li><li type="disc">Sleeves: Bat Sleeves <br/></li></ul> <br/><b>Looks great with </b> pastel pants. <br/><br/><b>Care Tips</b><br/>  Wash with like colours.<br/>  Do not soak  tumble dry or bleach<br/>  Mild iron<br/>  Line dry<br/><br/><b>Note:</b>There may be a slight colour variation in the image from original product. </div></div></div> </div>,,17:04:2014,
