467635,cotton bazaar cotton sarees,http://www.yebhi.com/online-shopping/women/dress-materials/sarees/salwar-kameez-set/kurta-kurtis/leggings-and-jeggings.html?affint=women-topmenu,1099,Traditional-Ethnic,dress-materials,cotton-bazaar,http://im6.ybndc.com/upload/467635/ProductRear635279058490502000.jpg,1099,,Women,http://www.yebhi.com/467635/PD/cotton-bazaar-cotton-sarees.htm,yebhi.com,Cotton Bazaar Cotton - Sarees Buy Online,Cotton Bazaar Cotton - Sarees  Best Price Rs 1099.00  EMI Rs 183 for 6 months FREE Shipping In Stock - Delivery in 6-8 Days,None,<div class="product_detail_columns tinyscrl" itemprop="description" style=""><div class="scrollbar" style="width:2px; height:250px; background:#9E9E9E;"><div class="track" style="width:2px;"><div class="thumb" style="width:6px;"><div class="end"> </div></div></div></div><div class="viewport" style=" height:250px; width:252px; font-family:Arial !important;"><div class="overview" style="text-align:justify; display:block;"><div>If you wish to go parallel with fashion then grab this assortment that has an appealing cotton material with an eye catchy color shade. This attire assures you to give a spotting image with its pleasing material quality. There may be color variation due to resolution of actual photo.Plain Saree  NON PADDED  Multi Color </div></div></div> </div>,,16:04:2014,
467425,cotton bazaar purple cotton sarees,http://www.yebhi.com/online-shopping/women/dress-materials/sarees/salwar-kameez-set/kurta-kurtis/leggings-and-jeggings.html?affint=women-topmenu,899,Traditional-Ethnic,dress-materials,cotton-bazaar,http://im6.ybndc.com/upload/467425/ProductRear635279057797706000.jpg,899,,Women,http://www.yebhi.com/467425/PD/cotton-bazaar-purple-cotton-sarees.htm,yebhi.com,Cotton Bazaar Purple Cotton - Sarees Buy Online,Cotton Bazaar Purple Cotton - Sarees  Best Price Rs 899.00  EMI Rs 150 for 6 months FREE Shipping In Stock - Delivery in 6-8 Days,None,<div class="product_detail_columns tinyscrl" itemprop="description" style=""><div class="scrollbar" style="width:2px; height:250px; background:#9E9E9E;"><div class="track" style="width:2px;"><div class="thumb" style="width:6px;"><div class="end"> </div></div></div></div><div class="viewport" style=" height:250px; width:252px; font-family:Arial !important;"><div class="overview" style="text-align:justify; display:block;"><div>Here is the amazing apparel for casual wear that has an alluring color touch with a plain work. It is worth to hit a purchase as it got cotton fabric to give a relaxing feel. It really satisfies your needs with its material quality like never before. One should drape this attire to gain desired quality.Plain Saree  NON PADDED  Light Purple Color </div></div></div> </div>,,16:04:2014,
cotton-bazaar,cotton bazaar red cotton sarees,http://www.yebhi.com/online-shopping/women/dress-materials/sarees/salwar-kameez-set/kurta-kurtis/leggings-and-jeggings.html?affint=women-topmenu,http://www.yebhi.com/467638/PD/cotton-bazaar-cotton-sarees.htm,Traditional-Ethnic,dress-materials,cotton-bazaar,http://www.yebhi.com/online-shopping/cotton-bazaar/women/dress-materials/sarees/salwar-kameez-set/leggings-and-jeggings/dress-materials/kurta-kurtis.html?affint=women-topmenu&lc=Brands,cotton bazaar cotton sarees,,Women,http://wes/salwar-kameez-set/leggings-and-jeggings/kurta-kurtis/dress-materials.html?affint=women-topmenu&lc=Category,yebhi.com,Cotton Bazaar Cotton - Sarees Buy Online,Cotton Bazaar Cotton - Sarees  Best Price Rs 1099.00  EMI Rs 183 for 6 months FREE Shipping In Stock - Delivery in 6-8 Days,467638,<div class="product_detail_columns tinyscrl" itemprop="description" style=""><div class="scrollbar" style="width:2px; height:250px; background:#9E9E9E;"><div class="track" style="width:2px;"><div class="thumb" style="width:6px;"><div class="end"> </div></div></div></div><div class="viewport" style=" height:250px; width:252px; font-family:Arial !important;"><div class="overview" style="text-align:justify; display:block;"><div>Here is the attire that enriches your elegance with its appealing material quality. This attire has most appealing cotton fabric which is shaded in catchy color touch. This casual wear saree keeps you parallel with the present fashion sense to make the heads turn around. One should hit an ultimate purchase to attain desired quality. There may be color variation due to resolution of actual photo.Plain Saree  NON PADDED  Multi Color </div></div></div> </div>,,16:04:2014,
467472,cotton bazaar orange cotton sarees,http://www.yebhi.com/online-shopping/women/dress-materials/sarees/salwar-kameez-set/kurta-kurtis/leggings-and-jeggings.html?affint=women-topmenu,899,Traditional-Ethnic,dress-materials,cotton-bazaar,http://im6.ybndc.com/upload/467472/ProductRear635279057947934000.jpg,899,,Women,http://www.yebhi.com/467472/PD/cotton-bazaar-orange-cotton-sarees.htm,yebhi.com,Cotton Bazaar Orange Cotton - Sarees Buy Online,Cotton Bazaar Orange Cotton - Sarees  Best Price Rs 899.00  EMI Rs 150 for 6 months FREE Shipping In Stock - Delivery in 6-8 Days,None,<div class="product_detail_columns tinyscrl" itemprop="description" style=""><div class="scrollbar" style="width:2px; height:250px; background:#9E9E9E;"><div class="track" style="width:2px;"><div class="thumb" style="width:6px;"><div class="end"> </div></div></div></div><div class="viewport" style=" height:250px; width:252px; font-family:Arial !important;"><div class="overview" style="text-align:justify; display:block;"><div>Presenting a casual wear saree that is perfectly crafted and artistically shaded iwht catchy color touch. This casual wear saree has most appealing cotton fabric that gives an additional quality to material. Grab this opportunity to attain desired quality like never before.Plain Saree  NON PADDED  Dark Brown Color </div></div></div> </div>,,16:04:2014,
467649,cotton bazaar green cotton sarees,http://www.yebhi.com/online-shopping/women/dress-materials/sarees/salwar-kameez-set/kurta-kurtis/leggings-and-jeggings.html?affint=women-topmenu,899,Traditional-Ethnic,dress-materials,cotton-bazaar,http://im6.ybndc.com/upload/467649/ProductRear635279058537146000.jpg,899,,Women,http://www.yebhi.com/467649/PD/cotton-bazaar-green-cotton-sarees.htm,yebhi.com,Cotton Bazaar Green Cotton - Sarees Buy Online,Cotton Bazaar Green Cotton - Sarees  Best Price Rs 899.00  EMI Rs 150 for 6 months FREE Shipping In Stock - Delivery in 6-8 Days,None,<div class="product_detail_columns tinyscrl" itemprop="description" style=""><div class="scrollbar" style="width:2px; height:250px; background:#9E9E9E;"><div class="track" style="width:2px;"><div class="thumb" style="width:6px;"><div class="end"> </div></div></div></div><div class="viewport" style=" height:250px; width:252px; font-family:Arial !important;"><div class="overview" style="text-align:justify; display:block;"><div>Express your feminine beauty with this splendid casual wear saree that features cotton material to give pleasing felas you drape it for any casual move. This cotton saree is shaded in superb color touch that assures to give a spotting look to every individual. One can attain a stunning entrance through this fabulous attire to grab a gazing view in a huge midst. There may be color variation due to resolution of actual photo.Plain Saree  NON PADDED  Green Color </div></div></div> </div>,,16:04:2014,
467662,cotton bazaar green cotton sarees,http://www.yebhi.com/online-shopping/women/dress-materials/sarees/salwar-kameez-set/kurta-kurtis/leggings-and-jeggings.html?affint=women-topmenu,1099,Traditional-Ethnic,dress-materials,cotton-bazaar,http://im6.ybndc.com/upload/467662/ProductRear635279058579890000.jpg,1099,,Women,http://www.yebhi.com/467662/PD/cotton-bazaar-green-cotton-sarees.htm,yebhi.com,Cotton Bazaar Green Cotton - Sarees Buy Online,Cotton Bazaar Green Cotton - Sarees  Best Price Rs 1099.00  EMI Rs 183 for 6 months FREE Shipping In Stock - Delivery in 6-8 Days,None,<div class="product_detail_columns tinyscrl" itemprop="description" style=""><div class="scrollbar" style="width:2px; height:250px; background:#9E9E9E;"><div class="track" style="width:2px;"><div class="thumb" style="width:6px;"><div class="end"> </div></div></div></div><div class="viewport" style=" height:250px; width:252px; font-family:Arial !important;"><div class="overview" style="text-align:justify; display:block;"><div>Presenting you the attire that enriches your elegance with its dazzling material quality. This attire has most appealing cotton material which is shaded in enchanting color touch. This casual wear saree keeps you parallel with the present fashion sense to make the heads turn around. One should hit an ultimate purchase to attain desired quality. There may be color variation due to resolution of actual photo.Plain Saree  NON PADDED  Lime Green Color </div></div></div> </div>,,16:04:2014,
467566,cotton bazaar green cotton sarees,http://www.yebhi.com/online-shopping/women/dress-materials/sarees/salwar-kameez-set/kurta-kurtis/leggings-and-jeggings.html?affint=women-topmenu,899,Traditional-Ethnic,dress-materials,cotton-bazaar,http://im6.ybndc.com/upload/467566/ProductRear635279058257126000.jpg,899,,Women,http://www.yebhi.com/467566/PD/cotton-bazaar-green-cotton-sarees.htm,yebhi.com,Cotton Bazaar Green Cotton - Sarees Buy Online,Cotton Bazaar Green Cotton - Sarees  Best Price Rs 899.00  EMI Rs 150 for 6 months FREE Shipping In Stock - Delivery in 6-8 Days,None,<div class="product_detail_columns tinyscrl" itemprop="description" style=""><div class="scrollbar" style="width:2px; height:250px; background:#9E9E9E;"><div class="track" style="width:2px;"><div class="thumb" style="width:6px;"><div class="end"> </div></div></div></div><div class="viewport" style=" height:250px; width:252px; font-family:Arial !important;"><div class="overview" style="text-align:justify; display:block;"><div>One has to take a pick on this marvelous casual wear saree to be the center of attraction. Beauty of this saree is enhanced with an alluring color touch to attain an eye catchy persona that each and every women wish to get. This cotton saree can be an ultimate hit to grab desired persona. There may be color variation due to resolution of actual photo.Plain Saree  NON PADDED  Green Color </div></div></div> </div>,,16:04:2014,
467670,cotton bazaar green cotton sarees,http://www.yebhi.com/online-shopping/women/dress-materials/sarees/salwar-kameez-set/kurta-kurtis/leggings-and-jeggings.html?affint=women-topmenu,899,Traditional-Ethnic,dress-materials,cotton-bazaar,http://im6.ybndc.com/upload/467670/ProductRear635279058606566000.jpg,899,,Women,http://www.yebhi.com/467670/PD/cotton-bazaar-green-cotton-sarees.htm,yebhi.com,Cotton Bazaar Green Cotton - Sarees Buy Online,Cotton Bazaar Green Cotton - Sarees  Best Price Rs 899.00  EMI Rs 150 for 6 months FREE Shipping In Stock - Delivery in 6-8 Days,None,<div class="product_detail_columns tinyscrl" itemprop="description" style=""><div class="scrollbar" style="width:2px; height:250px; background:#9E9E9E;"><div class="track" style="width:2px;"><div class="thumb" style="width:6px;"><div class="end"> </div></div></div></div><div class="viewport" style=" height:250px; width:252px; font-family:Arial !important;"><div class="overview" style="text-align:justify; display:block;"><div>Pink is a desired color for women to get a feminine look! Here is the apparel to embellish you through its superb material quality. It comprises cotton fabric which is an appealing material to give relaxing feel and appeal gazing views like never before.Plain Saree  NON PADDED  Olive Green Color </div></div></div> </div>,,16:04:2014,
467550,cotton bazaar red cotton sarees,http://www.yebhi.com/online-shopping/women/dress-materials/sarees/salwar-kameez-set/kurta-kurtis/leggings-and-jeggings.html?affint=women-topmenu,http://www.yebhi.com/467500/PD/cotton-bazaar-brown-cotton-sarees.htm,Traditional-Ethnic,dress-materials,cotton-bazaar,http://im6.ybndc.com/upload/467550/ProductRear63527905820486600bhi.com/online-shopping/cotton-bazaar/women/dress-materials/sarees/salwar-kameez-set/leggings-and-jeggings/dress-materials/kurta-kurtis.html?affint=women-topmenu&lc=Brands,cotton bazaar brown cotton sarees,,Women,http://www.yebhi.com/467550/PD/cotton-bazaar-red-cotton-sarees.htm,yebhi.com,Cotton Bazaar Brown Cotton - Sarees Buy Online,Cotton Bazaar Brown Cotton - Sarees  Best Price Rs 899.00  EMI Rs 150 for 6 months FREE Shipping In Stock - Delivery in 6-8 Days,467500,<div class="product_detail_columns tinyscrl" itemprop="description" style=""><div class="scrollbar" style="width:2px; height:250px; background:#9E9E9E;"><div class="track" style="width:2px;"><div class="thumb" style="width:6px;"><div class="end"> </div></div></div></div><div class="viewport" style=" height:250px; width:252px; font-family:Arial !important;"><div class="overview" style="text-align:justify; display:block;"><div>This beautiful cotton saree which takes you to the uncharted territory to explore the language of texture. The material quality gives a relaxing feel to put on for casual wear. The perfect attire to grab desired getup is here.Plain Saree  NON PADDED  Brown Color </div></div></div> </div>,,16:04:2014,
346981,cotton bazaar green dress materials,http://www.yebhi.com/online-shopping/women/dress-materials/sarees/salwar-kameez-set/kurta-kurtis/leggings-and-jeggings.html?affint=women-topmenu,1299,Traditional-Ethnic,dress-materials,cotton-bazaar,http://im6.ybndc.com/upload/346981/ProductRear635138942609149732.jpg,1299,,Women,http://www.yebhi.com/346981/PD/cotton-bazaar-green-dress-materials.htm,yebhi.com,Cotton Bazaar Green - Dress Materials Buy Online,Cotton Bazaar Green - Dress Materials  Best Price Rs 1299.00  EMI Rs 217 for 6 months FREE Shipping In Stock - Delivery in 9-12 Days,None,<div class="product_detail_columns tinyscrl" itemprop="description" style=""><div class="scrollbar" style="width:2px; height:250px; background:#9E9E9E;"><div class="track" style="width:2px;"><div class="thumb" style="width:6px;"><div class="end"> </div></div></div></div><div class="viewport" style=" height:250px; width:252px; font-family:Arial !important;"><div class="overview" style="text-align:justify; display:block;"><div>This dress material in red and green colour comes from the house of Cotton Bazaar. The dress material has <b>floral embroidered detailing</b> on the kurti piece and dupatta and comes in red salwar piece.  <br/><br/><b>Features</b><ul style="margin-left: 20px;"><li type="disc"><b>Brand:</b> Cotton Bazaar</li><li type="disc"><b>Category:</b>  Traditional and Ethnic Wear</li><li type="disc"><b>Type:</b> Dress Material</li><li type="disc"><b>Fabric:</b> Cotton  Chiffon</li><li type="disc"><b>Colour:</b> Green  Red</li></ul><br/><b>Wash &amp; Care</b><br/>  Do not bleach or dry clean.<br> Wash with like colours.<br> Line dry. <br>Warm iron<br><br/><b>Note:</b> There may be a slight colour variation in the image from original product. </br></br></br></br></div></div></div> </div>,,16:04:2014,
488593,cotton bazaar brown cotton dress materials,http://www.yebhi.com/online-shopping/women/dress-materials/sarees/salwar-kameez-set/kurta-kurtis/leggings-and-jeggings.html?affint=women-topmenu,808,Traditional-Ethnic,dress-materials,cotton-bazaar,http://im6.ybndc.com/upload/488593/ProductRear635304092808526000.jpg,808,,Women,http://www.yebhi.com/488593/PD/cotton-bazaar-brown-cotton-dress-materials.htm,yebhi.com,Cotton Bazaar Brown Cotton - Dress Materials Buy Online,Cotton Bazaar Brown Cotton - Dress Materials  Best Price Rs 808.00  EMI Rs 135 for 6 months FREE Shipping In Stock - Delivery in 6-8 Days,None,<div class="product_detail_columns tinyscrl" itemprop="description" style=""><div class="scrollbar" style="width:2px; height:250px; background:#9E9E9E;"><div class="track" style="width:2px;"><div class="thumb" style="width:6px;"><div class="end"> </div></div></div></div><div class="viewport" style=" height:250px; width:252px; font-family:Arial !important;"><div class="overview" style="text-align:justify; display:block;"><div>Top : 2.50 M  Bottom : 2.00 M  Dupatta : 2.25 M  Top : Printed Cotton  Bottom : Cotton  Dupatta : Cotton  NON PADDED Printed DRYCLEAN Infuse your real elegance by wearing this amazing attire that comprises cotton material on its top  bottom &amp; dupatta to give pleasing feel as you wear it for any casual move. It comes with alluring color shade with catchy printed design. One should adjoin this exotic attire to their wardrobe for amazing look like never before. </div></div></div> </div>,,16:04:2014,
467452,cotton bazaar pink cotton sarees,http://www.yebhi.com/online-shopping/women/dress-materials/sarees/salwar-kameez-set/kurta-kurtis/leggings-and-jeggings.html?affint=women-topmenu,899,Traditional-Ethnic,dress-materials,cotton-bazaar,http://im6.ybndc.com/upload/467452/ProductRear635279057883974000.jpg,899,,Women,http://www.yebhi.com/467452/PD/cotton-bazaar-pink-cotton-sarees.htm,yebhi.com,Cotton Bazaar Pink Cotton - Sarees Buy Online,Cotton Bazaar Pink Cotton - Sarees  Best Price Rs 899.00  EMI Rs 150 for 6 months FREE Shipping In Stock - Delivery in 6-8 Days,None,<div class="product_detail_columns tinyscrl" itemprop="description" style=""><div class="scrollbar" style="width:2px; height:250px; background:#9E9E9E;"><div class="track" style="width:2px;"><div class="thumb" style="width:6px;"><div class="end"> </div></div></div></div><div class="viewport" style=" height:250px; width:252px; font-family:Arial !important;"><div class="overview" style="text-align:justify; display:block;"><div>Presenting you an amazing assortment that hugs alluring design with an embossing color touch. One should drape this attire that assures to give an eye catchy getup as desired. This simple yet elegant saree features cotton material which gives relaxing feel as you drape it for any casual move. Plain Saree  NON PADDED  Pink &amp; Green Color </div></div></div> </div>,,16:04:2014,
dress-materials,Women,http://www.yebhi.com/online-shopping/women/dress-materials/sarees/salwar-kameez-set/kurta-kurtis/leggings-and-jeggings.html?affint=women-topmenu,http://www.yebhi.com/online-shopping/cotton-bazaar/women/dress-materials/sarees/salwar-kameez-set/leggings-and-jeggings/dress-materials/kurta-kurtis.html?affint=women-topmenu&lc=Brands,Traditional-Ethnic,dress-materials,cotton-bazaar,http://www.yebhi.com/online-shopping/women/dress-materials/sarees/salwar-kameez-set/leggings-and-jeggings/kurta-kurtis/dress-materials.html?affint=women-topmenu&lc=Category,cotton-bazaar,,Women,Traditional-Ethnic,yebhi.com,Cotton Bazaar Orange Cotton - Dress Materials Buy Online,Cotton Bazaar Orange Cotton - Dress Materials  Best Price Rs 1056.00  EMI Rs 176 for 6 months FREE Shipping In Stock - Delivery in 9-12 Days,cotton bazaar orange cotton dress materials,<div class="product_detail_columns tinyscrl" itemprop="description" style=""><div class="scrollbar" style="width:2px; height:250px; background:#9E9E9E;"><div class="track" style="width:2px;"><div class="thumb" style="width:6px;"><div class="end"> </div></div></div></div><div class="viewport" style=" height:250px; width:252px; font-family:Arial !important;"><div class="overview" style="text-align:justify; display:block;"><div>Get in touch with your feminine touch as you wear this fabulous piece of salwar suit that carries most appealing pure cotton material on its top  bottom &amp; dupatta. The suit is sure to give relaxing feel &amp; appeal showers of compliments like never before. Top : 2.45 M  Bottom : 2.00 M  Dupatta : 2.35 M  Top : Pure Cotton  Bottom : Pure Cotton  Dupatta : Pure Cotton </div></div></div> </div>,,16:04:2014,
488594,cotton bazaar brown cotton dress materials,http://www.yebhi.com/online-shopping/women/dress-materials/sarees/salwar-kameez-set/kurta-kurtis/leggings-and-jeggings.html?affint=women-topmenu,808,Traditional-Ethnic,dress-materials,cotton-bazaar,http://im6.ybndc.com/upload/488594/ProductRear635304092812270000.jpg,808,,Women,http://www.yebhi.com/488594/PD/cotton-bazaar-brown-cotton-dress-materials.htm,yebhi.com,Cotton Bazaar Brown Cotton - Dress Materials Buy Online,Cotton Bazaar Brown Cotton - Dress Materials  Best Price Rs 808.00  EMI Rs 135 for 6 months FREE Shipping In Stock - Delivery in 6-8 Days,None,<div class="product_detail_columns tinyscrl" itemprop="description" style=""><div class="scrollbar" style="width:2px; height:250px; background:#9E9E9E;"><div class="track" style="width:2px;"><div class="thumb" style="width:6px;"><div class="end"> </div></div></div></div><div class="viewport" style=" height:250px; width:252px; font-family:Arial !important;"><div class="overview" style="text-align:justify; display:block;"><div>Top : 2.50 M  Bottom : 2.00 M  Dupatta : 2.25 M  Top : Printed Cotton  Bottom : Cotton  Dupatta : Cotton  NON PADDED Printed DRYCLEAN Femininity depends on attire that you wear! Drape this amazing salwar suit that comes with cotton material on its top  bottom &amp; dupatta. The suit hugs light brown &amp; turquoise color touch which really looks fabulous for any occasion. Traditional print on it assures to grab an attention.  </div></div></div> </div>,,16:04:2014,
416368,cotton bazaar red dress materials,http://www.yebhi.com/online-shopping/women/dress-materials/sarees/salwar-kameez-set/kurta-kurtis/leggings-and-jeggings.html?affint=women-topmenu,949,Traditional-Ethnic,dress-materials,cotton-bazaar,http://im6.ybndc.com/upload/416368/ProductRear635193572398821548.jpg,949,,Women,http://www.yebhi.com/416368/PD/cotton-bazaar-red-dress-materials.htm,yebhi.com,Cotton Bazaar Red - Dress Materials Buy Online,Cotton Bazaar Red - Dress Materials  Best Price Rs 949.00  EMI Rs 158 for 6 months FREE Shipping In Stock - Delivery in 13-17 Days,None,<div class="product_detail_columns tinyscrl" itemprop="description" style=""><div class="scrollbar" style="width:2px; height:250px; background:#9E9E9E;"><div class="track" style="width:2px;"><div class="thumb" style="width:6px;"><div class="end"> </div></div></div></div><div class="viewport" style=" height:250px; width:252px; font-family:Arial !important;"><div class="overview" style="text-align:justify; display:block;"><div>Get a traditional look with this dress material crafted from high quality <b>cotton fabric.</b> In a <b>printed pattern all over in red and beige colour</b> this dress material comes from the house of <b>Cotton Bazaar.</b> <br/><br/><b>Features</b><ul style="margin-left: 20px;"><li type="disc"><b>Brand:</b> Cotton Bazaar</li><li type="disc"><b>Category:</b>  Traditional and Ethnic Wear</li><li type="disc"><b>Type:</b> Dress Material</li><li type="disc"><b>Fabric:</b> Cotton</li><li type="disc"><b>Colour:</b> Red  Beige</li></ul><br/><b>Wash &amp; Care</b><br/>  Wash it with a mild detergent.<br> Do not bleach or dry clean.<br> Wash with like colours.<br> Line dry. <br>Warm iron<br><br><b>Note:</b> There may be a slight colour variation in the image from original product. </br></br></br></br></br></br></div></div></div> </div>,,16:04:2014,
467446,cotton bazaar red cotton sarees,http://www.yebhi.com/online-shopping/women/dress-materials/sarees/salwar-kameez-set/kurta-kurtis/leggings-and-jeggings.html?affint=women-topmenu,899,Traditional-Ethnic,dress-materials,cotton-bazaar,http://im6.ybndc.com/upload/467446/ProductRear635279057864786000.jpg,899,,Women,http://www.yebhi.com/467446/PD/cotton-bazaar-red-cotton-sarees.htm,yebhi.com,Cotton Bazaar Red Cotton - Sarees Buy Online,Cotton Bazaar Red Cotton - Sarees  Best Price Rs 899.00  EMI Rs 150 for 6 months FREE Shipping In Stock - Delivery in 6-8 Days,None,<div class="product_detail_columns tinyscrl" itemprop="description" style=""><div class="scrollbar" style="width:2px; height:250px; background:#9E9E9E;"><div class="track" style="width:2px;"><div class="thumb" style="width:6px;"><div class="end"> </div></div></div></div><div class="viewport" style=" height:250px; width:252px; font-family:Arial !important;"><div class="overview" style="text-align:justify; display:block;"><div>Here is the fashion you thirst for! Desired material quality with eye catchy plain design makes this attire exclusive apparel for casual wear. This cotton saree assures to give pleasing feel as you drape it for any casual move! Pair it with minimal jewels to comlete the desired getup like never before. Plain Saree  NON PADDED  White &amp; Red Color </div></div></div> </div>,,16:04:2014,
