467475,cotton bazaar green cotton sarees,http://www.yebhi.com/online-shopping/women/dress-materials/sarees/salwar-kameez-set/kurta-kurtis/leggings-and-jeggings.html?affint=women-topmenu,899,Traditional-Ethnic,dress-materials,cotton-bazaar,http://im6.ybndc.com/upload/467475/ProductRear635279057958542000.jpg,899,,Women,http://www.yebhi.com/467475/PD/cotton-bazaar-green-cotton-sarees.htm,yebhi.com,Cotton Bazaar Green Cotton - Sarees Buy Online,Cotton Bazaar Green Cotton - Sarees  Best Price Rs 899.00  EMI Rs 150 for 6 months FREE Shipping In Stock - Delivery in 6-8 Days,None,<div class="product_detail_columns tinyscrl" itemprop="description" style=""><div class="scrollbar" style="width:2px; height:250px; background:#9E9E9E;"><div class="track" style="width:2px;"><div class="thumb" style="width:6px;"><div class="end"> </div></div></div></div><div class="viewport" style=" height:250px; width:252px; font-family:Arial !important;"><div class="overview" style="text-align:justify; display:block;"><div>Dazzle and shine with this cotton saree that features simple yet catchy color touch to attract the viewers. One can attain desired quality through this marvelous collection that assures to give spotting persona like never before. Plain Saree  NON PADDED  Green Color </div></div></div> </div>,,16:04:2014,
485592,cotton bazaar green cotton dress materials,http://www.yebhi.com/online-shopping/women/dress-materials/sarees/salwar-kameez-set/kurta-kurtis/leggings-and-jeggings.html?affint=women-topmenu,1056,Traditional-Ethnic,dress-materials,cotton-bazaar,http://im6.ybndc.com/upload/485592/ProductRear635297260259082000.jpg,1056,,Women,http://www.yebhi.com/485592/PD/cotton-bazaar-green-cotton-dress-materials.htm,yebhi.com,Cotton Bazaar Green Cotton - Dress Materials Buy Online,Cotton Bazaar Green Cotton - Dress Materials  Best Price Rs 1056.00  EMI Rs 176 for 6 months FREE Shipping In Stock - Delivery in 9-12 Days,None,<div class="product_detail_columns tinyscrl" itemprop="description" style=""><div class="scrollbar" style="width:2px; height:250px; background:#9E9E9E;"><div class="track" style="width:2px;"><div class="thumb" style="width:6px;"><div class="end"> </div></div></div></div><div class="viewport" style=" height:250px; width:252px; font-family:Arial !important;"><div class="overview" style="text-align:justify; display:block;"><div>Here is the perfect attire that will define your real elegance with its enchanting printed &amp; alluring color touch. This stunning salwar suit features pure cotton on its top  bottom &amp; dupatta to give a comfort feel as you drape it for any casual move.   Top : 2.45 M  Bottom : 2.00 M  Dupatta : 2.35 M  Top : Pure Cotton  Bottom : Pure Cotton  Dupatta : Pure Cotton </div></div></div> </div>,,16:04:2014,
467518,cotton bazaar brown cotton sarees,http://www.yebhi.com/online-shopping/women/dress-materials/sarees/salwar-kameez-set/kurta-kurtis/leggings-and-jeggings.html?affint=women-topmenu,999,Traditional-Ethnic,dress-materials,cotton-bazaar,http://im6.ybndc.com/upload/467518/ProductRear635279058100502000.jpg,999,,Women,http://www.yebhi.com/467518/PD/cotton-bazaar-brown-cotton-sarees.htm,yebhi.com,Cotton Bazaar Brown Cotton - Sarees Buy Online,Cotton Bazaar Brown Cotton - Sarees  Best Price Rs 999.00  EMI Rs 167 for 6 months FREE Shipping In Stock - Delivery in 6-8 Days,None,<div class="product_detail_columns tinyscrl" itemprop="description" style=""><div class="scrollbar" style="width:2px; height:250px; background:#9E9E9E;"><div class="track" style="width:2px;"><div class="thumb" style="width:6px;"><div class="end"> </div></div></div></div><div class="viewport" style=" height:250px; width:252px; font-family:Arial !important;"><div class="overview" style="text-align:justify; display:block;"><div>One should experience drastic change in fashion sense as it tends to change now &amp; then. Here is the apparel to fulfill all your desires through its fascinating design and great color combination.Plain Saree  NON PADDED  Brown Color </div></div></div> </div>,,16:04:2014,
416383,cotton bazaar beige cotton dress materials,http://www.yebhi.com/online-shopping/women/dress-materials/sarees/salwar-kameez-set/kurta-kurtis/leggings-and-jeggings.html?affint=women-topmenu,799,Traditional-Ethnic,dress-materials,cotton-bazaar,http://im6.ybndc.com/upload/416383/ProductRear635193572453733900.jpg,799,,Women,http://www.yebhi.com/416383/PD/cotton-bazaar-beige-cotton-dress-materials.htm,yebhi.com,Cotton Bazaar Beige Cotton - Dress Materials Buy Online,Cotton Bazaar Beige Cotton - Dress Materials  Best Price Rs 799.00  EMI Rs 133 for 6 months FREE Shipping In Stock - Delivery in 13-17 Days,None,<div class="product_detail_columns tinyscrl" itemprop="description" style=""><div class="scrollbar" style="width:2px; height:250px; background:#9E9E9E;"><div class="track" style="width:2px;"><div class="thumb" style="width:6px;"><div class="end"> </div></div></div></div><div class="viewport" style=" height:250px; width:252px; font-family:Arial !important;"><div class="overview" style="text-align:justify; display:block;"><div>Get a traditional look with this dress material crafted from <b>high quality cotton fabric.</b> In a <b>printed pattern all over</b> in <b>beige and brown</b> colour this dress material comes from the house of <b>Cotton Bazaar.</b><br/><br/><b>Features</b><ul style="margin-left: 20px;"><li type="disc"><b>Brand: </b>Cotton Bazaar</li><li type="disc"><b>Category: </b>Traditional and Ethnic Wear</li><li type="disc"><b>Type: </b> Dress Material</li><li type="disc"><b>Fabric: </b> Cotton  Polyester</li><li type="disc"><b>Colour: </b> Beige  Brown</li></ul><br/><b>Wash and Care </b><br/>  Do not bleach or dry clean.<br/> Wash with like colours.<br/> Line dry. <br/>  Warm iron<br/><br/><b>Note:</b> There may be a slight colour variation in the image from original product. </div></div></div> </div>,,16:04:2014,
467679,cotton bazaar mustard cotton sarees,http://www.yebhi.com/online-shopping/women/dress-materials/sarees/salwar-kameez-set/kurta-kurtis/leggings-and-jeggings.html?affint=women-topmenu,899,Traditional-Ethnic,dress-materials,cotton-bazaar,http://im6.ybndc.com/upload/467679/ProductRear635279058638078000.jpg,899,,Women,http://www.yebhi.com/467679/PD/cotton-bazaar-mustard-cotton-sarees.htm,yebhi.com,Cotton Bazaar Mustard Cotton - Sarees Buy Online,Cotton Bazaar Mustard Cotton - Sarees  Best Price Rs 899.00  EMI Rs 150 for 6 months FREE Shipping In Stock - Delivery in 6-8 Days,None,<div class="product_detail_columns tinyscrl" itemprop="description" style=""><div class="scrollbar" style="width:2px; height:250px; background:#9E9E9E;"><div class="track" style="width:2px;"><div class="thumb" style="width:6px;"><div class="end"> </div></div></div></div><div class="viewport" style=" height:250px; width:252px; font-family:Arial !important;"><div class="overview" style="text-align:justify; display:block;"><div>A sensational getup can be grabbed through this superb collection from Fabdeal house. This casual wear saree has an embossing color touch that asssures to give spotting persona in the occasion you step in. The perfect collection to attain desired quality.Plain Saree  NON PADDED  Yellow Color </div></div></div> </div>,,16:04:2014,
485594,cotton bazaar pink cotton dress materials,http://www.yebhi.com/online-shopping/women/dress-materials/sarees/salwar-kameez-set/kurta-kurtis/leggings-and-jeggings.html?affint=women-topmenu,1056,Traditional-Ethnic,dress-materials,cotton-bazaar,http://im6.ybndc.com/upload/485594/ProductRear635297260266726000.jpg,1056,,Women,http://www.yebhi.com/485594/PD/cotton-bazaar-pink-cotton-dress-materials.htm,yebhi.com,Cotton Bazaar Pink Cotton - Dress Materials Buy Online,Cotton Bazaar Pink Cotton - Dress Materials  Best Price Rs 1056.00  EMI Rs 176 for 6 months FREE Shipping In Stock - Delivery in 9-12 Days,None,<div class="product_detail_columns tinyscrl" itemprop="description" style=""><div class="scrollbar" style="width:2px; height:250px; background:#9E9E9E;"><div class="track" style="width:2px;"><div class="thumb" style="width:6px;"><div class="end"> </div></div></div></div><div class="viewport" style=" height:250px; width:252px; font-family:Arial !important;"><div class="overview" style="text-align:justify; display:block;"><div>Flaunt your fabulous side this season by wearing attire that carries simplicity with elegance. This dress will keep you comfortable all day long as it features cotton material on its top  bottom &amp; dupatta. The suit is shaded in orange &amp; peach color that drags ones attention with gazing looks.  Top : 2.45 M  Bottom : 2.00 M  Dupatta : 2.35 M  Top : Pure Cotton  Bottom : Pure Cotton  Dupatta : Pure Cotton </div></div></div> </div>,,16:04:2014,
416338,cotton bazaar green dress materials,http://www.yebhi.com/online-shopping/women/dress-materials/sarees/salwar-kameez-set/kurta-kurtis/leggings-and-jeggings.html?affint=women-topmenu,1099,Traditional-Ethnic,dress-materials,cotton-bazaar,http://im6.ybndc.com/upload/416338/ProductRear635193572289152845.jpg,1099,,Women,http://www.yebhi.com/416338/PD/cotton-bazaar-green-dress-materials.htm,yebhi.com,Cotton Bazaar Green - Dress Materials Buy Online,Cotton Bazaar Green - Dress Materials  Best Price Rs 1099.00  EMI Rs 183 for 6 months FREE Shipping In Stock - Delivery in 13-17 Days,None,<div class="product_detail_columns tinyscrl" itemprop="description" style=""><div class="scrollbar" style="width:2px; height:250px; background:#9E9E9E;"><div class="track" style="width:2px;"><div class="thumb" style="width:6px;"><div class="end"> </div></div></div></div><div class="viewport" style=" height:250px; width:252px; font-family:Arial !important;"><div class="overview" style="text-align:justify; display:block;"><div>Get a traditional look with this dress material crafted from high quality <b>cotton fabric.</b> In a <b>printed pattern all over in green  red and beige colour</b> this dress material comes from the house of <b>Cotton Bazaar.</b> <br/><br/><b>Features</b><ul style="margin-left: 20px;"><li type="disc"><b>Brand:</b> Cotton Bazaar</li><li type="disc"><b>Category:</b>  Traditional and Ethnic Wear</li><li type="disc"><b>Type:</b> Dress Material</li><li type="disc"><b>Fabric:</b> Cotton</li><li type="disc"><b>Colour:</b> Green  Red  Beige</li></ul><br/><b>Wash &amp; Care</b><br/>  Wash it with a mild detergent.<br> Do not bleach or dry clean.<br> Wash with like colours.<br> Line dry. <br>Warm iron<br><br><b>Note:</b> There may be a slight colour variation in the image from original product. </br></br></br></br></br></br></div></div></div> </div>,,16:04:2014,
467516,cotton bazaar red cotton sarees,http://www.yebhi.com/online-shopping/women/dress-materials/sarees/salwar-kameez-set/kurta-kurtis/leggings-and-jeggings.html?affint=women-topmenu,999,Traditional-Ethnic,dress-materials,cotton-bazaar,http://im6.ybndc.com/upload/467516/ProductRear635279058093950000.jpg,999,,Women,http://www.yebhi.com/467516/PD/cotton-bazaar-red-cotton-sarees.htm,yebhi.com,Cotton Bazaar Red Cotton - Sarees Buy Online,Cotton Bazaar Red Cotton - Sarees  Best Price Rs 999.00  EMI Rs 167 for 6 months FREE Shipping In Stock - Delivery in 6-8 Days,None,<div class="product_detail_columns tinyscrl" itemprop="description" style=""><div class="scrollbar" style="width:2px; height:250px; background:#9E9E9E;"><div class="track" style="width:2px;"><div class="thumb" style="width:6px;"><div class="end"> </div></div></div></div><div class="viewport" style=" height:250px; width:252px; font-family:Arial !important;"><div class="overview" style="text-align:justify; display:block;"><div>One should experience drastic change in fashion sense as it tends to change now &amp; then. Here is the apparel to fulfill all your desires through its fascinating design and great color combination.Plain Saree  NON PADDED  Maroon Color </div></div></div> </div>,,16:04:2014,
416346,cotton bazaar grey dress materials,http://www.yebhi.com/online-shopping/women/dress-materials/sarees/salwar-kameez-set/kurta-kurtis/leggings-and-jeggings.html?affint=women-topmenu,1099,Traditional-Ethnic,dress-materials,cotton-bazaar,http://im6.ybndc.com/upload/416346/ProductRear635193572317857029.jpg,1099,,Women,http://www.yebhi.com/416346/PD/cotton-bazaar-grey-dress-materials.htm,yebhi.com,Cotton Bazaar Grey - Dress Materials Buy Online,Cotton Bazaar Grey - Dress Materials  Best Price Rs 1099.00  EMI Rs 183 for 6 months FREE Shipping In Stock - Delivery in 13-17 Days,None,<div class="product_detail_columns tinyscrl" itemprop="description" style=""><div class="scrollbar" style="width:2px; height:250px; background:#9E9E9E;"><div class="track" style="width:2px;"><div class="thumb" style="width:6px;"><div class="end"> </div></div></div></div><div class="viewport" style=" height:250px; width:252px; font-family:Arial !important;"><div class="overview" style="text-align:justify; display:block;"><div>Get a traditional look with this dress material crafted from <b>high quality cotton and polyester</b> fabric. In a <b>printed pattern all over</b> in <b>grey and red</b> colour this dress material comes from the house of Cotton Bazaar. <br/><br/><b>Features</b><ul style="margin-left: 20px;"><li type="disc"><b>Brand: </b>Cotton Bazaar</li><li type="disc"><b>Category: </b>Traditional and Ethnic Wear</li><li type="disc"><b>Type: </b> Dress Material</li><li type="disc"><b>Fabric: </b> Cotton  Polyester</li><li type="disc"><b>Colour: </b> Grey  Red </li></ul><br/><b>Wash and Care </b><br/>  Do not bleach or dry clean.<br/> Wash with like colours.<br/> Line dry. <br/>  Warm iron<br/><br/><b>Note:</b> There may be a slight colour variation in the image from original product. </div></div></div> </div>,,16:04:2014,
467682,cotton bazaar pink cotton sarees,http://www.yebhi.com/online-shopping/women/dress-materials/sarees/salwar-kameez-set/kurta-kurtis/leggings-and-jeggings.html?affint=women-topmenu,899,Traditional-Ethnic,dress-materials,cotton-bazaar,http://im6.ybndc.com/upload/467682/ProductRear635279058648998000.jpg,899,,Women,http://www.yebhi.com/467682/PD/cotton-bazaar-pink-cotton-sarees.htm,yebhi.com,Cotton Bazaar Pink Cotton - Sarees Buy Online,Cotton Bazaar Pink Cotton - Sarees  Best Price Rs 899.00  EMI Rs 150 for 6 months FREE Shipping In Stock - Delivery in 6-8 Days,None,<div class="product_detail_columns tinyscrl" itemprop="description" style=""><div class="scrollbar" style="width:2px; height:250px; background:#9E9E9E;"><div class="track" style="width:2px;"><div class="thumb" style="width:6px;"><div class="end"> </div></div></div></div><div class="viewport" style=" height:250px; width:252px; font-family:Arial !important;"><div class="overview" style="text-align:justify; display:block;"><div>All those who aim to grab flattering getup can prefer this most fascinating attire that comprises an alluring design and eye catchy color touch. This cotton saree from fabdeal house assures to give dazzling look which will blow the conscious.Plain Saree  NON PADDED  Orange &amp; Black Color </div></div></div> </div>,,16:04:2014,
383554,cotton bazaar black cotton dress materials,http://www.yebhi.com/online-shopping/women/dress-materials/sarees/salwar-kameez-set/kurta-kurtis/leggings-and-jeggings.html?affint=women-topmenu,899,Traditional-Ethnic,dress-materials,cotton-bazaar,http://im6.ybndc.com/upload/383554/ProductRear635183845952101653.jpg,899,,Women,http://www.yebhi.com/383554/PD/cotton-bazaar-black-cotton-dress-materials.htm,yebhi.com,Cotton Bazaar Black Cotton - Dress Materials Buy Online,Cotton Bazaar Black Cotton - Dress Materials  Best Price Rs 899.00  EMI Rs 150 for 6 months FREE Shipping In Stock - Delivery in 9-12 Days,None,<div class="product_detail_columns tinyscrl" itemprop="description" style=""><div class="scrollbar" style="width:2px; height:250px; background:#9E9E9E;"><div class="track" style="width:2px;"><div class="thumb" style="width:6px;"><div class="end"> </div></div></div></div><div class="viewport" style=" height:250px; width:252px; font-family:Arial !important;"><div class="overview" style="text-align:justify; display:block;"><div><b>Cotton Bazaar</b> brings this dress material that has <b>floral prints </b> all over on the beige kameez piece. The salwar piece and the dupatta have <b> zig zag prints </b> and the set has been crafted from <b> cotton.</b><br/><br/><b>Features</b><ul style="margin-left: 20px;"><li type="disc"><b>Brand: </b>Cotton Bazaar</li><li type="disc"><b>Category: </b>Traditional and Ethnic Wear</li><li type="disc"><b>Type: </b> Dress Material</li><li type="disc"><b>Fabric: </b> Cotton</li><li type="disc"><b>Colour: </b> Black  Beige</li></ul><br/><b>Wash and Care </b><br/>  Do not bleach or dry clean.<br/> Wash with like colours.<br/> Line dry. <br/>  Warm iron<br/><br/><b>Note:</b> There may be a slight colour variation in the image from original product. </div></div></div> </div>,,16:04:2014,
467451,cotton bazaar pink cotton sarees,http://www.yebhi.com/online-shopping/women/dress-materials/sarees/salwar-kameez-set/kurta-kurtis/leggings-and-jeggings.html?affint=women-topmenu,899,Traditional-Ethnic,dress-materials,cotton-bazaar,http://im6.ybndc.com/upload/467451/ProductRear635279057880854000.jpg,899,,Women,http://www.yebhi.com/467451/PD/cotton-bazaar-pink-cotton-sarees.htm,yebhi.com,Cotton Bazaar Pink Cotton - Sarees Buy Online,Cotton Bazaar Pink Cotton - Sarees  Best Price Rs 899.00  EMI Rs 150 for 6 months FREE Shipping In Stock - Delivery in 6-8 Days,None,<div class="product_detail_columns tinyscrl" itemprop="description" style=""><div class="scrollbar" style="width:2px; height:250px; background:#9E9E9E;"><div class="track" style="width:2px;"><div class="thumb" style="width:6px;"><div class="end"> </div></div></div></div><div class="viewport" style=" height:250px; width:252px; font-family:Arial !important;"><div class="overview" style="text-align:justify; display:block;"><div>Presenting you an amazing assortment that hugs alluring design with an embossing color touch. One should drape this attire that assures to give an eye catchy getup as desired. This simple yet elegant saree features cotton material which gives relaxing feel as you drape it for any casual move. Plain Saree  NON PADDED  White &amp; Light Pink Color </div></div></div> </div>,,16:04:2014,
467632,cotton bazaar cotton sarees,http://www.yebhi.com/online-shopping/women/dress-materials/sarees/salwar-kameez-set/kurta-kurtis/leggings-and-jeggings.html?affint=women-topmenu,1099,Traditional-Ethnic,dress-materials,cotton-bazaar,http://im6.ybndc.com/upload/467632/ProductRear635279058480206000.jpg,1099,,Women,http://www.yebhi.com/467632/PD/cotton-bazaar-cotton-sarees.htm,yebhi.com,Cotton Bazaar Cotton - Sarees Buy Online,Cotton Bazaar Cotton - Sarees  Best Price Rs 1099.00  EMI Rs 183 for 6 months FREE Shipping In Stock - Delivery in 6-8 Days,None,<div class="product_detail_columns tinyscrl" itemprop="description" style=""><div class="scrollbar" style="width:2px; height:250px; background:#9E9E9E;"><div class="track" style="width:2px;"><div class="thumb" style="width:6px;"><div class="end"> </div></div></div></div><div class="viewport" style=" height:250px; width:252px; font-family:Arial !important;"><div class="overview" style="text-align:justify; display:block;"><div>If you wish to go parallel with fashion then grab this assortment that has an appealing cotton material with an eye catchy color shade. This attire assures you to give a spotting image with its pleasing material quality. There may be color variation due to resolution of actual photo.Plain Saree  NON PADDED  Multi Color </div></div></div> </div>,,16:04:2014,
467628,cotton bazaar green cotton sarees,http://www.yebhi.com/online-shopping/women/dress-materials/sarees/salwar-kameez-set/kurta-kurtis/leggings-and-jeggings.html?affint=women-topmenu,1099,Traditional-Ethnic,dress-materials,cotton-bazaar,http://im6.ybndc.com/upload/467628/ProductRear635279058466946000.jpg,1099,,Women,http://www.yebhi.com/467628/PD/cotton-bazaar-green-cotton-sarees.htm,yebhi.com,Cotton Bazaar Green Cotton - Sarees Buy Online,Cotton Bazaar Green Cotton - Sarees  Best Price Rs 1099.00  EMI Rs 183 for 6 months FREE Shipping In Stock - Delivery in 6-8 Days,None,<div class="product_detail_columns tinyscrl" itemprop="description" style=""><div class="scrollbar" style="width:2px; height:250px; background:#9E9E9E;"><div class="track" style="width:2px;"><div class="thumb" style="width:6px;"><div class="end"> </div></div></div></div><div class="viewport" style=" height:250px; width:252px; font-family:Arial !important;"><div class="overview" style="text-align:justify; display:block;"><div>Definition of beauty gets new turn as you drape this mesmerizing saree which has most appealing cotton material with superb color touch. This attire features simple yet elegant design that gives spotting persona with its intricate detailing. One has to take a pick in this attire to grab an eye catchy getup. There may be color variation due to resolution of actual photo.Plain Saree  NON PADDED  Green Color </div></div></div> </div>,,16:04:2014,
467636,cotton bazaar cotton sarees,http://www.yebhi.com/online-shopping/women/dress-materials/sarees/salwar-kameez-set/kurta-kurtis/leggings-and-jeggings.html?affint=women-topmenu,1099,Traditional-Ethnic,dress-materials,cotton-bazaar,http://im6.ybndc.com/upload/467636/ProductRear635279058493778000.jpg,1099,,Women,http://www.yebhi.com/467636/PD/cotton-bazaar-cotton-sarees.htm,yebhi.com,Cotton Bazaar Cotton - Sarees Buy Online,Cotton Bazaar Cotton - Sarees  Best Price Rs 1099.00  EMI Rs 183 for 6 months FREE Shipping In Stock - Delivery in 6-8 Days,None,<div class="product_detail_columns tinyscrl" itemprop="description" style=""><div class="scrollbar" style="width:2px; height:250px; background:#9E9E9E;"><div class="track" style="width:2px;"><div class="thumb" style="width:6px;"><div class="end"> </div></div></div></div><div class="viewport" style=" height:250px; width:252px; font-family:Arial !important;"><div class="overview" style="text-align:justify; display:block;"><div>Here is the attire that enriches your elegance with its appealing material quality. This attire has most appealing cotton fabric which is shaded in catchy color touch. This casual wear saree keeps you parallel with the present fashion sense to make the heads turn around. One should hit an ultimate purchase to attain desired quality. There may be color variation due to resolution of actual photo.Plain Saree  NON PADDED  Multi Color </div></div></div> </div>,,16:04:2014,
467519,cotton bazaar brown cotton sarees,http://www.yebhi.com/online-shopping/women/dress-materials/sarees/salwar-kameez-set/kurta-kurtis/leggings-and-jeggings.html?affint=women-topmenu,999,Traditional-Ethnic,dress-materials,cotton-bazaar,http://im6.ybndc.com/upload/467519/ProductRear635279058103778000.jpg,999,,Women,http://www.yebhi.com/467519/PD/cotton-bazaar-brown-cotton-sarees.htm,yebhi.com,Cotton Bazaar Brown Cotton - Sarees Buy Online,Cotton Bazaar Brown Cotton - Sarees  Best Price Rs 999.00  EMI Rs 167 for 6 months FREE Shipping In Stock - Delivery in 6-8 Days,None,<div class="product_detail_columns tinyscrl" itemprop="description" style=""><div class="scrollbar" style="width:2px; height:250px; background:#9E9E9E;"><div class="track" style="width:2px;"><div class="thumb" style="width:6px;"><div class="end"> </div></div></div></div><div class="viewport" style=" height:250px; width:252px; font-family:Arial !important;"><div class="overview" style="text-align:justify; display:block;"><div>One should experience drastic change in fashion sense as it tends to change now &amp; then. Here is the apparel to fulfill all your desires through its fascinating design and great color combination.Plain Saree  NON PADDED  Brown Color </div></div></div> </div>,,16:04:2014,
467610,cotton bazaar brown cotton sarees,http://www.yebhi.com/online-shopping/women/dress-materials/sarees/salwar-kameez-set/kurta-kurtis/leggings-and-jeggings.html?affint=women-topmenu,1099,Traditional-Ethnic,dress-materials,cotton-bazaar,http://im6.ybndc.com/upload/467610/ProductRear635279058406418000.jpg,1099,,Women,http://www.yebhi.com/467610/PD/cotton-bazaar-brown-cotton-sarees.htm,yebhi.com,Cotton Bazaar Brown Cotton - Sarees Buy Online,Cotton Bazaar Brown Cotton - Sarees  Best Price Rs 1099.00  EMI Rs 183 for 6 months FREE Shipping In Stock - Delivery in 6-8 Days,None,<div class="product_detail_columns tinyscrl" itemprop="description" style=""><div class="scrollbar" style="width:2px; height:250px; background:#9E9E9E;"><div class="track" style="width:2px;"><div class="thumb" style="width:6px;"><div class="end"> </div></div></div></div><div class="viewport" style=" height:250px; width:252px; font-family:Arial !important;"><div class="overview" style="text-align:justify; display:block;"><div>Express your feminine beauty with amazing cotton saree that is sure to give catchy look as you drape it for any casual move. This saree provides you a true Indian getup with its pure ethnic work. The overall quality of saree makes you a head turner in a huge crowd. This saree can be worn for all the occasion as it got very fabric. There may be color variation due to resolution of actual photo.Plain Saree  NON PADDED  Brown Color </div></div></div> </div>,,16:04:2014,
