467575,cotton bazaar green cotton sarees,http://www.yebhi.com/online-shopping/women/dress-materials/sarees/salwar-kameez-set/kurta-kurtis/leggings-and-jeggings.html?affint=women-topmenu,1099,Traditional-Ethnic,dress-materials,cotton-bazaar,http://im6.ybndc.com/upload/467575/ProductRear635279058287234000.jpg,1099,,Women,http://www.yebhi.com/467575/PD/cotton-bazaar-green-cotton-sarees.htm,yebhi.com,Cotton Bazaar Green Cotton - Sarees Buy Online,Cotton Bazaar Green Cotton - Sarees  Best Price Rs 1099.00  EMI Rs 183 for 6 months FREE Shipping In Stock - Delivery in 6-8 Days,None,<div class="product_detail_columns tinyscrl" itemprop="description" style=""><div class="scrollbar" style="width:2px; height:250px; background:#9E9E9E;"><div class="track" style="width:2px;"><div class="thumb" style="width:6px;"><div class="end"> </div></div></div></div><div class="viewport" style=" height:250px; width:252px; font-family:Arial !important;"><div class="overview" style="text-align:justify; display:block;"><div>Here is the attire that every women aims to have in order to grab an alluring persona. It has intricate design which is embossed in pink color to give a traditional look. One can attain an alluring getup through its fantabulous reniyal fabric. This casual wear saree is the perfect attire to be a spotting image. There may be color variation due to resolution of actual photo.Plain Saree  NON PADDED  Green Color </div></div></div> </div>,,16:04:2014,
467539,cotton bazaar grey cotton sarees,http://www.yebhi.com/online-shopping/women/dress-materials/sarees/salwar-kameez-set/kurta-kurtis/leggings-and-jeggings.html?affint=women-topmenu,899,Traditional-Ethnic,dress-materials,cotton-bazaar,http://im6.ybndc.com/upload/467539/ProductRear635279058168206000.jpg,899,,Women,http://www.yebhi.com/467539/PD/cotton-bazaar-grey-cotton-sarees.htm,yebhi.com,Cotton Bazaar Grey Cotton - Sarees Buy Online,Cotton Bazaar Grey Cotton - Sarees  Best Price Rs 899.00  EMI Rs 150 for 6 months FREE Shipping In Stock - Delivery in 6-8 Days,None,<div class="product_detail_columns tinyscrl" itemprop="description" style=""><div class="scrollbar" style="width:2px; height:250px; background:#9E9E9E;"><div class="track" style="width:2px;"><div class="thumb" style="width:6px;"><div class="end"> </div></div></div></div><div class="viewport" style=" height:250px; width:252px; font-family:Arial !important;"><div class="overview" style="text-align:justify; display:block;"><div>Glamour of fashion &amp; grace of women adjoins a perfect meaning to style. One can attain a graceful getup through this amazing casual wear saree with cotton material. This attire has an embossing color shade that makes heads turn around with a gazing view. One has to get going with this attire to grab the desired persona. There may be color variation due to resolution of actual photo.Plain Saree  NON PADDED  Dark Grey Color </div></div></div> </div>,,16:04:2014,
416322,cotton bazaar yellow dress materials,http://www.yebhi.com/online-shopping/women/dress-materials/sarees/salwar-kameez-set/kurta-kurtis/leggings-and-jeggings.html?affint=women-topmenu,1099,Traditional-Ethnic,dress-materials,cotton-bazaar,http://im6.ybndc.com/upload/416322/ProductRear635193572232056479.jpg,1099,,Women,http://www.yebhi.com/416322/PD/cotton-bazaar-yellow-dress-materials.htm,yebhi.com,Cotton Bazaar Yellow - Dress Materials Buy Online,Cotton Bazaar Yellow - Dress Materials  Best Price Rs 1099.00  EMI Rs 183 for 6 months FREE Shipping In Stock - Delivery in 13-17 Days,None,<div class="product_detail_columns tinyscrl" itemprop="description" style=""><div class="scrollbar" style="width:2px; height:250px; background:#9E9E9E;"><div class="track" style="width:2px;"><div class="thumb" style="width:6px;"><div class="end"> </div></div></div></div><div class="viewport" style=" height:250px; width:252px; font-family:Arial !important;"><div class="overview" style="text-align:justify; display:block;"><div><b>Cotton Bazaar</b> brings this dress material that has <b>stripes and floral prints </b> all over on the beige and red kameez piece. The salwar piece and the dupatta have <b> abstract prints </b> and the set has been crafted from <b> cotton and polyester</b><br/><br/><b>Features</b><ul style="margin-left: 20px;"><li type="disc"><b>Brand: </b>Cotton Bazaar</li><li type="disc"><b>Category: </b>Traditional and Ethnic Wear</li><li type="disc"><b>Type: </b> Dress Material</li><li type="disc"><b>Fabric: </b> Cotton  Polyester</li><li type="disc"><b>Colour: </b> Red  Beige  Green</li></ul><br/><b>Wash and Care </b><br/>  Do not bleach or dry clean.<br/> Wash with like colours.<br/> Line dry. <br/>  Warm iron<br/><br/><b>Note:</b> There may be a slight colour variation in the image from original product. </div></div></div> </div>,,16:04:2014,
416364,cotton bazaar grey dress materials,http://www.yebhi.com/online-shopping/women/dress-materials/sarees/salwar-kameez-set/kurta-kurtis/leggings-and-jeggings.html?affint=women-topmenu,949,Traditional-Ethnic,dress-materials,cotton-bazaar,http://im6.ybndc.com/upload/416364/ProductRear635193572383221448.jpg,949,,Women,http://www.yebhi.com/416364/PD/cotton-bazaar-grey-dress-materials.htm,yebhi.com,Cotton Bazaar Grey - Dress Materials Buy Online,Cotton Bazaar Grey - Dress Materials  Best Price Rs 949.00  EMI Rs 158 for 6 months FREE Shipping In Stock - Delivery in 13-17 Days,None,<div class="product_detail_columns tinyscrl" itemprop="description" style=""><div class="scrollbar" style="width:2px; height:250px; background:#9E9E9E;"><div class="track" style="width:2px;"><div class="thumb" style="width:6px;"><div class="end"> </div></div></div></div><div class="viewport" style=" height:250px; width:252px; font-family:Arial !important;"><div class="overview" style="text-align:justify; display:block;"><div>Get a traditional look with this dress material crafted from <b>high quality cotton fabric.</b> In a <b>printed pattern</b> all over in <b>grey and red</b> colour this dress material comes from the house of <b>Cotton Bazaar.</b><br/><br/><b>Features</b><ul style="margin-left: 20px;"><li type="disc"><b>Brand: </b>Cotton Bazaar</li><li type="disc"><b>Category: </b>Traditional and Ethnic Wear</li><li type="disc"><b>Type: </b> Dress Material</li><li type="disc"><b>Fabric: </b> Cotton  Polyester</li><li type="disc"><b>Colour: </b> Grey  Red</li></ul><br/><b>Wash and Care </b><br/>  Do not bleach or dry clean.<br/> Wash with like colours.<br/> Line dry. <br/>  Warm iron<br/><br/><b>Note:</b> There may be a slight colour variation in the image from original product.   </div></div></div> </div>,,16:04:2014,
485590,cotton bazaar purple cotton dress materials,http://www.yebhi.com/online-shopping/women/dress-materials/sarees/salwar-kameez-set/kurta-kurtis/leggings-and-jeggings.html?affint=women-topmenu,1056,Traditional-Ethnic,dress-materials,cotton-bazaar,http://im6.ybndc.com/upload/485590/ProductRear635297260251906000.jpg,1056,,Women,http://www.yebhi.com/485590/PD/cotton-bazaar-purple-cotton-dress-materials.htm,yebhi.com,Cotton Bazaar Purple Cotton - Dress Materials Buy Online,Cotton Bazaar Purple Cotton - Dress Materials  Best Price Rs 1056.00  EMI Rs 176 for 6 months FREE Shipping In Stock - Delivery in 9-12 Days,None,<div class="product_detail_columns tinyscrl" itemprop="description" style=""><div class="scrollbar" style="width:2px; height:250px; background:#9E9E9E;"><div class="track" style="width:2px;"><div class="thumb" style="width:6px;"><div class="end"> </div></div></div></div><div class="viewport" style=" height:250px; width:252px; font-family:Arial !important;"><div class="overview" style="text-align:justify; display:block;"><div>Introduce your feminine elegance with this amazing piece of salwar suit that features pure cotton on its top  bottom &amp; dupatta to give relaxing feel as desired. One should get going with this marvelous piece as it hugs purple &amp; green color shade. One should adjoin this catchy piece to their wardrobe which assures to give desired look like never before. Top : 2.45 M  Bottom : 2.00 M  Dupatta : 2.35 M  Top : Pure Cotton  Bottom : Pure Cotton  Dupatta : Pure Cotton </div></div></div> </div>,,16:04:2014,
416367,cotton bazaar green dress materials,http://www.yebhi.com/online-shopping/women/dress-materials/sarees/salwar-kameez-set/kurta-kurtis/leggings-and-jeggings.html?affint=women-topmenu,949,Traditional-Ethnic,dress-materials,cotton-bazaar,http://im6.ybndc.com/upload/416367/ProductRear635193572395077524.jpg,949,,Women,http://www.yebhi.com/416367/PD/cotton-bazaar-green-dress-materials.htm,yebhi.com,Cotton Bazaar Green - Dress Materials Buy Online,Cotton Bazaar Green - Dress Materials  Best Price Rs 949.00  EMI Rs 158 for 6 months FREE Shipping In Stock - Delivery in 13-17 Days,None,<div class="product_detail_columns tinyscrl" itemprop="description" style=""><div class="scrollbar" style="width:2px; height:250px; background:#9E9E9E;"><div class="track" style="width:2px;"><div class="thumb" style="width:6px;"><div class="end"> </div></div></div></div><div class="viewport" style=" height:250px; width:252px; font-family:Arial !important;"><div class="overview" style="text-align:justify; display:block;"><div>Get a traditional look with this dress material crafted from high quality <b>cotton fabric.</b> In a <b>printed pattern all over in green and beige colour</b> this dress material comes from the house of <b>Cotton Bazaar.</b> <br/><br/><b>Features</b><ul style="margin-left: 20px;"><li type="disc"><b>Brand:</b> Cotton Bazaar</li><li type="disc"><b>Category:</b>  Traditional and Ethnic Wear</li><li type="disc"><b>Type:</b> Dress Material</li><li type="disc"><b>Fabric:</b> Cotton</li><li type="disc"><b>Colour:</b> Green  Red  Beige</li></ul><br/><b>Wash &amp; Care</b><br/>  Wash it with a mild detergent.<br> Do not bleach or dry clean.<br> Wash with like colours.<br> Line dry. <br>Warm iron<br><br><b>Note:</b> There may be a slight colour variation in the image from original product. </br></br></br></br></br></br></div></div></div> </div>,,16:04:2014,
467639,cotton bazaar cotton sarees,http://www.yebhi.com/online-shopping/women/dress-materials/sarees/salwar-kameez-set/kurta-kurtis/leggings-and-jeggings.html?affint=women-topmenu,1099,Traditional-Ethnic,dress-materials,cotton-bazaar,http://im6.ybndc.com/upload/467639/ProductRear635279058503918000.jpg,1099,,Women,http://www.yebhi.com/467639/PD/cotton-bazaar-cotton-sarees.htm,yebhi.com,Cotton Bazaar Cotton - Sarees Buy Online,Cotton Bazaar Cotton - Sarees  Best Price Rs 1099.00  EMI Rs 183 for 6 months FREE Shipping In Stock - Delivery in 6-8 Days,None,<div class="product_detail_columns tinyscrl" itemprop="description" style=""><div class="scrollbar" style="width:2px; height:250px; background:#9E9E9E;"><div class="track" style="width:2px;"><div class="thumb" style="width:6px;"><div class="end"> </div></div></div></div><div class="viewport" style=" height:250px; width:252px; font-family:Arial !important;"><div class="overview" style="text-align:justify; display:block;"><div>Here is the attire that enriches your elegance with its appealing material quality. This attire has most appealing cotton fabric which is shaded in catchy color touch. This casual wear saree keeps you parallel with the present fashion sense to make the heads turn around. One should hit an ultimate purchase to attain desired quality. There may be color variation due to resolution of actual photo.Plain Saree  NON PADDED  Multi Color </div></div></div> </div>,,16:04:2014,
346979,cotton bazaar pink dress materials,http://www.yebhi.com/online-shopping/women/dress-materials/sarees/salwar-kameez-set/kurta-kurtis/leggings-and-jeggings.html?affint=women-topmenu,1199,Traditional-Ethnic,dress-materials,cotton-bazaar,http://im6.ybndc.com/upload/346979/ProductRear635138941841317732.jpg,1199,,Women,http://www.yebhi.com/346979/PD/cotton-bazaar-pink-dress-materials.htm,yebhi.com,Cotton Bazaar Pink - Dress Materials Buy Online,Cotton Bazaar Pink - Dress Materials  Best Price Rs 1199.00  EMI Rs 200 for 6 months FREE Shipping In Stock - Delivery in 9-12 Days,None,<div class="product_detail_columns tinyscrl" itemprop="description" style=""><div class="scrollbar" style="width:2px; height:250px; background:#9E9E9E;"><div class="track" style="width:2px;"><div class="thumb" style="width:6px;"><div class="end"> </div></div></div></div><div class="viewport" style=" height:250px; width:252px; font-family:Arial !important;"><div class="overview" style="text-align:justify; display:block;"><div><table><tr><td><b>Colour</b></td><td>    </td><td>Pink   Purple</td></tr><tr><td><b>For</b></td><td>    </td><td>Women</td></tr><tr><td><b>Material</b></td><td>    </td><td>Cotton   Chiffon</td></tr><tr><td><b>Brands</b></td><td>    </td><td>Cotton Bazaar</td></tr><tr><td><b>Departments</b></td><td>    </td><td>Apparels</td></tr><tr><td><b>Category</b></td><td>    </td><td>Dress Materials</td></tr></table>  </div></div></div> </div>,,16:04:2014,
485584,cotton bazaar green cotton dress materials,http://www.yebhi.com/online-shopping/women/dress-materials/sarees/salwar-kameez-set/kurta-kurtis/leggings-and-jeggings.html?affint=women-topmenu,1056,Traditional-Ethnic,dress-materials,cotton-bazaar,http://im6.ybndc.com/upload/485584/ProductRear635297260229910000.jpg,1056,,Women,http://www.yebhi.com/485584/PD/cotton-bazaar-green-cotton-dress-materials.htm,yebhi.com,Cotton Bazaar Green Cotton - Dress Materials Buy Online,Cotton Bazaar Green Cotton - Dress Materials  Best Price Rs 1056.00  EMI Rs 176 for 6 months FREE Shipping In Stock - Delivery in 9-12 Days,None,<div class="product_detail_columns tinyscrl" itemprop="description" style=""><div class="scrollbar" style="width:2px; height:250px; background:#9E9E9E;"><div class="track" style="width:2px;"><div class="thumb" style="width:6px;"><div class="end"> </div></div></div></div><div class="viewport" style=" height:250px; width:252px; font-family:Arial !important;"><div class="overview" style="text-align:justify; display:block;"><div>Here is the salwar suit that is stylish &amp; on trend to lure the audience like never before! This salwar suit comprises pure cotton on its top  bottom &amp; dupatta. This suit goes perfect for any special event &amp; it assures to renovate your casual look &amp; appeals showers of compliments.   Top : 2.45 M  Bottom : 2.00 M  Dupatta : 2.35 M  Top : Pure Cotton  Bottom : Pure Cotton  Dupatta : Pure Cotton </div></div></div> </div>,,16:04:2014,
467501,cotton bazaar green cotton sarees,http://www.yebhi.com/online-shopping/women/dress-materials/sarees/salwar-kameez-set/kurta-kurtis/leggings-and-jeggings.html?affint=women-topmenu,899,Traditional-Ethnic,dress-materials,cotton-bazaar,http://im6.ybndc.com/upload/467501/ProductRear635279058044186000.jpg,899,,Women,http://www.yebhi.com/467501/PD/cotton-bazaar-green-cotton-sarees.htm,yebhi.com,Cotton Bazaar Green Cotton - Sarees Buy Online,Cotton Bazaar Green Cotton - Sarees  Best Price Rs 899.00  EMI Rs 150 for 6 months FREE Shipping In Stock - Delivery in 6-8 Days,None,<div class="product_detail_columns tinyscrl" itemprop="description" style=""><div class="scrollbar" style="width:2px; height:250px; background:#9E9E9E;"><div class="track" style="width:2px;"><div class="thumb" style="width:6px;"><div class="end"> </div></div></div></div><div class="viewport" style=" height:250px; width:252px; font-family:Arial !important;"><div class="overview" style="text-align:justify; display:block;"><div>This beautiful cotton saree which takes you to the uncharted territory to explore the language of texture. The material quality gives a relaxing feel to put on for casual wear. The perfect attire to grab desired getup is here.Plain Saree  NON PADDED  Olive Green Color </div></div></div> </div>,,16:04:2014,
467511,cotton bazaar brown cotton sarees,http://www.yebhi.com/online-shopping/women/dress-materials/sarees/salwar-kameez-set/kurta-kurtis/leggings-and-jeggings.html?affint=women-topmenu,999,Traditional-Ethnic,dress-materials,cotton-bazaar,http://im6.ybndc.com/upload/467511/ProductRear635279058077726000.jpg,999,,Women,http://www.yebhi.com/467511/PD/cotton-bazaar-brown-cotton-sarees.htm,yebhi.com,Cotton Bazaar Brown Cotton - Sarees Buy Online,Cotton Bazaar Brown Cotton - Sarees  Best Price Rs 999.00  EMI Rs 167 for 6 months FREE Shipping In Stock - Delivery in 6-8 Days,None,<div class="product_detail_columns tinyscrl" itemprop="description" style=""><div class="scrollbar" style="width:2px; height:250px; background:#9E9E9E;"><div class="track" style="width:2px;"><div class="thumb" style="width:6px;"><div class="end"> </div></div></div></div><div class="viewport" style=" height:250px; width:252px; font-family:Arial !important;"><div class="overview" style="text-align:justify; display:block;"><div>A sensational look can be grabbed through draping this desired casual wear saree from Fabdeal house! This collection comprises superb cotton material to give relaxing feel like never before. The perfect apparel for any casual move as it hugs single color touch but catchy in looks. Plain Saree  NON PADDED  Olive Green Color </div></div></div> </div>,,16:04:2014,
346977,cotton bazaar purple dress materials,http://www.yebhi.com/online-shopping/women/dress-materials/sarees/salwar-kameez-set/kurta-kurtis/leggings-and-jeggings.html?affint=women-topmenu,1199,Traditional-Ethnic,dress-materials,cotton-bazaar,http://im6.ybndc.com/upload/346977/ProductRear635138940919357732.jpg,1199,,Women,http://www.yebhi.com/346977/PD/cotton-bazaar-purple-dress-materials.htm,yebhi.com,Cotton Bazaar Purple - Dress Materials Buy Online,Cotton Bazaar Purple - Dress Materials  Best Price Rs 1199.00  EMI Rs 200 for 6 months FREE Shipping In Stock - Delivery in 9-12 Days,None,<div class="product_detail_columns tinyscrl" itemprop="description" style=""><div class="scrollbar" style="width:2px; height:250px; background:#9E9E9E;"><div class="track" style="width:2px;"><div class="thumb" style="width:6px;"><div class="end"> </div></div></div></div><div class="viewport" style=" height:250px; width:252px; font-family:Arial !important;"><div class="overview" style="text-align:justify; display:block;"><div><table><tr><td><b>Colour</b></td><td>    </td><td>Green   Purple</td></tr><tr><td><b>For</b></td><td>    </td><td>Women</td></tr><tr><td><b>Material</b></td><td>    </td><td>Cotton   Chiffon</td></tr><tr><td><b>Brands</b></td><td>    </td><td>Cotton Bazaar</td></tr><tr><td><b>Departments</b></td><td>    </td><td>Apparels</td></tr><tr><td><b>Category</b></td><td>    </td><td>Dress Materials</td></tr></table>  </div></div></div> </div>,,16:04:2014,
467522,cotton bazaar green cotton sarees,http://www.yebhi.com/online-shopping/women/dress-materials/sarees/salwar-kameez-set/kurta-kurtis/leggings-and-jeggings.html?affint=women-topmenu,999,Traditional-Ethnic,dress-materials,cotton-bazaar,http://im6.ybndc.com/upload/467522/ProductRear635279058113294000.jpg,999,,Women,http://www.yebhi.com/467522/PD/cotton-bazaar-green-cotton-sarees.htm,yebhi.com,Cotton Bazaar Green Cotton - Sarees Buy Online,Cotton Bazaar Green Cotton - Sarees  Best Price Rs 999.00  EMI Rs 167 for 6 months FREE Shipping In Stock - Delivery in 6-8 Days,None,<div class="product_detail_columns tinyscrl" itemprop="description" style=""><div class="scrollbar" style="width:2px; height:250px; background:#9E9E9E;"><div class="track" style="width:2px;"><div class="thumb" style="width:6px;"><div class="end"> </div></div></div></div><div class="viewport" style=" height:250px; width:252px; font-family:Arial !important;"><div class="overview" style="text-align:justify; display:block;"><div>This casual wear saree from Fabdeal house comprises most appealing cotton fabrication. The saree comes in catchy color to attract the viewers. Bag it to cart in order to experience drastic change like never before!Plain Saree  NON PADDED  Green Color </div></div></div> </div>,,16:04:2014,
467534,cotton bazaar blue cotton sarees,http://www.yebhi.com/online-shopping/women/dress-materials/sarees/salwar-kameez-set/kurta-kurtis/leggings-and-jeggings.html?affint=women-topmenu,1099,Traditional-Ethnic,dress-materials,cotton-bazaar,http://im6.ybndc.com/upload/467534/ProductRear635279058152606000.jpg,1099,,Women,http://www.yebhi.com/467534/PD/cotton-bazaar-blue-cotton-sarees.htm,yebhi.com,Cotton Bazaar Blue Cotton - Sarees Buy Online,Cotton Bazaar Blue Cotton - Sarees  Best Price Rs 1099.00  EMI Rs 183 for 6 months FREE Shipping In Stock - Delivery in 6-8 Days,None,<div class="product_detail_columns tinyscrl" itemprop="description" style=""><div class="scrollbar" style="width:2px; height:250px; background:#9E9E9E;"><div class="track" style="width:2px;"><div class="thumb" style="width:6px;"><div class="end"> </div></div></div></div><div class="viewport" style=" height:250px; width:252px; font-family:Arial !important;"><div class="overview" style="text-align:justify; display:block;"><div>Presenting you mesmerizing attire that has most appealing cotton material. This casual wear saree with an embossing color shade gives an eye catchy look to drag the views in a midst of huge mob. One has to get going with this alluring attire that gives desired persona.Plain Saree  NON PADDED  Sky Blue Color </div></div></div> </div>,,16:04:2014,
467663,cotton bazaar yellow cotton sarees,http://www.yebhi.com/online-shopping/women/dress-materials/sarees/salwar-kameez-set/kurta-kurtis/leggings-and-jeggings.html?affint=women-topmenu,1099,Traditional-Ethnic,dress-materials,cotton-bazaar,http://im6.ybndc.com/upload/467663/ProductRear635279058583634000.jpg,1099,,Women,http://www.yebhi.com/467663/PD/cotton-bazaar-yellow-cotton-sarees.htm,yebhi.com,Cotton Bazaar Yellow Cotton - Sarees Buy Online,Cotton Bazaar Yellow Cotton - Sarees  Best Price Rs 1099.00  EMI Rs 183 for 6 months FREE Shipping In Stock - Delivery in 6-8 Days,None,<div class="product_detail_columns tinyscrl" itemprop="description" style=""><div class="scrollbar" style="width:2px; height:250px; background:#9E9E9E;"><div class="track" style="width:2px;"><div class="thumb" style="width:6px;"><div class="end"> </div></div></div></div><div class="viewport" style=" height:250px; width:252px; font-family:Arial !important;"><div class="overview" style="text-align:justify; display:block;"><div>Presenting you the attire that enriches your elegance with its dazzling material quality. This attire has most appealing cotton material which is shaded in enchanting color touch. This casual wear saree keeps you parallel with the present fashion sense to make the heads turn around. One should hit an ultimate purchase to attain desired quality. There may be color variation due to resolution of actual photo.Plain Saree  NON PADDED  Yellow Color </div></div></div> </div>,,16:04:2014,
488611,cotton bazaar red cotton dress materials,http://www.yebhi.com/online-shopping/women/dress-materials/sarees/salwar-kameez-set/kurta-kurtis/leggings-and-jeggings.html?affint=women-topmenu,808,Traditional-Ethnic,dress-materials,cotton-bazaar,http://im6.ybndc.com/upload/488611/ProductRear635304092876854000.jpg,808,,Women,http://www.yebhi.com/488611/PD/cotton-bazaar-red-cotton-dress-materials.htm,yebhi.com,Cotton Bazaar Red Cotton - Dress Materials Buy Online,Cotton Bazaar Red Cotton - Dress Materials  Best Price Rs 808.00  EMI Rs 135 for 6 months FREE Shipping In Stock - Delivery in 6-8 Days,None,<div class="product_detail_columns tinyscrl" itemprop="description" style=""><div class="scrollbar" style="width:2px; height:250px; background:#9E9E9E;"><div class="track" style="width:2px;"><div class="thumb" style="width:6px;"><div class="end"> </div></div></div></div><div class="viewport" style=" height:250px; width:252px; font-family:Arial !important;"><div class="overview" style="text-align:justify; display:block;"><div>Top : 2.50 M  Bottom : 2.00 M  Dupatta : 2.25 M  Top : Printed Cotton  Bottom : Cotton  Dupatta : Cotton  NON PADDED Printed DRYCLEAN Feel the ethnic touch with the apparel that comes with superb cotton material on its top  bottom and dupatta to give relaxing feel. The suit hugs maroon and teal color touch that really gives stunning look and appeals showers of compliments.  </div></div></div> </div>,,16:04:2014,
467528,cotton bazaar brown cotton sarees,http://www.yebhi.com/online-shopping/women/dress-materials/sarees/salwar-kameez-set/kurta-kurtis/leggings-and-jeggings.html?affint=women-topmenu,899,Traditional-Ethnic,dress-materials,cotton-bazaar,http://im6.ybndc.com/upload/467528/ProductRear635279058132950000.jpg,899,,Women,http://www.yebhi.com/467528/PD/cotton-bazaar-brown-cotton-sarees.htm,yebhi.com,Cotton Bazaar Brown Cotton - Sarees Buy Online,Cotton Bazaar Brown Cotton - Sarees  Best Price Rs 899.00  EMI Rs 150 for 6 months FREE Shipping In Stock - Delivery in 6-8 Days,None,<div class="product_detail_columns tinyscrl" itemprop="description" style=""><div class="scrollbar" style="width:2px; height:250px; background:#9E9E9E;"><div class="track" style="width:2px;"><div class="thumb" style="width:6px;"><div class="end"> </div></div></div></div><div class="viewport" style=" height:250px; width:252px; font-family:Arial !important;"><div class="overview" style="text-align:justify; display:block;"><div>Meet your graceful style by draping this saree from Fabdeal house which has an embossing color shade &amp; appealing cotton material. This simple yet elegant saree is the perfect apparel that assures you to give desired quality like never before.Plain Saree  NON PADDED  Brown Color </div></div></div> </div>,,16:04:2014,
