467622,cotton bazaar green cotton sarees,http://www.yebhi.com/online-shopping/women/dress-materials/sarees/salwar-kameez-set/kurta-kurtis/leggings-and-jeggings.html?affint=women-topmenu,1099,Traditional-Ethnic,dress-materials,cotton-bazaar,http://im6.ybndc.com/upload/467622/ProductRear635279058447134000.jpg,1099,,Women,http://www.yebhi.com/467622/PD/cotton-bazaar-green-cotton-sarees.htm,yebhi.com,Cotton Bazaar Green Cotton - Sarees Buy Online,Cotton Bazaar Green Cotton - Sarees  Best Price Rs 1099.00  EMI Rs 183 for 6 months FREE Shipping In Stock - Delivery in 6-8 Days,None,<div class="product_detail_columns tinyscrl" itemprop="description" style=""><div class="scrollbar" style="width:2px; height:250px; background:#9E9E9E;"><div class="track" style="width:2px;"><div class="thumb" style="width:6px;"><div class="end"> </div></div></div></div><div class="viewport" style=" height:250px; width:252px; font-family:Arial !important;"><div class="overview" style="text-align:justify; display:block;"><div>One of the most fascinating attire has hit the market which has most appealing cotton material to give relaxing feel as you drape it for any casual move. The overall quality of saree makes you a head turner in a huge crowd. Its intricate detailing work makes it much more demanding to make an ultimate hit. There may be color variation due to resolution of actual photo.Plain Saree  NON PADDED  Green Color </div></div></div> </div>,,16:04:2014,
488613,cotton bazaar blue cotton dress materials,http://www.yebhi.com/online-shopping/women/dress-materials/sarees/salwar-kameez-set/kurta-kurtis/leggings-and-jeggings.html?affint=women-topmenu,808,Traditional-Ethnic,dress-materials,cotton-bazaar,http://im6.ybndc.com/upload/488613/ProductRear635304092884810000.jpg,808,,Women,http://www.yebhi.com/488613/PD/cotton-bazaar-blue-cotton-dress-materials.htm,yebhi.com,Cotton Bazaar Blue Cotton - Dress Materials Buy Online,Cotton Bazaar Blue Cotton - Dress Materials  Best Price Rs 808.00  EMI Rs 135 for 6 months FREE Shipping In Stock - Delivery in 6-8 Days,None,<div class="product_detail_columns tinyscrl" itemprop="description" style=""><div class="scrollbar" style="width:2px; height:250px; background:#9E9E9E;"><div class="track" style="width:2px;"><div class="thumb" style="width:6px;"><div class="end"> </div></div></div></div><div class="viewport" style=" height:250px; width:252px; font-family:Arial !important;"><div class="overview" style="text-align:justify; display:block;"><div>Top : 2.50 M  Bottom : 2.00 M  Dupatta : 2.25 M  Top : Printed Cotton  Bottom : Cotton  Dupatta : Cotton  NON PADDED Printed DRYCLEAN Radiate happiness and warmth where ever you go by wearing this marvelous attire that comes with cotton material on its top  bottom &amp; dupatta to give pleasing. It goes perfect for any casual move to look stylish and appeal gazing views. Add to cart this marvelous attire that is sure to give stunning entrance.  </div></div></div> </div>,,16:04:2014,
467618,cotton bazaar red cotton sarees,http://www.yebhi.com/online-shopping/women/dress-materials/sarees/salwar-kameez-set/kurta-kurtis/leggings-and-jeggings.html?affint=women-topmenu,1099,Traditional-Ethnic,dress-materials,cotton-bazaar,http://im6.ybndc.com/upload/467618/ProductRear635279058433874000.jpg,1099,,Women,http://www.yebhi.com/467618/PD/cotton-bazaar-red-cotton-sarees.htm,yebhi.com,Cotton Bazaar Red Cotton - Sarees Buy Online,Cotton Bazaar Red Cotton - Sarees  Best Price Rs 1099.00  EMI Rs 183 for 6 months FREE Shipping In Stock - Delivery in 6-8 Days,None,<div class="product_detail_columns tinyscrl" itemprop="description" style=""><div class="scrollbar" style="width:2px; height:250px; background:#9E9E9E;"><div class="track" style="width:2px;"><div class="thumb" style="width:6px;"><div class="end"> </div></div></div></div><div class="viewport" style=" height:250px; width:252px; font-family:Arial !important;"><div class="overview" style="text-align:justify; display:block;"><div>One has to get going with this beautiful saree to attain a glamorous look that adjoins a spotting image to your persona. The cotton fabric with an embossing color touch makes the head turn around &amp; appeal showers of compliment. One should hit a wise purchase to grab newly fashioned persona. There may be color variation due to resolution of actual photo.Plain Saree  NON PADDED  Red Color </div></div></div> </div>,,16:04:2014,
467429,cotton bazaar orange cotton sarees,http://www.yebhi.com/online-shopping/women/dress-materials/sarees/salwar-kameez-set/kurta-kurtis/leggings-and-jeggings.html?affint=women-topmenu,899,Traditional-Ethnic,dress-materials,cotton-bazaar,http://im6.ybndc.com/upload/467429/ProductRear635279057810654000.jpg,899,,Women,http://www.yebhi.com/467429/PD/cotton-bazaar-orange-cotton-sarees.htm,yebhi.com,Cotton Bazaar Orange Cotton - Sarees Buy Online,Cotton Bazaar Orange Cotton - Sarees  Best Price Rs 899.00  EMI Rs 150 for 6 months FREE Shipping In Stock - Delivery in 6-8 Days,None,<div class="product_detail_columns tinyscrl" itemprop="description" style=""><div class="scrollbar" style="width:2px; height:250px; background:#9E9E9E;"><div class="track" style="width:2px;"><div class="thumb" style="width:6px;"><div class="end"> </div></div></div></div><div class="viewport" style=" height:250px; width:252px; font-family:Arial !important;"><div class="overview" style="text-align:justify; display:block;"><div>Spot up this season with this traditional casual wear saree. It has got an appealing cotton material with a lucrative color touch. One should drape this attire that enriches your feminine elegance like never before. Color may differ due to resolution of actual photo.Plain Saree  NON PADDED  Brown Color </div></div></div> </div>,,16:04:2014,
467570,cotton bazaar orange cotton sarees,http://www.yebhi.com/online-shopping/women/dress-materials/sarees/salwar-kameez-set/kurta-kurtis/leggings-and-jeggings.html?affint=women-topmenu,1099,Traditional-Ethnic,dress-materials,cotton-bazaar,http://im6.ybndc.com/upload/467570/ProductRear635279058270230000.jpg,1099,,Women,http://www.yebhi.com/467570/PD/cotton-bazaar-orange-cotton-sarees.htm,yebhi.com,Cotton Bazaar Orange Cotton - Sarees Buy Online,Cotton Bazaar Orange Cotton - Sarees  Best Price Rs 1099.00  EMI Rs 183 for 6 months FREE Shipping In Stock - Delivery in 6-8 Days,None,<div class="product_detail_columns tinyscrl" itemprop="description" style=""><div class="scrollbar" style="width:2px; height:250px; background:#9E9E9E;"><div class="track" style="width:2px;"><div class="thumb" style="width:6px;"><div class="end"> </div></div></div></div><div class="viewport" style=" height:250px; width:252px; font-family:Arial !important;"><div class="overview" style="text-align:justify; display:block;"><div>This attire is appreciated for its elegant design &amp; color combinations with smooth finishing. This casual wear attire with an alluring design make the heads turn around to give complimenting views. This reniyal fabric with an embossing green color makes it much more demanding to attain an ultimate hit. There may be color variation due to resolution of actual photo.Plain Saree  NON PADDED  Light Orange Color </div></div></div> </div>,,16:04:2014,
416333,cotton bazaar red dress materials,http://www.yebhi.com/online-shopping/women/dress-materials/sarees/salwar-kameez-set/kurta-kurtis/leggings-and-jeggings.html?affint=women-topmenu,1099,Traditional-Ethnic,dress-materials,cotton-bazaar,http://im6.ybndc.com/upload/416333/ProductRear635193572270900728.jpg,1099,,Women,http://www.yebhi.com/416333/PD/cotton-bazaar-red-dress-materials.htm,yebhi.com,Cotton Bazaar Red - Dress Materials Buy Online,Cotton Bazaar Red - Dress Materials  Best Price Rs 1099.00  EMI Rs 183 for 6 months FREE Shipping In Stock - Delivery in 13-17 Days,None,<div class="product_detail_columns tinyscrl" itemprop="description" style=""><div class="scrollbar" style="width:2px; height:250px; background:#9E9E9E;"><div class="track" style="width:2px;"><div class="thumb" style="width:6px;"><div class="end"> </div></div></div></div><div class="viewport" style=" height:250px; width:252px; font-family:Arial !important;"><div class="overview" style="text-align:justify; display:block;"><div>Get a traditional look with this dress material crafted from high quality <b>cotton fabric.</b> In a <b>printed pattern all over in maroon and blue colour</b> this dress material comes from the house of <b>Cotton Bazaar.</b> <br/><br/><b>Features</b><ul style="margin-left: 20px;"><li type="disc"><b>Brand:</b> Cotton Bazaar</li><li type="disc"><b>Category:</b>  Traditional and Ethnic Wear</li><li type="disc"><b>Type:</b> Dress Material</li><li type="disc"><b>Fabric:</b> Cotton</li><li type="disc"><b>Colour:</b> Maroon  Blue</li></ul><br/><b>Wash &amp; Care</b><br/>  Wash it with a mild detergent.<br> Do not bleach or dry clean.<br> Wash with like colours.<br> Line dry. <br>Warm iron<br><br><b>Note:</b> There may be a slight colour variation in the image from original product. </br></br></br></br></br></br></div></div></div> </div>,,16:04:2014,
467620,cotton bazaar grey cotton sarees,http://www.yebhi.com/online-shopping/women/dress-materials/sarees/salwar-kameez-set/kurta-kurtis/leggings-and-jeggings.html?affint=women-topmenu,1099,Traditional-Ethnic,dress-materials,cotton-bazaar,http://im6.ybndc.com/upload/467620/ProductRear635279058440738000.jpg,1099,,Women,http://www.yebhi.com/467620/PD/cotton-bazaar-grey-cotton-sarees.htm,yebhi.com,Cotton Bazaar Grey Cotton - Sarees Buy Online,Cotton Bazaar Grey Cotton - Sarees  Best Price Rs 1099.00  EMI Rs 183 for 6 months FREE Shipping In Stock - Delivery in 6-8 Days,None,<div class="product_detail_columns tinyscrl" itemprop="description" style=""><div class="scrollbar" style="width:2px; height:250px; background:#9E9E9E;"><div class="track" style="width:2px;"><div class="thumb" style="width:6px;"><div class="end"> </div></div></div></div><div class="viewport" style=" height:250px; width:252px; font-family:Arial !important;"><div class="overview" style="text-align:justify; display:block;"><div>One of the most fascinating attire has hit the market which has most appealing cotton material to give relaxing feel as you drape it for any casual move. The overall quality of saree makes you a head turner in a huge crowd. Its intricate detailing work makes it much more demanding to make an ultimate hit. There may be color variation due to resolution of actual photo.Plain Saree  NON PADDED  Grey Color </div></div></div> </div>,,16:04:2014,
467678,cotton bazaar grey cotton sarees,http://www.yebhi.com/online-shopping/women/dress-materials/sarees/salwar-kameez-set/kurta-kurtis/leggings-and-jeggings.html?affint=women-topmenu,899,Traditional-Ethnic,dress-materials,cotton-bazaar,http://im6.ybndc.com/upload/467678/ProductRear635279058634802000.jpg,899,,Women,http://www.yebhi.com/467678/PD/cotton-bazaar-grey-cotton-sarees.htm,yebhi.com,Cotton Bazaar Grey Cotton - Sarees Buy Online,Cotton Bazaar Grey Cotton - Sarees  Best Price Rs 899.00  EMI Rs 150 for 6 months FREE Shipping In Stock - Delivery in 6-8 Days,None,<div class="product_detail_columns tinyscrl" itemprop="description" style=""><div class="scrollbar" style="width:2px; height:250px; background:#9E9E9E;"><div class="track" style="width:2px;"><div class="thumb" style="width:6px;"><div class="end"> </div></div></div></div><div class="viewport" style=" height:250px; width:252px; font-family:Arial !important;"><div class="overview" style="text-align:justify; display:block;"><div>A sensational getup can be grabbed through this superb collection from Fabdeal house. This casual wear saree has an embossing color touch that asssures to give spotting persona in the occasion you step in. The perfect collection to attain desired quality.Plain Saree  NON PADDED  Grey Color </div></div></div> </div>,,16:04:2014,
346972,cotton bazaar red dress materials,http://www.yebhi.com/online-shopping/women/dress-materials/sarees/salwar-kameez-set/kurta-kurtis/leggings-and-jeggings.html?affint=women-topmenu,1199,Traditional-Ethnic,dress-materials,cotton-bazaar,http://im6.ybndc.com/upload/346972/ProductRear635138939629393732.jpg,1199,,Women,http://www.yebhi.com/346972/PD/cotton-bazaar-red-dress-materials.htm,yebhi.com,Cotton Bazaar Red - Dress Materials Buy Online,Cotton Bazaar Red - Dress Materials  Best Price Rs 1199.00  EMI Rs 200 for 6 months FREE Shipping In Stock - Delivery in 9-12 Days,None,<div class="product_detail_columns tinyscrl" itemprop="description" style=""><div class="scrollbar" style="width:2px; height:250px; background:#9E9E9E;"><div class="track" style="width:2px;"><div class="thumb" style="width:6px;"><div class="end"> </div></div></div></div><div class="viewport" style=" height:250px; width:252px; font-family:Arial !important;"><div class="overview" style="text-align:justify; display:block;"><div>Get an attention grabbing look in this <b>pretty red dress material</b> from the house of <b>Cotton Bazaar.</b> This semi stitched dress material features <b>heavy thread embroidery on the yoke and hemline.</b> It is beautifully complimented with black salwar piece and dual coloured dupatta.<br/><br/><b>Features</b><ul style="margin-left: 20px;"><li type="disc"><b>Brand:</b> Cotton Bazaar</li><li type="disc"><b>Category:</b>  Traditional and Ethnic Wear</li><li type="disc"><b>Type:</b> Dress Material</li><li type="disc"><b>Length of Kameez:</b> 2.75 meter</li><li type="disc"><b>Length of Bottom:</b> 2 meter</li><li type="disc"><b>Length of Dupatta:</b> 2.10 meter</li><li type="disc"><b>Fabric:</b> Cotton  Chiffon</li><li type="disc"><b>Colour:</b> Red  Black</li></ul><br/><b>Wash &amp; Care</b><br/>  Do not bleach or dry clean.<br/> Wash with like colours.<br/> Line dry. <br/>  Warm iron<br/><br/><b>Note:</b> There may be a slight colour variation in the image from original product. </div></div></div> </div>,,16:04:2014,
485581,cotton bazaar green cotton dress materials,http://www.yebhi.com/online-shopping/women/dress-materials/sarees/salwar-kameez-set/kurta-kurtis/leggings-and-jeggings.html?affint=women-topmenu,1056,Traditional-Ethnic,dress-materials,cotton-bazaar,http://im6.ybndc.com/upload/485581/ProductRear635297260219302000.jpg,1056,,Women,http://www.yebhi.com/485581/PD/cotton-bazaar-green-cotton-dress-materials.htm,yebhi.com,Cotton Bazaar Green Cotton - Dress Materials Buy Online,Cotton Bazaar Green Cotton - Dress Materials  Best Price Rs 1056.00  EMI Rs 176 for 6 months FREE Shipping In Stock - Delivery in 9-12 Days,None,<div class="product_detail_columns tinyscrl" itemprop="description" style=""><div class="scrollbar" style="width:2px; height:250px; background:#9E9E9E;"><div class="track" style="width:2px;"><div class="thumb" style="width:6px;"><div class="end"> </div></div></div></div><div class="viewport" style=" height:250px; width:252px; font-family:Arial !important;"><div class="overview" style="text-align:justify; display:block;"><div>Here is the attire that is perfect for any occasion! This stunning salwar suit is sure to give modish look &amp; appeal showers of compliments. The suit comes with appealing pure cotton on its top  bottom &amp; dupatta. Get going with this collection to experience the look which you want. Top : 2.45 M  Bottom : 2.00 M  Dupatta : 2.35 M  Top : Pure Cotton  Bottom : Pure Cotton  Dupatta : Pure Cotton </div></div></div> </div>,,16:04:2014,
488595,cotton bazaar black cotton dress materials,http://www.yebhi.com/online-shopping/women/dress-materials/sarees/salwar-kameez-set/kurta-kurtis/leggings-and-jeggings.html?affint=women-topmenu,808,Traditional-Ethnic,dress-materials,cotton-bazaar,http://im6.ybndc.com/upload/488595/ProductRear635304092816170000.jpg,808,,Women,http://www.yebhi.com/488595/PD/cotton-bazaar-black-cotton-dress-materials.htm,yebhi.com,Cotton Bazaar Black Cotton - Dress Materials Buy Online,Cotton Bazaar Black Cotton - Dress Materials  Best Price Rs 808.00  EMI Rs 135 for 6 months FREE Shipping In Stock - Delivery in 6-8 Days,None,<div class="product_detail_columns tinyscrl" itemprop="description" style=""><div class="scrollbar" style="width:2px; height:250px; background:#9E9E9E;"><div class="track" style="width:2px;"><div class="thumb" style="width:6px;"><div class="end"> </div></div></div></div><div class="viewport" style=" height:250px; width:252px; font-family:Arial !important;"><div class="overview" style="text-align:justify; display:block;"><div>Top : 2.50 M  Bottom : 2.00 M  Dupatta : 2.25 M  Top : Printed Cotton  Bottom : Cotton  Dupatta : Cotton  NON PADDED Printed DRYCLEAN Time to show your real elegance by wearing this amazing salwar suit that comes with an appealing cotton material on its top  bottom &amp; dupatta. This casual wear salwar suit is sure to keep you in fashion as it hugs catchy traditional prints with amazing color touch.  </div></div></div> </div>,,16:04:2014,
467579,cotton bazaar blue cotton sarees,http://www.yebhi.com/online-shopping/women/dress-materials/sarees/salwar-kameez-set/kurta-kurtis/leggings-and-jeggings.html?affint=women-topmenu,1099,Traditional-Ethnic,dress-materials,cotton-bazaar,http://im6.ybndc.com/upload/467579/ProductRear635279058300338000.jpg,1099,,Women,http://www.yebhi.com/467579/PD/cotton-bazaar-blue-cotton-sarees.htm,yebhi.com,Cotton Bazaar Blue Cotton - Sarees Buy Online,Cotton Bazaar Blue Cotton - Sarees  Best Price Rs 1099.00  EMI Rs 183 for 6 months FREE Shipping In Stock - Delivery in 6-8 Days,None,<div class="product_detail_columns tinyscrl" itemprop="description" style=""><div class="scrollbar" style="width:2px; height:250px; background:#9E9E9E;"><div class="track" style="width:2px;"><div class="thumb" style="width:6px;"><div class="end"> </div></div></div></div><div class="viewport" style=" height:250px; width:252px; font-family:Arial !important;"><div class="overview" style="text-align:justify; display:block;"><div>Make style statement in this beautiful and attractive blue saree that is designed to glamorize every women beauty. This attire is mostly preferred for its desired reniyal fabric &amp; an embossing blue color. One can be the center of attraction with this marvelous collection. There may be color variation due to resolution of actual photo.Plain Saree  NON PADDED  Light Blue Color </div></div></div> </div>,,16:04:2014,
467675,cotton bazaar grey cotton sarees,http://www.yebhi.com/online-shopping/women/dress-materials/sarees/salwar-kameez-set/kurta-kurtis/leggings-and-jeggings.html?affint=women-topmenu,899,Traditional-Ethnic,dress-materials,cotton-bazaar,http://im6.ybndc.com/upload/467675/ProductRear635279058624038000.jpg,899,,Women,http://www.yebhi.com/467675/PD/cotton-bazaar-grey-cotton-sarees.htm,yebhi.com,Cotton Bazaar Grey Cotton - Sarees Buy Online,Cotton Bazaar Grey Cotton - Sarees  Best Price Rs 899.00  EMI Rs 150 for 6 months FREE Shipping In Stock - Delivery in 6-8 Days,None,<div class="product_detail_columns tinyscrl" itemprop="description" style=""><div class="scrollbar" style="width:2px; height:250px; background:#9E9E9E;"><div class="track" style="width:2px;"><div class="thumb" style="width:6px;"><div class="end"> </div></div></div></div><div class="viewport" style=" height:250px; width:252px; font-family:Arial !important;"><div class="overview" style="text-align:justify; display:block;"><div>Here is the apparel for tomorrow s people who crave fashion! This casual wear saree form Fabdeal house comprises most appealing cotton material that really give pleasing feel as you drape it for casual move. One should wear this stunning saree with minimal jewels to complete the desired getup.Plain Saree  NON PADDED  Grey Color </div></div></div> </div>,,16:04:2014,
383547,cotton bazaar white cotton dress materials,http://www.yebhi.com/online-shopping/women/dress-materials/sarees/salwar-kameez-set/kurta-kurtis/leggings-and-jeggings.html?affint=women-topmenu,899,Traditional-Ethnic,dress-materials,cotton-bazaar,http://im6.ybndc.com/upload/383547/ProductRear635183845928389501.jpg,899,,Women,http://www.yebhi.com/383547/PD/cotton-bazaar-white-cotton-dress-materials.htm,yebhi.com,Cotton Bazaar White Cotton - Dress Materials Buy Online,Cotton Bazaar White Cotton - Dress Materials  Best Price Rs 899.00  EMI Rs 150 for 6 months FREE Shipping In Stock - Delivery in 9-12 Days,None,<div class="product_detail_columns tinyscrl" itemprop="description" style=""><div class="scrollbar" style="width:2px; height:250px; background:#9E9E9E;"><div class="track" style="width:2px;"><div class="thumb" style="width:6px;"><div class="end"> </div></div></div></div><div class="viewport" style=" height:250px; width:252px; font-family:Arial !important;"><div class="overview" style="text-align:justify; display:block;"><div><b>Cotton Bazaar</b> brings this dress material that has <b>abstract prints </b> all over on the white kameez piece. The salwar piece and the dupatta have <b> floral prints </b> and the set has been crafted from <b> cotton.</b><br/><br/><b>Features</b><ul style="margin-left: 20px;"><li type="disc"><b>Brand: </b>Cotton Bazaar</li><li type="disc"><b>Category: </b>Traditional and Ethnic Wear</li><li type="disc"><b>Type: </b> Dress Material</li><li type="disc"><b>Fabric: </b> Cotton</li><li type="disc"><b>Colour: </b> White  Red</li></ul><br/><b>Wash and Care </b><br/>  Do not bleach or dry clean.<br/> Wash with like colours.<br/> Line dry. <br/>  Warm iron<br/><br/><b>Note:</b> There may be a slight colour variation in the image from original product. </div></div></div> </div>,,16:04:2014,
467613,cotton bazaar green cotton sarees,http://www.yebhi.com/online-shopping/women/dress-materials/sarees/salwar-kameez-set/kurta-kurtis/leggings-and-jeggings.html?affint=women-topmenu,999,Traditional-Ethnic,dress-materials,cotton-bazaar,http://im6.ybndc.com/upload/467613/ProductRear635279058416870000.jpg,999,,Women,http://www.yebhi.com/467613/PD/cotton-bazaar-green-cotton-sarees.htm,yebhi.com,Cotton Bazaar Green Cotton - Sarees Buy Online,Cotton Bazaar Green Cotton - Sarees  Best Price Rs 999.00  EMI Rs 167 for 6 months FREE Shipping In Stock - Delivery in 6-8 Days,None,<div class="product_detail_columns tinyscrl" itemprop="description" style=""><div class="scrollbar" style="width:2px; height:250px; background:#9E9E9E;"><div class="track" style="width:2px;"><div class="thumb" style="width:6px;"><div class="end"> </div></div></div></div><div class="viewport" style=" height:250px; width:252px; font-family:Arial !important;"><div class="overview" style="text-align:justify; display:block;"><div>Definition of beauty gets a new turn as you drape this marvelous casual wear saree that has crop up cotton material. The saree is embossed with catchy color shade to adjoin an eye catchy getup to your persona. One should hit an ultimate purchase on this wardrobe to gain desired looks. There may be color variation due to resolution of actual photo.Plain Saree  NON PADDED  Green Color </div></div></div> </div>,,16:04:2014,
488614,cotton bazaar blue cotton dress materials,http://www.yebhi.com/online-shopping/women/dress-materials/sarees/salwar-kameez-set/kurta-kurtis/leggings-and-jeggings.html?affint=women-topmenu,808,Traditional-Ethnic,dress-materials,cotton-bazaar,http://im6.ybndc.com/upload/488614/ProductRear635304092889178000.jpg,808,,Women,http://www.yebhi.com/488614/PD/cotton-bazaar-blue-cotton-dress-materials.htm,yebhi.com,Cotton Bazaar Blue Cotton - Dress Materials Buy Online,Cotton Bazaar Blue Cotton - Dress Materials  Best Price Rs 808.00  EMI Rs 135 for 6 months FREE Shipping In Stock - Delivery in 6-8 Days,None,<div class="product_detail_columns tinyscrl" itemprop="description" style=""><div class="scrollbar" style="width:2px; height:250px; background:#9E9E9E;"><div class="track" style="width:2px;"><div class="thumb" style="width:6px;"><div class="end"> </div></div></div></div><div class="viewport" style=" height:250px; width:252px; font-family:Arial !important;"><div class="overview" style="text-align:justify; display:block;"><div>Top : 2.50 M  Bottom : 2.00 M  Dupatta : 2.25 M  Top : Printed Cotton  Bottom : Cotton  Dupatta : Cotton  NON PADDED Printed DRYCLEAN Expose your hidden glamour by wearing this enchanting attire that comes with most appealing cotton material on its top  bottom &amp; dupatta. One should adjoin this amazing attire to your wardrobe to experience drastic change in fashion sense. </div></div></div> </div>,,16:04:2014,
467681,cotton bazaar brown cotton sarees,http://www.yebhi.com/online-shopping/women/dress-materials/sarees/salwar-kameez-set/kurta-kurtis/leggings-and-jeggings.html?affint=women-topmenu,899,Traditional-Ethnic,dress-materials,cotton-bazaar,http://im6.ybndc.com/upload/467681/ProductRear635279058645254000.jpg,899,,Women,http://www.yebhi.com/467681/PD/cotton-bazaar-brown-cotton-sarees.htm,yebhi.com,Cotton Bazaar Brown Cotton - Sarees Buy Online,Cotton Bazaar Brown Cotton - Sarees  Best Price Rs 899.00  EMI Rs 150 for 6 months FREE Shipping In Stock - Delivery in 6-8 Days,None,<div class="product_detail_columns tinyscrl" itemprop="description" style=""><div class="scrollbar" style="width:2px; height:250px; background:#9E9E9E;"><div class="track" style="width:2px;"><div class="thumb" style="width:6px;"><div class="end"> </div></div></div></div><div class="viewport" style=" height:250px; width:252px; font-family:Arial !important;"><div class="overview" style="text-align:justify; display:block;"><div>A sensational getup can be grabbed through this superb collection from Fabdeal house. This casual wear saree has an embossing color touch that asssures to give spotting persona in the occasion you step in. The perfect collection to attain desired quality.Plain Saree  NON PADDED  Brown &amp; Black Color </div></div></div> </div>,,16:04:2014,
