497438,vila purple women tops,http://www.yebhi.com/online-shopping/women/apparels.html?affint=women-topmenu,1190,Clothing,tops,vila,http://im6.ybndc.com/upload/497438/ProductRear635321414310858000.jpg,1190,,Women,http://www.yebhi.com/497438/PD/vila-purple-women-tops.htm,yebhi.com,Vila Purple Women - Tops Buy Online,Vila Purple Women - Tops  Best Price Rs 1190.00  EMI Rs 198 for 6 months FREE Shipping In Stock - Delivery in 3-5 Days,XSSML,<div class="product_detail_columns tinyscrl" itemprop="description" style=""><div class="scrollbar" style="width:2px; height:250px; background:#9E9E9E;"><div class="track" style="width:2px;"><div class="thumb" style="width:6px;"><div class="end"> </div></div></div></div><div class="viewport" style=" height:250px; width:252px; font-family:Arial !important;"><div class="overview" style="text-align:justify; display:block;"><div>Shell Top?by Vila Made from polyester  Round neckline  Short sleeve styling  Printed fabric  Dipped hem at back  Regular fit100% Polyester </div></div></div> </div>,,17:04:2014,
497487,vila purple women tops,http://www.yebhi.com/online-shopping/women/apparels.html?affint=women-topmenu,1605,Clothing,tops,vila,http://im6.ybndc.com/upload/497487/ProductRear635321353410798000.jpg,1605,,Women,http://www.yebhi.com/497487/PD/vila-purple-women-tops.htm,yebhi.com,Vila Purple Women - Tops Buy Online,Vila Purple Women - Tops  Best Price Rs 1605.00  EMI Rs 268 for 6 months FREE Shipping In Stock - Delivery in 3-5 Days,XSSML,<div class="product_detail_columns tinyscrl" itemprop="description" style=""><div class="scrollbar" style="width:2px; height:250px; background:#9E9E9E;"><div class="track" style="width:2px;"><div class="thumb" style="width:6px;"><div class="end"> </div></div></div></div><div class="viewport" style=" height:250px; width:252px; font-family:Arial !important;"><div class="overview" style="text-align:justify; display:block;"><div>Scoop top by Vila  Made from polyester  Round neckline  Short sleeves  Lace panelling at the shoulders and lower hemline  Box pleated front  Single loop button closure at the back  Semi sheer fabric  Regular fit100% Polyester </div></div></div> </div>,,17:04:2014,
497443,vila multi color women tops,http://www.yebhi.com/online-shopping/women/apparels.html?affint=women-topmenu,1500,Clothing,tops,vila,http://im6.ybndc.com/upload/497443/ProductRear635321414335506000.jpg,1500,,Women,http://www.yebhi.com/497443/PD/vila-multi-color-women-tops.htm,yebhi.com,Vila Multi Color Women - Tops Buy Online,Vila Multi Color Women - Tops  Best Price Rs 1500.00  EMI Rs 250 for 6 months FREE Shipping In Stock - Delivery in 3-5 Days,SMLXL,<div class="product_detail_columns tinyscrl" itemprop="description" style=""><div class="scrollbar" style="width:2px; height:250px; background:#9E9E9E;"><div class="track" style="width:2px;"><div class="thumb" style="width:6px;"><div class="end"> </div></div></div></div><div class="viewport" style=" height:250px; width:252px; font-family:Arial !important;"><div class="overview" style="text-align:justify; display:block;"><div>Top?by Vila Made from polyester  V-neckline  Full sleeves  Animal print all over  Ruffle detail  Drawstring waist tie-up  Semi-sheer fabric  Regular fit100% Polyester </div></div></div> </div>,,17:04:2014,
497559,vila yellow women tops,http://www.yebhi.com/online-shopping/women/apparels.html?affint=women-topmenu,625,Clothing,tops,vila,http://im6.ybndc.com/upload/497559/ProductRear635321353722642000.jpg,625,,Women,http://www.yebhi.com/497559/PD/vila-yellow-women-tops.htm,yebhi.com,Vila Yellow Women - Tops Buy Online,Vila Yellow Women - Tops  Best Price Rs 625.00  EMI Rs 104 for 6 months FREE Shipping In Stock - Delivery in 3-5 Days,SML,<div class="product_detail_columns tinyscrl" itemprop="description" style=""><div class="scrollbar" style="width:2px; height:250px; background:#9E9E9E;"><div class="track" style="width:2px;"><div class="thumb" style="width:6px;"><div class="end"> </div></div></div></div><div class="viewport" style=" height:250px; width:252px; font-family:Arial !important;"><div class="overview" style="text-align:justify; display:block;"><div>This tank top from Vila is made from 100% polyester. The details include: sleeveless  strappy style  stitched panel. The tank top has a loose fit.100% Polyester </div></div></div> </div>,,17:04:2014,
497508,vila black women tops,http://www.yebhi.com/online-shopping/women/apparels.html?affint=women-topmenu,2800,Clothing,tops,vila,http://im6.ybndc.com/upload/497508/ProductRear635321353499094000.jpg,2800,,Women,http://www.yebhi.com/497508/PD/vila-black-women-tops.htm,yebhi.com,Vila Black Women - Tops Buy Online,Vila Black Women - Tops  Best Price Rs 2800.00  EMI Rs 467 for 6 months FREE Shipping In Stock - Delivery in 3-5 Days,SMLXL,<div class="product_detail_columns tinyscrl" itemprop="description" style=""><div class="scrollbar" style="width:2px; height:250px; background:#9E9E9E;"><div class="track" style="width:2px;"><div class="thumb" style="width:6px;"><div class="end"> </div></div></div></div><div class="viewport" style=" height:250px; width:252px; font-family:Arial !important;"><div class="overview" style="text-align:justify; display:block;"><div>Tunic Top by Vila Made from polyester  Round neckline  Long bishop sleeves  Diamante embellished cuffs and back  Slitted back  High-low hem  Keyhole detail at the back with button closure  Regular fit100% Polyester </div></div></div> </div>,,17:04:2014,
497413,vila green women tops,http://www.yebhi.com/online-shopping/women/apparels.html?affint=women-topmenu,1150,Clothing,tops,vila,http://im6.ybndc.com/upload/497413/ProductRear635321414195106000.jpg,1150,,Women,http://www.yebhi.com/497413/PD/vila-green-women-tops.htm,yebhi.com,Vila Green Women - Tops Buy Online,Vila Green Women - Tops  Best Price Rs 1150.00  EMI Rs 192 for 6 months FREE Shipping In Stock - Delivery in 3-5 Days,XSSML,<div class="product_detail_columns tinyscrl" itemprop="description" style=""><div class="scrollbar" style="width:2px; height:250px; background:#9E9E9E;"><div class="track" style="width:2px;"><div class="thumb" style="width:6px;"><div class="end"> </div></div></div></div><div class="viewport" style=" height:250px; width:252px; font-family:Arial !important;"><div class="overview" style="text-align:justify; display:block;"><div>This collar top?from Vila is made from 70% viscose and 30% polyester. The details include: spread collar  sleeveless  bead embellishment on the collar  concealed front button closure  watteau pleat at the back and curved hemline. The?collar top?has a slim fit.70% viscose and 30% polyester </div></div></div> </div>,,17:04:2014,
497492,vila beige women tops,http://www.yebhi.com/online-shopping/women/apparels.html?affint=women-topmenu,1800,Clothing,tops,vila,http://im6.ybndc.com/upload/497492/ProductRear635321353433886000.jpg,1800,,Women,http://www.yebhi.com/497492/PD/vila-beige-women-tops.htm,yebhi.com,Vila Beige Women - Tops Buy Online,Vila Beige Women - Tops  Best Price Rs 1800.00  EMI Rs 300 for 6 months FREE Shipping In Stock - Delivery in 3-5 Days,SMLXL,<div class="product_detail_columns tinyscrl" itemprop="description" style=""><div class="scrollbar" style="width:2px; height:250px; background:#9E9E9E;"><div class="track" style="width:2px;"><div class="thumb" style="width:6px;"><div class="end"> </div></div></div></div><div class="viewport" style=" height:250px; width:252px; font-family:Arial !important;"><div class="overview" style="text-align:justify; display:block;"><div>Scoop Top by Vila Made from polyester  Scoop neckline  Short sleeve styling  Vintage filigree print  Contrast panelled detail  Gold-tone exposed zipper closure at back  Regular fit100% Polyester </div></div></div> </div>,,17:04:2014,
497484,vila grey women tops,http://www.yebhi.com/online-shopping/women/apparels.html?affint=women-topmenu,1045,Clothing,tops,vila,http://im6.ybndc.com/upload/497484/ProductRear635321353397850000.jpg,1045,,Women,http://www.yebhi.com/497484/PD/vila-grey-women-tops.htm,yebhi.com,Vila Grey Women - Tops Buy Online,Vila Grey Women - Tops  Best Price Rs 1045.00  EMI Rs 174 for 6 months FREE Shipping In Stock - Delivery in 3-5 Days,XSSML,<div class="product_detail_columns tinyscrl" itemprop="description" style=""><div class="scrollbar" style="width:2px; height:250px; background:#9E9E9E;"><div class="track" style="width:2px;"><div class="thumb" style="width:6px;"><div class="end"> </div></div></div></div><div class="viewport" style=" height:250px; width:252px; font-family:Arial !important;"><div class="overview" style="text-align:justify; display:block;"><div>Scoop neck tee by Vila Made from polyester and cotton  Scoop neckline  Animal head motif trimming at the front  Short sleeves  Regular fit65% Polyester and 35% Cotton </div></div></div> </div>,,17:04:2014,
492980,vila grey cotton women tops,http://www.yebhi.com/online-shopping/women/apparels.html?affint=women-topmenu,1700,Clothing,tops,vila,http://im6.ybndc.com/upload/492980/ProductRear635314627972330000.jpg,1700,,Women,http://www.yebhi.com/492980/PD/vila-grey-cotton-women-tops.htm,yebhi.com,Vila Grey Cotton Women - Tops Buy Online,Vila Grey Cotton Women - Tops  Best Price Rs 1700.00  EMI Rs 283 for 6 months FREE Shipping In Stock - Delivery in 3-5 Days,XS,<div class="product_detail_columns tinyscrl" itemprop="description" style=""><div class="scrollbar" style="width:2px; height:250px; background:#9E9E9E;"><div class="track" style="width:2px;"><div class="thumb" style="width:6px;"><div class="end"> </div></div></div></div><div class="viewport" style=" height:250px; width:252px; font-family:Arial !important;"><div class="overview" style="text-align:justify; display:block;"><div>Kurti by W Made from cotton  Scoop neckline  Three quarter sleeves  Pintucks at the front  Solid hue  Regular fit </div></div></div> </div>,,17:04:2014,
497485,vila white women tops,http://www.yebhi.com/online-shopping/women/apparels.html?affint=women-topmenu,1045,Clothing,tops,vila,http://im6.ybndc.com/upload/497485/ProductRear635321353401906000.jpg,1045,,Women,http://www.yebhi.com/497485/PD/vila-white-women-tops.htm,yebhi.com,Vila White Women - Tops Buy Online,Vila White Women - Tops  Best Price Rs 1045.00  EMI Rs 174 for 6 months FREE Shipping In Stock - Delivery in 3-5 Days,XSSML,<div class="product_detail_columns tinyscrl" itemprop="description" style=""><div class="scrollbar" style="width:2px; height:250px; background:#9E9E9E;"><div class="track" style="width:2px;"><div class="thumb" style="width:6px;"><div class="end"> </div></div></div></div><div class="viewport" style=" height:250px; width:252px; font-family:Arial !important;"><div class="overview" style="text-align:justify; display:block;"><div>Scoop neck tee by Vila Made from polyester and cotton  Scoop neckline  Animal head motif trimming at the front  Short sleeves  Regular fit65% Polyester and 35% Cotton </div></div></div> </div>,,17:04:2014,
497441,vila black women tops,http://www.yebhi.com/online-shopping/women/apparels.html?affint=women-topmenu,1500,Clothing,tops,vila,http://im6.ybndc.com/upload/497441/ProductRear635321414325210000.jpg,1500,,Women,http://www.yebhi.com/497441/PD/vila-black-women-tops.htm,yebhi.com,Vila Black Women - Tops Buy Online,Vila Black Women - Tops  Best Price Rs 1500.00  EMI Rs 250 for 6 months FREE Shipping In Stock - Delivery in 3-5 Days,MLXL,<div class="product_detail_columns tinyscrl" itemprop="description" style=""><div class="scrollbar" style="width:2px; height:250px; background:#9E9E9E;"><div class="track" style="width:2px;"><div class="thumb" style="width:6px;"><div class="end"> </div></div></div></div><div class="viewport" style=" height:250px; width:252px; font-family:Arial !important;"><div class="overview" style="text-align:justify; display:block;"><div>Top?by Vila Made from polyester  V-neckline  Full sleeves  Animal print all over  Ruffle detail  Drawstring waist tie-up  Semi-sheer fabric  Regular fit100% Polyester </div></div></div> </div>,,17:04:2014,
497491,vila black women tops,http://www.yebhi.com/online-shopping/women/apparels.html?affint=women-topmenu,1800,Clothing,tops,vila,http://im6.ybndc.com/upload/497491/ProductRear635321353428894000.jpg,1800,,Women,http://www.yebhi.com/497491/PD/vila-black-women-tops.htm,yebhi.com,Vila Black Women - Tops Buy Online,Vila Black Women - Tops  Best Price Rs 1800.00  EMI Rs 300 for 6 months FREE Shipping In Stock - Delivery in 3-5 Days,SMLXL,<div class="product_detail_columns tinyscrl" itemprop="description" style=""><div class="scrollbar" style="width:2px; height:250px; background:#9E9E9E;"><div class="track" style="width:2px;"><div class="thumb" style="width:6px;"><div class="end"> </div></div></div></div><div class="viewport" style=" height:250px; width:252px; font-family:Arial !important;"><div class="overview" style="text-align:justify; display:block;"><div>Scoop Top by Vila Made from polyester  Scoop neckline  Short sleeve styling  Vintage filigree print  Contrast panelled detail  Gold-tone exposed zipper closure at back  Regular fit100% Polyester </div></div></div> </div>,,17:04:2014,
497212,vila grey women tops,http://www.yebhi.com/online-shopping/women/apparels.html?affint=women-topmenu,2000,Clothing,tops,vila,http://im6.ybndc.com/upload/497212/ProductRear635321413334610000.jpg,2000,,Women,http://www.yebhi.com/497212/PD/vila-grey-women-tops.htm,yebhi.com,Vila Grey Women - Tops Buy Online,Vila Grey Women - Tops  Best Price Rs 2000.00  EMI Rs 333 for 6 months FREE Shipping In Stock - Delivery in 3-5 Days,XSSML,<div class="product_detail_columns tinyscrl" itemprop="description" style=""><div class="scrollbar" style="width:2px; height:250px; background:#9E9E9E;"><div class="track" style="width:2px;"><div class="thumb" style="width:6px;"><div class="end"> </div></div></div></div><div class="viewport" style=" height:250px; width:252px; font-family:Arial !important;"><div class="overview" style="text-align:justify; display:block;"><div>Shirt?by Vila Made from polyester  Round neckline  Full sleeves  Snake skin print?  Concealed button placket at front  Regular fit ?100% Polyester </div></div></div> </div>,,17:04:2014,
492977,vila grey cotton women tops,http://www.yebhi.com/online-shopping/women/apparels.html?affint=women-topmenu,1800,Clothing,tops,vila,http://im6.ybndc.com/upload/492977/ProductRear635318763004746000.jpg,1800,,Women,http://www.yebhi.com/492977/PD/vila-grey-cotton-women-tops.htm,yebhi.com,Vila Grey Cotton Women - Tops Buy Online,Vila Grey Cotton Women - Tops  Best Price Rs 1800.00  EMI Rs 300 for 6 months FREE Shipping In Stock - Delivery in 3-5 Days,XS,<div class="product_detail_columns tinyscrl" itemprop="description" style=""><div class="scrollbar" style="width:2px; height:250px; background:#9E9E9E;"><div class="track" style="width:2px;"><div class="thumb" style="width:6px;"><div class="end"> </div></div></div></div><div class="viewport" style=" height:250px; width:252px; font-family:Arial !important;"><div class="overview" style="text-align:justify; display:block;"><div>This asymmetric top from KOOVS is made from cotton. The details include: round neckline  half sleeves  gradient hue pattern  asymmetric lower hem and pullover entry. The asymmetric top has a loose fit. </div></div></div> </div>,,17:04:2014,
492978,vila blue cotton women tops,http://www.yebhi.com/online-shopping/women/apparels.html?affint=women-topmenu,2200,Clothing,tops,vila,http://im6.ybndc.com/upload/492978/ProductRear635318763009426000.jpg,2200,,Women,http://www.yebhi.com/492978/PD/vila-blue-cotton-women-tops.htm,yebhi.com,Vila Blue Cotton Women - Tops Buy Online,Vila Blue Cotton Women - Tops  Best Price Rs 2200.00  EMI Rs 367 for 6 months FREE Shipping In Stock - Delivery in 3-5 Days,XS,<div class="product_detail_columns tinyscrl" itemprop="description" style=""><div class="scrollbar" style="width:2px; height:250px; background:#9E9E9E;"><div class="track" style="width:2px;"><div class="thumb" style="width:6px;"><div class="end"> </div></div></div></div><div class="viewport" style=" height:250px; width:252px; font-family:Arial !important;"><div class="overview" style="text-align:justify; display:block;"><div>Kurti by?The Vanca Made from cotton  Mandarin Collar  Polka dots allover  Knife pleats at the frontal  Long sleeves with buttoned cuffs  Sheer fabric  Front button placket for closure  Regular fit </div></div></div> </div>,,17:04:2014,
497412,vila white women tops,http://www.yebhi.com/online-shopping/women/apparels.html?affint=women-topmenu,1150,Clothing,tops,vila,http://im6.ybndc.com/upload/497412/ProductRear635321414190582000.jpg,1150,,Women,http://www.yebhi.com/497412/PD/vila-white-women-tops.htm,yebhi.com,Vila White Women - Tops Buy Online,Vila White Women - Tops  Best Price Rs 1150.00  EMI Rs 192 for 6 months FREE Shipping In Stock - Delivery in 3-5 Days,XSSML,<div class="product_detail_columns tinyscrl" itemprop="description" style=""><div class="scrollbar" style="width:2px; height:250px; background:#9E9E9E;"><div class="track" style="width:2px;"><div class="thumb" style="width:6px;"><div class="end"> </div></div></div></div><div class="viewport" style=" height:250px; width:252px; font-family:Arial !important;"><div class="overview" style="text-align:justify; display:block;"><div>This collar top?from Vila is made from 70% viscose and 30% polyester. The details include: spread collar  sleeveless  bead embellishment on the collar  concealed front button closure  watteau pleat at the back and curved hemline. The?collar top?has a slim fit.70% viscose and 30% polyester </div></div></div> </div>,,17:04:2014,
497560,vila pink women tops,http://www.yebhi.com/online-shopping/women/apparels.html?affint=women-topmenu,625,Clothing,tops,vila,http://im6.ybndc.com/upload/497560/ProductRear635321353726698000.jpg,625,,Women,http://www.yebhi.com/497560/PD/vila-pink-women-tops.htm,yebhi.com,Vila Pink Women - Tops Buy Online,Vila Pink Women - Tops  Best Price Rs 625.00  EMI Rs 104 for 6 months FREE Shipping In Stock - Delivery in 3-5 Days,XSSM,<div class="product_detail_columns tinyscrl" itemprop="description" style=""><div class="scrollbar" style="width:2px; height:250px; background:#9E9E9E;"><div class="track" style="width:2px;"><div class="thumb" style="width:6px;"><div class="end"> </div></div></div></div><div class="viewport" style=" height:250px; width:252px; font-family:Arial !important;"><div class="overview" style="text-align:justify; display:block;"><div>This tank top from Vila is made from 100% polyester. The details include: sleeveless  strappy style  stitched panel. The tank top has a loose fit.100% Polyester </div></div></div> </div>,,17:04:2014,
497442,vila purple women tops,http://www.yebhi.com/online-shopping/women/apparels.html?affint=women-topmenu,1500,Clothing,tops,vila,http://im6.ybndc.com/upload/497442/ProductRear635321414330358000.jpg,1500,,Women,http://www.yebhi.com/497442/PD/vila-purple-women-tops.htm,yebhi.com,Vila Purple Women - Tops Buy Online,Vila Purple Women - Tops  Best Price Rs 1500.00  EMI Rs 250 for 6 months FREE Shipping In Stock - Delivery in 3-5 Days,SMLXL,<div class="product_detail_columns tinyscrl" itemprop="description" style=""><div class="scrollbar" style="width:2px; height:250px; background:#9E9E9E;"><div class="track" style="width:2px;"><div class="thumb" style="width:6px;"><div class="end"> </div></div></div></div><div class="viewport" style=" height:250px; width:252px; font-family:Arial !important;"><div class="overview" style="text-align:justify; display:block;"><div>Top?by Vila Made from polyester  V-neckline  Full sleeves  Animal print all over  Ruffle detail  Drawstring waist tie-up  Semi-sheer fabric  Regular fit100% Polyester </div></div></div> </div>,,17:04:2014,
497211,vila beige women tops,http://www.yebhi.com/online-shopping/women/apparels.html?affint=women-topmenu,2000,Clothing,tops,vila,http://im6.ybndc.com/upload/497211/ProductRear635321413330242000.jpg,2000,,Women,http://www.yebhi.com/497211/PD/vila-beige-women-tops.htm,yebhi.com,Vila Beige Women - Tops Buy Online,Vila Beige Women - Tops  Best Price Rs 2000.00  EMI Rs 333 for 6 months FREE Shipping In Stock - Delivery in 3-5 Days,SML,<div class="product_detail_columns tinyscrl" itemprop="description" style=""><div class="scrollbar" style="width:2px; height:250px; background:#9E9E9E;"><div class="track" style="width:2px;"><div class="thumb" style="width:6px;"><div class="end"> </div></div></div></div><div class="viewport" style=" height:250px; width:252px; font-family:Arial !important;"><div class="overview" style="text-align:justify; display:block;"><div>Shirt?by Vila Made from polyester  Round neckline  Full sleeves  Snake skin print?  Concealed button placket at front  Regular fit ?100% Polyester </div></div></div> </div>,,17:04:2014,
497440,vila pink women tops,http://www.yebhi.com/online-shopping/women/apparels.html?affint=women-topmenu,1900,Clothing,tops,vila,http://im6.ybndc.com/upload/497440/ProductRear635321414320530000.jpg,1900,,Women,http://www.yebhi.com/497440/PD/vila-pink-women-tops.htm,yebhi.com,Vila Pink Women - Tops Buy Online,Vila Pink Women - Tops  Best Price Rs 1900.00  EMI Rs 317 for 6 months FREE Shipping In Stock - Delivery in 3-5 Days,XSSM,<div class="product_detail_columns tinyscrl" itemprop="description" style=""><div class="scrollbar" style="width:2px; height:250px; background:#9E9E9E;"><div class="track" style="width:2px;"><div class="thumb" style="width:6px;"><div class="end"> </div></div></div></div><div class="viewport" style=" height:250px; width:252px; font-family:Arial !important;"><div class="overview" style="text-align:justify; display:block;"><div>Top?by Vila Made from polyester  V-neckline  Short sleeves  Wrap front  Tab detail at shoulders  Regular fit100% Polyester </div></div></div> </div>,,17:04:2014,
497410,vila blue women tops,http://www.yebhi.com/online-shopping/women/apparels.html?affint=women-topmenu,1150,Clothing,tops,vila,http://im6.ybndc.com/upload/497410/ProductRear635321414181222000.jpg,1150,,Women,http://www.yebhi.com/497410/PD/vila-blue-women-tops.htm,yebhi.com,Vila Blue Women - Tops Buy Online,Vila Blue Women - Tops  Best Price Rs 1150.00  EMI Rs 192 for 6 months FREE Shipping In Stock - Delivery in 3-5 Days,XSSML,<div class="product_detail_columns tinyscrl" itemprop="description" style=""><div class="scrollbar" style="width:2px; height:250px; background:#9E9E9E;"><div class="track" style="width:2px;"><div class="thumb" style="width:6px;"><div class="end"> </div></div></div></div><div class="viewport" style=" height:250px; width:252px; font-family:Arial !important;"><div class="overview" style="text-align:justify; display:block;"><div>This collar top from Vila is made from polyester. The details include: sleeveless  spread collar  delicate embroidery at the frontal  watteau pleat at the back  sheer fabric and front button closure with placket. The collar top has a regular fit100% Polyester </div></div></div> </div>,,17:04:2014,
497486,vila white women tops,http://www.yebhi.com/online-shopping/women/apparels.html?affint=women-topmenu,1605,Clothing,tops,vila,http://im6.ybndc.com/upload/497486/ProductRear635321353405962000.jpg,1605,,Women,http://www.yebhi.com/497486/PD/vila-white-women-tops.htm,yebhi.com,Vila White Women - Tops Buy Online,Vila White Women - Tops  Best Price Rs 1605.00  EMI Rs 268 for 6 months FREE Shipping In Stock - Delivery in 3-5 Days,XSSML,<div class="product_detail_columns tinyscrl" itemprop="description" style=""><div class="scrollbar" style="width:2px; height:250px; background:#9E9E9E;"><div class="track" style="width:2px;"><div class="thumb" style="width:6px;"><div class="end"> </div></div></div></div><div class="viewport" style=" height:250px; width:252px; font-family:Arial !important;"><div class="overview" style="text-align:justify; display:block;"><div>Scoop top by Vila  Made from polyester  Round neckline  Short sleeves  Lace panelling at the shoulders and lower hemline  Box pleated front  Single loop button closure at the back  Semi sheer fabric  Regular fit100% Polyester </div></div></div> </div>,,17:04:2014,
497439,vila black women tops,http://www.yebhi.com/online-shopping/women/apparels.html?affint=women-topmenu,1900,Clothing,tops,vila,http://im6.ybndc.com/upload/497439/ProductRear635321414315694000.jpg,1900,,Women,http://www.yebhi.com/497439/PD/vila-black-women-tops.htm,yebhi.com,Vila Black Women - Tops Buy Online,Vila Black Women - Tops  Best Price Rs 1900.00  EMI Rs 317 for 6 months FREE Shipping In Stock - Delivery in 3-5 Days,XSSML,<div class="product_detail_columns tinyscrl" itemprop="description" style=""><div class="scrollbar" style="width:2px; height:250px; background:#9E9E9E;"><div class="track" style="width:2px;"><div class="thumb" style="width:6px;"><div class="end"> </div></div></div></div><div class="viewport" style=" height:250px; width:252px; font-family:Arial !important;"><div class="overview" style="text-align:justify; display:block;"><div>Top?by Vila Made from polyester  V-neckline  Short sleeves  Wrap front  Tab detail at shoulders  Regular fit100% Polyester </div></div></div> </div>,,17:04:2014,
