383953,miss chase white cotton women night suits,http://www.yebhi.com/online-shopping/women/apparels.html?affint=women-topmenu,1099,Clothing,nightwear,miss-chase,http://im6.ybndc.com/upload/383953/ProductRear635174579156873164.jpg,1099,,Women,http://www.yebhi.com/383953/PD/miss-chase-white-cotton-women-night-suits.htm,yebhi.com,Miss Chase White Cotton Women - Night Suits Buy Online,Miss Chase White Cotton Women - Night Suits  Best Price Rs 1099.00  EMI Rs 183 for 6 months FREE Shipping In Stock - Delivery in 6-8 Days,XSSM,<div class="product_detail_columns tinyscrl" itemprop="description" style=""><div class="scrollbar" style="width:2px; height:250px; background:#9E9E9E;"><div class="track" style="width:2px;"><div class="thumb" style="width:6px;"><div class="end"> </div></div></div></div><div class="viewport" style=" height:250px; width:252px; font-family:Arial !important;"><div class="overview" style="text-align:justify; display:block;"><div>These sultry and feminine oversized t-shirts are a perfect combination of style and comfort! </div></div></div> </div>,,16:04:2014,
383950,miss chase pink cotton womens pyjamas,http://www.yebhi.com/online-shopping/women/apparels.html?affint=women-topmenu,699,Clothing,nightwear,miss-chase,http://im6.ybndc.com/upload/383950/ProductRear635174569635040127.jpg,699,,Women,http://www.yebhi.com/383950/PD/miss-chase-pink-cotton-womens-pyjamas.htm,yebhi.com,Miss Chase Pink Cotton - Womens Pyjamas Buy Online,Miss Chase Pink Cotton - Womens Pyjamas  Best Price Rs 699.00  EMI Rs 117 for 6 months FREE Shipping In Stock - Delivery in 6-8 Days,SMLXL,<div class="product_detail_columns tinyscrl" itemprop="description" style=""><div class="scrollbar" style="width:2px; height:250px; background:#9E9E9E;"><div class="track" style="width:2px;"><div class="thumb" style="width:6px;"><div class="end"> </div></div></div></div><div class="viewport" style=" height:250px; width:252px; font-family:Arial !important;"><div class="overview" style="text-align:justify; display:block;"><div>A pair of solid colored pajamas can be paired with a printed or plain tee! A perfect nighttime piece for any fashionista! </div></div></div> </div>,,16:04:2014,
383958,miss chase white cotton women night suits,http://www.yebhi.com/online-shopping/women/apparels.html?affint=women-topmenu,999,Clothing,nightwear,miss-chase,http://im6.ybndc.com/upload/383958/ProductRear635174580117995325.jpg,999,,Women,http://www.yebhi.com/383958/PD/miss-chase-white-cotton-women-night-suits.htm,yebhi.com,Miss Chase White Cotton Women - Night Suits Buy Online,Miss Chase White Cotton Women - Night Suits  Best Price Rs 999.00  EMI Rs 167 for 6 months FREE Shipping In Stock - Delivery in 6-8 Days,M,<div class="product_detail_columns tinyscrl" itemprop="description" style=""><div class="scrollbar" style="width:2px; height:250px; background:#9E9E9E;"><div class="track" style="width:2px;"><div class="thumb" style="width:6px;"><div class="end"> </div></div></div></div><div class="viewport" style=" height:250px; width:252px; font-family:Arial !important;"><div class="overview" style="text-align:justify; display:block;"><div>This sultry striped boyfriend shirt is the perfect and most comfortable thing to wear to bed. </div></div></div> </div>,,16:04:2014,
383956,miss chase pink cotton women night suits,http://www.yebhi.com/online-shopping/women/apparels.html?affint=women-topmenu,999,Clothing,nightwear,miss-chase,http://im6.ybndc.com/upload/383956/ProductRear635174579721908786.jpg,999,,Women,http://www.yebhi.com/383956/PD/miss-chase-pink-cotton-women-night-suits.htm,yebhi.com,Miss Chase Pink Cotton Women - Night Suits Buy Online,Miss Chase Pink Cotton Women - Night Suits  Best Price Rs 999.00  EMI Rs 167 for 6 months FREE Shipping In Stock - Delivery in 6-8 Days,XSS,<div class="product_detail_columns tinyscrl" itemprop="description" style=""><div class="scrollbar" style="width:2px; height:250px; background:#9E9E9E;"><div class="track" style="width:2px;"><div class="thumb" style="width:6px;"><div class="end"> </div></div></div></div><div class="viewport" style=" height:250px; width:252px; font-family:Arial !important;"><div class="overview" style="text-align:justify; display:block;"><div>These sultry and feminine oversized t-shirts are a perfect combination of style and comfort! </div></div></div> </div>,,16:04:2014,
383955,miss chase green cotton women night suits,http://www.yebhi.com/online-shopping/women/apparels.html?affint=women-topmenu,1099,Clothing,nightwear,miss-chase,http://im6.ybndc.com/upload/383955/ProductRear635174577469410347.jpg,1099,,Women,http://www.yebhi.com/383955/PD/miss-chase-green-cotton-women-night-suits.htm,yebhi.com,Miss Chase Green Cotton Women - Night Suits Buy Online,Miss Chase Green Cotton Women - Night Suits  Best Price Rs 1099.00  EMI Rs 183 for 6 months FREE Shipping In Stock - Delivery in 6-8 Days,XSSM,<div class="product_detail_columns tinyscrl" itemprop="description" style=""><div class="scrollbar" style="width:2px; height:250px; background:#9E9E9E;"><div class="track" style="width:2px;"><div class="thumb" style="width:6px;"><div class="end"> </div></div></div></div><div class="viewport" style=" height:250px; width:252px; font-family:Arial !important;"><div class="overview" style="text-align:justify; display:block;"><div>Slip into something more comfortable and stylish with this attractive <b>green</b> coloured night dress from Miss Chase. This nighty features a trendy <b>slogan</b> which makes it look appealing. The soft <b>cotton</b> fabric makes it perfect for a relaxed night sleep.<b>Features</b><ul style="margin-left: 20px;"> <li type="disc"><b>Brand:</b> Miss Chase </li><li type="disc"><b>Category:</b> Nightwear<li type="disc"><b>Usage:</b> Dailywear<li type="disc"><b>Pattern:</b> Printed <li type="disc"><b>Colour:</b> Green<li type="disc"><b>Length:</b> Thigh-length <li type="disc"><b>Sleeve:</b> Half Sleeve <li type="disc"><b>Neck:</b> V-neck <li type="disc"><b>Material:</b> Cotton</li></li></li></li></li></li></li></li></ul><b>Wash &amp; Care </b>  Mild wash / machine wash gently.  Wash dark colours separately. </div></div></div> </div>,,16:04:2014,
383952,miss chase blue cotton women night suits,http://www.yebhi.com/online-shopping/women/apparels.html?affint=women-topmenu,999,Clothing,nightwear,miss-chase,http://im6.ybndc.com/upload/383952/ProductRear635174571552916421.jpg,999,,Women,http://www.yebhi.com/383952/PD/miss-chase-blue-cotton-women-night-suits.htm,yebhi.com,Miss Chase Blue Cotton Women - Night Suits Buy Online,Miss Chase Blue Cotton Women - Night Suits  Best Price Rs 999.00  EMI Rs 167 for 6 months FREE Shipping In Stock - Delivery in 6-8 Days,ML,<div class="product_detail_columns tinyscrl" itemprop="description" style=""><div class="scrollbar" style="width:2px; height:250px; background:#9E9E9E;"><div class="track" style="width:2px;"><div class="thumb" style="width:6px;"><div class="end"> </div></div></div></div><div class="viewport" style=" height:250px; width:252px; font-family:Arial !important;"><div class="overview" style="text-align:justify; display:block;"><div>This <b>2 piece</b> nightwear ensures utmost comfort and style for you. It includes a <b>sleeveless top</b> and <b>loose-fit pyjama bottoms</b>. The stylish <b>lace trim</b> neckline of the top make this set an adorable piece for your nightwear. Made from soft <b>cotton</b>  this set is ideal to relax at home.<b>Features</b><ul style="margin-left: 20px;"><li type="disc"><b>Brand:</b> Miss Chase<li type="disc"><b>Category:</b> Nightwear<li type="disc"><b>Usage:</b> Dailywear<li type="disc"><b>Sleeve (top):</b> Sleeveless<li type="disc"><b>Neck (top):</b> V-neck<li type="disc"><b>Length (bottoms):</b> Full length<li type="disc"><b>Pattern:</b> Solid<li type="disc"><b>Colour:</b> Blue<li type="disc"><b>Material:</b> Cotton</li></li></li></li></li></li></li></li></li></ul><b>Wash &amp; Care </b>  Mild wash / machine wash gently.  Wash dark colours separately. </div></div></div> </div>,,16:04:2014,
383954,miss chase pink cotton women night suits,http://www.yebhi.com/online-shopping/women/apparels.html?affint=women-topmenu,999,Clothing,nightwear,miss-chase,http://im6.ybndc.com/upload/383954/ProductRear635174579305386116.jpg,999,,Women,http://www.yebhi.com/383954/PD/miss-chase-pink-cotton-women-night-suits.htm,yebhi.com,Miss Chase Pink Cotton Women - Night Suits Buy Online,Miss Chase Pink Cotton Women - Night Suits  Best Price Rs 999.00  EMI Rs 167 for 6 months FREE Shipping in 2 Days,M,<div class="product_detail_columns tinyscrl" itemprop="description" style=""><div class="scrollbar" style="width:2px; height:250px; background:#9E9E9E;"><div class="track" style="width:2px;"><div class="thumb" style="width:6px;"><div class="end"> </div></div></div></div><div class="viewport" style=" height:250px; width:252px; font-family:Arial !important;"><div class="overview" style="text-align:justify; display:block;"><div>Slip into something more comfortable and stylish with this attractive <b>green</b> coloured night dress from Miss Chase. This nighty features a trendy <b>slogan</b> which makes it look appealing. The soft <b>cotton</b> fabric makes it perfect for a relaxed night sleep.<b>Features</b><ul style="margin-left: 20px;"> <li type="disc"><b>Brand:</b> Miss Chase </li><li type="disc"><b>Category:</b> Nightwear<li type="disc"><b>Usage:</b> Dailywear<li type="disc"><b>Pattern:</b> Printed <li type="disc"><b>Colour:</b> Pink<li type="disc"><b>Length:</b> Thigh-length <li type="disc"><b>Sleeve:</b> Sleeveless<li type="disc"><b>Neck:</b> V-neck <li type="disc"><b>Material:</b> Cotton</li></li></li></li></li></li></li></li></ul><b>Wash &amp; Care </b>  Mild wash / machine wash gently.  Wash dark colours separately. </div></div></div> </div>,,16:04:2014,
383957,miss chase red cotton women night suits,http://www.yebhi.com/online-shopping/women/apparels.html?affint=women-topmenu,999,Clothing,nightwear,miss-chase,http://im6.ybndc.com/upload/383957/ProductRear635174580021274705.jpg,999,,Women,http://www.yebhi.com/383957/PD/miss-chase-red-cotton-women-night-suits.htm,yebhi.com,Miss Chase Red Cotton Women - Night Suits Buy Online,Miss Chase Red Cotton Women - Night Suits  Best Price Rs 999.00  EMI Rs 167 for 6 months FREE Shipping In Stock - Delivery in 6-8 Days,M,<div class="product_detail_columns tinyscrl" itemprop="description" style=""><div class="scrollbar" style="width:2px; height:250px; background:#9E9E9E;"><div class="track" style="width:2px;"><div class="thumb" style="width:6px;"><div class="end"> </div></div></div></div><div class="viewport" style=" height:250px; width:252px; font-family:Arial !important;"><div class="overview" style="text-align:justify; display:block;"><div>The boyfriend sleep shirt is a stylish  feminine twist on a men?s shirt. Perfectly fashionable and comfortable to sleep in  don?t miss out on this style!  </div></div></div> </div>,,16:04:2014,
373256,miss chase pink cotton women night suits,http://www.yebhi.com/online-shopping/women/apparels.html?affint=women-topmenu,799,Clothing,nightwear,miss-chase,http://im6.ybndc.com/upload/373256/ProductRear635150351720501392.jpg,799,,Women,http://www.yebhi.com/373256/PD/miss-chase-pink-cotton-women-night-suits.htm,yebhi.com,Miss Chase Pink Cotton Women - Night Suits Buy Online,Miss Chase Pink Cotton Women - Night Suits  Best Price Rs 799.00  EMI Rs 133 for 6 months FREE Shipping in 2 Days,S,<div class="product_detail_columns tinyscrl" itemprop="description" style=""><div class="scrollbar" style="width:2px; height:250px; background:#9E9E9E;"><div class="track" style="width:2px;"><div class="thumb" style="width:6px;"><div class="end"> </div></div></div></div><div class="viewport" style=" height:250px; width:252px; font-family:Arial !important;"><div class="overview" style="text-align:justify; display:block;"><div>This adorable camisole and shorts set is the perfect sleepwear for summers! Get one now! </div></div></div> </div>,,16:04:2014,
439321,miss chase yellow cotton womens pyjamas,http://www.yebhi.com/online-shopping/women/apparels.html?affint=women-topmenu,699,Clothing,nightwear,miss-chase,http://im6.ybndc.com/upload/439321/ProductRear635234169959510103.jpg,699,,Women,http://www.yebhi.com/439321/PD/miss-chase-yellow-cotton-womens-pyjamas.htm,yebhi.com,Miss Chase Yellow Cotton - Womens Pyjamas Buy Online,Miss Chase Yellow Cotton - Womens Pyjamas  Best Price Rs 699.00  EMI Rs 117 for 6 months FREE Shipping In Stock - Delivery in 6-8 Days,SM,<div class="product_detail_columns tinyscrl" itemprop="description" style=""><div class="scrollbar" style="width:2px; height:250px; background:#9E9E9E;"><div class="track" style="width:2px;"><div class="thumb" style="width:6px;"><div class="end"> </div></div></div></div><div class="viewport" style=" height:250px; width:252px; font-family:Arial !important;"><div class="overview" style="text-align:justify; display:block;"><div>A pair of solid colored pajamas can be paired with a printed or plain tee! A perfect nighttime piece for any fashionista! </div></div></div> </div>,,16:04:2014,
439322,miss chase green cotton womens pyjamas,http://www.yebhi.com/online-shopping/women/apparels.html?affint=women-topmenu,699,Clothing,nightwear,miss-chase,http://im6.ybndc.com/upload/439322/ProductRear635234169964814205.jpg,699,,Women,http://www.yebhi.com/439322/PD/miss-chase-green-cotton-womens-pyjamas.htm,yebhi.com,Miss Chase Green Cotton - Womens Pyjamas Buy Online,Miss Chase Green Cotton - Womens Pyjamas  Best Price Rs 699.00  EMI Rs 117 for 6 months FREE Shipping In Stock - Delivery in 6-8 Days,XSSMLXL,<div class="product_detail_columns tinyscrl" itemprop="description" style=""><div class="scrollbar" style="width:2px; height:250px; background:#9E9E9E;"><div class="track" style="width:2px;"><div class="thumb" style="width:6px;"><div class="end"> </div></div></div></div><div class="viewport" style=" height:250px; width:252px; font-family:Arial !important;"><div class="overview" style="text-align:justify; display:block;"><div>A pair of solid colored pajamas can be paired with a printed or plain tee! A perfect nighttime piece for any fashionista! </div></div></div> </div>,,16:04:2014,
383951,miss chase white cotton women night suits,http://www.yebhi.com/online-shopping/women/apparels.html?affint=women-topmenu,799,Clothing,nightwear,miss-chase,http://im6.ybndc.com/upload/383951/ProductRear635174569729576733.jpg,799,,Women,http://www.yebhi.com/383951/PD/miss-chase-white-cotton-women-night-suits.htm,yebhi.com,Miss Chase White Cotton Women - Night Suits Buy Online,Miss Chase White Cotton Women - Night Suits  Best Price Rs 799.00  EMI Rs 133 for 6 months FREE Shipping In Stock - Delivery in 6-8 Days,M,<div class="product_detail_columns tinyscrl" itemprop="description" style=""><div class="scrollbar" style="width:2px; height:250px; background:#9E9E9E;"><div class="track" style="width:2px;"><div class="thumb" style="width:6px;"><div class="end"> </div></div></div></div><div class="viewport" style=" height:250px; width:252px; font-family:Arial !important;"><div class="overview" style="text-align:justify; display:block;"><div>This adorable camisole and shorts set is the perfect sleepwear for summers! Get one now! </div></div></div> </div>,,16:04:2014,
