311149,benetton green half sleeves cotton women casual shirts,http://www.yebhi.com/online-shopping/women/apparels.html?affint=women-topmenu,1519,Clothing,casual-shirts,benetton,http://im6.ybndc.com/upload/311149/ProductRear635083808878786000.jpg,1899,,Women,http://www.yebhi.com/311149/PD/benetton-green-half-sleeves-cotton-women-casual-shirts.htm,yebhi.com,Benetton Green Half Sleeves Cotton Women - Casual Shirts Buy Online,Benetton Green Half Sleeves Cotton Women - Casual Shirts  Best Price Rs 1519.00 Best Discount 20% Off EMI Rs 253 for 6 months FREE Shipping in 2 Days,SML,<div class="product_detail_columns tinyscrl" itemprop="description" style=""><div class="scrollbar" style="width:2px; height:250px; background:#9E9E9E;"><div class="track" style="width:2px;"><div class="thumb" style="width:6px;"><div class="end"> </div></div></div></div><div class="viewport" style=" height:250px; width:252px; font-family:Arial !important;"><div class="overview" style="text-align:justify; display:block;"><div>This <b> casual shirt </b> in <b> green colour </b> features checked pattern  a collared neck and half sleeves. From the house of Benetton  it is crafted from <b> cotton material.</b><b>Features</b><ul style="margin-left: 20px;"><li type="disc"> <b>Brand:</b> Benetton</li><li type="disc"> <b>Category:</b> Shirt</li><li type="disc"> <b>Type:</b> Casual Shirt</li><li type="disc"><b>Material:</b> Cotton</li><li type="disc"><b>Colour:</b> Green</li><li type="disc"><b>Pattern:</b> Checked pattern</li><li type="disc"><b>Neck:</b> Collared Neck</li><li type="disc"><b>Sleeves:</b> Half sleeves </li><li type="disc"><b>Fit:</b> Regular</li></ul><b> Team it with </b> denim and wedges.<br/><b>Care Tips</b>  Do not bleach or dry clean.Wash with like colours.Line dry.Warm iron. <b>Note:</b>  There may be a slight colour variation in the image from original product.   </div></div></div> </div>,,16:04:2014,
277108,benetton blue full sleeves viscose women casual shirts,http://www.yebhi.com/online-shopping/women/apparels.html?affint=women-topmenu,1679,Clothing,casual-shirts,benetton,http://im6.ybndc.com/upload/277108/ProductRear635026000548340263.jpg,2099,,Women,http://www.yebhi.com/277108/PD/benetton-blue-full-sleeves-viscose-women-casual-shirts.htm,yebhi.com,Benetton Blue Full Sleeves Viscose Women - Casual Shirts Buy Online,Benetton Blue Full Sleeves Viscose Women - Casual Shirts  Best Price Rs 1679.00 Best Discount 20% Off EMI Rs 280 for 6 months FREE Shipping in 2 Days,ML,<div class="product_detail_columns tinyscrl" itemprop="description" style=""><div class="scrollbar" style="width:2px; height:250px; background:#9E9E9E;"><div class="track" style="width:2px;"><div class="thumb" style="width:6px;"><div class="end"> </div></div></div></div><div class="viewport" style=" height:250px; width:252px; font-family:Arial !important;"><div class="overview" style="text-align:justify; display:block;"><div>Team your shorts or denims with this <b>dotted print shirt</b> and get the perfect formal look. Be extremely comfortable in your casual wear with this blue shirt from the house of <b>Benetton.</b> This <b>shirt is crafted with viscose</b> and is an exquisite creation for the style conscious lady. <br/><br/><b>Features</b><ul style="margin-left: 20px;"><li type="disc">Colour: Blue  White</li><li type="disc">Fabric: Viscose</li><li type="disc">Pattern: Printed</li><li type="disc">Sleeves: Full Sleeves</li><li type="disc">Front: Full buttoned placket</li><li type="disc">Pocket: 2</li></ul><br/><b>Looks great with</b> shorts/ denims.<br/><br/><b>Care Tips</b><br/>  Wash with like colours.<br/>  Do not soak  tumble dry or bleach<br/>  Mild iron<br/>  Line dry<br/><br/><b>Note:</b>The model in the image is wearing a size M.<br/> There may be a slight colour variation in the image from original product. </div></div></div> </div>,,16:04:2014,
311145,benetton mustard half sleeves cotton women casual shirts,http://www.yebhi.com/online-shopping/women/apparels.html?affint=women-topmenu,1679,Clothing,casual-shirts,benetton,http://im6.ybndc.com/upload/311145/ProductRear635071614001122544.jpg,2099,,Women,http://www.yebhi.com/311145/PD/benetton-mustard-half-sleeves-cotton-women-casual-shirts.htm,yebhi.com,Benetton Mustard Half Sleeves Cotton Women - Casual Shirts Buy Online,Benetton Mustard Half Sleeves Cotton Women - Casual Shirts  Best Price Rs 1679.00 Best Discount 20% Off EMI Rs 280 for 6 months FREE Shipping in 2 Days,SML,<div class="product_detail_columns tinyscrl" itemprop="description" style=""><div class="scrollbar" style="width:2px; height:250px; background:#9E9E9E;"><div class="track" style="width:2px;"><div class="thumb" style="width:6px;"><div class="end"> </div></div></div></div><div class="viewport" style=" height:250px; width:252px; font-family:Arial !important;"><div class="overview" style="text-align:justify; display:block;"><div>For all those casual hangouts where you need to look the best among your girlies. In a <b>vibrant orange colour with prints all over </b> this shirt from <b>Benetton</b> will keep you high on style and comfort too.<br/><br/><b>Features</b><ul style="margin-left: 20px;"><li type="disc">Colour: Orange</li><li type="disc">Fabric: Cotton</li><li type="disc">Pattern: Printed</li><li type="disc">Sleeves: Half Sleeves</li><li type="disc">Front: Full buttoned placket</li><li type="disc">Pocket: None</li></ul><br/><b>Looks great with</b> denims/ shorts and flip flops<br/><br/><b>Care Tips</b><br/>  Wash with like colours.<br/>  Do not soak  tumble dry or bleach<br/>  Mild iron<br/>  Line dry<br/><br/><b>Note:</b>The model in the image is wearing a size M<br/> There may be a slight colour variation in the image from original product. </div></div></div> </div>,,16:04:2014,
277107,benetton pink full sleeves women casual shirts,http://www.yebhi.com/online-shopping/women/apparels.html?affint=women-topmenu,1374,Clothing,casual-shirts,benetton,http://im6.ybndc.com/upload/277107/ProductRear635026571817450221.jpg,2499,,Women,http://www.yebhi.com/277107/PD/benetton-pink-full-sleeves-women-casual-shirts.htm,yebhi.com,Benetton Pink Full Sleeves Women - Casual Shirts Buy Online,Benetton Pink Full Sleeves Women - Casual Shirts  Best Price Rs 1374.00 Best Discount 45% Off EMI Rs 229 for 6 months FREE Shipping in 2 Days,M,<div class="product_detail_columns tinyscrl" itemprop="description" style=""><div class="scrollbar" style="width:2px; height:250px; background:#9E9E9E;"><div class="track" style="width:2px;"><div class="thumb" style="width:6px;"><div class="end"> </div></div></div></div><div class="viewport" style=" height:250px; width:252px; font-family:Arial !important;"><div class="overview" style="text-align:justify; display:block;"><div>This summer be a part of the fashion brigade with this <b>cute and stylish casual shirt</b> from the house of <b>Benetton.</b> Featuring <b>floral designs all over </b> this shirt give you a ravishing look. <br/><br/><b>Features</b><ul style="margin-left: 20px;"><li type="disc">Colour: Pink</li><li type="disc">Fabric: Polyester</li><li type="disc">Pattern: Printed</li><li type="disc">Sleeves: Full Sleeves</li><li type="disc">Front: Mandarin collars with buttoned detailing</li><li type="disc">Pocket: None</li></ul><br/><b>Looks great with</b>jeans and pumps.<br/><br/><b>Care Tips</b><br/>  Wash with like colours.<br>Do not soak  tumble dry or bleach<br>Mild iron<br>Line dry<br/><b>Note:</b>The model in the image is wearing a size M.</br> There may be a slight colour variation in the image from original product. </br></br></div></div></div> </div>,,16:04:2014,
311148,benetton pink half sleeves cotton women casual shirts,http://www.yebhi.com/online-shopping/women/apparels.html?affint=women-topmenu,1519,Clothing,casual-shirts,benetton,http://im6.ybndc.com/upload/311148/ProductRear635078739627894995.jpg,1899,,Women,http://www.yebhi.com/311148/PD/benetton-pink-half-sleeves-cotton-women-casual-shirts.htm,yebhi.com,Benetton Pink Half Sleeves Cotton Women - Casual Shirts Buy Online,Benetton Pink Half Sleeves Cotton Women - Casual Shirts  Best Price Rs 1519.00 Best Discount 20% Off EMI Rs 253 for 6 months FREE Shipping in 2 Days,SML,<div class="product_detail_columns tinyscrl" itemprop="description" style=""><div class="scrollbar" style="width:2px; height:250px; background:#9E9E9E;"><div class="track" style="width:2px;"><div class="thumb" style="width:6px;"><div class="end"> </div></div></div></div><div class="viewport" style=" height:250px; width:252px; font-family:Arial !important;"><div class="overview" style="text-align:justify; display:block;"><div>This <b> casual shirt </b> in <b> pink colour features a collared neck and half sleeves. </b> From the house of Benetton  it is crafted from <b> cotton material.</b><b>Features</b><ul style="margin-left: 20px;"><li type="disc"> <b>Brand:</b> Benetton</li><li type="disc"> <b>Category:</b> Shirts</li><li type="disc"> <b>Type:</b> Casual Shirt</li><li type="disc"><b>Material:</b> Cotton</li><li type="disc"><b>Colour:</b> Pink</li><li type="disc"><b>Pattern:</b> Checked pattern</li><li type="disc"><b>Neck:</b> Collared neck</li><li type="disc"><b>Sleeves:</b> Half sleeves </li><li type="disc"><b>Fit:</b> Regular</li></ul><b> Team it with </b> denim and wedges.<br/><b>Care Tips</b>  Do not bleach or dry clean. Wash with like colours. Line dry. Warm iron. <b>Note:</b>  There may be a slight colour variation in the image from original product.   </div></div></div> </div>,,16:04:2014,
311151,benetton yellow half sleeves women casual shirts,http://www.yebhi.com/online-shopping/women/apparels.html?affint=women-topmenu,1839,Clothing,casual-shirts,benetton,http://im6.ybndc.com/upload/311151/ProductRear635078757747606995.jpg,2299,,Women,http://www.yebhi.com/311151/PD/benetton-yellow-half-sleeves-women-casual-shirts.htm,yebhi.com,Benetton Yellow Half Sleeves Women - Casual Shirts Buy Online,Benetton Yellow Half Sleeves Women - Casual Shirts  Best Price Rs 1839.00 Best Discount 20% Off EMI Rs 307 for 6 months FREE Shipping in 2 Days,SMLXL,<div class="product_detail_columns tinyscrl" itemprop="description" style=""><div class="scrollbar" style="width:2px; height:250px; background:#9E9E9E;"><div class="track" style="width:2px;"><div class="thumb" style="width:6px;"><div class="end"> </div></div></div></div><div class="viewport" style=" height:250px; width:252px; font-family:Arial !important;"><div class="overview" style="text-align:justify; display:block;"><div><table><tr><td><b>Colour</b></td><td>    </td><td>Yellow</td></tr><tr><td><b>For</b></td><td>    </td><td>Women</td></tr><tr><td><b>Material</b></td><td>    </td><td>Linen</td></tr><tr><td><b>Brands</b></td><td>    </td><td>Benetton</td></tr><tr><td><b>Departments</b></td><td>    </td><td>Apparels</td></tr><tr><td><b>Sleeves</b></td><td>    </td><td>Half Sleeves</td></tr><tr><td><b>Design </b></td><td>    </td><td>Solids</td></tr><tr><td><b>Category</b></td><td>    </td><td>Casual Shirts</td></tr><tr><td><b>Discount</b></td><td>    </td><td>More than 10%   Sale</td></tr></table>  </div></div></div> </div>,,16:04:2014,
