432694,hugo chavez purple full sleeves women coats,http://www.yebhi.com/online-shopping/women/apparels.html?affint=women-topmenu,2850,Clothing,coats-and-jackets,hugo-chavez,http://im6.ybndc.com/upload/432694/ProductRear635228110957936967.jpg,2850,,Women,http://www.yebhi.com/432694/PD/hugo-chavez-purple-full-sleeves-women-coats.htm,yebhi.com,Hugo Chavez Purple Full Sleeves Women - Coats Buy Online,Hugo Chavez Purple Full Sleeves Women - Coats  Best Price Rs 2850.00  EMI Rs 475 for 6 months FREE Shipping In Stock - Delivery in 6-8 Days,SMLXL,<div class="product_detail_columns tinyscrl" itemprop="description" style=""><div class="scrollbar" style="width:2px; height:250px; background:#9E9E9E;"><div class="track" style="width:2px;"><div class="thumb" style="width:6px;"><div class="end"> </div></div></div></div><div class="viewport" style=" height:250px; width:252px; font-family:Arial !important;"><div class="overview" style="text-align:justify; display:block;"><div>pleated neckline with front opening    pockets on princess line and long sleeves . </div></div></div> </div>,,16:04:2014,
432699,hugo chavez orange full sleeves women coats,http://www.yebhi.com/online-shopping/women/apparels.html?affint=women-topmenu,2850,Clothing,coats-and-jackets,hugo-chavez,http://im6.ybndc.com/upload/432699/ProductRear635228110974005276.jpg,2850,,Women,http://www.yebhi.com/432699/PD/hugo-chavez-orange-full-sleeves-women-coats.htm,yebhi.com,Hugo Chavez Orange Full Sleeves Women - Coats Buy Online,Hugo Chavez Orange Full Sleeves Women - Coats  Best Price Rs 2850.00  EMI Rs 475 for 6 months FREE Shipping In Stock - Delivery in 6-8 Days,SMLXL,<div class="product_detail_columns tinyscrl" itemprop="description" style=""><div class="scrollbar" style="width:2px; height:250px; background:#9E9E9E;"><div class="track" style="width:2px;"><div class="thumb" style="width:6px;"><div class="end"> </div></div></div></div><div class="viewport" style=" height:250px; width:252px; font-family:Arial !important;"><div class="overview" style="text-align:justify; display:block;"><div>Orange felt jacket with front opening with stylized pockets and cuts and pleated hem line. </div></div></div> </div>,,16:04:2014,
432696,hugo chavez yellow full sleeves women coats,http://www.yebhi.com/online-shopping/women/apparels.html?affint=women-topmenu,2850,Clothing,coats-and-jackets,hugo-chavez,http://im6.ybndc.com/upload/432696/ProductRear635228110964489093.jpg,2850,,Women,http://www.yebhi.com/432696/PD/hugo-chavez-yellow-full-sleeves-women-coats.htm,yebhi.com,Hugo Chavez Yellow Full Sleeves Women - Coats Buy Online,Hugo Chavez Yellow Full Sleeves Women - Coats  Best Price Rs 2850.00  EMI Rs 475 for 6 months FREE Shipping In Stock - Delivery in 6-8 Days,SMLXL,<div class="product_detail_columns tinyscrl" itemprop="description" style=""><div class="scrollbar" style="width:2px; height:250px; background:#9E9E9E;"><div class="track" style="width:2px;"><div class="thumb" style="width:6px;"><div class="end"> </div></div></div></div><div class="viewport" style=" height:250px; width:252px; font-family:Arial !important;"><div class="overview" style="text-align:justify; display:block;"><div>yellow  jacket with standing collars   front opening  and  pockets on princess line   </div></div></div> </div>,,16:04:2014,
432688,hugo chavez orange full sleeves women jackets,http://www.yebhi.com/online-shopping/women/apparels.html?affint=women-topmenu,1850,Clothing,coats-and-jackets,hugo-chavez,http://im6.ybndc.com/upload/432688/ProductRear635228110939060604.jpg,1850,,Women,http://www.yebhi.com/432688/PD/hugo-chavez-orange-full-sleeves-women-jackets.htm,yebhi.com,Hugo Chavez Orange Full Sleeves Women - Jackets Buy Online,Hugo Chavez Orange Full Sleeves Women - Jackets  Best Price Rs 1850.00  EMI Rs 308 for 6 months FREE Shipping In Stock - Delivery in 6-8 Days,SMLXL,<div class="product_detail_columns tinyscrl" itemprop="description" style=""><div class="scrollbar" style="width:2px; height:250px; background:#9E9E9E;"><div class="track" style="width:2px;"><div class="thumb" style="width:6px;"><div class="end"> </div></div></div></div><div class="viewport" style=" height:250px; width:252px; font-family:Arial !important;"><div class="overview" style="text-align:justify; display:block;"><div>short jacket with full sleeves    front opening and pockets on side seam line.   </div></div></div> </div>,,16:04:2014,
432684,hugo chavez grey full sleeves women jackets,http://www.yebhi.com/online-shopping/women/apparels.html?affint=women-topmenu,3950,Clothing,coats-and-jackets,hugo-chavez,http://im6.ybndc.com/upload/432684/ProductRear635228110925956352.jpg,3950,,Women,http://www.yebhi.com/432684/PD/hugo-chavez-grey-full-sleeves-women-jackets.htm,yebhi.com,Hugo Chavez Grey Full Sleeves Women - Jackets Buy Online,Hugo Chavez Grey Full Sleeves Women - Jackets  Best Price Rs 3950.00  EMI Rs 658 for 6 months FREE Shipping In Stock - Delivery in 6-8 Days,SMLXL,<div class="product_detail_columns tinyscrl" itemprop="description" style=""><div class="scrollbar" style="width:2px; height:250px; background:#9E9E9E;"><div class="track" style="width:2px;"><div class="thumb" style="width:6px;"><div class="end"> </div></div></div></div><div class="viewport" style=" height:250px; width:252px; font-family:Arial !important;"><div class="overview" style="text-align:justify; display:block;"><div>short jacket with overlaped opening with exposed zipper   standing collar and full sleeves with exposed zipper opening . </div></div></div> </div>,,16:04:2014,
432687,hugo chavez pink full sleeves wool women jackets,http://www.yebhi.com/online-shopping/women/apparels.html?affint=women-topmenu,3280,Clothing,coats-and-jackets,hugo-chavez,http://im6.ybndc.com/upload/432687/ProductRear635228110935160529.jpg,3280,,Women,http://www.yebhi.com/432687/PD/hugo-chavez-pink-full-sleeves-wool-women-jackets.htm,yebhi.com,Hugo Chavez Pink Full Sleeves wool Women - Jackets Buy Online,Hugo Chavez Pink Full Sleeves wool Women - Jackets  Best Price Rs 3280.00  EMI Rs 547 for 6 months FREE Shipping In Stock - Delivery in 6-8 Days,SMLXL,<div class="product_detail_columns tinyscrl" itemprop="description" style=""><div class="scrollbar" style="width:2px; height:250px; background:#9E9E9E;"><div class="track" style="width:2px;"><div class="thumb" style="width:6px;"><div class="end"> </div></div></div></div><div class="viewport" style=" height:250px; width:252px; font-family:Arial !important;"><div class="overview" style="text-align:justify; display:block;"><div>short jacket  with abstract  opening   chinese hand made button    dori piping and  full sleeves   . </div></div></div> </div>,,16:04:2014,
432698,hugo chavez pink full sleeves women coats,http://www.yebhi.com/online-shopping/women/apparels.html?affint=women-topmenu,2850,Clothing,coats-and-jackets,hugo-chavez,http://im6.ybndc.com/upload/432698/ProductRear635228110970885216.jpg,2850,,Women,http://www.yebhi.com/432698/PD/hugo-chavez-pink-full-sleeves-women-coats.htm,yebhi.com,Hugo Chavez Pink Full Sleeves Women - Coats Buy Online,Hugo Chavez Pink Full Sleeves Women - Coats  Best Price Rs 2850.00  EMI Rs 475 for 6 months FREE Shipping In Stock - Delivery in 6-8 Days,SMXL,<div class="product_detail_columns tinyscrl" itemprop="description" style=""><div class="scrollbar" style="width:2px; height:250px; background:#9E9E9E;"><div class="track" style="width:2px;"><div class="thumb" style="width:6px;"><div class="end"> </div></div></div></div><div class="viewport" style=" height:250px; width:252px; font-family:Arial !important;"><div class="overview" style="text-align:justify; display:block;"><div>pleated neckline with front opening    pockets on princess line and long sleeves . </div></div></div> </div>,,16:04:2014,
432691,hugo chavez green full sleeves wool women jackets,http://www.yebhi.com/online-shopping/women/apparels.html?affint=women-topmenu,2950,Clothing,coats-and-jackets,hugo-chavez,http://im6.ybndc.com/upload/432691/ProductRear635228110948264781.jpg,2950,,Women,http://www.yebhi.com/432691/PD/hugo-chavez-green-full-sleeves-wool-women-jackets.htm,yebhi.com,Hugo Chavez Green Full Sleeves wool Women - Jackets Buy Online,Hugo Chavez Green Full Sleeves wool Women - Jackets  Best Price Rs 2950.00  EMI Rs 492 for 6 months FREE Shipping In Stock - Delivery in 6-8 Days,SMLXL,<div class="product_detail_columns tinyscrl" itemprop="description" style=""><div class="scrollbar" style="width:2px; height:250px; background:#9E9E9E;"><div class="track" style="width:2px;"><div class="thumb" style="width:6px;"><div class="end"> </div></div></div></div><div class="viewport" style=" height:250px; width:252px; font-family:Arial !important;"><div class="overview" style="text-align:justify; display:block;"><div>Short and smart colorful jacket with standing collar   long sleeves  front opening with exposed zipper and black suede patch at the back shoulder </div></div></div> </div>,,16:04:2014,
432695,hugo chavez red full sleeves women coats,http://www.yebhi.com/online-shopping/women/apparels.html?affint=women-topmenu,2850,Clothing,coats-and-jackets,hugo-chavez,http://im6.ybndc.com/upload/432695/ProductRear635228110961213030.jpg,2850,,Women,http://www.yebhi.com/432695/PD/hugo-chavez-red-full-sleeves-women-coats.htm,yebhi.com,Hugo Chavez Red Full Sleeves Women - Coats Buy Online,Hugo Chavez Red Full Sleeves Women - Coats  Best Price Rs 2850.00  EMI Rs 475 for 6 months FREE Shipping In Stock - Delivery in 6-8 Days,SMLXL,<div class="product_detail_columns tinyscrl" itemprop="description" style=""><div class="scrollbar" style="width:2px; height:250px; background:#9E9E9E;"><div class="track" style="width:2px;"><div class="thumb" style="width:6px;"><div class="end"> </div></div></div></div><div class="viewport" style=" height:250px; width:252px; font-family:Arial !important;"><div class="overview" style="text-align:justify; display:block;"><div>overlaped long jacket with front opening   belt on waist   pockets on princess line and inverted box pleat at the back  </div></div></div> </div>,,16:04:2014,
432697,hugo chavez green full sleeves women coats,http://www.yebhi.com/online-shopping/women/apparels.html?affint=women-topmenu,2850,Clothing,coats-and-jackets,hugo-chavez,http://im6.ybndc.com/upload/432697/ProductRear635228110967609153.jpg,2850,,Women,http://www.yebhi.com/432697/PD/hugo-chavez-green-full-sleeves-women-coats.htm,yebhi.com,Hugo Chavez Green Full Sleeves Women - Coats Buy Online,Hugo Chavez Green Full Sleeves Women - Coats  Best Price Rs 2850.00  EMI Rs 475 for 6 months FREE Shipping In Stock - Delivery in 6-8 Days,SMLXL,<div class="product_detail_columns tinyscrl" itemprop="description" style=""><div class="scrollbar" style="width:2px; height:250px; background:#9E9E9E;"><div class="track" style="width:2px;"><div class="thumb" style="width:6px;"><div class="end"> </div></div></div></div><div class="viewport" style=" height:250px; width:252px; font-family:Arial !important;"><div class="overview" style="text-align:justify; display:block;"><div>This <b> coat </b> in <b> green colour </b> features a collared neck with button closure and full sleeves. From the house of Hugo Chavez  it is crafted from <b> felt material.</b><b>Features</b><ul style="margin-left: 20px;"><li type="disc"> <b>Brand:</b> Hugo Chavez</li><li type="disc"> <b>Category:</b> Coats and Jackets</li><li type="disc"> <b>Type:</b> Coat</li><li type="disc"><b>Material:</b> Felt</li><li type="disc"><b>Colour:</b> Green</li><li type="disc"><b>Pattern:</b> Solid</li><li type="disc"><b>Neck:</b> Collared neck</li><li type="disc"><b>Sleeves:</b> Full sleeves </li><li type="disc"><b>Fit:</b> Regular</li></ul><b> Team it with </b> denim and wedges.<br/><b>Care Tips</b>  Dry Clean recommended. <b>Note:</b>  There may be a slight colour variation in the image from original product.   </div></div></div> </div>,,16:04:2014,
432692,hugo chavez green full sleeves women jackets,http://www.yebhi.com/online-shopping/women/apparels.html?affint=women-topmenu,2950,Clothing,coats-and-jackets,hugo-chavez,http://im6.ybndc.com/upload/432692/ProductRear635228110951384841.jpg,2950,,Women,http://www.yebhi.com/432692/PD/hugo-chavez-green-full-sleeves-women-jackets.htm,yebhi.com,Hugo Chavez Green Full Sleeves Women - Jackets Buy Online,Hugo Chavez Green Full Sleeves Women - Jackets  Best Price Rs 2950.00  EMI Rs 492 for 6 months FREE Shipping In Stock - Delivery in 6-8 Days,SMLXL,<div class="product_detail_columns tinyscrl" itemprop="description" style=""><div class="scrollbar" style="width:2px; height:250px; background:#9E9E9E;"><div class="track" style="width:2px;"><div class="thumb" style="width:6px;"><div class="end"> </div></div></div></div><div class="viewport" style=" height:250px; width:252px; font-family:Arial !important;"><div class="overview" style="text-align:justify; display:block;"><div>short jacket with front opening   flaps on the shoulders    stylized folded cuffs   patchd pockets and stylized yoke at the back . </div></div></div> </div>,,16:04:2014,
432686,hugo chavez red full sleeves wool women jackets,http://www.yebhi.com/online-shopping/women/apparels.html?affint=women-topmenu,2450,Clothing,coats-and-jackets,hugo-chavez,http://im6.ybndc.com/upload/432686/ProductRear635228110932196472.jpg,2450,,Women,http://www.yebhi.com/432686/PD/hugo-chavez-red-full-sleeves-wool-women-jackets.htm,yebhi.com,Hugo Chavez Red Full Sleeves wool Women - Jackets Buy Online,Hugo Chavez Red Full Sleeves wool Women - Jackets  Best Price Rs 2450.00  EMI Rs 408 for 6 months FREE Shipping In Stock - Delivery in 6-8 Days,SMLXL,<div class="product_detail_columns tinyscrl" itemprop="description" style=""><div class="scrollbar" style="width:2px; height:250px; background:#9E9E9E;"><div class="track" style="width:2px;"><div class="thumb" style="width:6px;"><div class="end"> </div></div></div></div><div class="viewport" style=" height:250px; width:252px; font-family:Arial !important;"><div class="overview" style="text-align:justify; display:block;"><div>short jacket with standing collars and asymmetric front opening . </div></div></div> </div>,,16:04:2014,
432689,hugo chavez green full sleeves women jackets,http://www.yebhi.com/online-shopping/women/apparels.html?affint=women-topmenu,1850,Clothing,coats-and-jackets,hugo-chavez,http://im6.ybndc.com/upload/432689/ProductRear635228110942024661.jpg,1850,,Women,http://www.yebhi.com/432689/PD/hugo-chavez-green-full-sleeves-women-jackets.htm,yebhi.com,Hugo Chavez Green Full Sleeves Women - Jackets Buy Online,Hugo Chavez Green Full Sleeves Women - Jackets  Best Price Rs 1850.00  EMI Rs 308 for 6 months FREE Shipping In Stock - Delivery in 6-8 Days,SM,<div class="product_detail_columns tinyscrl" itemprop="description" style=""><div class="scrollbar" style="width:2px; height:250px; background:#9E9E9E;"><div class="track" style="width:2px;"><div class="thumb" style="width:6px;"><div class="end"> </div></div></div></div><div class="viewport" style=" height:250px; width:252px; font-family:Arial !important;"><div class="overview" style="text-align:justify; display:block;"><div>short jacket with full sleeves    flap pocket at the front and single button opening at the front. </div></div></div> </div>,,16:04:2014,
432690,hugo chavez green full sleeves women jackets,http://www.yebhi.com/online-shopping/women/apparels.html?affint=women-topmenu,2780,Clothing,coats-and-jackets,hugo-chavez,http://im6.ybndc.com/upload/432690/ProductRear635228110945144721.jpg,2780,,Women,http://www.yebhi.com/432690/PD/hugo-chavez-green-full-sleeves-women-jackets.htm,yebhi.com,Hugo Chavez Green Full Sleeves Women - Jackets Buy Online,Hugo Chavez Green Full Sleeves Women - Jackets  Best Price Rs 2780.00  EMI Rs 463 for 6 months FREE Shipping In Stock - Delivery in 6-8 Days,SMLXL,<div class="product_detail_columns tinyscrl" itemprop="description" style=""><div class="scrollbar" style="width:2px; height:250px; background:#9E9E9E;"><div class="track" style="width:2px;"><div class="thumb" style="width:6px;"><div class="end"> </div></div></div></div><div class="viewport" style=" height:250px; width:252px; font-family:Arial !important;"><div class="overview" style="text-align:justify; display:block;"><div>Short jacket with standing collar   front opening with exposed zipper and long U yoke  at the front.    </div></div></div> </div>,,16:04:2014,
432667,hugo chavez white full sleeves viscose women coats,http://www.yebhi.com/online-shopping/women/apparels.html?affint=women-topmenu,2800,Clothing,coats-and-jackets,hugo-chavez,http://im6.ybndc.com/upload/432667/ProductRear635228029803800076.jpg,2800,,Women,http://www.yebhi.com/432667/PD/hugo-chavez-white-full-sleeves-viscose-women-coats.htm,yebhi.com,Hugo Chavez White Full Sleeves Viscose Women - Coats Buy Online,Hugo Chavez White Full Sleeves Viscose Women - Coats  Best Price Rs 2800.00  EMI Rs 467 for 6 months FREE Shipping In Stock - Delivery in 6-8 Days,SML,<div class="product_detail_columns tinyscrl" itemprop="description" style=""><div class="scrollbar" style="width:2px; height:250px; background:#9E9E9E;"><div class="track" style="width:2px;"><div class="thumb" style="width:6px;"><div class="end"> </div></div></div></div><div class="viewport" style=" height:250px; width:252px; font-family:Arial !important;"><div class="overview" style="text-align:justify; display:block;"><div>Short jacket with long sleeves and with upper side pocket. </div></div></div> </div>,,16:04:2014,
432685,hugo chavez white full sleeves women jackets,http://www.yebhi.com/online-shopping/women/apparels.html?affint=women-topmenu,2450,Clothing,coats-and-jackets,hugo-chavez,http://im6.ybndc.com/upload/432685/ProductRear635228110929232415.jpg,2450,,Women,http://www.yebhi.com/432685/PD/hugo-chavez-white-full-sleeves-women-jackets.htm,yebhi.com,Hugo Chavez White Full Sleeves Women - Jackets Buy Online,Hugo Chavez White Full Sleeves Women - Jackets  Best Price Rs 2450.00  EMI Rs 408 for 6 months FREE Shipping In Stock - Delivery in 6-8 Days,SMLXL,<div class="product_detail_columns tinyscrl" itemprop="description" style=""><div class="scrollbar" style="width:2px; height:250px; background:#9E9E9E;"><div class="track" style="width:2px;"><div class="thumb" style="width:6px;"><div class="end"> </div></div></div></div><div class="viewport" style=" height:250px; width:252px; font-family:Arial !important;"><div class="overview" style="text-align:justify; display:block;"><div>umbrella cut full sleeves jacket with pointed collars and front opening </div></div></div> </div>,,16:04:2014,
