385327,the design village pink women dresses,http://www.yebhi.com/online-shopping/women/apparels.html?affint=women-topmenu,1728,Clothing,dress,the-design-village,http://im6.ybndc.com/upload/385327/ProductRear635171786109459288.jpg,1819,,Women,http://www.yebhi.com/385327/PD/the-design-village-pink-women-dresses.htm,yebhi.com,The Design Village Pink Women - Dresses Buy Online,The Design Village Pink Women - Dresses  Best Price Rs 1728.00 Best Discount 5% Off EMI Rs 288 for 6 months FREE Shipping in 2 Days,Free Size,<div class="product_detail_columns tinyscrl" itemprop="description" style=""><div class="scrollbar" style="width:2px; height:250px; background:#9E9E9E;"><div class="track" style="width:2px;"><div class="thumb" style="width:6px;"><div class="end"> </div></div></div></div><div class="viewport" style=" height:250px; width:252px; font-family:Arial !important;"><div class="overview" style="text-align:justify; display:block;"><div>Double lapel maxi with elatic on the waist </div></div></div> </div>,,16:04:2014,
385369,the design village blue women dresses,http://www.yebhi.com/online-shopping/women/apparels.html?affint=women-topmenu,1728,Clothing,dress,the-design-village,http://im6.ybndc.com/upload/385369/ProductRear635171813900881437.jpg,1819,,Women,http://www.yebhi.com/385369/PD/the-design-village-blue-women-dresses.htm,yebhi.com,The Design Village Blue Women - Dresses Buy Online,The Design Village Blue Women - Dresses  Best Price Rs 1728.00 Best Discount 5% Off EMI Rs 288 for 6 months FREE Shipping in 2 Days,Free Size,<div class="product_detail_columns tinyscrl" itemprop="description" style=""><div class="scrollbar" style="width:2px; height:250px; background:#9E9E9E;"><div class="track" style="width:2px;"><div class="thumb" style="width:6px;"><div class="end"> </div></div></div></div><div class="viewport" style=" height:250px; width:252px; font-family:Arial !important;"><div class="overview" style="text-align:justify; display:block;"><div>Shirt dress with draw string on the waist<br/><br/>  Note: Accessories shown in the images are only for display and not a part of product.<br/> </div></div></div> </div>,,16:04:2014,
385355,the design village black women dresses,http://www.yebhi.com/online-shopping/women/apparels.html?affint=women-topmenu,1852,Clothing,dress,the-design-village,http://im6.ybndc.com/upload/385355/ProductRear635171809901951803.jpg,1949,,Women,http://www.yebhi.com/385355/PD/the-design-village-black-women-dresses.htm,yebhi.com,The Design Village Black Women - Dresses Buy Online,The Design Village Black Women - Dresses  Best Price Rs 1852.00 Best Discount 5% Off EMI Rs 309 for 6 months FREE Shipping in 2 Days,S,<div class="product_detail_columns tinyscrl" itemprop="description" style=""><div class="scrollbar" style="width:2px; height:250px; background:#9E9E9E;"><div class="track" style="width:2px;"><div class="thumb" style="width:6px;"><div class="end"> </div></div></div></div><div class="viewport" style=" height:250px; width:252px; font-family:Arial !important;"><div class="overview" style="text-align:justify; display:block;"><div>Sweet Dots Printed 3/4 Sleeve Dress with Button Detail Back For Women </div></div></div> </div>,,16:04:2014,
385340,the design village black women dresses,http://www.yebhi.com/online-shopping/women/apparels.html?affint=women-topmenu,1728,Clothing,dress,the-design-village,http://im6.ybndc.com/upload/385340/ProductRear635171789958783963.jpg,1819,,Women,http://www.yebhi.com/385340/PD/the-design-village-black-women-dresses.htm,yebhi.com,The Design Village Black Women - Dresses Buy Online,The Design Village Black Women - Dresses  Best Price Rs 1728.00 Best Discount 5% Off EMI Rs 288 for 6 months FREE Shipping in 2 Days,S,<div class="product_detail_columns tinyscrl" itemprop="description" style=""><div class="scrollbar" style="width:2px; height:250px; background:#9E9E9E;"><div class="track" style="width:2px;"><div class="thumb" style="width:6px;"><div class="end"> </div></div></div></div><div class="viewport" style=" height:250px; width:252px; font-family:Arial !important;"><div class="overview" style="text-align:justify; display:block;"><div>A-lign dress with contrast sleeves </div></div></div> </div>,,16:04:2014,
385386,the design village red women dresses,http://www.yebhi.com/online-shopping/women/apparels.html?affint=women-topmenu,1605,Clothing,dress,the-design-village,http://im6.ybndc.com/upload/385386/ProductRear635171817183142477.jpg,1689,,Women,http://www.yebhi.com/385386/PD/the-design-village-red-women-dresses.htm,yebhi.com,The Design Village Red Women - Dresses Buy Online,The Design Village Red Women - Dresses  Best Price Rs 1605.00 Best Discount 5% Off EMI Rs 268 for 6 months FREE Shipping in 2 Days,M,<div class="product_detail_columns tinyscrl" itemprop="description" style=""><div class="scrollbar" style="width:2px; height:250px; background:#9E9E9E;"><div class="track" style="width:2px;"><div class="thumb" style="width:6px;"><div class="end"> </div></div></div></div><div class="viewport" style=" height:250px; width:252px; font-family:Arial !important;"><div class="overview" style="text-align:justify; display:block;"><div>This <b> dress </b> in <b> red colour </b> features a V-neck with pleated detailing on the waist and cut sleeves. From the house of The Design Village  it is crafted from <b> crepe material.</b><b>Features</b><ul style="margin-left: 20px;"><li type="disc"> <b>Brand:</b> The Design Village</li><li type="disc"> <b>Category:</b> Dresses</li><li type="disc"><b>Material:</b> Crepe</li><li type="disc"><b>Colour:</b> Red</li><li type="disc"><b>Pattern:</b> Solid</li><li type="disc"><b>Neck:</b> V-neck</li><li type="disc"><b>Sleeves:</b> Cut sleeves </li><li type="disc"><b>Length:</b> Above Knee length </li><li type="disc"><b>Silhouette:</b> Pencil</li></ul><b> Team it with </b> wedges.<br/><b>Care Tips</b>  Wash it with a mild detergent. If washing in a machine  set it on a delicate mode and low temperature cycle. Wash dark colours separately and  use iron at low temperature. <b>Note:</b>  There may be a slight colour variation in the image from original product.   </div></div></div> </div>,,16:04:2014,
385391,the design village black women dresses,http://www.yebhi.com/online-shopping/women/apparels.html?affint=women-topmenu,1975,Clothing,dress,the-design-village,http://im6.ybndc.com/upload/385391/ProductRear635171818388718205.jpg,2079,,Women,http://www.yebhi.com/385391/PD/the-design-village-black-women-dresses.htm,yebhi.com,The Design Village Black Women - Dresses Buy Online,The Design Village Black Women - Dresses  Best Price Rs 1975.00 Best Discount 5% Off EMI Rs 329 for 6 months FREE Shipping in 2 Days,Free Size,<div class="product_detail_columns tinyscrl" itemprop="description" style=""><div class="scrollbar" style="width:2px; height:250px; background:#9E9E9E;"><div class="track" style="width:2px;"><div class="thumb" style="width:6px;"><div class="end"> </div></div></div></div><div class="viewport" style=" height:250px; width:252px; font-family:Arial !important;"><div class="overview" style="text-align:justify; display:block;"><div>High collar maxi with back tie on the collar and tie up belt on the waist<br/><br/><!--[if gte mso 9]&gt;&lt;xml&gt; &lt;o:OfficeDocumentSettings&gt;&lt;o:AllowPNG/&gt; &lt;/o:OfficeDocumentSettings&gt;&lt;/xml&gt;&lt;![endif]--><span style='font-size: 11pt; line-height: 115%; font-family: "calibri" "sans-serif";'>Disclaimer:<span id=":16w">Accessories shown in the images are only for display and arenot a part of the product.</span></span><!--[if gte mso 9]&gt;&lt;xml&gt; &lt;w:WordDocument&gt;&lt;w:View&gt;Normal&lt;/w:View&gt;&lt;w:Zoom&gt;0&lt;/w:Zoom&gt;&lt;w:TrackMoves/&gt;&lt;w:TrackFormatting/&gt;&lt;w:PunctuationKerning/&gt;&lt;w:ValidateAgainstSchemas/&gt;&lt;w:SaveIfXMLInvalid&gt;false&lt;/w:SaveIfXMLInvalid&gt;&lt;w:IgnoreMixedContent&gt;false&lt;/w:IgnoreMixedContent&gt;&lt;w:AlwaysShowPlaceholderText&gt;false&lt;/w:AlwaysShowPlaceholderText&gt;&lt;w:DoNotPromoteQF/&gt;&lt;w:LidThemeOther&gt;EN-IN&lt;/w:LidThemeOther&gt;&lt;w:LidThemeAsian&gt;X-NONE&lt;/w:LidThemeAsian&gt;&lt;w:LidThemeComplexScript&gt;X-NONE&lt;/w:LidThemeComplexScript&gt;&lt;w:Compatibility&gt;&lt;w:BreakWrappedTables/&gt;&lt;w:SnapToGridInCell/&gt;&lt;w:WrapTextWithPunct/&gt;&lt;w:UseAsianBreakRules/&gt;&lt;w:DontGrowAutofit/&gt;&lt;w:SplitPgBreakAndParaMark/&gt;&lt;w:EnableOpenTypeKerning/&gt;&lt;w:DontFlipMirrorIndents/&gt;&lt;w:OverrideTableStyleHps/&gt;&lt;/w:Compatibility&gt;&lt;m:mathPr&gt;&lt;m:mathFont m:val="Cambria Math"/&gt;&lt;m:brkBin m:val="before"/&gt;&lt;m:brkBinSub m:val="&#45;-"/&gt;&lt;m:smallFrac m:val="off"/&gt;&lt;m:dispDef/&gt;&lt;m:lMargin m:val="0"/&gt;&lt;m:rMargin m:val="0"/&gt;&lt;m:defJc m:val="centerGroup"/&gt;&lt;m:wrapIndent m:val="1440"/&gt;&lt;m:intLim m:val="subSup"/&gt;&lt;m:naryLim m:val="undOvr"/&gt;&lt;/m:mathPr&gt;&lt;/w:WordDocument&gt;&lt;/xml&gt;&lt;![endif]--><!--[if gte mso 9]&gt;&lt;xml&gt; &lt;w:LatentStyles DefLockedState="false" DefUnhideWhenUsed="true"  DefSemiHidden="true" DefQFormat="false" DefPriority="99"  LatentStyleCount="267"&gt;&lt;w:LsdException Locked="false" Priority="0" SemiHidden="false"   UnhideWhenUsed="false" QFormat="true" Name="Normal"/&gt;&lt;w:LsdException Locked="false" Priority="9" SemiHidden="false"   UnhideWhenUsed="false" QFormat="true" Name="heading 1"/&gt;&lt;w:LsdException Locked="false" Priority="9" QFormat="true" Name="heading 2"/&gt;&lt;w:LsdException Locked="false" Priority="9" QFormat="true" Name="heading 3"/&gt;&lt;w:LsdException Locked="false" Priority="9" QFormat="true" Name="heading 4"/&gt;&lt;w:LsdException Locked="false" Priority="9" QFormat="true" Name="heading 5"/&gt;&lt;w:LsdException Locked="false" Priority="9" QFormat="true" Name="heading 6"/&gt;&lt;w:LsdException Locked="false" Priority="9" QFormat="true" Name="heading 7"/&gt;&lt;w:LsdException Locked="false" Priority="9" QFormat="true" Name="heading 8"/&gt;&lt;w:LsdException Locked="false" Priority="9" QFormat="true" Name="heading 9"/&gt;&lt;w:LsdException Locked="false" Priority="39" Name="toc 1"/&gt;&lt;w:LsdException Locked="false" Priority="39" Name="toc 2"/&gt;&lt;w:LsdException Locked="false" Priority="39" Name="toc 3"/&gt;&lt;w:LsdException Locked="false" Priority="39" Name="toc 4"/&gt;&lt;w:LsdException Locked="false" Priority="39" Name="toc 5"/&gt;&lt;w:LsdException Locked="false" Priority="39" Name="toc 6"/&gt;&lt;w:LsdException Locked="false" Priority="39" Name="toc 7"/&gt;&lt;w:LsdException Locked="false" Priority="39" Name="toc 8"/&gt;&lt;w:LsdException Locked="false" Priority="39" Name="toc 9"/&gt;&lt;w:LsdException Locked="false" Priority="35" QFormat="true" Name="caption"/&gt;&lt;w:LsdException Locked="false" Priority="10" SemiHidden="false"   UnhideWhenUsed="false" QFormat="true" Name="Title"/&gt;&lt;w:LsdException Locked="false" Priority="1" Name="Default Paragraph Font"/&gt;&lt;w:LsdException Locked="false" Priority="11" SemiHidden="false"   UnhideWhenUsed="false" QFormat="true" Name="Subtitle"/&gt;&lt;w:LsdException Locked="false" Priority="22" SemiHidden="false"   UnhideWhenUsed="false" QFormat="true" Name="Strong"/&gt;&lt;w:LsdException Locked="false" Priority="20" SemiHidden="false"   UnhideWhenUsed="false" QFormat="true" Name="Emphasis"/&gt;&lt;w:LsdException Locked="false" Priority="59" SemiHidden="false"   UnhideWhenUsed="false" Name="Table Grid"/&gt;&lt;w:LsdException Locked="false" UnhideWhenUsed="false" Name="Placeholder Text"/&gt;&lt;w:LsdException Locked="false" Priority="1" SemiHidden="false"   UnhideWhenUsed="false" QFormat="true" Name="No Spacing"/&gt;&lt;w:LsdException Locked="false" Priority="60" SemiHidden="false"   UnhideWhenUsed="false" Name="Light Shading"/&gt;&lt;w:LsdException Locked="false" Priority="61" SemiHidden="false"   UnhideWhenUsed="false" Name="Light List"/&gt;&lt;w:LsdException Locked="false" Priority="62" SemiHidden="false"   UnhideWhenUsed="false" Name="Light Grid"/&gt;&lt;w:LsdException Locked="false" Priority="63" SemiHidden="false"   UnhideWhenUsed="false" Name="Medium Shading 1"/&gt;&lt;w:LsdException Locked="false" Priority="64" SemiHidden="false"   UnhideWhenUsed="false" Name="Medium Shading 2"/&gt;&lt;w:LsdException Locked="false" Priority="65" SemiHidden="false"   UnhideWhenUsed="false" Name="Medium List 1"/&gt;&lt;w:LsdException Locked="false" Priority="66" SemiHidden="false"   UnhideWhenUsed="false" Name="Medium List 2"/&gt;&lt;w:LsdException Locked="false" Priority="67" SemiHidden="false"   UnhideWhenUsed="false" Name="Medium Grid 1"/&gt;&lt;w:LsdException Locked="false" Priority="68" SemiHidden="false"   UnhideWhenUsed="false" Name="Medium Grid 2"/&gt;&lt;w:LsdException Locked="false" Priority="69" SemiHidden="false"   UnhideWhenUsed="false" Name="Medium Grid 3"/&gt;&lt;w:LsdException Locked="false" Priority="70" SemiHidden="false"   UnhideWhenUsed="false" Name="Dark List"/&gt;&lt;w:LsdException Locked="false" Priority="71" SemiHidden="false"   UnhideWhenUsed="false" Name="Colorful Shading"/&gt;&lt;w:LsdException Locked="false" Priority="72" SemiHidden="false"   UnhideWhenUsed="false" Name="Colorful List"/&gt;&lt;w:LsdException Locked="false" Priority="73" SemiHidden="false"   UnhideWhenUsed="false" Name="Colorful Grid"/&gt;&lt;w:LsdException Locked="false" Priority="60" SemiHidden="false"   UnhideWhenUsed="false" Name="Light Shading Accent 1"/&gt;&lt;w:LsdException Locked="false" Priority="61" SemiHidden="false"   UnhideWhenUsed="false" Name="Light List Accent 1"/&gt;&lt;w:LsdException Locked="false" Priority="62" SemiHidden="false"   UnhideWhenUsed="false" Name="Light Grid Accent 1"/&gt;&lt;w:LsdException Locked="false" Priority="63" SemiHidden="false"   UnhideWhenUsed="false" Name="Medium Shading 1 Accent 1"/&gt;&lt;w:LsdException Locked="false" Priority="64" SemiHidden="false"   UnhideWhenUsed="false" Name="Medium Shading 2 Accent 1"/&gt;&lt;w:LsdException Locked="false" Priority="65" SemiHidden="false"   UnhideWhenUsed="false" Name="Medium List 1 Accent 1"/&gt;&lt;w:LsdException Locked="false" UnhideWhenUsed="false" Name="Revision"/&gt;&lt;w:LsdException Locked="false" Priority="34" SemiHidden="false"   UnhideWhenUsed="false" QFormat="true" Name="List Paragraph"/&gt;&lt;w:LsdException Locked="false" Priority="29" SemiHidden="false"   UnhideWhenUsed="false" QFormat="true" Name="Quote"/&gt;&lt;w:LsdException Locked="false" Priority="30" SemiHidden="false"   UnhideWhenUsed="false" QFormat="true" Name="Intense Quote"/&gt;&lt;w:LsdException Locked="false" Priority="66" SemiHidden="false"   UnhideWhenUsed="false" Name="Medium List 2 Accent 1"/&gt;&lt;w:LsdException Locked="false" Priority="67" SemiHidden="false"   UnhideWhenUsed="false" Name="Medium Grid 1 Accent 1"/&gt;&lt;w:LsdException Locked="false" Priority="68" SemiHidden="false"   UnhideWhenUsed="false" Name="Medium Grid 2 Accent 1"/&gt;&lt;w:LsdException Locked="false" Priority="69" SemiHidden="false"   UnhideWhenUsed="false" Name="Medium Grid 3 Accent 1"/&gt;&lt;w:LsdException Locked="false" Priority="70" SemiHidden="false"   UnhideWhenUsed="false" Name="Dark List Accent 1"/&gt;&lt;w:LsdException Locked="false" Priority="71" SemiHidden="false"   UnhideWhenUsed="false" Name="Colorful Shading Accent 1"/&gt;&lt;w:LsdException Locked="false" Priority="72" SemiHidden="false"   UnhideWhenUsed="false" Name="Colorful List Accent 1"/&gt;&lt;w:LsdException Locked="false" Priority="73" SemiHidden="false"   UnhideWhenUsed="false" Name="Colorful Grid Accent 1"/&gt;&lt;w:LsdException Locked="false" Priority="60" SemiHidden="false"   UnhideWhenUsed="false" Name="Light Shading Accent 2"/&gt;&lt;w:LsdException Locked="false" Priority="61" SemiHidden="false"   UnhideWhenUsed="false" Name="Light List Accent 2"/&gt;&lt;w:LsdException Locked="false" Priority="62" SemiHidden="false"   UnhideWhenUsed="false" Name="Light Grid Accent 2"/&gt;&lt;w:LsdException Locked="false" Priority="63" SemiHidden="false"   UnhideWhenUsed="false" Name="Medium Shading 1 Accent 2"/&gt;&lt;w:LsdException Locked="false" Priority="64" SemiHidden="false"   UnhideWhenUsed="false" Name="Medium Shading 2 Accent 2"/&gt;&lt;w:LsdException Locked="false" Priority="65" SemiHidden="false"   UnhideWhenUsed="false" Name="Medium List 1 Accent 2"/&gt;&lt;w:LsdException Locked="false" Priority="66" SemiHidden="false"   UnhideWhenUsed="false" Name="Medium List 2 Accent 2"/&gt;&lt;w:LsdException Locked="false" Priority="67" SemiHidden="false"   UnhideWhenUsed="false" Name="Medium Grid 1 Accent 2"/&gt;&lt;w:LsdException Locked="false" Priority="68" SemiHidden="false"   UnhideWhenUsed="false" Name="Medium Grid 2 Accent 2"/&gt;&lt;w:LsdException Locked="false" Priority="69" SemiHidden="false"   UnhideWhenUsed="false" Name="Medium Grid 3 Accent 2"/&gt;&lt;w:LsdException Locked="false" Priority="70" SemiHidden="false"   UnhideWhenUsed="false" Name="Dark List Accent 2"/&gt;&lt;w:LsdException Locked="false" Priority="71" SemiHidden="false"   UnhideWhenUsed="false" Name="Colorful Shading Accent 2"/&gt;&lt;w:LsdException Locked="false" Priority="72" SemiHidden="false"   UnhideWhenUsed="false" Name="Colorful List Accent 2"/&gt;&lt;w:LsdException Locked="false" Priority="73" SemiHidden="false"   UnhideWhenUsed="false" Name="Colorful Grid Accent 2"/&gt;&lt;w:LsdException Locked="false" Priority="60" SemiHidden="false"   UnhideWhenUsed="false" Name="Light Shading Accent 3"/&gt;&lt;w:LsdException Locked="false" Priority="61" SemiHidden="false"   UnhideWhenUsed="false" Name="Light List Accent 3"/&gt;&lt;w:LsdException Locked="false" Priority="62" SemiHidden="false"   UnhideWhenUsed="false" Name="Light Grid Accent 3"/&gt;&lt;w:LsdException Locked="false" Priority="63" SemiHidden="false"   UnhideWhenUsed="false" Name="Medium Shading 1 Accent 3"/&gt;&lt;w:LsdException Locked="false" Priority="64" SemiHidden="false"   UnhideWhenUsed="false" Name="Medium Shading 2 Accent 3"/&gt;&lt;w:LsdException Locked="false" Priority="65" SemiHidden="false"   UnhideWhenUsed="false" Name="Medium List 1 Accent 3"/&gt;&lt;w:LsdException Locked="false" Priority="66" SemiHidden="false"   UnhideWhenUsed="false" Name="Medium List 2 Accent 3"/&gt;&lt;w:LsdException Locked="false" Priority="67" SemiHidden="false"   UnhideWhenUsed="false" Name="Medium Grid 1 Accent 3"/&gt;&lt;w:LsdException Locked="false" Priority="68" SemiHidden="false"   UnhideWhenUsed="false" Name="Medium Grid 2 Accent 3"/&gt;&lt;w:LsdException Locked="false" Priority="69" SemiHidden="false"   UnhideWhenUsed="false" Name="Medium Grid 3 Accent 3"/&gt;&lt;w:LsdException Locked="false" Priority="70" SemiHidden="false"   UnhideWhenUsed="false" Name="Dark List Accent 3"/&gt;&lt;w:LsdException Locked="false" Priority="71" SemiHidden="false"   UnhideWhenUsed="false" Name="Colorful Shading Accent 3"/&gt;&lt;w:LsdException Locked="false" Priority="72" SemiHidden="false"   UnhideWhenUsed="false" Name="Colorful List Accent 3"/&gt;&lt;w:LsdException Locked="false" Priority="73" SemiHidden="false"   UnhideWhenUsed="false" Name="Colorful Grid Accent 3"/&gt;&lt;w:LsdException Locked="false" Priority="60" SemiHidden="false"   UnhideWhenUsed="false" Name="Light Shading Accent 4"/&gt;&lt;w:LsdException Locked="false" Priority="61" SemiHidden="false"   UnhideWhenUsed="false" Name="Light List Accent 4"/&gt;&lt;w:LsdException Locked="false" Priority="62" SemiHidden="false"   UnhideWhenUsed="false" Name="Light Grid Accent 4"/&gt;&lt;w:LsdException Locked="false" Priority="63" SemiHidden="false"   UnhideWhenUsed="false" Name="Medium Shading 1 Accent 4"/&gt;&lt;w:LsdException Locked="false" Priority="64" SemiHidden="false"   UnhideWhenUsed="false" Name="Medium Shading 2 Accent 4"/&gt;&lt;w:LsdException Locked="false" Priority="65" SemiHidden="false"   UnhideWhenUsed="false" Name="Medium List 1 Accent 4"/&gt;&lt;w:LsdException Locked="false" Priority="66" SemiHidden="false"   UnhideWhenUsed="false" Name="Medium List 2 Accent 4"/&gt;&lt;w:LsdException Locked="false" Priority="67" SemiHidden="false"   UnhideWhenUsed="false" Name="Medium Grid 1 Accent 4"/&gt;&lt;w:LsdException Locked="false" Priority="68" SemiHidden="false"   UnhideWhenUsed="false" Name="Medium Grid 2 Accent 4"/&gt;&lt;w:LsdException Locked="false" Priority="69" SemiHidden="false"   UnhideWhenUsed="false" Name="Medium Grid 3 Accent 4"/&gt;&lt;w:LsdException Locked="false" Priority="70" SemiHidden="false"   UnhideWhenUsed="false" Name="Dark List Accent 4"/&gt;&lt;w:LsdException Locked="false" Priority="71" SemiHidden="false"   UnhideWhenUsed="false" Name="Colorful Shading Accent 4"/&gt;&lt;w:LsdException Locked="false" Priority="72" SemiHidden="false"   UnhideWhenUsed="false" Name="Colorful List Accent 4"/&gt;&lt;w:LsdException Locked="false" Priority="73" SemiHidden="false"   UnhideWhenUsed="false" Name="Colorful Grid Accent 4"/&gt;&lt;w:LsdException Locked="false" Priority="60" SemiHidden="false"   UnhideWhenUsed="false" Name="Light Shading Accent 5"/&gt;&lt;w:LsdException Locked="false" Priority="61" SemiHidden="false"   UnhideWhenUsed="false" Name="Light List Accent 5"/&gt;&lt;w:LsdException Locked="false" Priority="62" SemiHidden="false"   UnhideWhenUsed="false" Name="Light Grid Accent 5"/&gt;&lt;w:LsdException Locked="false" Priority="63" SemiHidden="false"   UnhideWhenUsed="false" Name="Medium Shading 1 Accent 5"/&gt;&lt;w:LsdException Locked="false" Priority="64" SemiHidden="false"   UnhideWhenUsed="false" Name="Medium Shading 2 Accent 5"/&gt;&lt;w:LsdException Locked="false" Priority="65" SemiHidden="false"   UnhideWhenUsed="false" Name="Medium List 1 Accent 5"/&gt;&lt;w:LsdException Locked="false" Priority="66" SemiHidden="false"   UnhideWhenUsed="false" Name="Medium List 2 Accent 5"/&gt;&lt;w:LsdException Locked="false" Priority="67" SemiHidden="false"   UnhideWhenUsed="false" Name="Medium Grid 1 Accent 5"/&gt;&lt;w:LsdException Locked="false" Priority="68" SemiHidden="false"   UnhideWhenUsed="false" Name="Medium Grid 2 Accent 5"/&gt;&lt;w:LsdException Locked="false" Priority="69" SemiHidden="false"   UnhideWhenUsed="false" Name="Medium Grid 3 Accent 5"/&gt;&lt;w:LsdException Locked="false" Priority="70" SemiHidden="false"   UnhideWhenUsed="false" Name="Dark List Accent 5"/&gt;&lt;w:LsdException Locked="false" Priority="71" SemiHidden="false"   UnhideWhenUsed="false" Name="Colorful Shading Accent 5"/&gt;&lt;w:LsdException Locked="false" Priority="72" SemiHidden="false"   UnhideWhenUsed="false" Name="Colorful List Accent 5"/&gt;&lt;w:LsdException Locked="false" Priority="73" SemiHidden="false"   UnhideWhenUsed="false" Name="Colorful Grid Accent 5"/&gt;&lt;w:LsdException Locked="false" Priority="60" SemiHidden="false"   UnhideWhenUsed="false" Name="Light Shading Accent 6"/&gt;&lt;w:LsdException Locked="false" Priority="61" SemiHidden="false"   UnhideWhenUsed="false" Name="Light List Accent 6"/&gt;&lt;w:LsdException Locked="false" Priority="62" SemiHidden="false"   UnhideWhenUsed="false" Name="Light Grid Accent 6"/&gt;&lt;w:LsdException Locked="false" Priority="63" SemiHidden="false"   UnhideWhenUsed="false" Name="Medium Shading 1 Accent 6"/&gt;&lt;w:LsdException Locked="false" Priority="64" SemiHidden="false"   UnhideWhenUsed="false" Name="Medium Shading 2 Accent 6"/&gt;&lt;w:LsdException Locked="false" Priority="65" SemiHidden="false"   UnhideWhenUsed="false" Name="Medium List 1 Accent 6"/&gt;&lt;w:LsdException Locked="false" Priority="66" SemiHidden="false"   UnhideWhenUsed="false" Name="Medium List 2 Accent 6"/&gt;&lt;w:LsdException Locked="false" Priority="67" SemiHidden="false"   UnhideWhenUsed="false" Name="Medium Grid 1 Accent 6"/&gt;&lt;w:LsdException Locked="false" Priority="68" SemiHidden="false"   UnhideWhenUsed="false" Name="Medium Grid 2 Accent 6"/&gt;&lt;w:LsdException Locked="false" Priority="69" SemiHidden="false"   UnhideWhenUsed="false" Name="Medium Grid 3 Accent 6"/&gt;&lt;w:LsdException Locked="false" Priority="70" SemiHidden="false"   UnhideWhenUsed="false" Name="Dark List Accent 6"/&gt;&lt;w:LsdException Locked="false" Priority="71" SemiHidden="false"   UnhideWhenUsed="false" Name="Colorful Shading Accent 6"/&gt;&lt;w:LsdException Locked="false" Priority="72" SemiHidden="false"   UnhideWhenUsed="false" Name="Colorful List Accent 6"/&gt;&lt;w:LsdException Locked="false" Priority="73" SemiHidden="false"   UnhideWhenUsed="false" Name="Colorful Grid Accent 6"/&gt;&lt;w:LsdException Locked="false" Priority="19" SemiHidden="false"   UnhideWhenUsed="false" QFormat="true" Name="Subtle Emphasis"/&gt;&lt;w:LsdException Locked="false" Priority="21" SemiHidden="false"   UnhideWhenUsed="false" QFormat="true" Name="Intense Emphasis"/&gt;&lt;w:LsdException Locked="false" Priority="31" SemiHidden="false"   UnhideWhenUsed="false" QFormat="true" Name="Subtle Reference"/&gt;&lt;w:LsdException Locked="false" Priority="32" SemiHidden="false"   UnhideWhenUsed="false" QFormat="true" Name="Intense Reference"/&gt;&lt;w:LsdException Locked="false" Priority="33" SemiHidden="false"   UnhideWhenUsed="false" QFormat="true" Name="Book Title"/&gt;&lt;w:LsdException Locked="false" Priority="37" Name="Bibliography"/&gt;&lt;w:LsdException Locked="false" Priority="39" QFormat="true" Name="TOC Heading"/&gt; &lt;/w:LatentStyles&gt;&lt;/xml&gt;&lt;![endif]--><!--[if gte mso 10]&gt;&lt;style&gt; /* Style Definitions */ table.MsoNormalTable{mso-style-name:"Table Normal";mso-tstyle-rowband-size:0;mso-tstyle-colband-size:0;mso-style-noshow:yes;mso-style-priority:99;mso-style-parent:"";mso-padding-alt:0cm 5.4pt 0cm 5.4pt;mso-para-margin-top:0cm;mso-para-margin-right:0cm;mso-para-margin-bottom:10.0pt;mso-para-margin-left:0cm;line-height:115%;mso-pagination:widow-orphan;font-size:11.0pt;font-family:"Calibri" "sans-serif";mso-ascii-font-family:Calibri;mso-ascii-theme-font:minor-latin;mso-hansi-font-family:Calibri;mso-hansi-theme-font:minor-latin;mso-bidi-font-family:"Times New Roman";mso-bidi-theme-font:minor-bidi;mso-fareast-language:EN-US;}&lt;/style&gt;&lt;![endif]--><br/> </div></div></div> </div>,,16:04:2014,
