492816,paper dolls beige dress,http://www.yebhi.com/online-shopping/women/apparels.html?affint=women-topmenu,2800,Clothing,dress,paper-dolls,http://im6.ybndc.com/upload/492816/ProductRear635314622333710000.jpg,2800,,Women,http://www.yebhi.com/492816/PD/paper-dolls-beige-dress.htm,yebhi.com,Paper Dolls Beige - Dress Buy Online,Paper Dolls Beige - Dress  Best Price Rs 2800.00  EMI Rs 467 for 6 months FREE Shipping In Stock - Delivery in 3-5 Days,101214,<div class="product_detail_columns tinyscrl" itemprop="description" style=""><div class="scrollbar" style="width:2px; height:250px; background:#9E9E9E;"><div class="track" style="width:2px;"><div class="thumb" style="width:6px;"><div class="end"> </div></div></div></div><div class="viewport" style=" height:250px; width:252px; font-family:Arial !important;"><div class="overview" style="text-align:justify; display:block;"><div>This peplum dress from Paper Dolls is made from a blend of viscose  nylon and elastane. The details include: V neckline  short puffed sleeves  monochrome style  contrast panelling on sides and waist  peplum waist  concealed zip fastening at the back  and back slit on the skirt. The peplum dress has a slim fit. </div></div></div> </div>,,16:04:2014,
492775,paper dolls black dress,http://www.yebhi.com/online-shopping/women/apparels.html?affint=women-topmenu,2445,Clothing,dress,paper-dolls,http://im6.ybndc.com/upload/492775/ProductRear635314622207662000.jpg,2445,,Women,http://www.yebhi.com/492775/PD/paper-dolls-black-dress.htm,yebhi.com,Paper Dolls Black - Dress Buy Online,Paper Dolls Black - Dress  Best Price Rs 2445.00  EMI Rs 408 for 6 months FREE Shipping In Stock - Delivery in 3-5 Days,101612,<div class="product_detail_columns tinyscrl" itemprop="description" style=""><div class="scrollbar" style="width:2px; height:250px; background:#9E9E9E;"><div class="track" style="width:2px;"><div class="thumb" style="width:6px;"><div class="end"> </div></div></div></div><div class="viewport" style=" height:250px; width:252px; font-family:Arial !important;"><div class="overview" style="text-align:justify; display:block;"><div>Pencil Dress?by?Paper Dolls Made from viscose  nylon and elastane  Low origami neckline  Sleeveless style  Monochrome panelling?  Belted waist  Concealed zip fastening at the back  Slit at the back hem  Bodycon fit </div></div></div> </div>,,16:04:2014,
492778,paper dolls purple dress,http://www.yebhi.com/online-shopping/women/apparels.html?affint=women-topmenu,2235,Clothing,dress,paper-dolls,http://im6.ybndc.com/upload/492778/ProductRear635314622211874000.jpg,2235,,Women,http://www.yebhi.com/492778/PD/paper-dolls-purple-dress.htm,yebhi.com,Paper Dolls Purple - Dress Buy Online,Paper Dolls Purple - Dress  Best Price Rs 2235.00  EMI Rs 373 for 6 months FREE Shipping In Stock - Delivery in 3-5 Days,81012,<div class="product_detail_columns tinyscrl" itemprop="description" style=""><div class="scrollbar" style="width:2px; height:250px; background:#9E9E9E;"><div class="track" style="width:2px;"><div class="thumb" style="width:6px;"><div class="end"> </div></div></div></div><div class="viewport" style=" height:250px; width:252px; font-family:Arial !important;"><div class="overview" style="text-align:justify; display:block;"><div>Pencil Dress?by?Paper Dolls Made from viscose  nylon and elastane  Round neckline  Keyhole detailing at the front  Short sleeves  Contrast PU panelling  Concealed zip fastening at the back  Slit at the back hem  Bodycon fit </div></div></div> </div>,,16:04:2014,
492764,paper dolls white dress,http://www.yebhi.com/online-shopping/women/apparels.html?affint=women-topmenu,3500,Clothing,dress,paper-dolls,http://im6.ybndc.com/upload/492764/ProductRear635314622168818000.jpg,3500,,Women,http://www.yebhi.com/492764/PD/paper-dolls-white-dress.htm,yebhi.com,Paper Dolls White - Dress Buy Online,Paper Dolls White - Dress  Best Price Rs 3500.00  EMI Rs 583 for 6 months FREE Shipping In Stock - Delivery in 3-5 Days,1012,<div class="product_detail_columns tinyscrl" itemprop="description" style=""><div class="scrollbar" style="width:2px; height:250px; background:#9E9E9E;"><div class="track" style="width:2px;"><div class="thumb" style="width:6px;"><div class="end"> </div></div></div></div><div class="viewport" style=" height:250px; width:252px; font-family:Arial !important;"><div class="overview" style="text-align:justify; display:block;"><div>This?pencil dress?from Paper Dolls is made from a blend of viscose  nylon and elastane. The details include: geometric neckline  short puffed sleeves  monochrome style  paisley overlay lace panelling at the frontal  concealed zip fastening at the back  and back slit on the skirt. The?pencil dress?has a slim fit. </div></div></div> </div>,,16:04:2014,
492820,paper dolls black dress,http://www.yebhi.com/online-shopping/women/apparels.html?affint=women-topmenu,4500,Clothing,dress,paper-dolls,http://im6.ybndc.com/upload/492820/ProductRear635314622351026000.jpg,4500,,Women,http://www.yebhi.com/492820/PD/paper-dolls-black-dress.htm,yebhi.com,Paper Dolls Black - Dress Buy Online,Paper Dolls Black - Dress  Best Price Rs 4500.00  EMI Rs 750 for 6 months FREE Shipping In Stock - Delivery in 3-5 Days,810161214,<div class="product_detail_columns tinyscrl" itemprop="description" style=""><div class="scrollbar" style="width:2px; height:250px; background:#9E9E9E;"><div class="track" style="width:2px;"><div class="thumb" style="width:6px;"><div class="end"> </div></div></div></div><div class="viewport" style=" height:250px; width:252px; font-family:Arial !important;"><div class="overview" style="text-align:justify; display:block;"><div>Peplum Dress by Paper Dolls Made from polyester  V-neckline  Sleeveless styling  Lace panelling  Peplum waist  Golden clasp sleek belt  Back zipper fastening  Slim fit </div></div></div> </div>,,16:04:2014,
492736,paper dolls blue dress,http://www.yebhi.com/online-shopping/women/apparels.html?affint=women-topmenu,3800,Clothing,dress,paper-dolls,http://im6.ybndc.com/upload/492736/ProductRear635314622081614000.jpg,3800,,Women,http://www.yebhi.com/492736/PD/paper-dolls-blue-dress.htm,yebhi.com,Paper Dolls Blue - Dress Buy Online,Paper Dolls Blue - Dress  Best Price Rs 3800.00  EMI Rs 633 for 6 months FREE Shipping In Stock - Delivery in 3-5 Days,810161412,<div class="product_detail_columns tinyscrl" itemprop="description" style=""><div class="scrollbar" style="width:2px; height:250px; background:#9E9E9E;"><div class="track" style="width:2px;"><div class="thumb" style="width:6px;"><div class="end"> </div></div></div></div><div class="viewport" style=" height:250px; width:252px; font-family:Arial !important;"><div class="overview" style="text-align:justify; display:block;"><div>Body Con Dress by Paper Dolls Made from polyester and elastane  Round collar neck  Short sleeves  Textured finish  Slender belt with bow detail  Slit at the back  Back zipper fastening  Body con fit </div></div></div> </div>,,16:04:2014,
492763,paper dolls white dress,http://www.yebhi.com/online-shopping/women/apparels.html?affint=women-topmenu,2800,Clothing,dress,paper-dolls,http://im6.ybndc.com/upload/492763/ProductRear635314622164606000.jpg,2800,,Women,http://www.yebhi.com/492763/PD/paper-dolls-white-dress.htm,yebhi.com,Paper Dolls White - Dress Buy Online,Paper Dolls White - Dress  Best Price Rs 2800.00  EMI Rs 467 for 6 months FREE Shipping In Stock - Delivery in 3-5 Days,10,<div class="product_detail_columns tinyscrl" itemprop="description" style=""><div class="scrollbar" style="width:2px; height:250px; background:#9E9E9E;"><div class="track" style="width:2px;"><div class="thumb" style="width:6px;"><div class="end"> </div></div></div></div><div class="viewport" style=" height:250px; width:252px; font-family:Arial !important;"><div class="overview" style="text-align:justify; display:block;"><div>This pencil dress from Paper Dolls is made from a blend of viscose  nylon and elastane. The details include: sweetheart neckline  half sleeves  monochrome style  contrast panelling on sleeves  neckline  waist and sides  concealed zip fastening at the back  and back slit on the skirt. The pencil dress has a slim fit. </div></div></div> </div>,,16:04:2014,
494361,paper dolls women dresses,http://www.yebhi.com/online-shopping/women/apparels.html?affint=women-topmenu,3800,Clothing,dress,paper-dolls,http://im6.ybndc.com/upload/494361/ProductRear635315458005766000.jpg,3800,,Women,http://www.yebhi.com/494361/PD/paper-dolls-women-dresses.htm,yebhi.com,Paper Dolls Women - Dresses Buy Online,Paper Dolls Women - Dresses  Best Price Rs 3800.00  EMI Rs 633 for 6 months FREE Shipping In Stock - Delivery in 3-5 Days,8,<div class="product_detail_columns tinyscrl" itemprop="description" style=""><div class="scrollbar" style="width:2px; height:250px; background:#9E9E9E;"><div class="track" style="width:2px;"><div class="thumb" style="width:6px;"><div class="end"> </div></div></div></div><div class="viewport" style=" height:250px; width:252px; font-family:Arial !important;"><div class="overview" style="text-align:justify; display:block;"><div>Body Con Dress?by Paper Dolls Made from polyester Bateau neckline Short sleeves Floral print Concealed zipper fastening at the back Body con fit100% Polyester </div></div></div> </div>,,16:04:2014,
