93933,quiksilver grey half sleeves men non collared t shirt,http://www.yebhi.com/online-shopping/men/apparels.html?affint=men-topmenu,2065,Clothing,t-shirts,quiksilver,http://im6.ybndc.com/upload/93933/ProductRear634983711438711881.jpg,2295,,Men,http://www.yebhi.com/93933/PD/quiksilver-grey-half-sleeves-men-non-collared-t-shirt.htm,yebhi.com,Quiksilver Grey Half Sleeves Men - Non-collared T-shirt Buy Online,Quiksilver Grey Half Sleeves Men - Non-collared T-shirt  Best Price Rs 2065.00 Best Discount 10% Off EMI Rs 344 for 6 months FREE Shipping in 2 Days,S,<div class="product_detail_columns tinyscrl" itemprop="description" style=""><div class="scrollbar" style="width:2px; height:250px; background:#9E9E9E;"><div class="track" style="width:2px;"><div class="thumb" style="width:6px;"><div class="end"> </div></div></div></div><div class="viewport" style=" height:250px; width:252px; font-family:Arial !important;"><div class="overview" style="text-align:justify; display:block;"><div>Add this cool Quiksilver T-shirt to your wardrobe for effortless  relaxed dressing. Made from finest quality <b>cotton and polyster blend</b>  this <b>grey coloured half sleeved  round neck</b> T-shirt is sure to give you comfort throughout the day. Get in vogue and wear it with a pair of your favourite jeans and shoes.<b>Style Tip</b>For a cool look  wear the black T-shirt along with a pair of jeans and smart shoes.<br/><b>Material &amp; Care</b> Made of polyester   cottonDo not bleach  iron  dry cleanWash with like colours </div></div></div> </div>,,16:04:2014,
94051,quiksilver blue half sleeves cotton men non collared t shirt,http://www.yebhi.com/online-shopping/men/apparels.html?affint=men-topmenu,1165,Clothing,t-shirts,quiksilver,http://im6.ybndc.com/upload/94051/ProductRear635055313836573782.jpg,1295,,Men,http://www.yebhi.com/94051/PD/quiksilver-blue-half-sleeves-cotton-men-non-collared-t-shirt.htm,yebhi.com,Quiksilver Blue Half Sleeves Cotton Men - Non-collared T-shirt Buy Online,Quiksilver Blue Half Sleeves Cotton Men - Non-collared T-shirt  Best Price Rs 1165.00 Best Discount 10% Off EMI Rs 194 for 6 months FREE Shipping in 2 Days,XLXXL,<div class="product_detail_columns tinyscrl" itemprop="description" style=""><div class="scrollbar" style="width:2px; height:250px; background:#9E9E9E;"><div class="track" style="width:2px;"><div class="thumb" style="width:6px;"><div class="end"> </div></div></div></div><div class="viewport" style=" height:250px; width:252px; font-family:Arial !important;"><div class="overview" style="text-align:justify; display:block;"><div>Blue coloured T-shirt with <b>abstract print  half sleeves and round neck</b>. Get your basics right with this simple T-shirt by Quiksilver. Made of cotton  rest ensure of comfort and breathability in this comfortable T-shirt. <b>Style Tips</b><br>For a casual look  wear this T-shirt along with a pair of jeans.<br>When going for a workout or simply lounging  pair it up with any capris  shorts or trackpants.<br/><b>Material and Care</b> <br>Made of cotton<br>Do not bleach or dry clean<br>Wash with like colours<br>Line dry </br></br></br></br></br></br></div></div></div> </div>,,16:04:2014,
93938,quiksilver white half sleeves cotton men non collared t shirt,http://www.yebhi.com/online-shopping/men/apparels.html?affint=men-topmenu,1795,Clothing,t-shirts,quiksilver,http://im6.ybndc.com/upload/93938/ProductRear635050093819350161.jpg,1995,,Men,http://www.yebhi.com/93938/PD/quiksilver-white-half-sleeves-cotton-men-non-collared-t-shirt.htm,yebhi.com,Quiksilver White Half Sleeves Cotton Men - Non-collared T-shirt Buy Online,Quiksilver White Half Sleeves Cotton Men - Non-collared T-shirt  Best Price Rs 1795.00 Best Discount 10% Off EMI Rs 299 for 6 months FREE Shipping in 2 Days,SXL,<div class="product_detail_columns tinyscrl" itemprop="description" style=""><div class="scrollbar" style="width:2px; height:250px; background:#9E9E9E;"><div class="track" style="width:2px;"><div class="thumb" style="width:6px;"><div class="end"> </div></div></div></div><div class="viewport" style=" height:250px; width:252px; font-family:Arial !important;"><div class="overview" style="text-align:justify; display:block;"><div>Go for this cool and snug-fit t-shirt from Quicksilver and make yourself ready for a cool walk with friends  morning jog or a gymming session. This tee is available in versatile white colour and will keep you relaxed while you'll be busy working out. Go for it as this set is trendy as well as comfortable to wear.<b>Style Tip</b>Pair the tee with running shoes for a perfect look.<b>Material &amp; Care</b>Made of cottonWash it with a mild detergentIf washing in a machine  set it on a delicate mode and low temperature cycle. Wash dark colours separately and  use iron at low temperature. </div></div></div> </div>,,16:04:2014,
93946,quiksilver grey half sleeves cotton men non collared t shirt,http://www.yebhi.com/online-shopping/men/apparels.html?affint=men-topmenu,1795,Clothing,t-shirts,quiksilver,http://im6.ybndc.com/upload/93946/ProductRear635050203832815371.jpg,1995,,Men,http://www.yebhi.com/93946/PD/quiksilver-grey-half-sleeves-cotton-men-non-collared-t-shirt.htm,yebhi.com,Quiksilver Grey Half Sleeves Cotton Men - Non-collared T-shirt Buy Online,Quiksilver Grey Half Sleeves Cotton Men - Non-collared T-shirt  Best Price Rs 1795.00 Best Discount 10% Off EMI Rs 299 for 6 months FREE Shipping in 2 Days,XXL,<div class="product_detail_columns tinyscrl" itemprop="description" style=""><div class="scrollbar" style="width:2px; height:250px; background:#9E9E9E;"><div class="track" style="width:2px;"><div class="thumb" style="width:6px;"><div class="end"> </div></div></div></div><div class="viewport" style=" height:250px; width:252px; font-family:Arial !important;"><div class="overview" style="text-align:justify; display:block;"><div>If you love casual styling  check out this rounded neck tee by Quiksilver. It sports a trendy design which is enhanced well by the grey colour tone. The funky graphics on the front makes your style statement go racy all the way. With half sleeves in place  this cotton tee is soothing to the body  thereby making it perfect as a summer wear. <br><br><b>Style Tip</b><br>Team up with slim fit denims and slip into casual shoes for a complete look.<br><br><b>Material and Care</b><br>Made of cotton<br>Do not bleach or dry clean<br>Wash with like colours<br>Line Dry<br><br> </br></br></br></br></br></br></br></br></br></br></br></div></div></div> </div>,,16:04:2014,
94049,quiksilver white men half sleeves cotton non collared t shirt,http://www.yebhi.com/online-shopping/men/apparels.html?affint=men-topmenu,1165,Clothing,t-shirts,quiksilver,http://im6.ybndc.com/upload/94049/ProductRear635042977157707575.jpg,1295,,Men,http://www.yebhi.com/94049/PD/quiksilver-white-men-half-sleeves-cotton-non-collared-t-shirt.htm,yebhi.com,Quiksilver White Men Half Sleeves Cotton - Non-collared T-shirt Buy Online,Quiksilver White Men Half Sleeves Cotton - Non-collared T-shirt  Best Price Rs 1165.00 Best Discount 10% Off EMI Rs 194 for 6 months FREE Shipping in 2 Days,XXL,<div class="product_detail_columns tinyscrl" itemprop="description" style=""><div class="scrollbar" style="width:2px; height:250px; background:#9E9E9E;"><div class="track" style="width:2px;"><div class="thumb" style="width:6px;"><div class="end"> </div></div></div></div><div class="viewport" style=" height:250px; width:252px; font-family:Arial !important;"><div class="overview" style="text-align:justify; display:block;"><div>A simple white T-shirt says a lot about your fine taste in fashion apparel. And when it comes to this T-shirt for men from Quiksilver  it brings with it the finest thing that completes your casual attire. Made of cotton fabric featuring a printed design  this half sleeves T-shirt is ultra cool and the best one a man can have to complement his style that is haute and trendy. <b>Style Tips</b>Team this T-shirt with a jeans and a stylish pair of casual shoes. For best style effect  wear this T-shirt with stone washed jeans and canvas shoes.<b>Material &amp; Care</b>Made of CottonHand wash coolWarm iron </div></div></div> </div>,,16:04:2014,
94050,quiksilver white half sleeves cotton men non collared t shirt,http://www.yebhi.com/online-shopping/men/apparels.html?affint=men-topmenu,1165,Clothing,t-shirts,quiksilver,http://im6.ybndc.com/upload/94050/ProductRear635050955195095765.jpg,1295,,Men,http://www.yebhi.com/94050/PD/quiksilver-white-half-sleeves-cotton-men-non-collared-t-shirt.htm,yebhi.com,Quiksilver White Half Sleeves Cotton Men - Non-collared T-shirt Buy Online,Quiksilver White Half Sleeves Cotton Men - Non-collared T-shirt  Best Price Rs 1165.00 Best Discount 10% Off EMI Rs 194 for 6 months FREE Shipping in 2 Days,XLXXL,<div class="product_detail_columns tinyscrl" itemprop="description" style=""><div class="scrollbar" style="width:2px; height:250px; background:#9E9E9E;"><div class="track" style="width:2px;"><div class="thumb" style="width:6px;"><div class="end"> </div></div></div></div><div class="viewport" style=" height:250px; width:252px; font-family:Arial !important;"><div class="overview" style="text-align:justify; display:block;"><div>White T-shirt with a print in black  half sleeves and round neck. Get your basics right with this simple white T-shirt by Quiksilver. Made of cotton  you can be ensured of comfort and breathability in this tee. <b>Style Tips</b><br>For a casual look  wear this T-shirt along with a pair of blue jeans.<br>When going for a workout or simply lounging  pair it up with any capris  shorts or track pants.<br/><b>Material and Care</b> <br>Made of cotton<br>Do not bleach or dry clean<br>Wash with like colours<br>Line dry. </br></br></br></br></br></br></div></div></div> </div>,,16:04:2014,
93934,quiksilver pink half sleeves cotton men non collared t shirt,http://www.yebhi.com/online-shopping/men/apparels.html?affint=men-topmenu,1435,Clothing,t-shirts,quiksilver,http://im6.ybndc.com/upload/93934/ProductRear634995785241463621.jpg,1595,,Men,http://www.yebhi.com/93934/PD/quiksilver-pink-half-sleeves-cotton-men-non-collared-t-shirt.htm,yebhi.com,Quiksilver Pink Half Sleeves Cotton Men - Non-collared T-shirt Buy Online,Quiksilver Pink Half Sleeves Cotton Men - Non-collared T-shirt  Best Price Rs 1435.00 Best Discount 10% Off EMI Rs 239 for 6 months FREE Shipping in 2 Days,M,<div class="product_detail_columns tinyscrl" itemprop="description" style=""><div class="scrollbar" style="width:2px; height:250px; background:#9E9E9E;"><div class="track" style="width:2px;"><div class="thumb" style="width:6px;"><div class="end"> </div></div></div></div><div class="viewport" style=" height:250px; width:252px; font-family:Arial !important;"><div class="overview" style="text-align:justify; display:block;"><div><table><tr><td><b>Colour</b></td><td>    </td><td>Pink</td></tr><tr><td><b>For</b></td><td>    </td><td>Men</td></tr><tr><td><b>Material</b></td><td>    </td><td>Cotton</td></tr><tr><td><b>Brands</b></td><td>    </td><td>Quiksilver</td></tr><tr><td><b>Departments</b></td><td>    </td><td>Apparels</td></tr><tr><td><b>Sleeves</b></td><td>    </td><td>Half Sleeves</td></tr><tr><td><b>Category</b></td><td>    </td><td>T-Shirts</td></tr><tr><td><b>Types</b></td><td>    </td><td>Non-collared T-shirt</td></tr><tr><td><b>Discount</b></td><td>    </td><td>More than 10%   Sale</td></tr></table>  </div></div></div> </div>,,16:04:2014,
93932,quiksilver white half sleeves men non collared t shirt,http://www.yebhi.com/online-shopping/men/apparels.html?affint=men-topmenu,2065,Clothing,t-shirts,quiksilver,http://im6.ybndc.com/upload/93932/ProductRear634983711150110031.jpg,2295,,Men,http://www.yebhi.com/93932/PD/quiksilver-white-half-sleeves-men-non-collared-t-shirt.htm,yebhi.com,Quiksilver White Half Sleeves Men - Non-collared T-shirt Buy Online,Quiksilver White Half Sleeves Men - Non-collared T-shirt  Best Price Rs 2065.00 Best Discount 10% Off EMI Rs 344 for 6 months FREE Shipping in 2 Days,SXXL,<div class="product_detail_columns tinyscrl" itemprop="description" style=""><div class="scrollbar" style="width:2px; height:250px; background:#9E9E9E;"><div class="track" style="width:2px;"><div class="thumb" style="width:6px;"><div class="end"> </div></div></div></div><div class="viewport" style=" height:250px; width:252px; font-family:Arial !important;"><div class="overview" style="text-align:justify; display:block;"><div>Blend your casual style in the most appropriate way with this trendy T-shirt from Quicksilver. Specially designed for men with an innate sense of style  this T-shirt surely promises you great fit and comfort as it is made of polyester and cotton fabric. With half sleeves to boast and a crew-neck collar plus a cool graphic print  this T-shirt is sure to add substance to your casual attire. Perfect to be worn with your jeans for all day comfort. <b>Style Tips</b><br>For a casual look  wear the T-shirt along with comfort fit jeans.<br>For a chilled and cool style  the T-shirt will look good with your cargo shorts and team it with a nice pair of sandals/slipper.<br/><b>Material and Care</b> <br>Made of Cotton   Polyester<br>Do not bleach  iron  dry clean<br>Wash with like colours<br>Line dry. </br></br></br></br></br></br></div></div></div> </div>,,16:04:2014,
93945,quiksilver purple half sleeves cotton men non collared t shirt,http://www.yebhi.com/online-shopping/men/apparels.html?affint=men-topmenu,1795,Clothing,t-shirts,quiksilver,http://im6.ybndc.com/upload/93945/ProductRear635026633389016908.jpg,1995,,Men,http://www.yebhi.com/93945/PD/quiksilver-purple-half-sleeves-cotton-men-non-collared-t-shirt.htm,yebhi.com,Quiksilver Purple Half Sleeves Cotton Men - Non-collared T-shirt Buy Online,Quiksilver Purple Half Sleeves Cotton Men - Non-collared T-shirt  Best Price Rs 1795.00 Best Discount 10% Off EMI Rs 299 for 6 months FREE Shipping in 2 Days,SLXLXXL,<div class="product_detail_columns tinyscrl" itemprop="description" style=""><div class="scrollbar" style="width:2px; height:250px; background:#9E9E9E;"><div class="track" style="width:2px;"><div class="thumb" style="width:6px;"><div class="end"> </div></div></div></div><div class="viewport" style=" height:250px; width:252px; font-family:Arial !important;"><div class="overview" style="text-align:justify; display:block;"><div>Quiksilver brings you this vibrant <b>rounded neck T-shirt</b>  which can entice the youth with its looks  in one go. The material is elastic and gives you ample comfort throughout the day. Purple shade and funky graphics on the front  create an appealing look for the youth. <br><br><b>Style Tip</b><br>Put on with slim-fit denims and slip into suede shoes for a complete look.<br><br><b>Material and Care</b><br>Made of Cotton<br>Do not bleach or dry clean<br>Wash with like colours<br>Line Dry<br> </br></br></br></br></br></br></br></br></br></br></div></div></div> </div>,,16:04:2014,
