80308,les copains brown women rectangle sunglasses,http://www.yebhi.com/online-shopping/lifestyle/women.html?affint=women-topmenu,4313,Accessories,sunglasses,les-copains,http://im6.ybndc.com/upload/80308/ProductRear634588730664774325.jpg,4793,,Women,http://www.yebhi.com/80308/PD/les-copains-brown-women-rectangle-sunglasses.htm,yebhi.com,Les Copains Brown Women - Rectangle Sunglasses Buy Online,Les Copains Brown Women - Rectangle Sunglasses  Best Price Rs 4313.00 Best Discount 10% Off EMI Rs 719 for 6 months FREE Shipping in 2 Days,None,<div class="product_detail_columns tinyscrl" itemprop="description" style=""><div class="scrollbar" style="width:2px; height:250px; background:#9E9E9E;"><div class="track" style="width:2px;"><div class="thumb" style="width:6px;"><div class="end"> </div></div></div></div><div class="viewport" style=" height:250px; width:252px; font-family:Arial !important;"><div class="overview" style="text-align:justify; display:block;"><div>This trendy pair of sunglasses is from Les Copains. The <b>black colour frame has white detailing</b> on the edges and the arms have the brand name embossed in a different colour. The lenses are<b> brown tinted</b>. Look different with this unique pair and make a stylish fashion statement.<b>Features</b><ul style="margin-left: 20px;"><li type="disc">For: Women</li><li type="disc">Frame colour: Black</li><li type="disc">Frame Shape: Rectangle</li><li type="disc">Frame Type: Full rim </li><li type="disc">Lens Colour: Brown tinted</li></ul> </div></div></div> </div>,,17:04:2014,
80315,les copains grey women oval sunglasses,http://www.yebhi.com/online-shopping/lifestyle/women.html?affint=women-topmenu,4313,Accessories,sunglasses,les-copains,http://im6.ybndc.com/upload/80315/ProductRear634588882269510144.jpg,4793,,Women,http://www.yebhi.com/80315/PD/les-copains-grey-women-oval-sunglasses.htm,yebhi.com,Les Copains Grey Women - Oval Sunglasses Buy Online,Les Copains Grey Women - Oval Sunglasses  Best Price Rs 4313.00 Best Discount 10% Off EMI Rs 719 for 6 months FREE Shipping in 2 Days,None,<div class="product_detail_columns tinyscrl" itemprop="description" style=""><div class="scrollbar" style="width:2px; height:250px; background:#9E9E9E;"><div class="track" style="width:2px;"><div class="thumb" style="width:6px;"><div class="end"> </div></div></div></div><div class="viewport" style=" height:250px; width:252px; font-family:Arial !important;"><div class="overview" style="text-align:justify; display:block;"><div><table><tr><td><b>Colour</b></td><td>    </td><td>Grey</td></tr><tr><td><b>For</b></td><td>    </td><td>Women</td></tr><tr><td><b>Brands</b></td><td>    </td><td>Les Copains</td></tr><tr><td><b>Departments</b></td><td>    </td><td>Eyewear</td></tr><tr><td><b>Category</b></td><td>    </td><td>Sunglasses</td></tr><tr><td><b>Types</b></td><td>    </td><td>Oval Sunglasses</td></tr><tr><td><b>Discount</b></td><td>    </td><td>More than 10%   Sale</td></tr></table>  </div></div></div> </div>,,17:04:2014,
85713,les copains brown women oval sunglasses,http://www.yebhi.com/online-shopping/lifestyle/women.html?affint=women-topmenu,4313,Accessories,sunglasses,les-copains,http://im6.ybndc.com/upload/85713/ProductRear634747608744526000.jpg,4793,,Women,http://www.yebhi.com/85713/PD/les-copains-brown-women-oval-sunglasses.htm,yebhi.com,Les Copains Brown Women - Oval Sunglasses Buy Online,Les Copains Brown Women - Oval Sunglasses  Best Price Rs 4313.00 Best Discount 10% Off EMI Rs 719 for 6 months FREE Shipping in 2 Days,None,<div class="product_detail_columns tinyscrl" itemprop="description" style=""><div class="scrollbar" style="width:2px; height:250px; background:#9E9E9E;"><div class="track" style="width:2px;"><div class="thumb" style="width:6px;"><div class="end"> </div></div></div></div><div class="viewport" style=" height:250px; width:252px; font-family:Arial !important;"><div class="overview" style="text-align:justify; display:block;"><div>Look different with this unique pair of sunglasses from Les Copains. The <b>oval shape of this full rim</b> is in the colour<b> brown</b>. The lenses are also <b>brown tinted</b>. The detailing on the arms lends exclusivity to this pair which will enhance your look. Sport it for casual occasions and make heads turn It comes in a sleek case.<b>Features</b><ul style="margin-left: 20px;"><li type="disc">For: Women</li><li type="disc">Frame colour: Brown</li><li type="disc">Frame Shape: Oval </li><li type="disc">Frame Type: Full rim </li><li type="disc">Lens Colour: Brown tinted</li></ul> </div></div></div> </div>,,17:04:2014,
85712,les copains black women oval sunglasses,http://www.yebhi.com/online-shopping/lifestyle/women.html?affint=women-topmenu,4313,Accessories,sunglasses,les-copains,http://im6.ybndc.com/upload/85712/ProductRear634588895366574099.jpg,4793,,Women,http://www.yebhi.com/85712/PD/les-copains-black-women-oval-sunglasses.htm,yebhi.com,Les Copains Black Women - Oval Sunglasses Buy Online,Les Copains Black Women - Oval Sunglasses  Best Price Rs 4313.00 Best Discount 10% Off EMI Rs 719 for 6 months FREE Shipping in 2 Days,None,<div class="product_detail_columns tinyscrl" itemprop="description" style=""><div class="scrollbar" style="width:2px; height:250px; background:#9E9E9E;"><div class="track" style="width:2px;"><div class="thumb" style="width:6px;"><div class="end"> </div></div></div></div><div class="viewport" style=" height:250px; width:252px; font-family:Arial !important;"><div class="overview" style="text-align:justify; display:block;"><div>Look different with this unique pair of sunglasses from Les Copains. The <b>oval shape of this full rim</b> is in the colour<b> black</b>. The lenses are also <b>black tinted</b>. The detailing on the arms lends exclusivity to this pair which will enhance your look. Sport it for casual occasions and make heads turn It comes in a sleek case.<b>Features</b><ul style="margin-left: 20px;"><li type="disc">For: Women</li><li type="disc">Frame colour: Black</li><li type="disc">Frame Shape: Oval </li><li type="disc">Frame Type: Full rim </li><li type="disc">Lens Colour: Black tinted</li></ul> </div></div></div> </div>,,17:04:2014,
85742,les copains mustard women sporty sunglasses,http://www.yebhi.com/online-shopping/lifestyle/women.html?affint=women-topmenu,4313,Accessories,sunglasses,les-copains,http://im6.ybndc.com/upload/85742/ProductRear634588889892655010.jpg,4793,,Women,http://www.yebhi.com/85742/PD/les-copains-mustard-women-sporty-sunglasses.htm,yebhi.com,Les Copains Mustard Women - Sporty Sunglasses Buy Online,Les Copains Mustard Women - Sporty Sunglasses  Best Price Rs 4313.00 Best Discount 10% Off EMI Rs 719 for 6 months FREE Shipping in 2 Days,None,<div class="product_detail_columns tinyscrl" itemprop="description" style=""><div class="scrollbar" style="width:2px; height:250px; background:#9E9E9E;"><div class="track" style="width:2px;"><div class="thumb" style="width:6px;"><div class="end"> </div></div></div></div><div class="viewport" style=" height:250px; width:252px; font-family:Arial !important;"><div class="overview" style="text-align:justify; display:block;"><div>From Les Copains comes this <b>sporty and fantastic</b> pair of sunglasses which you will love to sport for an excellent day look. The <b>mustard rectangular frame</b> has <b>broad arms and the brand name embossed on contrast colour</b>  on the sides. The lenses are <b>brown tinted</b>. Flaunt it and make a stylish fashion statement.<b>Features</b><ul style="margin-left: 20px;"><li type="disc">For: Women</li><li type="disc">Frame colour: Mustard</li><li type="disc">Frame Shape: Rectangular</li><li type="disc">Frame Type: Full rim </li><li type="disc">Lens Colour: Brown tinted</li></ul> </div></div></div> </div>,,17:04:2014,
80319,les copains grey women rectangle sunglasses,http://www.yebhi.com/online-shopping/lifestyle/women.html?affint=women-topmenu,4313,Accessories,sunglasses,les-copains,http://im6.ybndc.com/upload/80319/ProductRear634588660006149388.jpg,4793,,Women,http://www.yebhi.com/80319/PD/les-copains-grey-women-rectangle-sunglasses.htm,yebhi.com,Les Copains Grey Women - Rectangle Sunglasses Buy Online,Les Copains Grey Women - Rectangle Sunglasses  Best Price Rs 4313.00 Best Discount 10% Off EMI Rs 719 for 6 months FREE Shipping in 2 Days,None,<div class="product_detail_columns tinyscrl" itemprop="description" style=""><div class="scrollbar" style="width:2px; height:250px; background:#9E9E9E;"><div class="track" style="width:2px;"><div class="thumb" style="width:6px;"><div class="end"> </div></div></div></div><div class="viewport" style=" height:250px; width:252px; font-family:Arial !important;"><div class="overview" style="text-align:justify; display:block;"><div>High on style  this pair of sunglasses from Les Copains comes in a styled frame. A smart blend of fashion and substance  its shape provides that perfect look to  your face. These stylish sunglasses protect your eyes  while giving you an effortlessly stylish look at the same time. <br><br><b>Specifications </b><br>For: Women<br>Colour of Lenses: Pink <br> Frame Colour: Matte Black<br> Frame Material: Plastic<br><br><b>Style Tip</b><br>Wear these stylish shades while out on a lunch date with friends and look effortlessly gorgeous.  </br></br></br></br></br></br></br></br></br></div></div></div> </div>,,17:04:2014,
80293,les copains red unisex oval sunglasses,http://www.yebhi.com/online-shopping/lifestyle/women.html?affint=women-topmenu,4313,Accessories,sunglasses,les-copains,http://im6.ybndc.com/upload/80293/ProductRear634588857775325131.jpg,4793,,Women,http://www.yebhi.com/80293/PD/les-copains-red-unisex-oval-sunglasses.htm,yebhi.com,Les Copains Red Unisex - Oval Sunglasses Buy Online,Les Copains Red Unisex - Oval Sunglasses  Best Price Rs 4313.00 Best Discount 10% Off EMI Rs 719 for 6 months FREE Shipping in 2 Days,None,<div class="product_detail_columns tinyscrl" itemprop="description" style=""><div class="scrollbar" style="width:2px; height:250px; background:#9E9E9E;"><div class="track" style="width:2px;"><div class="thumb" style="width:6px;"><div class="end"> </div></div></div></div><div class="viewport" style=" height:250px; width:252px; font-family:Arial !important;"><div class="overview" style="text-align:justify; display:block;"><div><table><tr><td><b>Colour</b></td><td>    </td><td>Red</td></tr><tr><td><b>For</b></td><td>    </td><td>Men   Women</td></tr><tr><td><b>Brands</b></td><td>    </td><td>Les Copains</td></tr><tr><td><b>Departments</b></td><td>    </td><td>Eyewear</td></tr><tr><td><b>Category</b></td><td>    </td><td>Sunglasses</td></tr><tr><td><b>Types</b></td><td>    </td><td>Oval Sunglasses</td></tr><tr><td><b>Discount</b></td><td>    </td><td>More than 10%   Sale</td></tr></table>  </div></div></div> </div>,,17:04:2014,
80300,les copains brown women oval sunglasses,http://www.yebhi.com/online-shopping/lifestyle/women.html?affint=women-topmenu,4313,Accessories,sunglasses,les-copains,http://im6.ybndc.com/upload/80300/ProductRear634588884863338771.jpg,4793,,Women,http://www.yebhi.com/80300/PD/les-copains-brown-women-oval-sunglasses.htm,yebhi.com,Les Copains Brown Women - Oval Sunglasses Buy Online,Les Copains Brown Women - Oval Sunglasses  Best Price Rs 4313.00 Best Discount 10% Off EMI Rs 719 for 6 months FREE Shipping in 2 Days,None,<div class="product_detail_columns tinyscrl" itemprop="description" style=""><div class="scrollbar" style="width:2px; height:250px; background:#9E9E9E;"><div class="track" style="width:2px;"><div class="thumb" style="width:6px;"><div class="end"> </div></div></div></div><div class="viewport" style=" height:250px; width:252px; font-family:Arial !important;"><div class="overview" style="text-align:justify; display:block;"><div>From Les Copains comes this stylish pair of sunglasses in the<b>colour brown</b>. Flaunt your trendiest side with this pair. The <b>oval  full rim </b>has very <b>exclusive arms</b>. The brand name is embossed on the sides. It has <b>brown tinted lenses </b>which will give you an admirable look. It comes in a stylish case.<b>Features</b><ul style="margin-left: 20px;"><li type="disc">For: Women</li><li type="disc">Frame colour: Brown</li><li type="disc">Frame Shape: Oval</li><li type="disc">Frame Type: Full rim </li><li type="disc">Lens Colour: Brown tinted</li></ul> </div></div></div> </div>,,17:04:2014,
80316,les copains black women rectangle sunglasses,http://www.yebhi.com/online-shopping/lifestyle/women.html?affint=women-topmenu,4313,Accessories,sunglasses,les-copains,http://im6.ybndc.com/upload/80316/ProductRear634588658998382928.jpg,4793,,Women,http://www.yebhi.com/80316/PD/les-copains-black-women-rectangle-sunglasses.htm,yebhi.com,Les Copains Black Women - Rectangle Sunglasses Buy Online,Les Copains Black Women - Rectangle Sunglasses  Best Price Rs 4313.00 Best Discount 10% Off EMI Rs 719 for 6 months FREE Shipping in 2 Days,None,<div class="product_detail_columns tinyscrl" itemprop="description" style=""><div class="scrollbar" style="width:2px; height:250px; background:#9E9E9E;"><div class="track" style="width:2px;"><div class="thumb" style="width:6px;"><div class="end"> </div></div></div></div><div class="viewport" style=" height:250px; width:252px; font-family:Arial !important;"><div class="overview" style="text-align:justify; display:block;"><div>From Les Copains comes this unique pair of sunglasses in the <b>colour black</b>. The <b>rectangular  full rim </b>has a very <b>exclusive look</b>. The arms are sleek and the brand name is embossed on the sides on a contrast colour. It has <b>purple tinted lenses </b>which will give you an admirable look. Flaunt your trendiest side with this pair. It comes in a stylish case.<b>Features</b><ul style="margin-left: 20px;"><li type="disc">For: Women</li><li type="disc">Frame colour: Black</li><li type="disc">Frame Shape: Rectangle</li><li type="disc">Frame Type: Full rim </li><li type="disc">Lens Colour: Purple tinted</li></ul> </div></div></div> </div>,,17:04:2014,
80331,les copains purple women oval sunglasses,http://www.yebhi.com/online-shopping/lifestyle/women.html?affint=women-topmenu,4313,Accessories,sunglasses,les-copains,http://im6.ybndc.com/upload/80331/ProductRear634584426365934007.jpg,4793,,Women,http://www.yebhi.com/80331/PD/les-copains-purple-women-oval-sunglasses.htm,yebhi.com,Les Copains Purple Women - Oval Sunglasses Buy Online,Les Copains Purple Women - Oval Sunglasses  Best Price Rs 4313.00 Best Discount 10% Off EMI Rs 719 for 6 months FREE Shipping in 2 Days,None,<div class="product_detail_columns tinyscrl" itemprop="description" style=""><div class="scrollbar" style="width:2px; height:250px; background:#9E9E9E;"><div class="track" style="width:2px;"><div class="thumb" style="width:6px;"><div class="end"> </div></div></div></div><div class="viewport" style=" height:250px; width:252px; font-family:Arial !important;"><div class="overview" style="text-align:justify; display:block;"><div>Flaunt your trendiest side with this pair of sunglasses from Les Copains. The <b>colour pink</b> in dual tone and the <b>wayfarer style</b> will add vibrance to your look. This trendy pair of sunglasses will add an edge to your look and the lenses are <b>purple tinted</b>. Look different with this unique pair and make a fashion statement. It comes in a stylish case.<b>Features</b><ul style="margin-left: 20px;"><li type="disc">For: Women</li><li type="disc">Frame colour: Purple</li><li type="disc">Frame Shape: Wayfarer</li><li type="disc">Frame Type: Full rim </li><li type="disc">Lens Colour: Purple tinted</li></ul> </div></div></div> </div>,,17:04:2014,
80323,les copains pink women rectangle sunglasses,http://www.yebhi.com/online-shopping/lifestyle/women.html?affint=women-topmenu,4313,Accessories,sunglasses,les-copains,http://im6.ybndc.com/upload/80323/ProductRear634588731399383034.jpg,4793,,Women,http://www.yebhi.com/80323/PD/les-copains-pink-women-rectangle-sunglasses.htm,yebhi.com,Les Copains Pink Women - Rectangle Sunglasses Buy Online,Les Copains Pink Women - Rectangle Sunglasses  Best Price Rs 4313.00 Best Discount 10% Off EMI Rs 719 for 6 months FREE Shipping in 2 Days,None,<div class="product_detail_columns tinyscrl" itemprop="description" style=""><div class="scrollbar" style="width:2px; height:250px; background:#9E9E9E;"><div class="track" style="width:2px;"><div class="thumb" style="width:6px;"><div class="end"> </div></div></div></div><div class="viewport" style=" height:250px; width:252px; font-family:Arial !important;"><div class="overview" style="text-align:justify; display:block;"><div>Get an admirable look with this pair of sunglasses from Les Copains. The <b>red colour rectangular full rim</b> with broad arms has <b>abstract detailing and the brand name embossed on the sides</b> giving it a very trendy and peppy look. It has <b> black tinted lenses </b>. Make heads turn with this jazzy pair  which comes in a sleek case.<b>Features</b><ul style="margin-left: 20px;"><li type="disc">For: Women</li><li type="disc">Frame colour: Red</li><li type="disc">Frame Shape: Rectangle </li><li type="disc">Frame Type: Full rim </li><li type="disc">Lens Colour: Black tinted</li></ul> </div></div></div> </div>,,17:04:2014,
80347,les copains purple women rectangle sunglasses,http://www.yebhi.com/online-shopping/lifestyle/women.html?affint=women-topmenu,4313,Accessories,sunglasses,les-copains,http://im6.ybndc.com/upload/80347/ProductRear634588894742102096.jpg,4793,,Women,http://www.yebhi.com/80347/PD/les-copains-purple-women-rectangle-sunglasses.htm,yebhi.com,Les Copains Purple Women - Rectangle Sunglasses Buy Online,Les Copains Purple Women - Rectangle Sunglasses  Best Price Rs 4313.00 Best Discount 10% Off EMI Rs 719 for 6 months FREE Shipping in 2 Days,None,<div class="product_detail_columns tinyscrl" itemprop="description" style=""><div class="scrollbar" style="width:2px; height:250px; background:#9E9E9E;"><div class="track" style="width:2px;"><div class="thumb" style="width:6px;"><div class="end"> </div></div></div></div><div class="viewport" style=" height:250px; width:252px; font-family:Arial !important;"><div class="overview" style="text-align:justify; display:block;"><div>Stand apart from the crowd with this <b>rectangular</b> pair of sunglasses from Les Copains. The <b>dual colours purple and brown</b> on the <b>full rim</b> makes it a must possess pair. The lenses are <b>brown tinted </b>and has sleek arms with the brand initials on the sides. The edges add style your look.<b>Features</b><ul style="margin-left: 20px;"><li type="disc">For: Women</li><li type="disc">Frame colour: Purple  Brown</li><li type="disc">Frame Shape: Rectangular</li><li type="disc">Frame Type: Full rim </li><li type="disc">Lens Colour: Brown tinted</li></ul> </div></div></div> </div>,,17:04:2014,
80305,les copains unisex rectangle sunglasses,http://www.yebhi.com/online-shopping/lifestyle/women.html?affint=women-topmenu,4313,Accessories,sunglasses,les-copains,http://im6.ybndc.com/upload/80305/ProductRear634588816008241395.jpg,4793,,Women,http://www.yebhi.com/80305/PD/les-copains-unisex-rectangle-sunglasses.htm,yebhi.com,Les Copains Unisex - Rectangle Sunglasses Buy Online,Les Copains Unisex - Rectangle Sunglasses  Best Price Rs 4313.00 Best Discount 10% Off EMI Rs 719 for 6 months FREE Shipping in 2 Days,None,<div class="product_detail_columns tinyscrl" itemprop="description" style=""><div class="scrollbar" style="width:2px; height:250px; background:#9E9E9E;"><div class="track" style="width:2px;"><div class="thumb" style="width:6px;"><div class="end"> </div></div></div></div><div class="viewport" style=" height:250px; width:252px; font-family:Arial !important;"><div class="overview" style="text-align:justify; display:block;"><div>These Les Copains sunglasses have an easy to wear style with a stylish constructed front and proportionate plastic temples. These sunglasses have textured frame which look uber chic. The sculpted temples of these sunglasses are finished with a stamped brandmark.<b>Style Tip</b>  Wear these sunglasses with your casual attires while you set off to meet your date at lunch or a road trip with pals.<br><br><b>Specifications </b></br><b>Genre </b> : Men  Women </br><b> Col. Frame </b> : Black<b>Col. Lenses</b> : Grey </div></div></div> </div>,,17:04:2014,
80318,les copains orange women rectangle sunglasses,http://www.yebhi.com/online-shopping/lifestyle/women.html?affint=women-topmenu,4313,Accessories,sunglasses,les-copains,http://im6.ybndc.com/upload/80318/ProductRear634584543592573455.jpg,4793,,Women,http://www.yebhi.com/80318/PD/les-copains-orange-women-rectangle-sunglasses.htm,yebhi.com,Les Copains Orange Women - Rectangle Sunglasses Buy Online,Les Copains Orange Women - Rectangle Sunglasses  Best Price Rs 4313.00 Best Discount 10% Off EMI Rs 719 for 6 months FREE Shipping in 2 Days,None,<div class="product_detail_columns tinyscrl" itemprop="description" style=""><div class="scrollbar" style="width:2px; height:250px; background:#9E9E9E;"><div class="track" style="width:2px;"><div class="thumb" style="width:6px;"><div class="end"> </div></div></div></div><div class="viewport" style=" height:250px; width:252px; font-family:Arial !important;"><div class="overview" style="text-align:justify; display:block;"><div>From Les Copains comes this unique pair of sunglasses in the <b>colour brown</b>. The <b>rectangular  full rim </b>has a very <b>exclusive look</b>. The arms are sleek and the brand name is embossed on the sides on a contrast colour. It has <b>brown tinted lenses </b>which will give you an admirable look. Flaunt your trendiest side with this pair. It comes in a stylish case.<b>Features</b><ul style="margin-left: 20px;"><li type="disc">For: Women</li><li type="disc">Frame colour: Brown</li><li type="disc">Frame Shape: Rectangle</li><li type="disc">Frame Type: Full rim </li><li type="disc">Lens Colour: Brown tinted</li></ul> </div></div></div> </div>,,17:04:2014,
80304,les copains red women rectangle sunglasses,http://www.yebhi.com/online-shopping/lifestyle/women.html?affint=women-topmenu,4313,Accessories,sunglasses,les-copains,http://im6.ybndc.com/upload/80304/ProductRear634588768741498405.jpg,4793,,Women,http://www.yebhi.com/80304/PD/les-copains-red-women-rectangle-sunglasses.htm,yebhi.com,Les Copains Red Women - Rectangle Sunglasses Buy Online,Les Copains Red Women - Rectangle Sunglasses  Best Price Rs 4313.00 Best Discount 10% Off EMI Rs 719 for 6 months FREE Shipping in 2 Days,None,<div class="product_detail_columns tinyscrl" itemprop="description" style=""><div class="scrollbar" style="width:2px; height:250px; background:#9E9E9E;"><div class="track" style="width:2px;"><div class="thumb" style="width:6px;"><div class="end"> </div></div></div></div><div class="viewport" style=" height:250px; width:252px; font-family:Arial !important;"><div class="overview" style="text-align:justify; display:block;"><div><table><tr><td><b>Colour</b></td><td>    </td><td>Red</td></tr><tr><td><b>For</b></td><td>    </td><td>Women</td></tr><tr><td><b>Brands</b></td><td>    </td><td>Les Copains</td></tr><tr><td><b>Departments</b></td><td>    </td><td>Eyewear</td></tr><tr><td><b>Category</b></td><td>    </td><td>Sunglasses</td></tr><tr><td><b>Types</b></td><td>    </td><td>Rectangle Sunglasses</td></tr><tr><td><b>Discount</b></td><td>    </td><td>More than 10%   Sale</td></tr></table>  </div></div></div> </div>,,17:04:2014,
80342,les copains grey women rectangle sunglasses,http://www.yebhi.com/online-shopping/lifestyle/women.html?affint=women-topmenu,4313,Accessories,sunglasses,les-copains,http://im6.ybndc.com/upload/80342/ProductRear634588894440708164.jpg,4793,,Women,http://www.yebhi.com/80342/PD/les-copains-grey-women-rectangle-sunglasses.htm,yebhi.com,Les Copains Grey Women - Rectangle Sunglasses Buy Online,Les Copains Grey Women - Rectangle Sunglasses  Best Price Rs 4313.00 Best Discount 10% Off EMI Rs 719 for 6 months FREE Shipping in 2 Days,None,<div class="product_detail_columns tinyscrl" itemprop="description" style=""><div class="scrollbar" style="width:2px; height:250px; background:#9E9E9E;"><div class="track" style="width:2px;"><div class="thumb" style="width:6px;"><div class="end"> </div></div></div></div><div class="viewport" style=" height:250px; width:252px; font-family:Arial !important;"><div class="overview" style="text-align:justify; display:block;"><div><table><tr><td><b>Colour</b></td><td>    </td><td>Grey</td></tr><tr><td><b>For</b></td><td>    </td><td>Women</td></tr><tr><td><b>Brands</b></td><td>    </td><td>Les Copains</td></tr><tr><td><b>Departments</b></td><td>    </td><td>Eyewear</td></tr><tr><td><b>Category</b></td><td>    </td><td>Sunglasses</td></tr><tr><td><b>Types</b></td><td>    </td><td>Rectangle Sunglasses</td></tr><tr><td><b>Discount</b></td><td>    </td><td>More than 10%   Sale</td></tr></table>  </div></div></div> </div>,,17:04:2014,
