144730,House This Bed Sheet BS 176 A,http://www.yebhi.com/online-shopping/home-furnishing.html?affint=home-topmenu,2799,Home Furnishings,bed-sheet,house-this,http://im6.ybndc.com/upload/144730/ProductRear634760606887980370.jpg,2799,,home and kitchen,http://www.yebhi.com/144730/PD/House-This-Bed-Sheet-BS-176-A.htm,yebhi.com,House This Bed Sheet BS 176 A Buy Online,House This Bed Sheet BS 176 A  Best Price Rs 2799.00  EMI Rs 467 for 6 months FREE Shipping In Stock - Delivery in 13-17 Days,None,<div class="product_detail_columns tinyscrl" itemprop="description" style=""><div class="scrollbar" style="width:2px; height:250px; background:#9E9E9E;"><div class="track" style="width:2px;"><div class="thumb" style="width:6px;"><div class="end"> </div></div></div></div><div class="viewport" style=" height:250px; width:252px; font-family:Arial !important;"><div class="overview" style="text-align:justify; display:block;"><div><table 0"" 500"" cellpadding="" cellspacing="" width=""><tr><td 10"" style="" vertical-align:top"" width=""><strong>•</strong></td><td 130"" style="" vertical-align:top"" width=""><strong>Product Name</strong></td><td 50"" align="" center"" style="" vertical-align:top"" width="">:</td><td style="" vertical-align:top"">Double Bed Sheet Sets</td></tr><tr><td 10"" style="" vertical-align:top"" width=""><strong>•</strong></td><td style="" vertical-align:top""><strong>Material</strong></td><td align="" center"" style="" vertical-align:top"">:</td><td style="" vertical-align:top"">100% Cotton</td></tr><tr><td 10"" style="" vertical-align:top"" width=""><strong>•</strong></td><td style="" vertical-align:top""><strong>Size</strong></td><td align="" center"" style="" vertical-align:top"">:</td><td style="" vertical-align:top"">One Double Bed Sheet 229cm X 274cm<br/>  Two Pillow Cover 45cm X 68cm</td></tr><tr><td 10"" style="" vertical-align:top"" width=""><strong>•</strong></td><td style="" vertical-align:top""><strong>Contents</strong></td><td align="" center"" style="" vertical-align:top"">:</td><td style="" vertical-align:top"">3pcs Set</td></tr><tr><td 10"" style="" vertical-align:top"" width=""><strong>•</strong></td><td style="" vertical-align:top""><strong>Detail of Contents</strong></td><td align="" center"" style="" vertical-align:top"">:</td><td style="" vertical-align:top"">One Double Bed Sheet<br/>  Two Pillow Cover</td></tr><tr><td 10"" style="" vertical-align:top"" width=""><strong>•</strong></td><td style="" vertical-align:top""><strong>Wash Care &amp; Caution</strong></td><td align="" center"" style="" vertical-align:top"">:</td><td style="" vertical-align:top"">Wash at 40C at normal cycle<br/>  Wash dark colours seperately<br/>  Do not bleach<br/>  Warm iron<br/>  Tumble Dry Low<br/>  Do not dryclean<br/></td></tr></table>   </div></div></div> </div>,,17:04:2014,
144700,house this beige cotton double bed sheet,http://www.yebhi.com/online-shopping/home-furnishing.html?affint=home-topmenu,1999,Home Furnishings,bed-sheet,house-this,http://im6.ybndc.com/upload/144700/ProductRear634752042832660000.jpg,1999,,home and kitchen,http://www.yebhi.com/144700/PD/house-this-beige-cotton-double-bed-sheet.htm,yebhi.com,House This Beige Cotton - Double Bed Sheet Buy Online,House This Beige Cotton - Double Bed Sheet  Best Price Rs 1999.00  EMI Rs 333 for 6 months FREE Shipping In Stock - Delivery in 9-12 Days,None,<div class="product_detail_columns tinyscrl" itemprop="description" style=""><div class="scrollbar" style="width:2px; height:250px; background:#9E9E9E;"><div class="track" style="width:2px;"><div class="thumb" style="width:6px;"><div class="end"> </div></div></div></div><div class="viewport" style=" height:250px; width:252px; font-family:Arial !important;"><div class="overview" style="text-align:justify; display:block;"><div>  This set of <b>bed sheets</b> contains <b>one double bed bed sheet</b> and a pair of <b>matching pillow covers</b> crafted with <b>100% cotton</b>. The bed sheet and pillow covers have <b>contemporary prints</b> on them. This set is brought to you by <b>House This Bed.</b><br/><br/><b>Features</b><ul style="margin-left: 20px;"><li type="disc"> <b>Brand</b>: House This Bed<br/></li><li type="disc"> <b>Category</b>: Bedsheets<br/></li><li type="disc"> <b>Colour</b>: White  Brown  Orange<br/></li><li type="disc"> <b>Material</b>: 100 %Cotton<br/></li><li type="disc"> <b>Pattern</b>: Abstract Prints<br/></li><li type="disc"> <b>Size of bed sheet (Length x Width in cms)</b>: 274x229<br/></li><li type="disc"> <b>Size of pillow cover (Length x Width in cms)</b>: 68x45 <br/></li><li type="disc"> <b>Content</b>: One double bed sheet and two pillow covers </li></ul><br/><b>Care Tips</b><br/>  Do not bleach or dry clean<br/>  Wash with like colours<br/>  Line dry<br/>  </div></div></div> </div>,,17:04:2014,
144733,house this blue cotton double bed sheet,http://www.yebhi.com/online-shopping/home-furnishing.html?affint=home-topmenu,2099,Home Furnishings,bed-sheet,house-this,http://im6.ybndc.com/upload/144733/ProductRear634782117442418416.jpg,2099,,home and kitchen,http://www.yebhi.com/144733/PD/house-this-blue-cotton-double-bed-sheet.htm,yebhi.com,House This Blue Cotton - Double Bed Sheet Buy Online,House This Blue Cotton - Double Bed Sheet  Best Price Rs 2099.00  EMI Rs 350 for 6 months FREE Shipping In Stock - Delivery in 9-12 Days,None,<div class="product_detail_columns tinyscrl" itemprop="description" style=""><div class="scrollbar" style="width:2px; height:250px; background:#9E9E9E;"><div class="track" style="width:2px;"><div class="thumb" style="width:6px;"><div class="end"> </div></div></div></div><div class="viewport" style=" height:250px; width:252px; font-family:Arial !important;"><div class="overview" style="text-align:justify; display:block;"><div>Add this <b> double bedsheet set </b> with <b> contemporary   prints in blue and black colours </b> to your home furnishing collection. House This presents this bedsheet set crafted from <b> cotton material.</b><b>Features</b><ul style="margin-left: 20px;"><li type="disc"> <b>Brand:</b> House This</li><li type="disc"> <b>Category:</b> Bedsheet</li><li type="disc"><b>Type:</b> Double bedsheet set</li><li type="disc"><b>Material:</b> Cotton</li><li type="disc"><b>Colour:</b> Blue  Black</li><li type="disc"><b>Pattern:</b> Contemporary prints </li><li type="disc"><b>Size of Bedsheet (Length x Width in cms):</b> 274 x 229 </li><li type="disc"><b>Size of Pillow Cover (Length x Width in cms):</b> 68 x 45 </li><li type="disc"><b>Content:</b> One double bedsheet and two pillow covers</li></ul><b>Care Tips</b>  Do not bleach or dry clean. Wash with like colours. Line dry.  </div></div></div> </div>,,17:04:2014,
144707,house this purple cotton double bed sheet,http://www.yebhi.com/online-shopping/home-furnishing.html?affint=home-topmenu,1899,Home Furnishings,bed-sheet,house-this,http://im6.ybndc.com/upload/144707/ProductRear634752044830864000.jpg,1899,,home and kitchen,http://www.yebhi.com/144707/PD/house-this-purple-cotton-double-bed-sheet.htm,yebhi.com,House This Purple Cotton - Double Bed Sheet Buy Online,House This Purple Cotton - Double Bed Sheet  Best Price Rs 1899.00  EMI Rs 317 for 6 months FREE Shipping In Stock - Delivery in 9-12 Days,None,<div class="product_detail_columns tinyscrl" itemprop="description" style=""><div class="scrollbar" style="width:2px; height:250px; background:#9E9E9E;"><div class="track" style="width:2px;"><div class="thumb" style="width:6px;"><div class="end"> </div></div></div></div><div class="viewport" style=" height:250px; width:252px; font-family:Arial !important;"><div class="overview" style="text-align:justify; display:block;"><div>  This set of <b>bed sheets</b> contains <b>one double bed bed sheet</b> and a pair of <b>matching pillow covers</b> crafted with <b>100% cotton</b>. The bed sheet and pillow covers have <b>abstract design</b> on them. This set is brought to you by <b>House This Bed.</b><br/><br/><b>Features</b><ul style="margin-left: 20px;"><li type="disc"> <b>Brand</b>: House This Bed<br/></li><li type="disc"> <b>Category</b>: Bedsheets<br/></li><li type="disc"> <b>Colour</b>: Purple  White<br/></li><li type="disc"> <b>Material</b>: 100 %Cotton<br/></li><li type="disc"> <b>Pattern</b>: Abstract Prints<br/></li><li type="disc"> <b>Size of bed sheet (Length x Width in cms)</b>: 274x229<br/></li><li type="disc"> <b>Size of pillow cover (Length x Width in cms)</b>: 68x45 <br/></li><li type="disc"> <b>Content</b>: One double bed sheet and two pillow covers </li></ul><br/><b>Care Tips</b><br/>  Do not bleach or dry clean<br/>  Wash with like colours<br/>  Line dry<br/>  </div></div></div> </div>,,17:04:2014,
144712,house this green cotton double bed sheet,http://www.yebhi.com/online-shopping/home-furnishing.html?affint=home-topmenu,1899,Home Furnishings,bed-sheet,house-this,http://im6.ybndc.com/upload/144712/ProductRear634760600953546329.jpg,1899,,home and kitchen,http://www.yebhi.com/144712/PD/house-this-green-cotton-double-bed-sheet.htm,yebhi.com,House This Green Cotton - Double Bed Sheet Buy Online,House This Green Cotton - Double Bed Sheet  Best Price Rs 1899.00  EMI Rs 317 for 6 months FREE Shipping In Stock - Delivery in 9-12 Days,None,<div class="product_detail_columns tinyscrl" itemprop="description" style=""><div class="scrollbar" style="width:2px; height:250px; background:#9E9E9E;"><div class="track" style="width:2px;"><div class="thumb" style="width:6px;"><div class="end"> </div></div></div></div><div class="viewport" style=" height:250px; width:252px; font-family:Arial !important;"><div class="overview" style="text-align:justify; display:block;"><div>Add this <b> double bedsheet set </b> with <b> paisley prints in green and white colours </b> to your home furnishing collection. House This presents this bedsheet set crafted from <b> cotton material.</b><b>Features</b><ul style="margin-left: 20px;"><li type="disc"> <b>Brand:</b> House This</li><li type="disc"> <b>Category:</b> Bedsheet</li><li type="disc"><b>Type:</b> Double bedsheet set</li><li type="disc"><b>Material:</b> Cotton</li><li type="disc"><b>Colour:</b> Green  White</li><li type="disc"><b>Pattern:</b> Paisley prints </li><li type="disc"><b>Size of Bedsheet (Length x Width in cms):</b> 274 x 229</li><li type="disc"><b>Size of Pillow Cover (Length x Width in cms):</b> 68 x 45 </li><li type="disc"><b>Content:</b> One double bedsheet and two pillow covers</li></ul><b>Care Tips</b>  Do not bleach or dry clean. Wash with like colours. Line dry.  </div></div></div> </div>,,17:04:2014,
144706,House This Bed Sheet BS 232 B,http://www.yebhi.com/online-shopping/home-furnishing.html?affint=home-topmenu,1199,Home Furnishings,bed-sheet,house-this,http://im6.ybndc.com/upload/144706/ProductRear634752044580640000.jpg,1199,,home and kitchen,http://www.yebhi.com/144706/PD/House-This-Bed-Sheet-BS-232-B.htm,yebhi.com,House This Bed Sheet BS 232 B Buy Online,House This Bed Sheet BS 232 B  Best Price Rs 1199.00  EMI Rs 200 for 6 months FREE Shipping In Stock - Delivery in 9-12 Days,None,<div class="product_detail_columns tinyscrl" itemprop="description" style=""><div class="scrollbar" style="width:2px; height:250px; background:#9E9E9E;"><div class="track" style="width:2px;"><div class="thumb" style="width:6px;"><div class="end"> </div></div></div></div><div class="viewport" style=" height:250px; width:252px; font-family:Arial !important;"><div class="overview" style="text-align:justify; display:block;"><div><table 0"" 500"" cellpadding="" cellspacing="" width=""><tr><td 10"" style="" vertical-align:top"" width=""><strong>•</strong></td><td 130"" style="" vertical-align:top"" width=""><strong>Product Name</strong></td><td 50"" align="" center"" style="" vertical-align:top"" width="">:</td><td style="" vertical-align:top"">Single Bed Sheet Sets</td></tr><tr><td 10"" style="" vertical-align:top"" width=""><strong>•</strong></td><td style="" vertical-align:top""><strong>Material</strong></td><td align="" center"" style="" vertical-align:top"">:</td><td style="" vertical-align:top"">100% Cotton</td></tr><tr><td 10"" style="" vertical-align:top"" width=""><strong>•</strong></td><td style="" vertical-align:top""><strong>Size</strong></td><td align="" center"" style="" vertical-align:top"">:</td><td style="" vertical-align:top"">One Double Bed Sheet 150cm X 229cm<br/>  One Pillow Cover 45cm X 68cm</td></tr><tr><td 10"" style="" vertical-align:top"" width=""><strong>•</strong></td><td style="" vertical-align:top""><strong>Contents</strong></td><td align="" center"" style="" vertical-align:top"">:</td><td style="" vertical-align:top"">2pcs Set</td></tr><tr><td 10"" style="" vertical-align:top"" width=""><strong>•</strong></td><td style="" vertical-align:top""><strong>Detail of Contents</strong></td><td align="" center"" style="" vertical-align:top"">:</td><td style="" vertical-align:top"">One Double Bed Sheet<br/>  One Pillow Cover</td></tr><tr><td 10"" style="" vertical-align:top"" width=""><strong>•</strong></td><td style="" vertical-align:top""><strong>Wash Care &amp; Caution</strong></td><td align="" center"" style="" vertical-align:top"">:</td><td style="" vertical-align:top"">Wash at 40C at normal cycle<br/>  Wash dark colours seperately<br/>  Do not bleach<br/>  Warm iron<br/>  Tumble Dry Low<br/>  Do not dryclean<br/></td></tr></table>   </div></div></div> </div>,,17:04:2014,
144704,house this blue cotton double bed sheet,http://www.yebhi.com/online-shopping/home-furnishing.html?affint=home-topmenu,1899,Home Furnishings,bed-sheet,house-this,http://im6.ybndc.com/upload/144704/ProductRear634752044067400000.jpg,1899,,home and kitchen,http://www.yebhi.com/144704/PD/house-this-blue-cotton-double-bed-sheet.htm,yebhi.com,House This Blue Cotton - Double Bed Sheet Buy Online,House This Blue Cotton - Double Bed Sheet  Best Price Rs 1899.00  EMI Rs 317 for 6 months FREE Shipping In Stock - Delivery in 9-12 Days,None,<div class="product_detail_columns tinyscrl" itemprop="description" style=""><div class="scrollbar" style="width:2px; height:250px; background:#9E9E9E;"><div class="track" style="width:2px;"><div class="thumb" style="width:6px;"><div class="end"> </div></div></div></div><div class="viewport" style=" height:250px; width:252px; font-family:Arial !important;"><div class="overview" style="text-align:justify; display:block;"><div>    This set of <b>bed sheets</b> contains <b>one double bed bed sheet</b> and a pair of <b>matching pillow covers</b> crafted with <b>100% cotton</b>. The bed sheet and pillow covers have <b>abstract design</b> on them. This set is brought to you by <b>House This Bed.</b><br/><br/><b>Features</b><ul style="margin-left: 20px;"><li type="disc"> <b>Brand</b>: House This Bed<br/></li><li type="disc"> <b>Category</b>: Bedsheets<br/></li><li type="disc"> <b>Colour</b>: Blue  Yellow  White<br/></li><li type="disc"> <b>Material</b>: 100 %Cotton<br/></li><li type="disc"> <b>Pattern</b>: Abstract Prints<br/></li><li type="disc"> <b>Size of bed sheet (Length x Width in cms)</b>: 274x229<br/></li><li type="disc"> <b>Size of pillow cover (Length x Width in cms)</b>: 68x45 <br/></li><li type="disc"> <b>Content</b>: One double bed sheet and two pillow covers </li></ul><br/><b>Care Tips</b><br/>  Do not bleach or dry clean<br/>  Wash with like colours<br/>  Line dry<br/>  </div></div></div> </div>,,17:04:2014,
319930,house this white cotton double bed sheet,http://www.yebhi.com/online-shopping/home-furnishing.html?affint=home-topmenu,2199,Home Furnishings,bed-sheet,house-this,http://im6.ybndc.com/upload/319930/ProductRear635074174519168016.jpg,2199,,home and kitchen,http://www.yebhi.com/319930/PD/house-this-white-cotton-double-bed-sheet.htm,yebhi.com,House This White Cotton - Double Bed Sheet Buy Online,House This White Cotton - Double Bed Sheet  Best Price Rs 2199.00  EMI Rs 367 for 6 months FREE Shipping In Stock - Delivery in 9-12 Days,None,<div class="product_detail_columns tinyscrl" itemprop="description" style=""><div class="scrollbar" style="width:2px; height:250px; background:#9E9E9E;"><div class="track" style="width:2px;"><div class="thumb" style="width:6px;"><div class="end"> </div></div></div></div><div class="viewport" style=" height:250px; width:252px; font-family:Arial !important;"><div class="overview" style="text-align:justify; display:block;"><div>Add vibrance to your bedroom with this <b>peppy and beautiful bedsheet set from House This.</b> Crafted from the <b>soft material cotton </b> this excellent printed set with hues of pink  purple and green on a white background will give your bedroom a vibrant look. <br/><br/><b>Features</b><br/><ul style="margin-left: 20px;"><li type="disc">Material: Cotton<br/></li><li type="disc">Colour: White<br/></li><li type="disc">Pattern: Printed <br/></li><li type="disc">Content: One double bedsheet with two pillow covers<br/></li><li type="disc">Size of bedsheet (Length x Width in cms): 274 x 229 <br/><li type="disc">Size of pillow covers (Length x Width in cms): 45 x 68</li></li></ul><br/><b>Wash Care</b><br/>  Machine washable<br/> Do not Soak<br/> Cold Wash<br/> Dry in Shade </div></div></div> </div>,,17:04:2014,
144703,house this red cotton double bed sheet,http://www.yebhi.com/online-shopping/home-furnishing.html?affint=home-topmenu,1899,Home Furnishings,bed-sheet,house-this,http://im6.ybndc.com/upload/144703/ProductRear634752043804852000.jpg,1899,,home and kitchen,http://www.yebhi.com/144703/PD/house-this-red-cotton-double-bed-sheet.htm,yebhi.com,House This Red Cotton - Double Bed Sheet Buy Online,House This Red Cotton - Double Bed Sheet  Best Price Rs 1899.00  EMI Rs 317 for 6 months FREE Shipping In Stock - Delivery in 9-12 Days,None,<div class="product_detail_columns tinyscrl" itemprop="description" style=""><div class="scrollbar" style="width:2px; height:250px; background:#9E9E9E;"><div class="track" style="width:2px;"><div class="thumb" style="width:6px;"><div class="end"> </div></div></div></div><div class="viewport" style=" height:250px; width:252px; font-family:Arial !important;"><div class="overview" style="text-align:justify; display:block;"><div>Add this <b> double bedsheet set </b> with <b> contemporary prints in grey and red colours </b> to your home furnishing collection. House This presents this bedsheet set crafted from <b> cotton material.</b><b>Features</b><ul style="margin-left: 20px;"><li type="disc"> <b>Brand:</b> House This</li><li type="disc"> <b>Category:</b> Bedsheet</li><li type="disc"><b>Type:</b> Double bedsheet set</li><li type="disc"><b>Material:</b> Cotton</li><li type="disc"><b>Colour:</b> Grey  Red</li><li type="disc"><b>Pattern:</b> Contemporary prints </li><li type="disc"><b>Size of Bedsheet (Length x Width in cms):</b> 274 x 229 </li><li type="disc"><b>Size of Pillow Cover (Length x Width in cms):</b> 68 x 45 </li><li type="disc"><b>Content:</b> One double bedsheet and two pillow covers</li></ul><b>Care Tips</b>  Do not bleach or dry clean. Wash with like colours. Line dry.  </div></div></div> </div>,,17:04:2014,
96262,house this green cotton double bed sheet,http://www.yebhi.com/online-shopping/home-furnishing.html?affint=home-topmenu,1599,Home Furnishings,bed-sheet,house-this,http://im6.ybndc.com/upload/96262/ProductRear634601640227376922.jpg,1599,,home and kitchen,http://www.yebhi.com/96262/PD/house-this-green-cotton-double-bed-sheet.htm,yebhi.com,House This Green Cotton - Double Bed Sheet Buy Online,House This Green Cotton - Double Bed Sheet  Best Price Rs 1599.00  EMI Rs 267 for 6 months FREE Shipping In Stock - Delivery in 9-12 Days,None,<div class="product_detail_columns tinyscrl" itemprop="description" style=""><div class="scrollbar" style="width:2px; height:250px; background:#9E9E9E;"><div class="track" style="width:2px;"><div class="thumb" style="width:6px;"><div class="end"> </div></div></div></div><div class="viewport" style=" height:250px; width:252px; font-family:Arial !important;"><div class="overview" style="text-align:justify; display:block;"><div><table><tr><td><b>Colour</b></td><td>    </td><td>Green</td></tr><tr><td><b>Material</b></td><td>    </td><td>Cotton</td></tr><tr><td><b>Brands</b></td><td>    </td><td>House This</td></tr><tr><td><b>Departments</b></td><td>    </td><td>Home Furnishing</td></tr><tr><td><b>Category</b></td><td>    </td><td>Bed Sheet</td></tr><tr><td><b>Types</b></td><td>    </td><td>Double Bed Sheet</td></tr></table>Double Bedsheet Set<br>  Sheet Size- 90" X 108"<br>    Pillow Cover Size-  18" X 27"<br>  Contents- 3pcs<br>  Details of Contents- 1 Double bedsheet &amp; 2 Pillow covers<br>  </br></br></br></br></br></div></div></div> </div>,,17:04:2014,
144708,house this green cotton double bed sheet,http://www.yebhi.com/online-shopping/home-furnishing.html?affint=home-topmenu,1899,Home Furnishings,bed-sheet,house-this,http://im6.ybndc.com/upload/144708/ProductRear634752045153940000.jpg,1899,,home and kitchen,http://www.yebhi.com/144708/PD/house-this-green-cotton-double-bed-sheet.htm,yebhi.com,House This Green Cotton - Double Bed Sheet Buy Online,House This Green Cotton - Double Bed Sheet  Best Price Rs 1899.00  EMI Rs 317 for 6 months FREE Shipping In Stock - Delivery in 9-12 Days,None,<div class="product_detail_columns tinyscrl" itemprop="description" style=""><div class="scrollbar" style="width:2px; height:250px; background:#9E9E9E;"><div class="track" style="width:2px;"><div class="thumb" style="width:6px;"><div class="end"> </div></div></div></div><div class="viewport" style=" height:250px; width:252px; font-family:Arial !important;"><div class="overview" style="text-align:justify; display:block;"><div>   This set of <b>bed sheets</b> contains <b>one double bed bed sheet</b> and a pair of <b>matching pillow covers</b> crafted with <b>100% cotton</b>. The bed sheet and pillow covers have <b>abstract design</b> on them. This set is brought to you by <b>House This Bed.</b><br/><br/><b>Features</b><ul style="margin-left: 20px;"><li type="disc"> <b>Brand</b>: House This Bed<br/></li><li type="disc"> <b>Category</b>: Bedsheets<br/></li><li type="disc"> <b>Colour</b>: Green  White<br/></li><li type="disc"> <b>Material</b>: 100 %Cotton<br/></li><li type="disc"> <b>Pattern</b>: Abstract Prints<br/></li><li type="disc"> <b>Size of bed sheet (Length x Width in cms)</b>: 274x229<br/></li><li type="disc"> <b>Size of pillow cover (Length x Width in cms)</b>: 68x45 <br/></li><li type="disc"> <b>Content</b>: One double bed sheet and two pillow covers </li></ul><br/><b>Care Tips</b><br/>  Do not bleach or dry clean<br/>  Wash with like colours<br/>  Line dry<br/>  </div></div></div> </div>,,17:04:2014,
144697,house this red cotton double bed sheet,http://www.yebhi.com/online-shopping/home-furnishing.html?affint=home-topmenu,2299,Home Furnishings,bed-sheet,house-this,http://im6.ybndc.com/upload/144697/ProductRear634760599625977819.jpg,2299,,home and kitchen,http://www.yebhi.com/144697/PD/house-this-red-cotton-double-bed-sheet.htm,yebhi.com,House This Red Cotton - Double Bed Sheet Buy Online,House This Red Cotton - Double Bed Sheet  Best Price Rs 2299.00  EMI Rs 383 for 6 months FREE Shipping In Stock - Delivery in 9-12 Days,None,<div class="product_detail_columns tinyscrl" itemprop="description" style=""><div class="scrollbar" style="width:2px; height:250px; background:#9E9E9E;"><div class="track" style="width:2px;"><div class="thumb" style="width:6px;"><div class="end"> </div></div></div></div><div class="viewport" style=" height:250px; width:252px; font-family:Arial !important;"><div class="overview" style="text-align:justify; display:block;"><div> This set of <b>bed sheets</b> contains <b>one double bed bed sheet</b> and a pair of <b>matching pillow covers</b> crafted with <b>100% cotton</b>. The bed sheet and pillow covers have <b>abstract design</b> on them. This set is brought to you by <b>House This Bed.</b><br/><br/><b>Features</b><ul style="margin-left: 20px;"><li type="disc"> <b>Brand</b>: House This Bed<br/></li><li type="disc"> <b>Category</b>: Bedsheets<br/></li><li type="disc"> <b>Colour</b>: Orange  Brown  Green<br/></li><li type="disc"> <b>Material</b>: 100 %Cotton<br/></li><li type="disc"> <b>Pattern</b>: Abstract Prints<br/></li><li type="disc"> <b>Size of bed sheet (Length x Width in cms)</b>: 274x229<br/></li><li type="disc"> <b>Size of pillow cover (Length x Width in cms)</b>: 68x45 <br/></li><li type="disc"> <b>Content</b>: One double bed sheet and two pillow covers </li></ul><br/><b>Care Tips</b><br/>  Do not bleach or dry clean<br/>  Wash with like colours<br/>  Line dry<br/>  </div></div></div> </div>,,17:04:2014,
450481,house this cotton double bed sheet,http://www.yebhi.com/online-shopping/home-furnishing.html?affint=home-topmenu,2299,Home Furnishings,bed-sheet,house-this,http://im6.ybndc.com/upload/450481/ProductRear635254939457942000.jpg,2299,,home and kitchen,http://www.yebhi.com/450481/PD/house-this-cotton-double-bed-sheet.htm,yebhi.com,House This Cotton - Double Bed Sheet Buy Online,House This Cotton - Double Bed Sheet  Best Price Rs 2299.00  EMI Rs 383 for 6 months FREE Shipping In Stock - Delivery in 6-8 Days,None,<div class="product_detail_columns tinyscrl" itemprop="description" style=""><div class="scrollbar" style="width:2px; height:250px; background:#9E9E9E;"><div class="track" style="width:2px;"><div class="thumb" style="width:6px;"><div class="end"> </div></div></div></div><div class="viewport" style=" height:250px; width:252px; font-family:Arial !important;"><div class="overview" style="text-align:justify; display:block;"><div>1 DOUBLE BED SHEET AND 2 PILLOW COVERS.229X274  45X68 Cm Machine Wash 40 degrees. Normal Cycle. Do Not Bleach. Do not Tumble Dry. Warm Iron. Do not Dry Clean. Wash Dark Colours separately.  </div></div></div> </div>,,17:04:2014,
