144702,house this beige cotton double bed sheet,http://www.yebhi.com/online-shopping/home-furnishing.html?affint=home-topmenu,1999,Home Furnishings,bed-sheet,house-this,http://im6.ybndc.com/upload/144702/ProductRear634752043627324000.jpg,1999,,home and kitchen,http://www.yebhi.com/144702/PD/house-this-beige-cotton-double-bed-sheet.htm,yebhi.com,House This Beige Cotton - Double Bed Sheet Buy Online,House This Beige Cotton - Double Bed Sheet  Best Price Rs 1999.00  EMI Rs 333 for 6 months FREE Shipping In Stock - Delivery in 9-12 Days,None,<div class="product_detail_columns tinyscrl" itemprop="description" style=""><div class="scrollbar" style="width:2px; height:250px; background:#9E9E9E;"><div class="track" style="width:2px;"><div class="thumb" style="width:6px;"><div class="end"> </div></div></div></div><div class="viewport" style=" height:250px; width:252px; font-family:Arial !important;"><div class="overview" style="text-align:justify; display:block;"><div>  This set of <b>bed sheets</b> contains <b>one double bed bed sheet</b> and a pair of <b>matching pillow covers</b> crafted with <b>100% cotton</b>. The bed sheet and pillow covers have <b>contemporary prints</b> on them. This set is brought to you by <b>House This Bed.</b><br/><br/><b>Features</b><ul style="margin-left: 20px;"><li type="disc"> <b>Brand</b>: House This Bed<br/></li><li type="disc"> <b>Category</b>: Bedsheets<br/></li><li type="disc"> <b>Colour</b>: Yellow  Brown  Green<br/></li><li type="disc"> <b>Material</b>: 100 %Cotton<br/></li><li type="disc"> <b>Pattern</b>: Abstract Prints<br/></li><li type="disc"> <b>Size of bed sheet (Length x Width in cms)</b>: 274x229<br/></li><li type="disc"> <b>Size of pillow cover (Length x Width in cms)</b>: 68x45 <br/></li><li type="disc"> <b>Content</b>: One double bed sheet and two pillow covers </li></ul><br/><b>Care Tips</b><br/>  Do not bleach or dry clean<br/>  Wash with like colours<br/>  Line dry<br/>  </div></div></div> </div>,,17:04:2014,
259670,house this red cotton double bed sheet,http://www.yebhi.com/online-shopping/home-furnishing.html?affint=home-topmenu,1499,Home Furnishings,bed-sheet,house-this,http://im6.ybndc.com/upload/259670/ProductRear634928273310702000.jpg,1499,,home and kitchen,http://www.yebhi.com/259670/PD/house-this-red-cotton-double-bed-sheet.htm,yebhi.com,House This Red Cotton - Double Bed Sheet Buy Online,House This Red Cotton - Double Bed Sheet  Best Price Rs 1499.00  EMI Rs 250 for 6 months FREE Shipping In Stock - Delivery in 9-12 Days,None,<div class="product_detail_columns tinyscrl" itemprop="description" style=""><div class="scrollbar" style="width:2px; height:250px; background:#9E9E9E;"><div class="track" style="width:2px;"><div class="thumb" style="width:6px;"><div class="end"> </div></div></div></div><div class="viewport" style=" height:250px; width:252px; font-family:Arial !important;"><div class="overview" style="text-align:justify; display:block;"><div>Make your bedroom look <b>calm and peaceful</b> by spreading this bedsheet set by <b>House This.</b> In multishades of red and brown  this set features abstract print in striped pattern. This set contains a double bedsheet and two pillow covers.<b>Features</b><ul style="margin-left: 20px;"><li type="disc">Material: Cotton</li><li type="disc">Colour: Red  Brown</li><li type="disc">Pattern: Abstract</li><li type="disc">Contents: One double bed sheet and two pillow covers</li><li type="disc">Size of bedsheet (Length x Width in cms): 274x229</li><li type="disc">Size of pillow cover(Length x Width in cms): 69x45</li></ul><b>Care Tips</b>  Do not bleach or dry clean. Wash with like colours. Line dry.   </div></div></div> </div>,,17:04:2014,
259686,house this red cotton single bed sheet,http://www.yebhi.com/online-shopping/home-furnishing.html?affint=home-topmenu,1099,Home Furnishings,bed-sheet,house-this,http://im6.ybndc.com/upload/259686/ProductRear634928280624606000.jpg,1099,,home and kitchen,http://www.yebhi.com/259686/PD/house-this-red-cotton-single-bed-sheet.htm,yebhi.com,House This Red Cotton - Single Bed Sheet Buy Online,House This Red Cotton - Single Bed Sheet  Best Price Rs 1099.00  EMI Rs 183 for 6 months FREE Shipping In Stock - Delivery in 9-12 Days,None,<div class="product_detail_columns tinyscrl" itemprop="description" style=""><div class="scrollbar" style="width:2px; height:250px; background:#9E9E9E;"><div class="track" style="width:2px;"><div class="thumb" style="width:6px;"><div class="end"> </div></div></div></div><div class="viewport" style=" height:250px; width:252px; font-family:Arial !important;"><div class="overview" style="text-align:justify; display:block;"><div>Make your bedroom look <b>calm and peaceful</b> by spreading this bedsheet set by <b>House This.</b> In multishades of brown  this single bedsheet set features abstract print in striped pattern. This set contains a single bedsheet and one pillow cover.<b>Features</b><ul style="margin-left: 20px;"><li type="disc">Material: Cotton</li><li type="disc">Colour: Beige  Brown</li><li type="disc">Pattern: Abstract</li><li type="disc">Contents: One single bedsheet and one pillow cover</li><li type="disc">Size of bedsheet (Length x Width in cms): 150x229</li><li type="disc">Size of pillow cover(Length x Width in cms): 69x45</li></ul><b>Care Tips</b>  Do not bleach or dry clean. Wash with like colours. Line dry.   </div></div></div> </div>,,17:04:2014,
313784,house this beige pure cotton double bed sheet,http://www.yebhi.com/online-shopping/home-furnishing.html?affint=home-topmenu,1499,Home Furnishings,bed-sheet,house-this,http://im6.ybndc.com/upload/313784/ProductRear635065604491494127.jpg,1499,,home and kitchen,http://www.yebhi.com/313784/PD/house-this-beige-pure-cotton-double-bed-sheet.htm,yebhi.com,House This Beige - Pure Cotton Double Bed Sheet Buy Online,House This Beige - Pure Cotton Double Bed Sheet  Best Price Rs 1499.00  EMI Rs 250 for 6 months FREE Shipping In Stock - Delivery in 9-12 Days,None,<div class="product_detail_columns tinyscrl" itemprop="description" style=""><div class="scrollbar" style="width:2px; height:250px; background:#9E9E9E;"><div class="track" style="width:2px;"><div class="thumb" style="width:6px;"><div class="end"> </div></div></div></div><div class="viewport" style=" height:250px; width:252px; font-family:Arial !important;"><div class="overview" style="text-align:justify; display:block;"><div><li type="disc">Material: Cotton</li><li type="disc">Colour: BeigeRed</li><li type="disc"></li><li type="disc">Size: 225X274 45X69 cms</li><li type="disc">Number of pieces: 3</li><li type="disc">Content description: Double Bed Sheet Set</li><li type="disc">Wash care:Normal Machine Wash </li></div></div></div> </div>,,17:04:2014,
259668,house this blue cotton double bed sheet,http://www.yebhi.com/online-shopping/home-furnishing.html?affint=home-topmenu,1499,Home Furnishings,bed-sheet,house-this,http://im6.ybndc.com/upload/259668/ProductRear634928272915086000.jpg,1499,,home and kitchen,http://www.yebhi.com/259668/PD/house-this-blue-cotton-double-bed-sheet.htm,yebhi.com,House This Blue Cotton - Double Bed Sheet Buy Online,House This Blue Cotton - Double Bed Sheet  Best Price Rs 1499.00  EMI Rs 250 for 6 months FREE Shipping In Stock - Delivery in 9-12 Days,None,<div class="product_detail_columns tinyscrl" itemprop="description" style=""><div class="scrollbar" style="width:2px; height:250px; background:#9E9E9E;"><div class="track" style="width:2px;"><div class="thumb" style="width:6px;"><div class="end"> </div></div></div></div><div class="viewport" style=" height:250px; width:252px; font-family:Arial !important;"><div class="overview" style="text-align:justify; display:block;"><div>Welcome spring with this soothing and attractive bedsheet from House This. Made out of the <b>best quality of cotton</b>  this double bed sheet with complementing two pillow covers is a perfect addition to your bedroom. Sleep in style with this blue printed bedsheet.<br><br><b>Features</b><br>  Material: 100% Cotton<br>  Colour: Blue  Pattern: Contemporary<br>  Size of bed sheet: 229cm X 274cm <br>  Size of pillow cover: 45cm X 68cm <br>  Contents: 3 Pieces Set<br>  Details of Contents: One Double Bed Sheet and Two Pillow Covers<br><br><b>Wash and Care</b><br>Mild Wash<br>  Do not Bleach<br>  Tumble Dry   </br></br></br></br></br></br></br></br></br></br></br></br></br></div></div></div> </div>,,17:04:2014,
313782,house this blue pure cotton double bed sheet,http://www.yebhi.com/online-shopping/home-furnishing.html?affint=home-topmenu,1499,Home Furnishings,bed-sheet,house-this,http://im6.ybndc.com/upload/313782/ProductRear635065604278240760.jpg,1499,,home and kitchen,http://www.yebhi.com/313782/PD/house-this-blue-pure-cotton-double-bed-sheet.htm,yebhi.com,House This Blue - Pure Cotton Double Bed Sheet Buy Online,House This Blue - Pure Cotton Double Bed Sheet  Best Price Rs 1499.00  EMI Rs 250 for 6 months FREE Shipping In Stock - Delivery in 9-12 Days,None,<div class="product_detail_columns tinyscrl" itemprop="description" style=""><div class="scrollbar" style="width:2px; height:250px; background:#9E9E9E;"><div class="track" style="width:2px;"><div class="thumb" style="width:6px;"><div class="end"> </div></div></div></div><div class="viewport" style=" height:250px; width:252px; font-family:Arial !important;"><div class="overview" style="text-align:justify; display:block;"><div><li type="disc">Material: Cotton</li><li type="disc">Colour: Blue</li><li type="disc"></li><li type="disc">Size: 225X274  45X69 cms</li><li type="disc">Number of pieces: 3</li><li type="disc">Content description: Double Bed Sheet Set</li><li type="disc">Wash care:Normal Machine Wash </li></div></div></div> </div>,,17:04:2014,
76634,House This Bed Sheet BS 162 A,http://www.yebhi.com/online-shopping/home-furnishing.html?affint=home-topmenu,999,Home Furnishings,bed-sheet,house-this,http://im6.ybndc.com/upload/76634/ProductRear634613870389375851.jpg,999,,home and kitchen,http://www.yebhi.com/76634/PD/House-This-Bed-Sheet-BS-162-A.htm,yebhi.com,House This Bed Sheet BS 162 A Buy Online,House This Bed Sheet BS 162 A  Best Price Rs 999.00  EMI Rs 167 for 6 months FREE Shipping In Stock - Delivery in 13-17 Days,None,<div class="product_detail_columns tinyscrl" itemprop="description" style=""><div class="scrollbar" style="width:2px; height:250px; background:#9E9E9E;"><div class="track" style="width:2px;"><div class="thumb" style="width:6px;"><div class="end"> </div></div></div></div><div class="viewport" style=" height:250px; width:252px; font-family:Arial !important;"><div class="overview" style="text-align:justify; display:block;"><div>Graphic Flower  Double Bed Sheet And 2 Pillow Covers  60% Polyester 40% Cotton  Red&Black;  225X254   </div></div></div> </div>,,17:04:2014,
334433,house this beige cotton double bed sheet,http://www.yebhi.com/online-shopping/home-furnishing.html?affint=home-topmenu,1699,Home Furnishings,bed-sheet,house-this,http://im6.ybndc.com/upload/334433/ProductRear635107057982390000.jpg,1699,,home and kitchen,http://www.yebhi.com/334433/PD/house-this-beige-cotton-double-bed-sheet.htm,yebhi.com,House This Beige Cotton - Double Bed Sheet Buy Online,House This Beige Cotton - Double Bed Sheet  Best Price Rs 1699.00  EMI Rs 283 for 6 months FREE Shipping In Stock - Delivery in 9-12 Days,None,<div class="product_detail_columns tinyscrl" itemprop="description" style=""><div class="scrollbar" style="width:2px; height:250px; background:#9E9E9E;"><div class="track" style="width:2px;"><div class="thumb" style="width:6px;"><div class="end"> </div></div></div></div><div class="viewport" style=" height:250px; width:252px; font-family:Arial !important;"><div class="overview" style="text-align:justify; display:block;"><div>Add this <b> double bedsheet set </b> in <b> solid pattern </b> to your home furnishing collection. House This presents this bedsheet set in beige colour  crafted from <b> cotton material.</b><b>Features</b><ul style="margin-left: 20px;"><li type="disc"> <b>Brand:</b> House This</li><li type="disc"> <b>Category:</b> Bedsheet</li><li type="disc"><b>Type:</b> Double bedsheet set</li><li type="disc"><b>Material:</b> Cotton</li><li type="disc"><b>Colour:</b> Beige</li><li type="disc"><b>Pattern:</b> Solid pattern </li><li type="disc"><b>Size of Bedsheet (Length x Width in cms):</b> 274 x 229</li><li type="disc"><b>Size of Pillow Cover (Length x Width in cms):</b> 68 x 45 </li><li type="disc"><b>Content:</b> One double bedsheet and two pillow covers</li></ul><b>Care Tips</b>  Do not bleach or dry clean. Wash with like colours. Line dry.  </div></div></div> </div>,,17:04:2014,
313783,house this orange pure cotton double bed sheet,http://www.yebhi.com/online-shopping/home-furnishing.html?affint=home-topmenu,1499,Home Furnishings,bed-sheet,house-this,http://im6.ybndc.com/upload/313783/ProductRear635065604392901495.jpg,1499,,home and kitchen,http://www.yebhi.com/313783/PD/house-this-orange-pure-cotton-double-bed-sheet.htm,yebhi.com,House This Orange - Pure Cotton Double Bed Sheet Buy Online,House This Orange - Pure Cotton Double Bed Sheet  Best Price Rs 1499.00  EMI Rs 250 for 6 months FREE Shipping In Stock - Delivery in 9-12 Days,None,<div class="product_detail_columns tinyscrl" itemprop="description" style=""><div class="scrollbar" style="width:2px; height:250px; background:#9E9E9E;"><div class="track" style="width:2px;"><div class="thumb" style="width:6px;"><div class="end"> </div></div></div></div><div class="viewport" style=" height:250px; width:252px; font-family:Arial !important;"><div class="overview" style="text-align:justify; display:block;"><div><li type="disc">Material: Cotton</li><li type="disc">Colour: Orange</li><li type="disc"></li><li type="disc">Size: 225X274  45X69 cms</li><li type="disc">Number of pieces: 3</li><li type="disc">Content description: Double Bed Sheet Set</li><li type="disc">Wash care:Normal Machine Wash </li></div></div></div> </div>,,17:04:2014,
76631,House This Bed Sheet BS 176 B,http://www.yebhi.com/online-shopping/home-furnishing.html?affint=home-topmenu,2799,Home Furnishings,bed-sheet,house-this,http://im6.ybndc.com/upload/76631/ProductRear634550667763746000.jpg,2799,,home and kitchen,http://www.yebhi.com/76631/PD/House-This-Bed-Sheet-BS-176-B.htm,yebhi.com,House This Bed Sheet BS 176 B Buy Online,House This Bed Sheet BS 176 B  Best Price Rs 2799.00  EMI Rs 467 for 6 months FREE Shipping In Stock - Delivery in 13-17 Days,None,<div class="product_detail_columns tinyscrl" itemprop="description" style=""><div class="scrollbar" style="width:2px; height:250px; background:#9E9E9E;"><div class="track" style="width:2px;"><div class="thumb" style="width:6px;"><div class="end"> </div></div></div></div><div class="viewport" style=" height:250px; width:252px; font-family:Arial !important;"><div class="overview" style="text-align:justify; display:block;"><div><p style="text-align: justify; margin: 0px">You always want to have dainty and pretty bed sheets to sleep into. They make you feel at home because they are comfortable and convenient. If you are keen on having a floral bed sheet  then this one in a mustard colour is going to be you favourite. This is a striking designer bed sheet from House This that you would love to own. This is a luxurious bed linen item available from House This that speaks about your true style. This House This double bed sheet set can really boost up your interiors and reflect your smart lifestyle. This elite bed sheet has the interesting pattern which is aesthetically refined. This very adorable bed sheet is made with 100% cotton which makes it durable and comfortable. So you will feel good about sleeping in this pretty and cozy bed sheet. The graceful pattern coupled with the mesmerizing colour palette gives this bed sheet a unique aura. The pretty looking bed sheet is teeming with yellow rose flowers because of which it can really create a great impression. It imparts a warm glow to your room. You get the complimentary pillow covers with this remarkable bed sheet set. You can purchase this bed sheet from Yebhi.com.</p> </div></div></div> </div>,,17:04:2014,
76626,House This Bed Sheet BS 132 A,http://www.yebhi.com/online-shopping/home-furnishing.html?affint=home-topmenu,1899,Home Furnishings,bed-sheet,house-this,http://im6.ybndc.com/upload/76626/ProductRear634558641575202000.jpg,1899,,home and kitchen,http://www.yebhi.com/76626/PD/House-This-Bed-Sheet-BS-132-A.htm,yebhi.com,House This Bed Sheet BS 132 A Buy Online,House This Bed Sheet BS 132 A  Best Price Rs 1899.00  EMI Rs 317 for 6 months FREE Shipping In Stock - Delivery in 9-12 Days,None,<div class="product_detail_columns tinyscrl" itemprop="description" style=""><div class="scrollbar" style="width:2px; height:250px; background:#9E9E9E;"><div class="track" style="width:2px;"><div class="thumb" style="width:6px;"><div class="end"> </div></div></div></div><div class="viewport" style=" height:250px; width:252px; font-family:Arial !important;"><div class="overview" style="text-align:justify; display:block;"><div>In <b>multicolour </b> this <b>printed bedsheet set</b> will add colours to your kids room. Crafted with <b>cotton </b> this three piece set contains a double bedsheet and two pillow covers.<br/><br/><b>Features</b><ul style="margin-left: 20px;"><li type="disc"> <b>Brand</b>: House This Bed<br/></li><li type="disc"> <b>Category</b>: Bedsheets<br/></li><li type="disc"> <b>Colour</b>: Multicolour<br/></li><li type="disc"> <b>Material</b>: Cotton<br/></li><li type="disc"> <b>Pattern</b>: Printed<br/></li><li type="disc"> <b>Size of bed sheet (Length x Width in cms)</b>: 225 x 274<br/></li><li type="disc"> <b>Size of pillow covers (Length x Width in cms)</b>: 46 x 69<br/></li><li type="disc"> <b>Content</b>: One double bed sheet and two pillow covers </li></ul> <br/><b>Care Tips</b><br/>  Do not bleach or dry clean<br/>  Wash with like colours<br>  Line dry <br/> </br></div></div></div> </div>,,17:04:2014,
144713,House This Bed Sheet BS 200 B,http://www.yebhi.com/online-shopping/home-furnishing.html?affint=home-topmenu,1899,Home Furnishings,bed-sheet,house-this,http://im6.ybndc.com/upload/144713/ProductRear634760603312125448.jpg,1899,,home and kitchen,http://www.yebhi.com/144713/PD/House-This-Bed-Sheet-BS-200-B.htm,yebhi.com,House This Bed Sheet BS 200 B Buy Online,House This Bed Sheet BS 200 B  Best Price Rs 1899.00  EMI Rs 317 for 6 months FREE Shipping In Stock - Delivery in 13-17 Days,None,<div class="product_detail_columns tinyscrl" itemprop="description" style=""><div class="scrollbar" style="width:2px; height:250px; background:#9E9E9E;"><div class="track" style="width:2px;"><div class="thumb" style="width:6px;"><div class="end"> </div></div></div></div><div class="viewport" style=" height:250px; width:252px; font-family:Arial !important;"><div class="overview" style="text-align:justify; display:block;"><div><table 0"" 500"" cellpadding="" cellspacing="" width=""><tr><td 10"" style="" vertical-align:top"" width=""><strong>•</strong></td><td 130"" style="" vertical-align:top"" width=""><strong>Product Name</strong></td><td 50"" align="" center"" style="" vertical-align:top"" width="">:</td><td style="" vertical-align:top"">Double Bed Sheet Sets</td></tr><tr><td 10"" style="" vertical-align:top"" width=""><strong>•</strong></td><td style="" vertical-align:top""><strong>Material</strong></td><td align="" center"" style="" vertical-align:top"">:</td><td style="" vertical-align:top"">100% Cotton</td></tr><tr><td 10"" style="" vertical-align:top"" width=""><strong>•</strong></td><td style="" vertical-align:top""><strong>Size</strong></td><td align="" center"" style="" vertical-align:top"">:</td><td style="" vertical-align:top"">One Double Bed Sheet 229cm X 274cm<br/>  Two Pillow Cover 45cm X 68cm</td></tr><tr><td 10"" style="" vertical-align:top"" width=""><strong>•</strong></td><td style="" vertical-align:top""><strong>Contents</strong></td><td align="" center"" style="" vertical-align:top"">:</td><td style="" vertical-align:top"">3pcs Set</td></tr><tr><td 10"" style="" vertical-align:top"" width=""><strong>•</strong></td><td style="" vertical-align:top""><strong>Detail of Contents</strong></td><td align="" center"" style="" vertical-align:top"">:</td><td style="" vertical-align:top"">One Double Bed Sheet<br/>  Two Pillow Cover</td></tr><tr><td 10"" style="" vertical-align:top"" width=""><strong>•</strong></td><td style="" vertical-align:top""><strong>Wash Care &amp; Caution</strong></td><td align="" center"" style="" vertical-align:top"">:</td><td style="" vertical-align:top"">Wash at 40C at normal cycle<br/>  Wash dark colours seperately<br/>  Do not bleach<br/>  Warm iron<br/>  Tumble Dry Low<br/>  Do not dryclean<br/></td></tr></table>   </div></div></div> </div>,,17:04:2014,
76632,House This Bed Sheet BS 183 A,http://www.yebhi.com/online-shopping/home-furnishing.html?affint=home-topmenu,3099,Home Furnishings,bed-sheet,house-this,http://im6.ybndc.com/upload/76632/ProductRear634550668449990000.jpg,3099,,home and kitchen,http://www.yebhi.com/76632/PD/House-This-Bed-Sheet-BS-183-A.htm,yebhi.com,House This Bed Sheet BS 183 A Buy Online,House This Bed Sheet BS 183 A  Best Price Rs 3099.00  EMI Rs 517 for 6 months FREE Shipping In Stock - Delivery in 13-17 Days,None,<div class="product_detail_columns tinyscrl" itemprop="description" style=""><div class="scrollbar" style="width:2px; height:250px; background:#9E9E9E;"><div class="track" style="width:2px;"><div class="thumb" style="width:6px;"><div class="end"> </div></div></div></div><div class="viewport" style=" height:250px; width:252px; font-family:Arial !important;"><div class="overview" style="text-align:justify; display:block;"><div><p style="text-align: justify; margin: 0px">A pretty bed sheet set makes you feel good about yourself. When you go to bed after a hard dayâs work  a fresh bed sheet will make you cozy and comfortable. For this you want a bed sheet that has wonderful colours and one that has been made using quality material. Buy this dazzling green bed sheet set from House This for everything that you hope from a bed sheet set. House This brings you this unique bed spread which can reflect your true style with its marvelous designer look. The bed spread can enhance the beauty of your personal space. It has an enticing colour combination that adds to the grace of the bed sheet. The ravishing pattern of this bed sheet set can give you a luxurious feel. This special bed sheet set is especially designed to keep your house stylish and updated. It is made with the blend of polyester and cotton which gives it a nice finish. You get a set of two pillow covers with this double bed sheet. The ultra modern graphic flowers pattern is very fashionable. It comes in the standard size of 225X254. You can purchase this gorgeous House This double bed sheet set from Yebhi.com.</p> </div></div></div> </div>,,17:04:2014,
296919,house this yellow double bed sheet,http://www.yebhi.com/online-shopping/home-furnishing.html?affint=home-topmenu,999,Home Furnishings,bed-sheet,house-this,http://im6.ybndc.com/upload/296919/ProductRear635028497716935989.jpg,999,,home and kitchen,http://www.yebhi.com/296919/PD/house-this-yellow-double-bed-sheet.htm,yebhi.com,House This Yellow - Double Bed Sheet Buy Online,House This Yellow - Double Bed Sheet  Best Price Rs 999.00  EMI Rs 167 for 6 months FREE Shipping In Stock - Delivery in 9-12 Days,None,<div class="product_detail_columns tinyscrl" itemprop="description" style=""><div class="scrollbar" style="width:2px; height:250px; background:#9E9E9E;"><div class="track" style="width:2px;"><div class="thumb" style="width:6px;"><div class="end"> </div></div></div></div><div class="viewport" style=" height:250px; width:252px; font-family:Arial !important;"><div class="overview" style="text-align:justify; display:block;"><div>Make your room look fresh and vibrant by spreading this bright yellow coloured bedsheet. Add this bedsheet set from House This to your collection. It features a floral print allover on the bedsheet and pillow covers.<b>Features</b><ul style="margin-left: 20px;"><li type="disc">Material: Cotton</li><li type="disc">Colour: Green</li><li type="disc">Pattern: Floral</li><li type="disc">Contents: One double bedsheet and two pillow covers</li><li type="disc">Size of bedsheet (Length x Width in inches): 90x100</li><li type="disc">Size of pillow cover(Length x Width in inches): 17x27</li></ul><b>Care Tips</b>  Do not bleach or dry clean. Wash with like colours. Line dry.   </div></div></div> </div>,,17:04:2014,
