76629,House This Bed Sheet BS 178 B,http://www.yebhi.com/online-shopping/home-furnishing.html?affint=home-topmenu,2499,Home Furnishings,bed-sheet,house-this,http://im6.ybndc.com/upload/76629/ProductRear634550668228158000.jpg,2499,,home and kitchen,http://www.yebhi.com/76629/PD/House-This-Bed-Sheet-BS-178-B.htm,yebhi.com,House This Bed Sheet BS 178 B Buy Online,House This Bed Sheet BS 178 B  Best Price Rs 2499.00  EMI Rs 417 for 6 months FREE Shipping In Stock - Delivery in 9-12 Days,None,<div class="product_detail_columns tinyscrl" itemprop="description" style=""><div class="scrollbar" style="width:2px; height:250px; background:#9E9E9E;"><div class="track" style="width:2px;"><div class="thumb" style="width:6px;"><div class="end"> </div></div></div></div><div class="viewport" style=" height:250px; width:252px; font-family:Arial !important;"><div class="overview" style="text-align:justify; display:block;"><div>Grab this exclusive bedsheet set in white and yellow from <b>House This Bed .</b> In a <b>floral pattern </b> this bedsheet set contains a <b>double bedsheet and two pillow covers.</b> The set has been <b>crafted with cotton.</b><br/><br/><b>Features</b><ul style="margin-left: 20px;"><li type="disc"> <b>Brand</b>: House This Bed<br/></li><li type="disc"> <b>Category</b>: Bedsheets<br/></li><li type="disc"> <b>Colour</b>: White  Yellow<br/></li><li type="disc"> <b>Material</b>: Cotton<br/></li><li type="disc"> <b>Pattern</b>: Printed<br/></li><li type="disc"> <b>Size of bed sheet (Length x Width in cms)</b>: 229 x 274<br/></li><li type="disc"> <b>Size of pilllow covers (Length x Width in cms)</b>: 45 x 69<br/></li><li type="disc"> <b>Content</b>: One double bed sheet and two pillow covers </li></ul> <br/><b>Care Tips</b><br/>  Do not bleach or dry clean<br/>  Wash with like colours<br>  Line dry <br/> </br></div></div></div> </div>,,17:04:2014,
76633,house this beige cotton double bed sheet,http://www.yebhi.com/online-shopping/home-furnishing.html?affint=home-topmenu,3099,Home Furnishings,bed-sheet,house-this,http://im6.ybndc.com/upload/76633/ProductRear634550668679622000.jpg,3099,,home and kitchen,http://www.yebhi.com/76633/PD/house-this-beige-cotton-double-bed-sheet.htm,yebhi.com,House This Beige Cotton - Double Bed Sheet Buy Online,House This Beige Cotton - Double Bed Sheet  Best Price Rs 3099.00  EMI Rs 517 for 6 months FREE Shipping In Stock - Delivery in 9-12 Days,None,<div class="product_detail_columns tinyscrl" itemprop="description" style=""><div class="scrollbar" style="width:2px; height:250px; background:#9E9E9E;"><div class="track" style="width:2px;"><div class="thumb" style="width:6px;"><div class="end"> </div></div></div></div><div class="viewport" style=" height:250px; width:252px; font-family:Arial !important;"><div class="overview" style="text-align:justify; display:block;"><div>Add this <b> double bedsheet set </b> with <b> nature inspired  prints in beige and brown colours </b> to your home furnishing collection. House This presents this bedsheet set crafted from <b> cotton material.</b><b>Features</b><ul style="margin-left: 20px;"><li type="disc"> <b>Brand:</b> House This</li><li type="disc"> <b>Category:</b> Bedsheet</li><li type="disc"><b>Type:</b> Double bedsheet set</li><li type="disc"><b>Material:</b> Cotton</li><li type="disc"><b>Colour:</b> Beige  Brown</li><li type="disc"><b>Pattern:</b> Nature inspired prints </li><li type="disc"><b>Size of Bedsheet (Length x Width in cms):</b> 274 x 229 </li><li type="disc"><b>Content:</b> One double bedsheet and two pillow covers</li></ul><b>Care Tips</b>  Do not bleach or dry clean. Wash with like colours. Line dry.  </div></div></div> </div>,,17:04:2014,
259669,house this brown cotton double bed sheet,http://www.yebhi.com/online-shopping/home-furnishing.html?affint=home-topmenu,1499,Home Furnishings,bed-sheet,house-this,http://im6.ybndc.com/upload/259669/ProductRear634928273088090000.jpg,1499,,home and kitchen,http://www.yebhi.com/259669/PD/house-this-brown-cotton-double-bed-sheet.htm,yebhi.com,House This Brown Cotton - Double Bed Sheet Buy Online,House This Brown Cotton - Double Bed Sheet  Best Price Rs 1499.00  EMI Rs 250 for 6 months FREE Shipping In Stock - Delivery in 9-12 Days,None,<div class="product_detail_columns tinyscrl" itemprop="description" style=""><div class="scrollbar" style="width:2px; height:250px; background:#9E9E9E;"><div class="track" style="width:2px;"><div class="thumb" style="width:6px;"><div class="end"> </div></div></div></div><div class="viewport" style=" height:250px; width:252px; font-family:Arial !important;"><div class="overview" style="text-align:justify; display:block;"><div>Make your bedroom look <b>calm and peaceful</b> by spreading this bedsheet set by <b>House This.</b> In multishades of brown  this set features abstract print in striped pattern. This set contains a double bedsheet and two pillow covers.<b>Features</b><ul style="margin-left: 20px;"><li type="disc">Material: Cotton</li><li type="disc">Colour: Beige  Brown</li><li type="disc">Pattern: Abstract</li><li type="disc">Contents: One double bed sheet and two pillow covers</li><li type="disc">Size of bedsheet (Length x Width in cms): 274x229</li><li type="disc">Size of pillow cover(Length x Width in cms): 69x45</li></ul><b>Care Tips</b>  Do not bleach or dry clean. Wash with like colours. Line dry.   </div></div></div> </div>,,17:04:2014,
144696,house this yellow cotton double bed sheet,http://www.yebhi.com/online-shopping/home-furnishing.html?affint=home-topmenu,2299,Home Furnishings,bed-sheet,house-this,http://im6.ybndc.com/upload/144696/ProductRear634752041513524000.jpg,2299,,home and kitchen,http://www.yebhi.com/144696/PD/house-this-yellow-cotton-double-bed-sheet.htm,yebhi.com,House This Yellow Cotton - Double Bed Sheet Buy Online,House This Yellow Cotton - Double Bed Sheet  Best Price Rs 2299.00  EMI Rs 383 for 6 months FREE Shipping In Stock - Delivery in 9-12 Days,None,<div class="product_detail_columns tinyscrl" itemprop="description" style=""><div class="scrollbar" style="width:2px; height:250px; background:#9E9E9E;"><div class="track" style="width:2px;"><div class="thumb" style="width:6px;"><div class="end"> </div></div></div></div><div class="viewport" style=" height:250px; width:252px; font-family:Arial !important;"><div class="overview" style="text-align:justify; display:block;"><div>  This set of <b>bed sheets</b> contains <b>one double bed bed sheet</b> and a pair of <b>matching pillow covers</b> crafted with <b>cotton</b>. The bed sheet and pillow covers have <b>abstract <b><b>Design</b></b></b> on them. This set is brought to you by <b>House This Bed.</b><br/><br/><b>Features</b><ul style="margin-left: 20px;"><li type="disc"> <b><b>Brand</b></b>: House This Bed<br/></li><li type="disc"> <b><b><b>Category</b></b></b>: Bedsheets<br/></li><li type="disc"> <b><b><b>Colour</b></b></b>: White  Red  Blue<br/></li><li type="disc"> <b><b><b>Material</b></b></b>: Cotton<br/></li><li type="disc"> <b>Pattern</b>: Abstract Prints<br/></li><li type="disc"> <b>Size of bed sheet (Length x Width in cms)</b>: 274x229<br/></li><li type="disc"> <b>Size of pillow cover (Length x Width in cms)</b>: 68x45 <br/></li><li type="disc"> <b>Content</b>: One double bed sheet and two pillow covers </li></ul><br/><b>Care Tips</b><br/>  Do not bleach or dry clean<br/>  Wash with like <b><b>Colour</b></b>s<br/>  Line dry<br/> </div></div></div> </div>,,17:04:2014,
259684,house this brown cotton single bed sheet,http://www.yebhi.com/online-shopping/home-furnishing.html?affint=home-topmenu,1099,Home Furnishings,bed-sheet,house-this,http://im6.ybndc.com/upload/259684/ProductRear634928279570670000.jpg,1099,,home and kitchen,http://www.yebhi.com/259684/PD/house-this-brown-cotton-single-bed-sheet.htm,yebhi.com,House This Brown Cotton - Single Bed Sheet Buy Online,House This Brown Cotton - Single Bed Sheet  Best Price Rs 1099.00  EMI Rs 183 for 6 months FREE Shipping In Stock - Delivery in 9-12 Days,None,<div class="product_detail_columns tinyscrl" itemprop="description" style=""><div class="scrollbar" style="width:2px; height:250px; background:#9E9E9E;"><div class="track" style="width:2px;"><div class="thumb" style="width:6px;"><div class="end"> </div></div></div></div><div class="viewport" style=" height:250px; width:252px; font-family:Arial !important;"><div class="overview" style="text-align:justify; display:block;"><div>Create a comfortable yet stylish sleeping environment with this bedsheet from House This. <b>Constructed of cotton </b> this bedsheet is very <b>soft and will ensure you a good night's sleep.</b>. This sheet is <b>easy to maintain</b> and very durable. <br/><br/><b>Features</b><br/><ul style="margin-left: 20px;"><li """"disc""""""="" type="">Material: Cotton<br/></li><li type="disc">Colour: Brown<br/></li><li type="disc">Pattern: Contemporary<br/></li><li type="disc">Contents: 2 Pieces Set<br/></li><li type="disc">Details of Contents: One Bed Sheet  One Pillow Cover </li></ul><b>Wash and Care</b><br/>  Machine Wash<br/>  Donot Soak<br/>  Cold Wash<br/>  Dry in Shade </div></div></div> </div>,,17:04:2014,
334432,house this yellow cotton double bed sheet,http://www.yebhi.com/online-shopping/home-furnishing.html?affint=home-topmenu,1699,Home Furnishings,bed-sheet,house-this,http://im6.ybndc.com/upload/334432/ProductRear635107057886138000.jpg,1699,,home and kitchen,http://www.yebhi.com/334432/PD/house-this-yellow-cotton-double-bed-sheet.htm,yebhi.com,House This Yellow Cotton - Double Bed Sheet Buy Online,House This Yellow Cotton - Double Bed Sheet  Best Price Rs 1699.00  EMI Rs 283 for 6 months FREE Shipping In Stock - Delivery in 9-12 Days,None,<div class="product_detail_columns tinyscrl" itemprop="description" style=""><div class="scrollbar" style="width:2px; height:250px; background:#9E9E9E;"><div class="track" style="width:2px;"><div class="thumb" style="width:6px;"><div class="end"> </div></div></div></div><div class="viewport" style=" height:250px; width:252px; font-family:Arial !important;"><div class="overview" style="text-align:justify; display:block;"><div>Add this <b> double bedsheet set </b> in <b> solid pattern </b> to your home furnishing collection. House This presents this bedsheet set in yellow colour  crafted from <b> cotton material.</b><b>Features</b><ul style="margin-left: 20px;"><li type="disc"> <b>Brand:</b> House This</li><li type="disc"> <b>Category:</b> Bedsheet</li><li type="disc"><b>Type:</b> Double bedsheet set</li><li type="disc"><b>Material:</b> Cotton</li><li type="disc"><b>Colour:</b> Yellow</li><li type="disc"><b>Pattern:</b> Solid pattern </li><li type="disc"><b>Size of Bedsheet (Length x Width in cms):</b> 274 x 229</li><li type="disc"><b>Size of Pillow Cover (Length x Width in cms):</b> 68 x 45 </li><li type="disc"><b>Content:</b> One double bedsheet and two pillow covers</li></ul><b>Care Tips</b>  Do not bleach or dry clean. Wash with like colours. Line dry.  </div></div></div> </div>,,17:04:2014,
144725,House This Bed Sheet BS 165 A,http://www.yebhi.com/online-shopping/home-furnishing.html?affint=home-topmenu,1899,Home Furnishings,bed-sheet,house-this,http://im6.ybndc.com/upload/144725/ProductRear634766584730262682.jpg,1899,,home and kitchen,http://www.yebhi.com/144725/PD/House-This-Bed-Sheet-BS-165-A.htm,yebhi.com,House This Bed Sheet BS 165 A Buy Online,House This Bed Sheet BS 165 A  Best Price Rs 1899.00  EMI Rs 317 for 6 months FREE Shipping In Stock - Delivery in 9-12 Days,None,<div class="product_detail_columns tinyscrl" itemprop="description" style=""><div class="scrollbar" style="width:2px; height:250px; background:#9E9E9E;"><div class="track" style="width:2px;"><div class="thumb" style="width:6px;"><div class="end"> </div></div></div></div><div class="viewport" style=" height:250px; width:252px; font-family:Arial !important;"><div class="overview" style="text-align:justify; display:block;"><div>Grab this exclusive bedsheet set in white and black from <b>House This Bed .</b> In a <b>floral pattern </b> this bedsheet set contains a <b>double bedsheet and two pillow covers.</b> The set has been <b>crafted with cotton.</b><br/><br/><b>Features</b><ul style="margin-left: 20px;"><li type="disc"> <b>Brand</b>: House This Bed<br/></li><li type="disc"> <b>Category</b>: Bedsheets<br/></li><li type="disc"> <b>Colour</b>: White  Black<br/></li><li type="disc"> <b>Material</b>: Cotton<br/></li><li type="disc"> <b>Pattern</b>: Printed<br/></li><li type="disc"> <b>Size of bed sheet (Length x Width in cms)</b>: 229 x 274<br/></li><li type="disc"> <b>Size of pillow covers (Length x Width in cms)</b>: 45 x 69<br/></li><li type="disc"> <b>Content</b>: One double bed sheet and two pillow covers </li></ul> <br/><b>Care Tips</b><br/>  Do not bleach or dry clean<br/>  Wash with like colours<br>  Line dry <br/> </br></div></div></div> </div>,,17:04:2014,
296918,house this brown double bed sheet,http://www.yebhi.com/online-shopping/home-furnishing.html?affint=home-topmenu,999,Home Furnishings,bed-sheet,house-this,http://im6.ybndc.com/upload/296918/ProductRear635028497602587256.jpg,999,,home and kitchen,http://www.yebhi.com/296918/PD/house-this-brown-double-bed-sheet.htm,yebhi.com,House This Brown - Double Bed Sheet Buy Online,House This Brown - Double Bed Sheet  Best Price Rs 999.00  EMI Rs 167 for 6 months FREE Shipping In Stock - Delivery in 9-12 Days,None,<div class="product_detail_columns tinyscrl" itemprop="description" style=""><div class="scrollbar" style="width:2px; height:250px; background:#9E9E9E;"><div class="track" style="width:2px;"><div class="thumb" style="width:6px;"><div class="end"> </div></div></div></div><div class="viewport" style=" height:250px; width:252px; font-family:Arial !important;"><div class="overview" style="text-align:justify; display:block;"><div>Create a soothing environment at home by choosing this subtle bedsheet by <b>House This.</b> In an <b>brown and beige combination </b> this bedsheet set features floral prints all over. Order this to get a luxurious experience at an affordable price.<b>Features</b><ul style="margin-left: 20px;"><li type="disc">Material: Cotton  Polyester</li><li type="disc">Colour: Brown  Beige</li><li type="disc">Pattern: Floral </li><li type="disc"></li>Contents: One double bed sheet and two pillow covers<li type="disc">Size of bedsheet (Length x Width in cms): 274x229</li><li type="disc">Size of pillow cover(Length x Width in cms): 69x45</li></ul><b>Care Tips</b>  Do not bleach or dry clean. Wash with like colours. Line dry. </div></div></div> </div>,,17:04:2014,
259681,house this yellow cotton double bed sheet,http://www.yebhi.com/online-shopping/home-furnishing.html?affint=home-topmenu,1299,Home Furnishings,bed-sheet,house-this,http://im6.ybndc.com/upload/259681/ProductRear634928278686150000.jpg,1299,,home and kitchen,http://www.yebhi.com/259681/PD/house-this-yellow-cotton-double-bed-sheet.htm,yebhi.com,House This Yellow Cotton - Double Bed Sheet Buy Online,House This Yellow Cotton - Double Bed Sheet  Best Price Rs 1299.00  EMI Rs 217 for 6 months FREE Shipping in 2 Days,None,<div class="product_detail_columns tinyscrl" itemprop="description" style=""><div class="scrollbar" style="width:2px; height:250px; background:#9E9E9E;"><div class="track" style="width:2px;"><div class="thumb" style="width:6px;"><div class="end"> </div></div></div></div><div class="viewport" style=" height:250px; width:252px; font-family:Arial !important;"><div class="overview" style="text-align:justify; display:block;"><div>Brighten your bedroom with this <b>charming bed sheet set</b> from House This. The <b>excellent and vibrant floral prints in orange and yellow</b> will give a complete makeover to your bedroom. It is crafted from <b>cotton</b> and will give a <b>comfortable experience</b> after a long hectic day.<b>Features</b><ul style="margin-left: 20px;"><li type="disc">Material: Cotton</li><li type="disc">Colour: White  Orange  Yellow</li><li type="disc">Pattern: Floral prints</li><li type="disc">Content: One double bed cover and two pillow covers</li><li type="disc">Size of Bed Cover (Length x Width in cms): 275x225</li><li type="disc">Size of Pillow Cover (Length x Width in cms): 69x45</li></ul><b>Care Tips</b><br>  Do not bleach or dry clean.</br> Wash with like colours. Line dry.   </div></div></div> </div>,,17:04:2014,
144714,house this red cotton double bed sheet,http://www.yebhi.com/online-shopping/home-furnishing.html?affint=home-topmenu,1899,Home Furnishings,bed-sheet,house-this,http://im6.ybndc.com/upload/144714/ProductRear634760603643939575.jpg,1899,,home and kitchen,http://www.yebhi.com/144714/PD/house-this-red-cotton-double-bed-sheet.htm,yebhi.com,House This Red Cotton - Double Bed Sheet Buy Online,House This Red Cotton - Double Bed Sheet  Best Price Rs 1899.00  EMI Rs 317 for 6 months FREE Shipping In Stock - Delivery in 9-12 Days,None,<div class="product_detail_columns tinyscrl" itemprop="description" style=""><div class="scrollbar" style="width:2px; height:250px; background:#9E9E9E;"><div class="track" style="width:2px;"><div class="thumb" style="width:6px;"><div class="end"> </div></div></div></div><div class="viewport" style=" height:250px; width:252px; font-family:Arial !important;"><div class="overview" style="text-align:justify; display:block;"><div>Add this <b> double bedsheet set </b> with <b> paisley prints in beige and orange colours </b> to your home furnishing collection. House This presents this bedsheet set crafted from <b> cotton material.</b><b>Features</b><ul style="margin-left: 20px;"><li type="disc"> <b>Brand:</b> House This</li><li type="disc"> <b>Category:</b> Bedsheet</li><li type="disc"><b>Type:</b> Double bedsheet set</li><li type="disc"><b>Material:</b> Cotton</li><li type="disc"><b>Colour:</b> Beige  Orange</li><li type="disc"><b>Pattern:</b> Paisley prints </li><li type="disc"><b>Size of Bedsheet (Length x Width in cms):</b> 274 x 229 </li><li type="disc"><b>Size of Pillow Cover (Length x Width in cms):</b> 68 x 45 </li><li type="disc"><b>Content:</b> One double bedsheet and two pillow covers</li></ul><b>Care Tips</b>  Do not bleach or dry clean. Wash with like colours. Line dry.  </div></div></div> </div>,,17:04:2014,
144699,house this white cotton double bed sheet,http://www.yebhi.com/online-shopping/home-furnishing.html?affint=home-topmenu,2299,Home Furnishings,bed-sheet,house-this,http://im6.ybndc.com/upload/144699/ProductRear634752042472456000.jpg,2299,,home and kitchen,http://www.yebhi.com/144699/PD/house-this-white-cotton-double-bed-sheet.htm,yebhi.com,House This White Cotton - Double Bed Sheet Buy Online,House This White Cotton - Double Bed Sheet  Best Price Rs 2299.00  EMI Rs 383 for 6 months FREE Shipping In Stock - Delivery in 9-12 Days,None,<div class="product_detail_columns tinyscrl" itemprop="description" style=""><div class="scrollbar" style="width:2px; height:250px; background:#9E9E9E;"><div class="track" style="width:2px;"><div class="thumb" style="width:6px;"><div class="end"> </div></div></div></div><div class="viewport" style=" height:250px; width:252px; font-family:Arial !important;"><div class="overview" style="text-align:justify; display:block;"><div>  This set of <b>bed sheets</b> contains <b>one double bed bed sheet</b> and a pair of <b>matching pillow covers</b> crafted with <b>100% cotton</b>. The bed sheet and pillow covers have <b>abstract design</b> on them. This set is brought to you by <b>House This Bed.</b><br/><br/><b>Features</b><ul style="margin-left: 20px;"><li type="disc"> <b>Brand</b>: House This Bed<br/></li><li type="disc"> <b>Category</b>: Bedsheets<br/></li><li type="disc"> <b>Colour</b>: White  Orange  Grey<br/></li><li type="disc"> <b>Material</b>: 100 %Cotton<br/></li><li type="disc"> <b>Pattern</b>: Abstract Prints<br/></li><li type="disc"> <b>Size of bed sheet (Length x Width in cms)</b>: 274x229<br/></li><li type="disc"> <b>Size of pillow cover (Length x Width in cms)</b>: 68x45 <br/></li><li type="disc"> <b>Content</b>: One double bed sheet and two pillow covers </li></ul><br/><b>Care Tips</b><br/>  Do not bleach or dry clean<br/>  Wash with like colours<br/>  Line dry<br/>  </div></div></div> </div>,,17:04:2014,
76635,House This Bed Sheet BS 162 B,http://www.yebhi.com/online-shopping/home-furnishing.html?affint=home-topmenu,999,Home Furnishings,bed-sheet,house-this,http://im6.ybndc.com/upload/76635/ProductRear634613828993730496.jpg,999,,home and kitchen,http://www.yebhi.com/76635/PD/House-This-Bed-Sheet-BS-162-B.htm,yebhi.com,House This Bed Sheet BS 162 B Buy Online,House This Bed Sheet BS 162 B  Best Price Rs 999.00  EMI Rs 167 for 6 months FREE Shipping In Stock - Delivery in 13-17 Days,None,<div class="product_detail_columns tinyscrl" itemprop="description" style=""><div class="scrollbar" style="width:2px; height:250px; background:#9E9E9E;"><div class="track" style="width:2px;"><div class="thumb" style="width:6px;"><div class="end"> </div></div></div></div><div class="viewport" style=" height:250px; width:252px; font-family:Arial !important;"><div class="overview" style="text-align:justify; display:block;"><div>Graphic Flower  Double Bed Sheet And 2 Pillow Covers  60% Polyester 40% Cotton  Blue&Black;  225X254   </div></div></div> </div>,,17:04:2014,
259685,house this blue cotton single bed sheet,http://www.yebhi.com/online-shopping/home-furnishing.html?affint=home-topmenu,1099,Home Furnishings,bed-sheet,house-this,http://im6.ybndc.com/upload/259685/ProductRear634928279908566000.jpg,1099,,home and kitchen,http://www.yebhi.com/259685/PD/house-this-blue-cotton-single-bed-sheet.htm,yebhi.com,House This Blue Cotton - Single Bed Sheet Buy Online,House This Blue Cotton - Single Bed Sheet  Best Price Rs 1099.00  EMI Rs 183 for 6 months FREE Shipping In Stock - Delivery in 9-12 Days,None,<div class="product_detail_columns tinyscrl" itemprop="description" style=""><div class="scrollbar" style="width:2px; height:250px; background:#9E9E9E;"><div class="track" style="width:2px;"><div class="thumb" style="width:6px;"><div class="end"> </div></div></div></div><div class="viewport" style=" height:250px; width:252px; font-family:Arial !important;"><div class="overview" style="text-align:justify; display:block;"><div>Infuse a <b>fresh vibe in your room with this blue coloured</b> bedsheet set. The <b>floral prints in blue colour</b> will brighten up your room. It is crafted from the <b>superior quality cotton material</b> which will give a comfortable experience after a long hectic day.<b>Features</b><ul style="margin-left: 20px;"><li type="disc">Material: Cotton</li><li type="disc">Colour: White  Blue</li><li type="disc">Pattern: Floral</li><li type="disc">Contents: One single bedsheet and one pillow cover</li><li type="disc">Size of bedsheet (Length x Width in cms): 150x229</li><li type="disc">Size of pillow cover(Length x Width in cms): 69x45</li></ul><b>Care Tips</b>  Do not bleach or dry clean. Wash with like colours. Line dry.   </div></div></div> </div>,,17:04:2014,
