249035,trendy divva red women dresses,http://www.yebhi.com/online-shopping/women/apparels.html?affint=women-topmenu,2995,Clothing,dress,trendy-divva,http://im6.ybndc.com/upload/249035/ProductRear635049917412795357.jpg,2995,,Women,http://www.yebhi.com/249035/PD/trendy-divva-red-women-dresses.htm,yebhi.com,Trendy Divva Red Women - Dresses Buy Online,Trendy Divva Red Women - Dresses  Best Price Rs 2995.00  EMI Rs 499 for 6 months FREE Shipping In Stock - Delivery in 6-8 Days,XSSMLXL,<div class="product_detail_columns tinyscrl" itemprop="description" style=""><div class="scrollbar" style="width:2px; height:250px; background:#9E9E9E;"><div class="track" style="width:2px;"><div class="thumb" style="width:6px;"><div class="end"> </div></div></div></div><div class="viewport" style=" height:250px; width:252px; font-family:Arial !important;"><div class="overview" style="text-align:justify; display:block;"><div>This trendy one-shoulder dress by Trendy Divva will make you pick up your heels and step into a ramp with style. The dress features a ruffled one shoulder which is intricately embellished with sequins. The figure hugging silhouette will make you look even more charming and stylish. <b>Style Tip</b>Pair this dress with nude pumps and a statement clutch for an attractive appeal. <b>Material &amp; Care</b> Made of Cotton Gentle hand wash recommended Do not bleach or dry clean  Wash with like colours  Line Dry   </div></div></div> </div>,,16:04:2014,
438082,trendy divva grey georgette women dresses,http://www.yebhi.com/online-shopping/women/apparels.html?affint=women-topmenu,2347,Clothing,dress,trendy-divva,http://im6.ybndc.com/upload/438082/ProductRear635248017066504003.jpg,2995,,Women,http://www.yebhi.com/438082/PD/trendy-divva-grey-georgette-women-dresses.htm,yebhi.com,Trendy Divva Grey Georgette Women - Dresses Buy Online,Trendy Divva Grey Georgette Women - Dresses  Best Price Rs 2347.00 Best Discount 22% Off EMI Rs 391 for 6 months FREE Shipping In Stock - Delivery in 6-8 Days,MLXLXXL,<div class="product_detail_columns tinyscrl" itemprop="description" style=""><div class="scrollbar" style="width:2px; height:250px; background:#9E9E9E;"><div class="track" style="width:2px;"><div class="thumb" style="width:6px;"><div class="end"> </div></div></div></div><div class="viewport" style=" height:250px; width:252px; font-family:Arial !important;"><div class="overview" style="text-align:justify; display:block;"><div>Full Sleeve Embroided dress </div></div></div> </div>,,16:04:2014,
438057,trendy divva blue cotton women dresses,http://www.yebhi.com/online-shopping/women/apparels.html?affint=women-topmenu,3918,Clothing,dress,trendy-divva,http://im6.ybndc.com/upload/438057/ProductRear635248016956212003.jpg,4999,,Women,http://www.yebhi.com/438057/PD/trendy-divva-blue-cotton-women-dresses.htm,yebhi.com,Trendy Divva Blue Cotton Women - Dresses Buy Online,Trendy Divva Blue Cotton Women - Dresses  Best Price Rs 3918.00 Best Discount 22% Off EMI Rs 653 for 6 months FREE Shipping In Stock - Delivery in 6-8 Days,SML,<div class="product_detail_columns tinyscrl" itemprop="description" style=""><div class="scrollbar" style="width:2px; height:250px; background:#9E9E9E;"><div class="track" style="width:2px;"><div class="thumb" style="width:6px;"><div class="end"> </div></div></div></div><div class="viewport" style=" height:250px; width:252px; font-family:Arial !important;"><div class="overview" style="text-align:justify; display:block;"><div>Full Sleeve Casual Dress </div></div></div> </div>,,16:04:2014,
230941,trendy divva white women dresses,http://www.yebhi.com/online-shopping/women/apparels.html?affint=women-topmenu,2999,Clothing,dress,trendy-divva,http://im6.ybndc.com/upload/230941/ProductRear634857287334871431.jpg,2999,,Women,http://www.yebhi.com/230941/PD/trendy-divva-white-women-dresses.htm,yebhi.com,Trendy Divva White Women - Dresses Buy Online,Trendy Divva White Women - Dresses  Best Price Rs 2599.00 Best Discount 13% Off EMI Rs 433 for 6 months FREE Shipping in 2 Days,LXLXXL,<div class="product_detail_columns tinyscrl" itemprop="description" style=""><div class="scrollbar" style="width:2px; height:250px; background:#9E9E9E;"><div class="track" style="width:2px;"><div class="thumb" style="width:6px;"><div class="end"> </div></div></div></div><div class="viewport" style=" height:250px; width:252px; font-family:Arial !important;"><div class="overview" style="text-align:justify; display:block;"><div>Maintain your decency at the same time look modish in this tunic-style tight fit dress. The knee-length dress in white base comes with attractive print on it in cute shades. The dress has a stylish back and is sure to add to your style quotient. <b>Style Tip</b>A pair of pencil heel bellys with minimum make-up and elegant jewellery will look great with this dress<b>Material and Care</b>Made of PolyesterGentle hand or machine wash recommended.Do not soak  tumble dry or bleach   </div></div></div> </div>,,16:04:2014,
249068,trendy divva pink women dresses,http://www.yebhi.com/online-shopping/women/apparels.html?affint=women-topmenu,1999,Clothing,dress,trendy-divva,http://im6.ybndc.com/upload/249068/ProductRear634878023702092506.jpg,1999,,Women,http://www.yebhi.com/249068/PD/trendy-divva-pink-women-dresses.htm,yebhi.com,Trendy Divva Pink Women - Dresses Buy Online,Trendy Divva Pink Women - Dresses  Best Price Rs 1999.00  EMI Rs 333 for 6 months FREE Shipping In Stock - Delivery in 6-8 Days,MLXLXXLXXXL,<div class="product_detail_columns tinyscrl" itemprop="description" style=""><div class="scrollbar" style="width:2px; height:250px; background:#9E9E9E;"><div class="track" style="width:2px;"><div class="thumb" style="width:6px;"><div class="end"> </div></div></div></div><div class="viewport" style=" height:250px; width:252px; font-family:Arial !important;"><div class="overview" style="text-align:justify; display:block;"><div>Look pretty in this short dress from Trendy Divva. The simple yet stunning dress is available in pink colour and has a blue upper with floral prints on it. The lovely dress is perfect for casuak hang-outs and will keep you ahead of trend. Grab the affordable outfit right away!<br><br><b>Style Tip</b></br>Wear this dress with matching footwear and carry it with attitude to casual hang-outs..</br><br><b>Material &amp; Care</b></br>Made of PolyesterGentle hand wash or machine wash recommended.Do not tumble dry  scrub or bleachDry flat in shade </div></div></div> </div>,,16:04:2014,
291720,trendy divva red women dresses,http://www.yebhi.com/online-shopping/women/apparels.html?affint=women-topmenu,3999,Clothing,dress,trendy-divva,http://im6.ybndc.com/upload/291720/ProductRear635025141995276753.jpg,3999,,Women,http://www.yebhi.com/291720/PD/trendy-divva-red-women-dresses.htm,yebhi.com,Trendy Divva Red Women - Dresses Buy Online,Trendy Divva Red Women - Dresses  Best Price Rs 2089.00 Best Discount 48% Off EMI Rs 348 for 6 months FREE Shipping In Stock - Delivery in 6-8 Days,81014121618,<div class="product_detail_columns tinyscrl" itemprop="description" style=""><div class="scrollbar" style="width:2px; height:250px; background:#9E9E9E;"><div class="track" style="width:2px;"><div class="thumb" style="width:6px;"><div class="end"> </div></div></div></div><div class="viewport" style=" height:250px; width:252px; font-family:Arial !important;"><div class="overview" style="text-align:justify; display:block;"><div><table><tr><td><b>Colour</b></td><td>    </td><td>Grey   Red</td></tr><tr><td><b>For</b></td><td>    </td><td>Women</td></tr><tr><td><b>Material</b></td><td>    </td><td>Polyester</td></tr><tr><td><b>Brands</b></td><td>    </td><td>Trendy Divva</td></tr><tr><td><b>Departments</b></td><td>    </td><td>Apparels</td></tr><tr><td><b>Category</b></td><td>    </td><td>Dress</td></tr><tr><td><b>Types</b></td><td>    </td><td>Dresses</td></tr></table>  </div></div></div> </div>,,16:04:2014,
291732,trendy divva blue women dresses,http://www.yebhi.com/online-shopping/women/apparels.html?affint=women-topmenu,19999,Clothing,dress,trendy-divva,http://im6.ybndc.com/upload/291732/ProductRear635025178291561420.jpg,19999,,Women,http://www.yebhi.com/291732/PD/trendy-divva-blue-women-dresses.htm,yebhi.com,Trendy Divva Blue Women - Dresses Buy Online,Trendy Divva Blue Women - Dresses  Best Price Rs 19999.00  EMI Rs 3333 for 6 months FREE Shipping In Stock - Delivery in 6-8 Days,8101214,<div class="product_detail_columns tinyscrl" itemprop="description" style=""><div class="scrollbar" style="width:2px; height:250px; background:#9E9E9E;"><div class="track" style="width:2px;"><div class="thumb" style="width:6px;"><div class="end"> </div></div></div></div><div class="viewport" style=" height:250px; width:252px; font-family:Arial !important;"><div class="overview" style="text-align:justify; display:block;"><div><table><tr><td><b>Colour</b></td><td>    </td><td>Blue</td></tr><tr><td><b>For</b></td><td>    </td><td>Women</td></tr><tr><td><b>Material</b></td><td>    </td><td>Polyester</td></tr><tr><td><b>Brands</b></td><td>    </td><td>Trendy Divva</td></tr><tr><td><b>Departments</b></td><td>    </td><td>Apparels</td></tr><tr><td><b>Category</b></td><td>    </td><td>Dress</td></tr><tr><td><b>Types</b></td><td>    </td><td>Dresses</td></tr></table>  </div></div></div> </div>,,16:04:2014,
http://www.yebhi.com/online-shopping/deal-jeans/women/trouser.html?affint=women-topmenu&lc=Brands,http://www.yebhi.com/online-shopping/women/trouser.html?affint=women-topmenu&lc=Category,http://www.yebhi.com/online-shopping/women/apparels.html?affint=women-topmenu,492515,Clothing,dress,trendy-divva,deal jeans black georgette women capris,http://www.yebhi.com/492515/PD/deal-jeans-black-georgette-women-capris.htm,,Women,deal-jeans,yebhi.com,Deal Jeans Black Georgette Women - Capris Buy Online,Deal Jeans Black Georgette Women - Capris  Best Price Rs 1595.00  EMI Rs 266 for 6 months FREE Shipping in 2 Days,http://im6.ybndc.com/upload/492515/ProductRear635316164503090000.jpg,<div class="product_detail_columns tinyscrl" itemprop="description" style=""><div class="scrollbar" style="width:2px; height:250px; background:#9E9E9E;"><div class="track" style="width:2px;"><div class="thumb" style="width:6px;"><div class="end"> </div></div></div></div><div class="viewport" style=" height:250px; width:252px; font-family:Arial !important;"><div class="overview" style="text-align:justify; display:block;"><div>CAPRI </div></div></div> </div>,,16:04:2014,
438092,trendy divva pink women dresses,http://wwomen/apparels.html?affint=women-topmenu,1567,Clothing,dress,trendy-divva,http://im6.ybndc.com/upload/438092/ProductRear635248017125316003.jpg,1999,,Women,http://www.yebhi.com/438092/PD/trendy-divva-pink-women-dresses.htm,yebhi.com,Trendy Divva Pink Women - Dresses Buy Online,Trendy Divva Pink Women - Dresses  Best Price Rs 1567.00 Best Discount 22% Off EMI Rs 261 for 6 months FREE Shipping In Stock - Delivery in 6-8 Days,S,<div class="product_detail_columns tinyscrl" itemprop="description" style=""><div class="scrollbar" style="width:2px; height:250px; background:#9E9E9E;"><div class="track" style="width:2px;"><div class="thumb" style="width:6px;"><div class="end"> </div></div></div></div><div class="viewport" style=" height:250px; width:252px; font-family:Arial !important;"><div class="overview" style="text-align:justify; display:block;"><div>Half sleeve designer dress </div></div></div> </div>,,16:04:2014,
289155,trendy divva blue women dresses,http://www.yebhi.com/online-shopping/women/apparels.html?affint=women-topmenu,7499,Clothing,dress,trendy-divva,http://im6.ybndc.com/upload/289155/ProductRear635010315106703785.jpg,7499,,Women,http://www.yebhi.com/289155/PD/trendy-divva-blue-women-dresses.htm,yebhi.com,Trendy Divva Blue Women - Dresses Buy Online,Trendy Divva Blue Women - Dresses  Best Price Rs 3917.00 Best Discount 48% Off EMI Rs 653 for 6 months FREE Shipping In Stock - Delivery in 6-8 Days,681012,<div class="product_detail_columns tinyscrl" itemprop="description" style=""><div class="scrollbar" style="width:2px; height:250px; background:#9E9E9E;"><div class="track" style="width:2px;"><div class="thumb" style="width:6px;"><div class="end"> </div></div></div></div><div class="viewport" style=" height:250px; width:252px; font-family:Arial !important;"><div class="overview" style="text-align:justify; display:block;"><div>Flaunt your look with this dress from <b>Trendy Diva.</b> With a beautiful <b>sequin and floral embellishment   </b> the dress is sure to make you stand out in the crowd. <b>Made from soft and high quality fabric  </b> the dress ensures you comfort and relaxation.<br/><b>Features</b><ul style="margin-left: 20px;"><li type="disc">Fabric: Polyester</li><li type="disc">Pattern: Bead embellished</li><li type="disc">Colour: Blue</li><li type="disc">Sleeves: Sleeveless</li><li type="disc">Neck: V-neck</li><li type="disc">Length: Knee high</li><li type="disc">Style: Fitted bodice</li><li type="disc">Fit: Slim-fit</li></ul><b>Team it with</b> a pair of stilettos for a smart look. <b>Wash &amp; care</b>Wash with like colours.<br>Do not soak  tumble dry or bleach<br>Mild iron<br>Line dry </br></br></br></div></div></div> </div>,,16:04:2014,
438104,trendy divva red georgette women dresses,http://www.yebhi.com/online-shopping/women/apparels.html?affint=women-topmenu,3918,Clothing,dress,trendy-divva,http://im6.ybndc.com/upload/438104/ProductRear635248017185376003.jpg,4999,,Women,http://www.yebhi.com/438104/PD/trendy-divva-red-georgette-women-dresses.htm,yebhi.com,Trendy Divva Red Georgette Women - Dresses Buy Online,Trendy Divva Red Georgette Women - Dresses  Best Price Rs 3918.00 Best Discount 22% Off EMI Rs 653 for 6 months FREE Shipping In Stock - Delivery in 6-8 Days,MLXLXXL,<div class="product_detail_columns tinyscrl" itemprop="description" style=""><div class="scrollbar" style="width:2px; height:250px; background:#9E9E9E;"><div class="track" style="width:2px;"><div class="thumb" style="width:6px;"><div class="end"> </div></div></div></div><div class="viewport" style=" height:250px; width:252px; font-family:Arial !important;"><div class="overview" style="text-align:justify; display:block;"><div>Knee Length printed dress </div></div></div> </div>,,16:04:2014,
291739,trendy divva pink women jumpsuit,http://www.yebhi.com/online-shopping/women/apparels.html?affint=women-topmenu,4999,Clothing,dress,trendy-divva,http://im6.ybndc.com/upload/291739/ProductRear635025181734659491.jpg,4999,,Women,http://www.yebhi.com/291739/PD/trendy-divva-pink-women-jumpsuit.htm,yebhi.com,Trendy Divva Pink Women - Jumpsuit Buy Online,Trendy Divva Pink Women - Jumpsuit  Best Price Rs 4999.00  EMI Rs 833 for 6 months FREE Shipping in 2 Days,16,<div class="product_detail_columns tinyscrl" itemprop="description" style=""><div class="scrollbar" style="width:2px; height:250px; background:#9E9E9E;"><div class="track" style="width:2px;"><div class="thumb" style="width:6px;"><div class="end"> </div></div></div></div><div class="viewport" style=" height:250px; width:252px; font-family:Arial !important;"><div class="overview" style="text-align:justify; display:block;"><div><table><tr><td><b>Colour</b></td><td>    </td><td>Pink</td></tr><tr><td><b>For</b></td><td>    </td><td>Women</td></tr><tr><td><b>Material</b></td><td>    </td><td>Polyester</td></tr><tr><td><b>Brands</b></td><td>    </td><td>Trendy Divva</td></tr><tr><td><b>Departments</b></td><td>    </td><td>Apparels</td></tr><tr><td><b>Category</b></td><td>    </td><td>Dress</td></tr><tr><td><b>Types</b></td><td>    </td><td>Jumpsuit</td></tr></table>  </div></div></div> </div>,,16:04:2014,
229948,trendy divva pink women dresses,http://www.yebhi.com/online-shopping/women/apparels.html?affint=women-topmenu,14995,Clothing,dress,trendy-divva,http://im6.ybndc.com/upload/229948/ProductRear634854868604776242.jpg,14995,,Women,http://www.yebhi.com/229948/PD/trendy-divva-pink-women-dresses.htm,yebhi.com,Trendy Divva Pink Women - Dresses Buy Online,Trendy Divva Pink Women - Dresses  Best Price Rs 14995.00  EMI Rs 2499 for 6 months FREE Shipping in 2 Days,XXL,<div class="product_detail_columns tinyscrl" itemprop="description" style=""><div class="scrollbar" style="width:2px; height:250px; background:#9E9E9E;"><div class="track" style="width:2px;"><div class="thumb" style="width:6px;"><div class="end"> </div></div></div></div><div class="viewport" style=" height:250px; width:252px; font-family:Arial !important;"><div class="overview" style="text-align:justify; display:block;"><div>Accentuate your look with this exclusive dress from <b>Trendy Diva. </b> It is beautifully designed with <b>silver beads and has a frill feature. </b> The <b>off-shoulder </b>dress is <b>maxi length </b> and has a <b>flared hem </b> that makes it the perfect attire to be worn in parties. With our exclusive service of <b>Try &amp; Buy  </b>you can check its fit and size at the comfort of your home.<br/><b>Features</b><ul style="margin-left: 20px;"><li type="disc">Fabric: Polyester</li><li type="disc">Pattern: Bead embellished</li> <li type="disc">Colour: Pink</li><li type="disc">Neck: Off-shoulder</li><li type="disc">Style: Fitted bodice</li><li type="disc">Length: Maxi length</li><li type="disc">Fit: Slim fit<br/></li></ul><b>Team it with</b> a pair of stilettos for an elegant look. <b>Wash &amp; care</b>Wash with like colours.<br>Do not soak  tumble dry or bleach<br>Mild iron<br>Line dry</br><br><b>Note: </b> There may be a slight colour variation in the image from original product   </br></br></br></div></div></div> </div>,,16:04:2014,
249034,trendy divva black women dresses,http://www.yebhi.com/online-shopping/women/apparels.html?affint=women-topmenu,2995,Clothing,dress,trendy-divva,http://im6.ybndc.com/upload/249034/ProductRear634877309278820899.jpg,2995,,Women,http://www.yebhi.com/249034/PD/trendy-divva-black-women-dresses.htm,yebhi.com,Trendy Divva Black Women - Dresses Buy Online,Trendy Divva Black Women - Dresses  Best Price Rs 1564.00 Best Discount 48% Off EMI Rs 261 for 6 months FREE Shipping in 2 Days,SMXXLXXXL,<div class="product_detail_columns tinyscrl" itemprop="description" style=""><div class="scrollbar" style="width:2px; height:250px; background:#9E9E9E;"><div class="track" style="width:2px;"><div class="thumb" style="width:6px;"><div class="end"> </div></div></div></div><div class="viewport" style=" height:250px; width:252px; font-family:Arial !important;"><div class="overview" style="text-align:justify; display:block;"><div>Get  set for the party mood and look your best next time when you are planning to go for some hang-out or an evening function. This black coloured off-one shoulder one-piece  above the knee-length dress is sure to give you a hot diva like look. Grab the excluve dress right away to get that hot and sexy look for yourself.<b>Style Tip</b>Wear it with classy bellies and hold a flimsy clutch for that perfect look.<b>Material and Care</b>Made of PolyesterDo not bleach or dry cleanWash with like coloursLine dry </div></div></div> </div>,,16:04:2014,
438072,trendy divva grey women dresses,http://www.yebhi.com/online-shopping/women/apparels.html?affint=women-topmenu,1955,Clothing,dress,trendy-divva,http://im6.ybndc.com/upload/438072/ProductRear635248017023760003.jpg,2495,,Women,http://www.yebhi.com/438072/PD/trendy-divva-grey-women-dresses.htm,yebhi.com,Trendy Divva Grey Women - Dresses Buy Online,Trendy Divva Grey Women - Dresses  Best Price Rs 1955.00 Best Discount 22% Off EMI Rs 326 for 6 months FREE Shipping In Stock - Delivery in 6-8 Days,SMLXLXXLXXXL,<div class="product_detail_columns tinyscrl" itemprop="description" style=""><div class="scrollbar" style="width:2px; height:250px; background:#9E9E9E;"><div class="track" style="width:2px;"><div class="thumb" style="width:6px;"><div class="end"> </div></div></div></div><div class="viewport" style=" height:250px; width:252px; font-family:Arial !important;"><div class="overview" style="text-align:justify; display:block;"><div>Mega sleeve printed grey Dress </div></div></div> </div>,,16:04:2014,
249031,trendy divva red women cotton dresses,http://www.yebhi.com/online-shopping/women/apparels.html?affint=women-topmenu,3995,Clothing,dress,trendy-divva,http://im6.ybndc.com/upload/249031/ProductRear634877308208810040.jpg,3995,,Women,http://www.yebhi.com/249031/PD/trendy-divva-red-women-cotton-dresses.htm,yebhi.com,Trendy Divva Red Women Cotton - Dresses Buy Online,Trendy Divva Red Women Cotton - Dresses  Best Price Rs 2086.00 Best Discount 48% Off EMI Rs 348 for 6 months FREE Shipping In Stock - Delivery in 18-21 Days,MLXL,<div class="product_detail_columns tinyscrl" itemprop="description" style=""><div class="scrollbar" style="width:2px; height:250px; background:#9E9E9E;"><div class="track" style="width:2px;"><div class="thumb" style="width:6px;"><div class="end"> </div></div></div></div><div class="viewport" style=" height:250px; width:252px; font-family:Arial !important;"><div class="overview" style="text-align:justify; display:block;"><div><table><tr><td><b>Colour</b></td><td>    </td><td>Black   Red</td></tr><tr><td><b>For</b></td><td>    </td><td>Women</td></tr><tr><td><b>Material</b></td><td>    </td><td>Cotton</td></tr><tr><td><b>Brands</b></td><td>    </td><td>Trendy Divva</td></tr><tr><td><b>Departments</b></td><td>    </td><td>Apparels</td></tr><tr><td><b>Category</b></td><td>    </td><td>Dress</td></tr><tr><td><b>Types</b></td><td>    </td><td>Dresses</td></tr></table>  </div></div></div> </div>,,16:04:2014,
438089,trendy divva silver women dresses,http://www.yebhi.com/online-shopping/women/apparels.html?affint=women-topmenu,5877,Clothing,dress,trendy-divva,http://im6.ybndc.com/upload/438089/ProductRear635248017108312003.jpg,7499,,Women,http://www.yebhi.com/438089/PD/trendy-divva-silver-women-dresses.htm,yebhi.com,Trendy Divva Silver Women - Dresses Buy Online,Trendy Divva Silver Women - Dresses  Best Price Rs 5877.00 Best Discount 22% Off EMI Rs 980 for 6 months FREE Shipping In Stock - Delivery in 6-8 Days,SML,<div class="product_detail_columns tinyscrl" itemprop="description" style=""><div class="scrollbar" style="width:2px; height:250px; background:#9E9E9E;"><div class="track" style="width:2px;"><div class="thumb" style="width:6px;"><div class="end"> </div></div></div></div><div class="viewport" style=" height:250px; width:252px; font-family:Arial !important;"><div class="overview" style="text-align:justify; display:block;"><div>Knee Length Silver Party wear dress </div></div></div> </div>,,16:04:2014,
249080,trendy divva pink women dresses,http://www.yebhi.com/online-shopping/women/apparels.html?affint=women-topmenu,3499,Clothing,dress,trendy-divva,http://im6.ybndc.com/upload/249080/ProductRear634878149186659748.jpg,3499,,Women,http://www.yebhi.com/249080/PD/trendy-divva-pink-women-dresses.htm,yebhi.com,Trendy Divva Pink Women - Dresses Buy Online,Trendy Divva Pink Women - Dresses  Best Price Rs 1827.00 Best Discount 48% Off EMI Rs 305 for 6 months FREE Shipping In Stock - Delivery in 18-21 Days,XSSMLXL,<div class="product_detail_columns tinyscrl" itemprop="description" style=""><div class="scrollbar" style="width:2px; height:250px; background:#9E9E9E;"><div class="track" style="width:2px;"><div class="thumb" style="width:6px;"><div class="end"> </div></div></div></div><div class="viewport" style=" height:250px; width:252px; font-family:Arial !important;"><div class="overview" style="text-align:justify; display:block;"><div><table><tr><td><b>Colour</b></td><td>    </td><td>Pink</td></tr><tr><td><b>For</b></td><td>    </td><td>Women</td></tr><tr><td><b>Material</b></td><td>    </td><td>Polyester</td></tr><tr><td><b>Brands</b></td><td>    </td><td>Trendy Divva</td></tr><tr><td><b>Departments</b></td><td>    </td><td>Apparels</td></tr><tr><td><b>Category</b></td><td>    </td><td>Dress</td></tr><tr><td><b>Types</b></td><td>    </td><td>Dresses</td></tr></table>  </div></div></div> </div>,,16:04:2014,
249089,trendy divva blue women dresses,http://www.yebhi.com/online-shopping/women/apparels.html?affint=women-topmenu,3495,Clothing,dress,trendy-divva,http://im6.ybndc.com/upload/249089/ProductRear634878151789692434.jpg,3495,,Women,http://www.yebhi.com/249089/PD/trendy-divva-blue-women-dresses.htm,yebhi.com,Trendy Divva Blue Women - Dresses Buy Online,Trendy Divva Blue Women - Dresses  Best Price Rs 1825.00 Best Discount 48% Off EMI Rs 304 for 6 months FREE Shipping In Stock - Delivery in 6-8 Days,SMLXLXXLXXXL,<div class="product_detail_columns tinyscrl" itemprop="description" style=""><div class="scrollbar" style="width:2px; height:250px; background:#9E9E9E;"><div class="track" style="width:2px;"><div class="thumb" style="width:6px;"><div class="end"> </div></div></div></div><div class="viewport" style=" height:250px; width:252px; font-family:Arial !important;"><div class="overview" style="text-align:justify; display:block;"><div>This uber-stylish and glamorous one-piece dress from Trendy Divva is sure to give you a classy and modish look. The gorgeous dress in shiny self printed polyester fabric comes in a royal blue colour and has a designer neckstyle for that fashionable look. The plain dress is just enough to give you an extra-ordinary and elegant look. Grab the exclusive piece right away for your wardrobe.<br><br><b>Style Tip</b></br> Go for high-heeled bellys and accessorize minimum for an elegant look.<br><br><b>Material &amp; Care</b></br>Made of Polyester</br>Do not bleach  iron  dry clean</br>Do not tumble dry  scrub or bleachDry flat in shade </div></div></div> </div>,,16:04:2014,
