289152,trendy divva red women dresses,http://www.yebhi.com/online-shopping/women/apparels.html?affint=women-topmenu,3999,Clothing,dress,trendy-divva,http://im6.ybndc.com/upload/289152/ProductRear635010314366167038.jpg,3999,,Women,http://www.yebhi.com/289152/PD/trendy-divva-red-women-dresses.htm,yebhi.com,Trendy Divva Red Women - Dresses Buy Online,Trendy Divva Red Women - Dresses  Best Price Rs 2089.00 Best Discount 48% Off EMI Rs 348 for 6 months FREE Shipping In Stock - Delivery in 6-8 Days,81018121614,<div class="product_detail_columns tinyscrl" itemprop="description" style=""><div class="scrollbar" style="width:2px; height:250px; background:#9E9E9E;"><div class="track" style="width:2px;"><div class="thumb" style="width:6px;"><div class="end"> </div></div></div></div><div class="viewport" style=" height:250px; width:252px; font-family:Arial !important;"><div class="overview" style="text-align:justify; display:block;"><div>You will definitely make heads turn when you don yourself in this dress from <b> Trendy Diva. </b> The <b>crossover-V-neck and the ruched detail  </b> will add a spark to your look. <b> Made from soft and high quality fabric  </b> the dress will keep you comfortable all day long.<br/><b>Features</b><ul style="margin-left: 20px;"><li type="disc">Fabric: Polyester</li><li type="disc">Pattern: Solid</li><li type="disc">Colour: Red</li><li type="disc">Sleeves: Long butterfly sleeve</li><li type="disc">Neck: Crossover V-neck</li><li type="disc">Length: Knee high</li><li type="disc">Style: Fitted bodice</li><li type="disc">Fit: Slim-fit</li></ul><b>Team it with</b> a pair of stilettos for a smart look. <b>Wash &amp; care</b>Wash with like colours.<br>Do not soak  tumble dry or bleach<br>Mild iron<br>Line dry </br></br></br></div></div></div> </div>,,16:04:2014,
230937,trendy divva red women dresses,http://www.yebhi.com/online-shopping/women/apparels.html?affint=women-topmenu,4999,Clothing,dress,trendy-divva,http://im6.ybndc.com/upload/230937/ProductRear634857286491686026.jpg,4999,,Women,http://www.yebhi.com/230937/PD/trendy-divva-red-women-dresses.htm,yebhi.com,Trendy Divva Red Women - Dresses Buy Online,Trendy Divva Red Women - Dresses  Best Price Rs 2611.00 Best Discount 48% Off EMI Rs 435 for 6 months FREE Shipping In Stock - Delivery in 6-8 Days,SMLXLXXL,<div class="product_detail_columns tinyscrl" itemprop="description" style=""><div class="scrollbar" style="width:2px; height:250px; background:#9E9E9E;"><div class="track" style="width:2px;"><div class="thumb" style="width:6px;"><div class="end"> </div></div></div></div><div class="viewport" style=" height:250px; width:252px; font-family:Arial !important;"><div class="overview" style="text-align:justify; display:block;"><div>Look cute and chic by going for this extremely sweet and attractive flowy dress that is done with big and small floral prints on its alternative patches. The pretty colours  appealing patterns and soft fabric makes this dress a right choice for every style-conscious woman.The thin straps  broad neckline and above the knee length dress will give you a perfect sensuous look.<br><br><b>Style Tip</b></br> Wear it with chic strapped sandals for a perfect look.<br><br><b>Material &amp; Care</b></br>Made of Polyester</br>Gentle hand or machine wash with gentle detergent recommended.</br>Do not bleach  iron  dry cleanDry Clean only </div></div></div> </div>,,16:04:2014,
289160,trendy divva pink women dresses,http://www.yebhi.com/online-shopping/women/apparels.html?affint=women-topmenu,3999,Clothing,dress,trendy-divva,http://im6.ybndc.com/upload/289160/ProductRear635010316535360943.jpg,3999,,Women,http://www.yebhi.com/289160/PD/trendy-divva-pink-women-dresses.htm,yebhi.com,Trendy Divva Pink Women - Dresses Buy Online,Trendy Divva Pink Women - Dresses  Best Price Rs 2089.00 Best Discount 48% Off EMI Rs 348 for 6 months FREE Shipping In Stock - Delivery in 6-8 Days,810121416,<div class="product_detail_columns tinyscrl" itemprop="description" style=""><div class="scrollbar" style="width:2px; height:250px; background:#9E9E9E;"><div class="track" style="width:2px;"><div class="thumb" style="width:6px;"><div class="end"> </div></div></div></div><div class="viewport" style=" height:250px; width:252px; font-family:Arial !important;"><div class="overview" style="text-align:justify; display:block;"><div>Create a distinctive look in this dress from <b>Trendy Diva.</b> With a <b>crossover V-neck and bright pink colour </b> the dress will set you apart in the crowd. <b>Made from soft and high quality fabric  </b> the outfit will keep you comfy all day long.<br/><b>Features</b><ul style="margin-left: 20px;"><li type="disc">Fabric: Polyester</li><li type="disc">Pattern: Solid</li><li type="disc">Colour: Pink</li><li type="disc">Sleeves: Sleeveless</li><li type="disc">Neck: Crossover V-neck</li><li type="disc">Length: Knee high</li><li type="disc">Style: Fitted bodice</li><li type="disc">Fit: Regular fit</li></ul><b>Team it with</b> a pair of stilettos for a smart look. <b>Wash &amp; care</b>Wash with like colours.<br>Do not soak  tumble dry or bleach<br>Mild iron<br>Line dry </br></br></br></div></div></div> </div>,,16:04:2014,
438108,trendy divva brown chiffon women dresses,http://www.yebhi.com/online-shopping/women/apparels.html?affint=women-topmenu,3918,Clothing,dress,trendy-divva,http://im6.ybndc.com/upload/438108/ProductRear635248017203784003.jpg,4999,,Women,http://www.yebhi.com/438108/PD/trendy-divva-brown-chiffon-women-dresses.htm,yebhi.com,Trendy Divva Brown Chiffon Women - Dresses Buy Online,Trendy Divva Brown Chiffon Women - Dresses  Best Price Rs 3918.00 Best Discount 22% Off EMI Rs 653 for 6 months FREE Shipping In Stock - Delivery in 6-8 Days,SMLXLXXL,<div class="product_detail_columns tinyscrl" itemprop="description" style=""><div class="scrollbar" style="width:2px; height:250px; background:#9E9E9E;"><div class="track" style="width:2px;"><div class="thumb" style="width:6px;"><div class="end"> </div></div></div></div><div class="viewport" style=" height:250px; width:252px; font-family:Arial !important;"><div class="overview" style="text-align:justify; display:block;"><div>Party wear printed Dress </div></div></div> </div>,,16:04:2014,
438083,trendy divva black women jumpsuit,http://www.yebhi.com/online-shopping/women/apparels.html?affint=women-topmenu,3918,Clothing,dress,trendy-divva,http://im6.ybndc.com/upload/438083/ProductRear635248017072744003.jpg,4999,,Women,http://www.yebhi.com/438083/PD/trendy-divva-black-women-jumpsuit.htm,yebhi.com,Trendy Divva Black Women - Jumpsuit Buy Online,Trendy Divva Black Women - Jumpsuit  Best Price Rs 3918.00 Best Discount 22% Off EMI Rs 653 for 6 months FREE Shipping In Stock - Delivery in 6-8 Days,SMLXL4XL,<div class="product_detail_columns tinyscrl" itemprop="description" style=""><div class="scrollbar" style="width:2px; height:250px; background:#9E9E9E;"><div class="track" style="width:2px;"><div class="thumb" style="width:6px;"><div class="end"> </div></div></div></div><div class="viewport" style=" height:250px; width:252px; font-family:Arial !important;"><div class="overview" style="text-align:justify; display:block;"><div>Half sleeve casual jumpsuit </div></div></div> </div>,,16:04:2014,
229877,trendy divva red women dresses,http://www.yebhi.com/online-shopping/women/apparels.html?affint=women-topmenu,7499,Clothing,dress,trendy-divva,http://im6.ybndc.com/upload/229877/ProductRear634854863123213104.jpg,7499,,Women,http://www.yebhi.com/229877/PD/trendy-divva-red-women-dresses.htm,yebhi.com,Trendy Divva Red Women - Dresses Buy Online,Trendy Divva Red Women - Dresses  Best Price Rs 3917.00 Best Discount 48% Off EMI Rs 653 for 6 months FREE Shipping In Stock - Delivery in 18-21 Days,SML,<div class="product_detail_columns tinyscrl" itemprop="description" style=""><div class="scrollbar" style="width:2px; height:250px; background:#9E9E9E;"><div class="track" style="width:2px;"><div class="thumb" style="width:6px;"><div class="end"> </div></div></div></div><div class="viewport" style=" height:250px; width:252px; font-family:Arial !important;"><div class="overview" style="text-align:justify; display:block;"><div><table><tr><td><b>Colour</b></td><td>    </td><td>Red</td></tr><tr><td><b>For</b></td><td>    </td><td>Women</td></tr><tr><td><b>Material</b></td><td>    </td><td>Polyester</td></tr><tr><td><b>Brands</b></td><td>    </td><td>Trendy Divva</td></tr><tr><td><b>Departments</b></td><td>    </td><td>Apparels</td></tr><tr><td><b>Category</b></td><td>    </td><td>Dress</td></tr><tr><td><b>Types</b></td><td>    </td><td>Dresses</td></tr></table>  </div></div></div> </div>,,16:04:2014,
229957,trendy divva white women cotton dresses,http://www.yebhi.com/online-shopping/women/apparels.html?affint=women-topmenu,3495,Clothing,dress,trendy-divva,http://im6.ybndc.com/upload/229957/ProductRear634854872822419278.jpg,3495,,Women,http://www.yebhi.com/229957/PD/trendy-divva-white-women-cotton-dresses.htm,yebhi.com,Trendy Divva White Women Cotton - Dresses Buy Online,Trendy Divva White Women Cotton - Dresses  Best Price Rs 2999.00 Best Discount 14% Off EMI Rs 500 for 6 months FREE Shipping in 2 Days,XXL,<div class="product_detail_columns tinyscrl" itemprop="description" style=""><div class="scrollbar" style="width:2px; height:250px; background:#9E9E9E;"><div class="track" style="width:2px;"><div class="thumb" style="width:6px;"><div class="end"> </div></div></div></div><div class="viewport" style=" height:250px; width:252px; font-family:Arial !important;"><div class="overview" style="text-align:justify; display:block;"><div>This <b>dress from Trendy Divva</b> will surely make you the centre of attration. The <b>white</b> dress  made of <b>cotton</b>  dress is adorned beautified with <b>floral prints</b>. This knee-length frock has a<b> blue </b>pleated skirt-pattern with <b>paisley</b> and <b>flowers </b>printed all around.<b>Features</b><ul style="margin-left: 20px;"><li type="disc"> Fabric: Cotton</li><li type="disc">Print: Floral</li><li type="disc">Colour: White  Blue</li><li type="disc">Style: Fitted Bodice with Pleats</li><li type="disc">Neckline: Round Neck</li><li type="disc">Sleeves: Shoulder Straps</li><li type="disc">Length: Knee-Length</li><li type="disc">Silhouette: Free-FLow</li></ul><b>Looks chic with</b> a pair of complementing shoes  pair of sunglasses and you are ready to hit the streets.<br><br><b>Wash and Care<br/></b>Do not bleach or dry clean<br>Wash with like colours<br>Line dry<br>Warm iron<br><br><b>Note<br/></b>There may be a slight colour variation in the image from original product.  </br></br></br></br></br></br></br></div></div></div> </div>,,16:04:2014,
291715,trendy divva brown women dresses,http://www.yebhi.com/online-shopping/women/apparels.html?affint=women-topmenu,4999,Clothing,dress,trendy-divva,http://im6.ybndc.com/upload/291715/ProductRear635025139683965937.jpg,4999,,Women,http://www.yebhi.com/291715/PD/trendy-divva-brown-women-dresses.htm,yebhi.com,Trendy Divva Brown Women - Dresses Buy Online,Trendy Divva Brown Women - Dresses  Best Price Rs 2611.00 Best Discount 48% Off EMI Rs 435 for 6 months FREE Shipping In Stock - Delivery in 6-8 Days,8101412,<div class="product_detail_columns tinyscrl" itemprop="description" style=""><div class="scrollbar" style="width:2px; height:250px; background:#9E9E9E;"><div class="track" style="width:2px;"><div class="thumb" style="width:6px;"><div class="end"> </div></div></div></div><div class="viewport" style=" height:250px; width:252px; font-family:Arial !important;"><div class="overview" style="text-align:justify; display:block;"><div><table><tr><td><b>Colour</b></td><td>    </td><td>Black   Brown</td></tr><tr><td><b>For</b></td><td>    </td><td>Women</td></tr><tr><td><b>Material</b></td><td>    </td><td>Polyester</td></tr><tr><td><b>Brands</b></td><td>    </td><td>Trendy Divva</td></tr><tr><td><b>Departments</b></td><td>    </td><td>Apparels</td></tr><tr><td><b>Category</b></td><td>    </td><td>Dress</td></tr><tr><td><b>Types</b></td><td>    </td><td>Dresses</td></tr></table>  </div></div></div> </div>,,16:04:2014,
438093,trendy divva yellow women dresses,http://www.yebhi.com/online-shopping/women/apparels.html?affint=women-topmenu,2742,Clothing,dress,trendy-divva,http://im6.ybndc.com/upload/438093/ProductRear635248017131868003.jpg,3499,,Women,http://www.yebhi.com/438093/PD/trendy-divva-yellow-women-dresses.htm,yebhi.com,Trendy Divva Yellow Women - Dresses Buy Online,Trendy Divva Yellow Women - Dresses  Best Price Rs 2742.00 Best Discount 22% Off EMI Rs 457 for 6 months FREE Shipping In Stock - Delivery in 6-8 Days,MLXLXXL,<div class="product_detail_columns tinyscrl" itemprop="description" style=""><div class="scrollbar" style="width:2px; height:250px; background:#9E9E9E;"><div class="track" style="width:2px;"><div class="thumb" style="width:6px;"><div class="end"> </div></div></div></div><div class="viewport" style=" height:250px; width:252px; font-family:Arial !important;"><div class="overview" style="text-align:justify; display:block;"><div>Knee Length Yellow colored evening dress </div></div></div> </div>,,16:04:2014,
438068,trendy divva purple women dresses,http://www.yebhi.com/online-shopping/women/apparels.html?affint=women-topmenu,3131,Clothing,dress,trendy-divva,http://im6.ybndc.com/upload/438068/ProductRear635248017014868003.jpg,3995,,Women,http://www.yebhi.com/438068/PD/trendy-divva-purple-women-dresses.htm,yebhi.com,Trendy Divva Purple Women - Dresses Buy Online,Trendy Divva Purple Women - Dresses  Best Price Rs 3131.00 Best Discount 22% Off EMI Rs 522 for 6 months FREE Shipping In Stock - Delivery in 6-8 Days,XSSMLXLXXLXXXL,<div class="product_detail_columns tinyscrl" itemprop="description" style=""><div class="scrollbar" style="width:2px; height:250px; background:#9E9E9E;"><div class="track" style="width:2px;"><div class="thumb" style="width:6px;"><div class="end"> </div></div></div></div><div class="viewport" style=" height:250px; width:252px; font-family:Arial !important;"><div class="overview" style="text-align:justify; display:block;"><div>Party wear Knee Length black Dress </div></div></div> </div>,,16:04:2014,
295470,trendy divva brown women dresses,http://www.yebhi.com/online-shopping/women/apparels.html?affint=women-topmenu,2499,Clothing,dress,trendy-divva,http://im6.ybndc.com/upload/295470/ProductRear635030171176947228.jpg,2499,,Women,http://www.yebhi.com/295470/PD/trendy-divva-brown-women-dresses.htm,yebhi.com,Trendy Divva Brown Women - Dresses Buy Online,Trendy Divva Brown Women - Dresses  Best Price Rs 1305.00 Best Discount 48% Off EMI Rs 218 for 6 months FREE Shipping In Stock - Delivery in 6-8 Days,8141612,<div class="product_detail_columns tinyscrl" itemprop="description" style=""><div class="scrollbar" style="width:2px; height:250px; background:#9E9E9E;"><div class="track" style="width:2px;"><div class="thumb" style="width:6px;"><div class="end"> </div></div></div></div><div class="viewport" style=" height:250px; width:252px; font-family:Arial !important;"><div class="overview" style="text-align:justify; display:block;"><div>Create a bold style statement with this dress from <b> Trendy Diva. </b> It has a <b>check print and front pockets  </b> that lend a versatile trend. <b>Made from soft and high quality fabric  </b> the dress will keep you comfy without compromising on your look.<br/><b>Features</b><ul style="margin-left: 20px;"><li type="disc">Fabric: Polyester</li><li type="disc">Pattern: Check print</li><li type="disc">Colour: Brown</li><li type="disc">Sleeves: Long sleeve</li><li type="disc">Neck: Classic collar</li><li type="disc">Length: Knee high</li><li type="disc">Style: Fitted bodice</li><li type="disc">Fit: Slim fit</li></ul><br><b>Team it with</b> a pair of stilettos for a smart look. </br><b>Wash &amp; care</b>Wash with like colours.<br>Do not soak  tumble dry or bleach<br>Mild iron<br>Line dry </br></br></br></div></div></div> </div>,,16:04:2014,
295438,trendy divva blue women dresses,http://www.yebhi.com/online-shopping/women/apparels.html?affint=women-topmenu,2999,Clothing,dress,trendy-divva,http://im6.ybndc.com/upload/295438/ProductRear635028453011261416.jpg,2999,,Women,http://www.yebhi.com/295438/PD/trendy-divva-blue-women-dresses.htm,yebhi.com,Trendy Divva Blue Women - Dresses Buy Online,Trendy Divva Blue Women - Dresses  Best Price Rs 2599.00 Best Discount 13% Off EMI Rs 433 for 6 months FREE Shipping in 2 Days,8,<div class="product_detail_columns tinyscrl" itemprop="description" style=""><div class="scrollbar" style="width:2px; height:250px; background:#9E9E9E;"><div class="track" style="width:2px;"><div class="thumb" style="width:6px;"><div class="end"> </div></div></div></div><div class="viewport" style=" height:250px; width:252px; font-family:Arial !important;"><div class="overview" style="text-align:justify; display:block;"><div>Create an endless versatile style with this dress from <b> Trendy Diva. </b> The dress features a <b> multi-coloured spot print  </b> with a <b>tie-neck fastening  </b> that lends a sophisticated touch. <b>Made from soft and high quality fabric  </b> the dress will keep you comfortable without compromising on style.<br/><b>Features</b><ul style="margin-left: 20px;"><li type="disc">Fabric: Polyester</li><li type="disc">Pattern: Spot print</li><li type="disc">Colour: Blue</li><li type="disc">Sleeves: 3/4 length sleeve</li><li type="disc">Neck: Tie-neck fastening</li><li type="disc">Length: Knee high</li><li type="disc">Style: Fitted bodice</li><li type="disc">Fit: Slim fit</li></ul><b>Team it with</b> a pair of stilettos for a smart look. <b>Wash &amp; care</b>Wash with like colours.<br>Do not soak  tumble dry or bleach<br>Mild iron<br>Line dry </br></br></br></div></div></div> </div>,,16:04:2014,
229954,trendy divva pink women dresses,http://www.yebhi.com/online-shopping/women/apparels.html?affint=women-topmenu,2999,Clothing,dress,trendy-divva,http://im6.ybndc.com/upload/229954/ProductRear634854871270053327.jpg,2999,,Women,http://www.yebhi.com/229954/PD/trendy-divva-pink-women-dresses.htm,yebhi.com,Trendy Divva Pink Women - Dresses Buy Online,Trendy Divva Pink Women - Dresses  Best Price Rs 1566.00 Best Discount 48% Off EMI Rs 261 for 6 months FREE Shipping In Stock - Delivery in 6-8 Days,XSSMLXLXXL,<div class="product_detail_columns tinyscrl" itemprop="description" style=""><div class="scrollbar" style="width:2px; height:250px; background:#9E9E9E;"><div class="track" style="width:2px;"><div class="thumb" style="width:6px;"><div class="end"> </div></div></div></div><div class="viewport" style=" height:250px; width:252px; font-family:Arial !important;"><div class="overview" style="text-align:justify; display:block;"><div>This slim-fit pink coloured knee-length dress from Trendy Divva deserves a space in your fashionable wardrobe. The one-piece dress is beautifully done with light digital print on its upper and has a very pleasing appeal. The stylish dress has a pencil skirt style that gives it an added look.<b>Style Tip</b>Wear it with matching footwear and accessorize minimum to maintain that elegant look while going out to corporate or casual party occasions.<b>Material and Care</b>Made of PolyesterDo not bleach or dry cleanWash with like coloursLine dry </div></div></div> </div>,,16:04:2014,
291571,trendy divva yellow cotton women dresses,http://www.yebhi.com/online-shopping/women/apparels.html?affint=women-topmenu,3999,Clothing,dress,trendy-divva,http://im6.ybndc.com/upload/291571/ProductRear635018959982257953.jpg,3999,,Women,http://www.yebhi.com/291571/PD/trendy-divva-yellow-cotton-women-dresses.htm,yebhi.com,Trendy Divva Yellow Cotton Women - Dresses Buy Online,Trendy Divva Yellow Cotton Women - Dresses  Best Price Rs 3399.00 Best Discount 15% Off EMI Rs 567 for 6 months FREE Shipping in 2 Days,10,<div class="product_detail_columns tinyscrl" itemprop="description" style=""><div class="scrollbar" style="width:2px; height:250px; background:#9E9E9E;"><div class="track" style="width:2px;"><div class="thumb" style="width:6px;"><div class="end"> </div></div></div></div><div class="viewport" style=" height:250px; width:252px; font-family:Arial !important;"><div class="overview" style="text-align:justify; display:block;"><div>Look stylish and beautiful in this dress from <b> Trendy Diva. </b> It is <b>one-shouldered</b> and has a <b>ruffle detail  </b> that will lend you a chic look. <b>Made from soft and high quality cotton  </b> the dress will keep you comfortable all day long.<br/><b>Features</b><ul style="margin-left: 20px;"><li type="disc">Fabric: Cotton</li><li type="disc">Pattern: Solid</li><li type="disc">Colour: Yellow</li><li type="disc">Sleeves: Off-shoulder and sleeveless</li><li type="disc">Length: Knee high</li><li type="disc">Style: Fitted bodice</li><li type="disc">Fit: Slim fit</li></ul><b>Team it with</b> a pair of stilettos for a smart look. <b>Wash &amp; care</b>Do not bleach or dry clean<br>Wash with like colours<br>Line dry<br>Warm iron </br></br></br></div></div></div> </div>,,16:04:2014,
295445,trendy divva silver women dresses,http://www.yebhi.com/online-shopping/women/apparels.html?affint=women-topmenu,16999,Clothing,dress,trendy-divva,http://im6.ybndc.com/upload/295445/ProductRear635028550177420272.jpg,16999,,Women,http://www.yebhi.com/295445/PD/trendy-divva-silver-women-dresses.htm,yebhi.com,Trendy Divva Silver Women - Dresses Buy Online,Trendy Divva Silver Women - Dresses  Best Price Rs 8880.00 Best Discount 48% Off EMI Rs 1480 for 6 months FREE Shipping In Stock - Delivery in 6-8 Days,810141216,<div class="product_detail_columns tinyscrl" itemprop="description" style=""><div class="scrollbar" style="width:2px; height:250px; background:#9E9E9E;"><div class="track" style="width:2px;"><div class="thumb" style="width:6px;"><div class="end"> </div></div></div></div><div class="viewport" style=" height:250px; width:252px; font-family:Arial !important;"><div class="overview" style="text-align:justify; display:block;"><div>Create an endless versatile style with this dress from <b> Trendy Diva. </b> The dress is beautifully <b> encrusted with sparkly stones</b> and has a <b>ruched detail</b> that will surely make heads turn. <b> Made from soft and high quality fabric  </b> the attire will keep you comfy without compromising on style.<br/><b>Features</b><ul style="margin-left: 20px;"><li type="disc">Fabric: Polyester</li><li type="disc">Pattern: Stone embellished</li><li type="disc">Colour: Silver</li><li type="disc">Sleeves: Sleeveless</li><li type="disc">Neck: Scoop neck</li><li type="disc">Length: Full length</li><li type="disc">Style: Fitted bodice</li><li type="disc">Fit: Slim-fit</li></ul><b>Team it with</b> a pair of stilettos for a smart look. <b>Wash &amp; care</b>Wash with like colours.<br>Do not soak  tumble dry or bleach<br>Mild iron<br>Line dry </br></br></br></div></div></div> </div>,,16:04:2014,
249082,trendy divva blue women dresses,http://www.yebhi.com/online-shopping/women/apparels.html?affint=women-topmenu,2995,Clothing,dress,trendy-divva,http://im6.ybndc.com/upload/249082/ProductRear634878149645614690.jpg,2995,,Women,http://www.yebhi.com/249082/PD/trendy-divva-blue-women-dresses.htm,yebhi.com,Trendy Divva Blue Women - Dresses Buy Online,Trendy Divva Blue Women - Dresses  Best Price Rs 1564.00 Best Discount 48% Off EMI Rs 261 for 6 months FREE Shipping In Stock - Delivery in 18-21 Days,MLXL,<div class="product_detail_columns tinyscrl" itemprop="description" style=""><div class="scrollbar" style="width:2px; height:250px; background:#9E9E9E;"><div class="track" style="width:2px;"><div class="thumb" style="width:6px;"><div class="end"> </div></div></div></div><div class="viewport" style=" height:250px; width:252px; font-family:Arial !important;"><div class="overview" style="text-align:justify; display:block;"><div>This one-piece dress is a perfect pick for those ladies who never compromise on elegance and class when it comes to choosing anything for their wardrobe. This one-piece dress from Trendy Divva has a classy digital print on its royal blue base. The sleeves dress with a designer stitch will serve you well at the formal  casual as well as semi-formal occasions.  <b>Style Tips</b>A pair of peep-toe sandals or pencil heel bellies will look great with this dress. Hold a matching clutch and accessorize minimum to look royal.<b>Material and Care</b>Made of PolyesterGentle hand or machine wash recommended.Do not soak  tumble dry or bleach </div></div></div> </div>,,16:04:2014,
