438103,trendy divva blue cotton women dresses,http://www.yebhi.com/online-shopping/women/apparels.html?affint=women-topmenu,1958,Clothing,dress,trendy-divva,http://im6.ybndc.com/upload/438103/ProductRear635248017179292003.jpg,2499,,Women,http://www.yebhi.com/438103/PD/trendy-divva-blue-cotton-women-dresses.htm,yebhi.com,Trendy Divva Blue Cotton Women - Dresses Buy Online,Trendy Divva Blue Cotton Women - Dresses  Best Price Rs 1958.00 Best Discount 22% Off EMI Rs 326 for 6 months FREE Shipping In Stock - Delivery in 6-8 Days,XSSMLXLXXL,<div class="product_detail_columns tinyscrl" itemprop="description" style=""><div class="scrollbar" style="width:2px; height:250px; background:#9E9E9E;"><div class="track" style="width:2px;"><div class="thumb" style="width:6px;"><div class="end"> </div></div></div></div><div class="viewport" style=" height:250px; width:252px; font-family:Arial !important;"><div class="overview" style="text-align:justify; display:block;"><div>Sleeve less Zipper dress </div></div></div> </div>,,16:04:2014,
247077,trendy divva blue women dresses,http://www.yebhi.com/online-shopping/women/apparels.html?affint=women-topmenu,2999,Clothing,dress,trendy-divva,http://im6.ybndc.com/upload/247077/ProductRear634872179114955444.jpg,2999,,Women,http://www.yebhi.com/247077/PD/trendy-divva-blue-women-dresses.htm,yebhi.com,Trendy Divva Blue Women - Dresses Buy Online,Trendy Divva Blue Women - Dresses  Best Price Rs 1566.00 Best Discount 48% Off EMI Rs 261 for 6 months FREE Shipping In Stock - Delivery in 18-21 Days,XSFree Size,<div class="product_detail_columns tinyscrl" itemprop="description" style=""><div class="scrollbar" style="width:2px; height:250px; background:#9E9E9E;"><div class="track" style="width:2px;"><div class="thumb" style="width:6px;"><div class="end"> </div></div></div></div><div class="viewport" style=" height:250px; width:252px; font-family:Arial !important;"><div class="overview" style="text-align:justify; display:block;"><div><table><tr><td><b>Colour</b></td><td>    </td><td>Blue</td></tr><tr><td><b>For</b></td><td>    </td><td>Women</td></tr><tr><td><b>Material</b></td><td>    </td><td>Polyester</td></tr><tr><td><b>Brands</b></td><td>    </td><td>Trendy Divva</td></tr><tr><td><b>Departments</b></td><td>    </td><td>Apparels</td></tr><tr><td><b>Category</b></td><td>    </td><td>Dress</td></tr><tr><td><b>Types</b></td><td>    </td><td>Dresses</td></tr></table>  </div></div></div> </div>,,16:04:2014,
257353,trendy divva yellow women dresses,http://www.yebhi.com/online-shopping/women/apparels.html?affint=women-topmenu,5499,Clothing,dress,trendy-divva,http://im6.ybndc.com/upload/257353/ProductRear634904110288386627.jpg,5499,,Women,http://www.yebhi.com/257353/PD/trendy-divva-yellow-women-dresses.htm,yebhi.com,Trendy Divva Yellow Women - Dresses Buy Online,Trendy Divva Yellow Women - Dresses  Best Price Rs 5499.00  EMI Rs 917 for 6 months FREE Shipping in 2 Days,XS,<div class="product_detail_columns tinyscrl" itemprop="description" style=""><div class="scrollbar" style="width:2px; height:250px; background:#9E9E9E;"><div class="track" style="width:2px;"><div class="thumb" style="width:6px;"><div class="end"> </div></div></div></div><div class="viewport" style=" height:250px; width:252px; font-family:Arial !important;"><div class="overview" style="text-align:justify; display:block;"><div>Go for this classy yellow coloureed dress from Trendy Divva. The wonderful dress has designer mega-sleeves on it and is buttoned in front. The cute dress with side pockets has a slit in front that gives it a chic look.<br><br><b>Style Tip</b></br>Wear it with pencil heels and a classy handbag for that wonderful look </br><br><b>Material &amp; Care</b></br>Made of PolyesterDo not tumble dry  scrub or bleachDry flat in shade </div></div></div> </div>,,16:04:2014,
438129,trendy divva orange georgette women dresses,http://www.yebhi.com/online-shopping/women/apparels.html?affint=women-topmenu,3134,Clothing,dress,trendy-divva,http://im6.ybndc.com/upload/438129/ProductRear635248017296448003.jpg,3999,,Women,http://www.yebhi.com/438129/PD/trendy-divva-orange-georgette-women-dresses.htm,yebhi.com,Trendy Divva Orange Georgette Women - Dresses Buy Online,Trendy Divva Orange Georgette Women - Dresses  Best Price Rs 3134.00 Best Discount 22% Off EMI Rs 522 for 6 months FREE Shipping In Stock - Delivery in 6-8 Days,SMLXLXXLXXXL4XL,<div class="product_detail_columns tinyscrl" itemprop="description" style=""><div class="scrollbar" style="width:2px; height:250px; background:#9E9E9E;"><div class="track" style="width:2px;"><div class="thumb" style="width:6px;"><div class="end"> </div></div></div></div><div class="viewport" style=" height:250px; width:252px; font-family:Arial !important;"><div class="overview" style="text-align:justify; display:block;"><div>Sleeveless Orange Dress  with sequence at bottom </div></div></div> </div>,,16:04:2014,
438078,trendy divva black chiffon women dresses,http://www.yebhi.com/online-shopping/women/apparels.html?affint=women-topmenu,2350,Clothing,dress,trendy-divva,http://im6.ybndc.com/upload/438078/ProductRear635248017049344003.jpg,2999,,Women,http://www.yebhi.com/438078/PD/trendy-divva-black-chiffon-women-dresses.htm,yebhi.com,Trendy Divva Black Chiffon Women - Dresses Buy Online,Trendy Divva Black Chiffon Women - Dresses  Best Price Rs 2350.00 Best Discount 22% Off EMI Rs 392 for 6 months FREE Shipping In Stock - Delivery in 6-8 Days,XLXXL4XL,<div class="product_detail_columns tinyscrl" itemprop="description" style=""><div class="scrollbar" style="width:2px; height:250px; background:#9E9E9E;"><div class="track" style="width:2px;"><div class="thumb" style="width:6px;"><div class="end"> </div></div></div></div><div class="viewport" style=" height:250px; width:252px; font-family:Arial !important;"><div class="overview" style="text-align:justify; display:block;"><div>Mega Sleeve Sequenced dress </div></div></div> </div>,,16:04:2014,
438054,trendy divva orange women dresses,http://www.yebhi.com/online-shopping/women/apparels.html?affint=women-topmenu,2704,Clothing,dress,trendy-divva,http://im6.ybndc.com/upload/438054/ProductRear635248016938584003.jpg,3450,,Women,http://www.yebhi.com/438054/PD/trendy-divva-orange-women-dresses.htm,yebhi.com,Trendy Divva Orange Women - Dresses Buy Online,Trendy Divva Orange Women - Dresses  Best Price Rs 2704.00 Best Discount 22% Off EMI Rs 451 for 6 months FREE Shipping In Stock - Delivery in 6-8 Days,XXLXXXL4XL,<div class="product_detail_columns tinyscrl" itemprop="description" style=""><div class="scrollbar" style="width:2px; height:250px; background:#9E9E9E;"><div class="track" style="width:2px;"><div class="thumb" style="width:6px;"><div class="end"> </div></div></div></div><div class="viewport" style=" height:250px; width:252px; font-family:Arial !important;"><div class="overview" style="text-align:justify; display:block;"><div>Party wear dress with sequence </div></div></div> </div>,,16:04:2014,
295432,trendy divva red women dresses,http://www.yebhi.com/online-shopping/women/apparels.html?affint=women-topmenu,7499,Clothing,dress,trendy-divva,http://im6.ybndc.com/upload/295432/ProductRear635028450840351500.jpg,7499,,Women,http://www.yebhi.com/295432/PD/trendy-divva-red-women-dresses.htm,yebhi.com,Trendy Divva Red Women - Dresses Buy Online,Trendy Divva Red Women - Dresses  Best Price Rs 3917.00 Best Discount 48% Off EMI Rs 653 for 6 months FREE Shipping In Stock - Delivery in 6-8 Days,XSSML,<div class="product_detail_columns tinyscrl" itemprop="description" style=""><div class="scrollbar" style="width:2px; height:250px; background:#9E9E9E;"><div class="track" style="width:2px;"><div class="thumb" style="width:6px;"><div class="end"> </div></div></div></div><div class="viewport" style=" height:250px; width:252px; font-family:Arial !important;"><div class="overview" style="text-align:justify; display:block;"><div>Create a chic look with this dress from <b> Trendy Diva. </b> It has a<b> scoop neck</b> and <b>panel detail </b> that will lend you a stylish look. <b>Made from soft and high quality fabric  </b> the dress will keep you comfy all day long.<br/><b>Features</b><ul style="margin-left: 20px;"><li type="disc">Fabric: Polyester</li><li type="disc">Pattern: Solid</li><li type="disc">Colour: Red</li><li type="disc">Sleeves: Sleeveless</li><li type="disc">Neck: Sccop neck</li><li type="disc">Length: Knee length</li><li type="disc">Style: Fitted bodice</li><li type="disc">Fit: Slim-fit</li></ul><br><b>Team it with</b> a pair of stilettos for a smart look. </br><b>Wash &amp; care</b>Wash with like colours.<br>Do not soak  tumble dry or bleach<br>Mild iron<br>Line dry </br></br></br></div></div></div> </div>,,16:04:2014,
229945,trendy divva yelloed women dresses,http://www.yebhi.com/online-shopping/women/apparels.html?affint=women-topmenu,8995,Clothing,dress,trendy-divva,http://im6.ybndc.com/upload/229945/ProductRear634854868038960615.jpg,8995,,Women,http://www.yebhi.com/229945/PD/trendy-divva-red-women-dresses.htm,yebhi.com,Trendy Divva Red Women - Dresses Buy Online,Trendy Divva Red Women - Dresses  Best Price Rs 4698.00 Best Discount 48% Off EMI Rs 783 for 6 months FREE Shipping In Stock - Delivery in 6-8 Days,ML,<div class="product_detail_columns tinyscrl" itemprop="description" style=""><div class="scrollbar" style="width:2px; height:250px; background:#9E9E9E;"><div class="track" style="width:2px;"><div class="thumb" style="width:6px;"><div class="end"> </div></div></div></div><div class="viewport" style=" height:250px; width:252px; font-family:Arial !important;"><div class="overview" style="text-align:justify; display:block;"><div>Look glamorous and gorgeous at your special date or some essential occasion with this short-length flowy dress available in poyester fabric. With deep back  floral work on the waistline and one shoulder  the hot dress is studded with white stones at some places. This dress is surely a must-have for your wardrobe. <b>Style Tip</b>Let your dress speak out for you. Accesorize minimum and complete your look with designer footwear and elegant make-up to make a memorable impression.<b>Material and Care</b>Made of PolyesterGentle hand or machine wash recommended.Do not soak  tumble dry or bleach   </div></div></div> </div>,,16:04:2014,
438071,trendy divva black women dresses,http://www.yebhi.com/online-shopping/women/apparels.html?affint=women-topmenu,1955,Clothing,dress,trendy-divva,http://im6.ybndc.com/upload/438071/ProductRear635248017019080003.jpg,2495,,Women,http://www.yebhi.com/438071/PD/trendy-divva-black-women-dresses.htm,yebhi.com,Trendy Divva Black Women - Dresses Buy Online,Trendy Divva Black Women - Dresses  Best Price Rs 1955.00 Best Discount 22% Off EMI Rs 326 for 6 months FREE Shipping In Stock - Delivery in 6-8 Days,SMLXLXXLXXXL,<div class="product_detail_columns tinyscrl" itemprop="description" style=""><div class="scrollbar" style="width:2px; height:250px; background:#9E9E9E;"><div class="track" style="width:2px;"><div class="thumb" style="width:6px;"><div class="end"> </div></div></div></div><div class="viewport" style=" height:250px; width:252px; font-family:Arial !important;"><div class="overview" style="text-align:justify; display:block;"><div>Mega sleeve printed black Dress </div></div></div> </div>,,16:04:2014,
247110,trendy divva blue women cotton dresses,http://www.yebhi.com/online-shopping/women/apparels.html?affint=women-topmenu,1999,Clothing,dress,trendy-divva,http://im6.ybndc.com/upload/247110/ProductRear634872961301161426.jpg,1999,,Women,http://www.yebhi.com/247110/PD/trendy-divva-blue-women-cotton-dresses.htm,yebhi.com,Trendy Divva Blue Women Cotton - Dresses Buy Online,Trendy Divva Blue Women Cotton - Dresses  Best Price Rs 1699.00 Best Discount 15% Off EMI Rs 283 for 6 months FREE Shipping in 2 Days,M,<div class="product_detail_columns tinyscrl" itemprop="description" style=""><div class="scrollbar" style="width:2px; height:250px; background:#9E9E9E;"><div class="track" style="width:2px;"><div class="thumb" style="width:6px;"><div class="end"> </div></div></div></div><div class="viewport" style=" height:250px; width:252px; font-family:Arial !important;"><div class="overview" style="text-align:justify; display:block;"><div>This slim-fit sky blue coloured knee-length dress from Trendy Divva deserves a space in your fashionable wardrobe. The one-piece dress is beautifully done with cut-out work all over it and has a very pleasing appeal. The stylish neckline with nicely decorated button on one of its sleeves gives it an added look.<b>Style Tip</b>Wear it with matching footwear and accessorize minimum to maintain that elegant look while going out to corporate or casual party occasions.<b>Material and Care</b>Made of CottonDo not bleach or dry cleanWash with like coloursLine dry </div></div></div> </div>,,16:04:2014,
249042,trendy divva blue women dresses,http://www.yebhi.com/online-shopping/women/apparels.html?affint=women-topmenu,8995,Clothing,dress,trendy-divva,http://im6.ybndc.com/upload/249042/ProductRear634877311369546301.jpg,8995,,Women,http://www.yebhi.com/249042/PD/trendy-divva-blue-women-dresses.htm,yebhi.com,Trendy Divva Blue Women - Dresses Buy Online,Trendy Divva Blue Women - Dresses  Best Price Rs 8995.00  EMI Rs 1499 for 6 months FREE Shipping In Stock - Delivery in 6-8 Days,SMLXLXXL,<div class="product_detail_columns tinyscrl" itemprop="description" style=""><div class="scrollbar" style="width:2px; height:250px; background:#9E9E9E;"><div class="track" style="width:2px;"><div class="thumb" style="width:6px;"><div class="end"> </div></div></div></div><div class="viewport" style=" height:250px; width:252px; font-family:Arial !important;"><div class="overview" style="text-align:justify; display:block;"><div>Impart a glam and modish look to your personality by opting for this absolutely stunning and smart dress in royal blue colour. The designer one-piece above the knee-length dress consists of thin shoulder strap at one side and a broad strap with a brooch on the other side. Decorated with big and small stone work in a designed pattern  this dress is sure to turn heads at the next special social gathering.  <b>Style Tips</b>A pair of peep-toed sandals or pencil heel bellys will look great with this dress. Hold a matching clutch and accessorize minimum to look royal.<b>Material and Care</b>Made of PolyesterGentle hand or machine wash recommended.Do not soak  tumble dry or bleach   </div></div></div> </div>,,16:04:2014,
295436,trendy divva black women dresses,http://www.yebhi.com/online-shopping/women/apparels.html?affint=women-topmenu,2999,Clothing,dress,trendy-divva,http://im6.ybndc.com/upload/295436/ProductRear635028452157311942.jpg,2999,,Women,http://www.yebhi.com/295436/PD/trendy-divva-black-women-dresses.htm,yebhi.com,Trendy Divva Black Women - Dresses Buy Online,Trendy Divva Black Women - Dresses  Best Price Rs 1566.00 Best Discount 48% Off EMI Rs 261 for 6 months FREE Shipping In Stock - Delivery in 6-8 Days,6810121614,<div class="product_detail_columns tinyscrl" itemprop="description" style=""><div class="scrollbar" style="width:2px; height:250px; background:#9E9E9E;"><div class="track" style="width:2px;"><div class="thumb" style="width:6px;"><div class="end"> </div></div></div></div><div class="viewport" style=" height:250px; width:252px; font-family:Arial !important;"><div class="overview" style="text-align:justify; display:block;"><div>You will definitely make heads turn when you don yourself in this dress from <b> Trendy Diva. </b> It has a pretty<b> tulip print  </b> that creates a distinctive look. <b> Made from soft and high quality fabric  </b> the dress will keep you comfortable all day long.<br/><b>Features</b><ul style="margin-left: 20px;"><li type="disc">Fabric: Polyester</li><li type="disc">Pattern: Tulip print</li><li type="disc">Colour: Black  Green and Red</li><li type="disc">Sleeves: Sleeveless</li><li type="disc">Neck: Round neck</li><li type="disc">Length: Knee high</li><li type="disc">Fit: Slim-fit</li></ul><br><b>Team it with</b> a pair of stilettos for a smart look. </br><b>Wash &amp; care</b>Wash with like colours.<br>Do not soak  tumble dry or bleach<br>Mild iron<br>Line dry </br></br></br></div></div></div> </div>,,16:04:2014,
295440,trendy divva black women dresses,http://www.yebhi.com/online-shopping/women/apparels.html?affint=women-topmenu,3999,Clothing,dress,trendy-divva,http://im6.ybndc.com/upload/295440/ProductRear635028548659218540.jpg,3999,,Women,http://www.yebhi.com/295440/PD/trendy-divva-black-women-dresses.htm,yebhi.com,Trendy Divva Black Women - Dresses Buy Online,Trendy Divva Black Women - Dresses  Best Price Rs 3999.00  EMI Rs 667 for 6 months FREE Shipping In Stock - Delivery in 6-8 Days,81018161214,<div class="product_detail_columns tinyscrl" itemprop="description" style=""><div class="scrollbar" style="width:2px; height:250px; background:#9E9E9E;"><div class="track" style="width:2px;"><div class="thumb" style="width:6px;"><div class="end"> </div></div></div></div><div class="viewport" style=" height:250px; width:252px; font-family:Arial !important;"><div class="overview" style="text-align:justify; display:block;"><div>Look smart and sophisticated in this dress from<b> Trendy Diva. </b>It has a <b>leaf print  </b> that imparts an appealing look. <b> Crafted from soft and high quality fabric  </b> the dress will keep you comfortable all day long.<br/><b>Features</b><ul style="margin-left: 20px;"><li type="disc">Fabric: Polyester</li><li type="disc">Pattern: Leaf print</li><li type="disc">Colour: Black</li><li type="disc">Sleeves: Sleeveless</li><li type="disc">Neck: Round neck</li><li type="disc">Length: Below Knee</li><li type="disc">Style: Fitted bodice</li><li type="disc">Fit: Slim fit</li></ul><b>Team it with</b> a pair of stilettos for a smart look. <b>Wash &amp; care</b>Wash with like colours.<br>Do not soak  tumble dry or bleach<br>Mild iron<br>Line dry </br></br></br></div></div></div> </div>,,16:04:2014,
291556,trendy divva pink women dresses,http://www.yebhi.com/online-shopping/women/apparels.html?affint=women-topmenu,3499,Clothing,dress,trendy-divva,http://im6.ybndc.com/upload/291556/ProductRear635018951936506378.jpg,3499,,Women,http://www.yebhi.com/291556/PD/trendy-divva-pink-women-dresses.htm,yebhi.com,Trendy Divva Pink Women - Dresses Buy Online,Trendy Divva Pink Women - Dresses  Best Price Rs 1827.00 Best Discount 48% Off EMI Rs 305 for 6 months FREE Shipping In Stock - Delivery in 6-8 Days,1014121816,<div class="product_detail_columns tinyscrl" itemprop="description" style=""><div class="scrollbar" style="width:2px; height:250px; background:#9E9E9E;"><div class="track" style="width:2px;"><div class="thumb" style="width:6px;"><div class="end"> </div></div></div></div><div class="viewport" style=" height:250px; width:252px; font-family:Arial !important;"><div class="overview" style="text-align:justify; display:block;"><div>Create a bold style statement with this dress from <b> Trendy Diva. </b> It has a <b>floral print </b> that lends a versatile trend. <b>Made from soft and high quality fabric  </b> the dress will keep you comfy without compromising on your look.<br/><b>Features</b><ul style="margin-left: 20px;"><li type="disc">Fabric: Polyester</li><li type="disc">Pattern: Floral print</li><li type="disc">Colour: Pink</li><li type="disc">Sleeves: Sleeveless</li><li type="disc">Neck: Round neck</li><li type="disc">Length: Knee high</li><li type="disc">Style: Fitted bodice</li><li type="disc">Fit: Slim-fit</li></ul><b>Team it with</b> a pair of stilettos for a smart look. <b>Wash &amp; care</b>Wash with like colours.<br>Do not soak  tumble dry or bleach<br>Mild iron<br>Line dry </br></br></br></div></div></div> </div>,,16:04:2014,
229953,trendy divva white women dresses,http://www.yebhi.com/online-shopping/women/apparels.html?affint=women-topmenu,5999,Clothing,dress,trendy-divva,http://im6.ybndc.com/upload/229953/ProductRear634854870898926948.jpg,5999,,Women,http://www.yebhi.com/229953/PD/trendy-divva-white-women-dresses.htm,yebhi.com,Trendy Divva White Women - Dresses Buy Online,Trendy Divva White Women - Dresses  Best Price Rs 5399.00 Best Discount 10% Off EMI Rs 900 for 6 months FREE Shipping in 2 Days,S,<div class="product_detail_columns tinyscrl" itemprop="description" style=""><div class="scrollbar" style="width:2px; height:250px; background:#9E9E9E;"><div class="track" style="width:2px;"><div class="thumb" style="width:6px;"><div class="end"> </div></div></div></div><div class="viewport" style=" height:250px; width:252px; font-family:Arial !important;"><div class="overview" style="text-align:justify; display:block;"><div>Enhance your femininity and style with this <b>dress from Trendy Divva</b>. The <b>white </b>floor-length clothing with floral prints features <b>ruched</b> in the front. Made from <b>polyester</b>  this dress features a <b>sweetheart</b> neckline. <b>Features</b><ul style="margin-left: 20px;"><li type="disc"> Fabric: Polyester</li><li type="disc">Print: Floral</li><li type="disc">Colour: White</li><li type="disc">Style: Gown</li><li type="disc">Neckline: Sweetheart Neckline</li><li type="disc">Sleeves: Sleeveless</li><li type="disc">Length: Floor Length</li><li type="disc">Silhouette: Free Flow</li></ul><b>Looks chic with</b> a pair of stilettos and a matching handbag.<br><br><b> Wash and Care<br/></b>Wash with like colours.<br>Do not soak  tumble dry or bleach<br>Mild iron<br>Line dry<br><br><b> Note</b><br>There may be a slight colour variation in the image from original product.  </br></br></br></br></br></br></br></br></div></div></div> </div>,,16:04:2014,
438113,trendy divva red women jumpsuit,http://www.yebhi.com/online-shopping/women/apparels.html?affint=women-topmenu,3918,Clothing,dress,trendy-divva,http://im6.ybndc.com/upload/438113/ProductRear635248017229056003.jpg,4999,,Women,http://www.yebhi.com/438113/PD/trendy-divva-red-women-jumpsuit.htm,yebhi.com,Trendy Divva Red Women - Jumpsuit Buy Online,Trendy Divva Red Women - Jumpsuit  Best Price Rs 3918.00 Best Discount 22% Off EMI Rs 653 for 6 months FREE Shipping In Stock - Delivery in 6-8 Days,MLXL,<div class="product_detail_columns tinyscrl" itemprop="description" style=""><div class="scrollbar" style="width:2px; height:250px; background:#9E9E9E;"><div class="track" style="width:2px;"><div class="thumb" style="width:6px;"><div class="end"> </div></div></div></div><div class="viewport" style=" height:250px; width:252px; font-family:Arial !important;"><div class="overview" style="text-align:justify; display:block;"><div>Full length red designer jumpsuit </div></div></div> </div>,,16:04:2014,
249021,trendy divva white women dresses,http://www.yebhi.com/online-shopping/women/apparels.html?affint=women-topmenu,5500,Clothing,dress,trendy-divva,http://im6.ybndc.com/upload/249021/ProductRear634877305319515519.jpg,5500,,Women,http://www.yebhi.com/249021/PD/trendy-divva-white-women-dresses.htm,yebhi.com,Trendy Divva White Women - Dresses Buy Online,Trendy Divva White Women - Dresses  Best Price Rs 5500.00  EMI Rs 917 for 6 months FREE Shipping in 2 Days,XXXL,<div class="product_detail_columns tinyscrl" itemprop="description" style=""><div class="scrollbar" style="width:2px; height:250px; background:#9E9E9E;"><div class="track" style="width:2px;"><div class="thumb" style="width:6px;"><div class="end"> </div></div></div></div><div class="viewport" style=" height:250px; width:252px; font-family:Arial !important;"><div class="overview" style="text-align:justify; display:block;"><div>Sensuous looks and feminine colours  make this top one of the best ones to make you look gorgeous. The floral design on top of white shade  elevates the look manifolds. This knee length dress is crafted from the finest material  which keeps you comfortable all the while. So brace yourself for a titillating candlelight dinner with your beloved. <br><br><b>Style Tip</b><br>Pair up with a bracelet and put on strappy footwear or bellies for a complete look.<br><br><b>Material and Care</b><br>Made of Polyester<br>Do not bleach or dry clean<br>Wash with like colours<br>Line Dry<br> </br></br></br></br></br></br></br></br></br></br></div></div></div> </div>,,16:04:2014,
237439,trendy divva pink women cotton dresses,http://www.yebhi.com/online-shopping/women/apparels.html?affint=women-topmenu,2499,Clothing,dress,trendy-divva,http://im6.ybndc.com/upload/237439/ProductRear634863300993839095.jpg,2499,,Women,http://www.yebhi.com/237439/PD/trendy-divva-pink-women-cotton-dresses.htm,yebhi.com,Trendy Divva Pink Women Cotton - Dresses Buy Online,Trendy Divva Pink Women Cotton - Dresses  Best Price Rs 2499.00  EMI Rs 417 for 6 months FREE Shipping in 2 Days,L,<div class="product_detail_columns tinyscrl" itemprop="description" style=""><div class="scrollbar" style="width:2px; height:250px; background:#9E9E9E;"><div class="track" style="width:2px;"><div class="thumb" style="width:6px;"><div class="end"> </div></div></div></div><div class="viewport" style=" height:250px; width:252px; font-family:Arial !important;"><div class="overview" style="text-align:justify; display:block;"><div>This baby pink coloured shirt syle top from Trendy Divva is done with wonderful cut-work and plain design for that decent look. Now move out in the trendiest way to all your formal and semi-formal outing by slipping into this top. Made out of high-quality cotton fabric  this top is sure to make you steal the show wherever you go!<br><br><b>Style Tip</b></br>Wear this with your favourite denims or sleek trousers with shoes or bellies for a chic look.</br><br><b>Material &amp; Care</b></br>Made of CottonGentle hand wash or machine wash recommendedDo not tumble dry  scrub or bleachDry flat in shade </div></div></div> </div>,,16:04:2014,
