249041,trendy divva black women dresses,http://www.yebhi.com/online-shopping/women/apparels.html?affint=women-topmenu,4495,Clothing,dress,trendy-divva,http://im6.ybndc.com/upload/249041/ProductRear634877311111052644.jpg,4495,,Women,http://www.yebhi.com/249041/PD/trendy-divva-black-women-dresses.htm,yebhi.com,Trendy Divva Black Women - Dresses Buy Online,Trendy Divva Black Women - Dresses  Best Price Rs 4495.00  EMI Rs 749 for 6 months FREE Shipping in 2 Days,XXL,<div class="product_detail_columns tinyscrl" itemprop="description" style=""><div class="scrollbar" style="width:2px; height:250px; background:#9E9E9E;"><div class="track" style="width:2px;"><div class="thumb" style="width:6px;"><div class="end"> </div></div></div></div><div class="viewport" style=" height:250px; width:252px; font-family:Arial !important;"><div class="overview" style="text-align:justify; display:block;"><div><table><tr><td><b>Colour</b></td><td>    </td><td>Black</td></tr><tr><td><b>For</b></td><td>    </td><td>Women</td></tr><tr><td><b>Material</b></td><td>    </td><td>Polyester</td></tr><tr><td><b>Brands</b></td><td>    </td><td>Trendy Divva</td></tr><tr><td><b>Departments</b></td><td>    </td><td>Apparels</td></tr><tr><td><b>Category</b></td><td>    </td><td>Dress</td></tr><tr><td><b>Types</b></td><td>    </td><td>Dresses</td></tr></table>  </div></div></div> </div>,,16:04:2014,
438099,trendy divva blue cotton women dresses,http://www.yebhi.com/online-shopping/women/apparels.html?affint=women-topmenu,2350,Clothing,dress,trendy-divva,http://im6.ybndc.com/upload/438099/ProductRear635248017159792003.jpg,2999,,Women,http://www.yebhi.com/438099/PD/trendy-divva-blue-cotton-women-dresses.htm,yebhi.com,Trendy Divva Blue Cotton Women - Dresses Buy Online,Trendy Divva Blue Cotton Women - Dresses  Best Price Rs 2350.00 Best Discount 22% Off EMI Rs 392 for 6 months FREE Shipping In Stock - Delivery in 6-8 Days,XSSLXL,<div class="product_detail_columns tinyscrl" itemprop="description" style=""><div class="scrollbar" style="width:2px; height:250px; background:#9E9E9E;"><div class="track" style="width:2px;"><div class="thumb" style="width:6px;"><div class="end"> </div></div></div></div><div class="viewport" style=" height:250px; width:252px; font-family:Arial !important;"><div class="overview" style="text-align:justify; display:block;"><div>Sleeve less printed Dress </div></div></div> </div>,,16:04:2014,
438122,trendy divva black women dresses,http://www.yebhi.com/online-shopping/women/apparels.html?affint=women-topmenu,1955,Clothing,dress,trendy-divva,http://im6.ybndc.com/upload/438122/ProductRear635248017267588003.jpg,2495,,Women,http://www.yebhi.com/438122/PD/trendy-divva-black-women-dresses.htm,yebhi.com,Trendy Divva Black Women - Dresses Buy Online,Trendy Divva Black Women - Dresses  Best Price Rs 1955.00 Best Discount 22% Off EMI Rs 326 for 6 months FREE Shipping In Stock - Delivery in 6-8 Days,XSSMLXXL,<div class="product_detail_columns tinyscrl" itemprop="description" style=""><div class="scrollbar" style="width:2px; height:250px; background:#9E9E9E;"><div class="track" style="width:2px;"><div class="thumb" style="width:6px;"><div class="end"> </div></div></div></div><div class="viewport" style=" height:250px; width:252px; font-family:Arial !important;"><div class="overview" style="text-align:justify; display:block;"><div>Full sleeve printed dress </div></div></div> </div>,,16:04:2014,
438064,trendy divva red women dresses,http://www.yebhi.com/online-shopping/women/apparels.html?affint=women-topmenu,5877,Clothing,dress,trendy-divva,http://im6.ybndc.com/upload/438064/ProductRear635248016994588003.jpg,7499,,Women,http://www.yebhi.com/438064/PD/trendy-divva-red-women-dresses.htm,yebhi.com,Trendy Divva Red Women - Dresses Buy Online,Trendy Divva Red Women - Dresses  Best Price Rs 5877.00 Best Discount 22% Off EMI Rs 980 for 6 months FREE Shipping In Stock - Delivery in 6-8 Days,XSML,<div class="product_detail_columns tinyscrl" itemprop="description" style=""><div class="scrollbar" style="width:2px; height:250px; background:#9E9E9E;"><div class="track" style="width:2px;"><div class="thumb" style="width:6px;"><div class="end"> </div></div></div></div><div class="viewport" style=" height:250px; width:252px; font-family:Arial !important;"><div class="overview" style="text-align:justify; display:block;"><div>One Shoulder red party wear dress </div></div></div> </div>,,16:04:2014,
291569,trendy divva blue cotton women dresses,http://www.yebhi.com/online-shopping/women/apparels.html?affint=women-topmenu,3499,Clothing,dress,trendy-divva,http://im6.ybndc.com/upload/291569/ProductRear635018958805542410.jpg,3499,,Women,http://www.yebhi.com/291569/PD/trendy-divva-blue-cotton-women-dresses.htm,yebhi.com,Trendy Divva Blue Cotton Women - Dresses Buy Online,Trendy Divva Blue Cotton Women - Dresses  Best Price Rs 2999.00 Best Discount 14% Off EMI Rs 500 for 6 months FREE Shipping in 2 Days,14,<div class="product_detail_columns tinyscrl" itemprop="description" style=""><div class="scrollbar" style="width:2px; height:250px; background:#9E9E9E;"><div class="track" style="width:2px;"><div class="thumb" style="width:6px;"><div class="end"> </div></div></div></div><div class="viewport" style=" height:250px; width:252px; font-family:Arial !important;"><div class="overview" style="text-align:justify; display:block;"><div>Create a sophisticated look with this dress from <b> Trendy Diva. </b> It has a <b>classic collar and waist tie fastening  </b>that will create a chic look. <b>Made from soft and high quality cotton  </b> the dress will keep you comfortable and relaxed.<br/><b>Features</b><ul style="margin-left: 20px;"><li type="disc">Fabric: Cotton</li><li type="disc">Pattern: Solid</li><li type="disc">Colour: Blue</li><li type="disc">Sleeves: Short sleeve</li><li type="disc">Neck: Classic collar</li><li type="disc">Length: Knee high</li><li type="disc">Style: Fitted bodice</li><li type="disc">Fit: Slim-fit</li></ul><b>Team it with</b> a pair of stilettos for a smart look. <b>Wash &amp; care</b>Do not bleach or dry clean<br>Wash with like colours<br>Line dry<br>Warm iron </br></br></br></div></div></div> </div>,,16:04:2014,
438076,trendy divva black georgette women dresses,http://www.yebhi.com/online-shopping/women/apparels.html?affint=women-topmenu,2350,Clothing,dress,trendy-divva,http://im6.ybndc.com/upload/438076/ProductRear635248017044664003.jpg,2999,,Women,http://www.yebhi.com/438076/PD/trendy-divva-black-georgette-women-dresses.htm,yebhi.com,Trendy Divva Black Georgette Women - Dresses Buy Online,Trendy Divva Black Georgette Women - Dresses  Best Price Rs 2350.00 Best Discount 22% Off EMI Rs 392 for 6 months FREE Shipping In Stock - Delivery in 6-8 Days,SMLXLXXLXXXL,<div class="product_detail_columns tinyscrl" itemprop="description" style=""><div class="scrollbar" style="width:2px; height:250px; background:#9E9E9E;"><div class="track" style="width:2px;"><div class="thumb" style="width:6px;"><div class="end"> </div></div></div></div><div class="viewport" style=" height:250px; width:252px; font-family:Arial !important;"><div class="overview" style="text-align:justify; display:block;"><div>Full length black sequenced dress </div></div></div> </div>,,16:04:2014,
230932,trendy divva green women dresses,http://www.yebhi.com/online-shopping/women/apparels.html?affint=women-topmenu,4999,Clothing,dress,trendy-divva,http://im6.ybndc.com/upload/230932/ProductRear634856623384319365.jpg,4999,,Women,http://www.yebhi.com/230932/PD/trendy-divva-green-women-dresses.htm,yebhi.com,Trendy Divva Green Women - Dresses Buy Online,Trendy Divva Green Women - Dresses  Best Price Rs 2887.00 Best Discount 42% Off EMI Rs 481 for 6 months FREE Shipping In Stock - Delivery in 6-8 Days,SMLXLXXL,<div class="product_detail_columns tinyscrl" itemprop="description" style=""><div class="scrollbar" style="width:2px; height:250px; background:#9E9E9E;"><div class="track" style="width:2px;"><div class="thumb" style="width:6px;"><div class="end"> </div></div></div></div><div class="viewport" style=" height:250px; width:252px; font-family:Arial !important;"><div class="overview" style="text-align:justify; display:block;"><div>Impart an uber-trendy and diva like look to your personality by opting for this short-length dress in shaded green colour. The sleeveless flowy dress in frock style is sure to give you a chic and cute look. Grab it right away for a high-end look at all your casual occasions! <b>Style Tip</b>A pair of peep-toed sandals or pencil heels with decent make-up and mimimal accessories will give you that attractive look.<b>Material and Care</b>PolyesterGentle hand or machine wash recommended.Do not soak  tumble dry or bleach </div></div></div> </div>,,16:04:2014,
438134,trendy divva red women dresses,http://www.yebhi.com/online-shopping/women/apparels.html?affint=women-topmenu,3131,Clothing,dress,trendy-divva,http://im6.ybndc.com/upload/438134/ProductRear635248017318600003.jpg,3995,,Women,http://www.yebhi.com/438134/PD/trendy-divva-red-women-dresses.htm,yebhi.com,Trendy Divva Red Women - Dresses Buy Online,Trendy Divva Red Women - Dresses  Best Price Rs 3131.00 Best Discount 22% Off EMI Rs 522 for 6 months FREE Shipping In Stock - Delivery in 6-8 Days,SMLXLXXL,<div class="product_detail_columns tinyscrl" itemprop="description" style=""><div class="scrollbar" style="width:2px; height:250px; background:#9E9E9E;"><div class="track" style="width:2px;"><div class="thumb" style="width:6px;"><div class="end"> </div></div></div></div><div class="viewport" style=" height:250px; width:252px; font-family:Arial !important;"><div class="overview" style="text-align:justify; display:block;"><div>Sleeve less Casual Dress </div></div></div> </div>,,16:04:2014,
438115,trendy divva beige women jumpsuit,http://www.yebhi.com/online-shopping/women/apparels.html?affint=women-topmenu,3918,Clothing,dress,trendy-divva,http://im6.ybndc.com/upload/438115/ProductRear635248017239040003.jpg,4999,,Women,http://www.yebhi.com/438115/PD/trendy-divva-beige-women-jumpsuit.htm,yebhi.com,Trendy Divva Beige Women - Jumpsuit Buy Online,Trendy Divva Beige Women - Jumpsuit  Best Price Rs 3918.00 Best Discount 22% Off EMI Rs 653 for 6 months FREE Shipping In Stock - Delivery in 6-8 Days,MLXL,<div class="product_detail_columns tinyscrl" itemprop="description" style=""><div class="scrollbar" style="width:2px; height:250px; background:#9E9E9E;"><div class="track" style="width:2px;"><div class="thumb" style="width:6px;"><div class="end"> </div></div></div></div><div class="viewport" style=" height:250px; width:252px; font-family:Arial !important;"><div class="overview" style="text-align:justify; display:block;"><div>Full length beige designer jumpsuit </div></div></div> </div>,,16:04:2014,
249046,trendy divva green women dresses,http://www.yebhi.com/online-shopping/women/apparels.html?affint=women-topmenu,2999,Clothing,dress,trendy-divva,http://im6.ybndc.com/upload/249046/ProductRear634878016860980653.jpg,2999,,Women,http://www.yebhi.com/249046/PD/trendy-divva-green-women-dresses.htm,yebhi.com,Trendy Divva Green Women - Dresses Buy Online,Trendy Divva Green Women - Dresses  Best Price Rs 1566.00 Best Discount 48% Off EMI Rs 261 for 6 months FREE Shipping In Stock - Delivery in 6-8 Days,SMLXLXXLXXXL,<div class="product_detail_columns tinyscrl" itemprop="description" style=""><div class="scrollbar" style="width:2px; height:250px; background:#9E9E9E;"><div class="track" style="width:2px;"><div class="thumb" style="width:6px;"><div class="end"> </div></div></div></div><div class="viewport" style=" height:250px; width:252px; font-family:Arial !important;"><div class="overview" style="text-align:justify; display:block;"><div>This stylish dress will make you look sensuous  for a fabulous evening. The deep V neckline is bordered by embellishments which contributes to increasing the visual appeal of the dress. Black and yellow shades blend aesthetically with each other for a fabulous look. Put this on and create a serenading ambience in social gathering.<b>Style Tip</b>Put on with strappy footwear for a complete look.<b>Material and Care</b>Made of PolyesterDo not bleach or dry cleanWash with like colours.Line Dry. </div></div></div> </div>,,16:04:2014,
289154,trendy divva red cotton women dresses,http://www.yebhi.com/online-shopping/women/apparels.html?affint=women-topmenu,3499,Clothing,dress,trendy-divva,http://im6.ybndc.com/upload/289154/ProductRear635010314842594092.jpg,3499,,Women,http://www.yebhi.com/289154/PD/trendy-divva-red-cotton-women-dresses.htm,yebhi.com,Trendy Divva Red Cotton Women - Dresses Buy Online,Trendy Divva Red Cotton Women - Dresses  Best Price Rs 1827.00 Best Discount 48% Off EMI Rs 305 for 6 months FREE Shipping In Stock - Delivery in 9-12 Days,81014161812,<div class="product_detail_columns tinyscrl" itemprop="description" style=""><div class="scrollbar" style="width:2px; height:250px; background:#9E9E9E;"><div class="track" style="width:2px;"><div class="thumb" style="width:6px;"><div class="end"> </div></div></div></div><div class="viewport" style=" height:250px; width:252px; font-family:Arial !important;"><div class="overview" style="text-align:justify; display:block;"><div><table><tr><td><b>Colour</b></td><td>    </td><td>Red</td></tr><tr><td><b>For</b></td><td>    </td><td>Women</td></tr><tr><td><b>Material</b></td><td>    </td><td>Cotton</td></tr><tr><td><b>Brands</b></td><td>    </td><td>Trendy Divva</td></tr><tr><td><b>Departments</b></td><td>    </td><td>Apparels</td></tr><tr><td><b>Category</b></td><td>    </td><td>Dress</td></tr><tr><td><b>Types</b></td><td>    </td><td>Dresses</td></tr></table>  </div></div></div> </div>,,16:04:2014,
438084,trendy divva green women dresses,http://www.yebhi.com/online-shopping/women/apparels.html?affint=women-topmenu,3134,Clothing,dress,trendy-divva,http://im6.ybndc.com/upload/438084/ProductRear635248017077268003.jpg,3999,,Women,http://www.yebhi.com/438084/PD/trendy-divva-green-women-dresses.htm,yebhi.com,Trendy Divva Green Women - Dresses Buy Online,Trendy Divva Green Women - Dresses  Best Price Rs 3134.00 Best Discount 22% Off EMI Rs 522 for 6 months FREE Shipping In Stock - Delivery in 6-8 Days,SMLXLXXL,<div class="product_detail_columns tinyscrl" itemprop="description" style=""><div class="scrollbar" style="width:2px; height:250px; background:#9E9E9E;"><div class="track" style="width:2px;"><div class="thumb" style="width:6px;"><div class="end"> </div></div></div></div><div class="viewport" style=" height:250px; width:252px; font-family:Arial !important;"><div class="overview" style="text-align:justify; display:block;"><div>Knee Length sequenced Dress </div></div></div> </div>,,16:04:2014,
438085,trendy divva pink women dresses,http://www.yebhi.com/online-shopping/women/apparels.html?affint=women-topmenu,5877,Clothing,dress,trendy-divva,http://im6.ybndc.com/upload/438085/ProductRear635248017084132003.jpg,7499,,Women,http://www.yebhi.com/438085/PD/trendy-divva-pink-women-dresses.htm,yebhi.com,Trendy Divva Pink Women - Dresses Buy Online,Trendy Divva Pink Women - Dresses  Best Price Rs 5877.00 Best Discount 22% Off EMI Rs 980 for 6 months FREE Shipping In Stock - Delivery in 6-8 Days,SMLXL,<div class="product_detail_columns tinyscrl" itemprop="description" style=""><div class="scrollbar" style="width:2px; height:250px; background:#9E9E9E;"><div class="track" style="width:2px;"><div class="thumb" style="width:6px;"><div class="end"> </div></div></div></div><div class="viewport" style=" height:250px; width:252px; font-family:Arial !important;"><div class="overview" style="text-align:justify; display:block;"><div>Party wear pink designer dress </div></div></div> </div>,,16:04:2014,
249069,trendy divva blue women dresses,http://www.yebhi.com/online-shopping/women/apparels.html?affint=women-topmenu,2499,Clothing,dress,trendy-divva,http://im6.ybndc.com/upload/249069/ProductRear635050106013012325.jpg,2499,,Women,http://www.yebhi.com/249069/PD/trendy-divva-blue-women-dresses.htm,yebhi.com,Trendy Divva Blue Women - Dresses Buy Online,Trendy Divva Blue Women - Dresses  Best Price Rs 2149.00 Best Discount 14% Off EMI Rs 358 for 6 months FREE Shipping in 2 Days,XSXL,<div class="product_detail_columns tinyscrl" itemprop="description" style=""><div class="scrollbar" style="width:2px; height:250px; background:#9E9E9E;"><div class="track" style="width:2px;"><div class="thumb" style="width:6px;"><div class="end"> </div></div></div></div><div class="viewport" style=" height:250px; width:252px; font-family:Arial !important;"><div class="overview" style="text-align:justify; display:block;"><div>Style has no end when it comes to women dresses. This lovely dress with a trendy royal blue sheer  flingy upper has a distinct pencil skirt style bottom that will impart you a fashionable look while you dress up casually. The lovely dress in polyester fabric will give you a classy and uber-trendy look. <br><b>Style Tip</b></br> Go for high-heeled bellys and accessorize minimum for an elegant look.<br><br><b>Material &amp; Care</b></br>Made of Polyester</br>Do not bleach  iron  dry cleanDo not tumble dry  scrub or bleachDry flat in shade </div></div></div> </div>,,16:04:2014,
258117,trendy divva pink cotton blend women dresses,http://www.yebhi.com/online-shopping/women/apparels.html?affint=women-topmenu,2999,Clothing,dress,trendy-divva,http://im6.ybndc.com/upload/258117/ProductRear634907601333988981.jpg,2999,,Women,http://www.yebhi.com/258117/PD/trendy-divva-pink-cotton-blend-women-dresses.htm,yebhi.com,Trendy Divva Pink Cotton Blend Women - Dresses Buy Online,Trendy Divva Pink Cotton Blend Women - Dresses  Best Price Rs 1644.00 Best Discount 45% Off EMI Rs 274 for 6 months FREE Shipping In Stock - Delivery in 6-8 Days,XSSMLXLXXL,<div class="product_detail_columns tinyscrl" itemprop="description" style=""><div class="scrollbar" style="width:2px; height:250px; background:#9E9E9E;"><div class="track" style="width:2px;"><div class="thumb" style="width:6px;"><div class="end"> </div></div></div></div><div class="viewport" style=" height:250px; width:252px; font-family:Arial !important;"><div class="overview" style="text-align:justify; display:block;"><div>Look chic and cute in this pretty one-piece short dress that is done with attractive floral prints on it. The pretty dress with simple neckline and broad shoulder straps bears minimum design and is sure to give you a trendy look while you are heading for some casual outing. <b>Style Tips</b>A pair of strapped sandals and minimum make-up will look great with this dress. Hold a matching clutch and accessorize minimum to look royal.<b>Material and Care</b>Made of Cotton  WoolGentle hand wash recommended.Do not soak  tumble dry or bleach </div></div></div> </div>,,16:04:2014,
438074,trendy divva black women dresses,http://www.yebhi.com/online-shopping/women/apparels.html?affint=women-topmenu,2742,Clothing,dress,trendy-divva,http://im6.ybndc.com/upload/438074/ProductRear635248017032652003.jpg,3499,,Women,http://www.yebhi.com/438074/PD/trendy-divva-black-women-dresses.htm,yebhi.com,Trendy Divva Black Women - Dresses Buy Online,Trendy Divva Black Women - Dresses  Best Price Rs 2742.00 Best Discount 22% Off EMI Rs 457 for 6 months FREE Shipping In Stock - Delivery in 6-8 Days,XSSMLXLXXL,<div class="product_detail_columns tinyscrl" itemprop="description" style=""><div class="scrollbar" style="width:2px; height:250px; background:#9E9E9E;"><div class="track" style="width:2px;"><div class="thumb" style="width:6px;"><div class="end"> </div></div></div></div><div class="viewport" style=" height:250px; width:252px; font-family:Arial !important;"><div class="overview" style="text-align:justify; display:block;"><div>Plain Casual Dress </div></div></div> </div>,,16:04:2014,
438066,trendy divva purple women dresses,http://www.yebhi.com/online-shopping/women/apparels.html?affint=women-topmenu,2739,Clothing,dress,trendy-divva,http://im6.ybndc.com/upload/438066/ProductRear635248017004728003.jpg,3495,,Women,http://www.yebhi.com/438066/PD/trendy-divva-purple-women-dresses.htm,yebhi.com,Trendy Divva Purple Women - Dresses Buy Online,Trendy Divva Purple Women - Dresses  Best Price Rs 2739.00 Best Discount 22% Off EMI Rs 457 for 6 months FREE Shipping In Stock - Delivery in 6-8 Days,XSSMLXLXXL,<div class="product_detail_columns tinyscrl" itemprop="description" style=""><div class="scrollbar" style="width:2px; height:250px; background:#9E9E9E;"><div class="track" style="width:2px;"><div class="thumb" style="width:6px;"><div class="end"> </div></div></div></div><div class="viewport" style=" height:250px; width:252px; font-family:Arial !important;"><div class="overview" style="text-align:justify; display:block;"><div>Knee Length evening dress </div></div></div> </div>,,16:04:2014,
438087,trendy divva pink women dresses,http://www.yebhi.com/online-shopping/women/apparels.html?affint=women-topmenu,5877,Clothing,dress,trendy-divva,http://im6.ybndc.com/upload/438087/ProductRear635248017097236003.jpg,7499,,Women,http://www.yebhi.com/438087/PD/trendy-divva-pink-women-dresses.htm,yebhi.com,Trendy Divva Pink Women - Dresses Buy Online,Trendy Divva Pink Women - Dresses  Best Price Rs 5877.00 Best Discount 22% Off EMI Rs 980 for 6 months FREE Shipping In Stock - Delivery in 6-8 Days,SMLXL,<div class="product_detail_columns tinyscrl" itemprop="description" style=""><div class="scrollbar" style="width:2px; height:250px; background:#9E9E9E;"><div class="track" style="width:2px;"><div class="thumb" style="width:6px;"><div class="end"> </div></div></div></div><div class="viewport" style=" height:250px; width:252px; font-family:Arial !important;"><div class="overview" style="text-align:justify; display:block;"><div>Party wear Pink and white designer dress </div></div></div> </div>,,16:04:2014,
438080,trendy divva black chiffon women dresses,http://www.yebhi.com/online-shopping/women/apparels.html?affint=women-topmenu,2350,Clothing,dress,trendy-divva,http://im6.ybndc.com/upload/438080/ProductRear635248017058548003.jpg,2999,,Women,http://www.yebhi.com/438080/PD/trendy-divva-black-chiffon-women-dresses.htm,yebhi.com,Trendy Divva Black Chiffon Women - Dresses Buy Online,Trendy Divva Black Chiffon Women - Dresses  Best Price Rs 2350.00 Best Discount 22% Off EMI Rs 392 for 6 months FREE Shipping In Stock - Delivery in 6-8 Days,LXLXXLXXXL4XL,<div class="product_detail_columns tinyscrl" itemprop="description" style=""><div class="scrollbar" style="width:2px; height:250px; background:#9E9E9E;"><div class="track" style="width:2px;"><div class="thumb" style="width:6px;"><div class="end"> </div></div></div></div><div class="viewport" style=" height:250px; width:252px; font-family:Arial !important;"><div class="overview" style="text-align:justify; display:block;"><div>One Shoulder printed dress </div></div></div> </div>,,16:04:2014,
438130,trendy divva green georgette women dresses,http://www.yebhi.com/online-shopping/women/apparels.html?affint=women-topmenu,3134,Clothing,dress,trendy-divva,http://im6.ybndc.com/upload/438130/ProductRear635248017301440003.jpg,3999,,Women,http://www.yebhi.com/438130/PD/trendy-divva-green-georgette-women-dresses.htm,yebhi.com,Trendy Divva Green Georgette Women - Dresses Buy Online,Trendy Divva Green Georgette Women - Dresses  Best Price Rs 3134.00 Best Discount 22% Off EMI Rs 522 for 6 months FREE Shipping In Stock - Delivery in 6-8 Days,XSSM,<div class="product_detail_columns tinyscrl" itemprop="description" style=""><div class="scrollbar" style="width:2px; height:250px; background:#9E9E9E;"><div class="track" style="width:2px;"><div class="thumb" style="width:6px;"><div class="end"> </div></div></div></div><div class="viewport" style=" height:250px; width:252px; font-family:Arial !important;"><div class="overview" style="text-align:justify; display:block;"><div>Sleeveless green Dress  with sequence at bottom </div></div></div> </div>,,16:04:2014,
237430,trendy divva black women cotton dresses,http://www.yebhi.com/online-shopping/women/apparels.html?affint=women-topmenu,3495,Clothing,dress,trendy-divva,http://im6.ybndc.com/upload/237430/ProductRear634862731042937587.jpg,3495,,Women,http://www.yebhi.com/237430/PD/trendy-divva-black-women-cotton-dresses.htm,yebhi.com,Trendy Divva Black Women Cotton - Dresses Buy Online,Trendy Divva Black Women Cotton - Dresses  Best Price Rs 2018.00 Best Discount 42% Off EMI Rs 336 for 6 months FREE Shipping in 2 Days,MXL,<div class="product_detail_columns tinyscrl" itemprop="description" style=""><div class="scrollbar" style="width:2px; height:250px; background:#9E9E9E;"><div class="track" style="width:2px;"><div class="thumb" style="width:6px;"><div class="end"> </div></div></div></div><div class="viewport" style=" height:250px; width:252px; font-family:Arial !important;"><div class="overview" style="text-align:justify; display:block;"><div>This classy black coloured one-piece short length dress from Trendy Divva is sure to give you a super-classy and trendy look. This plain dress comes with stylishly designed zips on its front. Go for the lovely dress in cotton fabric and get set to make a statement.<b>Style Tip</b>A pair of bellys with minimum make-up will complete your formal as well as casual look.<b>Material &amp; Care</b> Made of  CottonMachine washDo not bleach or tumble dry.Use cool iron. </div></div></div> </div>,,16:04:2014,
