461878,nite flite black cotton women night suits,http://www.yebhi.com/online-shopping/women/apparels.html?affint=women-topmenu,769,Clothing,nightwear,nite-flite,http://im6.ybndc.com/upload/461878/ProductRear635290214682602000.jpg,769,,Women,http://www.yebhi.com/461878/PD/nite-flite-black-cotton-women-night-suits.htm,yebhi.com,Nite Flite Black Cotton Women - Night Suits Buy Online,Nite Flite Black Cotton Women - Night Suits  Best Price Rs 769.00  EMI Rs 128 for 6 months FREE Shipping in 2 Days,MLXL,<div class="product_detail_columns tinyscrl" itemprop="description" style=""><div class="scrollbar" style="width:2px; height:250px; background:#9E9E9E;"><div class="track" style="width:2px;"><div class="thumb" style="width:6px;"><div class="end"> </div></div></div></div><div class="viewport" style=" height:250px; width:252px; font-family:Arial !important;"><div class="overview" style="text-align:justify; display:block;"><div>Comfy capris and tee complete with a funky owl..to lounge around in or even wear out on casual strolls. Are you a night owl? Then you'll want these! </div></div></div> </div>,,16:04:2014,
462705,nite flite grey cotton women boxer shorts,http://www.yebhi.com/online-shopping/women/apparels.html?affint=women-topmenu,299,Clothing,nightwear,nite-flite,http://im6.ybndc.com/upload/462705/ProductRear635290231825286000.jpg,299,,Women,http://www.yebhi.com/462705/PD/nite-flite-grey-cotton-women-boxer-shorts.htm,yebhi.com,Nite Flite Grey Cotton Women - Boxer Shorts Buy Online,Nite Flite Grey Cotton Women - Boxer Shorts  Best Price Rs 299.00  EMI Rs 50 for 6 months,SXL,<div class="product_detail_columns tinyscrl" itemprop="description" style=""><div class="scrollbar" style="width:2px; height:250px; background:#9E9E9E;"><div class="track" style="width:2px;"><div class="thumb" style="width:6px;"><div class="end"> </div></div></div></div><div class="viewport" style=" height:250px; width:252px; font-family:Arial !important;"><div class="overview" style="text-align:justify; display:block;"><div>You won't be able to resist such pretty shorts?we love the polka dots and the soft flowy feel of the cotton. Finished off with a cute pink ribbon on top! </div></div></div> </div>,,16:04:2014,
461879,nite flite pink cotton women nighty,http://www.yebhi.com/online-shopping/women/apparels.html?affint=women-topmenu,499,Clothing,nightwear,nite-flite,http://im6.ybndc.com/upload/461879/ProductRear635290229189822000.jpg,499,,Women,http://www.yebhi.com/461879/PD/nite-flite-pink-cotton-women-nighty.htm,yebhi.com,Nite Flite Pink Cotton Women - Nighty Buy Online,Nite Flite Pink Cotton Women - Nighty  Best Price Rs 499.00  EMI Rs 83 for 6 months,MLXL,<div class="product_detail_columns tinyscrl" itemprop="description" style=""><div class="scrollbar" style="width:2px; height:250px; background:#9E9E9E;"><div class="track" style="width:2px;"><div class="thumb" style="width:6px;"><div class="end"> </div></div></div></div><div class="viewport" style=" height:250px; width:252px; font-family:Arial !important;"><div class="overview" style="text-align:justify; display:block;"><div>This lovely nighty in wine with delicate flowers is sure to kill two birds with one stone - elegance and oh-so-soft comfort. Two pockets with tiny ribbons adds to the prettiness. :) </div></div></div> </div>,,16:04:2014,
461876,nite flite pink cotton women night suits,http://www.yebhi.com/online-shopping/women/apparels.html?affint=women-topmenu,649,Clothing,nightwear,nite-flite,http://im6.ybndc.com/upload/461876/ProductRear635303226193582000.jpg,649,,Women,http://www.yebhi.com/461876/PD/nite-flite-pink-cotton-women-night-suits.htm,yebhi.com,Nite Flite Pink Cotton Women - Night Suits Buy Online,Nite Flite Pink Cotton Women - Night Suits  Best Price Rs 649.00  EMI Rs 108 for 6 months FREE Shipping in 2 Days,MLXLXXL,<div class="product_detail_columns tinyscrl" itemprop="description" style=""><div class="scrollbar" style="width:2px; height:250px; background:#9E9E9E;"><div class="track" style="width:2px;"><div class="thumb" style="width:6px;"><div class="end"> </div></div></div></div><div class="viewport" style=" height:250px; width:252px; font-family:Arial !important;"><div class="overview" style="text-align:justify; display:block;"><div>Sleep in these  go jogging or just lounge around at home...this hot pink hoodie set is both comfy and trendy. </div></div></div> </div>,,16:04:2014,
461875,nite flite green cotton women night suits,http://www.yebhi.com/online-shopping/women/apparels.html?affint=women-topmenu,619,Clothing,nightwear,nite-flite,http://im6.ybndc.com/upload/461875/ProductRear635290213740206000.jpg,619,,Women,http://www.yebhi.com/461875/PD/nite-flite-green-cotton-women-night-suits.htm,yebhi.com,Nite Flite Green Cotton Women - Night Suits Buy Online,Nite Flite Green Cotton Women - Night Suits  Best Price Rs 619.00  EMI Rs 103 for 6 months FREE Shipping in 2 Days,MLXL,<div class="product_detail_columns tinyscrl" itemprop="description" style=""><div class="scrollbar" style="width:2px; height:250px; background:#9E9E9E;"><div class="track" style="width:2px;"><div class="thumb" style="width:6px;"><div class="end"> </div></div></div></div><div class="viewport" style=" height:250px; width:252px; font-family:Arial !important;"><div class="overview" style="text-align:justify; display:block;"><div>A smart shorts set in a summery green and a message of peace...do your bit even when asleep! </div></div></div> </div>,,16:04:2014,
462706,nite flite green cotton women boxer shorts,http://www.yebhi.com/online-shopping/women/apparels.html?affint=women-topmenu,299,Clothing,nightwear,nite-flite,http://im6.ybndc.com/upload/462706/ProductRear635290232047742000.jpg,299,,Women,http://www.yebhi.com/462706/PD/nite-flite-green-cotton-women-boxer-shorts.htm,yebhi.com,Nite Flite Green Cotton Women - Boxer Shorts Buy Online,Nite Flite Green Cotton Women - Boxer Shorts  Best Price Rs 299.00  EMI Rs 50 for 6 months,SMLXL,<div class="product_detail_columns tinyscrl" itemprop="description" style=""><div class="scrollbar" style="width:2px; height:250px; background:#9E9E9E;"><div class="track" style="width:2px;"><div class="thumb" style="width:6px;"><div class="end"> </div></div></div></div><div class="viewport" style=" height:250px; width:252px; font-family:Arial !important;"><div class="overview" style="text-align:justify; display:block;"><div>Attractive shorts in a cool  funky mint  with black piping at borders and pockets. 100% cotton ensures a very comfy fit...perfect to unwind in after a long day! </div></div></div> </div>,,16:04:2014,
461873,nite flite blue cotton women night suits,http://www.yebhi.com/online-shopping/women/apparels.html?affint=women-topmenu,629,Clothing,nightwear,nite-flite,http://im6.ybndc.com/upload/461873/ProductRear635303225683462000.jpg,629,,Women,http://www.yebhi.com/461873/PD/nite-flite-blue-cotton-women-night-suits.htm,yebhi.com,Nite Flite Blue Cotton Women - Night Suits Buy Online,Nite Flite Blue Cotton Women - Night Suits  Best Price Rs 629.00  EMI Rs 105 for 6 months FREE Shipping in 2 Days,MLXLXXL,<div class="product_detail_columns tinyscrl" itemprop="description" style=""><div class="scrollbar" style="width:2px; height:250px; background:#9E9E9E;"><div class="track" style="width:2px;"><div class="thumb" style="width:6px;"><div class="end"> </div></div></div></div><div class="viewport" style=" height:250px; width:252px; font-family:Arial !important;"><div class="overview" style="text-align:justify; display:block;"><div>A navy blue tee paired up with pink checked shorts  this cute sleep set is sure to drive away your blues...and the dog's too! </div></div></div> </div>,,16:04:2014,
461874,nite flite pink cotton women night suits,http://www.yebhi.com/online-shopping/women/apparels.html?affint=women-topmenu,619,Clothing,nightwear,nite-flite,http://im6.ybndc.com/upload/461874/ProductRear635290212999674000.jpg,619,,Women,http://www.yebhi.com/461874/PD/nite-flite-pink-cotton-women-night-suits.htm,yebhi.com,Nite Flite Pink Cotton Women - Night Suits Buy Online,Nite Flite Pink Cotton Women - Night Suits  Best Price Rs 619.00  EMI Rs 103 for 6 months FREE Shipping in 2 Days,MLXLXXL,<div class="product_detail_columns tinyscrl" itemprop="description" style=""><div class="scrollbar" style="width:2px; height:250px; background:#9E9E9E;"><div class="track" style="width:2px;"><div class="thumb" style="width:6px;"><div class="end"> </div></div></div></div><div class="viewport" style=" height:250px; width:252px; font-family:Arial !important;"><div class="overview" style="text-align:justify; display:block;"><div>C'est Bon = 'It's good' in French. 'So good' is what people say when they see our stuff at Nite Flite! :) Pink and love are inseparable  and this pretty sleepwear set in grey and pink is the perfect case in point! </div></div></div> </div>,,16:04:2014,
461877,nite flite white cotton women night suits,http://www.yebhi.com/online-shopping/women/apparels.html?affint=women-topmenu,739,Clothing,nightwear,nite-flite,http://im6.ybndc.com/upload/461877/ProductRear635290214400710000.jpg,739,,Women,http://www.yebhi.com/461877/PD/nite-flite-white-cotton-women-night-suits.htm,yebhi.com,Nite Flite White Cotton Women - Night Suits Buy Online,Nite Flite White Cotton Women - Night Suits  Best Price Rs 739.00  EMI Rs 123 for 6 months FREE Shipping in 2 Days,MLXLXXL,<div class="product_detail_columns tinyscrl" itemprop="description" style=""><div class="scrollbar" style="width:2px; height:250px; background:#9E9E9E;"><div class="track" style="width:2px;"><div class="thumb" style="width:6px;"><div class="end"> </div></div></div></div><div class="viewport" style=" height:250px; width:252px; font-family:Arial !important;"><div class="overview" style="text-align:justify; display:block;"><div>A stylish  comfy piece  great for all ages :)  Sleep in style without compromising on comfort! </div></div></div> </div>,,16:04:2014,
461881,nite flite pink cotton womens pyjamas,http://www.yebhi.com/online-shopping/women/apparels.html?affint=women-topmenu,399,Clothing,nightwear,nite-flite,http://im6.ybndc.com/upload/461881/ProductRear635297182074066000.jpg,399,,Women,http://www.yebhi.com/461881/PD/nite-flite-pink-cotton-womens-pyjamas.htm,yebhi.com,Nite Flite Pink Cotton - Womens Pyjamas Buy Online,Nite Flite Pink Cotton - Womens Pyjamas  Best Price Rs 399.00  EMI Rs 67 for 6 months,MLXL,<div class="product_detail_columns tinyscrl" itemprop="description" style=""><div class="scrollbar" style="width:2px; height:250px; background:#9E9E9E;"><div class="track" style="width:2px;"><div class="thumb" style="width:6px;"><div class="end"> </div></div></div></div><div class="viewport" style=" height:250px; width:252px; font-family:Arial !important;"><div class="overview" style="text-align:justify; display:block;"><div>Cute pyjama alert! These pink PJs adorned with tiny black ribbons are perfect for lounging in. Team up with your favourite tee/cami to complete the look! </div></div></div> </div>,,16:04:2014,
461872,nite flite pink cotton women night suits,http://www.yebhi.com/online-shopping/women/apparels.html?affint=women-topmenu,589,Clothing,nightwear,nite-flite,http://im6.ybndc.com/upload/461872/ProductRear635290212598754000.jpg,589,,Women,http://www.yebhi.com/461872/PD/nite-flite-pink-cotton-women-night-suits.htm,yebhi.com,Nite Flite Pink Cotton Women - Night Suits Buy Online,Nite Flite Pink Cotton Women - Night Suits  Best Price Rs 589.00  EMI Rs 98 for 6 months FREE Shipping in 2 Days,LXL,<div class="product_detail_columns tinyscrl" itemprop="description" style=""><div class="scrollbar" style="width:2px; height:250px; background:#9E9E9E;"><div class="track" style="width:2px;"><div class="thumb" style="width:6px;"><div class="end"> </div></div></div></div><div class="viewport" style=" height:250px; width:252px; font-family:Arial !important;"><div class="overview" style="text-align:justify; display:block;"><div>Sizzle in this sexy racerback tee and shorts set! Perfect for chilling. :) it's sexy  it's cute  and comfy to boot...need we say more? </div></div></div> </div>,,16:04:2014,
461880,nite flite pink cotton women nighty,http://www.yebhi.com/online-shopping/women/apparels.html?affint=women-topmenu,499,Clothing,nightwear,nite-flite,http://im6.ybndc.com/upload/461880/ProductRear635290229408222000.jpg,499,,Women,http://www.yebhi.com/461880/PD/nite-flite-pink-cotton-women-nighty.htm,yebhi.com,Nite Flite Pink Cotton Women - Nighty Buy Online,Nite Flite Pink Cotton Women - Nighty  Best Price Rs 499.00  EMI Rs 83 for 6 months,MLXL,<div class="product_detail_columns tinyscrl" itemprop="description" style=""><div class="scrollbar" style="width:2px; height:250px; background:#9E9E9E;"><div class="track" style="width:2px;"><div class="thumb" style="width:6px;"><div class="end"> </div></div></div></div><div class="viewport" style=" height:250px; width:252px; font-family:Arial !important;"><div class="overview" style="text-align:justify; display:block;"><div>Charm your prince with this super-cute nighty! Made from pure cotton and a treat to sleep in  it guarantees sweet dreams of you with yours. ;) </div></div></div> </div>,,16:04:2014,
461882,nite flite black cotton womens pyjamas,http://www.yebhi.com/online-shopping/women/apparels.html?affint=women-topmenu,399,Clothing,nightwear,nite-flite,http://im6.ybndc.com/upload/461882/ProductRear635297183182446000.jpg,399,,Women,http://www.yebhi.com/461882/PD/nite-flite-black-cotton-womens-pyjamas.htm,yebhi.com,Nite Flite Black Cotton - Womens Pyjamas Buy Online,Nite Flite Black Cotton - Womens Pyjamas  Best Price Rs 399.00  EMI Rs 67 for 6 months,MXL,<div class="product_detail_columns tinyscrl" itemprop="description" style=""><div class="scrollbar" style="width:2px; height:250px; background:#9E9E9E;"><div class="track" style="width:2px;"><div class="thumb" style="width:6px;"><div class="end"> </div></div></div></div><div class="viewport" style=" height:250px; width:252px; font-family:Arial !important;"><div class="overview" style="text-align:justify; display:block;"><div>How funky are these radio PJs! A retro look for lounging in style...made from pure cotton  and a treat to the eyes and the body! Perfect for evenings on the sofa. :) </div></div></div> </div>,,16:04:2014,
