303359,fabdeal blue dress materials,http://www.yebhi.com/online-shopping/women/apparels.html?affint=women-topmenu,949,Clothing,dress-materials,fabdeal,http://im6.ybndc.com/upload/303359/ProductRear635049199979016452.jpg,949,,Women,http://www.yebhi.com/303359/PD/fabdeal-blue-dress-materials.htm,yebhi.com,Fabdeal Blue - Dress Materials Buy Online,Fabdeal Blue - Dress Materials  Best Price Rs 725.00 Best Discount 24% Off EMI Rs 121 for 6 months FREE Shipping In Stock - Delivery in 9-12 Days,None,<div class="product_detail_columns tinyscrl" itemprop="description" style=""><div class="scrollbar" style="width:2px; height:250px; background:#9E9E9E;"><div class="track" style="width:2px;"><div class="thumb" style="width:6px;"><div class="end"> </div></div></div></div><div class="viewport" style=" height:250px; width:252px; font-family:Arial !important;"><div class="overview" style="text-align:justify; display:block;"><div> This dress material in <b>blue and red colour</b> feature <b>self prints</b> all over<b>embroidered at the hem at the yoke</b>. It is crafted with <b>cotton polyester material</b> and comes with <b>matching bottom and dupatta</b>. This pretty pick is from the house of <b>Fabdeal.</b><br/><br/><b>Features</b><ul style="margin-left: 20px;"><li type="disc"><b>Brand: </b>Fabdeal</li><li type="disc"><b>Category: </b>Traditional and Ethnic Wear</li><li type="disc"><b>Type: </b>Dress Material</li><li type="disc"><b>Fabric: </b>Cotton Polyester</li><li type="disc"><b>Colour: </b>Red  Blue</li></ul><br/><b>Wash and Care </b><br/>  Do not bleach or dry clean<br> Wash with like colours<br> Line dry<br>Warm iron<br><br/><br/><b>Note:</b> There may be a slight colour variation in the image from original product  </br></br></br></br></div></div></div> </div>,,16:04:2014,
455559,fabdeal beige dress materials,http://www.yebhi.com/online-shopping/women/apparels.html?affint=women-topmenu,999,Clothing,dress-materials,fabdeal,http://im6.ybndc.com/upload/455559/ProductRear635261837544690000.jpg,999,,Women,http://www.yebhi.com/455559/PD/fabdeal-beige-dress-materials.htm,yebhi.com,Fabdeal Beige - Dress Materials Buy Online,Fabdeal Beige - Dress Materials  Best Price Rs 999.00  EMI Rs 167 for 6 months FREE Shipping In Stock - Delivery in 13-17 Days,None,<div class="product_detail_columns tinyscrl" itemprop="description" style=""><div class="scrollbar" style="width:2px; height:250px; background:#9E9E9E;"><div class="track" style="width:2px;"><div class="thumb" style="width:6px;"><div class="end"> </div></div></div></div><div class="viewport" style=" height:250px; width:252px; font-family:Arial !important;"><div class="overview" style="text-align:justify; display:block;"><div>Top : 2.00 M  Inner : 1.90 M  Bottom : 2.00 M  Dupatta : 2.20 M </div></div></div> </div>,,16:04:2014,
455591,fabdeal black dress materials,http://www.yebhi.com/online-shopping/women/apparels.html?affint=women-topmenu,699,Clothing,dress-materials,fabdeal,http://im6.ybndc.com/upload/455591/ProductRear635261837633454000.jpg,699,,Women,http://www.yebhi.com/455591/PD/fabdeal-black-dress-materials.htm,yebhi.com,Fabdeal Black - Dress Materials Buy Online,Fabdeal Black - Dress Materials  Best Price Rs 699.00  EMI Rs 117 for 6 months FREE Shipping In Stock - Delivery in 13-17 Days,None,<div class="product_detail_columns tinyscrl" itemprop="description" style=""><div class="scrollbar" style="width:2px; height:250px; background:#9E9E9E;"><div class="track" style="width:2px;"><div class="thumb" style="width:6px;"><div class="end"> </div></div></div></div><div class="viewport" style=" height:250px; width:252px; font-family:Arial !important;"><div class="overview" style="text-align:justify; display:block;"><div>Top : 2.00 M  Bottom : 1.90 M  Dupatta : 2.20 M </div></div></div> </div>,,16:04:2014,
418863,fabdeal yellow dress materials,http://www.yebhi.com/online-shopping/women/apparels.html?affint=women-topmenu,2049,Clothing,dress-materials,fabdeal,http://im6.ybndc.com/upload/418863/ProductRear635201351700619278.jpg,2049,,Women,http://www.yebhi.com/418863/PD/fabdeal-yellow-dress-materials.htm,yebhi.com,Fabdeal Yellow - Dress Materials Buy Online,Fabdeal Yellow - Dress Materials  Best Price Rs 2049.00  EMI Rs 342 for 6 months FREE Shipping In Stock - Delivery in 13-17 Days,None,<div class="product_detail_columns tinyscrl" itemprop="description" style=""><div class="scrollbar" style="width:2px; height:250px; background:#9E9E9E;"><div class="track" style="width:2px;"><div class="thumb" style="width:6px;"><div class="end"> </div></div></div></div><div class="viewport" style=" height:250px; width:252px; font-family:Arial !important;"><div class="overview" style="text-align:justify; display:block;"><div> This <b>dress material</b> in <b>yellow  blue and red</b> colour feature <b>beautiful embroidery</b> on the <b>yoke and the hem</b>. The <b>dress material</b> has <b>georgette upper</b> with <b>crepe inner and bottom</b>. It comes with <b>contrast coloured bottom and dupatta</b>.<br/><br/><b>Features</b><ul style="margin-left: 20px;"><li type="disc"><b>Brand: </b>Fabdeal</li><li type="disc"><b>Category: </b>Traditional and Ethnic Wear</li><li type="disc"><b>Type: </b>Dress Material</li><li type="disc"><b>Fabric: </b>Georgette  Chiffon  Crepe</li><li type="disc"><b>Colour: </b>Yellow  Blue  Red</li></ul><br/><b>Wash and Care </b><br/>  Wash it with a mild detergent.<br> If washing in a machine  set it on a delicate mode and low temperature cycle<br> Wash dark colours separately and  use iron at low temperature<br/><br/><b>Note:</b> There may be a slight colour variation in the image from original product  </br></br></div></div></div> </div>,,16:04:2014,
300786,fabdeal red art silk dress materials,http://www.yebhi.com/online-shopping/women/apparels.html?affint=women-topmenu,749,Clothing,dress-materials,fabdeal,http://im6.ybndc.com/upload/300786/ProductRear635042220417136705.jpg,749,,Women,http://www.yebhi.com/300786/PD/fabdeal-red-art-silk-dress-materials.htm,yebhi.com,Fabdeal Red Art Silk - Dress Materials Buy Online,Fabdeal Red Art Silk - Dress Materials  Best Price Rs 749.00  EMI Rs 125 for 6 months FREE Shipping In Stock - Delivery in 9-12 Days,None,<div class="product_detail_columns tinyscrl" itemprop="description" style=""><div class="scrollbar" style="width:2px; height:250px; background:#9E9E9E;"><div class="track" style="width:2px;"><div class="thumb" style="width:6px;"><div class="end"> </div></div></div></div><div class="viewport" style=" height:250px; width:252px; font-family:Arial !important;"><div class="overview" style="text-align:justify; display:block;"><div> This pretty<b> dress material</b> is made with <b>art silk material</b>. It comes in <b>red colour </b>with <b>geometrical prints</b> all over. It comes with <b>same colour lower</b>  and <b>dupatta</b> with <b>similar geometric prints</b>.<br/><br/><b>Features</b><ul style="margin-left: 20px;"><li type="disc"><b>Brand:</b>Fabdeal</li><li type="disc"><b>Category:</b> Traditional and Ethnic Wear</li><li type="disc"><b>Type:</b> Dress Material</li><li type="disc"><b>Fabric:</b> Art Silk</li><li type="disc"><b>Colour:</b> Red  Blue</li></ul><br/><b>Wash &amp; Care</b><br/>  Wash it with a mild detergent<br> If washing in a machine  set it on a delicate mode and low temperature cycle<br> Wash dark colours separately and use iron at low temperature<br><br><b>Note:</b> There may be a slight colour variation in the image from original product   </br></br></br></br></div></div></div> </div>,,16:04:2014,
295775,fabdeal green dress materials,http://www.yebhi.com/online-shopping/women/apparels.html?affint=women-topmenu,1049,Clothing,dress-materials,fabdeal,http://im6.ybndc.com/upload/295775/ProductRear635026708009911244.jpg,1049,,Women,http://www.yebhi.com/295775/PD/fabdeal-green-dress-materials.htm,yebhi.com,Fabdeal Green - Dress Materials Buy Online,Fabdeal Green - Dress Materials  Best Price Rs 1049.00  EMI Rs 175 for 6 months FREE Shipping In Stock - Delivery in 9-12 Days,None,<div class="product_detail_columns tinyscrl" itemprop="description" style=""><div class="scrollbar" style="width:2px; height:250px; background:#9E9E9E;"><div class="track" style="width:2px;"><div class="thumb" style="width:6px;"><div class="end"> </div></div></div></div><div class="viewport" style=" height:250px; width:252px; font-family:Arial !important;"><div class="overview" style="text-align:justify; display:block;"><div> Beautifully designed  this <b>dress material</b> in <b>green colour</b> is crafted with <b>cotton polyester material</b>. It features <b>circular prints</b> all over with <b>thread work in floral pattern</b>. It comes with <b>solid patterned lower</b> in <b>green colour</b> and <b>dupatta</b> in <b>green and white</b> with <b>self prints</b> all over.<br/><br/><b>Features</b><ul style="margin-left: 20px;"><li type="disc"><b>Brand:</b>Fabdeal</li><li type="disc"><b>Category:</b> Traditional and Ethnic Wear</li><li type="disc"><b>Type:</b> Dress Material</li><li type="disc"><b>Fabric:</b> Cotton Polyester</li><li type="disc"><b>Colour: </b>Green  White</li></ul><br/><b>Wash &amp; Care</b><br/>  Do not bleach or dry clean<br> Wash with like colours<br> Line dry<br>Warm iron<br><br><b>Note:</b> There may be a slight colour variation in the image from original product   </br></br></br></br></br></div></div></div> </div>,,16:04:2014,
300800,fabdeal green art silk dress materials,http://www.yebhi.com/online-shopping/women/apparels.html?affint=women-topmenu,749,Clothing,dress-materials,fabdeal,http://im6.ybndc.com/upload/300800/ProductRear635042225244743651.jpg,749,,Women,http://www.yebhi.com/300800/PD/fabdeal-green-art-silk-dress-materials.htm,yebhi.com,Fabdeal Green Art Silk - Dress Materials Buy Online,Fabdeal Green Art Silk - Dress Materials  Best Price Rs 749.00  EMI Rs 125 for 6 months FREE Shipping In Stock - Delivery in 9-12 Days,None,<div class="product_detail_columns tinyscrl" itemprop="description" style=""><div class="scrollbar" style="width:2px; height:250px; background:#9E9E9E;"><div class="track" style="width:2px;"><div class="thumb" style="width:6px;"><div class="end"> </div></div></div></div><div class="viewport" style=" height:250px; width:252px; font-family:Arial !important;"><div class="overview" style="text-align:justify; display:block;"><div>  This pretty<b> dress material</b> is made with <b>art silk material</b>. It comes in <b>blue and green colour colour </b>with <b>contemporary prints</b> all over. It comes with <b>green colour lower</b>  and <b>dupatta</b> with <b>similar contemporary prints</b>.<br/><br/><b>Features</b><ul style="margin-left: 20px;"><li type="disc"><b>Brand:</b>Fabdeal</li><li type="disc"><b>Category:</b> Traditional and Ethnic Wear</li><li type="disc"><b>Type:</b> Dress Material</li><li type="disc"><b>Fabric:</b> Art Silk</li><li type="disc"><b>Colour:</b> Green  Blue  Red</li></ul><br/><b>Wash &amp; Care</b><br/>  Wash it with a mild detergent<br/> If washing in a machine  set it on a delicate mode and low temperature cycle<br/> Wash dark colours separately and use iron at low temperature<br/><br/><b>Note:</b> There may be a slight colour variation in the image from original product </div></div></div> </div>,,16:04:2014,
310824,fabdeal beige cotton dress materials,http://www.yebhi.com/online-shopping/women/apparels.html?affint=women-topmenu,2049,Clothing,dress-materials,fabdeal,http://im6.ybndc.com/upload/310824/ProductRear635059528842035217.jpg,2049,,Women,http://www.yebhi.com/310824/PD/fabdeal-beige-cotton-dress-materials.htm,yebhi.com,Fabdeal Beige Cotton - Dress Materials Buy Online,Fabdeal Beige Cotton - Dress Materials  Best Price Rs 2049.00  EMI Rs 342 for 6 months FREE Shipping In Stock - Delivery in 9-12 Days,None,<div class="product_detail_columns tinyscrl" itemprop="description" style=""><div class="scrollbar" style="width:2px; height:250px; background:#9E9E9E;"><div class="track" style="width:2px;"><div class="thumb" style="width:6px;"><div class="end"> </div></div></div></div><div class="viewport" style=" height:250px; width:252px; font-family:Arial !important;"><div class="overview" style="text-align:justify; display:block;"><div> This suit in<b> beige colour</b> features <b>self prints all over</b> with <b>heavy embroidery at the hem</b>.  It comes with <b>green coloured solid lower</b> with a pretty dupatta in <b>triple shade</b> with <b>red piping and at the borders</b>.<br/><br/><b>Features</b><ul style="margin-left: 20px;"><li type="disc"><b>Brand:</b>Fabdeal</li><li type="disc"><b>Category:</b> Traditional and Ethnic Wear</li><li type="disc"><b>Type:</b> Dress Material</li><li type="disc"><b>Fabric:</b> Cotton</li><li type="disc"><b>Colour: </b>Beige  Green</li></ul><br/><b>Wash &amp; Care</b><br/>  Wash it with a mild detergent<br> If washing in a machine  set it on a delicate mode and low temperature cycle<br> Wash dark colours separately and use iron at low temperature<br><br><b>Note:</b> There may be a slight colour variation in the image from original product </br></br></br></br></div></div></div> </div>,,16:04:2014,
488619,fabdeal blue art silk dress materials,http://www.yebhi.com/online-shopping/women/apparels.html?affint=women-topmenu,923,Clothing,dress-materials,fabdeal,http://im6.ybndc.com/upload/488619/ProductRear635304092908366000.jpg,923,,Women,http://www.yebhi.com/488619/PD/fabdeal-blue-art-silk-dress-materials.htm,yebhi.com,Fabdeal Blue Art Silk - Dress Materials Buy Online,Fabdeal Blue Art Silk - Dress Materials  Best Price Rs 923.00  EMI Rs 154 for 6 months FREE Shipping In Stock - Delivery in 6-8 Days,None,<div class="product_detail_columns tinyscrl" itemprop="description" style=""><div class="scrollbar" style="width:2px; height:250px; background:#9E9E9E;"><div class="track" style="width:2px;"><div class="thumb" style="width:6px;"><div class="end"> </div></div></div></div><div class="viewport" style=" height:250px; width:252px; font-family:Arial !important;"><div class="overview" style="text-align:justify; display:block;"><div>Top  : 1.90 M  Bottom : 1.90 M  Dupatta : 2.10 M  Top : Chanderi Silk  Bottom : Semi Pissi  Dupatta : Chiffon Lining:  NON PADDED Embroidered DRYCLEAN Sway away everyone with your simplicity as you put on this ethnic suit set that has most appealing chanderi silk on its top  Semi Pissi in its bottom with chiffon dupatta. The exquisite work done on the frontal portion adjoins charm and makes it worth buying. Grab this assortment to attain desired quality like never before. </div></div></div> </div>,,16:04:2014,
455599,fabdeal beige dress materials,http://www.yebhi.com/online-shopping/women/apparels.html?affint=women-topmenu,849,Clothing,dress-materials,fabdeal,http://im6.ybndc.com/upload/455599/ProductRear635261837653266000.jpg,849,,Women,http://www.yebhi.com/455599/PD/fabdeal-beige-dress-materials.htm,yebhi.com,Fabdeal Beige - Dress Materials Buy Online,Fabdeal Beige - Dress Materials  Best Price Rs 849.00  EMI Rs 142 for 6 months FREE Shipping In Stock - Delivery in 13-17 Days,None,<div class="product_detail_columns tinyscrl" itemprop="description" style=""><div class="scrollbar" style="width:2px; height:250px; background:#9E9E9E;"><div class="track" style="width:2px;"><div class="thumb" style="width:6px;"><div class="end"> </div></div></div></div><div class="viewport" style=" height:250px; width:252px; font-family:Arial !important;"><div class="overview" style="text-align:justify; display:block;"><div>Top : 2.00 M  Bottom : 2.00 M  Dupatta : 2.20 M </div></div></div> </div>,,16:04:2014,
310821,fabdeal green cotton dress materials,http://www.yebhi.com/online-shopping/women/apparels.html?affint=women-topmenu,2299,Clothing,dress-materials,fabdeal,http://im6.ybndc.com/upload/310821/ProductRear635059527812896620.jpg,2299,,Women,http://www.yebhi.com/310821/PD/fabdeal-green-cotton-dress-materials.htm,yebhi.com,Fabdeal Green Cotton - Dress Materials Buy Online,Fabdeal Green Cotton - Dress Materials  Best Price Rs 2299.00  EMI Rs 383 for 6 months FREE Shipping In Stock - Delivery in 9-12 Days,None,<div class="product_detail_columns tinyscrl" itemprop="description" style=""><div class="scrollbar" style="width:2px; height:250px; background:#9E9E9E;"><div class="track" style="width:2px;"><div class="thumb" style="width:6px;"><div class="end"> </div></div></div></div><div class="viewport" style=" height:250px; width:252px; font-family:Arial !important;"><div class="overview" style="text-align:justify; display:block;"><div> This suit in<b> green and yellow colour</b> features <b>floral prints all over</b> with <b>floral embroidery on black patch work at the neck and at the hem</b>.  It comes with <b>green coloured solid lower</b> with a pretty dupatta with <b>red piping and at the borders</b>.<br/><br/><b>Features</b><ul style="margin-left: 20px;"><li type="disc"><b>Brand:</b>Fabdeal</li><li type="disc"><b>Category:</b> Traditional and Ethnic Wear</li><li type="disc"><b>Type:</b> Dress Material</li><li type="disc"><b>Fabric:</b> Cotton</li><li type="disc"><b>Colour: </b>Green  Yellow</li></ul><br/><b>Wash &amp; Care</b><br/>  Wash it with a mild detergent<br> If washing in a machine  set it on a delicate mode and low temperature cycle<br> Wash dark colours separately and use iron at low temperature<br><br><b>Note:</b> There may be a slight colour variation in the image from original product </br></br></br></br></div></div></div> </div>,,16:04:2014,
319112,fabdeal white dress material,http://www.yebhi.com/online-shopping/women/apparels.html?affint=women-topmenu,1699,Clothing,dress-materials,fabdeal,http://im6.ybndc.com/upload/319112/ProductRear635072627996858475.jpg,1699,,Women,http://www.yebhi.com/319112/PD/fabdeal-white-dress-material.htm,yebhi.com,Fabdeal White - Dress Material Buy Online,Fabdeal White - Dress Material  Best Price Rs 1699.00  EMI Rs 283 for 6 months FREE Shipping In Stock - Delivery in 9-12 Days,None,<div class="product_detail_columns tinyscrl" itemprop="description" style=""><div class="scrollbar" style="width:2px; height:250px; background:#9E9E9E;"><div class="track" style="width:2px;"><div class="thumb" style="width:6px;"><div class="end"> </div></div></div></div><div class="viewport" style=" height:250px; width:252px; font-family:Arial !important;"><div class="overview" style="text-align:justify; display:block;"><div><table><tr><td><b>Colour</b></td><td>    </td><td>Blue   White</td></tr><tr><td><b>For</b></td><td>    </td><td>Women</td></tr><tr><td><b>Material</b></td><td>    </td><td>Polyester   Georgette</td></tr><tr><td><b>Brands</b></td><td>    </td><td>Fabdeal</td></tr><tr><td><b>Departments</b></td><td>    </td><td>Apparels</td></tr><tr><td><b>Category</b></td><td>    </td><td>Dress Materials</td></tr></table>  </div></div></div> </div>,,16:04:2014,
418861,fabdeal beige dress materials,http://www.yebhi.com/online-shopping/women/apparels.html?affint=women-topmenu,2049,Clothing,dress-materials,fabdeal,http://im6.ybndc.com/upload/418861/ProductRear635201351694379238.jpg,2049,,Women,http://www.yebhi.com/418861/PD/fabdeal-beige-dress-materials.htm,yebhi.com,Fabdeal Beige - Dress Materials Buy Online,Fabdeal Beige - Dress Materials  Best Price Rs 2049.00  EMI Rs 342 for 6 months FREE Shipping In Stock - Delivery in 13-17 Days,None,<div class="product_detail_columns tinyscrl" itemprop="description" style=""><div class="scrollbar" style="width:2px; height:250px; background:#9E9E9E;"><div class="track" style="width:2px;"><div class="thumb" style="width:6px;"><div class="end"> </div></div></div></div><div class="viewport" style=" height:250px; width:252px; font-family:Arial !important;"><div class="overview" style="text-align:justify; display:block;"><div> This <b>dress material</b> in <b>beige and black</b> colour feature <b>beautiful embroidery</b> on the <b>yoke and the hem</b>. The <b>dress material</b> has <b>georgette upper</b> with <b>crepe inner and bottom</b>. It comes with <b>contrast coloured bottom and dupatta</b>.<br/><br/><b>Features</b><ul style="margin-left: 20px;"><li type="disc"><b>Brand: </b>Fabdeal</li><li type="disc"><b>Category: </b>Traditional and Ethnic Wear</li><li type="disc"><b>Type: </b>Dress Material</li><li type="disc"><b>Fabric: </b>Georgette  Chiffon  Crepe</li><li type="disc"><b>Colour: </b>Beige  Black</li></ul><br/><b>Wash and Care </b><br/>  Wash it with a mild detergent.<br> If washing in a machine  set it on a delicate mode and low temperature cycle<br> Wash dark colours separately and  use iron at low temperature<br/><br/><b>Note:</b> There may be a slight colour variation in the image from original product  </br></br></div></div></div> </div>,,16:04:2014,
3html?affint=women-topmenu,fabdeal beige dress materials,http://www.yebhi.com/online-shopping/women/apparels.html?affint=women-topmenu,dress-materials,Clothing,dress-materials,fabdeal,Women,Clothing,,Women,http://www.yebhi.com/382108/PD/fabdeal-beige-dress-materials.htm,yebhi.com,Fabdeal Yellow - Dress Materials Buy Online,Fabdeal Yellow - Dress Materials  Best Price Rs 649.00  EMI Rs 108 for 6 months FREE Shipping In Stock - Delivery in 9-12 Days,http://www.yebhi.com/online-shopping/women/dress-materials.html?affint=women-topmenu&lc=Category,<div class="product_detail_columns tinyscrl" itemprop="description" style=""><div class="scrollbar" style="width:2px; height:250px; background:#9E9E9E;"><div class="track" style="width:2px;"><div class="thumb" style="width:6px;"><div class="end"> </div></div></div></div><div class="viewport" style=" height:250px; width:252px; font-family:Arial !important;"><div class="overview" style="text-align:justify; display:block;"><div> This <b>dress material</b> in <b>brown  yellow and purple</b> colour from the house of <b>Fabdeal</b> features <b>self prints</b> all over. It comes with a <b>matching bottom</b> and <b>printed dupatta</b>. It is crafted with <b>crepe and polyester material</b>.<br/><br/><b>Features</b><ul style="margin-left: 20px;"><li type="disc"><b>Brand: </b>Fabdeal</li><li type="disc"><b>Category: </b>Traditional and Ethnic Wear</li><li type="disc"><b>Type: </b>Dress Material</li><li type="disc"><b>Fabric: </b>Crepe  Polyester</li><li type="disc"><b>Length of Kameez (in mts): </b>2.50</li><li type="disc"><b>Length of Salwaar(in mts): </b>2.25</li><li type="disc"><b>Length of Dupatta(in mts): </b>3</li><li type="disc"><b>Colour: </b>Brown  Yellow  Purple</li></ul><br/><b>Wash and Care </b><br/>  Do not bleach or dry clean<br> Wash with like colours<br> Line dry<br>Warm iron<br><br/><br/><b>Note:</b> There may be a slight colour variation in the image from original product  </br></br></br></br></div></div></div> </div>,,16:04:2014,
446897,fashion street yellow women belts,http://www.yebhi.com/online-shopping/women/apparels.html?affint=women-topmenu,774,Clothing,dress-materials,fabdeal,http://im6.ybndc.com/upload/446897/ProductRear635246265244360003.jpg,774,,Women,http://www.yebhi.com/446897/PD/fashion-street-yellow-women-belts.htm,yebhi.com,Fashion Street Yellow Women - Belts Buy Online,Fashion Street Yellow Women - Belts  Best Price Rs 774.00  EMI Rs 129 for 6 months FREE Shipping In Stock - Delivery in 8-10 Days,None,<div class="product_detail_columns tinyscrl" itemprop="description" style=""><div class="scrollbar" style="width:2px; height:250px; background:#9E9E9E;"><div class="track" style="width:2px;"><div class="thumb" style="width:6px;"><div class="end"> </div></div></div></div><div class="viewport" style=" height:250px; width:252px; font-family:Arial !important;"><div class="overview" style="text-align:justify; display:block;"><div>Material:Artificialpu </div></div></div> </div>,,16:04:2014,
330219,fabdeal blue dress materials,http://www.yebhi.com/online-shopping/women/apparels.html?affint=women-topmenu,599,Clothing,dress-materials,fabdeal,http://im6.ybndc.com/upload/330219/ProductRear635097600021252000.jpg,599,,Women,http://www.yebhi.com/330219/PD/fabdeal-blue-dress-materials.htm,yebhi.com,Fabdeal Blue - Dress Materials Buy Online,Fabdeal Blue - Dress Materials  Best Price Rs 599.00  EMI Rs 100 for 6 months FREE Shipping In Stock - Delivery in 9-12 Days,None,<div class="product_detail_columns tinyscrl" itemprop="description" style=""><div class="scrollbar" style="width:2px; height:250px; background:#9E9E9E;"><div class="track" style="width:2px;"><div class="thumb" style="width:6px;"><div class="end"> </div></div></div></div><div class="viewport" style=" height:250px; width:252px; font-family:Arial !important;"><div class="overview" style="text-align:justify; display:block;"><div> In <b>blue and black </b>colour  <b>Fabdeal</b> brings to you this <b>unstitched salwaar suit</b> crafted with <b>chiffon and georgette</b>. It features <b>self prints</b> all over and comes with <b>matching bottom and dupatta</b>.<br/><br/><b>Features</b><ul style="margin-left: 20px;"><li type="disc"><b>Brand: </b>Fabdeal</li><li type="disc"><b>Category: </b>Traditional and Ethnic Wear</li><li type="disc"><b>Type: </b>Dress Material</li><li type="disc"><b>Fabric: </b>Chiffon  Crepe</li><li type="disc"><b>Colour: </b>Blue  Black</li></ul><br/><b>Wash and Care </b><br/>  Wash it with a mild detergent.<br> If washing in a machine  set it on a delicate mode and low temperature cycle<br> Wash dark colours separately and  use iron at low temperature<br/><br/><b>Note:</b> There may be a slight colour variation in the image from original product  </br></br></div></div></div> </div>,,16:04:2014,
