485314,fabdeal beige georgette dress materials,http://www.yebhi.com/online-shopping/women/apparels.html?affint=women-topmenu,2905,Clothing,dress-materials,fabdeal,http://im6.ybndc.com/upload/485314/ProductRear635297259658014000.jpg,2905,,Women,http://www.yebhi.com/485314/PD/fabdeal-beige-georgette-dress-materials.htm,yebhi.com,Fabdeal Beige Georgette - Dress Materials Buy Online,Fabdeal Beige Georgette - Dress Materials  Best Price Rs 2905.00  EMI Rs 484 for 6 months FREE Shipping In Stock - Delivery in 9-12 Days,None,<div class="product_detail_columns tinyscrl" itemprop="description" style=""><div class="scrollbar" style="width:2px; height:250px; background:#9E9E9E;"><div class="track" style="width:2px;"><div class="thumb" style="width:6px;"><div class="end"> </div></div></div></div><div class="viewport" style=" height:250px; width:252px; font-family:Arial !important;"><div class="overview" style="text-align:justify; display:block;"><div>Redefine the feminine beauty through this dazzling attire that has come from Fabdeal house! It has potential to give sensational getup with an embossing cream color. Surprise the viewers as you adorn your outer structure with this amazing suit as it carries Faux Georgette on its top  Santoon inner &amp; bottom with Chiffon dupatta. Top : Length - Approx 48'' Chest Upto : 44''  Waist : 40''  Inner : 2.00 M Bottom : 2.25 M  Dupatta : 2.25 M  Top : Faux Georgette  Inner : Santoon  Bottom : Santoon  Dupatta : Chiffon </div></div></div> </div>,,16:04:2014,
485339,fabdeal pink georgette dress materials,http://www.yebhi.com/online-shopping/women/apparels.html?affint=women-topmenu,3220,Clothing,dress-materials,fabdeal,http://im6.ybndc.com/upload/485339/ProductRear635297259741786000.jpg,3220,,Women,http://www.yebhi.com/485339/PD/fabdeal-pink-georgette-dress-materials.htm,yebhi.com,Fabdeal Pink Georgette - Dress Materials Buy Online,Fabdeal Pink Georgette - Dress Materials  Best Price Rs 3220.00  EMI Rs 537 for 6 months FREE Shipping In Stock - Delivery in 9-12 Days,None,<div class="product_detail_columns tinyscrl" itemprop="description" style=""><div class="scrollbar" style="width:2px; height:250px; background:#9E9E9E;"><div class="track" style="width:2px;"><div class="thumb" style="width:6px;"><div class="end"> </div></div></div></div><div class="viewport" style=" height:250px; width:252px; font-family:Arial !important;"><div class="overview" style="text-align:justify; display:block;"><div>Move on to grab this delicately designed salwar suit to attain surprising getup. This collection is perfect for special occasions to be a spotting persona. As it features pure georgette on its top  santoon inner &amp; bottom with chiffon dupatta  it is sure to give desired getup like never before. Top : Length - Approx 48'' Chest Upto : 44''  Waist : 44''  Inner : 2.00 M Bottom : 2.25 M  Dupatta : 2.25 M  Top : Pure Georgette  Inner : santoon  Bottom : Santoon  Dupatta : Chiffon </div></div></div> </div>,,16:04:2014,
310873,fabdeal orange dress materials,http://www.yebhi.com/online-shopping/women/apparels.html?affint=women-topmenu,4449,Clothing,dress-materials,fabdeal,http://im6.ybndc.com/upload/310873/ProductRear635062863779620885.jpg,4449,,Women,http://www.yebhi.com/310873/PD/fabdeal-orange-dress-materials.htm,yebhi.com,Fabdeal Orange - Dress Materials Buy Online,Fabdeal Orange - Dress Materials  Best Price Rs 4449.00  EMI Rs 742 for 6 months FREE Shipping In Stock - Delivery in 9-12 Days,None,<div class="product_detail_columns tinyscrl" itemprop="description" style=""><div class="scrollbar" style="width:2px; height:250px; background:#9E9E9E;"><div class="track" style="width:2px;"><div class="thumb" style="width:6px;"><div class="end"> </div></div></div></div><div class="viewport" style=" height:250px; width:252px; font-family:Arial !important;"><div class="overview" style="text-align:justify; display:block;"><div>  This <b>dress material</b> in <b>orange colour</b> from the house of <b>Fabdeal</b> features <b>embroidery</b> at the <b>front</b> and <b>patch detailing</b> on the <b>yoke</b>. It comes with <b>matching bottom</b>. The dress material is crafted with <b>georgette and net material</b>. The <b>dupatta</b> has a <b>golden border</b>.<br/><br/><b>Features</b><ul style="margin-left: 20px;"><li type="disc"><b>Brand:</b> Fabdeal</li><li type="disc"><b>Category:</b> Traditional and Ethnic Wear</li><li type="disc"><b>Type:</b> Dress Material</li><li type="disc"><b>Fabric:</b> Georgette  Net</li><li type="disc"><b>Colour: </b>Orange  Blue</li></ul><br/><b>Wash &amp; Care</b><br/>  Wash it with a mild detergent<br> If washing in a machine  set it on a delicate mode and low temperature cycle<br> Wash dark colours separately and use iron at low temperature<br><br><b>Note:</b> There may be a slight colour variation in the image from original product  </br></br></br></br></div></div></div> </div>,,16:04:2014,
310876,fabdeal yellow dress materials,http://www.yebhi.com/online-shopping/women/apparels.html?affint=women-topmenu,4449,Clothing,dress-materials,fabdeal,http://im6.ybndc.com/upload/310876/ProductRear635062864559625885.jpg,4449,,Women,http://www.yebhi.com/310876/PD/fabdeal-yellow-dress-materials.htm,yebhi.com,Fabdeal Yellow - Dress Materials Buy Online,Fabdeal Yellow - Dress Materials  Best Price Rs 4449.00  EMI Rs 742 for 6 months FREE Shipping In Stock - Delivery in 9-12 Days,None,<div class="product_detail_columns tinyscrl" itemprop="description" style=""><div class="scrollbar" style="width:2px; height:250px; background:#9E9E9E;"><div class="track" style="width:2px;"><div class="thumb" style="width:6px;"><div class="end"> </div></div></div></div><div class="viewport" style=" height:250px; width:252px; font-family:Arial !important;"><div class="overview" style="text-align:justify; display:block;"><div>  This <b>dress material</b> in <b>red  yellow and blue colour</b> from the house of <b>Fabdeal</b> features <b>floral embroidery</b> at the <b>front</b> and <b>mukesh work detailing</b> on the <b>yoke</b>. It comes with <b>matching bottom</b>. The dress material is crafted with <b>georgette and net material</b>. The <b>dupatta</b> comes in<b>dual shade</b>.<br/><br/><b>Features</b><ul style="margin-left: 20px;"><li type="disc"><b>Brand:</b> Fabdeal</li><li type="disc"><b>Category:</b> Traditional and Ethnic Wear</li><li type="disc"><b>Type:</b> Dress Material</li><li type="disc"><b>Fabric:</b> Georgette  Net</li><li type="disc"><b>Colour: </b>Red  Yellow  Blue</li></ul><br/><b>Wash &amp; Care</b><br/>  Wash it with a mild detergent<br> If washing in a machine  set it on a delicate mode and low temperature cycle<br> Wash dark colours separately and use iron at low temperature<br><br><b>Note:</b> There may be a slight colour variation in the image from original product  </br></br></br></br></div></div></div> </div>,,16:04:2014,
485318,fabdeal white georgette dress materials,http://www.yebhi.com/online-shopping/women/apparels.html?affint=women-topmenu,2905,Clothing,dress-materials,fabdeal,http://im6.ybndc.com/upload/485318/ProductRear635297259671118000.jpg,2905,,Women,http://www.yebhi.com/485318/PD/fabdeal-white-georgette-dress-materials.htm,yebhi.com,Fabdeal White Georgette - Dress Materials Buy Online,Fabdeal White Georgette - Dress Materials  Best Price Rs 2905.00  EMI Rs 484 for 6 months FREE Shipping In Stock - Delivery in 9-12 Days,None,<div class="product_detail_columns tinyscrl" itemprop="description" style=""><div class="scrollbar" style="width:2px; height:250px; background:#9E9E9E;"><div class="track" style="width:2px;"><div class="thumb" style="width:6px;"><div class="end"> </div></div></div></div><div class="viewport" style=" height:250px; width:252px; font-family:Arial !important;"><div class="overview" style="text-align:justify; display:block;"><div>Here is the ideal choice for summer..! This salwar suit from fabdeal house gives a comfort feel as you drape it now &amp; then for special event. This white in colored salwar suit is perfect to attain an angelic look that appeals showers of compliments like never before. Top : Length - Approx 48'' Chest Upto : 44''  Waist : 40''  Inner : 2.00 M Bottom : 2.25 M  Dupatta : 2.25 M  Top : Faux Georgette  Inner : Santoon  Bottom : Santoon  Dupatta : Chiffon </div></div></div> </div>,,16:04:2014,
485342,fabdeal white georgette dress materials,http://www.yebhi.com/online-shopping/women/apparels.html?affint=women-topmenu,3220,Clothing,dress-materials,fabdeal,http://im6.ybndc.com/upload/485342/ProductRear635297259752238000.jpg,3220,,Women,http://www.yebhi.com/485342/PD/fabdeal-white-georgette-dress-materials.htm,yebhi.com,Fabdeal White Georgette - Dress Materials Buy Online,Fabdeal White Georgette - Dress Materials  Best Price Rs 3220.00  EMI Rs 537 for 6 months FREE Shipping In Stock - Delivery in 9-12 Days,None,<div class="product_detail_columns tinyscrl" itemprop="description" style=""><div class="scrollbar" style="width:2px; height:250px; background:#9E9E9E;"><div class="track" style="width:2px;"><div class="thumb" style="width:6px;"><div class="end"> </div></div></div></div><div class="viewport" style=" height:250px; width:252px; font-family:Arial !important;"><div class="overview" style="text-align:justify; display:block;"><div>With a graceful intricate embroidered  this salwar suit from Fabdeal will instantly push up the style quotient of your wardrobe. Pair with matching jewels &amp; sandles for a dressed down look. This fabulous suit carries pure georgette on its top  santoon inner &amp; bottom with chiffon dupatta that really keeps you in fashion as desired. Top : Length - Approx 48'' Chest Upto : 44''  Waist : 44''  Inner : 2.00 M Bottom : 2.25 M  Dupatta : 2.25 M  Top : Pure Georgette  Inner : santoon  Bottom : Santoon  Dupatta : Chiffon </div></div></div> </div>,,16:04:2014,
330262,fabdeal mustard dress materials,http://www.yebhi.com/online-shopping/women/apparels.html?affint=women-topmenu,749,Clothing,dress-materials,fabdeal,http://im6.ybndc.com/upload/330262/ProductRear635097637719900000.jpg,749,,Women,http://www.yebhi.com/330262/PD/fabdeal-mustard-dress-materials.htm,yebhi.com,Fabdeal Mustard - Dress Materials Buy Online,Fabdeal Mustard - Dress Materials  Best Price Rs 749.00  EMI Rs 125 for 6 months FREE Shipping In Stock - Delivery in 9-12 Days,None,<div class="product_detail_columns tinyscrl" itemprop="description" style=""><div class="scrollbar" style="width:2px; height:250px; background:#9E9E9E;"><div class="track" style="width:2px;"><div class="thumb" style="width:6px;"><div class="end"> </div></div></div></div><div class="viewport" style=" height:250px; width:252px; font-family:Arial !important;"><div class="overview" style="text-align:justify; display:block;"><div> This dress material in <b>green  purple and orange colour</b> feature <b>self prints work all over</b>. It is crafted with <b>cotton polyester material</b> and comes with <b>matching bottom and dupatta</b>. This pretty pick is from the house of <b>Fabdeal.</b><br/><br/><b>Features</b><ul style="margin-left: 20px;"><li type="disc"><b>Brand: </b>Fabdeal</li><li type="disc"><b>Category: </b>Traditional and Ethnic Wear</li><li type="disc"><b>Type: </b>Dress Material</li><li type="disc"><b>Fabric: </b>Cotton Polyester</li><li type="disc"><b>Colour: </b>Green  Orange  Purple</li></ul><br/><b>Wash and Care </b><br/>  Do not bleach or dry clean<br> Wash with like colours<br> Line dry<br>Warm iron<br><br/><br/><b>Note:</b> There may be a slight colour variation in the image from original product  </br></br></br></br></div></div></div> </div>,,16:04:2014,
485340,fabdeal yellow georgette dress materials,http://www.yebhi.com/online-shopping/women/apparels.html?affint=women-topmenu,3220,Clothing,dress-materials,fabdeal,http://im6.ybndc.com/upload/485340/ProductRear635297259745374000.jpg,3220,,Women,http://www.yebhi.com/485340/PD/fabdeal-yellow-georgette-dress-materials.htm,yebhi.com,Fabdeal Yellow Georgette - Dress Materials Buy Online,Fabdeal Yellow Georgette - Dress Materials  Best Price Rs 3220.00  EMI Rs 537 for 6 months FREE Shipping In Stock - Delivery in 9-12 Days,None,<div class="product_detail_columns tinyscrl" itemprop="description" style=""><div class="scrollbar" style="width:2px; height:250px; background:#9E9E9E;"><div class="track" style="width:2px;"><div class="thumb" style="width:6px;"><div class="end"> </div></div></div></div><div class="viewport" style=" height:250px; width:252px; font-family:Arial !important;"><div class="overview" style="text-align:justify; display:block;"><div>Spread your own glamour with this mesmerizing salwar suit that comprises most appealing pure georgette on its top  santoon inner &amp; bottom with chiffon dupatta with an embossing yellow color touch. Drape this collection to appeal flattering getup like never before.  Top : Length - Approx 48'' Chest Upto : 44''  Waist : 44''  Inner : 2.00 M Bottom : 2.25 M  Dupatta : 2.25 M  Top : Pure Georgette  Inner : santoon  Bottom : Santoon  Dupatta : Chiffon </div></div></div> </div>,,16:04:2014,
310874,fabdeal black dress materials,http://www.yebhi.com/online-shopping/women/apparels.html?affint=women-topmenu,4299,Clothing,dress-materials,fabdeal,http://im6.ybndc.com/upload/310874/ProductRear635062864018458416.jpg,4299,,Women,http://www.yebhi.com/310874/PD/fabdeal-black-dress-materials.htm,yebhi.com,Fabdeal Black - Dress Materials Buy Online,Fabdeal Black - Dress Materials  Best Price Rs 4299.00  EMI Rs 717 for 6 months FREE Shipping In Stock - Delivery in 9-12 Days,None,<div class="product_detail_columns tinyscrl" itemprop="description" style=""><div class="scrollbar" style="width:2px; height:250px; background:#9E9E9E;"><div class="track" style="width:2px;"><div class="thumb" style="width:6px;"><div class="end"> </div></div></div></div><div class="viewport" style=" height:250px; width:252px; font-family:Arial !important;"><div class="overview" style="text-align:justify; display:block;"><div> This <b>dress material</b> in <b>black and white colour</b> from the house of <b>Fabdeal</b> features <b>floral embroidery</b> at the <b>front</b> and <b>white thread work detailing</b> on the <b>yoke</b>. It comes with <b>matching bottom</b>. The dress material is crafted with <b>georgette and net material</b>. The <b>dupatta</b> has a <b>black border</b>.<br/><br/><b>Features</b><ul style="margin-left: 20px;"><li type="disc"><b>Brand:</b> Fabdeal</li><li type="disc"><b>Category:</b> Traditional and Ethnic Wear</li><li type="disc"><b>Type:</b> Dress Material</li><li type="disc"><b>Fabric:</b> Georgette  Net</li><li type="disc"><b>Colour: </b>Black  White</li></ul><br/><b>Wash &amp; Care</b><br/>  Wash it with a mild detergent<br> If washing in a machine  set it on a delicate mode and low temperature cycle<br> Wash dark colours separately and use iron at low temperature<br><br><b>Note:</b> There may be a slight colour variation in the image from original product  </br></br></br></br></div></div></div> </div>,,16:04:2014,
485384,fabdeal beige dress materials,http://www.yebhi.com/online-shopping/women/apparels.html?affint=women-topmenu,4888,Clothing,dress-materials,fabdeal,http://im6.ybndc.com/upload/485384/ProductRear635297259895914000.jpg,4888,,Women,http://www.yebhi.com/485384/PD/fabdeal-beige-dress-materials.htm,yebhi.com,Fabdeal Beige - Dress Materials Buy Online,Fabdeal Beige - Dress Materials  Best Price Rs 4888.00  EMI Rs 815 for 6 months FREE Shipping In Stock - Delivery in 9-12 Days,None,<div class="product_detail_columns tinyscrl" itemprop="description" style=""><div class="scrollbar" style="width:2px; height:250px; background:#9E9E9E;"><div class="track" style="width:2px;"><div class="thumb" style="width:6px;"><div class="end"> </div></div></div></div><div class="viewport" style=" height:250px; width:252px; font-family:Arial !important;"><div class="overview" style="text-align:justify; display:block;"><div>Let your feminine side expose this season by wearing this marvelous attire that carries Viscose &amp; Soft Net on its top  Viscose Georgette on sleeves  Santoon Silk inner &amp; bottom with Pure Chiffon dupatta. It hugs white color shade with exotic embroidered design that keeps you spotting in a huge midst like never before. Top : Length - Approx 47'' Chest Upto : 44''  Waist : 44  Inner : 2.00 M Bottom : 2.50 M  Dupatta : 2.25 M Top : Viscose &amp; Soft Net  Sleeve : Viscose Georgette  Inner : Santoon Silk  Bottom : Santoon Silk  Dupatta : Pure Chiffon </div></div></div> </div>,,16:04:2014,
485310,fabdeal black georgette dress materials,http://www.yebhi.com/online-shopping/women/apparels.html?affint=women-topmenu,4199,Clothing,dress-materials,fabdeal,http://im6.ybndc.com/upload/485310/ProductRear635297259644598000.jpg,4199,,Women,http://www.yebhi.com/485310/PD/fabdeal-black-georgette-dress-materials.htm,yebhi.com,Fabdeal Black Georgette - Dress Materials Buy Online,Fabdeal Black Georgette - Dress Materials  Best Price Rs 4199.00  EMI Rs 700 for 6 months FREE Shipping In Stock - Delivery in 9-12 Days,None,<div class="product_detail_columns tinyscrl" itemprop="description" style=""><div class="scrollbar" style="width:2px; height:250px; background:#9E9E9E;"><div class="track" style="width:2px;"><div class="thumb" style="width:6px;"><div class="end"> </div></div></div></div><div class="viewport" style=" height:250px; width:252px; font-family:Arial !important;"><div class="overview" style="text-align:justify; display:block;"><div>It is the perfect attire for all fashion conscious women for present generation. One can appeal flattering views through this awesome suit as you step in a grand occasion. The material quality assures to give majestic feel as it carries Net material on its top &amp; santoon bottom with georgette dupatta. Top : Length - Approx 48'' Chest Upto : 44''  Waist : 40''  Inner : 2.00 M Bottom : 2.50 M  Dupatta : 2.25 M  Top : Georgette   Bottom : Santoon   Dupatta : Georgette </div></div></div> </div>,,16:04:2014,
310868,fabdeal green net dress materials,http://www.yebhi.com/online-shopping/women/apparels.html?affint=women-topmenu,3799,Clothing,dress-materials,fabdeal,http://im6.ybndc.com/upload/310868/ProductRear635062862632857534.jpg,3799,,Women,http://www.yebhi.com/310868/PD/fabdeal-green-net-dress-materials.htm,yebhi.com,Fabdeal Green Net - Dress Materials Buy Online,Fabdeal Green Net - Dress Materials  Best Price Rs 3799.00  EMI Rs 633 for 6 months FREE Shipping In Stock - Delivery in 9-12 Days,None,<div class="product_detail_columns tinyscrl" itemprop="description" style=""><div class="scrollbar" style="width:2px; height:250px; background:#9E9E9E;"><div class="track" style="width:2px;"><div class="thumb" style="width:6px;"><div class="end"> </div></div></div></div><div class="viewport" style=" height:250px; width:252px; font-family:Arial !important;"><div class="overview" style="text-align:justify; display:block;"><div> This <b>dress material</b> in <b>green  purple and orange colour</b> from the house of <b>Fabdeal</b> features <b>heavy embroidery</b> at the <b>hem and yoke</b>. It comes with <b>matching bottom</b> and <b>dupatta</b>. The dress material is crafted with <b>net material</b>.<br/><br/><b>Features</b><ul style="margin-left: 20px;"><li type="disc"><b>Brand:</b> Fabdeal</li><li type="disc"><b>Category:</b> Traditional and Ethnic Wear</li><li type="disc"><b>Type:</b> Dress Material</li><li type="disc"><b>Fabric:</b> Net</li><li type="disc"><b>Colour: </b>Green  Purple  Orange</li></ul><br/><b>Wash &amp; Care</b><br/>  Dry Clean Only<br><br><b>Note:</b> There may be a slight colour variation in the image from original product  </br></br></div></div></div> </div>,,16:04:2014,
310867,fabdeal purple net dress materials,http://www.yebhi.com/online-shopping/women/apparels.html?affint=women-topmenu,3949,Clothing,dress-materials,fabdeal,http://im6.ybndc.com/upload/310867/ProductRear635062862373895874.jpg,3949,,Women,http://www.yebhi.com/310867/PD/fabdeal-purple-net-dress-materials.htm,yebhi.com,Fabdeal Purple Net - Dress Materials Buy Online,Fabdeal Purple Net - Dress Materials  Best Price Rs 3949.00  EMI Rs 658 for 6 months FREE Shipping In Stock - Delivery in 9-12 Days,None,<div class="product_detail_columns tinyscrl" itemprop="description" style=""><div class="scrollbar" style="width:2px; height:250px; background:#9E9E9E;"><div class="track" style="width:2px;"><div class="thumb" style="width:6px;"><div class="end"> </div></div></div></div><div class="viewport" style=" height:250px; width:252px; font-family:Arial !important;"><div class="overview" style="text-align:justify; display:block;"><div> This <b>dress material</b> in <b>purple and green colour</b> from the house of <b>Fabdeal</b> features <b>heavy embroidery</b> at the <b>hem and yoke</b>. It comes with <b>matching bottom</b> and <b>dupatta</b>. The dress material is crafted with <b>net material</b>.<br/><br/><b>Features</b><ul style="margin-left: 20px;"><li type="disc"><b>Brand:</b> Fabdeal</li><li type="disc"><b>Category:</b> Traditional and Ethnic Wear</li><li type="disc"><b>Type:</b> Dress Material</li><li type="disc"><b>Fabric:</b> Net</li><li type="disc"><b>Colour: </b>Purple  Green</li></ul><br/><b>Wash &amp; Care</b><br/>  Dry Clean Only<br><br><b>Note:</b> There may be a slight colour variation in the image from original product  </br></br></div></div></div> </div>,,16:04:2014,
485316,fabdeal green georgette dress materials,http://www.yebhi.com/online-shopping/women/apparels.html?affint=women-topmenu,2905,Clothing,dress-materials,fabdeal,http://im6.ybndc.com/upload/485316/ProductRear635297259664566000.jpg,2905,,Women,http://www.yebhi.com/485316/PD/fabdeal-green-georgette-dress-materials.htm,yebhi.com,Fabdeal Green Georgette - Dress Materials Buy Online,Fabdeal Green Georgette - Dress Materials  Best Price Rs 2905.00  EMI Rs 484 for 6 months FREE Shipping In Stock - Delivery in 9-12 Days,None,<div class="product_detail_columns tinyscrl" itemprop="description" style=""><div class="scrollbar" style="width:2px; height:250px; background:#9E9E9E;"><div class="track" style="width:2px;"><div class="thumb" style="width:6px;"><div class="end"> </div></div></div></div><div class="viewport" style=" height:250px; width:252px; font-family:Arial !important;"><div class="overview" style="text-align:justify; display:block;"><div>Move on to grab this party wear salwar suit that is sure to give desired getup as it comprises Faux Georgette on its top  Santoon inner &amp; bottom with Chiffon dupatta. This collection is perfect for special occasions to be a spotting persona. Its exotic embroidered appeals catchy look and keeps you spotting in a huge midst. Top : Length - Approx 48'' Chest Upto : 44''  Waist : 40''  Inner : 2.00 M Bottom : 2.25 M  Dupatta : 2.25 M  Top : Faux Georgette  Inner : Santoon  Bottom : Santoon  Dupatta : Chiffon </div></div></div> </div>,,16:04:2014,
310872,fabdeal red dress materials,http://www.yebhi.com/online-shopping/women/apparels.html?affint=women-topmenu,3949,Clothing,dress-materials,fabdeal,http://im6.ybndc.com/upload/310872/ProductRear635062863566055516.jpg,3949,,Women,http://www.yebhi.com/310872/PD/fabdeal-red-dress-materials.htm,yebhi.com,Fabdeal Red - Dress Materials Buy Online,Fabdeal Red - Dress Materials  Best Price Rs 3949.00  EMI Rs 658 for 6 months FREE Shipping In Stock - Delivery in 9-12 Days,None,<div class="product_detail_columns tinyscrl" itemprop="description" style=""><div class="scrollbar" style="width:2px; height:250px; background:#9E9E9E;"><div class="track" style="width:2px;"><div class="thumb" style="width:6px;"><div class="end"> </div></div></div></div><div class="viewport" style=" height:250px; width:252px; font-family:Arial !important;"><div class="overview" style="text-align:justify; display:block;"><div> This dress material in <b>purple  red and black colour</b> feature <b>thread work on the yoke and the hem</b>. It is crafted with <b>crepe material</b> and comes with <b>matching bottom and dupatta</b>. This pretty pick is from the house of <b>Fabdeal.</b><br/><br/><b>Features</b><ul style="margin-left: 20px;"><li type="disc"><b>Brand: </b>Fabdeal</li><li type="disc"><b>Category: </b>Traditional and Ethnic Wear</li><li type="disc"><b>Type: </b>Dress Material</li><li type="disc"><b>Fabric: </b>Crepe</li><li type="disc"><b>Colour: </b>Purple  Red  Black</li></ul><br/><b>Wash and Care </b><br/>  Do not bleach or dry clean<br> Wash with like colours<br> Line dry<br>Warm iron<br><br/><br/><b>Note:</b> There may be a slight colour variation in the image from original product  </br></br></br></br></div></div></div> </div>,,16:04:2014,
