416489,fabdeal pink dress materials,http://www.yebhi.com/online-shopping/women/apparels.html?affint=women-topmenu,849,Clothing,dress-materials,fabdeal,http://im6.ybndc.com/upload/416489/ProductRear635194374409478609.jpg,849,,Women,http://www.yebhi.com/416489/PD/fabdeal-pink-dress-materials.htm,yebhi.com,Fabdeal Pink - Dress Materials Buy Online,Fabdeal Pink - Dress Materials  Best Price Rs 849.00  EMI Rs 142 for 6 months FREE Shipping In Stock - Delivery in 13-17 Days,None,<div class="product_detail_columns tinyscrl" itemprop="description" style=""><div class="scrollbar" style="width:2px; height:250px; background:#9E9E9E;"><div class="track" style="width:2px;"><div class="thumb" style="width:6px;"><div class="end"> </div></div></div></div><div class="viewport" style=" height:250px; width:252px; font-family:Arial !important;"><div class="overview" style="text-align:justify; display:block;"><div> This <b>dress material</b> from the house of <b>Fabdeal</b> features <b>crepe top</b> and <b>bottom</b>. In <b>pink and purple</b> colour  it features <b>self prints</b> and all over. It comes with <b>matching bottom</b> and <b>chiffon dupatta</b> in <b>dual shade</b>.<br/><br/><b>Features</b><ul style="margin-left: 20px;"><li type="disc"><b>Brand: </b>Fabdeal</li><li type="disc"><b>Category: </b>Traditional and Ethnic Wear</li><li type="disc"><b>Type: </b>Dress Material</li><li type="disc"><b>Fabric: </b>Chiffon  Crepe</li><li type="disc"><b>Colour: </b>Pink  Purple</li></ul><br/><b>Wash and Care </b><br/>  Wash it with a mild detergent.<br> If washing in a machine  set it on a delicate mode and low temperature cycle<br> Wash dark colours separately and  use iron at low temperature<br/><br/><b>Note:</b> There may be a slight colour variation in the image from original product  </br></br></div></div></div> </div>,,16:04:2014,
310866,fabdeal yellow women georgette dress material,http://www.yebhi.com/online-shopping/women/apparels.html?affint=women-topmenu,4599,Clothing,dress-materials,fabdeal,http://im6.ybndc.com/upload/310866/ProductRear635062862135370345.jpg,4599,,Women,http://www.yebhi.com/310866/PD/fabdeal-yellow-women-georgette-dress-material.htm,yebhi.com,Fabdeal Yellow Women Georgette - Dress Material Buy Online,Fabdeal Yellow Women Georgette - Dress Material  Best Price Rs 4599.00  EMI Rs 767 for 6 months FREE Shipping In Stock - Delivery in 9-12 Days,None,<div class="product_detail_columns tinyscrl" itemprop="description" style=""><div class="scrollbar" style="width:2px; height:250px; background:#9E9E9E;"><div class="track" style="width:2px;"><div class="thumb" style="width:6px;"><div class="end"> </div></div></div></div><div class="viewport" style=" height:250px; width:252px; font-family:Arial !important;"><div class="overview" style="text-align:justify; display:block;"><div> Crafted with <b>georgette material</b>  this <b>dress material</b> in <b>yellow colour</b> features <b>thread work </b>all over. It has a <b>purple patch</b> with <b>golden thread work</b> on the <b>yoke and the hem</b>. It comes with <b>solid patterned yellow coloured lower</b> and <b>dupatta</b> in <b>contrast red</b> with <b>yellow piping</b> at the <b>borders</b>.<br/><br/><b>Features</b><ul style="margin-left: 20px;"><li type="disc"><b>Brand:</b>Fabdeal</li><li type="disc"><b>Category:</b> Traditional and Ethnic Wear</li><li type="disc"><b>Type:</b> Dress Material</li><li type="disc"><b>Fabric:</b> Georgette</li><li type="disc"><b>Colour: </b>Yellow  Purple  Red</li></ul><br/><b>Wash &amp; Care</b><br/>  Wash it with a mild detergent<br> If washing in a machine  set it on a delicate mode and low temperature cycle<br> Wash dark colours separately and use iron at low temperature<br><br><b>Note:</b> There may be a slight colour variation in the image from original product   </br></br></br></br></div></div></div> </div>,,16:04:2014,
330222,fabdeal green dress materials,http://www.yebhi.com/online-shopping/women/apparels.html?affint=women-topmenu,599,Clothing,dress-materials,fabdeal,http://im6.ybndc.com/upload/330222/ProductRear635097601379700000.jpg,599,,Women,http://www.yebhi.com/330222/PD/fabdeal-green-dress-materials.htm,yebhi.com,Fabdeal Green - Dress Materials Buy Online,Fabdeal Green - Dress Materials  Best Price Rs 599.00  EMI Rs 100 for 6 months FREE Shipping In Stock - Delivery in 9-12 Days,None,<div class="product_detail_columns tinyscrl" itemprop="description" style=""><div class="scrollbar" style="width:2px; height:250px; background:#9E9E9E;"><div class="track" style="width:2px;"><div class="thumb" style="width:6px;"><div class="end"> </div></div></div></div><div class="viewport" style=" height:250px; width:252px; font-family:Arial !important;"><div class="overview" style="text-align:justify; display:block;"><div> In <b>green and purple </b>colour  <b>Fabdeal</b> brings to you this <b>unstitched salwaar suit</b> crafted with <b>chiffon and georgette</b>. It features <b>self prints</b> all over and comes with <b>matching bottom and dupatta</b>.<br/><br/><b>Features</b><ul style="margin-left: 20px;"><li type="disc"><b>Brand: </b>Fabdeal</li><li type="disc"><b>Category: </b>Traditional and Ethnic Wear</li><li type="disc"><b>Type: </b>Dress Material</li><li type="disc"><b>Fabric: </b>Chiffon  Crepe</li><li type="disc"><b>Colour: </b>Green  Purple</li></ul><br/><b>Wash and Care </b><br/>  Wash it with a mild detergent.<br> If washing in a machine  set it on a delicate mode and low temperature cycle<br> Wash dark colours separately and  use iron at low temperature<br/><br/><b>Note:</b> There may be a slight colour variation in the image from original product  </br></br></div></div></div> </div>,,16:04:2014,
300787,fabdeal brown art silk dress materials,http://www.yebhi.com/online-shopping/women/apparels.html?affint=women-topmenu,749,Clothing,dress-materials,fabdeal,http://im6.ybndc.com/upload/300787/ProductRear635042221047380745.jpg,749,,Women,http://www.yebhi.com/300787/PD/fabdeal-brown-art-silk-dress-materials.htm,yebhi.com,Fabdeal Brown Art Silk - Dress Materials Buy Online,Fabdeal Brown Art Silk - Dress Materials  Best Price Rs 749.00  EMI Rs 125 for 6 months FREE Shipping In Stock - Delivery in 9-12 Days,None,<div class="product_detail_columns tinyscrl" itemprop="description" style=""><div class="scrollbar" style="width:2px; height:250px; background:#9E9E9E;"><div class="track" style="width:2px;"><div class="thumb" style="width:6px;"><div class="end"> </div></div></div></div><div class="viewport" style=" height:250px; width:252px; font-family:Arial !important;"><div class="overview" style="text-align:justify; display:block;"><div> This pretty<b> dress material</b> is made with <b>art silk material</b>. It comes in <b>brown colour </b>with <b>self prints</b> all over. It features a <b>broad embroidered hem </b>and <b>patches of the same</b> at the <b>shoulders and sleeves</b>. It comes with <b>contrast colour lower</b> and <b>matching dupatta</b> in <b>dual shade</b>.<br/><br/><b>Features</b><ul style="margin-left: 20px;"><li type="disc"><b>Brand:</b>Fabdeal</li><li type="disc"><b>Category:</b> Traditional and Ethnic Wear</li><li type="disc"><b>Type:</b> Dress Material</li><li type="disc"><b>Fabric:</b> Art Silk</li><li type="disc"><b>Colour:</b> Brown  Green</li></ul><br/><b>Wash &amp; Care</b><br/>  Wash it with a mild detergent<br> If washing in a machine  set it on a delicate mode and low temperature cycle<br> Wash dark colours separately and use iron at low temperature<br><br><b>Note:</b> There may be a slight colour variation in the image from original product   </br></br></br></br></div></div></div> </div>,,16:04:2014,
303366,fabdeal brown dress materials,http://www.yebhi.com/online-shopping/women/apparels.html?affint=women-topmenu,949,Clothing,dress-materials,fabdeal,http://im6.ybndc.com/upload/303366/ProductRear635049213961542083.jpg,949,,Women,http://www.yebhi.com/303366/PD/fabdeal-brown-dress-materials.htm,yebhi.com,Fabdeal Brown - Dress Materials Buy Online,Fabdeal Brown - Dress Materials  Best Price Rs 949.00  EMI Rs 158 for 6 months FREE Shipping In Stock - Delivery in 9-12 Days,None,<div class="product_detail_columns tinyscrl" itemprop="description" style=""><div class="scrollbar" style="width:2px; height:250px; background:#9E9E9E;"><div class="track" style="width:2px;"><div class="thumb" style="width:6px;"><div class="end"> </div></div></div></div><div class="viewport" style=" height:250px; width:252px; font-family:Arial !important;"><div class="overview" style="text-align:justify; display:block;"><div> This dress material in <b>brown and green colour</b> feature <b>thread work all over</b> with<b> patches of embroidery on the hem and the yoke</b>. It is crafted with <b>cotton polyester material</b> and comes with <b>matching bottom and dupatta</b>. This pretty pick is from the house of <b>Fabdeal.</b><br/><br/><b>Features</b><ul style="margin-left: 20px;"><li type="disc"><b>Brand: </b>Fabdeal</li><li type="disc"><b>Category: </b>Traditional and Ethnic Wear</li><li type="disc"><b>Type: </b>Dress Material</li><li type="disc"><b>Fabric: </b>Cotton Polyester</li><li type="disc"><b>Colour: </b>Brown  Green</li></ul><br/><b>Wash and Care </b><br/>  Do not bleach or dry clean<br> Wash with like colours<br> Line dry<br>Warm iron<br><br/><br/><b>Note:</b> There may be a slight colour variation in the image from original product  </br></br></br></br></div></div></div> </div>,,16:04:2014,
485373,fabdeal red cotton dress materials,http://www.yebhi.com/online-shopping/women/apparels.html?affint=women-topmenu,1235,Clothing,dress-materials,fabdeal,http://im6.ybndc.com/upload/485373/ProductRear635297259859254000.jpg,1235,,Women,http://www.yebhi.com/485373/PD/fabdeal-red-cotton-dress-materials.htm,yebhi.com,Fabdeal Red Cotton - Dress Materials Buy Online,Fabdeal Red Cotton - Dress Materials  Best Price Rs 1235.00  EMI Rs 206 for 6 months FREE Shipping In Stock - Delivery in 9-12 Days,None,<div class="product_detail_columns tinyscrl" itemprop="description" style=""><div class="scrollbar" style="width:2px; height:250px; background:#9E9E9E;"><div class="track" style="width:2px;"><div class="thumb" style="width:6px;"><div class="end"> </div></div></div></div><div class="viewport" style=" height:250px; width:252px; font-family:Arial !important;"><div class="overview" style="text-align:justify; display:block;"><div>Step out in a new fabulous getup by draping this marvelous attire that carries Cotton material on its top  Polyster Cotton bottom with Chiffon dupatta. One will be stunned to experience a celeb look as it hugs red colored exotic embroidered design. One should add this collection to their wish list for drastic change in fashion sense. Top : 2.10 M  Bottom : 2.50 M  Dupatta : 2.25 M  Top : Cotton  Bottom : Polyster Cotton  Dupatta : Chiffon </div></div></div> </div>,,16:04:2014,
330225,fabdeal blue dress materials,http://www.yebhi.com/online-shopping/women/apparels.html?affint=women-topmenu,599,Clothing,dress-materials,fabdeal,http://im6.ybndc.com/upload/330225/ProductRear635097602585424000.jpg,599,,Women,http://www.yebhi.com/330225/PD/fabdeal-blue-dress-materials.htm,yebhi.com,Fabdeal Blue - Dress Materials Buy Online,Fabdeal Blue - Dress Materials  Best Price Rs 599.00  EMI Rs 100 for 6 months FREE Shipping In Stock - Delivery in 9-12 Days,None,<div class="product_detail_columns tinyscrl" itemprop="description" style=""><div class="scrollbar" style="width:2px; height:250px; background:#9E9E9E;"><div class="track" style="width:2px;"><div class="thumb" style="width:6px;"><div class="end"> </div></div></div></div><div class="viewport" style=" height:250px; width:252px; font-family:Arial !important;"><div class="overview" style="text-align:justify; display:block;"><div> In <b>blue and red</b>colour  <b>Fabdeal</b> brings to you this <b>unstitched salwaar suit</b> crafted with <b>chiffon and georgette</b>. It features <b>self prints</b> all over and comes with <b>matching bottom and dupatta</b>.<br/><br/><b>Features</b><ul style="margin-left: 20px;"><li type="disc"><b>Brand: </b>Fabdeal</li><li type="disc"><b>Category: </b>Traditional and Ethnic Wear</li><li type="disc"><b>Type: </b>Dress Material</li><li type="disc"><b>Fabric: </b>Chiffon  Crepe</li><li type="disc"><b>Colour: </b>Red  Blue</li></ul><br/><b>Wash and Care </b><br/>  Wash it with a mild detergent.<br> If washing in a machine  set it on a delicate mode and low temperature cycle<br> Wash dark colours separately and  use iron at low temperature<br/><br/><b>Note:</b> There may be a slight colour variation in the image from original product  </br></br></div></div></div> </div>,,16:04:2014,
485381,fabdeal black net dress materials,http://www.yebhi.com/online-shopping/women/apparels.html?affint=women-topmenu,3534,Clothing,dress-materials,fabdeal,http://im6.ybndc.com/upload/485381/ProductRear635297259885618000.jpg,3534,,Women,http://www.yebhi.com/485381/PD/fabdeal-black-net-dress-materials.htm,yebhi.com,Fabdeal Black Net - Dress Materials Buy Online,Fabdeal Black Net - Dress Materials  Best Price Rs 3534.00  EMI Rs 589 for 6 months FREE Shipping In Stock - Delivery in 9-12 Days,None,<div class="product_detail_columns tinyscrl" itemprop="description" style=""><div class="scrollbar" style="width:2px; height:250px; background:#9E9E9E;"><div class="track" style="width:2px;"><div class="thumb" style="width:6px;"><div class="end"> </div></div></div></div><div class="viewport" style=" height:250px; width:252px; font-family:Arial !important;"><div class="overview" style="text-align:justify; display:block;"><div>Salwar suit is an essential part of every Indian woman's wardrobe. Fabdeal presents a range of suits that come with a contemporary twist &amp; carries blend of classy &amp; modish qyuality. Team this exotic salwar suit with a pair of matching jewels to complete desired getup. Top : Length - Approx 48'' Chest Upto : 44''  Waist : 44''  Inner : 2.00 M Bottom : 2.25 M  Dupatta : 2.25 M  Top : Net  Inner : Santoon  Bottom : Santoon  Dupatta : Chiffon </div></div></div> </div>,,16:04:2014,
276226,fabdeal black women dress material,http://www.yebhi.com/online-shopping/women/apparels.html?affint=women-topmenu,4199,Clothing,dress-materials,fabdeal,http://im6.ybndc.com/upload/276226/ProductRear634986089894230293.jpg,4199,,Women,http://www.yebhi.com/276226/PD/fabdeal-black-women-dress-material.htm,yebhi.com,Fabdeal Black Women - Dress Material Buy Online,Fabdeal Black Women - Dress Material  Best Price Rs 4199.00  EMI Rs 700 for 6 months FREE Shipping In Stock - Delivery in 9-12 Days,None,<div class="product_detail_columns tinyscrl" itemprop="description" style=""><div class="scrollbar" style="width:2px; height:250px; background:#9E9E9E;"><div class="track" style="width:2px;"><div class="thumb" style="width:6px;"><div class="end"> </div></div></div></div><div class="viewport" style=" height:250px; width:252px; font-family:Arial !important;"><div class="overview" style="text-align:justify; display:block;"><div><table><tr><td><b>Colour</b></td><td>    </td><td>Black   Red</td></tr><tr><td><b>For</b></td><td>    </td><td>Women</td></tr><tr><td><b>Material</b></td><td>    </td><td>Viscose</td></tr><tr><td><b>Brands</b></td><td>    </td><td>Fabdeal</td></tr><tr><td><b>Departments</b></td><td>    </td><td>Apparels</td></tr><tr><td><b>Category</b></td><td>    </td><td>Dress Materials</td></tr></table>  </div></div></div> </div>,,16:04:2014,
416481,fabdeal blue dress materials,http://www.yebhi.com/online-shopping/women/apparels.html?affint=women-topmenu,849,Clothing,dress-materials,fabdeal,http://im6.ybndc.com/upload/416481/ProductRear635194374384362448.jpg,849,,Women,http://www.yebhi.com/416481/PD/fabdeal-blue-dress-materials.htm,yebhi.com,Fabdeal Blue - Dress Materials Buy Online,Fabdeal Blue - Dress Materials  Best Price Rs 849.00  EMI Rs 142 for 6 months FREE Shipping in 2 Days,None,<div class="product_detail_columns tinyscrl" itemprop="description" style=""><div class="scrollbar" style="width:2px; height:250px; background:#9E9E9E;"><div class="track" style="width:2px;"><div class="thumb" style="width:6px;"><div class="end"> </div></div></div></div><div class="viewport" style=" height:250px; width:252px; font-family:Arial !important;"><div class="overview" style="text-align:justify; display:block;"><div> This <b>dress material</b> from the house of <b>Fabdeal</b> features <b>crepe top</b> and <b>bottom</b>. In <b>blue and white</b> colour  it features <b>self prints</b> and all over. It comes with <b>matching bottom</b> and <b>chiffon dupatta</b> in <b>dual shade</b>.<br/><br/><b>Features</b><ul style="margin-left: 20px;"><li type="disc"><b>Brand: </b>Fabdeal</li><li type="disc"><b>Category: </b>Traditional and Ethnic Wear</li><li type="disc"><b>Type: </b>Dress Material</li><li type="disc"><b>Fabric: </b>Chiffon  Crepe</li><li type="disc"><b>Colour: </b>Blue  White</li></ul><br/><b>Wash and Care </b><br/>  Wash it with a mild detergent.<br> If washing in a machine  set it on a delicate mode and low temperature cycle<br> Wash dark colours separately and  use iron at low temperature<br/><br/><b>Note:</b> There may be a slight colour variation in the image from original product  </br></br></div></div></div> </div>,,16:04:2014,
485370,fabdeal purple cotton dress materials,http://www.yebhi.com/online-shopping/women/apparels.html?affint=women-topmenu,1235,Clothing,dress-materials,fabdeal,http://im6.ybndc.com/upload/485370/ProductRear635297259848646000.jpg,1235,,Women,http://www.yebhi.com/485370/PD/fabdeal-purple-cotton-dress-materials.htm,yebhi.com,Fabdeal Purple Cotton - Dress Materials Buy Online,Fabdeal Purple Cotton - Dress Materials  Best Price Rs 1235.00  EMI Rs 206 for 6 months FREE Shipping In Stock - Delivery in 9-12 Days,None,<div class="product_detail_columns tinyscrl" itemprop="description" style=""><div class="scrollbar" style="width:2px; height:250px; background:#9E9E9E;"><div class="track" style="width:2px;"><div class="thumb" style="width:6px;"><div class="end"> </div></div></div></div><div class="viewport" style=" height:250px; width:252px; font-family:Arial !important;"><div class="overview" style="text-align:justify; display:block;"><div>Look flawless by draping this marvelous apparel that carries Cotton material on its top  Polyster Cotton bottom with chiffon dupatta. The attire is shaded lavender hues to attain complimenting views like never before. Top : 2.10 M  Bottom : 2.50 M  Dupatta : 2.25 M  Top : Cotton  Bottom : Polyster  Cotton  Dupatta : Chiffon </div></div></div> </div>,,16:04:2014,
323125,fabdeal beige dress materials,http://www.yebhi.com/online-shopping/women/apparels.html?affint=women-topmenu,649,Clothing,dress-materials,fabdeal,http://im6.ybndc.com/upload/323125/ProductRear635080185214686995.jpg,649,,Women,http://www.yebhi.com/323125/PD/fabdeal-beige-dress-materials.htm,yebhi.com,Fabdeal Beige - Dress Materials Buy Online,Fabdeal Beige - Dress Materials  Best Price Rs 649.00  EMI Rs 108 for 6 months FREE Shipping in 2 Days,None,<div class="product_detail_columns tinyscrl" itemprop="description" style=""><div class="scrollbar" style="width:2px; height:250px; background:#9E9E9E;"><div class="track" style="width:2px;"><div class="thumb" style="width:6px;"><div class="end"> </div></div></div></div><div class="viewport" style=" height:250px; width:252px; font-family:Arial !important;"><div class="overview" style="text-align:justify; display:block;"><div>This dress material in <b>beige colour</b> from <b>Fabdeal</b> is crafted with <b>crepe polyester fabric.</b> The set features <b> printed pattern all over.</b><br/><br/><b>Features</b><ul style="margin-left: 20px;"><li type="disc"><b>Brand:</b> Fabdeal</li><li type="disc"><b>Category:</b>  Traditional and Ethnic Wear</li><li type="disc"><b>Type:</b> Dress Material</li><li type="disc"><b>Fabric:</b> Crepe Polyester</li><li type="disc"><b>Colour:</b> Beige  Brown</li></ul><br/><b>Wash &amp; Care</b><br/>  Wash it with a mild detergent.<br> If washing in a machine  set it on a delicate mode and low temperature cycle.<br> Wash dark colours separately and  use iron at low temperature.<br><br><b>Note:</b> There may be a slight colour variation in the image from original product. </br></br></br></br></div></div></div> </div>,,16:04:2014,
416504,fabdeal blue semi stitched dress materials,http://www.yebhi.com/online-shopping/women/apparels.html?affint=women-topmenu,2699,Clothing,dress-materials,fabdeal,http://im6.ybndc.com/upload/416504/ProductRear635194374457994920.jpg,2699,,Women,http://www.yebhi.com/416504/PD/fabdeal-blue-semi-stitched-dress-materials.htm,yebhi.com,Fabdeal Blue - Semi Stitched Dress Materials Buy Online,Fabdeal Blue - Semi Stitched Dress Materials  Best Price Rs 2699.00  EMI Rs 450 for 6 months FREE Shipping In Stock - Delivery in 13-17 Days,None,<div class="product_detail_columns tinyscrl" itemprop="description" style=""><div class="scrollbar" style="width:2px; height:250px; background:#9E9E9E;"><div class="track" style="width:2px;"><div class="thumb" style="width:6px;"><div class="end"> </div></div></div></div><div class="viewport" style=" height:250px; width:252px; font-family:Arial !important;"><div class="overview" style="text-align:justify; display:block;"><div>Infuse your true feminine elegance by draping this alluring piece that carries pure georgette on its top &amp; santoon inner &amp; bottom with chiffon dupatta. This blue in colored party wear salwar suit is designed with enchanting embroidery work that really allows you to appeal complimenting views like never before. </div></div></div> </div>,,16:04:2014,
300841,fabdeal green dress materials,http://www.yebhi.com/online-shopping/women/apparels.html?affint=women-topmenu,1449,Clothing,dress-materials,fabdeal,http://im6.ybndc.com/upload/300841/ProductRear635036954668477544.jpg,1449,,Women,http://www.yebhi.com/300841/PD/fabdeal-green-dress-materials.htm,yebhi.com,Fabdeal Green - Dress Materials Buy Online,Fabdeal Green - Dress Materials  Best Price Rs 1349.00 Best Discount 7% Off EMI Rs 225 for 6 months FREE Shipping in 2 Days,None,<div class="product_detail_columns tinyscrl" itemprop="description" style=""><div class="scrollbar" style="width:2px; height:250px; background:#9E9E9E;"><div class="track" style="width:2px;"><div class="thumb" style="width:6px;"><div class="end"> </div></div></div></div><div class="viewport" style=" height:250px; width:252px; font-family:Arial !important;"><div class="overview" style="text-align:justify; display:block;"><div> This <b>dress material</b> in <b>green and blue colour</b> from the house of <b>Fabdeal</b> features <b>thread work</b> all over with <b>heavy embroidery</b> on the <b>hem</b>. It comes with <b>matching bottom</b>. The dress material is crafted out of <b>cotton and chiffon material</b>. It has a <b>matching</b> dupatta with <b>thread work and borders.</b><br/><br/><b>Features</b><ul style="margin-left: 20px;"><li type="disc"><b>Brand:</b> Fabdeal</li><li type="disc"><b>Category:</b> Traditional and Ethnic Wear</li><li type="disc"><b>Type:</b> Dress Material</li><li type="disc"><b>Fabric:</b> Chiffon  Cotton</li><li type="disc"><b>Colour: </b>Green  Blue</li></ul><br/><b>Wash &amp; Care</b><br/>  Wash it with a mild detergent.<br> If washing in a machine  set it on a delicate mode and low temperature cycle.<br> Wash dark colours separately and  use iron at low temperature.<br><br><b>Note:</b> There may be a slight colour variation in the image from original product  </br></br></br></br></div></div></div> </div>,,16:04:2014,
485369,fabdeal pink art silk dress materials,http://www.yebhi.com/online-shopping/women/apparels.html?affint=women-topmenu,1235,Clothing,dress-materials,fabdeal,http://im6.ybndc.com/upload/485369/ProductRear635297259845058000.jpg,1235,,Women,http://www.yebhi.com/485369/PD/fabdeal-pink-art-silk-dress-materials.htm,yebhi.com,Fabdeal Pink Art Silk - Dress Materials Buy Online,Fabdeal Pink Art Silk - Dress Materials  Best Price Rs 1235.00  EMI Rs 206 for 6 months FREE Shipping In Stock - Delivery in 9-12 Days,None,<div class="product_detail_columns tinyscrl" itemprop="description" style=""><div class="scrollbar" style="width:2px; height:250px; background:#9E9E9E;"><div class="track" style="width:2px;"><div class="thumb" style="width:6px;"><div class="end"> </div></div></div></div><div class="viewport" style=" height:250px; width:252px; font-family:Arial !important;"><div class="overview" style="text-align:justify; display:block;"><div>This Embroidery suit with stunning design never lose its charm! Here is the apparel that features Banarasi Silk Jacquard on its top  bottom with Polyster Cotton &amp; chiffon dupatta! One should hit an ultimate purchase for drastic change in fashion sense.  Top : 2.10 M  Bottom : 2.50 M  Dupatta : 2.25 M  Top : Banarasi Silk Jacquard  Bottom : Polyster  Cotton  Dupatta : Chiffon </div></div></div> </div>,,16:04:2014,
