485388,fabdeal pink dress materials,http://www.yebhi.com/online-shopping/women/apparels.html?affint=women-topmenu,4802,Clothing,dress-materials,fabdeal,http://im6.ybndc.com/upload/485388/ProductRear635297259909798000.jpg,4802,,Women,http://www.yebhi.com/485388/PD/fabdeal-pink-dress-materials.htm,yebhi.com,Fabdeal Pink - Dress Materials Buy Online,Fabdeal Pink - Dress Materials  Best Price Rs 4802.00  EMI Rs 800 for 6 months FREE Shipping In Stock - Delivery in 9-12 Days,None,<div class="product_detail_columns tinyscrl" itemprop="description" style=""><div class="scrollbar" style="width:2px; height:250px; background:#9E9E9E;"><div class="track" style="width:2px;"><div class="thumb" style="width:6px;"><div class="end"> </div></div></div></div><div class="viewport" style=" height:250px; width:252px; font-family:Arial !important;"><div class="overview" style="text-align:justify; display:block;"><div>Your dressing style is incomplete without wearing this mesmerizing salwar suit that features viscose georgette on its top  viscose georgette sleeves  Santoon Silk inner &amp; bottom with pure chiffon dupatta. The suit is shaded in pink color touch that really looks catchy and appeals showers of compliments.  Top : Length - Approx 47'' Chest Upto : 44''  Waist : 44  Inner : 2.00 M Bottom : 2.50 M  Dupatta : 2.25 M Top : Viscose Georgette  Sleeve : Viscose Georgette  Inner : Santoon Silk  Bottom : Santoon Silk  Dupatta : Pure Chiffon </div></div></div> </div>,,16:04:2014,
488641,fabdeal purple dress materials,http://www.yebhi.com/online-shopping/women/apparels.html?affint=women-topmenu,1131,Clothing,dress-materials,fabdeal,http://im6.ybndc.com/upload/488641/ProductRear635304092991046000.jpg,1131,,Women,http://www.yebhi.com/488641/PD/fabdeal-purple-dress-materials.htm,yebhi.com,Fabdeal Purple - Dress Materials Buy Online,Fabdeal Purple - Dress Materials  Best Price Rs 1131.00  EMI Rs 189 for 6 months FREE Shipping In Stock - Delivery in 6-8 Days,None,<div class="product_detail_columns tinyscrl" itemprop="description" style=""><div class="scrollbar" style="width:2px; height:250px; background:#9E9E9E;"><div class="track" style="width:2px;"><div class="thumb" style="width:6px;"><div class="end"> </div></div></div></div><div class="viewport" style=" height:250px; width:252px; font-family:Arial !important;"><div class="overview" style="text-align:justify; display:block;"><div>Top : 2.00 M   Bottom : 2.00 M  Dupatta : 2.25 M  Top : Crepe Jacquard   Bottom : American Crepe   Dupatta : Silver Chiffon Lining:  NON PADDED Embroidered DRYCLEAN Rule the fashion this season by draping this marvelous attire that has come with tempting embroidered work. The material quality on suit comprises Crepe Jacquard on its top  American Crepe on its bottom with Silver Chiffon dupatta. Get going with this attire that assures to turn heads around. </div></div></div> </div>,,16:04:2014,
455608,fabdeal blue dress materials,http://www.yebhi.com/online-shopping/women/apparels.html?affint=women-topmenu,849,Clothing,dress-materials,fabdeal,http://im6.ybndc.com/upload/455608/ProductRear635261837679006000.jpg,849,,Women,http://www.yebhi.com/455608/PD/fabdeal-blue-dress-materials.htm,yebhi.com,Fabdeal Blue - Dress Materials Buy Online,Fabdeal Blue - Dress Materials  Best Price Rs 849.00  EMI Rs 142 for 6 months FREE Shipping In Stock - Delivery in 13-17 Days,None,<div class="product_detail_columns tinyscrl" itemprop="description" style=""><div class="scrollbar" style="width:2px; height:250px; background:#9E9E9E;"><div class="track" style="width:2px;"><div class="thumb" style="width:6px;"><div class="end"> </div></div></div></div><div class="viewport" style=" height:250px; width:252px; font-family:Arial !important;"><div class="overview" style="text-align:justify; display:block;"><div>Top : 2.00 M  Bottom : 2.00 M  Dupatta : 2.20 M </div></div></div> </div>,,16:04:2014,
455562,fabdeal purple dress materials,http://www.yebhi.com/online-shopping/women/apparels.html?affint=women-topmenu,999,Clothing,dress-materials,fabdeal,http://im6.ybndc.com/upload/455562/ProductRear635261837553114000.jpg,999,,Women,http://www.yebhi.com/455562/PD/fabdeal-purple-dress-materials.htm,yebhi.com,Fabdeal Purple - Dress Materials Buy Online,Fabdeal Purple - Dress Materials  Best Price Rs 999.00  EMI Rs 167 for 6 months FREE Shipping In Stock - Delivery in 13-17 Days,None,<div class="product_detail_columns tinyscrl" itemprop="description" style=""><div class="scrollbar" style="width:2px; height:250px; background:#9E9E9E;"><div class="track" style="width:2px;"><div class="thumb" style="width:6px;"><div class="end"> </div></div></div></div><div class="viewport" style=" height:250px; width:252px; font-family:Arial !important;"><div class="overview" style="text-align:justify; display:block;"><div>Top : 2.00 M  Inner : 1.90 M  Bottom : 2.00 M  Dupatta : 2.20 M </div></div></div> </div>,,16:04:2014,
310820,fabdeal green cotton dress materials,http://www.yebhi.com/online-shopping/women/apparels.html?affint=women-topmenu,2049,Clothing,dress-materials,fabdeal,http://im6.ybndc.com/upload/310820/ProductRear635059527543482893.jpg,2049,,Women,http://www.yebhi.com/310820/PD/fabdeal-green-cotton-dress-materials.htm,yebhi.com,Fabdeal Green Cotton - Dress Materials Buy Online,Fabdeal Green Cotton - Dress Materials  Best Price Rs 2049.00  EMI Rs 342 for 6 months FREE Shipping In Stock - Delivery in 9-12 Days,None,<div class="product_detail_columns tinyscrl" itemprop="description" style=""><div class="scrollbar" style="width:2px; height:250px; background:#9E9E9E;"><div class="track" style="width:2px;"><div class="thumb" style="width:6px;"><div class="end"> </div></div></div></div><div class="viewport" style=" height:250px; width:252px; font-family:Arial !important;"><div class="overview" style="text-align:justify; display:block;"><div> This suit in<b> green and pink colour</b> features <b>floral prints all over</b> with <b>heavy embroidery at the hem</b>.  It comes with <b>green coloured solid lower</b> with a pretty dupatta with <b>pink piping and at the borders</b>.<br/><br/><b>Features</b><ul style="margin-left: 20px;"><li type="disc"><b>Brand:</b>Fabdeal</li><li type="disc"><b>Category:</b> Traditional and Ethnic Wear</li><li type="disc"><b>Type:</b> Dress Material</li><li type="disc"><b>Fabric:</b> Cotton</li><li type="disc"><b>Colour: </b>Pink  Green</li></ul><br/><b>Wash &amp; Care</b><br/>  Wash it with a mild detergent<br> If washing in a machine  set it on a delicate mode and low temperature cycle<br> Wash dark colours separately and use iron at low temperature<br><br><b>Note:</b> There may be a slight colour variation in the image from original product </br></br></br></br></div></div></div> </div>,,16:04:2014,
418843,fabdeal green dress materials,http://www.yebhi.com/online-shopping/women/apparels.html?affint=women-topmenu,999,Clothing,dress-materials,fabdeal,http://im6.ybndc.com/upload/418843/ProductRear635201351634942857.jpg,999,,Women,http://www.yebhi.com/418843/PD/fabdeal-green-dress-materials.htm,yebhi.com,Fabdeal Green - Dress Materials Buy Online,Fabdeal Green - Dress Materials  Best Price Rs 999.00  EMI Rs 167 for 6 months FREE Shipping In Stock - Delivery in 13-17 Days,None,<div class="product_detail_columns tinyscrl" itemprop="description" style=""><div class="scrollbar" style="width:2px; height:250px; background:#9E9E9E;"><div class="track" style="width:2px;"><div class="thumb" style="width:6px;"><div class="end"> </div></div></div></div><div class="viewport" style=" height:250px; width:252px; font-family:Arial !important;"><div class="overview" style="text-align:justify; display:block;"><div> Designed with a perfect ethnic touch  this <b>dress material</b> is in <b>pink and green colour</b>. It features <b>georgette top having embroidery on the hem and yoke and self prints all over</b> with <b>crepe inner and bottom</b>. The <b>dupatta</b> is <b>printed</b> and comes in <b>dual shades</b>.<br/><br/><b>Features</b><ul style="margin-left: 20px;"><li type="disc"><b>Brand: </b>Fabdeal</li><li type="disc"><b>Category: </b>Traditional and Ethnic Wear</li><li type="disc"><b>Type: </b>Dress Material</li><li type="disc"><b>Fabric: </b>Chiffon  Crepe  Georgette  Polyester</li><li type="disc"><b>Colour: </b>Pink  Green</li></ul><br/><b>Wash and Care </b><br/>  Wash it with a mild detergent.<br> If washing in a machine  set it on a delicate mode and low temperature cycle<br> Wash dark colours separately and  use iron at low temperature<br/><br/><b>Note:</b> There may be a slight colour variation in the image from original product  </br></br></div></div></div> </div>,,16:04:2014,
330244,fabdeal red dress materials,http://www.yebhi.com/online-shopping/women/apparels.html?affint=women-topmenu,599,Clothing,dress-materials,fabdeal,http://im6.ybndc.com/upload/330244/ProductRear635097622203984000.jpg,599,,Women,http://www.yebhi.com/330244/PD/fabdeal-red-dress-materials.htm,yebhi.com,Fabdeal Red - Dress Materials Buy Online,Fabdeal Red - Dress Materials  Best Price Rs 599.00  EMI Rs 100 for 6 months FREE Shipping In Stock - Delivery in 9-12 Days,None,<div class="product_detail_columns tinyscrl" itemprop="description" style=""><div class="scrollbar" style="width:2px; height:250px; background:#9E9E9E;"><div class="track" style="width:2px;"><div class="thumb" style="width:6px;"><div class="end"> </div></div></div></div><div class="viewport" style=" height:250px; width:252px; font-family:Arial !important;"><div class="overview" style="text-align:justify; display:block;"><div> In <b>red  white and black </b>colour  <b>Fabdeal</b> brings to you this <b>unstitched salwaar suit</b> crafted with <b>chiffon and georgette</b>. It features <b>self prints</b> all over and comes with <b>matching bottom and dupatta</b>.<br/><br/><b>Features</b><ul style="margin-left: 20px;"><li type="disc"><b>Brand: </b>Fabdeal</li><li type="disc"><b>Category: </b>Traditional and Ethnic Wear</li><li type="disc"><b>Type: </b>Dress Material</li><li type="disc"><b>Fabric: </b>Chiffon  Crepe</li><li type="disc"><b>Colour: </b>Red  White  Black</li></ul><br/><b>Wash and Care </b><br/>  Wash it with a mild detergent.<br> If washing in a machine  set it on a delicate mode and low temperature cycle<br> Wash dark colours separately and  use iron at low temperature<br/><br/><b>Note:</b> There may be a slight colour variation in the image from original product  </br></br></div></div></div> </div>,,16:04:2014,
418857,fabdeal green dress materials,http://www.yebhi.com/online-shopping/women/apparels.html?affint=women-topmenu,2049,Clothing,dress-materials,fabdeal,http://im6.ybndc.com/upload/418857/ProductRear635201351681431155.jpg,2049,,Women,http://www.yebhi.com/418857/PD/fabdeal-green-dress-materials.htm,yebhi.com,Fabdeal Green - Dress Materials Buy Online,Fabdeal Green - Dress Materials  Best Price Rs 2049.00  EMI Rs 342 for 6 months FREE Shipping In Stock - Delivery in 13-17 Days,None,<div class="product_detail_columns tinyscrl" itemprop="description" style=""><div class="scrollbar" style="width:2px; height:250px; background:#9E9E9E;"><div class="track" style="width:2px;"><div class="thumb" style="width:6px;"><div class="end"> </div></div></div></div><div class="viewport" style=" height:250px; width:252px; font-family:Arial !important;"><div class="overview" style="text-align:justify; display:block;"><div> This <b>dress material</b> in <b>green and blue</b> colour feature <b>beautiful embroidery</b> on the <b>yoke and the hem</b>. The <b>dress material</b> has <b>georgette upper</b> with <b>crepe inner and bottom</b>. It comes with <b>contrast coloured bottom and dupatta</b>.<br/><br/><b>Features</b><ul style="margin-left: 20px;"><li type="disc"><b>Brand: </b>Fabdeal</li><li type="disc"><b>Category: </b>Traditional and Ethnic Wear</li><li type="disc"><b>Type: </b>Dress Material</li><li type="disc"><b>Fabric: </b>Georgette  Chiffon  Crepe</li><li type="disc"><b>Colour: </b>Green  Blue</li></ul><br/><b>Wash and Care </b><br/>  Wash it with a mild detergent.<br> If washing in a machine  set it on a delicate mode and low temperature cycle<br> Wash dark colours separately and  use iron at low temperature<br/><br/><b>Note:</b> There may be a slight colour variation in the image from original product  </br></br></div></div></div> </div>,,16:04:2014,
330277,fabdeal red dress materials,http://www.yebhi.com/online-shopping/women/apparels.html?affint=women-topmenu,999,Clothing,dress-materials,fabdeal,http://im6.ybndc.com/upload/330277/ProductRear635097646202400000.jpg,999,,Women,http://www.yebhi.com/330277/PD/fabdeal-red-dress-materials.htm,yebhi.com,Fabdeal Red - Dress Materials Buy Online,Fabdeal Red - Dress Materials  Best Price Rs 999.00  EMI Rs 167 for 6 months FREE Shipping In Stock - Delivery in 9-12 Days,None,<div class="product_detail_columns tinyscrl" itemprop="description" style=""><div class="scrollbar" style="width:2px; height:250px; background:#9E9E9E;"><div class="track" style="width:2px;"><div class="thumb" style="width:6px;"><div class="end"> </div></div></div></div><div class="viewport" style=" height:250px; width:252px; font-family:Arial !important;"><div class="overview" style="text-align:justify; display:block;"><div> This <b>dress material</b> in <b>red colour</b> features <b>booti print</b> all over is from the house of <b>Fabdeal</b>. It features a <b>broad embroidered border </b>at the <b>hem</b> and is crafted with <b>art silk</b> and <b>chiffon material</b>. It comes with <b>contrast colour salwaar</b> and a <b>matching dupatta</b> with <b>larger prints</b>.<br/><br/><b>Features</b><ul style="margin-left: 20px;"><li type="disc"><b>Brand:</b>Fabdeal</li><li type="disc"><b>Category:</b> Traditional and Ethnic Wear</li><li type="disc"><b>Type:</b> Dress Material</li><li type="disc"><b>Fabric:</b> Art Silk  Chiffon</li><li type="disc"><b>Colour:</b>Red  Grey</li></ul><br/><b>Wash &amp; Care</b><br/>  Wash it with a mild detergent<br> If washing in a machine  set it on a delicate mode and low temperature cycle<br> Wash dark colours separately and use iron at low temperature<br><br><b>Note:</b> There may be a slight colour variation in the image from original product   </br></br></br></br></div></div></div> </div>,,16:04:2014,
300785,fabdeal pink art silk dress materials,http://www.yebhi.com/online-shopping/women/apparels.html?affint=women-topmenu,749,Clothing,dress-materials,fabdeal,http://im6.ybndc.com/upload/300785/ProductRear635042220049286347.jpg,749,,Women,http://www.yebhi.com/300785/PD/fabdeal-pink-art-silk-dress-materials.htm,yebhi.com,Fabdeal Pink Art Silk - Dress Materials Buy Online,Fabdeal Pink Art Silk - Dress Materials  Best Price Rs 572.00 Best Discount 24% Off EMI Rs 95 for 6 months FREE Shipping In Stock - Delivery in 9-12 Days,None,<div class="product_detail_columns tinyscrl" itemprop="description" style=""><div class="scrollbar" style="width:2px; height:250px; background:#9E9E9E;"><div class="track" style="width:2px;"><div class="thumb" style="width:6px;"><div class="end"> </div></div></div></div><div class="viewport" style=" height:250px; width:252px; font-family:Arial !important;"><div class="overview" style="text-align:justify; display:block;"><div> This <b>dress material</b> in <b>pink and blue colour</b> from the house of <b>Fabdeal</b> features <b>assorted prints</b> all over. It comes with <b>matching bottom</b>. The dress material is crafted out of <b>art silk material</b>. It has a <b>tripple shaded</b> dupatta.<br/><br/><b>Features</b><ul style="margin-left: 20px;"><li type="disc"><b>Brand:</b> Fabdeal</li><li type="disc"><b>Category:</b> Traditional and Ethnic Wear</li><li type="disc"><b>Type:</b> Dress Material</li><li type="disc"><b>Fabric:</b> Art Silk</li><li type="disc"><b>Colour: </b>Pink  Blue</li></ul><br/><b>Wash &amp; Care</b><br/>  Dry Clean Only<br><br><b>Note:</b> There may be a slight colour variation in the image from original product  </br></br></div></div></div> </div>,,16:04:2014,
485347,fabdeal golden georgette dress materials,http://www.yebhi.com/online-shopping/women/apparels.html?affint=women-topmenu,3040,Clothing,dress-materials,fabdeal,http://im6.ybndc.com/upload/485347/ProductRear635297259769242000.jpg,3040,,Women,http://www.yebhi.com/485347/PD/fabdeal-golden-georgette-dress-materials.htm,yebhi.com,Fabdeal Golden Georgette - Dress Materials Buy Online,Fabdeal Golden Georgette - Dress Materials  Best Price Rs 3040.00  EMI Rs 507 for 6 months FREE Shipping In Stock - Delivery in 9-12 Days,None,<div class="product_detail_columns tinyscrl" itemprop="description" style=""><div class="scrollbar" style="width:2px; height:250px; background:#9E9E9E;"><div class="track" style="width:2px;"><div class="thumb" style="width:6px;"><div class="end"> </div></div></div></div><div class="viewport" style=" height:250px; width:252px; font-family:Arial !important;"><div class="overview" style="text-align:justify; display:block;"><div>One should redefine their majestic look with this marvelous suit that comprises pure georgette on its top  santoon inner &amp; bottom with naznin chiffon dupatta. It is embossed in olive green color to drag the complimenting views. The compatible design &amp; exotic embroidery work lends a unique persona like never before. Top : Length - Approx 48'' Chest Upto : 44''  Waist : 44''  Inner : 2.00 M Bottom : 2.25 M  Dupatta : 2.25 M  Top : Pure Georgette  Inner : Santoon  Bottom : Santoon   Dupatta : Naznin Chiffon </div></div></div> </div>,,16:04:2014,
416484,fabdeal blue dress materials,http://www.yebhi.com/online-shopping/women/apparels.html?affint=women-topmenu,849,Clothing,dress-materials,fabdeal,http://im6.ybndc.com/upload/416484/ProductRear635194374393566507.jpg,849,,Women,http://www.yebhi.com/416484/PD/fabdeal-blue-dress-materials.htm,yebhi.com,Fabdeal Blue - Dress Materials Buy Online,Fabdeal Blue - Dress Materials  Best Price Rs 849.00  EMI Rs 142 for 6 months FREE Shipping In Stock - Delivery in 13-17 Days,None,<div class="product_detail_columns tinyscrl" itemprop="description" style=""><div class="scrollbar" style="width:2px; height:250px; background:#9E9E9E;"><div class="track" style="width:2px;"><div class="thumb" style="width:6px;"><div class="end"> </div></div></div></div><div class="viewport" style=" height:250px; width:252px; font-family:Arial !important;"><div class="overview" style="text-align:justify; display:block;"><div> This <b>dress material</b> from the house of <b>Fabdeal</b> features <b>crepe top</b> and <b>bottom</b>. In <b>red  blue and green</b> colour  it features <b>self prints</b> and all over. It comes with <b>matching bottom</b> and <b>chiffon dupatta</b> in <b>dual shade</b>.<br/><br/><b>Features</b><ul style="margin-left: 20px;"><li type="disc"><b>Brand: </b>Fabdeal</li><li type="disc"><b>Category: </b>Traditional and Ethnic Wear</li><li type="disc"><b>Type: </b>Dress Material</li><li type="disc"><b>Fabric: </b>Chiffon  Crepe</li><li type="disc"><b>Colour: </b>Red  Blue  Green</li></ul><br/><b>Wash and Care </b><br/>  Wash it with a mild detergent.<br> If washing in a machine  set it on a delicate mode and low temperature cycle<br> Wash dark colours separately and  use iron at low temperature<br/><br/><b>Note:</b> There may be a slight colour variation in the image from original product  </br></br></div></div></div> </div>,,16:04:2014,
271829,fabdeal blue chiffon dress materials,http://www.yebhi.com/online-shopping/women/apparels.html?affint=women-topmenu,799,Clothing,dress-materials,fabdeal,http://im6.ybndc.com/upload/271829/ProductRear634977426547278399.jpg,799,,Women,http://www.yebhi.com/271829/PD/fabdeal-blue-chiffon-dress-materials.htm,yebhi.com,Fabdeal Blue Chiffon - Dress Materials Buy Online,Fabdeal Blue Chiffon - Dress Materials  Best Price Rs 674.00 Best Discount 16% Off EMI Rs 112 for 6 months FREE Shipping in 2 Days,None,<div class="product_detail_columns tinyscrl" itemprop="description" style=""><div class="scrollbar" style="width:2px; height:250px; background:#9E9E9E;"><div class="track" style="width:2px;"><div class="thumb" style="width:6px;"><div class="end"> </div></div></div></div><div class="viewport" style=" height:250px; width:252px; font-family:Arial !important;"><div class="overview" style="text-align:justify; display:block;"><div> This <b>dress material</b> in <b>blue  purple and green colour</b> from the house of <b>Fabdeal</b> features <b>floral prints</b> at the <b>front</b> . It comes with <b>matching bottom</b>. The dress material is crafted with <b>chiffon material</b>. It has a <b>tripple shaded</b> dupatta.<br/><br/><b>Features</b><ul style="margin-left: 20px;"><li type="disc"><b>Brand:</b> Fabdeal</li><li type="disc"><b>Category:</b> Traditional and Ethnic Wear</li><li type="disc"><b>Type:</b> Dress Material</li><li type="disc"><b>Fabric:</b> Chiffon</li><li type="disc"><b>Colour: </b>Purple  Green  Black</li></ul><br/><b>Wash &amp; Care</b><br/>  Wash it with a mild detergent<br> If washing in a machine  set it on a delicate mode and low temperature cycle<br> Wash dark colours separately and use iron at low temperature<br><br><b>Note:</b> There may be a slight colour variation in the image from original product  </br></br></br></br></div></div></div> </div>,,16:04:2014,
455589,fabdeal green dress materials,http://www.yebhi.com/online-shopping/women/apparels.html?affint=women-topmenu,699,Clothing,dress-materials,fabdeal,http://im6.ybndc.com/upload/455589/ProductRear635261837627994000.jpg,699,,Women,http://www.yebhi.com/455589/PD/fabdeal-green-dress-materials.htm,yebhi.com,Fabdeal Green - Dress Materials Buy Online,Fabdeal Green - Dress Materials  Best Price Rs 699.00  EMI Rs 117 for 6 months FREE Shipping In Stock - Delivery in 13-17 Days,None,<div class="product_detail_columns tinyscrl" itemprop="description" style=""><div class="scrollbar" style="width:2px; height:250px; background:#9E9E9E;"><div class="track" style="width:2px;"><div class="thumb" style="width:6px;"><div class="end"> </div></div></div></div><div class="viewport" style=" height:250px; width:252px; font-family:Arial !important;"><div class="overview" style="text-align:justify; display:block;"><div>Top : 2.00 M  Bottom : 1.90 M  Dupatta : 2.20 M </div></div></div> </div>,,16:04:2014,
455583,fabdeal black dress materials,http://www.yebhi.com/online-shopping/women/apparels.html?affint=women-topmenu,699,Clothing,dress-materials,fabdeal,http://im6.ybndc.com/upload/455583/ProductRear635261837611458000.jpg,699,,Women,http://www.yebhi.com/455583/PD/fabdeal-black-dress-materials.htm,yebhi.com,Fabdeal Black - Dress Materials Buy Online,Fabdeal Black - Dress Materials  Best Price Rs 699.00  EMI Rs 117 for 6 months FREE Shipping In Stock - Delivery in 13-17 Days,None,<div class="product_detail_columns tinyscrl" itemprop="description" style=""><div class="scrollbar" style="width:2px; height:250px; background:#9E9E9E;"><div class="track" style="width:2px;"><div class="thumb" style="width:6px;"><div class="end"> </div></div></div></div><div class="viewport" style=" height:250px; width:252px; font-family:Arial !important;"><div class="overview" style="text-align:justify; display:block;"><div>Top : 2.00 M  Bottom : 1.90 M  Dupatta : 2.20 M </div></div></div> </div>,,16:04:2014,
455558,fabdeal green dress materials,http://www.yebhi.com/online-shopping/women/apparels.html?affint=women-topmenu,999,Clothing,dress-materials,fabdeal,http://im6.ybndc.com/upload/455558/ProductRear635261837541882000.jpg,999,,Women,http://www.yebhi.com/455558/PD/fabdeal-green-dress-materials.htm,yebhi.com,Fabdeal Green - Dress Materials Buy Online,Fabdeal Green - Dress Materials  Best Price Rs 999.00  EMI Rs 167 for 6 months FREE Shipping In Stock - Delivery in 13-17 Days,None,<div class="product_detail_columns tinyscrl" itemprop="description" style=""><div class="scrollbar" style="width:2px; height:250px; background:#9E9E9E;"><div class="track" style="width:2px;"><div class="thumb" style="width:6px;"><div class="end"> </div></div></div></div><div class="viewport" style=" height:250px; width:252px; font-family:Arial !important;"><div class="overview" style="text-align:justify; display:block;"><div>Top : 2.00 M  Inner : 1.90 M  Bottom : 2.00 M  Dupatta : 2.20 M </div></div></div> </div>,,16:04:2014,
