305961,dream on grey cotton nighty,http://www.yebhi.com/online-shopping/women/apparels.html?affint=women-topmenu,1299,Clothing,nightwear,dream-on,http://im6.ybndc.com/upload/305961/ProductRear635061255828173570.jpg,1299,,Women,http://www.yebhi.com/305961/PD/dream-on-grey-cotton-nighty.htm,yebhi.com,Dream On Grey Cotton - Nighty Buy Online,Dream On Grey Cotton - Nighty  Best Price Rs 1299.00  EMI Rs 217 for 6 months FREE Shipping in 2 Days,SL,<div class="product_detail_columns tinyscrl" itemprop="description" style=""><div class="scrollbar" style="width:2px; height:250px; background:#9E9E9E;"><div class="track" style="width:2px;"><div class="thumb" style="width:6px;"><div class="end"> </div></div></div></div><div class="viewport" style=" height:250px; width:252px; font-family:Arial !important;"><div class="overview" style="text-align:justify; display:block;"><div>This nighty has a sleek  feminine silhouette  all wrapped up in comfort and style. This <b>ankle-length</b> nighty features a <b>lace trim neckline</b>. The <b>floral print</b> is eye-catchy and sophisticated at the same place.<b>Features</b><ul style="margin-left: 20px;"><li type="disc">Usage: Dailywear<li type="disc">Colour: Grey<li type="disc">Length: Ankle-length <li type="disc">Neck: V-neck <li type="disc">Sleeve: Sleeveless<li type="disc">Pattern: Printed <li type="disc">Material: Cotton</li></li></li></li></li></li></li></ul><b>Wash &amp; Care </b>  Mild wash / machine wash gently.  Wash dark colours separately. </div></div></div> </div>,,16:04:2014,
305967,dream on blue cotton women boxer shorts,http://www.yebhi.com/online-shopping/women/apparels.html?affint=women-topmenu,450,Clothing,nightwear,dream-on,http://im6.ybndc.com/upload/305967/ProductRear635056263785631160.jpg,450,,Women,http://www.yebhi.com/305967/PD/dream-on-blue-cotton-women-boxer-shorts.htm,yebhi.com,Dream On Blue Cotton Women - Boxer Shorts Buy Online,Dream On Blue Cotton Women - Boxer Shorts  Best Price Rs 450.00  EMI Rs 75 for 6 months,ML,<div class="product_detail_columns tinyscrl" itemprop="description" style=""><div class="scrollbar" style="width:2px; height:250px; background:#9E9E9E;"><div class="track" style="width:2px;"><div class="thumb" style="width:6px;"><div class="end"> </div></div></div></div><div class="viewport" style=" height:250px; width:252px; font-family:Arial !important;"><div class="overview" style="text-align:justify; display:block;"><div>Cool and comfy  these <b>polka dot</b> shorts will let you stay relaxed for the entire day. Made with softest <b>cotton</b> fabric  these shorts ensure utmost comfort for you. A great pick for summers  this pair would be perfect for a leisure time at home.<b>Features</b><ul style="margin-left: 20px;"><li type="disc">Usage: Dailywear<li type="disc">Style: Boxer<li type="disc">Pattern: Printed<li type="disc">Colour: Black<li type="disc">Waist: Mid-rise<li type="disc">Fit: Relaxed<li type="disc">Material: Cotton</li></li></li></li></li></li></li></ul><b>Wash &amp; Care </b>  Mild wash / machine wash gently.  Wash dark colours separately. </div></div></div> </div>,,16:04:2014,
305966,dream on beige cotton women nightwear,http://www.yebhi.com/online-shopping/women/apparels.html?affint=women-topmenu,1999,Clothing,nightwear,dream-on,http://im6.ybndc.com/upload/305966/ProductRear635056109290352812.jpg,1999,,Women,http://www.yebhi.com/305966/PD/dream-on-beige-cotton-women-nightwear.htm,yebhi.com,Dream On Beige Cotton Women - Nightwear Buy Online,Dream On Beige Cotton Women - Nightwear  Best Price Rs 1999.00  EMI Rs 333 for 6 months FREE Shipping in 2 Days,SML,<div class="product_detail_columns tinyscrl" itemprop="description" style=""><div class="scrollbar" style="width:2px; height:250px; background:#9E9E9E;"><div class="track" style="width:2px;"><div class="thumb" style="width:6px;"><div class="end"> </div></div></div></div><div class="viewport" style=" height:250px; width:252px; font-family:Arial !important;"><div class="overview" style="text-align:justify; display:block;"><div>Make your sleep time more delightful with this cozy and stylish 3 piece nightwear by Dream On. This set includes a <b>cover-up  top and pyjama bottoms</b> and features an <b>animal print</b> on the top and pyjama bottoms giving it a perfect feminine look. This set is crafted from soft <b>cotton</b> fabric for a comfortable and relaxed fit.<b>Features</b><ul style="margin-left: 20px;"><li type="disc">Usage: Dailywear<li type="disc">Contents: Cover-up  Top and Pyjama Bottoms <li type="disc">Pattern: Printed / Solid<li type="disc">Colour: Black  Beige<li type="disc">Material: Cotton</li></li></li></li></li></ul><b>Wash &amp; Care </b>  Mild wash / machine wash gently.  Wash dark colours separately. </div></div></div> </div>,,16:04:2014,
305962,dream on white cotton babydoll nightwear,http://www.yebhi.com/online-shopping/women/apparels.html?affint=women-topmenu,1799,Clothing,nightwear,dream-on,http://im6.ybndc.com/upload/305962/ProductRear635056275742015803.jpg,1799,,Women,http://www.yebhi.com/305962/PD/dream-on-white-cotton-babydoll-nightwear.htm,yebhi.com,Dream On White Cotton - Babydoll Nightwear Buy Online,Dream On White Cotton - Babydoll Nightwear  Best Price Rs 1799.00  EMI Rs 300 for 6 months FREE Shipping in 2 Days,SML,<div class="product_detail_columns tinyscrl" itemprop="description" style=""><div class="scrollbar" style="width:2px; height:250px; background:#9E9E9E;"><div class="track" style="width:2px;"><div class="thumb" style="width:6px;"><div class="end"> </div></div></div></div><div class="viewport" style=" height:250px; width:252px; font-family:Arial !important;"><div class="overview" style="text-align:justify; display:block;"><div>This cute babydoll dress is made with soft <b>cotton</b> fabric  perfect to be worn in summers for a relaxing day at home. This nightwear features an adorable <b>print</b> for an ultimate feminine appeal and also comes with a solid <b>pink</b> colour shrug. <b>Features</b><ul style="margin-left: 20px;"><li type="disc">Usage: Dailywear<li type="disc">Contents: Babydoll dress and Shrug <li type="disc">Colour: Pink  White<li type="disc">Length: Thigh-length <li type="disc">Neck: V-neck<li type="disc">Pattern: Printed <li type="disc">Material: Cotton</li></li></li></li></li></li></li></ul><b>Wash &amp; Care </b>  Mild wash / machine wash gently.  Wash dark colours separately. </div></div></div> </div>,,16:04:2014,
305959,dream on black cotton women nightwear,http://www.yebhi.com/online-shopping/women/apparels.html?affint=women-topmenu,1199,Clothing,nightwear,dream-on,http://im6.ybndc.com/upload/305959/ProductRear635056109000970957.jpg,1199,,Women,http://www.yebhi.com/305959/PD/dream-on-black-cotton-women-nightwear.htm,yebhi.com,Dream On Black Cotton Women - Nightwear Buy Online,Dream On Black Cotton Women - Nightwear  Best Price Rs 1199.00  EMI Rs 200 for 6 months FREE Shipping in 2 Days,ML,<div class="product_detail_columns tinyscrl" itemprop="description" style=""><div class="scrollbar" style="width:2px; height:250px; background:#9E9E9E;"><div class="track" style="width:2px;"><div class="thumb" style="width:6px;"><div class="end"> </div></div></div></div><div class="viewport" style=" height:250px; width:252px; font-family:Arial !important;"><div class="overview" style="text-align:justify; display:block;"><div>This smart and comfortable nightwear keeps you relaxed at home. This two piece set has a black <b>racer back</b> vest and an <b>abstract printed</b> pyjama. Crafted with <b>cotton</b>  it keeps you at utmost comfort and ease after a hard tiring day at work.<br/><br/><b>Features</b><br/><ul style="margin-left: 20px"><li type="disc">Usage: Everyday<br/></li><li type="disc">Material: Cotton<br/></li><li type="disc">Colour: Black  White<br/></li><li type="dis">Pattern: Solid  Printed <br/></li><li type="dis">Contents: Racer back vest and pyjama<br/></li><li type="disc">Neck (Vest): Round <br/></li><li type="disc">Length (Pyjama): Full length <br/></li></ul><br/><b>Wash &amp; Care </b><br/>  Mild wash / machine wash gently. <br/>  Wash dark colours separately. </div></div></div> </div>,,16:04:2014,
305960,dream on beige cotton women nightwear,http://www.yebhi.com/online-shopping/women/apparels.html?affint=women-topmenu,1099,Clothing,nightwear,dream-on,http://im6.ybndc.com/upload/305960/ProductRear635056281374275907.jpg,1099,,Women,http://www.yebhi.com/305960/PD/dream-on-beige-cotton-women-nightwear.htm,yebhi.com,Dream On Beige Cotton Women - Nightwear Buy Online,Dream On Beige Cotton Women - Nightwear  Best Price Rs 1099.00  EMI Rs 183 for 6 months FREE Shipping in 2 Days,SML,<div class="product_detail_columns tinyscrl" itemprop="description" style=""><div class="scrollbar" style="width:2px; height:250px; background:#9E9E9E;"><div class="track" style="width:2px;"><div class="thumb" style="width:6px;"><div class="end"> </div></div></div></div><div class="viewport" style=" height:250px; width:252px; font-family:Arial !important;"><div class="overview" style="text-align:justify; display:block;"><div>Stylish yet comfy  this 2 piece nightwear includes a top and shorts. This nightwear in soothing colour offers an alluring feminine appeal and features an <b>attractive prints</b>. Crafted from soft <b>cotton</b> fabric this set is a perfect loungewear to relax at home.<b>Features</b><ul style="margin-left: 20px;"><li type="disc">Usage: Dailywear<li type="disc">Contents: Top and Shorts<li type="disc">Pattern: Printed<li type="disc">Colour: Blue  Orange and White<li type="disc">Neck (Top): Round neck<li type="disc">Sleeve (Top): Half Sleeve<li type="disc">Material: Cotton</li></li></li></li></li></li></li></ul><b>Wash &amp; Care </b>  Mild wash / machine wash gently.  Wash dark colours separately. </div></div></div> </div>,,16:04:2014,
305965,dream on purple cotton women nightwear,http://www.yebhi.com/online-shopping/women/apparels.html?affint=women-topmenu,899,Clothing,nightwear,dream-on,http://im6.ybndc.com/upload/305965/ProductRear635060575465848301.jpg,899,,Women,http://www.yebhi.com/305965/PD/dream-on-purple-cotton-women-nightwear.htm,yebhi.com,Dream On Purple Cotton Women - Nightwear Buy Online,Dream On Purple Cotton Women - Nightwear  Best Price Rs 899.00  EMI Rs 150 for 6 months FREE Shipping in 2 Days,ML,<div class="product_detail_columns tinyscrl" itemprop="description" style=""><div class="scrollbar" style="width:2px; height:250px; background:#9E9E9E;"><div class="track" style="width:2px;"><div class="thumb" style="width:6px;"><div class="end"> </div></div></div></div><div class="viewport" style=" height:250px; width:252px; font-family:Arial !important;"><div class="overview" style="text-align:justify; display:block;"><div>Make your sleep time more delightful with this cozy and stylish 2 piece nightwear by Dream On. This set includes <b>top and shorts</b> and features a cute <b>butterfly print</b> on the top and giving it a perfect feminine look. This set is crafted from soft <b>cotton</b> fabric for a comfortable and relaxed fit.<b>Features</b><ul style="margin-left: 20px;"><li type="disc">Usage: Dailywear<li type="disc">Contents: Top and Shorts<li type="disc">Pattern: Printed / Solid<li type="disc">Colour: Red  White<li type="disc">Neck (Top): Round neck<li type="disc">Sleeve (Top): Sleeveless<li type="disc">Material: Cotton</li></li></li></li></li></li></li></ul><b>Wash &amp; Care </b>  Mild wash / machine wash gently.  Wash dark colours separately. </div></div></div> </div>,,16:04:2014,
305964,dream on white cotton babydoll nightwear,http://www.yebhi.com/online-shopping/women/apparels.html?affint=women-topmenu,1499,Clothing,nightwear,dream-on,http://im6.ybndc.com/upload/305964/ProductRear635056276096762077.jpg,1499,,Women,http://www.yebhi.com/305964/PD/dream-on-white-cotton-babydoll-nightwear.htm,yebhi.com,Dream On White Cotton - Babydoll Nightwear Buy Online,Dream On White Cotton - Babydoll Nightwear  Best Price Rs 1499.00  EMI Rs 250 for 6 months FREE Shipping in 2 Days,SML,<div class="product_detail_columns tinyscrl" itemprop="description" style=""><div class="scrollbar" style="width:2px; height:250px; background:#9E9E9E;"><div class="track" style="width:2px;"><div class="thumb" style="width:6px;"><div class="end"> </div></div></div></div><div class="viewport" style=" height:250px; width:252px; font-family:Arial !important;"><div class="overview" style="text-align:justify; display:block;"><div>This cute babydoll dress is made with soft <b>cotton</b> fabric  perfect to be worn in summers for a relaxing day at home. This nightwear features an adorable <b>floral print</b> for an ultimate feminine appeal and also comes with a solid <b>green</b> colour shrug. <b>Features</b><ul style="margin-left: 20px;"><li type="disc">Usage: Dailywear<li type="disc">Contents: Babydoll dress and Shrug <li type="disc">Colour: Green  White <li type="disc">Length: Thigh-length <li type="disc">Neck: V-neck<li type="disc">Pattern: Printed <li type="disc">Material: Cotton</li></li></li></li></li></li></li></ul><b>Wash &amp; Care </b>  Mild wash / machine wash gently.  Wash dark colours separately. </div></div></div> </div>,,16:04:2014,
