472227,just linen orange pillow covers,http://www.yebhi.com/online-shopping/home-furnishing.html?affint=home-topmenu,395,Home Furnishings,pillows-cushions-bolsters,justlinen,http://im6.ybndc.com/upload/472227/ProductRear635296304191710000.jpg,395,,home and kitchen,http://www.yebhi.com/472227/PD/just-linen-orange-pillow-covers.htm,yebhi.com,Just Linen Orange - Pillow Covers Buy Online,Just Linen Orange - Pillow Covers  Best Price Rs 395.00  EMI Rs 66 for 6 months,None,<div class="product_detail_columns tinyscrl" itemprop="description" style=""><div class="scrollbar" style="width:2px; height:250px; background:#9E9E9E;"><div class="track" style="width:2px;"><div class="thumb" style="width:6px;"><div class="end"> </div></div></div></div><div class="viewport" style=" height:250px; width:252px; font-family:Arial !important;"><div class="overview" style="text-align:justify; display:block;"><div> Your bedset is the highlight of your home d cor. Make your's unique with this striped Pillow Covers .Made of different materials and accented with beautiful designs our cotton bed linen is the cynosure of our product range.  Product Note: All accessories visible in the image are used for pictoral representation only  and are not for sale.   </div></div></div> </div>,,17:04:2014,
472223,just linen yellow pillow covers,http://www.yebhi.com/online-shopping/home-furnishing.html?affint=home-topmenu,395,Home Furnishings,pillows-cushions-bolsters,justlinen,http://im6.ybndc.com/upload/472223/ProductRear635296304188122000.jpg,395,,home and kitchen,http://www.yebhi.com/472223/PD/just-linen-yellow-pillow-covers.htm,yebhi.com,Just Linen Yellow - Pillow Covers Buy Online,Just Linen Yellow - Pillow Covers  Best Price Rs 395.00  EMI Rs 66 for 6 months,None,<div class="product_detail_columns tinyscrl" itemprop="description" style=""><div class="scrollbar" style="width:2px; height:250px; background:#9E9E9E;"><div class="track" style="width:2px;"><div class="thumb" style="width:6px;"><div class="end"> </div></div></div></div><div class="viewport" style=" height:250px; width:252px; font-family:Arial !important;"><div class="overview" style="text-align:justify; display:block;"><div> Your bedset is the highlight of your home d cor. Make your's unique with this striped Pillow Covers .Made of different materials and accented with beautiful designs our cotton bed linen is the cynosure of our product range.  Product Note: All accessories visible in the image are used for pictoral representation only  and are not for sale.   </div></div></div> </div>,,17:04:2014,
472228,just linen beige pillow covers,http://www.yebhi.com/online-shopping/home-furnishing.html?affint=home-topmenu,395,Home Furnishings,pillows-cushions-bolsters,justlinen,http://im6.ybndc.com/upload/472228/ProductRear635296304192802000.jpg,395,,home and kitchen,http://www.yebhi.com/472228/PD/just-linen-beige-pillow-covers.htm,yebhi.com,Just Linen Beige - Pillow Covers Buy Online,Just Linen Beige - Pillow Covers  Best Price Rs 395.00  EMI Rs 66 for 6 months,None,<div class="product_detail_columns tinyscrl" itemprop="description" style=""><div class="scrollbar" style="width:2px; height:250px; background:#9E9E9E;"><div class="track" style="width:2px;"><div class="thumb" style="width:6px;"><div class="end"> </div></div></div></div><div class="viewport" style=" height:250px; width:252px; font-family:Arial !important;"><div class="overview" style="text-align:justify; display:block;"><div> Your bedset is the highlight of your home d cor. Make your's unique with this striped Pillow Covers .Made of different materials and accented with beautiful designs our cotton bed linen is the cynosure of our product range.  Product Note: All accessories visible in the image are used for pictoral representation only  and are not for sale.   </div></div></div> </div>,,17:04:2014,
449750,just linen damask regular pillow cover,http://www.yebhi.com/online-shopping/home-furnishing.html?affint=home-topmenu,495,Home Furnishings,pillows-cushions-bolsters,justlinen,http://im6.ybndc.com/upload/449750/ProductRear635260789056678000.jpg,495,,home and kitchen,http://www.yebhi.com/449750/PD/just-linen-damask-regular-pillow-cover.htm,yebhi.com,Just Linen Damask Regular - Pillow Cover Buy Online,Just Linen Damask Regular - Pillow Cover  Best Price Rs 495.00  EMI Rs 83 for 6 months,None,<div class="product_detail_columns tinyscrl" itemprop="description" style=""><div class="scrollbar" style="width:2px; height:250px; background:#9E9E9E;"><div class="track" style="width:2px;"><div class="thumb" style="width:6px;"><div class="end"> </div></div></div></div><div class="viewport" style=" height:250px; width:252px; font-family:Arial !important;"><div class="overview" style="text-align:justify; display:block;"><div>Prodcut Name : Pillow Covers<br/>  Material : 100% Cotton Damask <br/>  Size : 19 * 29 inches (48 * 74 cms)<br/>  Total no of Pieces : 2 Piece Set<br/>  Detail of Pieces : 2 (1 Pair of Regular Size Pillow Covers)<br/>  Special Features : Concentric Circles / Self Design<br/>  Key Features : Indulge in a bit of everyday luxury with Just Linen's Bedsheet Set. Extremely soft and easy to care for  this quality bedding is made from 100% Cotton Damask whose longer  finer fibers make for a silky smooth feel that gets softer with every washing. Classic styling includes fine patterns which gives a rich look to your decor.  Thread Count: 300/sq.inch  Product Note: All accessories visible in the image are used for pictorial representation only  and are not for sale.<br/>  Wash Care : Hand Wash in cold water and dry in shade   Use Mild detergent  Do not bleach / soak / tumble dry   Wash dark colours seperately    </div></div></div> </div>,,17:04:2014,
449653,just linen regular size pillow protector,http://www.yebhi.com/online-shopping/home-furnishing.html?affint=home-topmenu,350,Home Furnishings,pillows-cushions-bolsters,justlinen,http://im6.ybndc.com/upload/449653/ProductRear635260788962298000.jpg,350,,home and kitchen,http://www.yebhi.com/449653/PD/just-linen-regular-size-pillow-protector.htm,yebhi.com,Just Linen Regular Size - Pillow Protector Buy Online,Just Linen Regular Size - Pillow Protector  Best Price Rs 350.00  EMI Rs 58 for 6 months,None,<div class="product_detail_columns tinyscrl" itemprop="description" style=""><div class="scrollbar" style="width:2px; height:250px; background:#9E9E9E;"><div class="track" style="width:2px;"><div class="thumb" style="width:6px;"><div class="end"> </div></div></div></div><div class="viewport" style=" height:250px; width:252px; font-family:Arial !important;"><div class="overview" style="text-align:justify; display:block;"><div>Prodcut Name : Pillow Protector<br/>  Material : 100% Silkenised Micro Poly Wadding(100 gsm) as the filling. Outer covering is of 100% Cotton White fabric.<br/>  Size : 19 * 29 inches (48 * 74 cms)<br/>  Total no of Pieces : 1 Piece<br/>  Detail of Pieces : 1 Regular Sized Pillow Protector<br/>  Special Features : Quilted Checks<br/>  Key Features :  Can't sleep without your favourite pillow  Let us help you ensure that your pillows are protected and last longer. These protectors help prevent any liquid or bacterial penetration into your pillows. These protectors help prevent any liquid or bacterial penetration into your pillows. Material: 100% Silkenised Micro Poly Wadding(100 gsm) as the filling. Outer covering is of 100% Cotton White fabric. Product Note: These 2 sided protectors are used on the pillows like a slip.<br/>  Wash Care : Hand Wash in cold water and dry in shade   Use Mild detergent  Do not bleach / soak / tumble dry   Wash dark colours seperately    </div></div></div> </div>,,17:04:2014,
472225,just linen beige pillow covers,http://www.yebhi.com/online-shopping/home-furnishing.html?affint=home-topmenu,395,Home Furnishings,pillows-cushions-bolsters,justlinen,http://im6.ybndc.com/upload/472225/ProductRear635296304189838000.jpg,395,,home and kitchen,http://www.yebhi.com/472225/PD/just-linen-beige-pillow-covers.htm,yebhi.com,Just Linen Beige - Pillow Covers Buy Online,Just Linen Beige - Pillow Covers  Best Price Rs 395.00  EMI Rs 66 for 6 months,None,<div class="product_detail_columns tinyscrl" itemprop="description" style=""><div class="scrollbar" style="width:2px; height:250px; background:#9E9E9E;"><div class="track" style="width:2px;"><div class="thumb" style="width:6px;"><div class="end"> </div></div></div></div><div class="viewport" style=" height:250px; width:252px; font-family:Arial !important;"><div class="overview" style="text-align:justify; display:block;"><div> Your bedset is the highlight of your home d cor. Make your's unique with this striped Pillow Covers .Made of different materials and accented with beautiful designs our cotton bed linen is the cynosure of our product range.  Product Note: All accessories visible in the image are used for pictoral representation only  and are not for sale.   </div></div></div> </div>,,17:04:2014,
472144,just linen white cotton pillow covers,http://www.yebhi.com/online-shopping/home-furnishing.html?affint=home-topmenu,495,Home Furnishings,pillows-cushions-bolsters,justlinen,http://im6.ybndc.com/upload/472144/ProductRear635296305752802000.jpg,495,,home and kitchen,http://www.yebhi.com/472144/PD/just-linen-white-cotton-pillow-covers.htm,yebhi.com,Just Linen White Cotton - Pillow Covers Buy Online,Just Linen White Cotton - Pillow Covers  Best Price Rs 495.00  EMI Rs 83 for 6 months,None,<div class="product_detail_columns tinyscrl" itemprop="description" style=""><div class="scrollbar" style="width:2px; height:250px; background:#9E9E9E;"><div class="track" style="width:2px;"><div class="thumb" style="width:6px;"><div class="end"> </div></div></div></div><div class="viewport" style=" height:250px; width:252px; font-family:Arial !important;"><div class="overview" style="text-align:justify; display:block;"><div>Indulge in a bit of everyday luxury with Just Linen pillow Covers. Extremely soft and easy to care for  this quality bedding is made from  100% Cotton Damask whose longer  finer fibers make for a silky smooth feel that gets softer with every washing. Classic styling includes fine patterns which gives a rich look to your decor. Product Note: All accessories visible in the image are used for pictoral representation only  and are not for sale. </div></div></div> </div>,,17:04:2014,
449618,just linen grey regular pillow cover,http://www.yebhi.com/online-shopping/home-furnishing.html?affint=home-topmenu,495,Home Furnishings,pillows-cushions-bolsters,justlinen,http://im6.ybndc.com/upload/449618/ProductRear635260788926262000.jpg,495,,home and kitchen,http://www.yebhi.com/449618/PD/just-linen-grey-regular-pillow-cover.htm,yebhi.com,Just Linen Grey Regular - Pillow Cover Buy Online,Just Linen Grey Regular - Pillow Cover  Best Price Rs 495.00  EMI Rs 83 for 6 months,None,<div class="product_detail_columns tinyscrl" itemprop="description" style=""><div class="scrollbar" style="width:2px; height:250px; background:#9E9E9E;"><div class="track" style="width:2px;"><div class="thumb" style="width:6px;"><div class="end"> </div></div></div></div><div class="viewport" style=" height:250px; width:252px; font-family:Arial !important;"><div class="overview" style="text-align:justify; display:block;"><div>Prodcut Name : Pillow Covers<br/>  Material : 100% Cotton Satin Yarn Dyed<br/>  Size : 19 * 29 inches (48 * 74 cms)<br/>  Total no of Pieces : 2 Piece Set<br/>  Detail of Pieces : 2 (1 Pair of Regular Size Pillow Covers)<br/>  Special Features : Yarn Dyed Stripes<br/>  Key Features : This contemporary styled Urban Stripe Complete Bedding Set by Just Linen is the ideal choice to update or change the look of your bedroom. The complete bed set is incredibly soft and looks great with any combination of furniture and accessories. So create a mood and generate some envy. These cotton linens define the mood and temperament of an individual for a day. So just add a ravishing beauty.  Thread Count: 300/sq.inch  Product Note: All accessories visible in the image are used for pictorial representation only  and are not for sale.<br/>  Wash Care : Wash Care:  i)Do not bleach / soak. ii) Wash dark colours seperately. iii) Wash in cold water and dry in shade.    iv) Don't Soak overnight.   v) Light Ironing required after wash.  vi) No need to dry clean.      </div></div></div> </div>,,17:04:2014,
449598,just linen damask regular pillow cover,http://www.yebhi.com/online-shopping/home-furnishing.html?affint=home-topmenu,495,Home Furnishings,pillows-cushions-bolsters,justlinen,http://im6.ybndc.com/upload/449598/ProductRear635260788906606000.jpg,495,,home and kitchen,http://www.yebhi.com/449598/PD/just-linen-damask-regular-pillow-cover.htm,yebhi.com,Just Linen Damask Regular - Pillow Cover Buy Online,Just Linen Damask Regular - Pillow Cover  Best Price Rs 495.00  EMI Rs 83 for 6 months,None,<div class="product_detail_columns tinyscrl" itemprop="description" style=""><div class="scrollbar" style="width:2px; height:250px; background:#9E9E9E;"><div class="track" style="width:2px;"><div class="thumb" style="width:6px;"><div class="end"> </div></div></div></div><div class="viewport" style=" height:250px; width:252px; font-family:Arial !important;"><div class="overview" style="text-align:justify; display:block;"><div>Prodcut Name : Pillow Covers<br/>  Material : 100% Cotton Damask <br/>  Size : 19 * 29 inches (48 * 74 cms)<br/>  Total no of Pieces : 2 Piece Set<br/>  Detail of Pieces : 2 (1 Pair of Regular Size Pillow Covers)<br/>  Special Features : ContemporaryPattern / Self Design<br/>  Key Features : Indulge in a bit of everyday luxury with Just Linen's Bedsheet Set. Extremely soft and easy to care for  this quality bedding is made from 100% Cotton Damask whose longer  finer fibers make for a silky smooth feel that gets softer with every washing. Classic styling includes fine patterns which gives a rich look to your decor.  Thread Count: 300/sq.inch  Product Note: All accessories visible in the image are used for pictorial representation only  and are not for sale.<br/>  Wash Care : Wash Care:  i)Do not bleach / soak. ii) Wash dark colours seperately. iii) Wash in cold water and dry in shade.    iv) Don't Soak overnight.   v) Light Ironing required after wash.  vi) No need to dry clean.      </div></div></div> </div>,,17:04:2014,
472083,just linen purple pillow covers,http://www.yebhi.com/online-shopping/home-furnishing.html?affint=home-topmenu,395,Home Furnishings,pillows-cushions-bolsters,justlinen,http://im6.ybndc.com/upload/472083/ProductRear635296305695082000.jpg,395,,home and kitchen,http://www.yebhi.com/472083/PD/just-linen-purple-pillow-covers.htm,yebhi.com,Just Linen Purple - Pillow Covers Buy Online,Just Linen Purple - Pillow Covers  Best Price Rs 395.00  EMI Rs 66 for 6 months,None,<div class="product_detail_columns tinyscrl" itemprop="description" style=""><div class="scrollbar" style="width:2px; height:250px; background:#9E9E9E;"><div class="track" style="width:2px;"><div class="thumb" style="width:6px;"><div class="end"> </div></div></div></div><div class="viewport" style=" height:250px; width:252px; font-family:Arial !important;"><div class="overview" style="text-align:justify; display:block;"><div>This luxurious Pillow Coversis sure to add a subtle touch of class  and sophistication to your bedroom. This beautiful Self Design Pillow Covers will take the level of comfort and warmth of your room one step ahead  while exuding elegance and charm at the same time.    Product Note: All accessories visible in the image are used for pictoral representation only  and are not for sale. </div></div></div> </div>,,17:04:2014,
472145,just linen white cotton pillow covers,http://www.yebhi.com/online-shopping/home-furnishing.html?affint=home-topmenu,495,Home Furnishings,pillows-cushions-bolsters,justlinen,http://im6.ybndc.com/upload/472145/ProductRear635296305753738000.jpg,495,,home and kitchen,http://www.yebhi.com/472145/PD/just-linen-white-cotton-pillow-covers.htm,yebhi.com,Just Linen White Cotton - Pillow Covers Buy Online,Just Linen White Cotton - Pillow Covers  Best Price Rs 495.00  EMI Rs 83 for 6 months,None,<div class="product_detail_columns tinyscrl" itemprop="description" style=""><div class="scrollbar" style="width:2px; height:250px; background:#9E9E9E;"><div class="track" style="width:2px;"><div class="thumb" style="width:6px;"><div class="end"> </div></div></div></div><div class="viewport" style=" height:250px; width:252px; font-family:Arial !important;"><div class="overview" style="text-align:justify; display:block;"><div>This Cotton Damask is the one of the finest from our collection of luxurious linen. Give a sophisticated look to your bed during the day  and feel the comfort of richness during the night with this uber soft Pillow Covers .                                                                                                                                                                                                                                                                                                                                                                                                                                                                                                                           Product Note: All accessories visible in the image are used for pictorial representation only  and are not for sale.  </div></div></div> </div>,,17:04:2014,
449610,just linen brown regular pillow cover,http://www.yebhi.com/online-shopping/home-furnishing.html?affint=home-topmenu,495,Home Furnishings,pillows-cushions-bolsters,justlinen,http://im6.ybndc.com/upload/449610/ProductRear635260788917994000.jpg,495,,home and kitchen,http://www.yebhi.com/449610/PD/just-linen-brown-regular-pillow-cover.htm,yebhi.com,Just Linen Brown Regular - Pillow Cover Buy Online,Just Linen Brown Regular - Pillow Cover  Best Price Rs 495.00  EMI Rs 83 for 6 months,None,<div class="product_detail_columns tinyscrl" itemprop="description" style=""><div class="scrollbar" style="width:2px; height:250px; background:#9E9E9E;"><div class="track" style="width:2px;"><div class="thumb" style="width:6px;"><div class="end"> </div></div></div></div><div class="viewport" style=" height:250px; width:252px; font-family:Arial !important;"><div class="overview" style="text-align:justify; display:block;"><div>Prodcut Name : Pillow Covers<br/>  Material : 100% Cotton Satin Yarn Dyed<br/>  Size : 19 * 29 inches (48 * 74 cms)<br/>  Total no of Pieces : 2 Piece Set<br/>  Detail of Pieces : 2 (1 Pair of Regular Size Pillow Covers)<br/>  Special Features : Yarn Dyed Stripes<br/>  Key Features : This contemporary styled Urban Stripe Complete Bedding Set by Just Linen is the ideal choice to update or change the look of your bedroom. The complete bed set is incredibly soft and looks great with any combination of furniture and accessories. So create a mood and generate some envy. These cotton linens define the mood and temperament of an individual for a day. So just add a ravishing beauty.  Thread Count: 300/sq.inch  Product Note: All accessories visible in the image are used for pictorial representation only  and are not for sale.<br/>  Wash Care : Wash Care:  i)Do not bleach / soak. ii) Wash dark colours seperately. iii) Wash in cold water and dry in shade.    iv) Don't Soak overnight.   v) Light Ironing required after wash.  vi) No need to dry clean.      </div></div></div> </div>,,17:04:2014,
472226,just linen orange pillow covers,http://www.yebhi.com/online-shopping/home-furnishing.html?affint=home-topmenu,395,Home Furnishings,pillows-cushions-bolsters,justlinen,http://im6.ybndc.com/upload/472226/ProductRear635296304190774000.jpg,395,,home and kitchen,http://www.yebhi.com/472226/PD/just-linen-orange-pillow-covers.htm,yebhi.com,Just Linen Orange - Pillow Covers Buy Online,Just Linen Orange - Pillow Covers  Best Price Rs 395.00  EMI Rs 66 for 6 months,None,<div class="product_detail_columns tinyscrl" itemprop="description" style=""><div class="scrollbar" style="width:2px; height:250px; background:#9E9E9E;"><div class="track" style="width:2px;"><div class="thumb" style="width:6px;"><div class="end"> </div></div></div></div><div class="viewport" style=" height:250px; width:252px; font-family:Arial !important;"><div class="overview" style="text-align:justify; display:block;"><div> Your bedset is the highlight of your home d cor. Make your's unique with this striped Pillow Covers .Made of different materials and accented with beautiful designs our cotton bed linen is the cynosure of our product range.  Product Note: All accessories visible in the image are used for pictoral representation only  and are not for sale.   </div></div></div> </div>,,17:04:2014,
449733,just linen aqua regular pillow cover,http://www.yebhi.com/online-shopping/home-furnishing.html?affint=home-topmenu,495,Home Furnishings,pillows-cushions-bolsters,justlinen,http://im6.ybndc.com/upload/449733/ProductRear635260789040610000.jpg,495,,home and kitchen,http://www.yebhi.com/449733/PD/just-linen-aqua-regular-pillow-cover.htm,yebhi.com,Just Linen Aqua Regular - Pillow Cover Buy Online,Just Linen Aqua Regular - Pillow Cover  Best Price Rs 495.00  EMI Rs 83 for 6 months,None,<div class="product_detail_columns tinyscrl" itemprop="description" style=""><div class="scrollbar" style="width:2px; height:250px; background:#9E9E9E;"><div class="track" style="width:2px;"><div class="thumb" style="width:6px;"><div class="end"> </div></div></div></div><div class="viewport" style=" height:250px; width:252px; font-family:Arial !important;"><div class="overview" style="text-align:justify; display:block;"><div>Prodcut Name : Pillow Covers<br/>  Material : 100% Cotton Satin Yarn Dyed<br/>  Size : 19 * 29 inches (48 * 74 cms)<br/>  Total no of Pieces : 2 Piece Set<br/>  Detail of Pieces : 2 (1 Pair of Regular Size Pillow Covers)<br/>  Special Features : Yarn Dyed Stripes<br/>  Key Features : This contemporary styled Urban Stripe Complete Bedding Set by Just Linen is the ideal choice to update or change the look of your bedroom. The complete bed set is incredibly soft and looks great with any combination of furniture and accessories. So create a mood and generate some envy. These cotton linens define the mood and temperament of an individual for a day. So just add a ravishing beauty.  Thread Count: 300/sq.inch  Product Note: All accessories visible in the image are used for pictorial representation only  and are not for sale.<br/>  Wash Care : Hand Wash in cold water and dry in shade   Use Mild detergent  Do not bleach / soak / tumble dry   Wash dark colours seperately    </div></div></div> </div>,,17:04:2014,
449716,just linen damask regular pillow cover,http://www.yebhi.com/online-shopping/home-furnishing.html?affint=home-topmenu,495,Home Furnishings,pillows-cushions-bolsters,justlinen,http://im6.ybndc.com/upload/449716/ProductRear635260789024854000.jpg,495,,home and kitchen,http://www.yebhi.com/449716/PD/just-linen-damask-regular-pillow-cover.htm,yebhi.com,Just Linen Damask Regular - Pillow Cover Buy Online,Just Linen Damask Regular - Pillow Cover  Best Price Rs 495.00  EMI Rs 83 for 6 months,None,<div class="product_detail_columns tinyscrl" itemprop="description" style=""><div class="scrollbar" style="width:2px; height:250px; background:#9E9E9E;"><div class="track" style="width:2px;"><div class="thumb" style="width:6px;"><div class="end"> </div></div></div></div><div class="viewport" style=" height:250px; width:252px; font-family:Arial !important;"><div class="overview" style="text-align:justify; display:block;"><div>Prodcut Name : Pillow Covers<br/>  Material : 100% Cotton Damask <br/>  Size : 19 * 29 inches (48 * 74 cms)<br/>  Total no of Pieces : 2 Piece Set<br/>  Detail of Pieces : 2 (1 Pair of Regular Size Pillow Covers)<br/>  Special Features : Zebra Design/ Self Design<br/>  Key Features : Indulge in a bit of everyday luxury with Just Linen's Bedsheet Set. Extremely soft and easy to care for  this quality bedding is made from 100% Cotton Damask whose longer  finer fibers make for a silky smooth feel that gets softer with every washing. Classic styling includes fine patterns which gives a rich look to your decor.  Thread Count: 300/sq.inch  Product Note: All accessories visible in the image are used for pictorial representation only  and are not for sale.<br/>  Wash Care : Hand Wash in cold water and dry in shade   Use Mild detergent  Do not bleach / soak / tumble dry   Wash dark colours seperately    </div></div></div> </div>,,17:04:2014,
