449743,just linen blue regular pillow cover,http://www.yebhi.com/online-shopping/home-furnishing.html?affint=home-topmenu,495,Home Furnishings,pillows-cushions-bolsters,justlinen,http://im6.ybndc.com/upload/449743/ProductRear635260789050438000.jpg,495,,home and kitchen,http://www.yebhi.com/449743/PD/just-linen-blue-regular-pillow-cover.htm,yebhi.com,Just Linen Blue Regular - Pillow Cover Buy Online,Just Linen Blue Regular - Pillow Cover  Best Price Rs 495.00  EMI Rs 83 for 6 months,None,<div class="product_detail_columns tinyscrl" itemprop="description" style=""><div class="scrollbar" style="width:2px; height:250px; background:#9E9E9E;"><div class="track" style="width:2px;"><div class="thumb" style="width:6px;"><div class="end"> </div></div></div></div><div class="viewport" style=" height:250px; width:252px; font-family:Arial !important;"><div class="overview" style="text-align:justify; display:block;"><div>Prodcut Name : Pillow Covers<br/>  Material : 100% Cotton Satin Yarn Dyed<br/>  Size : 19 * 29 inches (48 * 74 cms)<br/>  Total no of Pieces : 2 Piece Set<br/>  Detail of Pieces : 2 (1 Pair of Regular Size Pillow Covers)<br/>  Special Features : Yarn Dyed Stripes<br/>  Key Features : This contemporary styled Urban Stripe Complete Bedding Set by Just Linen is the ideal choice to update or change the look of your bedroom. The complete bed set is incredibly soft and looks great with any combination of furniture and accessories. So create a mood and generate some envy. These cotton linens define the mood and temperament of an individual for a day. So just add a ravishing beauty.  Thread Count: 300/sq.inch  Product Note: All accessories visible in the image are used for pictorial representation only  and are not for sale.<br/>  Wash Care : Hand Wash in cold water and dry in shade   Use Mild detergent  Do not bleach / soak / tumble dry   Wash dark colours seperately    </div></div></div> </div>,,17:04:2014,
449626,just linen black regular pillow cover,http://www.yebhi.com/online-shopping/home-furnishing.html?affint=home-topmenu,495,Home Furnishings,pillows-cushions-bolsters,justlinen,http://im6.ybndc.com/upload/449626/ProductRear635260788934842000.jpg,495,,home and kitchen,http://www.yebhi.com/449626/PD/just-linen-black-regular-pillow-cover.htm,yebhi.com,Just Linen Black Regular - Pillow Cover Buy Online,Just Linen Black Regular - Pillow Cover  Best Price Rs 495.00  EMI Rs 83 for 6 months,None,<div class="product_detail_columns tinyscrl" itemprop="description" style=""><div class="scrollbar" style="width:2px; height:250px; background:#9E9E9E;"><div class="track" style="width:2px;"><div class="thumb" style="width:6px;"><div class="end"> </div></div></div></div><div class="viewport" style=" height:250px; width:252px; font-family:Arial !important;"><div class="overview" style="text-align:justify; display:block;"><div>Prodcut Name : Pillow Covers<br/>  Material : 100% Cotton Satin Yarn Dyed<br/>  Size : 19 * 29 inches (48 * 74 cms)<br/>  Total no of Pieces : 2 Piece Set<br/>  Detail of Pieces : 2 (1 Pair of Regular Size Pillow Covers)<br/>  Special Features : Yarn Dyed Stripes<br/>  Key Features : This contemporary styled Urban Stripe Complete Bedding Set by Just Linen is the ideal choice to update or change the look of your bedroom. The complete bed set is incredibly soft and looks great with any combination of furniture and accessories. So create a mood and generate some envy. These cotton linens define the mood and temperament of an individual for a day. So just add a ravishing beauty.  Thread Count: 300/sq.inch  Product Note: All accessories visible in the image are used for pictorial representation only  and are not for sale.<br/>  Wash Care : Wash Care:  i)Do not bleach / soak. ii) Wash dark colours seperately. iii) Wash in cold water and dry in shade.    iv) Don't Soak overnight.   v) Light Ironing required after wash.  vi) No need to dry clean.      </div></div></div> </div>,,17:04:2014,
472224,just linen pink pillow covers,http://www.yebhi.com/online-shopping/home-furnishing.html?affint=home-topmenu,395,Home Furnishings,pillows-cushions-bolsters,justlinen,http://im6.ybndc.com/upload/472224/ProductRear635296304189058000.jpg,395,,home and kitchen,http://www.yebhi.com/472224/PD/just-linen-pink-pillow-covers.htm,yebhi.com,Just Linen Pink - Pillow Covers Buy Online,Just Linen Pink - Pillow Covers  Best Price Rs 395.00  EMI Rs 66 for 6 months,None,<div class="product_detail_columns tinyscrl" itemprop="description" style=""><div class="scrollbar" style="width:2px; height:250px; background:#9E9E9E;"><div class="track" style="width:2px;"><div class="thumb" style="width:6px;"><div class="end"> </div></div></div></div><div class="viewport" style=" height:250px; width:252px; font-family:Arial !important;"><div class="overview" style="text-align:justify; display:block;"><div> Your bedset is the highlight of your home d cor. Make your's unique with this striped Pillow Covers .Made of different materials and accented with beautiful designs our cotton bed linen is the cynosure of our product range.  Product Note: All accessories visible in the image are used for pictoral representation only  and are not for sale.   </div></div></div> </div>,,17:04:2014,
449594,just linen damask floral pattern double bedsheet,http://www.yebhi.com/online-shopping/home-furnishing.html?affint=home-topmenu,http://www.yebhi.com/online-shopping/foster/women/watches.html?affint=women-topmenu&oth=lifestyle&lc=Brands,Home Furnishings,pillows-cushions-bolsters,justlinen,http://im6.yh=lifestyle&lc=Category,foster,,home and kitchen,http://www.yebhi.com/449594/PD/just-linen-damask-floral-pattern-double-bedsheet.htm,yebhi.com,Foster Blue Women Analog - Wrist Watches Buy Online,Foster Blue Women Analog - Wrist Watches  Best Price Rs 839.00 Best Discount 30% Off EMI Rs 140 for 6 months FREE Shipping In Stock - Delivery in 9-12 Days,foster blue women analog wrist watches,<div class="product_detail_columns tinyscrl" itemprop="description" style=""><div class="scrollbar" style="width:2px; height:250px; background:#9E9E9E;"><div class="track" style="width:2px;"><div class="thumb" style="width:6px;"><div class="end"> </div></div></div></div><div class="viewport" style=" height:250px; width:252px; font-family:Arial !important;"><div class="overview" style="text-align:justify; display:block;"><div>Brand: Fosters / Fashionable &amp; designer watch / 1 year manufacturer warranty / 3 years battery life guaranteed / Stainless steel back / Movement or Machine: Genuine Japanese Quartz / Analog display  /  Strap material: Leather / Nubuck leather lining to absorb sweat / Dial dimension: 35 mm / Strap dimension: 22 mm / Water resistant / Comes in an extremely smart gift case / Separate warranty card with every watch / Extra strap for watch </div></div></div> </div>,,17:04:2014,
472229,just linen orange pillow covers,http://www.yebhi.com/online-shopping/home-furnishing.html?affint=home-topmenu,395,Home Furnishings,pillows-cushions-bolsters,justlinen,http://im6.ybndc.com/upload/472229/ProductRear635296304193738000.jpg,395,,home and kitchen,http://www.yebhi.com/472229/PD/just-linen-orange-pillow-covers.htm,yebhi.com,Just Linen Orange - Pillow Covers Buy Online,Just Linen Orange - Pillow Covers  Best Price Rs 395.00  EMI Rs 66 for 6 months,None,<div class="product_detail_columns tinyscrl" itemprop="description" style=""><div class="scrollbar" style="width:2px; height:250px; background:#9E9E9E;"><div class="track" style="width:2px;"><div class="thumb" style="width:6px;"><div class="end"> </div></div></div></div><div class="viewport" style=" height:250px; width:252px; font-family:Arial !important;"><div class="overview" style="text-align:justify; display:block;"><div> Your bedset is the highlight of your home d cor. Make your's unique with this striped Pillow Covers .Made of different materials and accented with beautiful designs our cotton bed linen is the cynosure of our product range.  Product Note: All accessories visible in the image are used for pictoral representation only  and are not for sale.   </div></div></div> </div>,,17:04:2014,
472222,just linen yellow pillow covers,http://www.yebhi.com/online-shopping/home-furnishing.html?affint=home-topmenu,395,Home Furnishings,pillows-cushions-bolsters,justlinen,http://im6.ybndc.com/upload/472222/ProductRear635296304187342000.jpg,395,,home and kitchen,http://www.yebhi.com/472222/PD/just-linen-yellow-pillow-covers.htm,yebhi.com,Just Linen Yellow - Pillow Covers Buy Online,Just Linen Yellow - Pillow Covers  Best Price Rs 395.00  EMI Rs 66 for 6 months,None,<div class="product_detail_columns tinyscrl" itemprop="description" style=""><div class="scrollbar" style="width:2px; height:250px; background:#9E9E9E;"><div class="track" style="width:2px;"><div class="thumb" style="width:6px;"><div class="end"> </div></div></div></div><div class="viewport" style=" height:250px; width:252px; font-family:Arial !important;"><div class="overview" style="text-align:justify; display:block;"><div> Your bedset is the highlight of your home d cor. Make your's unique with this striped Pillow Covers .Made of different materials and accented with beautiful designs our cotton bed linen is the cynosure of our product range.  Product Note: All accessories visible in the image are used for pictoral representation only  and are not for sale.   </div></div></div> </div>,,17:04:2014,
472082,just linen orange pillow covers,http://www.yebhi.com/online-shopping/home-furnishing.html?affint=home-topmenu,395,Home Furnishings,pillows-cushions-bolsters,justlinen,http://im6.ybndc.com/upload/472082/ProductRear635296305694302000.jpg,395,,home and kitchen,http://www.yebhi.com/472082/PD/just-linen-orange-pillow-covers.htm,yebhi.com,Just Linen Orange - Pillow Covers Buy Online,Just Linen Orange - Pillow Covers  Best Price Rs 395.00  EMI Rs 66 for 6 months,None,<div class="product_detail_columns tinyscrl" itemprop="description" style=""><div class="scrollbar" style="width:2px; height:250px; background:#9E9E9E;"><div class="track" style="width:2px;"><div class="thumb" style="width:6px;"><div class="end"> </div></div></div></div><div class="viewport" style=" height:250px; width:252px; font-family:Arial !important;"><div class="overview" style="text-align:justify; display:block;"><div>This luxurious Pillow Coversis sure to add a subtle touch of class  and sophistication to your bedroom. This beautiful Self Design Pillow Covers will take the level of comfort and warmth of your room one step ahead  while exuding elegance and charm at the same time.    Product Note: All accessories visible in the image are used for pictoral representation only  and are not for sale. </div></div></div> </div>,,17:04:2014,
472230,just linen yellow pillow covers,http://www.yebhi.com/online-shopping/home-furnishing.html?affint=home-topmenu,395,Home Furnishings,pillows-cushions-bolsters,justlinen,http://im6.ybndc.com/upload/472230/ProductRear635296304194674000.jpg,395,,home and kitchen,http://www.yebhi.com/472230/PD/just-linen-yellow-pillow-covers.htm,yebhi.com,Just Linen Yellow - Pillow Covers Buy Online,Just Linen Yellow - Pillow Covers  Best Price Rs 395.00  EMI Rs 66 for 6 months,None,<div class="product_detail_columns tinyscrl" itemprop="description" style=""><div class="scrollbar" style="width:2px; height:250px; background:#9E9E9E;"><div class="track" style="width:2px;"><div class="thumb" style="width:6px;"><div class="end"> </div></div></div></div><div class="viewport" style=" height:250px; width:252px; font-family:Arial !important;"><div class="overview" style="text-align:justify; display:block;"><div> Your bedset is the highlight of your home d cor. Make your's unique with this striped Pillow Covers .Made of different materials and accented with beautiful designs our cotton bed linen is the cynosure of our product range.  Product Note: All accessories visible in the image are used for pictoral representation only  and are not for sale.   </div></div></div> </div>,,17:04:2014,
