497047,vila red women dresses,http://www.yebhi.com/online-shopping/women/apparels.html?affint=women-topmenu,2200,Clothing,dress,vila,http://im6.ybndc.com/upload/497047/ProductRear635321424745074000.jpg,2200,,Women,http://www.yebhi.com/497047/PD/vila-red-women-dresses.htm,yebhi.com,Vila Red Women - Dresses Buy Online,Vila Red Women - Dresses  Best Price Rs 2200.00  EMI Rs 367 for 6 months FREE Shipping In Stock - Delivery in 3-5 Days,SML,<div class="product_detail_columns tinyscrl" itemprop="description" style=""><div class="scrollbar" style="width:2px; height:250px; background:#9E9E9E;"><div class="track" style="width:2px;"><div class="thumb" style="width:6px;"><div class="end"> </div></div></div></div><div class="viewport" style=" height:250px; width:252px; font-family:Arial !important;"><div class="overview" style="text-align:justify; display:block;"><div>Skater Dress by Vila Made from polyester  viscose and elastane  Round neckline  Sleeveless styling  Pleated skater skirt  Slim fit60% Polyester  35% Viscose and 5% Elastane </div></div></div> </div>,,16:04:2014,
497024,vila blue women dresses,http://www.yebhi.com/online-shopping/women/apparels.html?affint=women-topmenu,1750,Clothing,dress,vila,http://im6.ybndc.com/upload/497024/ProductRear635321424649758000.jpg,1750,,Women,http://www.yebhi.com/497024/PD/vila-blue-women-dresses.htm,yebhi.com,Vila Blue Women - Dresses Buy Online,Vila Blue Women - Dresses  Best Price Rs 1750.00  EMI Rs 292 for 6 months FREE Shipping In Stock - Delivery in 3-5 Days,XSS,<div class="product_detail_columns tinyscrl" itemprop="description" style=""><div class="scrollbar" style="width:2px; height:250px; background:#9E9E9E;"><div class="track" style="width:2px;"><div class="thumb" style="width:6px;"><div class="end"> </div></div></div></div><div class="viewport" style=" height:250px; width:252px; font-family:Arial !important;"><div class="overview" style="text-align:justify; display:block;"><div>This asymmetric dress from Vila is made from polyester. The details include: cowl neckline  sleeveless  ruched detailing at the side  high and low hemline  and semi sheer fabric. The asymmetric dress has a regular fit.100% Polyester </div></div></div> </div>,,16:04:2014,
494235,vila white women dresses,http://www.yebhi.com/online-shopping/women/apparels.html?affint=women-topmenu,2500,Clothing,dress,vila,http://im6.ybndc.com/upload/494235/ProductRear635315464982710000.jpg,2500,,Women,http://www.yebhi.com/494235/PD/vila-white-women-dresses.htm,yebhi.com,Vila White Women - Dresses Buy Online,Vila White Women - Dresses  Best Price Rs 2500.00  EMI Rs 417 for 6 months FREE Shipping In Stock - Delivery in 3-5 Days,XSSML,<div class="product_detail_columns tinyscrl" itemprop="description" style=""><div class="scrollbar" style="width:2px; height:250px; background:#9E9E9E;"><div class="track" style="width:2px;"><div class="thumb" style="width:6px;"><div class="end"> </div></div></div></div><div class="viewport" style=" height:250px; width:252px; font-family:Arial !important;"><div class="overview" style="text-align:justify; display:block;"><div>Tunic Dress by Vila Made from polyester Surplice neckline Sleeveless styling Elasticated waist Monochrome print allover Deep slit back with button closure Mini length Regular fit100% Polyester </div></div></div> </div>,,16:04:2014,
493709,vila black women jumpsuit,http://www.yebhi.com/online-shopping/women/apparels.html?affint=women-topmenu,2500,Clothing,dress,vila,http://im6.ybndc.com/upload/493709/ProductRear635315349553162000.jpg,2500,,Women,http://www.yebhi.com/493709/PD/vila-black-women-jumpsuit.htm,yebhi.com,Vila Black Women - Jumpsuit Buy Online,Vila Black Women - Jumpsuit  Best Price Rs 2500.00  EMI Rs 417 for 6 months FREE Shipping In Stock - Delivery in 3-5 Days,XSSML,<div class="product_detail_columns tinyscrl" itemprop="description" style=""><div class="scrollbar" style="width:2px; height:250px; background:#9E9E9E;"><div class="track" style="width:2px;"><div class="thumb" style="width:6px;"><div class="end"> </div></div></div></div><div class="viewport" style=" height:250px; width:252px; font-family:Arial !important;"><div class="overview" style="text-align:justify; display:block;"><div>Jumpsuit by Vila Made from viscose  Short sleeves  Bateau neckline  Animal print?  Cut-out back  Drawstring waist  Regular fit 100% Viscose </div></div></div> </div>,,16:04:2014,
497025,vila black women dresses,http://www.yebhi.com/online-shopping/women/apparels.html?affint=women-topmenu,1750,Clothing,dress,vila,http://im6.ybndc.com/upload/497025/ProductRear635321424654438000.jpg,1750,,Women,http://www.yebhi.com/497025/PD/vila-black-women-dresses.htm,yebhi.com,Vila Black Women - Dresses Buy Online,Vila Black Women - Dresses  Best Price Rs 1750.00  EMI Rs 292 for 6 months FREE Shipping In Stock - Delivery in 3-5 Days,XSSML,<div class="product_detail_columns tinyscrl" itemprop="description" style=""><div class="scrollbar" style="width:2px; height:250px; background:#9E9E9E;"><div class="track" style="width:2px;"><div class="thumb" style="width:6px;"><div class="end"> </div></div></div></div><div class="viewport" style=" height:250px; width:252px; font-family:Arial !important;"><div class="overview" style="text-align:justify; display:block;"><div>This asymmetric dress from Vila is made from polyester. The details include: cowl neckline  sleeveless  ruched detailing at the side  high and low hemline  and semi sheer fabric. The asymmetric dress has a regular fit.100% Polyester </div></div></div> </div>,,16:04:2014,
497061,vila green women dresses,http://www.yebhi.com/online-shopping/women/apparels.html?affint=women-topmenu,1605,Clothing,dress,vila,http://im6.ybndc.com/upload/497061/ProductRear635321424794214000.jpg,1605,,Women,http://www.yebhi.com/497061/PD/vila-green-women-dresses.htm,yebhi.com,Vila Green Women - Dresses Buy Online,Vila Green Women - Dresses  Best Price Rs 1605.00  EMI Rs 268 for 6 months FREE Shipping In Stock - Delivery in 3-5 Days,XSSML,<div class="product_detail_columns tinyscrl" itemprop="description" style=""><div class="scrollbar" style="width:2px; height:250px; background:#9E9E9E;"><div class="track" style="width:2px;"><div class="thumb" style="width:6px;"><div class="end"> </div></div></div></div><div class="viewport" style=" height:250px; width:252px; font-family:Arial !important;"><div class="overview" style="text-align:justify; display:block;"><div>Tunic dress by Vila  Made from polyester  Round neckline  Floral print bodice  Sleeveless style  Regular fit (Note: Belt is not included)100% Polyester </div></div></div> </div>,,16:04:2014,
497073,vila black women dresses,http://www.yebhi.com/online-shopping/women/apparels.html?affint=women-topmenu,3000,Clothing,dress,vila,http://im6.ybndc.com/upload/497073/ProductRear635321424844134000.jpg,3000,,Women,http://www.yebhi.com/497073/PD/vila-black-women-dresses.htm,yebhi.com,Vila Black Women - Dresses Buy Online,Vila Black Women - Dresses  Best Price Rs 3000.00  EMI Rs 500 for 6 months FREE Shipping In Stock - Delivery in 3-5 Days,XSSML,<div class="product_detail_columns tinyscrl" itemprop="description" style=""><div class="scrollbar" style="width:2px; height:250px; background:#9E9E9E;"><div class="track" style="width:2px;"><div class="thumb" style="width:6px;"><div class="end"> </div></div></div></div><div class="viewport" style=" height:250px; width:252px; font-family:Arial !important;"><div class="overview" style="text-align:justify; display:block;"><div>High-Low Dress by Vila Made from cotton  Round neckline  Short ruched sleeves  High low hem  Deep cut-out back  Dual button fastening at the back  Relaxed fitCotton </div></div></div> </div>,,16:04:2014,
492735,vila black dress,http://www.yebhi.com/online-shopping/women/apparels.html?affint=women-topmenu,3000,Clothing,dress,vila,http://im6.ybndc.com/upload/492735/ProductRear635318762657022000.jpg,3000,,Women,http://www.yebhi.com/492735/PD/vila-black-dress.htm,yebhi.com,Vila Black - Dress Buy Online,Vila Black - Dress  Best Price Rs 3000.00  EMI Rs 500 for 6 months FREE Shipping In Stock - Delivery in 3-5 Days,XSSML,<div class="product_detail_columns tinyscrl" itemprop="description" style=""><div class="scrollbar" style="width:2px; height:250px; background:#9E9E9E;"><div class="track" style="width:2px;"><div class="thumb" style="width:6px;"><div class="end"> </div></div></div></div><div class="viewport" style=" height:250px; width:252px; font-family:Arial !important;"><div class="overview" style="text-align:justify; display:block;"><div>Body Con Dress by Vila Made from polyester  viscose and elastane  Scoop neckline  Short sleeves  Floral overlay lace paneling  Tear drop cut-out at the back  Body con fit </div></div></div> </div>,,16:04:2014,
494282,vila white women dresses,http://www.yebhi.com/online-shopping/women/apparels.html?affint=women-topmenu,1500,Clothing,dress,vila,http://im6.ybndc.com/upload/494282/ProductRear635315465176774000.jpg,1500,,Women,http://www.yebhi.com/494282/PD/vila-white-women-dresses.htm,yebhi.com,Vila White Women - Dresses Buy Online,Vila White Women - Dresses  Best Price Rs 1500.00  EMI Rs 250 for 6 months FREE Shipping In Stock - Delivery in 3-5 Days,SML,<div class="product_detail_columns tinyscrl" itemprop="description" style=""><div class="scrollbar" style="width:2px; height:250px; background:#9E9E9E;"><div class="track" style="width:2px;"><div class="thumb" style="width:6px;"><div class="end"> </div></div></div></div><div class="viewport" style=" height:250px; width:252px; font-family:Arial !important;"><div class="overview" style="text-align:justify; display:block;"><div>This tunic dress from Vila is made from 100% viscose. The details include: V neckline  sleeveless  floral print  drawstrings around the waist  and has a pullover entry. The?tunic dress?has a regular fit.100% Viscose </div></div></div> </div>,,16:04:2014,
497062,vila grey women dresses,http://www.yebhi.com/online-shopping/women/apparels.html?affint=women-topmenu,1605,Clothing,dress,vila,http://im6.ybndc.com/upload/497062/ProductRear635321424798738000.jpg,1605,,Women,http://www.yebhi.com/497062/PD/vila-grey-women-dresses.htm,yebhi.com,Vila Grey Women - Dresses Buy Online,Vila Grey Women - Dresses  Best Price Rs 1605.00  EMI Rs 268 for 6 months FREE Shipping In Stock - Delivery in 3-5 Days,XSSML,<div class="product_detail_columns tinyscrl" itemprop="description" style=""><div class="scrollbar" style="width:2px; height:250px; background:#9E9E9E;"><div class="track" style="width:2px;"><div class="thumb" style="width:6px;"><div class="end"> </div></div></div></div><div class="viewport" style=" height:250px; width:252px; font-family:Arial !important;"><div class="overview" style="text-align:justify; display:block;"><div>Tunic dress by Vila  Made from polyester  Round neckline  Floral print bodice  Sleeveless style  Regular fit (Note: Belt is not included)100% Polyester </div></div></div> </div>,,16:04:2014,
492826,vila black women dresses,http://www.yebhi.com/online-shopping/women/apparels.html?affint=women-topmenu,1750,Clothing,dress,vila,http://im6.ybndc.com/upload/492826/ProductRear635318762768562000.jpg,1750,,Women,http://www.yebhi.com/492826/PD/vila-black-women-dresses.htm,yebhi.com,Vila Black Women - Dresses Buy Online,Vila Black Women - Dresses  Best Price Rs 1750.00  EMI Rs 292 for 6 months FREE Shipping In Stock - Delivery in 3-5 Days,S,<div class="product_detail_columns tinyscrl" itemprop="description" style=""><div class="scrollbar" style="width:2px; height:250px; background:#9E9E9E;"><div class="track" style="width:2px;"><div class="thumb" style="width:6px;"><div class="end"> </div></div></div></div><div class="viewport" style=" height:250px; width:252px; font-family:Arial !important;"><div class="overview" style="text-align:justify; display:block;"><div>Shift Dress?by Vila Made from viscose  Round neckline  Sleeveless styling  Natural spot print  Pleated front  Regular fit </div></div></div> </div>,,16:04:2014,
497046,vila black women dresses,http://www.yebhi.com/online-shopping/women/apparels.html?affint=women-topmenu,2200,Clothing,dress,vila,http://im6.ybndc.com/upload/497046/ProductRear635321424740862000.jpg,2200,,Women,http://www.yebhi.com/497046/PD/vila-black-women-dresses.htm,yebhi.com,Vila Black Women - Dresses Buy Online,Vila Black Women - Dresses  Best Price Rs 2200.00  EMI Rs 367 for 6 months FREE Shipping In Stock - Delivery in 3-5 Days,SMLXL,<div class="product_detail_columns tinyscrl" itemprop="description" style=""><div class="scrollbar" style="width:2px; height:250px; background:#9E9E9E;"><div class="track" style="width:2px;"><div class="thumb" style="width:6px;"><div class="end"> </div></div></div></div><div class="viewport" style=" height:250px; width:252px; font-family:Arial !important;"><div class="overview" style="text-align:justify; display:block;"><div>Skater Dress by Vila Made from polyester  viscose and elastane  Round neckline  Sleeveless styling  Pleated skater skirt  Slim fit60% Polyester  35% Viscose and 5% Elastane </div></div></div> </div>,,16:04:2014,
497074,vila multi color women dresses,http://www.yebhi.com/online-shopping/women/apparels.html?affint=women-topmenu,3000,Clothing,dress,vila,http://im6.ybndc.com/upload/497074/ProductRear635321424848034000.jpg,3000,,Women,http://www.yebhi.com/497074/PD/vila-multi-color-women-dresses.htm,yebhi.com,Vila Multi Color Women - Dresses Buy Online,Vila Multi Color Women - Dresses  Best Price Rs 3000.00  EMI Rs 500 for 6 months FREE Shipping In Stock - Delivery in 3-5 Days,XSSML,<div class="product_detail_columns tinyscrl" itemprop="description" style=""><div class="scrollbar" style="width:2px; height:250px; background:#9E9E9E;"><div class="track" style="width:2px;"><div class="thumb" style="width:6px;"><div class="end"> </div></div></div></div><div class="viewport" style=" height:250px; width:252px; font-family:Arial !important;"><div class="overview" style="text-align:justify; display:block;"><div>High-Low Dress by Vila Made from cotton  Round neckline  Short ruched sleeves  High low hem  Deep cut-out back  Dual button fastening at the back  Relaxed fitCotton </div></div></div> </div>,,16:04:2014,
