279517,eyda beige door curtain,http://www.yebhi.com/online-shopping/home-furnishing.html?affint=home-topmenu,1180,Home Furnishings,curtains,eyda,http://im6.ybndc.com/upload/279517/ProductRear634996441664967437.jpg,1180,,home and kitchen,http://www.yebhi.com/279517/PD/eyda-beige-door-curtain.htm,yebhi.com,Eyda Beige - Door Curtain Buy Online,Eyda Beige - Door Curtain  Best Price Rs 1180.00  EMI Rs 197 for 6 months FREE Shipping In Stock - Delivery in 6-8 Days,None,<div class="product_detail_columns tinyscrl" itemprop="description" style=""><div class="scrollbar" style="width:2px; height:250px; background:#9E9E9E;"><div class="track" style="width:2px;"><div class="thumb" style="width:6px;"><div class="end"> </div></div></div></div><div class="viewport" style=" height:250px; width:252px; font-family:Arial !important;"><div class="overview" style="text-align:justify; display:block;"><div>This excellent <b>door curtains</b> in the colour <b>beige</b> is from Eyda. Made from <b>polyester</b> and along with the classic colour beige and the pleated detailing will give your room a <b>classy look</b>. Flaunt it and earn accolades for your choices.<br/><br/><b>Features</b><br/><ul style="margin-left: 20px;"><li type="disc">Material: Polyester <br/></li><li type="disc">Colour: Beige<br/></li><li type="disc">Pattern: Solid with pleated detailing<br/></li><li type="disc">Content: 1 Door Curtains<br/></li><li type="disc">Curtain Hanging/ Construction: Grommet<br/></li><li type="disc">Size (Length x Width in cms): 210x135</li></ul><br/><b>Care Tips</b><br/>  Wash with like colours.<br/> Do not soak  tumble dry or bleach.<br/>  Mild iron. Line dry </div></div></div> </div>,,17:04:2014,
279542,eyda blue long door curtain,http://www.yebhi.com/online-shopping/home-furnishing.html?affint=home-topmenu,1580,Home Furnishings,curtains,eyda,http://im6.ybndc.com/upload/279542/ProductRear634996447031557838.jpg,1580,,home and kitchen,http://www.yebhi.com/279542/PD/eyda-blue-long-door-curtain.htm,yebhi.com,Eyda Blue - Long Door Curtain Buy Online,Eyda Blue - Long Door Curtain  Best Price Rs 1580.00  EMI Rs 263 for 6 months FREE Shipping In Stock - Delivery in 6-8 Days,None,<div class="product_detail_columns tinyscrl" itemprop="description" style=""><div class="scrollbar" style="width:2px; height:250px; background:#9E9E9E;"><div class="track" style="width:2px;"><div class="thumb" style="width:6px;"><div class="end"> </div></div></div></div><div class="viewport" style=" height:250px; width:252px; font-family:Arial !important;"><div class="overview" style="text-align:justify; display:block;"><div>Reveal your classy choice with this beautiful <b>long door curtain</b> from Eyda. It has <b>contrast spiral detailing</b> and is crafted from <b>polyester.</b> It will give a creative look and adorn your room with its excellent looks.<b>Features</b><ul style="margin-left: 20px;"><li type="disc">Material: Polyester </li><li type="disc">Colour: Blue</li><li type="disc">Pattern: Solid with spiral detailing</li><li type="disc">Curtain Hanging/ Construction: Grommet</li><li type="disc">Content: 1 Long Door Curtain</li><li type="disc">Size (Length x Width in cms): 275x135</li></ul><b>Care Tips</b><br>  Wash with like colours.</br> Do not soak  tumble dry or bleach.Mild iron. Line dry </div></div></div> </div>,,17:04:2014,
279537,eyda blue window curtain,http://www.yebhi.com/online-shopping/home-furnishing.html?affint=home-topmenu,2480,Home Furnishings,curtains,eyda,http://im6.ybndc.com/upload/279537/ProductRear634996445986819141.jpg,2480,,home and kitchen,http://www.yebhi.com/279537/PD/eyda-blue-window-curtain.htm,yebhi.com,Eyda Blue - Window Curtain Buy Online,Eyda Blue - Window Curtain  Best Price Rs 2480.00  EMI Rs 413 for 6 months FREE Shipping In Stock - Delivery in 6-8 Days,None,<div class="product_detail_columns tinyscrl" itemprop="description" style=""><div class="scrollbar" style="width:2px; height:250px; background:#9E9E9E;"><div class="track" style="width:2px;"><div class="thumb" style="width:6px;"><div class="end"> </div></div></div></div><div class="viewport" style=" height:250px; width:252px; font-family:Arial !important;"><div class="overview" style="text-align:justify; display:block;"><div>Let this exceptional <b>window curtain</b> from Eyda infuse elegance to your room. It is crafted from <b>polyester</b> and has <b>spiral detailing on a blue base colour</b>. Flaunt this extraordinary and appealing curtain and be appreciated by your guests for your world class choice.<b>Features</b><ul style="margin-left: 20px;"><li type="disc">Material: Polyester </li><li type="disc">Colour: Black</li><li type="disc">Pattern: Solid with spiral detailing</li><li type="disc">Curtain Hanging/ Construction: Grommet</li><li type="disc">Content: Set of 2 Window Curtain</li><li type="disc">Size (Length x Width in cms): 150x135</li></ul><b>Care Tips</b><br>  Wash with like colours.</br> Do not soak  tumble dry or bleach.Mild iron. Line dry </div></div></div> </div>,,17:04:2014,
279503,eyda purple door curtain,http://www.yebhi.com/online-shopping/home-furnishing.html?affint=home-topmenu,1480,Home Furnishings,curtains,eyda,http://im6.ybndc.com/upload/279503/ProductRear634996455490088059.jpg,1480,,home and kitchen,http://www.yebhi.com/279503/PD/eyda-purple-door-curtain.htm,yebhi.com,Eyda Purple - Door Curtain Buy Online,Eyda Purple - Door Curtain  Best Price Rs 1480.00  EMI Rs 247 for 6 months FREE Shipping In Stock - Delivery in 6-8 Days,None,<div class="product_detail_columns tinyscrl" itemprop="description" style=""><div class="scrollbar" style="width:2px; height:250px; background:#9E9E9E;"><div class="track" style="width:2px;"><div class="thumb" style="width:6px;"><div class="end"> </div></div></div></div><div class="viewport" style=" height:250px; width:252px; font-family:Arial !important;"><div class="overview" style="text-align:justify; display:block;"><div>Give a <b>sophisticated look</b> to your room with the glamorous door curtains from Eyda  which you will take your breath away. The excellent <b>purple</b> colour with the unique <b>stripe detailing</b> coupled with the material <b>polyester</b> will give a charming look to your room.  Let your guests get a glimpse of your extraordinary choice.<b>Features</b><ul style="margin-left: 20px;"><li type="disc">Material: Polyester </li><li type="disc">Colour: Purple</li><li type="disc">Pattern: Solid with striped detailing</li><li type="disc">Curtain Hanging/ Construction: Grommet</li><li type="disc">Content: 1 Door Curtain</li><li type="disc">Size (Length x Width in cms): 210x135</li></ul><b>Care Tips</b><br>  Wash with like colours.</br> Do not soak  tumble dry or bleach.Mild iron. Line dry  </div></div></div> </div>,,17:04:2014,
mesleep,eyda beige long door curtain,http://www.yebhi.com/online-shopping/home-furnishing.html?affint=home-topmenu,http://www.yebhi.com/480167/PD/mesleep-men-2-pcs-set-holi-t-shirt-cushion-cover-combo.htm,Home Furnishings,curtains,eyda,http://www.yebhi.com/online-shopping/mesleep/combos-and-gift-packs.html?affint=home-topmenu&lc=Brands,mesleep men 2 pcs set holi t shirt cushion cover combo,,home and kitchen,http://www.yebhi.com/279495/PD/eyda-bembos-and-gift-packs.html?affint=home-topmenu&lc=Category,yebhi.com,meSleep Men - 2 pcs set Holi T-Shirt Cushion Cover-Combo Buy Online,meSleep Men - 2 pcs set Holi T-Shirt Cushion Cover-Combo  Best Price Rs 446.00 Best Discount 36% Off EMI Rs 74 for 6 months,480167,<div class="product_detail_columns tinyscrl" itemprop="description" style=""><div class="scrollbar" style="width:2px; height:250px; background:#9E9E9E;"><div class="track" style="width:2px;"><div class="thumb" style="width:6px;"><div class="end"> </div></div></div></div><div class="viewport" style=" height:250px; width:252px; font-family:Arial !important;"><div class="overview" style="text-align:justify; display:block;"><div>Holi T-Shirt Sweat proof Neckline : Round   Sleeves : Half. 16 x 16 inch Digitally printed Holi Cushion cover. Perfect Holi Gift for your loved ones..   Product Colour May Slightly Vary Due To Photographic Lighting Sources Or Your Monitor Settings.  </div></div></div> </div>,,17:04:2014,
279502,eyda red door curtain,http://www.yebhi.com/online-shopping/home-furnishing.html?affint=home-topmenu,1480,Home Furnishings,curtains,eyda,http://im6.ybndc.com/upload/279502/ProductRear634996455286038751.jpg,1480,,home and kitchen,http://www.yebhi.com/279502/PD/eyda-red-door-curtain.htm,yebhi.com,Eyda Red - Door Curtain Buy Online,Eyda Red - Door Curtain  Best Price Rs 1480.00  EMI Rs 247 for 6 months FREE Shipping In Stock - Delivery in 6-8 Days,None,<div class="product_detail_columns tinyscrl" itemprop="description" style=""><div class="scrollbar" style="width:2px; height:250px; background:#9E9E9E;"><div class="track" style="width:2px;"><div class="thumb" style="width:6px;"><div class="end"> </div></div></div></div><div class="viewport" style=" height:250px; width:252px; font-family:Arial !important;"><div class="overview" style="text-align:justify; display:block;"><div>Give a <b>ravishing look</b> to your room with the glamorous door curtains from Eyda  which you will take your breath away. The excellent looks with the unique <b>stripe detailing</b> coupled with the material <b>polyester</b> will give a charming look to your room.  Let your guests get a glimpse of your extraordinary choices.<b>Features</b><ul style="margin-left: 20px;"><li type="disc">Material: Polyester </li><li type="disc">Colour: Red</li><li type="disc">Pattern: Solid with striped detailing</li><li type="disc">Curtain Hanging/ Construction: Grommet</li><li type="disc">Content: 1 Door Curtain</li><li type="disc">Size (Length x Width in cms): 210x135</li></ul><b>Care Tips</b><br>  Wash with like colours.</br> Do not soak  tumble dry or bleach.Mild iron. Line dry  </div></div></div> </div>,,17:04:2014,
279513,eyda purple window curtain,http://www.yebhi.com/online-shopping/home-furnishing.html?affint=home-topmenu,1980,Home Furnishings,curtains,eyda,http://im6.ybndc.com/upload/279513/ProductRear634996440869518338.jpg,1980,,home and kitchen,http://www.yebhi.com/279513/PD/eyda-purple-window-curtain.htm,yebhi.com,Eyda Purple - Window Curtain Buy Online,Eyda Purple - Window Curtain  Best Price Rs 1980.00  EMI Rs 330 for 6 months FREE Shipping In Stock - Delivery in 6-8 Days,None,<div class="product_detail_columns tinyscrl" itemprop="description" style=""><div class="scrollbar" style="width:2px; height:250px; background:#9E9E9E;"><div class="track" style="width:2px;"><div class="thumb" style="width:6px;"><div class="end"> </div></div></div></div><div class="viewport" style=" height:250px; width:252px; font-family:Arial !important;"><div class="overview" style="text-align:justify; display:block;"><div>Give a stylish and elegant look to your room with the excellent <b>window curtain</b> from Eyda. In the <b>exclusive and sophisticated purple </b> colour  it is crafted from <b>polyester</b>. With pleated flap detailing  it will enhance the look of your room and win appreciation from one and all.<b>Features</b><ul style="margin-left: 20px;"><li type="disc">Material: Polyester </li><li type="disc">Colour: Purple</li><li type="disc">Pattern: Solid with pleated flap detailing</li><li type="disc">Curtain Hanging/ Construction: Grommet</li><li type="disc">Size (Length x Width in cms): 150x135 </li><li type="disc">Content: Set of 2 Window Curtains</li></ul><b>Care Tips</b><br>  Wash with like colours.</br> Do not soak  tumble dry or bleach.Mild iron. Line dry  </div></div></div> </div>,,17:04:2014,
279561,eyda black door curtain,http://www.yebhi.com/online-shopping/home-furnishing.html?affint=home-topmenu,1480,Home Furnishings,curtains,eyda,http://im6.ybndc.com/upload/279561/ProductRear634996450038165111.jpg,1480,,home and kitchen,http://www.yebhi.com/279561/PD/eyda-black-door-curtain.htm,yebhi.com,Eyda Black - Door Curtain Buy Online,Eyda Black - Door Curtain  Best Price Rs 1480.00  EMI Rs 247 for 6 months FREE Shipping In Stock - Delivery in 6-8 Days,None,<div class="product_detail_columns tinyscrl" itemprop="description" style=""><div class="scrollbar" style="width:2px; height:250px; background:#9E9E9E;"><div class="track" style="width:2px;"><div class="thumb" style="width:6px;"><div class="end"> </div></div></div></div><div class="viewport" style=" height:250px; width:252px; font-family:Arial !important;"><div class="overview" style="text-align:justify; display:block;"><div>This unique <b>door curtain</b> will give your room a modern twist and a state-of- the-art. Crafted from <b>polyester </b> this excellent curtain is from Eyda. The <b>rich black colour</b> with contrast panel detailing and geometric print in a flower-like pattern adds to the admirable look of this curtain  which will enthrall you and your guests.<b>Features</b><ul style="margin-left: 20px;"><li type="disc">Material: Polyester </li><li type="disc">Colour: Black</li><li type="disc">Pattern: Solid with spiral detailing</li><li type="disc">Curtain Hanging/ Construction: Grommet</li><li type="disc">Content: 1 Door Curtain</li><li type="disc">Size (Length x Width in cms): 210x135</li></ul><b>Care Tips</b><br>  Wash with like colours.</br> Do not soak  tumble dry or bleach.Mild iron. Line dry </div></div></div> </div>,,17:04:2014,
279574,eyda green door curtain,http://www.yebhi.com/online-shopping/home-furnishing.html?affint=home-topmenu,1580,Home Furnishings,curtains,eyda,http://im6.ybndc.com/upload/279574/ProductRear634996452647125835.jpg,1580,,home and kitchen,http://www.yebhi.com/279574/PD/eyda-green-door-curtain.htm,yebhi.com,Eyda Green - Door Curtain Buy Online,Eyda Green - Door Curtain  Best Price Rs 1580.00  EMI Rs 263 for 6 months FREE Shipping In Stock - Delivery in 6-8 Days,None,<div class="product_detail_columns tinyscrl" itemprop="description" style=""><div class="scrollbar" style="width:2px; height:250px; background:#9E9E9E;"><div class="track" style="width:2px;"><div class="thumb" style="width:6px;"><div class="end"> </div></div></div></div><div class="viewport" style=" height:250px; width:252px; font-family:Arial !important;"><div class="overview" style="text-align:justify; display:block;"><div>Brighten up your abode with this exclusive and <b>stunning door curtain</b> from Eyda. Crafted from <b>polyester</b> and the <b>subtle green</b> colour with <b>panel and floral detailing </b>will  inject elegance to your room. Be sure to be praised by your friends and family for your unique choice.<b>Features</b><ul style="margin-left: 20px;"><li type="disc">Material: Polyester </li><li type="disc">Colour: Green</li><li type="disc">Pattern: Solid with floral detailing</li><li type="disc">Curtain Hanging/ Construction: Grommet</li><li type="disc">Content: 1 Door Curtain</li><li type="disc">Size (Length x Width in cms): 210x135</li></ul><b>Care Tips</b><br>  Wash with like colours.</br> Do not soak  tumble dry or bleach.Mild iron. Line dry </div></div></div> </div>,,17:04:2014,
279520,eyda purple door curtain,http://www.yebhi.com/online-shopping/home-furnishing.html?affint=home-topmenu,1180,Home Furnishings,curtains,eyda,http://im6.ybndc.com/upload/279520/ProductRear634996442843554992.jpg,1180,,home and kitchen,http://www.yebhi.com/279520/PD/eyda-purple-door-curtain.htm,yebhi.com,Eyda Purple - Door Curtain Buy Online,Eyda Purple - Door Curtain  Best Price Rs 1180.00  EMI Rs 197 for 6 months FREE Shipping In Stock - Delivery in 6-8 Days,None,<div class="product_detail_columns tinyscrl" itemprop="description" style=""><div class="scrollbar" style="width:2px; height:250px; background:#9E9E9E;"><div class="track" style="width:2px;"><div class="thumb" style="width:6px;"><div class="end"> </div></div></div></div><div class="viewport" style=" height:250px; width:252px; font-family:Arial !important;"><div class="overview" style="text-align:justify; display:block;"><div>Give a stylish and elegant look to your room with the excellent <b>door curtain</b> from Eyda. In the <b>exclusive and sophisticated purple </b> colour  it is crafted from <b>polyester</b>. With pleated flap detailing  it will enhance the look of your room and you will win appreciation from one and all.<b>Features</b><ul style="margin-left: 20px;"><li type="disc">Material: Polyester </li><li type="disc">Colour: Purple</li><li type="disc">Pattern: Solid with pleated flap detailing</li><li type="disc">Curtain Hanging/ Construction: Grommet</li><li type="disc">Content: 1 Door Curtain</li><li type="disc">Size (Length x Width in cms): 210x135</li></ul><b>Care Tips</b><br>  Wash with like colours.</br> Do not soak  tumble dry or bleach.Mild iron. Line dry  </div></div></div> </div>,,17:04:2014,
279500,eyda beige door curtain,http://www.yebhi.com/online-shopping/home-furnishing.html?affint=home-topmenu,1480,Home Furnishings,curtains,eyda,http://im6.ybndc.com/upload/279500/ProductRear634996439082838885.jpg,1480,,home and kitchen,http://www.yebhi.com/279500/PD/eyda-beige-door-curtain.htm,yebhi.com,Eyda Beige - Door Curtain Buy Online,Eyda Beige - Door Curtain  Best Price Rs 1480.00  EMI Rs 247 for 6 months FREE Shipping In Stock - Delivery in 6-8 Days,None,<div class="product_detail_columns tinyscrl" itemprop="description" style=""><div class="scrollbar" style="width:2px; height:250px; background:#9E9E9E;"><div class="track" style="width:2px;"><div class="thumb" style="width:6px;"><div class="end"> </div></div></div></div><div class="viewport" style=" height:250px; width:252px; font-family:Arial !important;"><div class="overview" style="text-align:justify; display:block;"><div>Give a <b>touch of sophistication</b> to your home decor with this purple colored curtain that features embroidered pattern on a white patch. The curatin will for sure give a gleaming look to your rom.<br/><b>Features</b><br><ul style="margin-left: 20px;"><li type="disc"> Material: Polyster</li></ul></br><li type="disc"> Colour: Purple <br/></li><li type="disc"> Pattern: Solid with embroidred patchwork.</li><li type="disc">Curtain Hanging/Construction: Grommet</li><li type="disc"> Contents: One door curtain</li><b>Care Instructions</b><br>  Wash with like colours.<br>  Do not soak  tumble dry or bleach. Mild iron. Line dry</br>  </br></div></div></div> </div>,,17:04:2014,
279552,eyda purple window curtain,http://www.yebhi.com/online-shopping/home-furnishing.html?affint=home-topmenu,2480,Home Furnishings,curtains,eyda,http://im6.ybndc.com/upload/279552/ProductRear634996448453974956.jpg,2480,,home and kitchen,http://www.yebhi.com/279552/PD/eyda-purple-window-curtain.htm,yebhi.com,Eyda Purple - Window Curtain Buy Online,Eyda Purple - Window Curtain  Best Price Rs 2480.00  EMI Rs 413 for 6 months FREE Shipping In Stock - Delivery in 6-8 Days,None,<div class="product_detail_columns tinyscrl" itemprop="description" style=""><div class="scrollbar" style="width:2px; height:250px; background:#9E9E9E;"><div class="track" style="width:2px;"><div class="thumb" style="width:6px;"><div class="end"> </div></div></div></div><div class="viewport" style=" height:250px; width:252px; font-family:Arial !important;"><div class="overview" style="text-align:justify; display:block;"><div>Enliven your room with this majestic purple <b> window curtain</b> from Eyda. The royal <b>purple </b>colour with the spiral detailing and the <b>polyester</b> material will infuse glamour to your room. The  mesmerising look will steal your heart and beautify your home.<b>Features</b><ul style="margin-left: 20px;"><li type="disc">Material: Polyester </li><li type="disc">Colour: Purple</li><li type="disc">Pattern: Solid with spiral detailing</li><li type="disc">Curtain Hanging/ Construction: Grommet</li><li type="disc">Content: Set of 2 Window Curtain</li><li type="disc">Size (Length x Width in cms): 150x135</li></ul><b>Care Tips</b><br>  Wash with like colours.</br> Do not soak  tumble dry or bleach.Mild iron. Line dry </div></div></div> </div>,,17:04:2014,
279521,eyda purple long door curtain,http://www.yebhi.com/online-shopping/home-furnishing.html?affint=home-topmenu,1380,Home Furnishings,curtains,eyda,http://im6.ybndc.com/upload/279521/ProductRear634996442989571928.jpg,1380,,home and kitchen,http://www.yebhi.com/279521/PD/eyda-purple-long-door-curtain.htm,yebhi.com,Eyda Purple - Long Door Curtain Buy Online,Eyda Purple - Long Door Curtain  Best Price Rs 1380.00  EMI Rs 230 for 6 months FREE Shipping In Stock - Delivery in 6-8 Days,None,<div class="product_detail_columns tinyscrl" itemprop="description" style=""><div class="scrollbar" style="width:2px; height:250px; background:#9E9E9E;"><div class="track" style="width:2px;"><div class="thumb" style="width:6px;"><div class="end"> </div></div></div></div><div class="viewport" style=" height:250px; width:252px; font-family:Arial !important;"><div class="overview" style="text-align:justify; display:block;"><div>Give an excellent makeover to your room with the long <b>door curtain</b> in <b>purple </b>colour from Eyda. Made from <b>polyester</b>material and in a dashing colour  this curtain with  pleated detailing will give your room a <b>classy look</b>. Flaunt it and earn accolades for your choice.<br/><br/><b>Features</b><br/><ul style="margin-left: 20px;"><li type="disc">Material: Polyester <br/></li><li type="disc">Colour: Purple<br/></li><li type="disc">Pattern: Solid with pleated detailing<br/></li><li type="disc">Content: 1 piece door curtain<br/></li><li type="disc">Curtain Hanging/ Construction: Grommet<br/></li><li type="disc">Size (Length x Width in cms): 210x135</li></ul><br/><b>Care Tips</b><br/>  Wash with like colours.<br/> Do not soak  tumble dry or bleach.<br/>  Mild iron. Line dry </div></div></div> </div>,,17:04:2014,
279514,eyda purple door curtain,http://www.yebhi.com/online-shopping/home-furnishing.html?affint=home-topmenu,1180,Home Furnishings,curtains,eyda,http://im6.ybndc.com/upload/279514/ProductRear634996441065299593.jpg,1180,,home and kitchen,http://www.yebhi.com/279514/PD/eyda-purple-door-curtain.htm,yebhi.com,Eyda Purple - Door Curtain Buy Online,Eyda Purple - Door Curtain  Best Price Rs 1180.00  EMI Rs 197 for 6 months FREE Shipping In Stock - Delivery in 6-8 Days,None,<div class="product_detail_columns tinyscrl" itemprop="description" style=""><div class="scrollbar" style="width:2px; height:250px; background:#9E9E9E;"><div class="track" style="width:2px;"><div class="thumb" style="width:6px;"><div class="end"> </div></div></div></div><div class="viewport" style=" height:250px; width:252px; font-family:Arial !important;"><div class="overview" style="text-align:justify; display:block;"><div>Give a stylish and elegant look to your room with the excellent <b>door curtain</b> from Eyda. In the <b>exclusive and sophisticated purple </b> colour  it is crafted from <b>polyester</b>. With pleated flap detailing  it will enhance the look of your room and win appreciation from one and all.<b>Features</b><ul style="margin-left: 20px;"><li type="disc">Material: Polyester </li><li type="disc">Colour: Purple</li><li type="disc">Pattern: Solid with pleated flap detailing</li><li type="disc">Curtain Hanging/ Construction: Grommet</li><li type="disc">Content: 1 Door Curtains</li><li type="disc">Size (Length x Width in cms): 210x135</li></ul><b>Care Tips</b><br>  Wash with like colours.</br> Do not soak  tumble dry or bleach.Mild iron. Line dry  </div></div></div> </div>,,17:04:2014,
279565,eyda purple long door curtain,http://www.yebhi.com/online-shopping/home-furnishing.html?affint=home-topmenu,1680,Home Furnishings,curtains,eyda,http://im6.ybndc.com/upload/279565/ProductRear634996450644853000.jpg,1680,,home and kitchen,http://www.yebhi.com/279565/PD/eyda-purple-long-door-curtain.htm,yebhi.com,Eyda Purple - Long Door Curtain Buy Online,Eyda Purple - Long Door Curtain  Best Price Rs 1680.00  EMI Rs 280 for 6 months FREE Shipping In Stock - Delivery in 6-8 Days,None,<div class="product_detail_columns tinyscrl" itemprop="description" style=""><div class="scrollbar" style="width:2px; height:250px; background:#9E9E9E;"><div class="track" style="width:2px;"><div class="thumb" style="width:6px;"><div class="end"> </div></div></div></div><div class="viewport" style=" height:250px; width:252px; font-family:Arial !important;"><div class="overview" style="text-align:justify; display:block;"><div>Give your room a <b>delicate and charming look</b> with this <b>door curtain</b> from Eyda. It is crafted from <b>polyester</b> and comes in an excellent <b>purple colour</b>. The contrast panel detailing on top and bottom along with the geometric print in a flower-like pattern adds to the attractiveness of this curtain  which will enchant you senses. Your excellent choice will be admired by your guests and family.<b>Features</b><ul style="margin-left: 20px;"><li type="disc">Material: Polyester </li><li type="disc">Colour: Purple</li><li type="disc">Pattern: Solid with contrast detailing</li><li type="disc">Curtain Hanging/ Construction: Grommet</li><li type="disc">Content: 1 Long Door Curtain</li><li type="disc">Size (Length x Width in cms): 275x135</li></ul><b>Care Tips</b><br>  Wash with like colours.</br> Do not soak  tumble dry or bleach.Mild iron. Line dry </div></div></div> </div>,,17:04:2014,
