279511,eyda green door curtain,http://www.yebhi.com/online-shopping/home-furnishing.html?affint=home-topmenu,1180,Home Furnishings,curtains,eyda,http://im6.ybndc.com/upload/279511/ProductRear634996440521324106.jpg,1180,,home and kitchen,http://www.yebhi.com/279511/PD/eyda-green-door-curtain.htm,yebhi.com,Eyda Green - Door Curtain Buy Online,Eyda Green - Door Curtain  Best Price Rs 1180.00  EMI Rs 197 for 6 months FREE Shipping In Stock - Delivery in 6-8 Days,None,<div class="product_detail_columns tinyscrl" itemprop="description" style=""><div class="scrollbar" style="width:2px; height:250px; background:#9E9E9E;"><div class="track" style="width:2px;"><div class="thumb" style="width:6px;"><div class="end"> </div></div></div></div><div class="viewport" style=" height:250px; width:252px; font-family:Arial !important;"><div class="overview" style="text-align:justify; display:block;"><div>This <b>elegant door curtain</b> will give your room a brilliant look. Crafted from <b>polyester</b>  this curtain is from Eyda. The excellent <b>green </b>colour and <b>contrast flap detailing</b> will earn you compliments from one and all. It will enhance the artistic appeal of your room and showcase your unique choice.<b>Features</b><ul style="margin-left: 20px;"><li type="disc">Material: Polyester </li><li type="disc">Colour: Green</li><li type="disc">Pattern: Solid with pleated flap detailing</li><li type="disc">Curtain Hanging/ Construction: Grommet</li><li type="disc">Content: 1 Door Curtain</li><li type="disc">Size (Length x Width in cms): 210x135</li></ul><b>Care Tips</b><br>  Wash with like colours.</br> Do not soak  tumble dry or bleach.Mild iron. Line dry </div></div></div> </div>,,17:04:2014,
279486,eyda black long door curtain,http://www.yebhi.com/online-shopping/home-furnishing.html?affint=home-topmenu,1580,Home Furnishings,curtains,eyda,http://im6.ybndc.com/upload/279486/ProductRear634996436399621685.jpg,1580,,home and kitchen,http://www.yebhi.com/279486/PD/eyda-black-long-door-curtain.htm,yebhi.com,Eyda Black - Long Door Curtain Buy Online,Eyda Black - Long Door Curtain  Best Price Rs 1580.00  EMI Rs 263 for 6 months FREE Shipping In Stock - Delivery in 6-8 Days,None,<div class="product_detail_columns tinyscrl" itemprop="description" style=""><div class="scrollbar" style="width:2px; height:250px; background:#9E9E9E;"><div class="track" style="width:2px;"><div class="thumb" style="width:6px;"><div class="end"> </div></div></div></div><div class="viewport" style=" height:250px; width:252px; font-family:Arial !important;"><div class="overview" style="text-align:justify; display:block;"><div>Give a <b>touch of sophistication</b> to your home decor with this blue colored curtain that features embroidered white pattern. The curatin will for sure give a gleaming look to your rom.<br/><b>Features</b><br><ul style="margin-left: 20px;"><li type="disc"> Material: Polyster</li></ul></br><li type="disc"> Colour: Blue <br/></li><li type="disc"> Pattern: Textured with embroidred patchwork.</li><li type="disc">Curtain Hanging/Construction: Grommet</li><li type="disc"> Contents: One long door curtain</li><b>Care Instructions</b><br>  Wash with like colours.<br>  Do not soak  tumble dry or bleach. Mild iron. Line dry</br>  </br></div></div></div> </div>,,17:04:2014,
279501,eyda red door curtain,http://www.yebhi.com/online-shopping/home-furnishing.html?affint=home-topmenu,1480,Home Furnishings,curtains,eyda,http://im6.ybndc.com/upload/279501/ProductRear634996455033473132.jpg,1480,,home and kitchen,http://www.yebhi.com/279501/PD/eyda-red-door-curtain.htm,yebhi.com,Eyda Red - Door Curtain Buy Online,Eyda Red - Door Curtain  Best Price Rs 1480.00  EMI Rs 247 for 6 months FREE Shipping In Stock - Delivery in 6-8 Days,None,<div class="product_detail_columns tinyscrl" itemprop="description" style=""><div class="scrollbar" style="width:2px; height:250px; background:#9E9E9E;"><div class="track" style="width:2px;"><div class="thumb" style="width:6px;"><div class="end"> </div></div></div></div><div class="viewport" style=" height:250px; width:252px; font-family:Arial !important;"><div class="overview" style="text-align:justify; display:block;"><div>Give a <b>charming and ravishing appeal</b> to your room with the gorgeous door curtains from Eyda. The shiny look of <b>polyester</b> coupled with the unique <b>floral detailing</b> will give a mesmerising look to your room.  Let your guests get a glimpse of your extraordinary choices.<b>Features</b><ul style="margin-left: 20px;"><li type="disc">Material: Polyester </li><li type="disc">Colour: Red</li><li type="disc">Pattern: Solid with floral detailing</li><li type="disc">Curtain Hanging/ Construction: Grommet</li><li type="disc">Content: 1 Door Curtain</li><li type="disc">Size (Length x Width in cms): 210x135</li></ul><b>Care Tips</b><br>  Wash with like colours.</br> Do not soak  tumble dry or bleach.Mild iron. Line dry  </div></div></div> </div>,,17:04:2014,
279505,eyda green door curtain,http://www.yebhi.com/online-shopping/home-furnishing.html?affint=home-topmenu,1480,Home Furnishings,curtains,eyda,http://im6.ybndc.com/upload/279505/ProductRear634996456712355894.jpg,1480,,home and kitchen,http://www.yebhi.com/279505/PD/eyda-green-door-curtain.htm,yebhi.com,Eyda Green - Door Curtain Buy Online,Eyda Green - Door Curtain  Best Price Rs 1480.00  EMI Rs 247 for 6 months FREE Shipping In Stock - Delivery in 6-8 Days,None,<div class="product_detail_columns tinyscrl" itemprop="description" style=""><div class="scrollbar" style="width:2px; height:250px; background:#9E9E9E;"><div class="track" style="width:2px;"><div class="thumb" style="width:6px;"><div class="end"> </div></div></div></div><div class="viewport" style=" height:250px; width:252px; font-family:Arial !important;"><div class="overview" style="text-align:justify; display:block;"><div>Give an <b>elegant look</b> to your room with the charming door curtains from Eyda. The excellent<b>green</b> colour with the unique <b>stripe detailing</b> is sure to please you. The rich <b>polyester</b> material will give an excellent look to your room.  Be sure to get compliments from your guests for your unique choice.<b>Features</b><ul style="margin-left: 20px;"><li type="disc">Material: Polyester </li><li type="disc">Colour: Green</li><li type="disc">Pattern: Solid with striped detailing</li><li type="disc">Curtain Hanging/ Construction: Grommet</li><li type="disc">Content: 1 Door Curtain</li><li type="disc">Size (Length x Width in cms): 210x135</li></ul><b>Care Tips</b><br>  Wash with like colours.</br> Do not soak  tumble dry or bleach.Mild iron. Line dry  </div></div></div> </div>,,17:04:2014,
279523,eyda red door curtain,http://www.yebhi.com/online-shopping/home-furnishing.html?affint=home-topmenu,1180,Home Furnishings,curtains,eyda,http://im6.ybndc.com/upload/279523/ProductRear634996443283477812.jpg,1180,,home and kitchen,http://www.yebhi.com/279523/PD/eyda-red-door-curtain.htm,yebhi.com,Eyda Red - Door Curtain Buy Online,Eyda Red - Door Curtain  Best Price Rs 1180.00  EMI Rs 197 for 6 months FREE Shipping In Stock - Delivery in 6-8 Days,None,<div class="product_detail_columns tinyscrl" itemprop="description" style=""><div class="scrollbar" style="width:2px; height:250px; background:#9E9E9E;"><div class="track" style="width:2px;"><div class="thumb" style="width:6px;"><div class="end"> </div></div></div></div><div class="viewport" style=" height:250px; width:252px; font-family:Arial !important;"><div class="overview" style="text-align:justify; display:block;"><div>Revamp the look of your room with this <b>stunning door curtain</b> from Eyda. The bright <b>red </b>colour coupled with the flap detailing will lend a <b>ravishing look</b> to your room and accentuate charm. It is crafted from <b>polyester</b> and will enthrall you and your guests.<b>Features</b><ul style="margin-left: 20px;"><li type="disc">Material: Polyester </li><li type="disc">Colour: Red</li><li type="disc">Pattern: Solid with flap detailing</li><li type="disc">Curtain Hanging/ Construction: Grommet</li><li type="disc">Content: 1 Door Curtain</li><li type="disc">Size (Length x Width in cms): 210x135</li></ul><b>Care Tips</b><br>  Wash with like colours.</br> Do not soak  tumble dry or bleach.Mild iron. Line dry </div></div></div> </div>,,17:04:2014,
279512,eyda green long door curtain,http://www.yebhi.com/online-shopping/home-furnishing.html?affint=home-topmenu,1380,Home Furnishings,curtains,eyda,http://im6.ybndc.com/upload/279512/ProductRear634996440697137233.jpg,1380,,home and kitchen,http://www.yebhi.com/279512/PD/eyda-green-long-door-curtain.htm,yebhi.com,Eyda Green - Long Door Curtain Buy Online,Eyda Green - Long Door Curtain  Best Price Rs 1380.00  EMI Rs 230 for 6 months FREE Shipping In Stock - Delivery in 6-8 Days,None,<div class="product_detail_columns tinyscrl" itemprop="description" style=""><div class="scrollbar" style="width:2px; height:250px; background:#9E9E9E;"><div class="track" style="width:2px;"><div class="thumb" style="width:6px;"><div class="end"> </div></div></div></div><div class="viewport" style=" height:250px; width:252px; font-family:Arial !important;"><div class="overview" style="text-align:justify; display:block;"><div>Give an excellent makeover to your room with this excellent <b>long door curtain</b> in <b>green </b>colour from Eyda. Made from <b>polyester</b> material and in a dashing colour  the curtain  with pleated detailing will give your room a <b>classy look</b>. Flaunt it and earn accolades for your choices.<br/><br/><b>Features</b><br/><ul style="margin-left: 20px;"><li type="disc">Material: Polyester <br/></li><li type="disc">Colour: Green<br/></li><li type="disc">Pattern: Solid with pleated detailing<br/></li><li type="disc">Content: 1 piece door curtain<br/></li><li type="disc">Curtain Hanging/ Construction: Grommet<br/></li><li type="disc">Size (Length x Width in cms): 210x135</li></ul><br/><b>Care Tips</b><br/>  Wash with like colours.<br/> Do not soak  tumble dry or bleach.<br/>  Mild iron. Line dry </div></div></div> </div>,,17:04:2014,
279489,eyda blue long door curtain,http://www.yebhi.com/online-shopping/home-furnishing.html?affint=home-topmenu,1580,Home Furnishings,curtains,eyda,http://im6.ybndc.com/upload/279489/ProductRear634996436812556332.jpg,1580,,home and kitchen,http://www.yebhi.com/279489/PD/eyda-blue-long-door-curtain.htm,yebhi.com,Eyda Blue - Long Door Curtain Buy Online,Eyda Blue - Long Door Curtain  Best Price Rs 1580.00  EMI Rs 263 for 6 months FREE Shipping In Stock - Delivery in 6-8 Days,None,<div class="product_detail_columns tinyscrl" itemprop="description" style=""><div class="scrollbar" style="width:2px; height:250px; background:#9E9E9E;"><div class="track" style="width:2px;"><div class="thumb" style="width:6px;"><div class="end"> </div></div></div></div><div class="viewport" style=" height:250px; width:252px; font-family:Arial !important;"><div class="overview" style="text-align:justify; display:block;"><div>Adorn your room with this <b>stylish and elegant long door curtain</b> from Eyda. The exclusive <b>blue </b>colour with <b>floral detailing</b> will add glamour to your room and give it a charming appeal and dreamy atmosphere. Crafted from <b>polyester</b>  it will speak volumes about your classic choice.<b>Features</b><ul style="margin-left: 20px;"><li type="disc">Material: Polyester </li><li type="disc">Colour: Blue</li><li type="disc">Pattern: Solid with floral detailing</li><li type="disc">Curtain Hanging/ Construction: Grommet</li><li type="disc">Content: 1 Long Door Curtain</li><li type="disc">Size (Length x Width in cms): 275x135</li></ul><b>Care Tips</b><br>  Wash with like colours.</br> Do not soak  tumble dry or bleach.Mild iron. Line dry  </div></div></div> </div>,,17:04:2014,
279496,eyda purple window curtain,http://www.yebhi.com/online-shopping/home-furnishing.html?affint=home-topmenu,2480,Home Furnishings,curtains,eyda,http://im6.ybndc.com/upload/279496/ProductRear634996438318745987.jpg,2480,,home and kitchen,http://www.yebhi.com/279496/PD/eyda-purple-window-curtain.htm,yebhi.com,Eyda Purple - Window Curtain Buy Online,Eyda Purple - Window Curtain  Best Price Rs 2480.00  EMI Rs 413 for 6 months FREE Shipping In Stock - Delivery in 6-8 Days,None,<div class="product_detail_columns tinyscrl" itemprop="description" style=""><div class="scrollbar" style="width:2px; height:250px; background:#9E9E9E;"><div class="track" style="width:2px;"><div class="thumb" style="width:6px;"><div class="end"> </div></div></div></div><div class="viewport" style=" height:250px; width:252px; font-family:Arial !important;"><div class="overview" style="text-align:justify; display:block;"><div>This <b>vibrant window curtain</b> will highlight your stylish tastes and extraordinary choices. The <b>red floral detailing</b> on a bright purple base will give a ravishing look to your room. Crafted from <b>polyester</b>  this window curtain from Eyda will adorn your windows and give you a luxurious experience.<b>Features</b><ul style="margin-left: 20px;"><li type="disc">Material: Polyester </li><li type="disc">Colour: Purple  Red</li><li type="disc">Pattern: Solid with floral detailing</li><li type="disc">Curtain Hanging/ Construction: Grommet</li><li type="disc">Content: Set of 2 Window Curtain</li><li type="disc">Size (Length x Width in cms): 150x135</li></ul><b>Care Tips</b><br>  Wash with like colours.</br> Do not soak  tumble dry or bleach.Mild iron. Line dry  </div></div></div> </div>,,17:04:2014,
279487,eyda blue window curtain,http://www.yebhi.com/online-shopping/home-furnishing.html?affint=home-topmenu,2480,Home Furnishings,curtains,eyda,http://im6.ybndc.com/upload/279487/ProductRear634996436524266484.jpg,2480,,home and kitchen,http://www.yebhi.com/279487/PD/eyda-blue-window-curtain.htm,yebhi.com,Eyda Blue - Window Curtain Buy Online,Eyda Blue - Window Curtain  Best Price Rs 2480.00  EMI Rs 413 for 6 months FREE Shipping In Stock - Delivery in 6-8 Days,None,<div class="product_detail_columns tinyscrl" itemprop="description" style=""><div class="scrollbar" style="width:2px; height:250px; background:#9E9E9E;"><div class="track" style="width:2px;"><div class="thumb" style="width:6px;"><div class="end"> </div></div></div></div><div class="viewport" style=" height:250px; width:252px; font-family:Arial !important;"><div class="overview" style="text-align:justify; display:block;"><div>Adorn your windows with this <b>stylish and elegant window curtain</b> from Eyda. The exclusive <b>blue </b>colour with <b>floral detailing</b> will add glamour to your room and give it a charming appeal. Crafted from <b>polyester</b>  it will speak volumes about your classic choice.<b>Features</b><ul style="margin-left: 20px;"><li type="disc">Material: Polyester </li><li type="disc">Colour: Blue</li><li type="disc">Pattern: Solid with floral detailing</li><li type="disc">Curtain Hanging/ Construction: Grommet</li><li type="disc">Content: Set of 2 Window Curtain</li><li type="disc">Size (Length x Width in cms): 150x135</li></ul><b>Care Tips</b><br>  Wash with like colours.</br> Do not soak  tumble dry or bleach.Mild iron. Line dry  </div></div></div> </div>,,17:04:2014,
279515,eyda purple long door curtain,http://www.yebhi.com/online-shopping/home-furnishing.html?affint=home-topmenu,1380,Home Furnishings,curtains,eyda,http://im6.ybndc.com/upload/279515/ProductRear634996441264044867.jpg,1380,,home and kitchen,http://www.yebhi.com/279515/PD/eyda-purple-long-door-curtain.htm,yebhi.com,Eyda Purple - Long Door Curtain Buy Online,Eyda Purple - Long Door Curtain  Best Price Rs 1380.00  EMI Rs 230 for 6 months FREE Shipping In Stock - Delivery in 6-8 Days,None,<div class="product_detail_columns tinyscrl" itemprop="description" style=""><div class="scrollbar" style="width:2px; height:250px; background:#9E9E9E;"><div class="track" style="width:2px;"><div class="thumb" style="width:6px;"><div class="end"> </div></div></div></div><div class="viewport" style=" height:250px; width:252px; font-family:Arial !important;"><div class="overview" style="text-align:justify; display:block;"><div>Give a stylish and elegant look to your room with the excellent <b>long door curtain</b> from Eyda. In the <b>exclusive and sophisticated purple </b> colour  it is crafted from <b>polyester</b>. With pleated flap detailing  it will enhance the look of your room and win appreciation from one and all. With an extra long feature  it will add a dreamy look to your room.<b>Features</b><ul style="margin-left: 20px;"><li type="disc">Material: Polyester </li><li type="disc">Colour: Purple</li><li type="disc">Pattern: Solid with pleated flap detailing</li><li type="disc">Curtain Hanging/ Construction: Grommet</li><li type="disc">Content: 1 Large Door Curtain</li><li type="disc">Size (Length x Width in cms): 275x135</li></ul><b>Care Tips</b><br>  Wash with like colours.</br> Do not soak  tumble dry or bleach.Mild iron. Line dry   </div></div></div> </div>,,17:04:2014,
279484,eyda black window curtain,http://www.yebhi.com/online-shopping/home-furnishing.html?affint=home-topmenu,2480,Home Furnishings,curtains,eyda,http://im6.ybndc.com/upload/279484/ProductRear634996435737709442.jpg,2480,,home and kitchen,http://www.yebhi.com/279484/PD/eyda-black-window-curtain.htm,yebhi.com,Eyda Black - Window Curtain Buy Online,Eyda Black - Window Curtain  Best Price Rs 2480.00  EMI Rs 413 for 6 months FREE Shipping In Stock - Delivery in 6-8 Days,None,<div class="product_detail_columns tinyscrl" itemprop="description" style=""><div class="scrollbar" style="width:2px; height:250px; background:#9E9E9E;"><div class="track" style="width:2px;"><div class="thumb" style="width:6px;"><div class="end"> </div></div></div></div><div class="viewport" style=" height:250px; width:252px; font-family:Arial !important;"><div class="overview" style="text-align:justify; display:block;"><div>Give a <b>touch of sophistication</b> to your home decor with this blue colored curtain that features embroidered white pattern. The curatin will for sure give a gleaming look to your rom.<br/><b>Features</b><br><ul style="margin-left: 20px;"><li type="disc"> Material: Polyster</li></ul></br><li type="disc"> Colour: Blue <br/></li><li type="disc"> Pattern: Textured with embroidred patchwork.</li><li type="disc">Curtain Hanging/Construction: Grommet</li><li type="disc"> Contents: One window curtain</li><b>Care Instructions</b><br>  Wash with like colours.<br>  Do not soak  tumble dry or bleach. Mild iron. Line dry</br>  </br></div></div></div> </div>,,17:04:2014,
279538,eyda blue door curtain,http://www.yebhi.com/online-shopping/home-furnishing.html?affint=home-topmenu,1280,Home Furnishings,curtains,eyda,http://im6.ybndc.com/upload/279538/ProductRear634996446176204355.jpg,1280,,home and kitchen,http://www.yebhi.com/279538/PD/eyda-blue-door-curtain.htm,yebhi.com,Eyda Blue - Door Curtain Buy Online,Eyda Blue - Door Curtain  Best Price Rs 1280.00  EMI Rs 213 for 6 months FREE Shipping In Stock - Delivery in 6-8 Days,None,<div class="product_detail_columns tinyscrl" itemprop="description" style=""><div class="scrollbar" style="width:2px; height:250px; background:#9E9E9E;"><div class="track" style="width:2px;"><div class="thumb" style="width:6px;"><div class="end"> </div></div></div></div><div class="viewport" style=" height:250px; width:252px; font-family:Arial !important;"><div class="overview" style="text-align:justify; display:block;"><div>Let this exceptional <b>door curtain</b> from Eyda infuse elegance to your room. It is crafted from <b>polyester</b> and has <b>spiral detailing on a blue base colour</b>. Flaunt this extraordinary and appealing curtian and be appreciated by your guests for your world class choice.<b>Features</b><ul style="margin-left: 20px;"><li type="disc">Material: Polyester </li><li type="disc">Colour: Blue</li><li type="disc">Pattern: Solid with spiral detailing</li><li type="disc">Curtain Hanging/ Construction: Grommet</li><li type="disc">Content: 1 Door Curtain</li><li type="disc">Size (Length x Width in cms): 210x135</li></ul><b>Care Tips</b><br>  Wash with like colours.</br> Do not soak  tumble dry or bleach.Mild iron. Line dry </div></div></div> </div>,,17:04:2014,
279547,eyda purple door curtain,http://www.yebhi.com/online-shopping/home-furnishing.html?affint=home-topmenu,1280,Home Furnishings,curtains,eyda,http://im6.ybndc.com/upload/279547/ProductRear634996447764138534.jpg,1280,,home and kitchen,http://www.yebhi.com/279547/PD/eyda-purple-door-curtain.htm,yebhi.com,Eyda Purple - Door Curtain Buy Online,Eyda Purple - Door Curtain  Best Price Rs 1280.00  EMI Rs 213 for 6 months FREE Shipping In Stock - Delivery in 6-8 Days,None,<div class="product_detail_columns tinyscrl" itemprop="description" style=""><div class="scrollbar" style="width:2px; height:250px; background:#9E9E9E;"><div class="track" style="width:2px;"><div class="thumb" style="width:6px;"><div class="end"> </div></div></div></div><div class="viewport" style=" height:250px; width:252px; font-family:Arial !important;"><div class="overview" style="text-align:justify; display:block;"><div>Add a soft and delicate touch to your room with this excellent <b> door curtains</b> from Eyda. The soft <b>purple </b>colour will illuminate your room and give it a graceful appeal. Be sure to get compliments for your choice with this curtain crafted from <b>polyester.</b><b>Features</b><ul style="margin-left: 20px;"><li type="disc">Material: Polyester </li><li type="disc">Colour: Purple</li><li type="disc">Pattern: Solid with spiral detailing</li><li type="disc">Curtain Hanging/ Construction: Grommet</li><li type="disc">Content: 1 Door Curtain</li><li type="disc">Size (Length x Width in cms): 210x135</li></ul><b>Care Tips</b><br>  Wash with like colours.</br> Do not soak  tumble dry or bleach.Mild iron. Line dry </div></div></div> </div>,,17:04:2014,
279497,eyda purple door curtain,http://www.yebhi.com/online-shopping/home-furnishing.html?affint=home-topmenu,1380,Home Furnishings,curtains,eyda,http://im6.ybndc.com/upload/279497/ProductRear634996438505635185.jpg,1380,,home and kitchen,http://www.yebhi.com/279497/PD/eyda-purple-door-curtain.htm,yebhi.com,Eyda Purple - Door Curtain Buy Online,Eyda Purple - Door Curtain  Best Price Rs 1380.00  EMI Rs 230 for 6 months FREE Shipping In Stock - Delivery in 6-8 Days,None,<div class="product_detail_columns tinyscrl" itemprop="description" style=""><div class="scrollbar" style="width:2px; height:250px; background:#9E9E9E;"><div class="track" style="width:2px;"><div class="thumb" style="width:6px;"><div class="end"> </div></div></div></div><div class="viewport" style=" height:250px; width:252px; font-family:Arial !important;"><div class="overview" style="text-align:justify; display:block;"><div>This <b>vibrant door curtain</b> will highlight your stylish tastes and extraordinary choices. The <b>red floral detailing</b> on a bright purple base will give a ravishing look to your room. Crafted from <b>polyester</b>  this curtain from Eyda will adorn your doors and give you a luxurious experience.<b>Features</b><ul style="margin-left: 20px;"><li type="disc">Material: Polyester </li><li type="disc">Colour: Purple  Red</li><li type="disc">Pattern: Solid with floral detailing</li><li type="disc">Curtain Hanging/ Construction: Grommet</li><li type="disc">Content: 1 Door Curtain</li><li type="disc">Size (Length x Width in cms): 210x135</li></ul><b>Care Tips</b><br>  Wash with like colours.</br> Do not soak  tumble dry or bleach.Mild iron. Line dry  </div></div></div> </div>,,17:04:2014,
279492,eyda red long door curtain,http://www.yebhi.com/online-shopping/home-furnishing.html?affint=home-topmenu,1580,Home Furnishings,curtains,eyda,http://im6.ybndc.com/upload/279492/ProductRear634996437501612749.jpg,1580,,home and kitchen,http://www.yebhi.com/279492/PD/eyda-red-long-door-curtain.htm,yebhi.com,Eyda Red - Long Door Curtain Buy Online,Eyda Red - Long Door Curtain  Best Price Rs 1580.00  EMI Rs 263 for 6 months FREE Shipping In Stock - Delivery in 6-8 Days,None,<div class="product_detail_columns tinyscrl" itemprop="description" style=""><div class="scrollbar" style="width:2px; height:250px; background:#9E9E9E;"><div class="track" style="width:2px;"><div class="thumb" style="width:6px;"><div class="end"> </div></div></div></div><div class="viewport" style=" height:250px; width:252px; font-family:Arial !important;"><div class="overview" style="text-align:justify; display:block;"><div>Let this <b>excellent long door curtain</b> speak volumes about your classic tastes with its <b>exquisite looks</b>. The <b>red floral prints</b> on a beige base will give a charming look to your room  which you and your guests will love. Crafted from <b>polyester</b>  this window curtain is from Eyda.<b>Features</b><ul style="margin-left: 20px;"><li type="disc">Material: Polyester </li><li type="disc">Colour: Beige  Red</li><li type="disc">Pattern: Solid with floral detailing</li><li type="disc">Curtain Hanging/ Construction: Grommet</li><li type="disc">Content: 1 Long Door Curtain</li><li type="disc">Size (Length x Width in cms): 275x135</li></ul><b>Care Tips</b><br>  Wash with like colours.</br> Do not soak  tumble dry or bleach.Mild iron. Line dry  </div></div></div> </div>,,17:04:2014,
