279570,eyda purple door curtain,http://www.yebhi.com/online-shopping/home-furnishing.html?affint=home-topmenu,1480,Home Furnishings,curtains,eyda,http://im6.ybndc.com/upload/279570/ProductRear634996451928429228.jpg,1480,,home and kitchen,http://www.yebhi.com/279570/PD/eyda-purple-door-curtain.htm,yebhi.com,Eyda Purple - Door Curtain Buy Online,Eyda Purple - Door Curtain  Best Price Rs 1480.00  EMI Rs 247 for 6 months FREE Shipping In Stock - Delivery in 6-8 Days,None,<div class="product_detail_columns tinyscrl" itemprop="description" style=""><div class="scrollbar" style="width:2px; height:250px; background:#9E9E9E;"><div class="track" style="width:2px;"><div class="thumb" style="width:6px;"><div class="end"> </div></div></div></div><div class="viewport" style=" height:250px; width:252px; font-family:Arial !important;"><div class="overview" style="text-align:justify; display:block;"><div>Revamp the look of your room with this <b>stunning door curtain</b> from Eyda  which will add charisma to your room. It is crafted from <b>polyester</b> and comes in the <b>magnetic purple</b> colour. The panel detailing adds to the enticing look of the curtain  which will enchant you senses and give your room an excellent makeover.<b>Features</b><ul style="margin-left: 20px;"><li type="disc">Material: Polyester </li><li type="disc">Colour: Purple</li><li type="disc">Pattern: Solid with panel detailing</li><li type="disc">Curtain Hanging/ Construction: Grommet</li><li type="disc">Content: 1 Door Curtain</li><li type="disc">Size (Length x Width in cms): 210x135</li></ul><b>Care Tips</b><br>  Wash with like colours.</br> Do not soak  tumble dry or bleach.Mild iron. Line dry </div></div></div> </div>,,17:04:2014,
279490,eyda red window curtain,http://www.yebhi.com/online-shopping/home-furnishing.html?affint=home-topmenu,2480,Home Furnishings,curtains,eyda,http://im6.ybndc.com/upload/279490/ProductRear634996436969961341.jpg,2480,,home and kitchen,http://www.yebhi.com/279490/PD/eyda-red-window-curtain.htm,yebhi.com,Eyda Red - Window Curtain Buy Online,Eyda Red - Window Curtain  Best Price Rs 2480.00  EMI Rs 413 for 6 months FREE Shipping In Stock - Delivery in 6-8 Days,None,<div class="product_detail_columns tinyscrl" itemprop="description" style=""><div class="scrollbar" style="width:2px; height:250px; background:#9E9E9E;"><div class="track" style="width:2px;"><div class="thumb" style="width:6px;"><div class="end"> </div></div></div></div><div class="viewport" style=" height:250px; width:252px; font-family:Arial !important;"><div class="overview" style="text-align:justify; display:block;"><div>Let this <b>excellent window curtain</b> speak volumes about your classic tastes with its <b>exquisite looks</b>. The <b>red floral prints</b> on a beige base will give a charming look to your room. Crafted from <b>polyester</b>  this window curtain is from Eyda.<b>Features</b><ul style="margin-left: 20px;"><li type="disc">Material: Polyester </li><li type="disc">Colour: Beige  Red</li><li type="disc">Pattern: Solid with floral detailing</li><li type="disc">Curtain Hanging/ Construction: Grommet</li><li type="disc">Content: Set of 2 Window Curtain</li><li type="disc">Size (Length x Width in cms): 150x135</li></ul><b>Care Tips</b><br>  Wash with like colours.</br> Do not soak  tumble dry or bleach.Mild iron. Line dry  </div></div></div> </div>,,17:04:2014,
279491,eyda red door curtain,http://www.yebhi.com/online-shopping/home-furnishing.html?affint=home-topmenu,1380,Home Furnishings,curtains,eyda,http://im6.ybndc.com/upload/279491/ProductRear634996437115354273.jpg,1380,,home and kitchen,http://www.yebhi.com/279491/PD/eyda-red-door-curtain.htm,yebhi.com,Eyda Red - Door Curtain Buy Online,Eyda Red - Door Curtain  Best Price Rs 1380.00  EMI Rs 230 for 6 months FREE Shipping In Stock - Delivery in 6-8 Days,None,<div class="product_detail_columns tinyscrl" itemprop="description" style=""><div class="scrollbar" style="width:2px; height:250px; background:#9E9E9E;"><div class="track" style="width:2px;"><div class="thumb" style="width:6px;"><div class="end"> </div></div></div></div><div class="viewport" style=" height:250px; width:252px; font-family:Arial !important;"><div class="overview" style="text-align:justify; display:block;"><div>Let this <b>excellent door curtain</b> speak volumes about your classic tastes with its <b>exquisite looks</b>. The <b>red floral prints</b> on a beige base will give a charming look to your room  which you and your guests will love. Crafted from <b>polyester</b>  this window curtain is from Eyda.<b>Features</b><ul style="margin-left: 20px;"><li type="disc">Material: Polyester </li><li type="disc">Colour: Beige  Red</li><li type="disc">Pattern: Solid with floral detailing</li><li type="disc">Curtain Hanging/ Construction: Grommet</li><li type="disc">Content: 1 Door Curtain</li><li type="disc">Size (Length x Width in cms): 210x135</li></ul><b>Care Tips</b><br>  Wash with like colours.</br> Do not soak  tumble dry or bleach.Mild iron. Line dry  </div></div></div> </div>,,17:04:2014,
279516,eyda beige window curtain,http://www.yebhi.com/online-shopping/home-furnishing.html?affint=home-topmenu,1980,Home Furnishings,curtains,eyda,http://im6.ybndc.com/upload/279516/ProductRear634996441462790141.jpg,1980,,home and kitchen,http://www.yebhi.com/279516/PD/eyda-beige-window-curtain.htm,yebhi.com,Eyda Beige - Window Curtain Buy Online,Eyda Beige - Window Curtain  Best Price Rs 1980.00  EMI Rs 330 for 6 months FREE Shipping In Stock - Delivery in 6-8 Days,None,<div class="product_detail_columns tinyscrl" itemprop="description" style=""><div class="scrollbar" style="width:2px; height:250px; background:#9E9E9E;"><div class="track" style="width:2px;"><div class="thumb" style="width:6px;"><div class="end"> </div></div></div></div><div class="viewport" style=" height:250px; width:252px; font-family:Arial !important;"><div class="overview" style="text-align:justify; display:block;"><div>Add a stylish and graceful look to your room with the fabulous <b>window curtain</b> from Eyda. In the <b>exclusive and classic beige </b> colour  it is crafted from <b>polyester</b>. With pleated flap detailing  it will enhance the look of your windows and win appreciation from your guests.<b>Features</b><ul style="margin-left: 20px;"><li type="disc">Material: Polyester </li><li type="disc">Colour: Beige</li><li type="disc">Pattern: Solid with pleated flap detailing</li><li type="disc">Curtain Hanging/ Construction: Grommet</li><li type="disc">Size (Length x Width in cms): 150x135 </li><li type="disc">Content: Set of 2 Window Curtains</li></ul><b>Care Tips</b><br>  Wash with like colours.</br> Do not soak  tumble dry or bleach.Mild iron. Line dry  </div></div></div> </div>,,17:04:2014,
279506,eyda beige door curtain,http://www.yebhi.com/online-shopping/home-furnishing.html?affint=home-topmenu,1480,Home Furnishings,curtains,eyda,http://im6.ybndc.com/upload/279506/ProductRear634996439439145169.jpg,1480,,home and kitchen,http://www.yebhi.com/279506/PD/eyda-beige-door-curtain.htm,yebhi.com,Eyda Beige - Door Curtain Buy Online,Eyda Beige - Door Curtain  Best Price Rs 1480.00  EMI Rs 247 for 6 months FREE Shipping In Stock - Delivery in 6-8 Days,None,<div class="product_detail_columns tinyscrl" itemprop="description" style=""><div class="scrollbar" style="width:2px; height:250px; background:#9E9E9E;"><div class="track" style="width:2px;"><div class="thumb" style="width:6px;"><div class="end"> </div></div></div></div><div class="viewport" style=" height:250px; width:252px; font-family:Arial !important;"><div class="overview" style="text-align:justify; display:block;"><div>Give a <b>classic look</b> to your room with the <b>charming door curtains</b> from Eyda. The sophisticated<b>beige</b> colour with the unique <b>stripe detailing</b> is sure to please you. The rich <b>polyester</b> material will give an excellent look to your room.  Be sure to get compliments from your guests for your unique choice.<b>Features</b><ul style="margin-left: 20px;"><li type="disc">Material: Polyester </li><li type="disc">Colour: Beige</li><li type="disc">Pattern: Solid with striped detailing<li type="disc">Curtain Hanging/ Construction: Grommet</li><li type="disc">Content: 1 Door Curtain</li><li type="disc">Size (Length x Width in cms): 210x135</li></li></ul><b>Care Tips</b><br>  Wash with like colours.</br> Do not soak  tumble dry or bleach.Mild iron. Line dry  </div></div></div> </div>,,17:04:2014,
279534,eyda black window curtain,http://www.yebhi.com/online-shopping/home-furnishing.html?affint=home-topmenu,2480,Home Furnishings,curtains,eyda,http://im6.ybndc.com/upload/279534/ProductRear634996445373891212.jpg,2480,,home and kitchen,http://www.yebhi.com/279534/PD/eyda-black-window-curtain.htm,yebhi.com,Eyda Black - Window Curtain Buy Online,Eyda Black - Window Curtain  Best Price Rs 2480.00  EMI Rs 413 for 6 months FREE Shipping In Stock - Delivery in 6-8 Days,None,<div class="product_detail_columns tinyscrl" itemprop="description" style=""><div class="scrollbar" style="width:2px; height:250px; background:#9E9E9E;"><div class="track" style="width:2px;"><div class="thumb" style="width:6px;"><div class="end"> </div></div></div></div><div class="viewport" style=" height:250px; width:252px; font-family:Arial !important;"><div class="overview" style="text-align:justify; display:block;"><div>Infuse sophistication to your room with this exceptional <b>window curtain</b> from Eyda. It is crafted from <b>polyester</b> and has <b>spiral detailing in silver on a black base colour</b>  which gives it an exclusive and urbane look. Flaunt it and be appreciated by your guests for your world class choice.<b>Features</b><ul style="margin-left: 20px;"><li type="disc">Material: Polyester </li><li type="disc">Colour: Black</li><li type="disc">Pattern: Solid with spiral detailing</li><li type="disc">Curtain Hanging/ Construction: Grommet</li><li type="disc">Content: Set of 2 Window Curtain</li><li type="disc">Size (Length x Width in cms): 150x135</li></ul><b>Care Tips</b><br>  Wash with like colours.</br> Do not soak  tumble dry or bleach.Mild iron. Line dry </div></div></div> </div>,,17:04:2014,
279539,eyda blue long door curtain,http://www.yebhi.com/online-shopping/home-furnishing.html?affint=home-topmenu,1580,Home Furnishings,curtains,eyda,http://im6.ybndc.com/upload/279539/ProductRear634996446335325375.jpg,1580,,home and kitchen,http://www.yebhi.com/279539/PD/eyda-blue-long-door-curtain.htm,yebhi.com,Eyda Blue - Long Door Curtain Buy Online,Eyda Blue - Long Door Curtain  Best Price Rs 1580.00  EMI Rs 263 for 6 months FREE Shipping In Stock - Delivery in 6-8 Days,None,<div class="product_detail_columns tinyscrl" itemprop="description" style=""><div class="scrollbar" style="width:2px; height:250px; background:#9E9E9E;"><div class="track" style="width:2px;"><div class="thumb" style="width:6px;"><div class="end"> </div></div></div></div><div class="viewport" style=" height:250px; width:252px; font-family:Arial !important;"><div class="overview" style="text-align:justify; display:block;"><div>Let this exceptional <b>door curtain</b> from Eyda infuse elegance to your room. It is crafted from <b>polyester</b> and has <b>spiral detailing on a blue base colour</b>. Flaunt this extraordinary and appealing curtain and be appreciated by your guests for your extremely world class choice.<b>Features</b><ul style="margin-left: 20px;"><li type="disc">Material: Polyester </li><li type="disc">Colour: Blue</li><li type="disc">Pattern: Solid with spiral detailing</li><li type="disc">Curtain Hanging/ Construction: Grommet</li><li type="disc">Content: 1 Long Door Curtain</li><li type="disc">Size (Length x Width in cms): 275x135</li></ul><b>Care Tips</b><br>  Wash with like colours.</br> Do not soak  tumble dry or bleach.Mild iron. Line dry </div></div></div> </div>,,17:04:2014,
279543,eyda green window curtain,http://www.yebhi.com/online-shopping/home-furnishing.html?affint=home-topmenu,2480,Home Furnishings,curtains,eyda,http://im6.ybndc.com/upload/279543/ProductRear634996447183502812.jpg,2480,,home and kitchen,http://www.yebhi.com/279543/PD/eyda-green-window-curtain.htm,yebhi.com,Eyda Green - Window Curtain Buy Online,Eyda Green - Window Curtain  Best Price Rs 2480.00  EMI Rs 413 for 6 months FREE Shipping In Stock - Delivery in 6-8 Days,None,<div class="product_detail_columns tinyscrl" itemprop="description" style=""><div class="scrollbar" style="width:2px; height:250px; background:#9E9E9E;"><div class="track" style="width:2px;"><div class="thumb" style="width:6px;"><div class="end"> </div></div></div></div><div class="viewport" style=" height:250px; width:252px; font-family:Arial !important;"><div class="overview" style="text-align:justify; display:block;"><div>Breathe style into your collection of curtains with this excellent and exceptional <b>window curtain</b> from Eyda. The green colour with <b>contrast spiral detailing</b> and the <b>polyester.</b>material makes it unique. You will fall in love with its creative look and your guests will shower appreciation for your excellent choice.<b>Features</b><ul style="margin-left: 20px;"><li type="disc">Material: Polyester </li><li type="disc">Colour: Green</li><li type="disc">Pattern: Solid with spiral detailing</li><li type="disc">Curtain Hanging/ Construction: Grommet</li><li type="disc">Content: Set of 2 Window Curtain</li><li type="disc">Size (Length x Width in cms): 150x135</li></ul><b>Care Tips</b><br>  Wash with like colours.</br> Do not soak  tumble dry or bleach.Mild iron. Line dry </div></div></div> </div>,,17:04:2014,
279567,eyda gold door curtain,http://www.yebhi.com/online-shopping/home-furnishing.html?affint=home-topmenu,1480,Home Furnishings,curtains,eyda,http://im6.ybndc.com/upload/279567/ProductRear634996450988679204.jpg,1480,,home and kitchen,http://www.yebhi.com/279567/PD/eyda-gold-door-curtain.htm,yebhi.com,Eyda Gold - Door Curtain Buy Online,Eyda Gold - Door Curtain  Best Price Rs 1480.00  EMI Rs 247 for 6 months FREE Shipping In Stock - Delivery in 6-8 Days,None,<div class="product_detail_columns tinyscrl" itemprop="description" style=""><div class="scrollbar" style="width:2px; height:250px; background:#9E9E9E;"><div class="track" style="width:2px;"><div class="thumb" style="width:6px;"><div class="end"> </div></div></div></div><div class="viewport" style=" height:250px; width:252px; font-family:Arial !important;"><div class="overview" style="text-align:justify; display:block;"><div>This curtain lends a <b>refined look</b> to your room. <b>Textured light brown base with brown patchwork in the center</b> on this curtain will make your room <b>look classy.</b> When teamed up with contrasting colored interiors  it will add wonders to the room.<br/><b>Features</b><br><ul style="margin-left: 20px;"><li type="disc"> Material: Polyster </li></ul></br><li type="disc"> Colour: Brown <br/></li><li type="disc"> Pattern: Textured with patchwork in the center</li><li type="disc">Curtain Hanging/Construction: Grommet</li><li type="disc"> Contents: One door curtain</li><b>Care Instructions</b><br>  Wash with like colours.<br>  Do not soak  tumble dry or bleach. Mild iron. Line dry</br>  </br></div></div></div> </div>,,17:04:2014,
279553,eyda purple door curtain,http://www.yebhi.com/online-shopping/home-furnishing.html?affint=home-topmenu,1280,Home Furnishings,curtains,eyda,http://im6.ybndc.com/upload/279553/ProductRear634996448600459895.jpg,1280,,home and kitchen,http://www.yebhi.com/279553/PD/eyda-purple-door-curtain.htm,yebhi.com,Eyda Purple - Door Curtain Buy Online,Eyda Purple - Door Curtain  Best Price Rs 1280.00  EMI Rs 213 for 6 months FREE Shipping In Stock - Delivery in 6-8 Days,None,<div class="product_detail_columns tinyscrl" itemprop="description" style=""><div class="scrollbar" style="width:2px; height:250px; background:#9E9E9E;"><div class="track" style="width:2px;"><div class="thumb" style="width:6px;"><div class="end"> </div></div></div></div><div class="viewport" style=" height:250px; width:252px; font-family:Arial !important;"><div class="overview" style="text-align:justify; display:block;"><div><table><tr><td><b>Colour</b></td><td>    </td><td>Purple</td></tr><tr><td><b>Material</b></td><td>    </td><td>Polyester</td></tr><tr><td><b>Brands</b></td><td>    </td><td>Eyda</td></tr><tr><td><b>Departments</b></td><td>    </td><td>Home Furnishing</td></tr><tr><td><b>Category</b></td><td>    </td><td>Curtains</td></tr><tr><td><b>Types</b></td><td>    </td><td>Door Curtain</td></tr></table>  </div></div></div> </div>,,17:04:2014,
279562,eyda black long door curtain,http://www.yebhi.com/online-shopping/home-furnishing.html?affint=home-topmenu,1680,Home Furnishings,curtains,eyda,http://im6.ybndc.com/upload/279562/ProductRear634996450200562152.jpg,1680,,home and kitchen,http://www.yebhi.com/279562/PD/eyda-black-long-door-curtain.htm,yebhi.com,Eyda Black - Long Door Curtain Buy Online,Eyda Black - Long Door Curtain  Best Price Rs 1680.00  EMI Rs 280 for 6 months FREE Shipping In Stock - Delivery in 6-8 Days,None,<div class="product_detail_columns tinyscrl" itemprop="description" style=""><div class="scrollbar" style="width:2px; height:250px; background:#9E9E9E;"><div class="track" style="width:2px;"><div class="thumb" style="width:6px;"><div class="end"> </div></div></div></div><div class="viewport" style=" height:250px; width:252px; font-family:Arial !important;"><div class="overview" style="text-align:justify; display:block;"><div>This unique <b>long door curtain</b> will give your room a modern twist and a state-of- the-art look. Crafted from <b>polyester </b> this excellent curtain is from Eyda. The <b>rich black colour</b> with contrast panel detailing on the top and bottom along with the geometric print in a flower-like pattern adds to the admirable look of this curtain  which will enthrall you and your guests.<b>Features</b><ul style="margin-left: 20px;"><li type="disc">Material: Polyester </li><li type="disc">Colour: Black</li><li type="disc">Pattern: Solid with spiral detailing</li><li type="disc">Curtain Hanging/ Construction: Grommet</li><li type="disc">Content: 1 Long Door Curtain</li><li type="disc">Size (Length x Width in cms): 275x135</li></ul><b>Care Tips</b><br>  Wash with like colours.</br> Do not soak  tumble dry or bleach.Mild iron. Line dry </div></div></div> </div>,,17:04:2014,
279560,eyda black window curtain,http://www.yebhi.com/online-shopping/home-furnishing.html?affint=home-topmenu,2580,Home Furnishings,curtains,eyda,http://im6.ybndc.com/upload/279560/ProductRear634996449892304176.jpg,2580,,home and kitchen,http://www.yebhi.com/279560/PD/eyda-black-window-curtain.htm,yebhi.com,Eyda Black - Window Curtain Buy Online,Eyda Black - Window Curtain  Best Price Rs 2580.00  EMI Rs 430 for 6 months FREE Shipping In Stock - Delivery in 6-8 Days,None,<div class="product_detail_columns tinyscrl" itemprop="description" style=""><div class="scrollbar" style="width:2px; height:250px; background:#9E9E9E;"><div class="track" style="width:2px;"><div class="thumb" style="width:6px;"><div class="end"> </div></div></div></div><div class="viewport" style=" height:250px; width:252px; font-family:Arial !important;"><div class="overview" style="text-align:justify; display:block;"><div>This unique set of window curtain will give your room a modern twist and a state-of- the-art. Crafted from <b>polyester </b> this excellent pair is from Eyda. The rich black colour with contrast panel detailing adds to the admirable look of this curtain  which will enthrall you and your guests.<b>Features</b><ul style="margin-left: 20px;"><li type="disc">Material: Polyester </li><li type="disc">Colour: Black</li><li type="disc">Pattern: Solid with contrast panel detailing</li><li type="disc">Curtain Hanging/ Construction: Grommet</li><li type="disc">Content: Set of 2 Window Curtain</li><li type="disc">Size (Length x Width in cms): 150x135</li></ul><b>Care Tips</b><br>  Wash with like colours.</br> Do not soak  tumble dry or bleach.Mild iron. Line dry </div></div></div> </div>,,17:04:2014,
279541,eyda blue door curtain,http://www.yebhi.com/online-shopping/home-furnishing.html?affint=home-topmenu,1280,Home Furnishings,curtains,eyda,http://im6.ybndc.com/upload/279541/ProductRear634996446837180592.jpg,1280,,home and kitchen,http://www.yebhi.com/279541/PD/eyda-blue-door-curtain.htm,yebhi.com,Eyda Blue - Door Curtain Buy Online,Eyda Blue - Door Curtain  Best Price Rs 1280.00  EMI Rs 213 for 6 months FREE Shipping In Stock - Delivery in 6-8 Days,None,<div class="product_detail_columns tinyscrl" itemprop="description" style=""><div class="scrollbar" style="width:2px; height:250px; background:#9E9E9E;"><div class="track" style="width:2px;"><div class="thumb" style="width:6px;"><div class="end"> </div></div></div></div><div class="viewport" style=" height:250px; width:252px; font-family:Arial !important;"><div class="overview" style="text-align:justify; display:block;"><div>Reveal your classy choice with this beautiful <b>door curtain</b> from Eyda. It has <b>contrast spiral detailing</b> and is crafted from <b>polyester.</b> It will give a creative look and adorn your room with its excellent looks.<b>Features</b><ul style="margin-left: 20px;"><li type="disc">Material: Polyester </li><li type="disc">Colour: Blue</li><li type="disc">Pattern: Solid with spiral detailing</li><li type="disc">Curtain Hanging/ Construction: Grommet</li><li type="disc">Content: 1 Door Curtain</li><li type="disc">Size (Length x Width in cms): 210x135</li></ul><b>Care Tips</b><br>  Wash with like colours.</br> Do not soak  tumble dry or bleach.Mild iron. Line dry </div></div></div> </div>,,17:04:2014,
279507,eyda blue window curtain,http://www.yebhi.com/online-shopping/home-furnishing.html?affint=home-topmenu,1980,Home Furnishings,curtains,eyda,http://im6.ybndc.com/upload/279507/ProductRear634996439653334542.jpg,1980,,home and kitchen,http://www.yebhi.com/279507/PD/eyda-blue-window-curtain.htm,yebhi.com,Eyda Blue - Window Curtain Buy Online,Eyda Blue - Window Curtain  Best Price Rs 1980.00  EMI Rs 330 for 6 months FREE Shipping In Stock - Delivery in 6-8 Days,None,<div class="product_detail_columns tinyscrl" itemprop="description" style=""><div class="scrollbar" style="width:2px; height:250px; background:#9E9E9E;"><div class="track" style="width:2px;"><div class="thumb" style="width:6px;"><div class="end"> </div></div></div></div><div class="viewport" style=" height:250px; width:252px; font-family:Arial !important;"><div class="overview" style="text-align:justify; display:block;"><div>This <b>exclusive window curtain</b> will enhance the look of your room and show off your stylish side. The <b>contrast flap  detailing</b> on a excellent blue base will give an extraordinary look to your room. Crafted from <b>polyester</b>  this window curtain from Eyda will adorn your windows and give you a luxurious experience.<b>Features</b><ul style="margin-left: 20px;"><li type="disc">Material: Polyester </li><li type="disc">Colour: Blue</li><li type="disc">Pattern: Solid with pleated flap detailing</li><li type="disc">Curtain Hanging/ Construction: Grommet</li><li type="disc">Content: Set of 2 Window Curtain</li><li type="disc">Size (Length x Width in cms): 150x135</li></ul><b>Care Tips</b><br>  Wash with like colours.</br> Do not soak  tumble dry or bleach.Mild iron. Line dry  </div></div></div> </div>,,17:04:2014,
279566,eyda gold window curtain,http://www.yebhi.com/online-shopping/home-furnishing.html?affint=home-topmenu,2580,Home Furnishings,curtains,eyda,http://im6.ybndc.com/upload/279566/ProductRear634996450837982238.jpg,2580,,home and kitchen,http://www.yebhi.com/279566/PD/eyda-gold-window-curtain.htm,yebhi.com,Eyda Gold - Window Curtain Buy Online,Eyda Gold - Window Curtain  Best Price Rs 2580.00  EMI Rs 430 for 6 months FREE Shipping In Stock - Delivery in 6-8 Days,None,<div class="product_detail_columns tinyscrl" itemprop="description" style=""><div class="scrollbar" style="width:2px; height:250px; background:#9E9E9E;"><div class="track" style="width:2px;"><div class="thumb" style="width:6px;"><div class="end"> </div></div></div></div><div class="viewport" style=" height:250px; width:252px; font-family:Arial !important;"><div class="overview" style="text-align:justify; display:block;"><div>This curtain lends a <b>refined look</b> to your room. <b>Textured light brown base with dark brown border on the top</b> will make your room <b>look classy.</b> When teamed up with contrasting colored interiors  it will add wonders to the room.<br/><b>Features</b><br><ul style="margin-left: 20px;"><li type="disc"> Material: Polyster </li></ul></br><li type="disc"> Colour: Brown <br/></li><li type="disc"> Pattern: Textured</li><li type="disc">Curtain Hanging/Construction: Grommet</li><li type="disc"> Contents: One window curtain</li><b>Care Instructions</b><br>  Wash with like colours.<br> Do not soak  tumble dry or bleach. Mild iron. Line dry</br>  </br></div></div></div> </div>,,17:04:2014,
